subreddit,self ID,parent ID,time,text
UCSantaBarbara,fpmuxwx,t1_fpmovjz,1588742421.0,They probably got it from a bank. Marxist extraction of labor theory is not compatible with modern economics because it lacks an understanding of the other factors of production.
UCSantaBarbara,fpmur9v,t1_fpmqrs9,1588742274.0,"Bud, if you actually knew about supply and demand, you would realize that IV prices are artificially high due to a lack of supply. NIMBY landlords would rather pack kids 3 to a room for 700 bucks then allow for higher density building."
JoeBiden,fpmqsur,t3_geclm3,1588739310.0,"We can't forget that as recent as 1981, lynchings were still occurring in the United States. The racists haven't stopped trying to keep an entire people disenfranchised, they've simply started doing it quieter."
Catholicism,fpmpjoh,t3_gecrex,1588738416.0,"The good that the church as an institution does. From preseving art, architecture, running a multitude of charities, serving as a neutral mediator between states etc."
UCSantaBarbara,fpmnh5v,t1_fpmfl0m,1588737016.0,"I was talking with a buddy about this. I expect sections/labs and the like to be in person, with proper protective measures in place, with lectures still online. What a time to be alive"
UCSantaBarbara,fplh5td,t1_fplfnkf,1588712624.0,"Yeah, plus the students in k-12 live usually within a few miles of their school, they are not having people come from across the state. Local areas will be able to control the reopening without that added variable"
UCSantaBarbara,fpl8o42,t1_fpl509e,1588708322.0,I just wish they made a call on session B for summer. I don’t wanna have to sublease for 6 weeks with like no time to plan
UCSantaBarbara,fpk72o3,t3_gdv00r,1588689248.0,Yo shoot me a pm
neoliberal,fpeo55n,t3_gcydad,1588551355.0,"I’ve been reading Ben Rhodes’s book *The world as it is* and I’ve had two main takeaways. The first is that, retrospectively, the sheer amount of fake news, conspiracy theories, and cynically evil shit that was getting thrown at the Obama administration was hard to properly digest. While it had a lot personal, and public effect on the members of the administration, few would’ve actually believed the tangible effect it was having on the electoral psyche of America. 

And as the media struggled, and ultimately failed, to handle this new subset of misinformation, the institutionalized powers in government that could’ve worked to correct the record didnt. They were either hamstrung by congressional gridlock, or actively abetting the spread of the conspiracy theories for political gain. 

I often talk to my dad about politics, and while he has drifted further left, after he wrote in a name in 2016 after admittedly falling for the fake news casting Hillary in a bad light, he still retains many MAGA loving friends. One thing he told me to always keep in mind is that they see us as crazy as we see them. The difference is we’re not actually insane. 

We as neoliberals need to be cognizant that in a manner of sorts, our fellow countrymen are victims of the misinformation campaign perpetrated to undermine our institutions. Now this doesn’t absolve them of their incorrect beliefs, and I lament the idiocy that they have allowed to fester in our institutions, but the malicious actors that created all the fake news are who we need to focus our attention against.

I gotta close this by thinking melancholically on what could’ve been. I feel somewhat responsible by proxy of failing to ensure the progress all these great public servants had worked so tirelessly for endured. But I know that they would say not to work for their sake, but for everyone’s. I can’t wait to kick that orange bastards ass in November. 

PS, if you want a reminder of what a president with empathy looks like, watch Obama sing amazing grace after the Charleston church shooting."
UCSantaBarbara,fpbnkul,t1_fpbgmjf,1588474176.0,Lmao
UCSantaBarbara,fpbbs1t,t1_fpb6f4l,1588466438.0,How these people got in when they have such little grasp of scientific reality is astounding.
neoliberal,fpaoxjr,t1_fpaei7n,1588452671.0,"Do you think a pro-life, or pro-2A dem could possibly do it, at least at the state level? Or is Texas just gonna stay red for the foreseeable future?"
neoliberal,fpaoqoz,t1_fpan5db,1588452557.0,"Exactly! The dude wasn't trying to make some hail mary policy proposal to save his campaign, it was a genuine, if possibly over-enthusiastic, call to action after having his community that he loves so dearly get attacked for the very values it holds. If someone shot up my school, hometown, or place of worship, I'd probably go extremely hard on guns. It's not a mask of thing, it's just a reaction to something deeply personal."
neoliberal,fp8kkpn,t1_fp8enrt,1588394771.0,"Honestly, I don't think that is the case. Lindsey Graham is many things, but one thing he isn't is someone who secretly despises Joe Biden watch [this video](https://www.youtube.com/watch?v=kLMYW8jFPHg)"
neoliberal,fp0wgp3,t1_fp0roa2,1588218477.0,This is the most r/neoliberal response ever lmao
Catholicism,fozilks,t1_fozhkjq,1588191272.0,"When it's between someone who will fight the institutionalized injustices, and use evidence-based policy to help the disenfranchised, all while ensuring clean energy gets implemented, versus a terrible president who has only one thing going for him then my decision is easy."
Catholicism,foz1jnx,t1_foydpjy,1588183087.0,Read my other comment
neoliberal,foyxonw,t1_foyhcdq,1588181108.0,"Don’t worry, us Political Science majors can be just as smug, without the income!"
neoliberal,foyxji7,t1_foy6fbx,1588181034.0,Who’d a thought Chris christie was actually the second biggest fast food lover running in 2016
UCSantaBarbara,foxcgi4,t1_fowsks4,1588139866.0,"Yeah I highly recommend staying in university apartments for the first year as a transfer. It’s furnished, a 9 month lease, and a good way to meet others, plus they tend to put a lot of transfers together so it’s a solid way to meet people."
Catholicism,fowaed5,t1_fow8yna,1588115993.0,"Totally understandable, I definitely wasn’t able to put in as much work in my response as I wanted, but I’m glad you appreciated it none the less. Cheers."
UCSantaBarbara,fow7kop,t1_fow6psc,1588114481.0,"Whatever the CDC and experts like Dr. Faucci recommend. IDK what else there is to do. If we hadn't followed their recommendations in the first place, 2 million people would've died. We'll be ""lucky"" if only 200, die."
Catholicism,fow75f9,t1_foven4m,1588114258.0,"Thanks for your patience. First, I want to preface my response by saying that what I am arguing for is not that every catholic must vote for Trump. I know multiple people who are catholic and do not feel they could ever vote for someone who is pro-choice, which I understand. They are effectively single-issue voters, and will always vote for a pro-life politician, regardless of any other policy. They have every right to do so, and I would never dispute that. What I am merely arguing is that no catholic should feel compelled to vote for Trump, and that the church has allowed for a wide range of political positions one can hold in good conscious. This conclusion, which I reached after debating, wrestling, and investigating over a significant period of time, is why I feel not only allowed but justified in voting for Joe Biden. 

A Catholic cannot vote for a candidate who favors a policy promoting an intrinsically evil act, such as abortion, euthanasia, assisted suicide, deliberately subjecting workers or the poor to subhuman living conditions, redefining marriage in ways that violate its essential meaning, or racist behavior, if the voter's intent is to support that position. In such cases, a Catholic would be guilty of formal cooperation in grave evil. At the same time, a voter should not use a candidate's opposition to an intrinsic evil to justify indifference or inattentiveness to other important moral issues involving human life and dignity.
USCCB 34 Making Moral Choices

Let me be perfectly clear, I am pro-life and reject euthanasia. I understand that these two issues take precedent over all others in regards to the how a catholic should vote. Yet while they may carry more weight, that does not mean other issues do not carry weight as well. Aside from those two issues, I probably disagree with Trump on every single issue. You can see there are two other significant issues that are seen as intrinsically evil. Policies that promote racist behavior, and subjugate the worker to unjust conditions. From Trump’s muslim ban, to his racist protectionist policies all to fund his wall, his comments on “s-hole countries”, to most glaringly his separation of families seeking refugee status are fine examples of his willingness to harm the global poor, the disenfranchised, and the voiceless. These are all examples of his policies that have explicitly gone against catholic social teaching on charity. 

In your second and third points (I’m ingnoring your first point because I agree with you, catholic moral teaching should of course influence your political beliefs) you say you are unconvinced that Trump is racist, bigoted, and anti-poor, yet I ask you what else could he be if he rejects expert opinion on free trade, open-borders, and institutionalized poverty? Experts agree that a carbon tax would be an exceptional manner of helping to engage in a market based solution in reducing carbon emissions, yet he rejects that as well, and Biden has addressed all of these issues, providing far more evidence based solutions. 

Remember the words of the poem The New Colossus? “Give me your tired, your poor, / Your huddled masses yearning to breathe free, / The wretched refuse of your teeming shore. / Send these, the homeless, tempest-tost to me, / I lift my lamp beside the golden door!” What is more American than assisting those who seek to come to our home, build the life they dream of, and contributing to society? 

And in regard to the democratic position on higher taxes for the extremely wealthy, it fits with the Gospel, specifically Luke 12:48 “to whom much is given, much shall be required”. Those who have so much excess, while others are living destitute have an obligation to offer charity. If they will not do it out of their own volition, then the state has a mandate to aquire taxes to help ensure the destitute are not left on the edges of society. Remember, Aquinas himself said that is a starving man does not receive charity, then he is within his right to take what he needs from others, as that which he takes belongs to him. It was a failure of those who had what he needed to not provide for him. 

Finally, in regards to argument 4, you say that Trump’s personal moral character is beside the point. I disagree wholeheartedly. I find the moral character of someone to be of great importance. Joe Biden has seen personal tragedy that few could imagine. Losing a daughter, wife in a car accident is a terrible fate, and to make matters worse he lost one of his surviving sons to brain cancer. To endure such loss, and maintain his commitment to public service is a testament to his moral character. He even took the train every night while he was in the Senate to go see his sons every night. Trump on the other hand has been divorced twice, married three times, and even cheated on his current wife while she was 8 months pregnant. He is a morally bankrupt man, who has said he has nothing to apologize for. He got draft dispensation, then called not getting an STD, “his personal Vietnam”. Laws are a reflection of our morals, and our leaders should be willing to fight for our morals.

Hopefully I have illustrated how a catholic can arrive at the conclusion that they could vote for biden, if not convinced you to change your vote. Again, my intention was not to “make the catholic case” because I respect the right of catholics to hold different policy beliefs. These differences are necessary. If you would like any clarifications feel free to ask."
UCSantaBarbara,fow41h6,t1_fow33k7,1588112615.0,"Bud, we all want an outlet. I moved back home, thank god I was living in Uni apartments so I got a refund, and am getting my ass kicked by online classes. We have a global pandemic that the government did not adequately prepare for, extreme measures were required. 

What's extreme about social distancing? We all have a responsibility to do our part to minimize the spread. If the government and citizenry handled this properly, we may have been able to resume in-person class in the fall. But we didn't, and after barely more than a month a bunch of morons started protesting without masks. 

This isn't easy on anyone, but it required a response that we apparently were too weak willed to accomplish. Good job america."
UCSantaBarbara,fow30dd,t1_fovtpin,1588112070.0,"The county supervisors are a bunch of fuckin morons. LA and SD counties closed their beaches, so guess where the closest beaches were for 10 million people? You guessed it, OC. My friend who works at place right on pch said it felt like a summer weekend with how crowded it was."
Catholicism,fovprnu,t1_foven4m,1588105416.0,"Sure thing! I’m currently occupied with some coursework, but I’d be happy to give a detailed breakdown of my political philosophy, and why I’ve come to support Biden."
YouthForBiden,fovasvr,t3_g9rp64,1588098217.0,"My first choice was Beto O’Rourke. I remember following his senate campaign, and I felt his focus on values as a response to Trump was what this country needed in a post trump presidency. After his campaign failed to launch, I briefly danced between Bennet, Warren, then finally Buttigieg. But when my state of California started early voting, I pulled the trigger for Biden, and I actually cast my vote before South Carolina. 

I believe my ultimate reason for switching is that I came to the conclusion that Biden was the most likely to win the primary, and that his skill set was more than enough to help repair the damage the Trump administration has caused. I’m a poli sci major focused on foreign affairs, so Biden’s experience is second to none in that regard. America needs to reclaim her international standing, and the time we have lost has only diminished the unity of the western alliance that has been integral to maintaining world peace."
neoliberal,fotkwic,t1_fotj38i,1588057122.0,"You can even leave the door open for when she’s ready. Say it in your own words, but you could communicate to her that your offer still stands and you hope to one day try it out when she’s ready. Idk something like that."
Catholicism,fotbh1e,t3_g9dqva,1588049257.0,"I think he is allowed to do so, obviously one's morality is going to impact their political beliefs, but if his thesis is that every catholic should vote for Trump then I strongly disagree. At this rate, I will be voting for Joe Biden, something I have grappled with and am comfortable in doing."
Catholicism,fotbaql,t3_g9at9j,1588049126.0,"Is this from before or after he killed thousands in his torture prisons, used chemical weapons on his own people, and let imprisoned jihadists escape prison to infiltrate the FSA, thus discouraging western states from supporting the democratic fighters?"
Catholicism,fotb43d,t1_fot1yxj,1588048991.0,"Yup, twice I believe. I think the lack of an actual response by either administration is one of the worst failures we have allowed to occur."
television,fooatpp,t1_foo0l1l,1587935725.0,"Don’t forget the theme of the rock’s character having to overcome his own weaknesses that the macho-bravado filled lifestyle wouldn’t let him properly address. The weakness being his fear of investigating whether he has a TBI or not from his time in the NFL. Of course in the end he doesn’t, and that character development is thrown out the window, along with most of the charm of the show, after the first season."
Catholicism,fonz5h2,t1_fonvix6,1587929343.0,"The European powers were waging an illicit war that they had conspired to set up justification. The thing was a proxy war at best, and a neocolonial power grab at worst. In the end it was a giant waste of lives and manpower that hampered the western alliance against the USSR. Incorporating religion into a secular war misses the actual context of the conflict."
Catholicism,fokp6f3,t1_foknxla,1587846298.0,"Not really bud, I get that its self deprecating, but it also shows maturity. What's to fight about? A bunch of drunk goons looking to jump some dude just out on a date? A jerk that is bragging about committing felony assault and maybe killing someone? Idk man, but I'd rather swallow my dignity and play along than risk getting jumped and put in the hospital. 

I'm not sure if there is more context to the scene, but I don't see a subconcious arousal from the woman, more just extreme uncomfort and relief that the night didn't end the way it looked like would."
Catholicism,foknfxg,t1_fokjie9,1587845355.0,"I don't think given his recent history that Louis CK is the best authority on women, bud."
Catholicism,fokmo6a,t1_foklsxx,1587844935.0,"Yeah I have to agree. Not to mention that what is deemed as culturally masculine has changed drastically over time and that it is different across cultures. As I wrote in another comment, I think that toxic masculinity is not saying that all masculinity is toxic, it's simply that toxic behavior has been defended as ""masculine"""
Catholicism,fokmib8,t1_fokkr4h,1587844846.0,"I think you hit the nail on the head about what ""toxic masculinity"" actually means. It's not saying that masculinity is inherently toxic, and to reject it, its that toxic behavior has been defended and excused as ""masculine""."
neoliberal,foixkgb,t1_foix86c,1587800454.0,Fixing the economy one meme at a time
neoliberal,foixfhc,t1_foix0ej,1587800313.0,"It’s that thing my doctor tells me to have, otherwise I’ll catch the mesothelioma"
neoliberal,foixdps,t1_foix8h7,1587800264.0,I was quoting spongebob lmao. Thanks though!
neoliberal,foixbk5,t1_foix0pt,1587800205.0,Chads out! 😡👉🚪
neoliberal,foix64x,t1_foiwwiy,1587800053.0,At least you’ll never be jet lagged on vacation!
neoliberal,foix4jw,t1_foiwx85,1587800008.0,I don’t even know what that means and I agree with ya!
neoliberal,foix2pf,t1_foiwy71,1587799958.0,"Idk, mayhaps the CLINTONS haven’t been affected because they’re still busy flying chem trails over middle America!"
neoliberal,foiwsjr,t3_g7p7mj,1587799671.0,Has anyone else had there sleep schedule thrown outta wack by quarantine? I don’t like being awake when it’s tomorrow 😤
Catholicism,fo8410m,t1_fo836uu,1587589513.0,"You have the right to believe that, and I have the right to disagree. There is no Catholic dogma on the existence of a public health care option, for example."
Catholicism,fo832tk,t1_fo82pwf,1587589038.0,"No one is saying that. No one here is a Bernie Bro, there are a multitude of different policy positions a Catholic can in good conscious take, none of which are outright socialism. The establishment of government-funded social safety nets is not antitheical to Catholicism, nor is it inherently leftist."
Catholicism,fo82rn8,t1_fo80sq8,1587588879.0,"It also makes a distinction between the ""Welfare State"" and as StJP2 puts it, the ""Social Assistance State"" which he describes as an overbloated, legalistic, byzantine system that is an imperfect form of the Welfare State."
Catholicism,fo7e02h,t3_g63jl2,1587576726.0,"I got the back of the saint benedict medal as a small 3X3 inch tattoo on my leg. It may be a little more then what you’re interested in, but with the acronyms it came out pretty cool! But for the love of Pete, go to a solid tattoo artist. My guy messed up some parts, that’s what I get for trusting a dude with only 5 teeth in his apartment for a 120 bucks. Go premium it’s only permanent haha."
neoliberal,fo5wfah,t1_fo5uu1w,1587537915.0,🔥🔥🔥 this is too good
neoliberal,fo5svw4,t3_g5r1ei,1587534635.0,Who’s got the link to the song? This remix slaps harder than the tent salesman slaps the roof of this tent.
college,fo4ikek,t1_fo3gpox,1587505067.0,"Hey, just wanted to say you display great maturity, and I hope you find academic success when you go onto college. You seem like a bright kid."
college,fo4ieaw,t3_g5hu1c,1587504980.0,"I need to attend lecture as part of my regime. I go to campus because I'm far more productive there then my apartment, let alone back home. I also take notes by pen and paper, I have never enjoyed taking notes with a laptop, and learning through one is equally difficult. I hope to get my grove going soon, but I'm not sure what I'll do if this continues into next school year."
UCSantaBarbara,fny17h6,t3_g4iasb,1587350953.0,I'm a transfer and lived in San Joaquin this year. I remember stepping out at 7:30 most mornings to catch the bus and just getting blown away by the gorgeous views 100 feet from my front door. Damn I miss it.
UCSantaBarbara,fny12qk,t3_g4htum,1587350863.0,"Its honestly too soon to tell. The state would have to start reopening to get even a ballpark idea of when it might be. If Fall 2020 gets made online, I'll either withdraw from the term, or just move up to IV and take classes online up there. We just gotta keep social distancing and doing our own small part to fight the virus."
UCSantaBarbara,fnutt27,t1_fntw3uf,1587270900.0,"I think what the other person was referring to was the extension of the shelter at home order to may 15th by mayor of LA. But yeah like you said there is no hard date. I understand they want to give the opportunity for students to complete labs, but it would be a bust trying to get housing sorted for 6 weeks with barely any notice. I’m of the opinion they are leaning towards it being online."
UCSantaBarbara,fnuev5r,t3_g3tvmx,1587260487.0,"Idk bro, 4 bucks a year to help with sustainability efforts seems like a pretty small price to pay. I’ll just skip Yerba and a pack of five gum to make up the difference."
neoliberal,fnthjxk,t3_g3mxgv,1587241787.0,"Bennet was unironically one of the best candidates on stage. He’d have made an exceptional president, but when Biden entered, and when the debates became dominated by the the Harris, Bernie, Beto, Warren soundbites, there was no chance for him to really move forward."
neoliberal,fnte8e4,t1_fnsurdp,1587239888.0,And the fact he never polled about 5% with minorities lmao.
neoliberal,fnqvyaj,t1_fnnmkba,1587173424.0,"Hmm, shows my ignorance on the subject. Thanks for passing on the question! Did she having any recommendations for books or articles? I mean generally, not necessarily on afghan tribalism, but to learn more about Afghanistan proper"
neoliberal,fnpbya2,t1_fnosq4w,1587142813.0,They'd probably think that BLM aren't covered under the people's right to protest because they don't consider them to actually be people.
UCSantaBarbara,fnn5pzp,t3_g2jikr,1587084984.0,"People need to realize that this virus isn’t just killing the elderly. A 21 year old college student just passed because of this, and countless people our age are getting hospitalized as well. 


The whole 2% fatality thing is stupid. Imagine telling a veteran that because his unit only lost 2% of their troops, he wasn’t actually in any real danger. He and everyone else would rightfully think you’re an idiot. We all have to be smart about this, otherwise you can bet fall 2020 will be online too."
neoliberal,fnn2kip,t1_fnmph03,1587083057.0,"While Afghanistan is a patriarchal society, there is also a deep-seated culture of holding tribal/regional allegiance over allegiance to the state. Is misogyny magnified between Afghans of different regional/tribal affiliations?"
UCSantaBarbara,fnn1wzt,t1_fnmb2of,1587082666.0,I remember reading roughly 10% of the student body are international students.
Catholicism,fnhkzyu,t1_fnhboal,1586964337.0,"You even said abortion is not the end all be all. I am acutely aware of the churches position on it, and I don’t take the Democrats support of it lightly. But for the current election, yes I think they do our weight because I’m not a single issue voter. If you are, that’s fine. But almost every single policy besides being “pro-life” I disagree on with trump. If in the future the republicans decide to run someone who isn’t morally bankrupt, i most likely will vote for them."
Catholicism,fnhjv65,t1_fngqxlu,1586963748.0,"He’s made a lot pretty big mistakes. Just recently he’s been trying to sell products he claims kill Covid-19. 

And no, what he did is not overblown. He ruined the lives of multiple people who have had to move repeatedly because he accused them of being crisis actors, and part of pentagon plots to take away our guns. Simply saying that should be enough to get him fired."
Catholicism,fnglklz,t1_fnfj3mx,1586936194.0,"He still called sandy hook a hoax and was the main instigator for all the harassment those poor families have had to endure. For that alone he should’ve resigned if he had any dignity. But he doesn’t, he’s a snake oil peddler who lacks any shame."
Catholicism,fngl3zb,t1_fnfz12x,1586935730.0,"I think you meant to say Biden, and I don’t think you really understood my previous comment. The other commentator gave a better example of the sort of question you should ask."
neoliberal,fngk7bn,t1_fngjp3k,1586934877.0,"I have no where near enough life experience to really grapple with what you’ve said, but I will definitely consider it when I get to that stage of life few years down to line. I’m glad you have the self awareness to allow for such introspection."
