subreddit,self ID,parent ID,time,text
neoliberal,fngjxi8,t3_g1mwcx,1586934621.0,"Broke: giving out compostable paper straws for drinks that no one likes
Woke: bring your own reusable straw to avoid the terrible paper ones
Joke: bringing your own pack of disposable plastics straws to use instead of paper"
Catholicism,fnekygj,t1_fne5als,1586891226.0,"I know you don't. But its overly simplistic to think that because you support a candidate, you must inherently support all of their policies taken to their most extreme consequence. Trump has long advocated for protectionist trade policies, despite neoliberal, free trade policies having lifted millions out of poverty. I don't, and I'm sure nor does the above commenter, support Biden because of his pro-choice stance, but I support him over Trump because I agree with far more of his policies than Trump's."
Catholicism,fne570h,t1_fndlxfm,1586883261.0,"If we’re gonna play this game, why do you hate the global poor?"
YouthForBiden,fnbobbw,t3_g0spq4,1586819136.0,"I’m pulling for duckworth as she could help shore up the Midwest. While I really like Harris, and she does represent me, I just think she’d better serve either as a prominent senator, or as AG. I’d love to hear more informed takes on why people favor either. Though either pick would be good regardless."
neoliberal,fmt10eb,t3_fx1nfr,1586365134.0,"Now that Sanders is out, we need someone to remake that “neoliberals assemble” avengers video but against Trump instead of Bernie. We’re in the endgame now."
UCSantaBarbara,fmle2vn,t1_fmk4dhs,1586184551.0,Do you k ow if the sessions are independent of each other? Like if I wanna cancel session B after session A started would that be without a W?
neoliberal,fmldcul,t1_fmkm1d7,1586184132.0,You can hear it all the way in New Zealand!
UCSantaBarbara,fm6axpe,t3_ftbu73,1585790058.0,"The best thing you can do is try and give yourself a regimen to follow. Even if the lectures are not live, try and treat them as if they were. Leave your phone in a different room, and if it’s possible, set up your computer in a quiet space in your house. It may seem silly, but I mentally prepare myself by leaving my phone in my room, and walking into my space as if I was walking into a lecture hall. Then I will go for a brief walk, then come back and pretend I’m at the library catching up on readings. I might do some chores in the morning to use up some excess energy. It’s what works for me. It’s all about tricking yourself into applying as much effort as you would on campus."
