subreddit,self ID,parent ID,time,text
aww,ffjmdfq,t1_ffjeode,1580001583.0,"I want to punch you, you failure of a peach cobbler."
aww,ffizyt0,t3_ettwh3,1579986911.0,I'm dying omg it's so cute!
AnimeBooty,felpw5r,t3_epm1ea,1579228051.0,I see you're a man of culture as well.
gaming,fdjfbtb,t3_ellxwm,1578468393.0,No one gonna talk about those absolutely ADORABLE creepers?
aww,fdjey3y,t3_eliw0e,1578467956.0,"My heart is melting oml
This is sooooo cute!"
wholesomememes,fdcpyhe,t1_fdc73p9,1578281110.0,r/expectedcommunism
me_irl,fdcprok,t1_fd9ylfe,1578280971.0,I'm fucking dying at this
aww,fcpd2ss,t3_eib6sg,1577858894.0,This is the way.
whatsthisbug,fckzl64,t1_fcjk3bi,1577736586.0,This is the way
gaming,fciy72p,t3_ehaomy,1577672661.0,The only genius thing about you is that you remembered his name is Link and not Zelda.
expectedcommunism,fca27v5,t1_fc9o0xh,1577561948.0,Damn you beat me to it
