subreddit,self ID,parent ID,time,text
WritingPrompts,ffsj9ii,t1_ffs72au,1580183057.0,"You should definitely consider continuing it. Maybe explore the idea of loneliness more, how you can have everything and still nothing. How precious true friendship can be. Lots of possible themes here"
aww,ffs33hs,t3_euxjmw,1580171941.0,Can you just put the camera away and pet me please?
WritingPrompts,ffs2q8i,t1_ffs0t55,1580171684.0,Sooo good!
AskReddit,ffqjeo9,t3_euorqv,1580136241.0,Video games and hot pockets.
books,ffqhedv,t3_euo7rb,1580134659.0,I liked Sanderson's Mistborn series. Great world building.
WritingPrompts,ffqh35v,t1_ffqgzoo,1580134402.0,Sounds a lot better when you say it. :)
WritingPrompts,ffqgppd,t1_ffqedxl,1580134091.0,"I think that means something along the lines of ""there is nothing so stong that it can't be defeated by money"" but that's not quite it. Is it latin?"
escaperooms,ffqfhji,t1_ffqegy1,1580133047.0,"I get that there is a schedule and you can't give people *unlimited* time, but they should give *adequate* time for the average group to finish. Rush too much, make it too hard, too stressful, and don't let folks finish, and people won't have fun and won't come back. I've seen escape rooms that actually *brag* that less than 10% of groups/players succeed. Sure, it's great if you're the 10% but all the rest of your customers leave feeling dissapointed and inadequate...not good for encouraging repeat business."
escaperooms,ffqap5r,t3_eun6qv,1580128449.0,"Yup. I'm not a big fan of the short time limits. I want to enjoy it, not feel stressed out. I want to do the puzzles and enjoy the story but I hate feeling too rushed. A couple times we've gotten to the last obstacle/clue and ran out of time. Just 5 minutes more we would have finished. I would like to be given plenty of time to finish if working at a steady pace without feeling too rushed. If people want to race they can, perhaps the team with the shortest time each month gets a prize, but there are those of us who aren't in as big a hurry who want to savor the experience. I get that time is money for these places, but if more than half of your guests aren't finishing you've got problems with your game design. People want to finish."
aww,ffqa0xh,t3_eumqbq,1580127701.0,"Gotta ask, what's with the cardboard wall?"
mildlyinteresting,ffq39r4,t1_ffq2kog,1580118025.0,Someday hopefully we have much better ways of treating cancer and we will look back and view chemotherapy as barbaric. Sadly right now it's what we got.
progresspics,ffpzw8q,t3_eujvsl,1580112891.0,Well done you.
cancer,ffptw4r,t3_eug8dk,1580105537.0,"I spent the last 7 months in treatment. I'm finally done - forever hopefully. But I know I've changed. Lately I've been stuggling with transitioning back into a ""normal"" life. I can't go back to the way things were before - literally I can't - I'm not physically able to do the job I had before. So I have to figure out a new way forward. I'm not sure what to do. I'll figure it out, but I think recognizing and accepting that things have changed is the first step. Welcome to the new normal."
mildlyinteresting,ffp5kby,t1_ffp2zbf,1580086797.0,Yup. Chemo destroys veins and a lot of older folks have bad veins to begin with. It's terribly handy.
mildlyinteresting,ffp5gdb,t1_ffovod3,1580086716.0,Mine they used one side to administer the chemo meds and the second port for premeds and fluids to keep me hydrated and protect kidneys and organs.
mildlyinteresting,ffp5dqj,t1_ffovod3,1580086674.0,Mine they used one side to administer the chemo meds and the second port for premeds and fluids to keep me hydrated and protect kidneys and organs.
mildlyinteresting,ffokola,t1_ffmksiz,1580078647.0,"I've seen those ones. I think that's the kind most people get, although I think the double ones are becoming more common. They're darn useful."
mildlyinteresting,ffokhn2,t1_ffo4x2x,1580078573.0,"Who needs luck when you have insanely expensive and highly toxic drugs, right? :)"
mildlyinteresting,ffokd01,t1_ffof0fy,1580078522.0,"A rare type of uterine cancer, adenosarcoma with sarcomatous overgrowth (most uterine cancers are carcinomas not sarcomas)."
mildlyinteresting,ffmbwdj,t1_ffmbap1,1580052052.0,"Yup! Unlike the single ports it's heparin packed and I have to get it flushed every 4 weeks if not being used regularly. You can use it for contrast dye but most of the imaging nurses/CT techs I came across weren't really trained on ports, so I primarily used it during chemo and for blood draws."
mildlyinteresting,ffmaukd,t1_ffma6a6,1580051544.0,"Sorry if that grosses you out. After 7 months of treatment I've gotten pretty used to talking about bodily functions, gross stuff, getting stuck with needles, and being naked in front of people. I'm pretty well just over it. Very little of that sort of thing bothers me anymore."
mildlyinteresting,ffma4rz,t1_ffm3gn5,1580051267.0,"I thought it was plastic, at least it felt plastic, but I didn't ask."
mildlyinteresting,ffm9blq,t1_ffm7ti0,1580050877.0,"That sucks. I'm sorry you're having to go through this. Facebook has some pretty good cancer support groups, better than what is available on Reddit and more private, just search for your type of cancer and there is probably a group for it. It's a good place to ask questions that you might be too embarassed to ask elsewhere. I joined a couple groups and learned a ton. It's also a good place to vent where no one will judge."
mildlyinteresting,ffm6ju5,t1_ffm3ofl,1580049294.0,"A rare type of uterine cancer, adenosarcoma with sarcomatous overgrowth (most uterine cancers are carcinomas not sarcomas). I had very few symptoms, just a little heavier than normal menstrual bleeding. Then one day I all of a sudden started hemorrhaging blood like crazy. It was scary. I ended up needing 5 blood transfusions and my hemoglobin was less than half the normal level. At first the ER doc thought I might be having a miscarriage (I am only 38), but that wasn't it as I knew I wasn't pregnant. They did an ultrasound and rushed me into surgery. I had a D&C and they removed a ton of tumors/cancer tissue. About 10 days later I had a total hysterectomy (uterus, ovaries, and cervix all removed). That was eventually followed by chemo and radiation."
mildlyinteresting,ffm1xqq,t1_fflzhvc,1580047217.0,It's under the skin so no one can actually see it...but you would know.
mildlyinteresting,ffm1kpr,t1_fflzjzb,1580047122.0,Oh yes I can definitely feel it. It's right under the skin in my chest just above my right breast. You can actually see the bump. If i press on my skin I can feel the outline of it (thats actually how the nurses know where to stick the needles they feel for the three nubs/bumps) and sometimes it itches (it itched a lot more when it was still healing) or if I'm laying in a weird position on my side it may even pinch a little. Right now I'm laying on my stomach/chest and there is a pillow pushing it against my skin.
mildlyinteresting,fflr1cq,t1_fflq32k,1580043037.0,Eeeeeve!
mildlyinteresting,fflqdfn,t1_fflp0nq,1580042725.0,"Seeing as that ""wire"" is actually a tube that is inserted into an artery in my neck and routes  highly toxic chemo meds directly to my heart to be dispersed to the rest of my body, I sure as hell hope it wasn't designed by Apple."
mildlyinteresting,ffln2ay,t1_ffll10r,1580041656.0,Yup. Being sick sucks. Finding someone to blame and taking out your frustration on them is sometimes the only thing that helps.
mildlyinteresting,fflkao7,t3_eu5job,1580040672.0,I'm assuming it's because you probably spread your germs around and got them sick as well.
mildlyinteresting,fflgqa4,t3_eu4xaw,1580039533.0,"Whenever I see manufacturing screw ups like this, like weird shaped M&Ms, I always worry there might be debris or something like a bug inside or something else that got into the food by accident. Who knows what caused it, but I wouldn't eat it personally. Sorry if that ruins it for you."
mildlyinteresting,fflf5ug,t3_eu5mvj,1580038951.0,All I can think of is how that makes you a litter bug. Not cool.
mildlyinteresting,fflequd,t1_fflehwn,1580038769.0,Thanks! Cheers!
mildlyinteresting,ffleg2m,t3_eu5keq,1580038574.0,"The parrot's eye looking up, like he's thinking ""wtf, why is my head on fire?"" is the best part."
mildlyinteresting,ffldq10,t1_ffld6dx,1580038338.0,"It is. And the IVs in your arms are super annoying. Before I got my port I had a couple surgeries and some blood transfusions, they put the IVs in my elbow area and every time I bent my arm the alarm on the IV would start beeping and the nurse would have to come in. It was such a pain. Also chemo can be pretty damaging to your veins. Port helps it get to your heart and dispersed throughout the body as fast as possible."
mildlyinteresting,ffld7fo,t1_fflcykf,1580038052.0,"Ooo, I always wanted to be the queen of my own little fiefdom. Bow down before me minions!"
mildlyinteresting,fflaxf3,t1_ffladvm,1580037309.0,"Thanks. I'm pretty darn pleased about it myself...well, all the treatment and surgeries weren't fun but the not dying part was pretty spectacular. :)"
mildlyinteresting,ffl9la7,t1_ffl8wyd,1580036820.0,"Thank you. It's been a crazy year. I lost my grandma to cancer, so I've seen how bad it can get. I'm only 38 so I think being young and strong helped. I've been fortunate so far, it could have been much worse."
mildlyinteresting,ffl8cn7,t1_ffl7hyc,1580036200.0,I was surprised it was purple too. When I have it removed (which won't be for awhile yet)  I'll have to remember to ask my nurses about the color.
mildlyinteresting,ffl7qbh,t1_ffl6vhg,1580036056.0,"Thank you! I was actually diagnosed in June, had my port installed in August. Over the last 7 months I've had 3 surgeries, 5 blood transfusions, intensive in-patient chemotherapy, and 5 weeks of targeted radiation. I actually had a CAT scan last week and it came back clear. I'm done with treatment and hopefully have beat cancer forever. However I have a rare type of cancer with a very high recurrance rate so we'll have to keep a close eye out and I'll have regular scans over the next year. I still have the port in my chest, I'm planning to wait until I'm cancer free for a year before I get it removed."
mildlyinteresting,ffl72j2,t1_ffl5pxf,1580035728.0,I did not ask that question. I don't think so. The brochures were all purple and gray. Once it is installed you can't see it. It's under the skin. I just have a scar.
mildlyinteresting,ffl6x6d,t3_eu5795,1580035650.0,"This was implanted under the skin in my chest just above my right breast. The white tube is connected to an artery in my neck. When the nurses adminstered my chemo drugs they would press their fingers against my skin and feel for the three little nubs/bumps and that would show them where to insert the IV needles. Most of the cancer patients I've met only get single ports, but mine is a double. My oncologist said he likes the doubles because nurses can adminster the chemo drugs through one side and my premeds and fluids to protect my kidneys/organs and keep me hydrated through the other side. The port is nice, some people don't like them, but they are sooo much more comfortable than having multiple needles sticking out of your arms. If you have any questions about this or anything else feel free to ask."
cancer,ffl0897,t3_etef68,1580032389.0,"I got a double port, which was nice. They administered my chemo drugs on one side and fluids to protect my kidneys through the other side."
cancer,ffkztio,t3_etef68,1580032177.0,I really like my port. It was sooooo much more comfortable than having IVs in my arm.
cancer,ffkzkob,t3_etuwui,1580032062.0,Biotin. A biotin vitamin suppliment may help. It's promotes healthy hair and nails. Check with her Dr first but it shouldn't interfere with anything. I lost my hair durimg chemo and that is what I'm taking to help with regrowth.
harrypotter,ffkxy0a,t3_eu2enb,1580031002.0,I'm guessing if a place like this opened in the States it would get sued by Universal.
television,ffkv2et,t3_eu3140,1580029473.0,"""When I smile I look like a kidnap victim trying to communicate with their eyes."""
television,ffku2g2,t3_eu3ptk,1580028892.0,Ok Boomer.
AskReddit,ffiqxdd,t3_etv5sz,1579980487.0,"Break up and move on?  

I am my worst enemy.  

There is no escape."
aww,ffi2krw,t1_ffi2bel,1579963227.0,Take your phone. If you get stuck under the bed and die of starvation your cat will eat you.
AskReddit,ffhz6vn,t3_etqldk,1579960025.0,"Lottery tickets. In reality a total waste of money and possibly even discourages self-improvement, but also kinda fun because a ticket is a license to daydream and comes with a small glimmer of hope."
aww,ffhykyk,t1_ffhycoe,1579959396.0,"You should be. Be afraid, be very afraid."
aww,ffhxwsj,t3_etqo8l,1579958672.0,Because he is plotting how best to overthrow your dominion.
interestingasfuck,ffhxnrl,t3_etpepp,1579958390.0,Looks perfect for climbing!
CasualConversation,ffht2ab,t1_ffh2det,1579952456.0,Poetry huh? Maybe buy her a rhyming dictionary.
CasualConversation,ffhsucs,t3_etl08d,1579952131.0,"1.) Write her a real letter on actual paper saying how you feel and listing all the things you love about her and why you are thankful for her. No one writes letters anymore so it will mean something and get noticed.  
2.) Try to encourage her to focus on the future in a positive way instead of getting weighed down by her past regrets/trauma. Maybe mention fun things you want to do with her when she is done with treatment, maybe a trip or concert or cool activity. **Give her something to look forward to.** Maybe encourage her to make a detailed bucket list. If she has goals for the future it will help.  
3.) Lastly, gratitude is incredibly powerful. Bit by bit, over time, it can help heal depression and transform attitudes. Taking time every day to make a mental list of everything you are thankful for is one of the best things you can do for your mental health. When I was diagnosed with cancer (this was about 7 months ago) a friend gave me a set of what she called ""Greek worry beads"" (basically just a bunch of beads on a chain similar to catholic rosary beads, also used by some eastern religions/spiritualists to keep track of how many times they repeat their meditations/mantras). Worrying is a pointless activity, so I call them my ""blessing beads"" instead of ""worry beads"" (yeah I know how cheesy and dumb it sounds). Anyway, I used them while waiting at doctors appointments or in the car to count off all the things I'm grateful for. Those things can be big (family, friends), little (sun is out today, got a compliment on my outfit), practical (clean water to drink, roof over head), or downright goofy (watched a funny cat video that made me smile). It really does work. Not overnight. But like how a constant drip of water on a rock can smooth its surface."
CasualConversation,ffhrr02,t3_etn65r,1579950474.0,"I love the stuffed crust but it is NEVER on sale or included in coupons, if you want it as part of a deal they always charge an extra upgrade fee."
CasualConversation,ffhrgva,t3_etn7k5,1579950034.0,"No mystery. It's night time you said? They are probably doing long exposure shots. When it's dark you have to leave the shutter open longer. They might even be doing astrophotography and taking pics of the stars or pics of the city lights. Sometimes with night time shots you have to take multiple shots with different shutter speeds and apertures and layer then in photoshop to get the exposure right on different subjects. Some professional night time city/street scape pics are actually 4 or 5 different photos layered. Photographing the brighter street lights is different setting from, stars, wet pavement, and dimmer lights. If it is pretty dark they could be leaving the shutter open for a full minute or more with each shot. Check out r/exposureporn (note, it isn't actually porn, it's safe for work, just photos with longer exposure/shutter times)."
CasualConversation,ffhqzde,t3_etn9wr,1579949272.0,"Female here. I've tried mens clothes but they usually don't fit right. Shirt shoulders are too wide and don't look flattering, t-shirts too long, pants just don't fit. I've bought mens socks and hats but that's about it. Actually, a lot of women's clothes don't fit me well either. I usually try a ton of stuff on but only end up buying one thing, and it's usually NOT something that I really loved the look of on the hanger, it's just whatever fit best and I felt comfortable in. If I could define my own ideal personal sense of style using pictures of clothing from catalogs it would look very different from what is actually hanging in my closet. I've had to settle. I suppose if I cared more I could get stuff tailored or sew my own clothes, but I guess it just isn't that important to me."
CasualConversation,ffhqjh5,t3_etntnp,1579948580.0,"I don't think it's legal to NOT pay you, depends on where you are located of course and what was agreed upon when they hired you. I've heard of training pay being less, but only for a short set period of time. Never heard of training for free when you're still obviously being expected to do a lot of work. Also, you should not be hearing about your compensation from a co-worker. The boss should tell you directly if something is unpaid. And if training is unpaid they should have told you at interview and/or before they hired you. That's not professional. If the BOSS didn't tell you, and it turns out co-worker was right and they don't pay to train, then you have every right to go to him and demand to be paid as you never agreed to work for free when he hired you."
CasualConversation,ffhpxzv,t1_ffhphf6,1579947659.0,"Again, drink lots and lots of water. Also some exercise will maybe help sweat it out and clear your head."
CasualConversation,ffhpur8,t1_ffhphf6,1579947521.0,"Make sure you tell that buddy thank you, thank you or even offer to buy them coffee/dinner/drinks in appreciation. If someone was targeting you for assault/robbery your buddy hanging around might have kept them away. Make a point of praising their actions in front of your other friends and dad (ie. ""I don't know what I would have done if Whats-his/her-name hadn't stuck by me! I'm soooo thankful for him/her. I'm so glad she/he believed me."") maybe it will make them think twice about what their behavior towards you should have been."
CasualConversation,ffhpdll,t3_etotca,1579946791.0,It happened to a friend of mine on her honeymoon and it was the bartender that did it. It happens more than people realize and often goes unreported. Trust your gut. Drink lots of water. Watch your drink being made if possible and never leave it unattended. If your friend doesn't believe you maybe you need to pick different drinking buddies. You need people around you that you can trust and who will believe you and protect you when you say something is wrong.
mildlyinteresting,ffhoapb,t1_ffhjmlv,1579945113.0,TIL there are actually people on Reddit who haven't seen Star Wars.
cancer,ffho0ca,t1_ffgv2zk,1579944675.0,"If his condition is terminal then his diet should be whatever the hell he wants. Hospital food was never that appetizing to me. Sometimes you really just need a friend to bring you a milkshake and fries. I asked my cancer doctor what I should be eating during chemo (I'm not terminal but I did multiple rounds of in-patient chemo, radiation, and three surgeries so I've been in hospital lot over the last 7 months) and he told me that the important thing was just to eat *something*. He said if the only thing you can stomach is some kind of junk food, then go ahead and eat that, anything is better than nothing. One of my favorite things was frozen blended coffee drinks my sister-in-law and mom brought them when they visited me and it was sooooo appreciated."
cancer,ffhn6vr,t3_etj5ol,1579943439.0,"Speaking as someone who has cancer what I appreciated most in the hospital was 1.) Just people I love showing up to show that they care and are there to support me 2.) The occasional frozen blended coffee or smoothie or the offer to pick up fast food or snacks and sneak it into the hospital in future if I was ever craving it. 3.) My extra-long phone charging cord (my hospital room only had a couple power outlets and they weren't necessarily close to the bed. I have a cord that is like 6 feet long and it was a lifesaver.) 
I got a ton of other gifts (water bottles, blankets, beanies, coloring books...oh soooo many coloring books) but most of them I never used. ASK him before buying random stuff, there might be something he actually needs or wants."
cancer,ffhlv5t,t1_ffhbjic,1579941448.0,The maid service on maternity leave is such a good idea.
cancer,ffhlsxs,t3_etkucg,1579941355.0,"A cleaning person is soooooo nice. When I had cancer I was always tired and cleaning was the last thing I wanted to do. A cancer patient has much more important things to be worrying about. Plus, a clean home helps prevent infection and disease if they are having surgery and/or have low immune system from chemo. It really is one of the best gifts. I had lots of people give me things like blankets and water bottles and ginger candies and mugs and flowers....it was nice of them but most of that stuff I never used because I already had it."
solotravel,ffhl3fi,t1_fff7dc0,1579940332.0,Your family has the right idea.
solotravel,ffhkyub,t3_eta2kh,1579940145.0,"PSA: For the love of travel people *please* stop bringing home cheesy t-shirts, keychains, and magnets with the names of places *you've* visited on them and giving them to friends and family as gifts. No one wants a keychain, from a place they haven't been, to remind them of *your* trip that *you* went on without them. If you're going to bring home a gift, make it food (chocolate, wine, coffee, cheese, etc) or at least something useful or beautiful. No one really wants cheap tacky tourist stuff as gifts."
solotravel,ffhkk7v,t3_eta2kh,1579939564.0,"Nope. Not as a rule. I try to avoid tourist/souvenir shops like the plague. Pictures and memories are my souvenirs. I prefer to spend my money on experiences. That being said, I have on occasion purchased specialty food items like coffee (Costa Rica), wine/alcohol (Sonoma, Mexico), and smoked salmon (Alaska), but only if I can't get it at home or it's significantly cheaper than at home. My advice is don't ever buy something just because you feel like you ""need"" to buy *something*. **It's ok to come home empty handed if there is nothing worth buying.** Wait until you see something that you absolutely fall in love with. Be picky. Otherwise it will just end up in a garage sale or dusty box somewhere."
firefly,ffhjkit,t1_ffhg31x,1579938188.0,"Mal, means ""bad"", in Latin...if this kid lives up to his name the misbehaving part is pretty much guaranteed."
Map_Porn,ffhiwd2,t1_ffh7ftj,1579937290.0,"Note there are TWO trails in Idaho called the Centennial Trail. The Idaho Centennial Trail as pictured on the map above runs north to south the length of the state and is for hiking. The North Idaho Centennial Trail runs east to west across the panhandle, is about 25 miles, and is paved for biking. There are actually a number of really nice long biking trails in North Idaho. Most of them converted railroads or ""rails to trails"". The Trail of the Coeur d'Alenes and the Hiawatha Trail are other examples. The Hiawatha on the Idaho-Montana border is especially cool with a multiple tunnels and old trestle bridges, including the 1.5 mile long pitch black Taft tunnel (headlamps are required), also has nice scenery and a small waterfall. (I live here and have biked on all of them.)"
mildlyinteresting,ffexfjm,t3_et8t3o,1579869378.0,"The puzzle is a picture of Neuschwanstein castle in Bavaria/Germany. It is the real life castle that Disney used as inspiration for the Cinderella castle. It's located on a mountain with shear cliffs on three sides, near a waterfall, and on misty/foggy mornings it often looks like it is floating on a cloud. The king who built it died under very suspicious circumstances (it's a fascinating story) and construction stopped when he died so it was never finished. There some very ornate rooms but also some big empty spaces in the castle where doors open to nothing but a long drop."
todayilearned,ffebj30,t1_ffdr16s,1579842189.0,I thought the ending was brilliant. It was both happy and sad at the same time.
progresspics,ffe2b1i,t3_estmez,1579834849.0,"I'll admit I had to take a second and third and fourth take before going ""yeah, that is the same person"". Astounding transformation. Congrats on all the hard work paying off."
StarWars,ffe0mf4,t3_esyp5b,1579833623.0,r/photoshopbattles
mildlyinteresting,fer3w2n,t1_fer278a,1579349504.0,Good times. See you in the spring.
cancer,feqgety,t1_feqdzty,1579341560.0,"It could, you don't know until you try. Biotin is magical. It's also not expensive. Take it for a month or two and if it's gonna work you should definitely see evidence of it in that timeframe."
mildlyinteresting,feqfvu8,t1_fepoftn,1579341323.0,"It's likely the snow on the opposite side of house isn't piled as high. This snow likely drifted/blew against the house and the wall isn't that thick, so if they don't want snow fallin in the house they could go out the back or side door that is sheltered from the wind and work their way around front. They could also exit thru a second floor window or on to a raised back porch if they have one."
cancer,feqcyjq,t3_eqe5ej,1579340254.0,Have you tried taking a biotin vitamin suppliment?  Biotin helps.
todayilearned,feplofh,t1_fepl3ca,1579323779.0,"Yeah, you don't realize how huge it is until you see someone standing next to it."
