subreddit,self ID,parent ID,time,textShowerthoughts,fephbhu,t3_eqbep7,1579320493.0,"Am woman. Had five transfusions. Odds are at least one of my donors was male. It never occured to me that some guy's boner blood was now flowing in my veins. Actually, I never really thought about where the blood had been before. Sooo ah, gee, thanks for that."
StarWars,fepfr1r,t1_fepc9ev,1579319379.0,Not the first time a girl got passed over because some guy was drinking buddies with the boss. It's a story as old as time.
AskReddit,fepepua,t3_eqapyx,1579318660.0,"I won my office March Madness pool the first time I ever entered. There were like 50 people in the pool, most of them guys who are big college basketball fans. I can't imagine the guys were happy that a girl, who hadn't watched a single game of the regular season, beat them and took all their money. This was back in 2001 when Duke won. I just got lucky and made some good guesses, but after all the bragging/boasting those guys did about their picks it was pretty satisfying to win."
Showerthoughts,fepcmv4,t3_eqaqel,1579317242.0,"Most people on the internet have never really lived....there, fixed it for you."
todayilearned,fepb61k,t3_eqarcx,1579316261.0,"The Athena replica statue is really huge and is painted bright colors and is actually kinda ugly as a result. Supposedly most of the old roman statues were originally painted like this, but the paint has all worn off which is why they all just look white/natural stone. So if you'd gone to a Roman (correction: Greek) temple back in the day the statues would have all been tacky colors."
AskReddit,fepaoem,t1_fepaewg,1579315928.0,Yup. For parents a toddler is basically the last boss you face before the final epic battle with the teenager going thru puberty.
AskReddit,fepa94c,t3_eqalwl,1579315645.0,Potty training
AskReddit,fep9mq2,t3_eqambw,1579315238.0,Cake decorating
interestingasfuck,fep9f5e,t3_eqamg4,1579315103.0,That alien spaceship needs to recalibrate its cloaking device.
AskReddit,fep8k6k,t3_eqa7y0,1579314548.0,My only tattoo is a series of three guide dots given to me by my oncologist when I had radiation therapy for cancer. So if I'm lucky I either have the ability to control/manipulate radiation or perhaps the power to destroy cancer...if I'm not so lucky my power will be to spread joy through poka dots.
StarWars,fep6rzi,t3_eqa84a,1579313407.0,It's all fun and games until he drools on you.
mildlyinteresting,fep6bgk,t3_eqa8bj,1579313108.0,Time to burn it down.
mildlyinteresting,feov0zs,t1_feoql68,1579306021.0,"I'm in a couple different cancer support groups on Facebook and they are always talking about getting genetic tested and tested for Lynch so I looked it up. Some of these Facebook support groups are surprisingly well informed and good resources, Reddit really doesn't have anything like it (no subs at all for my type of cancer). Haven't been genetically tested myself yet. My kind of cancer is rare, like less than a fraction of 1% rare. But thankfully we caught it in time. I *only* needed three surgeries, five blood transfusions, intensive chemo, and 5 weeks of radiation. Just got the results of my most recent CT scan today and I'm clear at the moment (hooray! my cancer has high recurrence rate so I have to keep getting screened)."
mildlyinteresting,feobcjm,t1_feo9gtf,1579297704.0,"I'm familiar with Lynch, that sucks. Rules for qualifying for Medicare/Medicade changed January 1. If you didn't qualify before you might now. It's actually much easier to get, at least in my state. Otherwise I guess I would just suggest making getting a job that offers insurance a priority."
aww,fenisqf,t1_femvrdi,1579285599.0,Yup. That's the takeaway. Go with that.
AskReddit,femqnxe,t3_eq02ca,1579266785.0,"First day of class a teacher calls me aside and tells me he had my brothers in his class when they were my age and that he hopes I won't be like them and proceeds to lecture me for several minutes on turning in homework etc. First. Day. Of. Class. I hadn't done anything wrong. Not only that, if he had bothered to look at my records he would have seen that I was a straight A student with no disciplinary issues whatsoever. And in fact my brothers really weren't that bad, average students and not really troublemakers. I was sooo pissed for being judged unfairly. I hated him from that day on. Later in the year he tried to be friendly with me and get me to volunteer to help with stuff, I barely spoke to him. He had totally lost my respect day one and there was no getting it back."
AskReddit,femq0pp,t3_eq02fh,1579266201.0,Fresh baked bread
AskReddit,femo1k9,t1_femn0ta,1579264282.0,"Maybe. Or maybe clicking her heels together was the equivalent of a respawn. Even if it was all just a trippy dream, 95% her troubles could have been easily avoided had the ""good"" witch not withheld critical information and told a lie of omission when Dorothy asked her point blank how she could get home. Yet somehow Dorothy doesn't seem all that upset by this deception that nearly cost her her life. Dream or no, any normal person would be pissed off."
