subreddit,self ID,parent ID,time,text
memes,ff8sp1j,t1_ff8qbpv,1579694599.0,He is trying to talk
memes,ff8smwe,t1_ff8ok06,1579694530.0,That's how i talk to 2000 people as a 1999
Overwatch,ff8fbn3,t3_es4mu8,1579676020.0,"When mei do that to my, i just start shooting her until she ice block so i can get the fuck out cha cha real smooth"
dragonballfighterz,fetp0pm,t1_fetnuwy,1579377835.0,And my bow
dragonballfighterz,fem3olv,t3_epolbq,1579238701.0,"You make me hate Vegeto and his legs even more right now XD, but still nice comeback."
dragonballfighterz,fe1it7o,t3_enba7p,1578826970.0,Oof level : over 9000
memes,fdwkuyo,t3_en737d,1578759773.0,"Buzz lightning : hmmmmm yes, the glass here is made out of glass"
wholesomememes,fdwddgy,t1_fdvlkin,1578757592.0,"My girlfriend is just like you, except she doesn't want to play, she never played a single videogame in her life and don't like to be bad at something."
dragonballfighterz,fdv647i,t3_en69eg,1578743748.0,"You could try to have trunks as point, goku ssj as mid and yamcha as anchor.
Goku ssj and yamcha are pretty good together and i just read that you want trunks to be in the team."
relationship_advice,fdnj1x1,t1_fdmtuih,1578586845.0,"I agree with you but i just want to say that it's not that easy to get rid of an addiction (but yeah, he can at least try)"
wholesomememes,fdiemvk,t3_elg1n4,1578441171.0,"I bought my girlfriend 2 scarves for Christmas, we are in the same school and i love to borrow it and smell it during class (and also sleep on it...)"
Seaofthieves,fdg4nj9,t3_el2x80,1578379861.0,"A friend and me were doing skeleton boats for more than an hour and when we finaly were about to end it, a sloop show up and kill us. We wanted our revenge but on our way, we've met 2 megalodon and have been killed by the kraken...

We left the game right after."
sex,fdcgnex,t3_ekl6zx,1578274425.0,"My girlfriend always rush to stick to me after we finish sex, she normally like cuddle and hugs but after sex, i think that it's all she wants, jumping into my arms for affections (and to be honest, i really love it, i find it so cute and it make me sleep almost instantly which is really difficult normally).
Don't worry being manly about that, it's not important, just enjoy it ;)"
Unexpected,fdcavtc,t3_dnkw2t,1578270598.0,u/vredditdownloader
forhonor,fdc9rly,t3_ekhec6,1578269910.0,u/vredditdownloader
forhonor,fdc9j2b,t1_fdc9e9s,1578269776.0,Oh... Humm i've seen a bot putting a link to download
forhonor,fdc8vdg,t3_ekhec6,1578269388.0,"As a french, i find this hilarious"
forhonor,fdc8r69,t1_fdb4vwe,1578269321.0,"On mobile, make the vid full screen and go on the top right corner and there you go"
dragonballfighterz,fcfh9pi,t1_fcfgyfs,1577629903.0,"Yes, it has damage reduction but just saying he can do it ;)"
dragonballfighterz,fcfeav8,t1_fcdfhqt,1577629078.0,Z broly can double lvl3 and lvl1
memes,fcf1kzo,t1_fcf0gl9,1577625776.0,You
wholesomememes,fc5ifzz,t3_eg9r5u,1577458483.0,"I'm too afraid to have a dog when i'll be an old man, i don't want to leave this world first and leave my dog alone."
dankmemes,fbal3vj,t1_fbakyr5,1576680933.0,"So we just said ""fuck it, u can have your shithole "" ?"
