subreddit,self ID,parent ID,time,text
Onision,ff7lrpd,t1_ff7je2a,1579652584.0,Suprised that Onision is hated globally lmao.
Onision,ff6elg5,t1_ff65g42,1579625508.0,Yeah lol.
Onision,ff6ccj5,t3_erwjyd,1579624102.0,"Onion’s thought process: Look at this picture of me as a kid. Look at me I’m a human being I’m innocent. I’m just a fragile little boy, please please I’m a victim of society, if you are making fun of me you are making fun of this little boy. I’ve been through alot. My childhood was horrible, look at me I’m a little baby me please, my father was a sexual predator. I have to use this picture of me as a kid I was so innocent. I saw this from Avatar the Last Airbender, the kids they were watching it. Kitara found a baby picture of Fire Lord Ozai, he was sweet and innocent, like me as a little baby aren’t I so cute?"
Onision,ff5p364,t3_erswwo,1579604171.0,It all sounds like the very first episode of Game of Thrones to me tbh.
Onision,ff5fx8o,t3_err4n2,1579591131.0, Seein double
Onision,ff5fwxi,t3_err4gw,1579591120.0,Seein double
Onision,ff3wxwt,t3_eriit2,1579550653.0,"I bet Greg, Kai and his victims were fucking."
Onision,ff3wqpu,t3_erinb3,1579550525.0,Literally the worse version of “did your parents drop you on the floor as  kid”
Onision,fez86go,t3_eqxvse,1579454702.0,"Its funny cause he didnt show bloopers for the very first “wow” video. That was either his legit
 seething anger of his patreon getting deleted. After seeing the views he got he decided tocreate the homeless story, but its less emotional and fake as fuck, very bad acting. With obvious cuts."
aww,fevwihv,t3_eqmvak,1579402327.0,Widdle floof
Onision,feudhpm,t3_eqmcvg,1579385528.0,Nooooo but this implies onision beats up chris hansen with his spider reflexes at the end.
Onision,feu8rv7,t3_eqm0tk,1579384263.0,"Yeah you’re not wrong in speculating. In Gregs debate against Blaire White, he has a freudian slip in which Greg says he prefers underdeveloped girls. This is fucking creepy because he has this power fantasy of fetishizing underdeveloped girls as being weak. How ever, if a woman is a developed, ho boi its fair game to be shamed by Greg.  This can be seen in Hansen’s recent video with Jaclyn Glenn. Glenn mentions instances where Greg made so many videos about her body image because she’s tall etc.

There’s so many instances of Greg body shaming women for their looks its horrible. If you check out Strange Aeon’s video on reading Stones to Abigaile, one of the characters in that book has large breasts, and Greg clearly states that she’s bound to be a stripper. Strange Aeon points out that yeah Greg clearly can’t stand a women with power. 

What’s scary is that those books are a scope into the mind of Onion. Its all an unbridled and unfiltered perspective of his world and it’s what he thinks about everyday. He clings to these perspectives so hard yet when he think he’s trying to be deep with nihilism its a fucking conundrum. With nihilism, the idea is that everything is pointless and everything becomes nothing yet Greg is so up in his ass about his own views. In nihilism there is no point in views and principles because its all existentialism. Greg just wants to say God is Dead, like AN ACTUAL TITLE to one of his other shitty fucking books, to trigger christians. He spins nihilism to his edgy teenager perspective without academic understanding of the context behind it, like I doubt he ever read Nietzche’s shit and he just found out that Nietzche just said god is dead and decided to use that to be a major edgelord."
metalgearsolid,fetth3b,t3_eqcx9o,1579379879.0,Hey hey keep it up man.
metalgearsolid,fettarm,t3_eqjohc,1579379820.0,AHAHAHAH
metalgearsolid,fephrag,t1_feoyg45,1579320819.0,"Thank you, man took a lot of hours."
metalgearsolid,fephq66,t1_fepbh30,1579320796.0,Salute.
metalgearsolid,fephouk,t1_feoxeku,1579320768.0,Haahah thanks! Mix of Shinkawa and Miller would be so pretty sick stuff actually.
metalgearsolid,fephlkc,t1_feoinva,1579320698.0,Thaank you!!!
metalgearsolid,fephk7b,t1_fep06gn,1579320670.0,You’re prettyyy good.
metalgearsolid,fephjnq,t1_feosjdn,1579320659.0,Thank you!
metalgearsolid,fephj7u,t1_feoz1cn,1579320649.0,"Yessss, I really wanna develop my own thing, but Shinkawa is so aesthetics."
Onision,fenxn03,t1_fendgma,1579292340.0,LOOOOL
Onision,fenwttb,t3_eq1ngk,1579292070.0,"Let me get this straight Oniontard, You think that your the Joker, one of the most diabolical villains who likes to fuck with vigilantes who spends their nights beating criminals to a pulp with their bare hands. 

Shut the fuck up Greg they only thing you like to fuck with is little girls."
Onision,felf62c,t3_epqxew,1579220729.0,"If they can catch Capone for tax fraud, you can sure bet they can catch Greg “The Grooming Onion Master 3000” Jimmy James Jackson-Saville the IV."
Onision,fele805,t1_feldfvo,1579220100.0,Look up the Groomer Archives on youtube.
aww,fekj2m6,t3_epjm2z,1579201088.0,So fwufffyy
Onision,fek2f03,t1_fek0nhe,1579191166.0,Yes milk him of all his moneeeey.
PrequelMemes,feh7vli,t1_fdbcwlx,1579110972.0,Wee gollege
Grimdank,feh7rv9,t3_emnaj7,1579110911.0,WEEEEE GOLLLEGE?
Onision,fefmaah,t1_fefj599,1579059386.0,Notably Mikenactor.
Onision,fefm3fz,t3_eousaf,1579059260.0,RaiD ShAdoW leGens.
Onision,fefl5cq,t1_fee9ei1,1579058654.0,Must’ve been a real bite in the ass to the Onion.
Onision,fedci0l,t3_eof6dq,1579007570.0,HAHHA SO THE COPS ACTUALLY CAME AND SAID THEY WERE FANS OF HANSEN AHAHHAHSHFHFJ.
Onision,fedc2zq,t1_fedbzbi,1579007195.0,ITS FUCKING GOLD.
Onision,fedbrrv,t3_eojyea,1579006908.0,Mike Morse came out with further detail that the cops ACTUALLY CAME AND THEY SAID THEY WERE BIG FANS OF CHRIS HANSEN AHAHAHAHHAAHAHJAHAHHAHHAHAAH.
Onision,fe2ln8f,t3_enn39p,1578840054.0,Wow 130$ for this piece of shit plaque? Pewds sold his gold plaque for 5 shmekkles on the street while selling hot dogs.
Onision,fe2k7wg,t1_fe28ksc,1578839392.0,"I know how you feel man. But its pointless arguing with his fans. At this point they think hes like Marilyn Manson/Kurt Cobain. They think he’s attractive because he’s going for this grunge punk emo look and they actually think he did nothing wrong. 

But the truth is Onions closing himself off from society and placing himself in an echo chamber where he likes what he hears.

His fans are the only the validation he has in accepting who he is and the only thing that tethers him to his principled morals. Because of this he will cling to it. But in actuality his principaled morals are controversial and conflicting, even with the people closests to him. Withouth realizing that this is what pushes people away, it creates further issues of abandonment and lonliness.

Only his fans will keep feeding into his torrential lonliness. Kai himself is not a husband nor a wife because what kind of husband or wife lets their partner fall into such a state of being?

Kai is just a fan. A fan who has followed him into the depths of isolation. And together, they have carefully crafted this worldview of righteousness, where they can be carefree and think that they are untouchable. His worldview is for his followers to wage war against society; that they  truly think they are different because they are outcasts.

These are the kind of people who are loyal to him. These are the people who would follow him into the Jungle. They will not accept society because the truth hurts.

In the very end, society has come knocking at Onision’s door. But he will push himself further into isolation, all under the guise of exclusivity, something that society doesn’t deserve, because they don’t understand."
Onision,fdvbow5,t3_en099w,1578745752.0,Tis the same on his instagram. Dudes prepping for a suicide.
Onision,fdv8dw4,t1_fdurg8e,1578744536.0,"Holy cow this is very strange indeed, i checked the most recent video, and the only instagram link leads to that account."
Onision,fdv5s19,t3_en6hgs,1578743565.0,"Most of the pictures are just himself. And there are photos comparing his face from years ago. This piece of shit is the most narcissistic motherfucker I’ve ever seen, I bet he beats off to himself. Fucking degenerate."
Onision,fdse875,t3_emu10z,1578700668.0,"And the next day and the next day and the next day, he’ll be back."
Onision,fdsd6ly,t1_fds23hs,1578699944.0,No its Patrick.
Onision,fdsc61i,t3_emytbk,1578699242.0,Why
Onision,fdnx12l,t1_fdngetc,1578594571.0,Guess what Bob Ross is a scorpio too!
Onision,fdnvev4,t1_fdnrntl,1578593632.0,"Someone made a drawing of onision being mounted by blaire white, she tweeted it and got banned for it. 
Then in her debate against onion, he brought it up to victimize himself.

https://lolcow.farm/pt/res/332828.html"
Onision,fdn8pi5,t1_fdn4owr,1578580271.0,"Meh id rather not see someone like greg even recieve an ounce of infamy to have his very own documentary. To me i think he would see that as an achievement.

The dude should disappear all together be like a bad cringy thought you have once in a while. 

TRO and J Aubrey have made videos on Onision and those are probably the best documentary like coverage  I’ve seen. Those guys should get the support not netflix."
Onision,fdn40cp,t3_em86vx,1578576633.0,Lol as if they would waste time and money making a documentary about him.
aww,fdk3l7s,t3_elqyl4,1578495222.0,The way the video cuts off. Kills me everytime.
Onision,fdk3d0d,t3_elohjn,1578495063.0,"Man, i feel bad enough that people are wasting time making video edits on greg lol."
Onision,fdk38vj,t1_fdjqcmj,1578494982.0,Check out The Groomer Archives too. They demonitize themselves with a demonitization song so greg can’t get the moola.
Onision,fdk30tq,t1_fdjvsur,1578494825.0,"I don’t know if person C should be blamed, because they are being used to get to person A."
Onision,fdk2ohq,t1_fdjyr91,1578494582.0,Something lengthy that greg can hope to possess one day.
thesims,fdi4enr,t3_eldfrf,1578435536.0,They added this but not bunk beds lol.
Onision,fdh7ydn,t3_eky5mp,1578417330.0,"If I complete college before Onision gets arrested, I’ll be damned lol."
Onision,fdh6whn,t3_elaoix,1578416681.0,The story is so fake ass bullshit. The dog is obviously blaire white mounting him.
Onision,fdh6i1e,t1_fdh4s10,1578416427.0,"Its all fake man lol. I think the story with the dog is being so goddamn outlandish, he’s doing it to draw attention away from his husband."
Onision,fdg1fkk,t1_fdftxyh,1578376516.0,"I agree that onision getting all this attention isn’t a good thing since he can profit off of it. Whether these allegations are true or not,  the exposé of Onision keeps people from going being associated with him at all and can protect people from him in the future."
witcher,fdf18fx,t1_fbszsdc,1578351013.0,"I’m Asian and i’d rather have an all white cast out of respect for Polish culture to be honest. I don’t care about seeing asians in a european show. Its annoying tbh, theres less polish culture. It’d be like forcing black people into Dynasty Warriors or Journey to the West."
witcher,fdf0f3e,t1_fdelmlm,1578350499.0,To me Yen is perfect lol. The main cast choice is perfect  lol
witcher,fdf084w,t1_fdepnmm,1578350378.0,"The main thing is, how is Fringilla black when she’s related to Ciri lol."
witcher,fdf04at,t1_fdetjvb,1578350311.0,"They really did him fucking bad man. The dude was a man who led battles, he was ferocious, but they wanted game of thrones route and made him like some drunkard rip off robert baratheon. Pisses me off."
thesims,fd8u54d,t1_fd7wbzj,1578223376.0,HAHAAHAHAHA
Onision,fd60v9b,t3_ek03rt,1578183962.0,Shreg?
Onision,fd606fq,t3_ek4e0u,1578183715.0,"Dude his videos are fake. He’s still normal piece of shit Greg, he still has everything, you’re literally eating out of his hands. Just look at his main channel and twitter. His fraakput backgroundsngo from his house, to the wilds, to the car, to a hotel, and back to his house lmao, like its completely inconsistent. He’s trying to weave something stupid, but it all the more makes him look even more retarded."
Onision,fd1a2jo,t1_fd0xgrc,1578129013.0,"I’m confused in how you’re trying to misconstrue how the FBI didn’t have any hand in catching the Unabomber when they were the ones who found his cabin and arrested him. 

The brother played an important part in IDENTIFYING the Unabomber and allowing the FBI to pursue a warrant for his arrest.

Are you saying the FBI didn’t catch Ted Kraczynski  because they didn’t know who he is for numerous of years? 

Yes the wife had to convince Kaczynski brother, but only when the FBI decided to release his manifesto that made it public for the Kaczynskis brother to recognize his brothers handwritings. FBI were able to profile Kaczynski into finding out that he was a person of Academia. 

Idk how you’re saying the FBI didn’t  find the unabomber when they were behind the investigation, and they were the ones who arrested him. 

But i guess from what you’re trying to say, is that the FBI would’ve never caught him because what if his brother never turned himself in? I think that only delays the FBI because they were still able to profile him, but it would’ve taken longer in identifying him."
Onision,fcwtjrs,t1_fcw5fh6,1578037027.0,"The same way they found the UNABOMBER, a mathmatic genius who eluded the FBI for 17 years. If a mathematic genius couldn’t escape the FBI then how could Gregtard escape the FBI."
Onision,fcuirwe,t3_eiycv4,1577981937.0,"Probably some japanese in there cause Greg loves hentai.

Lets dissect his name. His name has two words in it. Oni  Sion

In Japanese Oni can mean demon, but knowing a Greg’s lust for Hentai Incest. So that means Oni could also be:

Onii-chan = big brother. 

Not sure Sion, but it has religious meanings in Hebrew."
Onision,fcszjde,t1_fcskp0c,1577929030.0,"Lmao does the FBI have to announce everytime they are investigating the mafia or a terrorist organization. HEY GUYS WE’RE INVESTIGATING JOHN GOTTI. WE PUT TAPS IN HIS HOUSE. HELLO WORLD.

“THERES NO PROOF FBI IS INVESTIGATING.”
Lmao I’m pretty sure thats what criminals thought before they were raided unexpectedly by the FBI.

And since Hansen has made it public FBI is investigating, why hasn’t their twitter account called out Chris? They have PR, they would’ve been like “BULLSHIT WHY WOULD WE GIVE A FUCK ABOUT ONISION.”

What the fuck dude, this sounds like fucking Onion Logic. 

“There’s no proof FBI is investigating Onision, if there is show evidence.” 

The fact that the FBI hasn’t denied or said anything at all means they wanna work under secrecy. Thats how they operate. If the FBI has to show evidence that kinda sounds counterintuitive.  

They want to catch fucking Greg. If they openly announce it, GrOG would be on the fucking run. Dude would stop posting. Dude would legit run to fucking Canada. The fact that Kai stopped posting is fucking big signs

You want to catch the rabbit before scaring it off."
Onision,fcohdk7,t1_fcnrb1q,1577832265.0,I’ve been able to lurk there and get some goid screenshots actually.
Onision,fclq41o,t1_fcknz8j,1577753739.0,O yeah you’re right bring back our boys Tobuscus and Logan Paul.
Onision,fclps7i,t1_fcleb7l,1577753512.0,He levelled up.
Onision,fclpo92,t3_ehqdcj,1577753436.0,"Dude what fuck did he shove his head up pikachu’s ass? Or did he steal a bunch of yellow highlighters from the local highschool. 

Seriously though looking at this piece of shits smug face pisses me off."
Onision,fclp1t8,t3_ehr8un,1577753006.0,"Either that, or his 18+ fans are people who genuinely have nothing better to do then to go to college or get a job. If his fans are really 18+ how do they find time to spend the rest of their day on discord waiting for onision to go on and watch his livestream. 

Can you imagine wasting your own fucking personal time listening to what comes out of this pos mouth. Like what in the absolute fuck."
Onision,fcjwl8f,t3_ehh4xh,1577708211.0,We must pollute the wetland behind his backyard  with Alligator Snapping Turtles.
Onision,fc6nnz8,t1_fc6frt2,1577484904.0,"Yeah and Hansen could give less of a shit even if onion claims him. Hansens got 6 Emmy awards, youtubers would suck dick for that kind of prestige."
Onision,fc6ezg6,t1_fc61y7m,1577478998.0,ShReg’s OniOn PlantAtion.
Onision,fc6eu5l,t3_egdn5f,1577478898.0," I’m 22 now, and it was in 2010 at the age of 13 when I discoverered the Onion. I was taking a massive shit in the bathroom. I brought in my parents laptop to watch youtube and I ran into his recommended videos.

I was bullied a lot as a kid cause I was a dweeb nerd. So when I was watching his video his attitude seemed kind of seemed interesting to me. I think one of his videos was when he was rating white girls wearing native american clothing, and shitting on them for it. I really thought wow this guy must really know what hes talking about, and a lot of girls must like him. His opinions are pretty right on."
Onision,fc6e5ep,t1_fc5wefs,1577478434.0,I’d prefer a pack of weenies over a pack of carrots.
Onision,fc6dw2y,t1_fc5stz3,1577478261.0,"THIS. Chris Hansen gets like 10+ mil views in his True Crime Daily videos. Hansen just wants to give people a platform to talk. I mean if he wanted to more views, he would go back to doing his True Crime Dailies. 

I think its the onion fans spreading this bullshit."
Onision,fc6csvi,t1_fc67dkh,1577477542.0,"Not likely, dude pitched a tent in his backyard."
Onision,fc6c5b4,t3_egfj1h,1577477130.0,HAHHAHA these onion freakout backgrounds are a new meme worthy templates.
killteam,fc58w8m,t1_fbsba57,1577449105.0,REEEEEEEEEE GOLLLEeeeGGEEEE
jerma985,fc58uqa,t3_efdzm2,1577449051.0,WEEEEEEEEEEEEED GOOOOLLLEEGGEEEE!??)
berserklejerk,fc4rsz7,t3_ef4w6t,1577426052.0,People are posting more dicks in this thread now.
berserklejerk,fc4rqmq,t3_efpdvl,1577425985.0,Put your grasses on
berserklejerk,fc4rq18,t3_efod82,1577425968.0,This guy’s kids gonna be a rainbow.
Onision,fc3iqmk,t1_fc2y0ia,1577390694.0,"Take a look at it like this, its all about charisma and subtle manipulation. Onision dances on the edges of line in which he could’ve actually ended up like a Charles Manson. He’s not the Charles Manson, but his tactics and mentality are subtle hints that skirts between the fine line of being a full fledge cult leader.

The main similarities between Manson and Onision is that he’s able to lure young woman to his house where he can control them. However the differences here is that Onion ultimately hates drugs. Manson used drugs to put his followers in further states of mental duress in where he could psychologically abuse them even further.

Both Manson and Onision have an alluring personality. Manson was a guitarist and singer whom had connections to the industry, as to Onion’s equivalency of immature antics that are funny to adolescents.

Onisions followers like to hear his fucking spiel because it probably suits their own personal views. Other cult leaders use popular radicalist ideologies to attract young and impressionable individuals. Mansons perspectives on hippie culture is comparable to Onion boys philosphy on veganism.

Jim Jones, another cult leader uses the same sort of tactic. Jones promoted racial diversity and adopted children of color. This attracted many people to his teachings because they seemed nuanced and open minded at the time. 

Onision does the exact same shit. The whole spiel with H3H3 shit talking BTS. Onion boy straight up in his tweets started sucking ever Kpop fans dick. 

The serious red flags is when cult leaders start to feel the enclosure of society collapsing on them. This is when followers leave the cult and start seeing that the Leader is full of shit. 

This triggers the leader and this is when they decide to leave society for good. They take their followers and isolate themselves from the world. 

Onision hasn’t done this yet, but as things get tighter its getting closer to these behaviors."
Onision,fc3dvnt,t3_efuyq1,1577387627.0,Delet this cancer.
Onision,fc0pk9y,t3_efi27r,1577296592.0,"Whenever I look at this piece of shits face, I hear Linkin Park’s Numb blaring in my ears."
Onision,fbyorhe,t1_fbyoead,1577222367.0,Well it wouldn’t make sense for Hansen to openly mislead us about the FBI investigation. If he did lie about it he would get nothing but backlash. All we can do is place faith in Hansen to actually pull through. I mean who else can we take the word for? Do other people have credible contact and worked with the FBI in the past? It could also be Onision and his fans spreading these opinions.
Onision,fbyo18g,t1_fbynibe,1577221825.0,"Trust me, he’s being investigated. Visiting his archived forums really made me feel like i was already tapped by the FBI. Those forums are truly disturbing. And the fact that he kept recreating his forums. We’d have to consider that this is the holidays too. No one wants to deal with an onion before christmas."
Onision,fbynlsm,t3_ef0hu3,1577221506.0,He slowly loks like smeagol erryday
Onision,fbynb94,t3_ef70x3,1577221287.0,"If the FBI are investigating Onision, imagine being the guy who has to do surveillance on  every Onion boys video routinely."
Onision,fbxg269,t3_eewxsz,1577185581.0,The joker fucks with multi billionaire vigilantes not abused traumatized girls.
Onision,fbtvwlh,t3_eehgcr,1577098719.0,Its raining poop.
