subreddit,self ID,parent ID,time,textHemophilia,fcihlwb,t3_ehcdht,1577662682.0,"I do not have joint problems so it's not going to be super helpful, but I lift weights (squats, deadlift, bench and overhead press, pullups) and run on an elliptical machine (for cardio)."
Hemophilia,fcihay3,t1_fci7dgn,1577662536.0,"I suspect you know this, but just in case: There is no such thing as 'spot reduction' -- exercising your abs does not help you lose weight around your stomach. You have to lose weight overall.

That said, swimming is a good recommendation."
newhampshire,fci9r5l,t1_fcgiqyx,1577659486.0,"This sounds like it could be fun and I’m not even a shooting enthusiast, I just like the outdoors. I hope you find a spot, and congratulations to the wedded couple to be. 

However, if I were a landlord: 10 young men + partying and probably booze + fire + guns + probable inexperience with said guns.... maybe not the first people to whom I’d rent my place.

Edit: I apologize, I see you have a lot of posts about guns  I jumped to conclusions because you didn’t mention what you wanted to shoot and were from out of state. Good luck!!"
antiMLM,fcf8z7v,t1_fcb4eaa,1577627689.0,"This is one of the things that make me have more empathy. Huns are doing a bad thing, but they are *victims* who are being *taken advantage of*. 

I’m a working professional with a graduate degree. I have plenty of money for bills. I have paid time off. I work outside the house and I feel my job is respected by society. But that’s not true for a lot of folks and it’s not fair for me to judge how someone in a shittier situation falls for a con specifically advertised to them. 

Folks like me fall for scams too, teyre just *different* scams."
antiMLM,fceucln,t1_fcb6tj4,1577623869.0,They charge you to*check your balance?* That’s nuts. Right? I don’t usually use my debit card and my bank has an app. Do other debit cards charge for that?
newhampshire,fce0m1v,t1_fcc9lk5,1577615712.0,That’s their biggest loss. People used to rave about craftsman tools and say good things about kenmore appliances. Not any more! You can’t fix losing your reputation.
DeathByMillennial,fcbxqe8,t1_fcaygsg,1577592145.0,"
>	The biggest thing is — I don’t get “involved” on FB anymore. I’d rather engage in enlightened debate on Reddit if the urge hits me.


Amen! Also it is hard for me to criticize anyone’s social media usage when I have a 25k karma Reddit account. I spend a lot hours here!"
AskMenOver30,fcb982p,t3_ef4ovu,1577584010.0,"I've been through at least two big moves as an adult (one in mid mid 20s, one in my mid 30s, about 5 years ago) and in both cases [meetup.com](https://meetup.com) worked wonderfully for both me and my wife. We joined some groups that we were interested in, and though the official groups have long since dissolved (they seem to have a 2-3 year lifetime) we've stayed close with a handful of friends in each group. Denver should have a large enough population for it to work (friends moving to small towns report that there are not enough people online to form a critical mass)."
antiMLM,fcaw0j2,t1_fc8bhex,1577577714.0,"LL row names their products after women’s names. It names its menswear products after men’s names. 

Big missed opportunity for equal opportunity names and nicknames. Skip. Riley. Charlie."
DeathByMillennial,fca1gz5,t1_fc97ieb,1577561533.0,"Edit: I am an older millennial 

Well yeah, every generation has its own ways of communicating, and Facebook and its users grew up together so the aesthetic and the language evolved with and are matched to the original users. When I was younger I was not pleased when the olds started signing up (originally it was a college student only thing). Then I woke up and I was myself old!

Seriously though, Facebook is only one platform. More interesting is how usage trends change overall. As others pointed out, Snapchat, tiktok, etc are very popular. But they’re more ephemeral, which is a legit difference."
DeathByMillennial,fca0fgy,t1_fc98htp,1577560942.0,"As an older millennial, I’ve reduced my Facebook usage dramatically in the last couple years, and this was a big part of it. Connecting with distant loved ones is one thing. Reading people’s repugnant political views is another."
antiMLM,fc972jl,t1_fc96gwl,1577548067.0,"Hi! Yeah, if you know that mall, that description is *very*  specific. :-)"
antiMLM,fc8lhzr,t1_fc7u2ji,1577537395.0,I see mostly card tables in there but retail-grade clothes racks aren’t cheap either. I was in a store that was liquidating to where even the racks and hardware had price stickers and they were still hundreds of dollars. Maybe the ones in the pictures were already there though.
antiMLM,fc8kw2o,t1_fc88xx7,1577537039.0,"Or a same-sex partner ... just kidding, MLMs are as old fashioned AF when it comes to that kind of thing. I’m straight so maybe I’m missing the signals, but I haven’t seen any ad copy or hun copy-pastes that are evenly remotely up-to-date about gender, sexuality, or roles."
antiMLM,fc8j2qq,t1_fc88pfq,1577535997.0,"Ours survived by being in a no sales-tax state but on the border (literally: state line is in the parking lot) with a high tax state. It has a jc penny, and a soon to be closed sears. These are always empty. But it also has a few other productive anchors (target, dicks, and Macy’s) — and an Apple store and a coach retail store, for which tax avoidance is definitely worth the drive!

Still, it might die as it loses sears. The mall is always busy but but that’s a lot of rent to lose unless they have another anchor lined up.

Edit: the real loss for me is the sears auto center. They were competent (at least for maintenance) and charged fair prices, neither the cheapest or most expensive. *However*, you could shop at the mall, even get groceries at target, while waiting for your car to be done. Much better than sitting on a rotting chair in a tiny waiting room in the bad part of town."
todayilearned,fc5fq34,t1_fc5dydt,1577456281.0,See [definition 2](https://www.merriam-webster.com/dictionary/meat). Some  English speakers use the word “meat” used to mean mammals only. “Poultry” it “fowl “ means birds. Mostly this is an older way to speak.
mildlyinteresting,fc5afy5,t1_fc5516x,1577451011.0,"I’ve never seen them on the street in the US, but I see them in public buildings all the time (more often than I see fire extinguishers ). So whether it helps or not, there’s international agreement that is a good idea."
todayilearned,fc54kmn,t1_fc43tvm,1577442829.0,"And this language is odd too. In my grandparent’s generation, and some religious circles, poultry is not meat. Meat specifically means the flesh of animals. You can say you don’t eat meat, and still be served chicken."
antiMLM,fc2kgs7,t1_fc26qnv,1577364762.0,"Forget MLMs, even if I’m just walking the mall people will try to sell me makeup or fragrance from the temporary kiosks or even the beauty sections of legit stores. I’m a nearly 40 year old, conventionally masculine man, and the pitch is always about a woman in my life (wife, mother, daughter) who would love what is being sold. I have no idea about quality or price. I *am*  suspicious that the harder someone has to work to sell something, the less desirable it is — after all, no one is selling iPhones or Coach handbags by yelling at shoppers from mall kiosks. I just decided I won’t buy makeup as a gift. No one has complained."
