subreddit,self ID,parent ID,time,text
antiMLM,ffgc672,t1_fffmdit,1579902994.0,"Also, powdered peanut butter."
antiMLM,ffg3t13,t1_fff097i,1579897846.0,"The delayed gratification is part of it. By the time the cookies come in, you have forgotten you ordered them, so they are pleasant surprise. It is kind of like how online shopping used to be before they invented Amazon prime. You’d buy a bunch of shit online, forget about it, and then a couple weeks later suddenly you’d start receiving surprise gifts in the mail."
instantpot,ffg35vw,t3_esnw1p,1579897453.0,"I had some sense of what to expect, so I wasn’t surprised, but you’re not wrong. It’s *faster*, not fast. The recipes I’ve tried so far are still too slow for weeknight cooking, assuming the cook works outside the home. But, you can make giant amounts of food, so if you have a lot of mouths to feed or tolerate eating the same thing repeatedly you can do well with weekend prep. Also, it’s less attention-intensive. I made a chili the other night I usually make on the stove. I didn’t save any time. But, I didn’t have to stir or watch the stove or even stay in the kitchen. 

The rice button works great on mine but it’s a zavor, not an IP. Haven’t tried the other buttons. 

The challenge is the things pressure cookers do well (large pieces of poor-quality meat, giant vats of stew, dishes made from raw beans) are not foods I usually eat. Partly because these are traditionally time consuming and partly because I didn’t grow up eating these things. 

Time will tell whether this gets regular use or ends up like the bread maker (worst purchase ever)."
instantpot,ffg0npv,t1_fffnzgd,1579895907.0,At our work we have a big carton of a fish with a slash through it over the microwave in our break room.
antiMLM,fff079b,t1_ffezqob,1579872004.0,I agree. I guess my point is dealing with people who talk too much does not need to be difficult. :-)
newhampshire,ffexnej,t1_ffcvpda,1579869597.0,"Ha!

Seriously though, it’s a human flaw, not an intelligence thing.  Humans look at what popular people are doing and take it more seriously than what random unpopular people are doing. That’s why celebrity product endorsements have been a thing, as far as I know, forever. Don’t know what the solution is."
newhampshire,ffex5a3,t1_ffdvi2e,1579869087.0,"I grew up in the finger lakes. Culturally and geographically (and weather!) NH feels a lot like upstate NY so I think you’ll do well and have the right expectations (caveat, Ithaca itself does not have a typical NY culture). 

 I guess it’s personal preference but I think commute affects quality of life in a big way. I work in Merrimack and Nashua so I live in Nashua, easy drive. I have good highway access, water, sewer, and natural gas utilities, but I’m in a suburb with plenty of space. Manchester might be great for you if you’re also doing East/west travel."
antiMLM,ffew1e5,t1_ffem6qv,1579867918.0,"I’m assuming, by marketing to people who don’t already buy protein powder. Protein powder is one of those things that either you buy it regularly or you’ve never bought it ever. If you buy it regularly you know what brands taste the best and what sites are good to order from and how much it costs. But if you don’t buy it...  you have no tools for evaluating price or quality."
antiMLM,ffev37t,t1_ffeiyov,1579866821.0,"I work with engineers. Being on the spectrum is pretty common. I just say, “I’m sorry x, I need to stop talking now because I need to focus on finishing some work. Maybe we can talk more later.” (If it’s a work relevant conversation, I’ll offer to set up a meeting in outlook.)

I’ve never had anyone seem insulted."
PropagandaPosters,ffeu7gp,t1_ff8qz66,1579865727.0,"I never understood why people were so uncomfortable with this quote, which I shows I’m more sympathetic to the philosophy than I realize. If she said, “I want open borders in the next four years” yeah I think you’re right the consequences would be rough for the US, and I say that as someone who generally supports immigration for economic and moral reasons.  But as dreams go, *of course* the ideal state of the world is open borders, just as an ideal world has no nukes, or has a free press in every country, or any number of seemingly impossible goals we can nonetheless move toward together."
antiMLM,ffbr70i,t1_ffaxbf2,1579779512.0,"I’m soon to be a new dad, and I worry about this. Not MLMs specifically, but while some of my friends who became parents are the same people, a few had complete personality changes where suddenly they believe all kinds of nonsense  that they would have been skeptical about before.  Silly health tips, questionable financial advice, obviously dishonest political ads, you name it."
antiMLM,ff8r1o3,t1_ff8mizb,1579692588.0,"I think the US and Papua New Guinea are the only countries in the world that don’t require paid leave, but I didn’t want an internet fact checker to call me out on an exception, so I made a weaker claim. :-)"
antiMLM,ff8gepf,t1_ff7tw36,1579677320.0,"Right, there’s no law requiring paid leave, and even our unpaid leave system only applies to companies of a certain size. If you’re from another wealthy country in Europe or something the US is barbaric by comparison."
antiMLM,ff4ko09,t3_erku97,1579565929.0,"This is meaningless, but I’ve never noticed this meme features a real life pill. You can look it up in pill identifier websites. That’s an acetaminophen/oxycodone pill."
antiMLM,fez7tkv,t1_fez4s0r,1579454583.0,"I haven’t seen one of those before so I don’t know. But yeah, it does kind of 
have that feel, doesn’t it"
PoliticalDiscussion,feykc04,t1_fekgisf,1579446675.0,"I like booker’s sincere service-mindedness and optimistic disposition, but I don’t know that he’s ideologically that close to Bernie. As far as the “have never won” argument, the Democrats have also never won with a woman candidate or a socialist candidate or an openly gay candidate, and so on. If a non-Biden candidate is nominated there will probably already be enough novelty that historical wisdom is hard to reconcile!"
newhampshire,fexxj6w,t1_fet0sk9,1579437955.0,"I agree, my experience of my NH people *in real life* is it’s just playful rivalry, only online do I see seeming hatred. I guess the caveat though is I live in Nashua and rarely go north of Manchester, so I’m near the border. Though most NH natives live in the south part of the state too."
newhampshire,fexwji1,t1_ferrdnr,1579437642.0,"I have to agree with you. I moved from NJ/NYC and though those drivers are aggressive and contemptuous of traffic laws and are heavy with the horn Boston is much *angrier*. Only place I’ve seen actual road rage too (people cursing at each other between cars, passing and braking)."
antiMLM,feuc5hk,t1_fet1kay,1579385181.0,"You are fortunate. Our state requires no coverage for fertility treatment of any kind. Although, this is supposedly going to change; there's a new law (like all new laws, it's not clear how the details and exceptions will work out)."
antiMLM,feubloz,t1_fes5wpe,1579384981.0,"Ugh, depending on what the particular challenge is, if not covered by insurance (most insurance doesn't) it can be multiple tens of thousands of dollars for the first attempt. Unfortunately this is like modern real estate prices in that advice to get a job and skip the avocado toast kindof trivializes just how high the costs are and how hard they are to meet. Buuttt MLMs are certainly NOT the answer.

Edit: not saying you were intentionally trivializing the challenge or the solution, that's just how I reacted"
GetMotivated,fetrfa5,t1_fethr93,1579378892.0,">	...People who go on to be doctors have a very strong drive and tend to be surrounded with people that also have a strong drive. 

I suspect this is true. I’m not a doctor, but I do find most of my social circle has similar intelligence and ambition. Some of us make more money than others (different professions, or work for nonprofit vs for profit employers) but the same capacity and intensity is there. I bet most doctors will find their non-doctor friends to have done well (whether that means money or not will depend on that person’s goals).

Edit: also, it’s really hard to hang out with people with way more or way less ambition. Doesn’t have to be work ambition; it could be art or hobbies or fitness. But a mismatch in drive is hard to live with"
newhampshire,ferk7pd,t1_felq9qy,1579354951.0,"Sincere question, is there’s no mechanism for impeachment or special elections? Not saying either is a good idea I just assumed there’s always some way to get people out of elected positions if there’s legal trouble.  Maybe there isn’t."
newhampshire,ferizqs,t1_femj0md,1579354502.0,"You might think so. But according to my friends who have worked campaigns (in other states), no. They have limited resources. They want to spend time and money making sure supporters actually vote and persuading maybes to change to yeses. Repeated harassment of people who definitely will never support you is a really bad strategy for winning and a poor use of time."
newhampshire,ferhoro,t1_fekxuly,1579354009.0,"Yeah, it’s just that time of year! I get two or three political texts a week, ugh. It’s just the other major party doesn’t have a competitive primary. If your standard for politicians is they aren’t allowed to have annoying supporters or do political advertising... I think you’ll run out of people to vote for real quick."
antiMLM,fer8vet,t1_feq6kcv,1579351285.0,"I think part of the these books’ message is “you are smarter about money than other people and know the secret about how the world works”. Speaking purely anecdotally, it seems like men are particularly vulnerable to this kind of pride “I am the one lion in a world of sheep” and are really attracted to the idea there’s some secret information or secret club that leads to success. Which may be why this organization does better with men."
television,fend5q7,t1_fenavpb,1579282147.0,"My understanding is yes, many people do have bad experiences with doctors, whom until recently were not trained to  be socially or emotionally supportive, and at least in the US provide seemingly rushed care (I think the median doctor visit is 15-16 minutes) for prices that make this overpriced woo seem like pocket change. People have needs beyond just the physical, and that’s assuming the physical is taken care of, which is a big assumption!"
antiMLM,fekk2jw,t1_fej86zz,1579201690.0,"Not a bad idea. People who leave restrictive religious groups have these, for similar reasons"
science,fek59ru,t1_fek51zt,1579192896.0,"Exactly my point. People don’t like to unite, common enemy or not"
science,fek4pfp,t1_feih17x,1579192554.0,"Counterpoint, though. 1940s America, united in wwii. 1950s-1980s America, Cold War, people literally thought russian bombs were coming any minute. But racism in America sure as hell didn’t go away for 1940-1990."
aww,fejmvuw,t1_fej9im1,1579180237.0,"Or even just being in the same room. My moms cat doesn’t like touching. Yet he will always choose to be in the room where the people are, even though he could go anywhere in the house."
newhampshire,fef8hlq,t1_feegsu7,1579050678.0,"As discussed further down, you can do it at least a little early which is pretty handy. My wife and I have nov/dec birthdays and it is always a pain in the butt to do registration and inspection during the holidays, so we take care of it earlier."
SlaughteredByScience,fee2ras,t1_f5sn2z8,1579025190.0,The old saying is “safety standards are written in blood”.
OutOfTheLoop,fecjehr,t1_fecb5yr,1578975353.0,"That’s what it feels like to me! (I edited my comment to be less dickish, but yours should still make sense)."
OutOfTheLoop,fec9ep3,t1_febd7qq,1578968995.0,"
Edit: I was unfairly provocative in my original comment. But I do think people turn to woo because of a dissatisfaction that isn’t being addressed combined with a disillusionment with non-woo institutions. If people are healthy, have confidence in the future, and are plugged into supportive communities, I don’t think there’s the same appeal. And we live in dissatisfying and disillusioning times."
explainlikeimfive,febvtki,t1_fe3zcir,1578963340.0,That too!
antiMLM,fe8pszj,t1_fe6amsu,1578929073.0,"Yeah, apparently that’s a point of pride in the CrossFit community too. They even have a puking cartoon character mascot you can get on things."
explainlikeimfive,fe368ad,t1_fe2nvcs,1578846362.0,"I suspect print stays alive partly because no one has figured out (or had a business case for) infinitely resellable, giftable ebooks. Technologically I think electronic media is superior in many ways, but it isn’t cheap enough when you consider the lack of a used market, the cost of phones and other readers, and the lack of confidence that an ebook you buy today will be readable 20 years from now."
newhampshire,fe205u7,t1_fdxdrj2,1578833012.0,"True, but not all places are equally boring. I couldn’t wait to get out of my small town and I’m glad I did. As a 40 year old with a family, I can stick around in NH, but I don’t fault a young person wanting somewhere a little more populated, a little more active. I work for a company that hires young technical professionals, and it’s legitimately challenging to hire people to move here if they don’t already have connections to the area. That’s not a negative judgment, just a statement of fact."
antiMLM,fe1xyug,t1_fe1glwz,1578832182.0,"Wow, they ripped off an artist’s work, *including the artist’s watermark *? That’s actually impressive in its audacity.

Edit: typos"
witcher,fe1vhjl,t1_fdzyiu0,1578831340.0,"This is a common RPG trope, and I think it’s fun, but I do think I played some game in the 90s where time would progress and the game could become nearly unbeatable if you took too long. I can’t remember anything else though so maybe I imagined it."
witcher,fe1u50h,t1_fe0u6vh,1578830869.0,">	Geralt is so good because he is a established character with flaws, lusts and goals. It is the story that truly makes Witcher good and binds the whole game together, and the story is carried by the very well written characters and connections between them.

I agree so much with this and I’m delighted to see someone else say it. I’m convinced the storytelling is so good in the Witcher because of this, and it’s a great RPG *because* of the limitations on player choice. It completely changed what I want from a story-based game."
witcher,fe1svse,t1_fe0pz8a,1578830466.0,"I like Kiera in the game even though she’s a one-time fling. I find her arrogance and self-centered manipulativeness strangely appealing, and I like her in-game look. Yes, I made some questionable choices about who I was after when I was younger."
witcher,fe1qgwx,t1_fc02qh6,1578829630.0,"It’s generational. The 80s and maybe even the early 90s really did limit deep enjoyment of fantasy and science fiction to social misfits, computers were nerdy, and video games were for children and emotionally stunted men. The mainstream enjoyment of speculative fiction and the total revolution in how kids who like technology and robots are treated are amazing changes to see in my lifetime. But I guess some folk in my and my parents generation haven’t noticed."
witcher,fe1mda7,t1_fbr6neb,1578828294.0,"I’m no fan of resource gathering, so I was a big fan of this game mechanic, as ridiculous as it may be. Also, let’s take a minute to acknowledge that we can accept a fictional work with superhuman mutant monster killers and an interdimensional beastiary, but we know homeopathy is too ridiculous to be believed even fiction. And yet people in real life do believe in that shit!"
Cooking,fdwya8s,t1_fdw7ntf,1578763466.0,"That’s fair, I guess. I’m mostly thinking of cooks illustrated (which is owned by the same company) but I’m amateur enough that I might not be good judge."
television,fdvzfig,t1_fdsq7r2,1578753468.0,"Just starting the books now, so I’ll have to wait and see. I love Gaunter O’Dimm though, and he’s supposedly a cdprojekt red creation."
television,fdvybwa,t1_fds9l7a,1578753158.0,">	It’s so clearly very different people, different characters...that I had no idea the narrator was dandelion until like 200hrs in...

No kidding! I must have missed this reveal because I beat the game and expansions and only now, when reading your comment, am finding out. No way are they the same person"
InfowarriorRides,fdvsfk3,t1_fdv0hy5,1578751039.0,I’m not a vet but interact with many through work (defense contractor). I always thought it interesting that the people most passionate about stolen valor (or for that matter the flag code) are not the vets.
Cooking,fdv68ip,t1_fdtblwh,1578743793.0,"Cooks Illustrated / America’s test kitchen is also amazing, though they have a slight tendency to over complicate things (for a home cook thats trying to feed people quickly after work). Every recipe I’ve tried has been great. They do have long descriptions but they’re educational and not random human interest stuff."
AppleWatch,fdqn8xd,t1_fdqg89u,1578670666.0,Thanks! My wife always says I’m fidgety. It explains why it is so easy to hit exercise and stand goals even though I have a sedentary job
AppleWatch,fdqfwil,t1_fdoh9f3,1578665647.0,"I thought that was the activity tracker, but the exercise tracker worked on heart rate?"
Cooking,fdqffu5,t3_emmj8i,1578665300.0,"I don’t love boxed Mac n cheese, but I completely agree with the philosophy that you can enjoy food even if is not gourmet or authentic. My generation (millennial), especially in online food communities, seems to worship cultural authenticity or culinary “correctness”. But you know, I like general tso chicken and I don’t care that it’s not Chinese. And I like ground beef tacos made with grocery store seasoning packets and topped with cheddar cheese.  Not everything has to honor cultural or culinary history or treat cooking like an aspirational art."
intermittentfasting,fdq6kee,t3_emoqme,1578657066.0,"I started a 16:8 fast about a week ago. I also feel low energy during the fast and feel less focused, and irritable; I have definitely not felt the energy thing yet. Obviously there’s people who don’t eat breakfast anyway and do fine, but I’ve always been a big breakfast person so maybe I’m still not used to it. 

The headaches and nausea could be dehydration? I find I have to be more intentional about drinking water during the morning because I’m not drinking anything with a meal."
aww,fdng0qx,t1_fdmj2s4,1578585018.0,Friskies has a “cat fishing” game too that works well on iPads.
AppleWatch,fdn3e6y,t1_fdmgzgn,1578576109.0,"Definitely heart rate. By comparison I have a high resting heart rate in the high 70s or low 80s, and sometimes I get exercise credit just for walking around my house, which doesn’t seem right either!"
antiMLM,fdkf03h,t1_fdies94,1578502470.0,"The idea that poor and rich folk deserve their fate is *very* deeply embedded in American culture. We want to believe anyone can succeed and it’s hard for us to admit how much your parents’ wealth, the town you were born in, let alone the color of your skin, influence how things work out. If success and failure is all about personal effort and righteousness we don’t have to think about sad things."
TwoXChromosomes,fdk70kc,t1_fdj6558,1578497525.0,"I have a couple rare diseases that have always meant driving to the nearest city of 300,000 or more to get service from the university-affiliated teaching hospital. I’ve always had amazing service from my specialty docs! Not as much from regular GPs, but I’m happy with the one I have now. I have to admit though both my and my insurance costs for the specialty treatment is much higher; you get what you pay for I guess."
television,fdfbzij,t1_fdcuroy,1578358108.0,Neat! Fascinating
antiMLM,fdequ6t,t1_fddeumn,1578344697.0,"Oh shit, I remember that. I must be getting old."
television,fdcov8x,t1_fdchutn,1578280306.0,"I like this interpretation because real life cultures have rituals where one is obligated to offer something but the other person (following cultural norms) is not expected to accept, or at least expected to apply some friendly judgement to how they interpret the offer. Witchers and sorceresses with their child-acquiring ways may be indulging in a crueler application of the rule. 

Between normal folk, I could imagine even if there was a surprise child or windfall , that award might be politely overlooked in favor of a more mundane surprise nearby. 

I am not sure this is how the universe works (as someone else said, fate/destiny is real in the Witcher)  but Im trying to imagine how this law would actually work with human behavior."
television,fdcd3tu,t1_fdc48hc,1578271983.0,"I think part of the confusion is that in the real world (outside the Witcher universe) that'd be an insane way to do business, for all parties, so your brain rejects it and says ""that can't possibly be how it works"". Now, real life human cultures have come up with some crazy traditions around honor and indebtedness so it isn't completely inconceivable once you buy into it, but I think it takes a while to suspend disbelief / accept this is how the Witcher universe works."
television,fdc1nh5,t1_fdc1041,1578265352.0,"I think that's a good thing to remember. When you are watching a new fantasy fresh, you don't know what is important yet. Which names are important to remember and which are not? Do I need to be paying attention to what the monsters are called and their lore? Do I need to be paying to political factions? That's not obvious to someone new to the world. A new viewer doesn't even know who the main characters are, beyond Geralt himself."
television,fdc16hu,t1_fdampl0,1578265101.0,"Even with my familiarity with the world, the time jumps were confusing. If I didn't already know the key parts of the plot it would have been *very* confusing. I'll admit I'm not a fan of nonlinear story telling in general, but if they were going to go that way, they should have made it a little bit clearer."
television,fdbhg9z,t1_fbiu58d,1578257460.0,"I had solid ""witcher 3 video game + online wiki"" knowledge of the universe, and now have started reading the books. I could figure it out, but I agree with you that the nonlinear storytelling is confusing and I think it is a 100% fair criticism from someone not already familiar with the characters and story."
television,fdbgz66,t1_fbhb7xh,1578257287.0,"Aside from the one required Gwent mission, I avoided all Gwent. I hate deck building games with a firey passion both ingame and in real life! No beef with people who like other things, though! I'm just glad I could successfully avoid (most) of it."
aww,fcxaqad,t1_fcwsqlg,1578057603.0,"I lift at home. First time I did a bench press after getting the equipment, my cat jumped on my chest and started nuzzling my face. Fortunately it was just a practice/warm up lift to remind myself of what I was doing and to make sure the spotter bars were at the right height, because it definitely wasn’t a safe situation for either of us.

Edit: other dangerous situation: first time I did squats while listening to a comedy podcast. Really hard to keep a tight core while laughing"
news,fcu2lfq,t1_fct4l9t,1577970575.0,"I think part of what happens is the “spread” between humans widens again. Infants, children, and even teens can vary widely in mental ability and social maturity even at the same age. Then in middle adult hood, people level out. A 25 and a 45 year old might have different life experience, but they probably won’t have significantly different social intelligence or self control. Then once senescence sets in, people again vary dramatically, so that there are some 70 year olds in better mental and sometimes physical shape than some 55 year olds, and vice versa. 

I don’t think this is a reason not to expect much. Or at least, if bad behavior is expected, doesn’t mean it should be tolerated."
LifeProTips,fcq9a8k,t1_fcq6yju,1577881437.0,"I *thought* I had, but maybe the preferences options changed in the many years since I last looked. Or maybe I simply forgot.  That’s how they get you. :-|"
XVcrosstrek,fcn5d0i,t1_fcl4bgg,1577803699.0,"Mine was effortless too. I was due for an oil change, tire rotation, and state inspection (normally I wouldn’t go to a dealer for these) so when I got the recall notice I was able to make an appointment within a few days notice and was in and out in no more time than an oil change and rotation usually takes (I’m assuming there was no damage and they just had to do the software). 

I did jump on it right away though. Got notices through the smartphone app and had it fixed well before the paper mailing came out."
science,fcl5buv,t1_fcl1y8m,1577740141.0,"The American version of the phrase is also penny wise, pound foolish. Or at least I’ve never heard anything else. It’s just less obvious to an American speaker where the expression comes from. :-)"
todayilearned,fcimjnc,t1_fcich43,1577665065.0,"I grew up Protestant, but as I've met Catholics I've come to believe that like Judaism, Catholicism is as much a cultural identity as it is a belief system. Especially in ethnic families (Irish, Italian) the rites and traditions of the catholic church (and participation in them) is a big part of the family and community experience, but don't necessarily require belief."
