subreddit,self ID,parent ID,time,textworldpolitics,fe0768r,t1_fdzqmkj,1578804841.0,"As the other guy said it's a system funded by taxes. Ask any libertarian, they'll tell you taxes are fundamentally socialism.

But it goes further than that. The US military provides cheap housing for its employees, it provides them with universal healthcare and pays for a lot (most?) of their higher education.

I'm not disparaging this. Just pointing out that the US government and many on the right are happy to engage in this form of socialism.

Even the most ardent capitalist wouldn't advocate letting the market run the military. Here in the UK after WW2 it was decided that national health was too important to let it be a profit driven exercise."
worldpolitics,fdyjb9b,t1_fdy9u7k,1578780404.0,Yeah it is.
Showerthoughts,fdyixq6,t1_fdy8fhi,1578780259.0,">who cares about how we farm chickens

Hi. I do.

OP is still an idiot tho."
worldbuilding,fdy8dcc,t3_end3ty,1578777128.0,"People argue that the moment we perfect age extension medical technology (or cure aging) our population will go through the roof.

I'm not so sure. If couples didn't have the looming threat of the menopause over their heads I don't think they'll be in any rush to reproduce."
worldpolitics,fdxl39o,t1_fdxjdvi,1578770056.0,Your military is the most expensive socialist scheme on the planet.
worldpolitics,fdxilyz,t1_fdwx99a,1578769053.0,"Lol. The crisis the NHS is suffering from is political underfunding.

Also, private health care is also available in the UK, yet very few people choose to pay extra for it... because all in all the NHS is pretty good."
Scotland,fdxa61t,t1_fdwy37v,1578766840.0,"Glasgow isn't a signatory of the Act of Union 1707.

You're talking shite."
Scotland,fdx9z24,t1_fdwv6vo,1578766783.0,Google the McCrone Report.
worldbuilding,fds9kqy,t3_emxs3f,1578697497.0,"As others have said it basically depends on a few things. You're probably not going to have to get too detailed if they're short stories or if they are set a long time after the apocalypse.

However, I will say this as someone who adores the subgenre and has read/watched/played many post apoc stories... I feel as if the writer has left out too much info much more often than I feel they've put too much in.

My Fall is pretty detailed... but that has more to do with the rather worrying sadistic glee I got plotting out the fall of our society!"
scifi,fdrgp72,t1_fdr9f7k,1578684263.0,">He made Star Trek movies that were very Star Wars,

Which were shite.

>and Star Wars movies that were exactly what a Star Wars movie should be.

Which were also shite.

>It was a good choice.

It was a shite choice.

Abrams hasn't done anything decent since Super8."
TheExpanse,fdrf0ns,t1_fdreoll,1578683642.0,I haven't read the books (yet)... why is this? Book Ashford less war-weary and empathic?
