subreddit,self ID,parent ID,time,text
spaceengineers,ffmjcfh,t1_ffmfubb,1580055476.0,"Lol.

Basically it has to be that way for the story I think. I think in the shows the say the Federation is about a thousand light years across."
worldbuilding,ffmdutt,t1_ffm5m87,1580053133.0,"Ohhh. I think I gotta be a bit nitpicky here, sorry.

Afaik there are examples of extremophiles who can *survive exposure to vacuum* but that's not the same as living in space imo even if they can do it in an inert form for potentially forever.

Nothing we know of can feed, procreate, thrive etc in a vacuum."
spaceengineers,ffmcnzb,t1_fflvko4,1580052439.0,"No, Warp 1 is the speed of light, yes. But then after that it goes up exponentially (or is it logarithmically?)

Either way, you end up with Warp 10 being infinite speed. 

https://memory-alpha.fandom.com/wiki/Warp_factor"
spaceengineers,fflcvn5,t1_ffj61mi,1580037870.0,Warp 10 is infinite speed. So. It would take exactly 0 seconds I believe...
news,ffjprip,t1_ffjivwe,1580003871.0,Of course not. He's poor and brown.
startrek,ffhtcvs,t3_etpf7i,1579952892.0,"I cautiously liked it.

I've been waiting for a post-VOY TV series for twenty years, and I don't feel let down.

I have no issue with the andoird uprising or Starfleet going downhill. It seems we may be getting a ""fight for the ideals of the federation"" and there's nothing wrong with that. DS9 did it and did it very well.

The episode *was* messy. There was a lot of information and emotions thrown at us in 45mins. But in comparison to other pilots? It's better than Farpoint. And probably on par with DS9's and VOY's premieres."
insanepeoplefacebook,ffhsqf0,t1_ffhj8eq,1579951971.0,I can't speak about that particular event but what the guy is describing is basically lobbying. Which happens everyday in DC.
nextfuckinglevel,ffh287k,t1_ffh20zw,1579921138.0,Scrobbles.
space,ffgwd0o,t1_ffgrjl6,1579916739.0,The shuttle Enterprise was specifically renamed after a campaign by Trekkies.
politics,fffwop6,t1_fffthw1,1579893447.0,"My opinion of.... history?

Lol. Okay dokey."
politics,fffwjpo,t1_fffva27,1579893360.0,"Wasn't talking to you, arsehole."
politics,ffftdto,t1_fffrdwv,1579891384.0,I'm not from the States.
UpliftingNews,ffftaua,t1_fffqq4y,1579891332.0,"Ah yes. I do see that comment.

Sorry, I didn't mean to imply I'm calling for the end of capitalism.

>but how to do that without heavily affecting economic growth/standards of living is the $100 trillion question

Agreed. I wish I had the answer. Buying locally is one part of it I think. The amount of products and produce flown and shipped around the planet is obscene.

But of course I'm a hypocrite, as I'm typing this out in Europe on a smartphone made in Asia..."
UpliftingNews,fffplh3,t1_fffpcnp,1579889039.0,"Who said do away with capitalism?

I just want it reformed to we include the sums from the damage done to the environment.

Have a look at ""environmental full cost accounting"".

I have a feeling we may be arguing past each other.... (:"
politics,fffp5gk,t1_fffnaji,1579888764.0,Lmao. It's all available on your favourite search engine. Roflmao.
UpliftingNews,fffolmn,t1_fffmxh0,1579888425.0,"Our capitalist system is deeply flawed because it doesn't take into account the damage done to the environment nor the free work the environment does for corporations.

I'm sorry, but the belief that ""the market"" can solve global warming without being remade from the bottom up is very naive."
scifiwriting,fffmy1g,t1_fffid02,1579887424.0,"There could be other factors in play but lack of light pollution won't affect it imo.

Where I live there's virtually no light pollution and I still can't see the stars until I turn the inside lights off."
politics,fffmke9,t1_fffmb76,1579887190.0,"Got any proof it's still run by Dems?

Your parties switched when the republicans decided being evil would win them votes."
politics,fffmeem,t1_fffa6oi,1579887088.0,pseudo*
atheism,fffgv0c,t1_fffea6p,1579883676.0,">It might not cause psychosis but when you’re running up the street naked you’re either going to be shot by the cops or put in a psych ward.


I think you need to add *""...in America""* to the end of that sentence."
atheism,fffgk3u,t1_fff0scc,1579883487.0,You're right.... so the downvotes are confusing me.
Malazan,fffcutb,t1_fffbryi,1579881158.0,"Yeah, I really like Page. But his Icarium is a nasally and annoying little shitebag."
watchpeoplesurvive,fff1f10,t1_ffewt2n,1579873043.0,He was shot in both legs. A few centimetres off and it could have nicked his major arteries. If that was the case he'd bled out in a few minutes.
podcasts,ffewxh5,t3_et0k48,1579868862.0,"I got to know Duncan through his appearances on Harmontown.

Imo he is one of the nicest, friendliest and kind human beings on the face of the planet. 

I've always meant to get into his podcast. Thanks for the reminder OP. (:"
PoliticalHumor,ff945zo,t1_ff93urc,1579704412.0,That's because your healthcare system is one of the least efficient on the planet buddy.
PoliticalHumor,ff943ml,t1_ff92bys,1579704366.0,"Awesome. Lazy degenerates.

Got any other pearls of wisdom is that empty excuse for a brain?"
worldbuilding,ff5twf7,t3_errnvo,1579610083.0,"**The Horde Invasion**

The period that is my current present was meant to be a time of relative peace in my post-apocalyptic Europe. 

The decade long Slaver War was finally over with the last slaver state capitulating and agreeing to outlaw slavery. 

It was only a few months later that the rumour spread across Asia Minor that the so-called Holy Horde, a million strong cannibalistic and apocalyptic cult had left the Middle East and was marching for Istanbul.

The major western powers of the New Hanseatic League, the Coalition and the Vatican weren't exactly on best terms with the Islamic caliphate that rulled the city and nearby lands but there has never been any true hostilities and there was no doubt that if the Horde destroyed Istanbul it would then be free to strike at the heart of Europe.

And so a huge cross-continental defence force was mustered. Many soldiers who were still returning home after Slaver War were given new orders and redirected towards Turkey. Many more volunteers were added the the ranks. The Vatican marketed the coming conflict as a holy war, which drummed up tribalistic fever to a point where young people were eager to do their part.

The majority of the defence force got to the city before the Horde. One of my main characters, Tosh led a regiment of his Rangers from the distant Scottish Highlands with his wife Rachel serving as his XO.

They watched the Horde approach from the scrap metal walls of Istanbul.

Only... it wasn't the whole Horde, but just one third. The other two headed straight for the Bosporus Straight and commandeered as many boats as they could.

Those in the city didn't realise they weren't facing the whole Horde until after the hard wrought battle which lasted two days and nights was won. Jubilation turned into dispair. By the time they got to the straight the rest of the Horde would be over it. And anyways they weren't in any condition to take on more than 600,000 savages in a standing battle.

Long story short (as this is getting long as it is) the defence force has to wait for reinforcements to be shipped in. By this time the Horde has made it further west, razing every village, town and city it comes across. Tosh is leading a division who have been tasked with biting at the Horde's heels to try and slow it so the main force can get around it and put itself between the Horde and Budapest."
Stargate,ff3fj0y,t1_ff313ni,1579540017.0,"I'm not saying I couldn't see another Scottish Atlantis expedition member requesting it... just not Carson.

He's more likely to request a wee picture of his mum on his shoulder than a saltire!"
Stargate,ff30nvd,t1_ff300il,1579530513.0,"Aye we do.

And it's not impossible Beckett requested an ""unofficial"" patch. But honestly (and I say this as a Scottish person who voted yes in the last independence referendum) that is a pretty contentious thing to do and would quite likely piss off other Brits. It's basically totally out of character for Carson as he was one of the least argumentative people on the crew."
Stargate,ff2zf23,t1_ff2uocr,1579529474.0,"Imo one part of this aspect about Atlantis is actually proof that SG isn't set in our universe, but a similar one.

Dr Beckett (who btw for a Canadian does an almost perfect east coast Scottish accent) wears a Scottish patch but Scotland isn't an independent political entity in our world. We see other Brits wear the Union Jack as you would expect."
tumblr,ff2qi99,t1_ff25xkg,1579519434.0,Only if we want to be polite.
insanepeoplefacebook,fez89sr,t1_fez18jm,1579454732.0,"Oh, I'm pretty sure she has some fossil fuel execs worried about their bonuses.

Last thing they want to see is a reduction in use."
AskUK,feyofhd,t1_feyaimm,1579448259.0,"Who said anything about keeping it?

I just want it included in the fucking sums so the age old lie of Scotland being black hole for money can finally die.

Scotland has been a net contributor to the pot overall. That's all I'm saying."
AskUK,fey9mdr,t1_fey2vzo,1579442589.0,">This gets even more insulting when you find out that Scotland gets 20% more funding than everyone else and is responsible for more than half the country's deficit, yet still has money to throw around on freebies.

Nah mate. What's insulting is every time this shite is spouted everyone conveniently forgets to include the cash earned from the 40 billion barrels of oil extracted from Scottish oil fields.

You add that variable to the formula and all of a sudden Scotland is in the black... I wonder why it's ignored?"
worldnews,fet0rjc,t1_feshloz,1579370789.0,"I was calling the BNP and EDL extremists. They are literal Neo-Nazis. Like literally.

Trump is certainly not a moderate, but I agree he's not an extremist. He simply can't be an extremist because extremists need some form of ideology or belief in a greater cause to twist into extremism in the first place.

Trump is just a self absorbed narcissist that doesn't care about a single, solitary thing except for himself.

A large part of the American right either refuse to see that or applaud it as a strength. I don't know which is more worrying tbh."
worldnews,fesxp5z,t1_fessls3,1579369994.0,"I think you misunderstand me. (:

I was calling the British National Party and English Defence League extremists. They are essentially Nazis/KKK parties.

The UK is about to give itself an education on the dangers of populism however, thanks to Brexit."
worldnews,fesdqkn,t1_fescssy,1579364126.0,"I know people who admire him over here but would never vote for such extremists.

Basically they love him for the same reason American right wingers do - political tribalism and they see how much he pissed off the ""other side""."
joinsquad,fesctuv,t3_eqgoqf,1579363929.0,Oh boy. I could get *so many fucking* revives in there!!!
AskEurope,fera4be,t1_fer3tm6,1579351655.0,"In my experience the Irish are the best craic on the whole continent, just behind Scandinavians. And I feel qualified to judge because I work in tourism and meet hundreds of foreigners a year.

Of course, as a Scot you'll probably whine that I'm biased against English folk... and I'm not, Northerners are pretty sound."
AskEurope,fer8x74,t1_fer0ytf,1579351304.0,"Obligatory Fawlty Towers quote...

In fact fuck it. It's so obvious and overdone I can't be arsed quoting it."
TheExpanse,fer8b4b,t1_fep7xlz,1579351050.0,I really loud fart would probably work better to calm people down...
GreenAndPleasant,fer7o3e,t1_fer53pt,1579350848.0,They're all Brits.
worldbuilding,fenpdlt,t3_eq4nxc,1579288860.0,"> I don't want to name them ""Wizards"" or ""Witches"" either, because that seems a little too much like Harry Potter. 

Firstly, if you're wed to the idea of utterly new names there's nothing wrong with that. However I would say don't let a kids book ruin what are two utterly appropriate words for adult fantasy.

When I think of witches I think of Nil and Nether from Malazan. Two twin children with the souls of past tribal mages. At one point they are the only mages of any worth for a whole army and hold their own against dozens of opponents with their weird spirit magic.

When I think of wizards I think of the Prince of Nothing series. A wizard in this world is the title for an outcast and illegal mage who is not a member of one of the Schools. They must live in the wilderness or try and hide in plain sight.

Both of these are pretty cool images imo. (:"
worldbuilding,fennhnl,t3_eq4r4e,1579288213.0,"Good video.

You know your stuff. Your video was very similar to a conversation I once had when I asked a professional proof reader for tips. (:"
worldbuilding,fenjvpj,t3_eq3ld1,1579286263.0,"Hmm. I'd recommend doing a bit of research on human social evolution and looking into the social habits of reptiles.

Most reptiles are solitary right? So, if such a creature could evolve a society it would likely be incredibly different from human society as we came from very social apes. 

You mentioned Forkrul Assail, so I know you're an Erikson fan. I always assumed this is what he did to come up with the Jaghut society, similarly basing them on an originally solitary animal.

Obviously I'm not saying you should rip off Erikson, only think about what a civilisation would look like if it came from a species that thought and lived utterly different from how we do..."
funhaus,femyz0a,t1_femxucm,1579273186.0,"Just thinking about the word scrobbles cracks me up.

*""WHAT THE FUCK ARE SCROBBLES!?!?""*"
politics,femxxn1,t1_femwk32,1579272473.0,"*""Look at this shiny thing! Look at it!  No, don't look over there. Look here!""*"
Fantasy,fekc968,t1_fek8g9b,1579197031.0,">No, that's not it at all. What people criticize about Ericson's work his his deliberate obtuseness, not that its complex.

I apologise if I put words in your mouth but the above comment really did come across (to me at least) as if you were basically just calling Erikson a shite writer.

I mean, what's the difference between deliberate obtuseness and deliberate complexity if not the subjective opinion/preference of the reader?"
Fantasy,fek7xcm,t1_fek007j,1579194474.0,"You're attempting to put your own subjective opinion on the series as if it's objective fact.

You say it's shit writing? That's fine. You're entitled to your opinion.

A lot of literary critics and other fantasy writers disagree with you however."
facepalm,fejzx65,t1_fejshnf,1579189624.0,Bullshit my imperial friend.
facepalm,fejsedo,t1_fejrhcc,1579184691.0,"*""My arguement only works within these parameters so that's the parameters we will debate within.""*"
Scotland,fejpu1u,t1_fejd1oi,1579182756.0,"I've never considered the Union Jack to have racist or fascist connotations. Royalist and ""Little Englander"" connections? Sure.

But people also need to remember the Union Jack is actually a pretty decent design from a purely aesthetic point of view. And because of this in some senses it's a cultural icon utterly separate from nationalism."
Fantasy,fejmykd,t1_fejmmgu,1579180306.0,I'd never heard of it but first contact stories are one of my favourite sci-fi subgenres. Thanks for the recommendation I've added it to my list!
Fantasy,fejkabv,t1_fejgyrv,1579177715.0,"Only if they have ridiculously thin skin.

I'm a huge Star Trek fan.

I also adore Alistair Reynolds' novels.

One of of those has significantly more mainstream appeal than the other, and saying so isn't offensive to my Trekkie sensibilities."
Fantasy,fejk29c,t1_fejeuf5,1579177481.0,If that's the case they are mistaking complexity for deliberate obtuseness.
worldbuilding,fegfryl,t3_ep084z,1579091281.0,"**Rangers**

The only monsters in my world are other humans in a lawless world.

But the Rangers fit the question nevertheless.

The guild was started when after a decade of travelling post apocalyptic Europe a group of ex-caravan guards returned to their remote homeland to find it still infested with slavers, raiders and violent clans. They had left as teenagers as guard apprentices to escape that exact violence and anarchy.

They decide to put their skills and equipment to good use and patrol a single trade route between two villages. Their success is almost immediately apparent to the locals and they soon find themselves with a small army of young (and a few old) volunteers needing put to work.

So they are able to protect more roads leading to more settlements. Which increases their volunteer pool.

To begin with the Rangers (which was originally just a placeholder name for the organisation but no one came up with anything better) relied on handouts from appreciative civilians for food and clothes. Their weapons and equipment for that first army of volunteers was provided by a couple of powerful allies who approved of the Rangers' mission. Eventually as the guild grew it acquired land and other assets to provide itself with an income."
Scotland,fedxjgw,t1_fedslp6,1579021997.0,">Similarly how is 'independence' leaving one union to join another? 

Would you lot please stop with this regurgitated bullshit?

The difference in the two unions are staggering. That's like my mum asking me why did I move out of her house just to move into another house.

Here's a wee thought experiment for you. Google the McCrone Report. Read the wiki page. Now imagine if Brussels had done something similar to the UK.

>Scotland is purely anti-English... we know, we get it, but unfortunately for you ... we're in charge

We're not anti-English. We are anti-bellend though. Best you stay away."
joinsquad,fedws6v,t3_eoltl2,1579021537.0,"""Help me medic!""

""I can't. Revives through walls are illegal on this server!""

""Pleeeeeeaaase! It's your job! I won't tell anyone!"""
worldpolitics,fedglgr,t1_fedfpk6,1579010970.0,">And before you say I'm a butthurt Blairite or something like that, I'm a conservative.

So... a Blairite?"
Malazan,febnmi8,t1_fea0ah5,1578960743.0,"Well, yes. I'm sure shifting into a thousand spiders gives one a unique perspective!"
Malazan,fe8v1l5,t3_eo5oep,1578931239.0,"You're asking for clarification on Pust's external-internal thought process?

That route only has the destination of insanity!!! Even Shawdowthrone knows better than to try that lol."
JusticeServed,fe8t0zn,t1_fe8jyy0,1578930452.0,"The guy in a video is clearly not a Muslim from his ethnicity (I know whites can be Muslim but from a statistical point of view they're such a small number to be rather meaningless).

So bringing up Muslims in this discussion is pretty irrelevant. Regardless of the fact it's a discussion about antisemitism and yes, a lot of Muslims are antisemitic.

My point is so are a lot of Austrians. But talking about them in a post about a crime commited by a white dude in England is about as relevant as talking about Islam.

FYI, I've got nothing against Austrians!"
JusticeServed,fe8lgw9,t1_fe8j5pp,1578927536.0,"Aye. And going off his ethnicity being a Muslim ain't likely one of them.

Although there's no reason to assume he is, I'd wager statistically speaking he is more likely to be a T_D user than either Muslim or Austrian."
JusticeServed,fe8ho84,t1_fe8cihn,1578926256.0,Yes.
JusticeServed,fe8c1g0,t1_fe670ru,1578924634.0,"Wait... I thought us lefties hated Jewish folks.

Which is it?"
JusticeServed,fe8bjxl,t1_fe88o4x,1578924527.0,"Austria is also very antisemitic.

Why is no one talking about them?"
politics,fe7ec04,t1_fe6nfvi,1578913459.0,"This is a big part of the problem.

According to some Americans my nation is highly socialist because of things like universal healthcare.

No one calls themselves socialists here except for the actual communists... who are the tiniest minority of lefties.

If you aren't advocating that the people own all the means of production you ain't a socialist."
facepalm,fe7b8s9,t1_fe6rz53,1578912402.0,I'd say thats more the journalists than the scientists.
answers,fe2wzfj,t1_fe2tqyy,1578843751.0,"Yes, quite possibly.

Although it may be used as a framework for another one that probably would carve up the planets and moons between the major powers. Perhaps they'll even pretend they don't own the land, but are just ""administrating"" it lol."
worldbuilding,fe2sxbe,t1_fe2rktl,1578842494.0,"Yeah exactly!

Depending on the climate possibly wine making equipment too?

Beautiful art btw. I hope you're going nto post the finished map(s)!"
worldbuilding,fe2qjxx,t3_eno76b,1578841776.0,"The metaphysics - how the magic works. How much does ""magic"" encompass - is it just arcane rays coming out of mages hands or does it include things like spirit magic, possession, ghosts etc. How does magic relate to your world's religions?

Any disadvantages to using it? 

Are there different Mage Schools? Can women join if there are?

If you have different races do they have different magical prowess?"
worldbuilding,fe2paoi,t3_enoacg,1578841402.0,Brewing or distillation if it's allowed (or even if the it's not!)?
GreenAndPleasant,fe2lu7r,t1_fe2lix9,1578840190.0,">Lmao. ""I may have benefited all my life from your exploitation but I ain't gotta give anything back to you, you filthy brown""

No I'm sorry but that's not fucking on. You are done putting words in my mouth. I have not nor would I ever say anything like that. 

You are free to turn me into a racist piece of shit in your imagination but I'm blocking you."
GreenAndPleasant,fe2lbpc,t1_fe2ka49,1578839867.0,"Why are you so fucking determined to make my arguement for me? I'm not going to turn into the cartoon you have of me in your head no matter how much you try.

No. I'm not going to do that. Because I don't think you should have to make reparations.

Now, if your nation has fucked anyone over we can talk about societal reparations. That's fair. And obviously you as part of that society will need to pay a share of that through taxes. But I would never expect you to feel guilty for crimes your society committed... *especially* ones before you were born, or even before the birth of your great grandparents.

And I ain't going to feel guilty for something I never did. Sorry."
GreenAndPleasant,fe2k4ma,t1_fe2jy07,1578839355.0,Yeah. Like that.
GreenAndPleasant,fe2k30o,t1_fe2jvry,1578839337.0,"You still let that child starve. You bastard!!!

Ok, so what have you done in the last year to make reparations for the crimes of your county?"
GreenAndPleasant,fe2jvp6,t1_fe2jg3u,1578839262.0,Why can't you debate with me straight?
GreenAndPleasant,fe2jm7w,t1_fe2jc7i,1578839162.0,"So... you looked down on the child and said *""I'm not British""*.

Good to know."
GreenAndPleasant,fe2jbl6,t1_fe2j7tb,1578839046.0,Yeah bud. You're definitely obsessed with race.
GreenAndPleasant,fe2j7nl,t1_fe2j2q1,1578838998.0,What did you do to help during the Great Bangladesh Famine ?
GreenAndPleasant,fe2j0al,t1_fe2ivkn,1578838909.0,You sound racist to be honest.
GreenAndPleasant,fe2iw2r,t1_fe2ijme,1578838858.0,Oh. No need to apologise for being ignorant. It's not your fault.
GreenAndPleasant,fe2iirt,t1_fe2e9ur,1578838717.0,"I'm a racist? 

Fuck you dude."
GreenAndPleasant,fe2i9sf,t1_fe29zhh,1578838628.0,">You should look up how even people who weren't directly involved in slavery and genocidal conquest still benefited from it and defended it because their livelihood was tangentially/indirectly related to it, for example, a baker whose bread was used to feed slaves on ships stopped in English ports.

>And Serfdom was long gone when Anglos were docking boats full of slaves in their ports and starving a billion Indians to death.

Actually, the serfdom of Highland crofting existed well into the 1800s, up to and probably after the UK banned slavery in 1833.

You're clearly pretty ignorant of large parts of internal British history. I mean you keep calling me, *a fucking Scot*, Anglo for starters.

Oh don't get me wrong. You're pretty much 100% correct about the external stuff. But you're missing a lot of nuanced context.

>Not defend the country that gave you those illgotten privileges when called out on the fact it's the most horrible country to have ever existed.

Who's defending shit? You're just pissed I'm not showing enough hatred of the UK (ironic as I'm a Scot Nat). I don't see the point in wasting time hating. It also adds to political tribalism which doesn't get anyone anywhere."
answers,fe2dgcr,t3_enn587,1578837188.0,"Well, in theory no.

The Outer Space Treaty of 1967 which has been signed by everyone capable of sending people to Mars bans any sovereign nation (and I would assume citizens or companies of that nation) from claiming any celestial body."
worldbuilding,fe2b91b,t3_enlyoj,1578836449.0,"https://www.sfwa.org/2009/08/fantasy-worldbuilding-questions-peoples-and-customs/

I know you only asked for 5 but this website has a checklist of hundreds. You may find it useful. (:"
GreenAndPleasant,fe28xqr,t1_fe1z44a,1578835772.0,"As a working class descendant of Highland crofters (read serfs) I'm fairly confident I haven't benefited all that much.

And as for the parts of my life that are easier because of the centuries of the Empire raping and pillaging the globe, what exactly would you like me to do? Self loathing over something I have essentially no control of doesn't seem very efficient."
TheExpanse,fe1zl4q,t1_fe111it,1578832761.0,"Eh?

Taking everyone to the latrine was part of Holden's routine."
GreenAndPleasant,fe1x2pr,t1_fe1gm17,1578831894.0,The children are not responsible for the sins of their fathers.
