subreddit,self ID,parent ID,time,text
blursedimages,ffjkqpr,t3_etsp7e,1580000466.0,"Ohhh so thats why stumps look like that, they use excess flesh to cover it! Cool"
memes,ffjdrpw,t3_etto9s,1579996142.0,"Im trans and i agree, i wouldnt date a cis person"
dndmemes,ffjaa8s,t3_etsh6z,1579994094.0,If your character is alive then your winning
rareinsults,ffhoyrm,t3_etldx2,1579946153.0,"Lmao, doubt they would have any black friends if you watched their videos"
HolUp,ffhl68a,t1_ffgwlzk,1579940442.0,"Lmao, nobody is normal"
HolUp,ffgoc75,t1_ffgo27k,1579910951.0,"Oooh good one, genuinely made me snort"
HolUp,ffgnojv,t1_ffgnaaq,1579910488.0,You can own jokes? Cool!
HolUp,ffgmbmc,t1_ffgfcif,1579909557.0,"Lmao, heteros can dish it out but not take it"
memes,ffessd9,t3_et6y3i,1579863818.0,Ya but i only had to pay £260 for ps4 while a computer at the same price cant even run minecraft
TrueOffMyChest,ffeqdmx,t3_et5f4s,1579860276.0,"Demi sexual isnt a sexuality its just the way the become attracted, so you could be a gay demisexual"
ThatsInsane,ffao01x,t1_ffanerq,1579740437.0,No this is Patrick
ThatsInsane,ffak6q8,t1_ffajlhl,1579737772.0,Oh that ducks
ThatsInsane,ffado2r,t3_esieoy,1579733113.0,I briefly thought they were playing becuase the wolves didnt seem to putting much effort into actually killing the dog
AskReddit,ffa8nhx,t3_esc8vq,1579730029.0,"Put more effort in, also the reason you feel crap all the time is cause youre a girl"
memes,ffa8ani,t1_ffa7w1v,1579729831.0,Thet left the @ uncovered tho
memes,ff9l9qr,t3_esdc9h,1579715376.0,Why cover the names? They want to be known
worldnews,ff7auxo,t3_erunbv,1579644964.0,Impossible
PeopleBeingJerks,ff77wa8,t3_es05bh,1579642862.0,Watching stuff like this reassures me I'm not a psychopath cause this literally makes me so sad for that kid
memes,ff72o5r,t1_ff6ndct,1579639908.0,Nah we are just people thx
Minecraft,ff62uze,t3_erpe2k,1579617744.0,"Weirdly cool, you should expand the forest around it or create something under it to give it a more lore feel"
traaaaaaannnnnnnnnns,ff420sx,t1_ff41kqr,1579553822.0,"Makes sense, mabey they would get age related diseases but genetic diseases would have probably been removed."
traaaaaaannnnnnnnnns,ff3n4h7,t3_er9wsi,1579544601.0,I wonder if timelords would be trans? being trans is because of something not lining up in our biology so would a time Lord have mistakes in their biology? Could timelords be diabetic or have other illnesses or are they always born with perfect health?
lgbt,ff3ln5z,t3_erd34q,1579543680.0,I can never what people are coming out as on this sub
facepalm,fexedk9,t3_eqpln8,1579429636.0,*laughs in England*
iamatotalpieceofshit,fewonk2,t3_eqllhi,1579417141.0,Lmao the daily mail is blocked at my college cause it's trash
comics,fewoa86,t3_eqo7mb,1579416893.0,Every trans girl in the world would like a borger  please
comics,fewo9u8,t3_eqo7mb,1579416881.0,Every trans girl in the world would like a borger  please
comics,fewo9hx,t3_eqo7mb,1579416869.0,Every trans girl in the world would like a borger  please
pointlesslygendered,fetqccq,t3_eqg6xe,1579378347.0,It means she represses her emotions till she gets depressed but hasn't been brainwashed into thinking girly things make her gay
