subreddit,self ID,parent ID,time,text
Veryfuckingstupid,fg0scpz,t3_evkz22,1580414066.0,"Why are these people saying all that crap of planned parenthood?
Not one person has proof of what they claim but they just keep sharing and posting fake info about it."
phoenix,fg0py2s,t3_ew92jr,1580412731.0,"Sears, Circuit city, best buy, and similar stores are closed because of pushy sales people, I know they are only trying to get a bigger bonus on their check every week but I stopped going there just to avoid the sales people.
Edit: I used to go for a USB cable and they kept insisting on buying speakers new stereo, amplifier..., wich I didn't need. 
Can't afford all of that, just apply for a credit card."
AskReddit,ffxu10t,t1_ffx2ya7,1580332410.0,Especially letting hundreds of strangers  know where I am and what I do during the day.
AskReddit,ffxtdia,t1_ffxc50x,1580332038.0,WRONG
interestingasfuck,ffx5fdr,t1_ffweg9b,1580318130.0,To be honest.......  yes.
Jokes,ffvrnyr,t3_evfl2x,1580271334.0,You sick bastard. Take my upvote.
todayilearned,fftch5a,t1_ffs9t2e,1580216368.0,"I've never heard of that, so the casinos don't let You in and gamble or how does it work?"
todayilearned,ffs5365,t1_ffrqs91,1580173344.0,It is if We include all deaths by shootings at schools. /s
todayilearned,ffs4ya3,t1_ffrqdkr,1580173247.0,"One time a dog chased Me and I didn't even try to run cuz I was too heavy, good thing is the dog was also heavy and got tired after 5 seconds."
AskReddit,ffjn1mo,t1_ffisl5f,1580002035.0,Same here.
WTF,fff94fx,t3_eta3nm,1579878771.0,"""You will have to use it as a keychain""
Last sentence He said."
dontputyourdickinthat,fff7998,t1_fff6kk8,1579877491.0,I see what She did there.
AskReddit,ff9srlx,t3_esbsrj,1579720451.0,Not given to Me but a friend of mine was told bu His parents to have as many kids as god gives Him. 3 kids in 5 years and one more on the way. They must be crazy to do that.
AskReddit,ff9sh41,t1_ff95pou,1579720252.0,A dog house maybe?
delusionalcraigslist,ff9qztu,t3_es8kqs,1579719121.0,"As it says this is not for everyone.
I don't know who would buy that shit."
WTF,ff7q5px,t3_erwg99,1579655656.0,I want to know what drugs are they using? I want some.
Jokes,ff6ac5d,t1_ff3vk1k,1579622817.0,"No, the spirit filled his holy."
Jokes,ff6a6ii,t3_erhii3,1579622717.0,"Are You the one who was blessed with a 9"" penis?"
videos,ff68gdg,t3_erqxyn,1579621600.0,This guys were really brave to record the whole thing on video. I wish more people do the same.
