subreddit,self ID,parent ID,time,textoctoprint,fd45q5w,t3_ejwyiw,1578164630.0,"I set up a Pi 4B recently with the 0.17 Octoprint image, it's been working smoothly. 

There's a command that will report an under-voltage power supply situation. I connected to it via Putty, then ran ""vcgencmd get\_throttled"" (after running a CPU stress test, to increase the draw). If it reports ""throttled=0x0"", then you're in good shape. 

Other results indicate what problem you're running into. I found info here: 

[https://raspberrypi.stackexchange.com/questions/60593/how-raspbian-detects-under-voltage](https://raspberrypi.stackexchange.com/questions/60593/how-raspbian-detects-under-voltage)

I'm using the 3A 5V power supply that came with my case, with no problems so far. I have not tried it with a phone charger. For $12, I'm liking this fan-equipped case & power supply, I haven't had power issues while running a 15-minute CPU stress test, and with the fan on low-speed (running at 3V, not 5V), the highest temperature I saw was 59C. Granted, the house is cool, since it's winter. The fan is essentially silent at this speed. 

[https://www.amazon.com/gp/product/B07WR9MMKT](https://www.amazon.com/gp/product/B07WR9MMKT)"
3Dprinting,fd2ijft,t1_fd004ye,1578147746.0,"I'm happy to provide my competitors with a model of the 737 Max, for their entries into the contest..."
3Dprinting,fd2i5w0,t1_fczn7vx,1578147580.0,Needs a tiny Jericho Trumpet.
smallengines,fd2f51n,t3_ejvbrl,1578146318.0,"I'd expect a stuck valve to stick open, not closed, giving you too-little compression. If you remove the spark plug when this happens, does is it then become easy to pull?

Does gas come spraying out of the plug hole when you remove the plug and pull the cord, after it's difficult to pull? If your carb's float valve is leaking, it's possible it could be letting gas leak into the cylinder while the engine is just sitting. This would cause a similar hydrolocking situation. The band-aid fix would be to add a fuel shutoff valve, and close it between uses. The better solution would be to fix the float/needle valve problem in the carb. This is also bad if it lets gas into the oil, since it won't lubricate as well, and can cause engine damage. Does the oil smell like gas?

Is it a flathead or OHV engine? If your valve clearances are wrong (too large) the compression release may not be working properly. I'd expect that to be consistent every time, admittedly, but it's still possible, I suppose.

It's tough to imagine the troublesome oil staying in there somehow, after getting it running again for a few seasons. Change the oil if you want, but I think that filling with gas/Seafoam is not necessary, and may just introduce other potential problems."
3Dprinting,fczdxy7,t1_fcza0p6,1578099028.0,"Slightly-angled tail fins, to make it spiral (if it doesn't already) were my first thought :) 

Wear your safety glasses, folks! This is gonna get risky. But fun. 

Shortening the tube would reduce the pressure-drop of the air, through the tube. Giving a bit more pressure to the projectile. 

Now, how do we hook this up to a compressor.... 

I do actually have a refillable aerosol can, so you can make your own sprays from a liquid you provide. It refills with a pump or compressor. Could be a refillable source for using something like this, though it probably puts out less volume of air than a canned-air setup. And since each launch is just a brief blast of air, a can would probably give quite a number of launches."
3Dprinting,fcz8t16,t3_ejjkkm,1578095983.0,"Holy crap man, that's amazing! Fantastic work! More pics would be welcome, I'm sure. How long did it take to print, and to paint?"
functionalprint,fcz7lsh,t1_fcs4zyc,1578095294.0,"Ours are the Glad or Ziplock-type thin plastic reusable stuff. Maybe thermoformed. 

These look interesting, they probably seal better than ours, at least. Granted, I'm not using putting liquid in them, so the seal isn't essential. I presume the glass is pretty durable, and it wouldn't get messed up or stained if you were microwaving things that got too hot. That's nice."
ender3,fcyzq6u,t1_fcyw8bs,1578090681.0,"Good question. You could swap two stepper cables, and see if the problem stays with the cable (and therefore driver), or with the extruder.

I believe there is a voltage control pot on the stock board, from what I've read. Perhaps the stepper voltage is wrong now somehow?"
ender3,fcypzcv,t1_fcy6f1y,1578084713.0,"If you're extruding through the nozzle (I assume you must be, with direct drive), what about eliminating that restriction?

Remove the stepper & extruder from the hot end, for instance. Or maybe remove the nozzle, so you're just extruding through an open hole. Something to help understand if there's some sort of restriction/slippage issue that's responsible.

I went dual gear clone recently, but not DD, and I ended up at 406 steps/mm."
cats,fcyi7hz,t3_ejgbrc,1578080590.0,"Based on our cats, at least, I'm guessing maybe it's pronounced ""leisure wear"", and the ""active"" is silent?

Well, unless it's 2AM, I suppose."
videos,fcy92ng,t1_fcxvnbm,1578076555.0,"Some of Demitri's stuff is pretty funny. But I checked out a newer release of his maybe a year ago and it didn't work for me, unfortunately. Maybe I should try again."
videos,fcy8l1a,t1_fcy1djq,1578076349.0,"A line from one of his specials that always makes me chuckle is ""When the jokes go down, Chuck, you've got to pick it UP"", taking to the guy plucking along on a bass or something in the background. RIP Mitch."
octoprint,fcy7aju,t1_fcy3chy,1578075851.0,"If you want to upload the troublesome file somewhere, I'm happy to try uploading it to my Octoprint later, if that's of any use."
octoprint,fcy2nm7,t1_fcy09f1,1578073995.0,"Totally admit that this is unlikely, but just to ask: If you have your computer set to hide file extensions, is it possible that the file is actually called something like calibration.gcode.txt, rather than calibration.gcode? This wouldn't be consistent with it printing OK from the SD card, I suppose."
tifu,fcxq8qh,t1_fcxkoyf,1578068883.0,"Yup, that was well done."
