subreddit,self ID,parent ID,time,text
bestoflegaladvice,fgsbu0t,t1_fgfs4zl,1581079787.0,"IIRC there are two private companies that own them too. Swans with a nick on the left side of their bills belong to one, one with a nick on the right belong to the other. Businesses can be a right pair of knickers, huh?"
AskReddit,fgs180t,t1_fgruc7o,1581066339.0,"""The chef's skilled hands are busy!"""
PracticalGuideToEvil,fgrum03,t1_fgrp2vt,1581058166.0,Apparently there's a vampire leading one of the remaining Legions in Praes.
movies,fgrt9r3,t1_fgrd00x,1581056769.0,So the doughnut...is not whole.
LeopardsAteMyFace,fgns2fa,t1_ffwopy5,1580951659.0,"[""I gotta kill all the fish, haven't I?""](https://www.youtube.com/watch?v=6_PU7EyH1ks)"
LeopardsAteMyFace,fgnrrih,t1_ffzeh69,1580951459.0,">a contemporary joke about Naumann and his followers ending their meeting by giving the Nazi salute and shouting ""Down With Us!""."
OldSchoolCool,fgm08e8,t1_fgl9ra4,1580915204.0,"""You didn't bring me on for my winning personality."""
AskReddit,fglwnu5,t1_fglt6u9,1580912747.0,There was a special Boat Train that brought passengers to Southampton and the docks from the city.
AskReddit,fglwjdh,t1_fglq7js,1580912658.0,"In total there were four iceberg warnings from different sources. It's true that Philips on the Titanic told the *Californian's* operator to ""SHUT UP SHUT UP IM WORKING CAPE RACE"", but that isn't significant because there were lots of others received. However, there are two things to bear on mind:

* Only one of those actually made it to the bridge, because the telegraph office was so swamped with passenger messages;

* The incident caused the *Californian's* operator to shut down their telegraph equipment for the night...which meant they couldn't hear the Titanic's distress calls later on (they thought the flares were fireworks)."
tumblr,fgluhb3,t1_fglp6m2,1580911228.0,/r/LeopardsAteMyFace
books,fgll8hk,t3_ez010b,1580903018.0,Where are the Snowdens of yesteryear?
AskReddit,fglfg35,t1_fgkiidg,1580894993.0,"*There's a song to be sung,*  
*Cos we may not, be the Young Ones, for very long...*"
OldSchoolCool,fgl9m3n,t3_ez3lze,1580887103.0,"Huh, with those glasses he reminds me of the safecracker from Die Hard."
AskReddit,fgl1h0x,t1_fgky1ol,1580879099.0,Or clinical depression.
ireland,fgl16ga,t1_fgiz2al,1580878856.0,"It's satire, intended to imitate an FF/FG voter that refuses to consider alternatives."
PracticalGuideToEvil,fgl0x6e,t3_eyu4iz,1580878648.0,">It's a hunter's trophy: ""I managed to slay a creature tougher but stupider than me, one that attacked me for nothing more than coming across it.""

I don't think that's true at all, plenty of hunters deliberately seek out big beasties for the challenge, and their reputation."
LeopardsAteMyFace,fgkwsvf,t1_fg78avv,1580875474.0,Where's the part about the LGBT Church workers?
todayilearned,fgkh5ke,t1_fgjs14p,1580865456.0,"And the mascot is really young because they don't have a ""old dignified colonel from an old war"" stereotype."
MauLer,fgkdq1j,t3_eyr7k9,1580863176.0,"If you really want to, you can find old videos of Rags on his channel before he got the furry avatar and used his face instead."
PracticalGuideToEvil,fgibxp5,t1_fgi9cvy,1580816028.0,"I don't know, to a Hero having your soul imprisoned in, say, a chamber pot is a pretty gross violation of *something*, because it prevents your soul from ever moving on to that nice place with the big white gates and the harps, and until recently it also would have ensured a Hero was permanently dead and not eligible for raising."
tumblr,fghw6px,t3_eydk7l,1580795729.0,"IIRC the last time this came up, one of the pulling ponies mentioned how it would be their turn to ride on the carriage soon."
tumblr,fghstin,t3_eyief5,1580792848.0,"This happens in Aliens Vs. Predator of all places, the archaeologist takes a few minutes going through possible meanings before he gets the answer."
MauLer,fghs2l9,t1_fggftmw,1580792256.0,"The Watchman comic literally has flashbacks to the Vietnam War, and I swear it has President Nixon appear too."
tumblr,fghrrfi,t1_fggimuu,1580792019.0,"I truly, truly think it's a bad name that carrys loaded language. Take any other negative-adjective+demographic and see what happens.

>""We as a society need to solve the problem of:

>Aggressive Femininity  
Disingenuous Intellectualism   
Avaricious Evangelicalism  
Virulent Homosexuality  
Lazy Whiteness  
Angry Atheism    
Envious Protestantism  
Classist Mexicaness  

And those are just the ones I made up, I'm sure you can think of even more unsavoury examples involving Jews and black people. Now, if someone covered by the aforementioned demographics were to see this, would they think it was a slur applied to them?"
UpliftingNews,fghb5me,t1_fgh9vqr,1580780898.0,"Oh! Thanks, I knew the parties but didn't know the colours."
UpliftingNews,fgh9i8o,t1_fgg9zr5,1580779820.0,What's with the Blue Team/Red Team terminology?
tumblr,fgh8tdu,t1_fggzeyg,1580779368.0,"Huh...is the crocodile from India or something? That's the only meaning of the name I can remember, 'Bindhi' means the red dot Hindu women wear."
LeopardsAteMyFace,fgh8dkx,t1_fggn39v,1580779073.0,You forgot to mention his habit of smoking giant cigars.
bestoflegaladvice,fgf004a,t1_fgexex4,1580717216.0,"[Karen Wetterhahn](https://en.wikipedia.org/wiki/Karen_Wetterhahn).

>Wetterhahn would recall that she had spilled one or two drops of dimethylmercury from the tip of a pipette onto her latex-gloved hand. Not believing herself in any immediate danger, as she was taking all recommended precautions, she proceeded to clean up the area prior to removing her protective clothing.However, tests later revealed that dimethylmercury can, in fact, rapidly permeate different kinds of latex gloves and enter the skin within about 15 seconds. The exposure was later confirmed by hair testing, which showed a dramatic jump in mercury levels 17 days after the initial accident, peaking at 39 days, followed by a gradual decline.

>Despite aggressive chelation therapy, her condition rapidly deteriorated. Three weeks after the first neurological symptoms appeared, Wetterhahn lapsed into what appeared to be a vegetative state punctuated by periods of extreme agitation. One of her former students said that ""Her husband saw tears rolling down her face. I asked if she was in pain. The doctors said it didn't appear that her brain could even register pain."" Wetterhahn was removed from life support and died on June 8, 1997, less than a year after her initial exposure."
factorio,fgezuug,t1_fgblyf5,1580717015.0,"Way too little. I chose my first space launch as a good enough milestone to make this post with (in reality I'm at 525 hours but that doesn't sound as good), and I really need to sort out my Red circuit production before I can start launching more regularly."
AskScienceFiction,fgbcup0,t1_fg97iom,1580660756.0,"He told Yoda as much as he could, that he had dreams of someone he loved dying. The advice he got was to let go of everything, which...didn't work out."
worldnews,fgbai9f,t1_fgasfue,1580660083.0,"Hollywood is owned by these sorts of guys. Why do you think when companies are the villain, they're usually unrealisticly cartoonishly evil? It's to divorce that perception of them from reality, so people won't internalise the idea of 'companies with the sole goal of making money = bad for society'. Think about the DoD's relationship with Hollywood, and how they sponsor pro-military movies as recruiting tools. You never thought big corporations had the same idea?"
factorio,fgb85lw,t1_fgb5ct4,1580659389.0,"Lots of Exoskeleton augmentations to speed me back up. If I was at the full 60 again, I'd be moving at light speed."
factorio,fgaugip,t1_fgafnv7,1580655488.0,"Because I like building big, and it's gratifying seeing it pay off when the tech progress bar fills up in a few seconds, tops."
factorio,fgatkfj,t1_fgao4at,1580655346.0,"The game is about whatever you want it to be about. You can optimise for UPS if you want to, look up the best blueprints for a given part of your base, and carefully calculate exactly how many of each building you need, but personally I don't like doing that. That's not creative, that's *work*, something I play games to avoid. So I indulge in futureproofing my base, building at an enormous scale so I won't have to expand later. I run into power problems, okay, next power plant can produce a bajillion Watts so I don't have to think about it."
AskReddit,fgaa3ao,t1_fg8pcyk,1580648701.0,"Yeah I'm the same, I use deadpan all the time (Addams Family is a 10/10 family comedy in my book), but I find it very difficult to interpret. In fact sometimes I've been told the same about myself."
Shipwrecks,fga9bhx,t1_fb1x2gi,1580648366.0,"If the captain had kept up to date on where the hurricane was, they certainly would have."
factorio,fga7k1d,t1_fg9ld0l,1580647779.0,"Science isn't about '*Why?'*, it's about *'Why not?'*"
factorio,fga6ouk,t3_exl74v,1580647419.0,"[This](https://www.reddit.com/r/factorio/comments/dupx9l/space_is_cheap_build_big_or_how_i_killed_my_fps/) is my previous post from two months ago, when my base was at four hundred hours - I think it's nice to compare."
factorio,fg9zod9,t1_fg9za57,1580645092.0,The thing about the power plants was all in the image descriptions.
AskScienceFiction,fg9zaq8,t1_fg9yvkx,1580644949.0,"...Huh, I never thought of that. At a guess the punch doesn't hurt them but when they go flying back from the impact, they smack either onto the ground or into the wall."
factorio,fg9xgwo,t1_fg9wx57,1580644319.0,...Oops.
factorio,fg9xejt,t1_fg9t6vy,1580644291.0,"You saw the part where the Nuclear and Solid plants were turned off, right? They only kick in if Solar fails for whatever reason, which is unlikely - there's an extra GW in spare capacity. I also deliberately didn't use Beacons to give myself a challenge."
factorio,fg9x1mm,t1_fg9w8vi,1580644137.0,"I work to certain restrictions, to give myself a challenge. For example, I don't use Logistics to feed assemblers unless it's really really necessary, I set up the Grid system to limit how I can place buildings, and this time around I didn't use beacons either."
AskScienceFiction,fg9w68c,t1_fg9bqja,1580643920.0,"Basically, Clark is practically invulnerable. Anything he touches, for as long as he's touching it, is also invulnerable. That's how, for example, he can pick up a plane without shearing it in half."
PracticalGuideToEvil,fg8w2cf,t1_fg8soh5,1580630523.0,Second Liesse.
AskReddit,fg8m8je,t1_fg8h32q,1580624120.0,">  ASD Level One

We have levels now? Do we get promoted for being less tism-y?"
AskReddit,fg8m3t9,t1_fg8a8vz,1580623980.0,"Nope, Foaly and Captain Trouble 'Trubbs' in the aftermath of the Goblin Rebellion (though it was in the Arctic Incident, you're correct). Foaly had been locked inside his control room and made to seem as if he'd turned off the LEP's plasma cannons.

...I last read that book the better part of a decade ago. I don't have a lot of space in my memory for people, social skills or friends, but I remember books, music and movies very well."
AskScienceFiction,fg8ltjf,t1_fg72yu3,1580623682.0,Can you really see Springfield Elementary being able to afford one? They had to rent out their classrooms as part-time jail cells so they could give their teachers a raise.
AskReddit,fg80rqv,t1_fg7vkqr,1580606461.0,"Huh. I didn't do it by imitation - I actually picked up social cues by reading books. Not textbooks either, fiction. In text the author has to point out when someone's voice is sardonic, sarcastic, or otherwise non-literal, and it acted as training wheels for me to puzzle out RL interactions. 

Case in point, I would have been eight to twelve when reading this:

> (someone was framed for treason and just unraveled the plot, but the police don't know that yet)

>""Its okay! I fixed everything. In fact, you should be giving me a medal.""

>""Oh yeah, I've got your medal right here"". 

>*Foaly wasn't the best people person, but even he could sense the thinly veiled threat.*

If it wasn't for that narration, I'd have spent the rest of the book wondering why he didn't come out after all, and where the medal was.

In fact now I use sarcasm and implication a *lot* in casual conversation, because it's really fun to create double meanings and act with my voice."
AskScienceFiction,fg6is8u,t1_fg5cg2t,1580569100.0,"So I guess I'll ask - how much sense does it make to put a kitchen, which receives daily loads of food and oil for cooking and produces almost as much waste, on the second floor, thus forcing the poor dinner lady to climb *stairs* while carrying all that stuff?"
movies,fg1zczo,t1_fg1vupx,1580435506.0,"The drug lord uses rubber bands to keep his rolls of cash together, later on a cop has the same bands in his car and it tips off that he's dirty."
AskScienceFiction,fg1uzkk,t1_fg1giz8,1580433598.0,"Hey man, you're the one that brought up the code phrase as a point to Cap appearing to be a member of HYDRA. 

>Because not only did he know that SHIELD was an arm of Hydra, he also knew which members of SHIELD were Hydra agents and the code phrase that they used to identify one another.

So I *already* know the part about knowing HYDRA infiltrating SHIELD, and knowing which members are HYDRA agents, because that's all in your previous comment. I specifically limited myself to talking about the code phrase."
bestoflegaladvice,ffzklmy,t1_ffz625k,1580383715.0,"Who decides how many stars you get? Is it self reported by the hotel according to the kind of customers they want, or is it like Michelin stars where there's an agency that awards them?"
AskScienceFiction,ffzk1hb,t1_ffz78gr,1580382974.0,"Well let's be fair, the code phrase isn't a huge secret."
tumblr,ffzjyli,t1_ffzivgl,1580382870.0,"Uh, as you wish - it's Hillary Clinton, naked, with Trump's face instead of a vagina."
OldSchoolCool,ffz58ph,t1_ffxw5n7,1580364426.0,"I actually looked that name up because I was intrigued by the boxes, apparently it was a business selling snacks to railway passengers. https://www.kzwp.com/lyons1/telfer.htm"
Music,ffz4z5h,t3_evps5h,1580364156.0,Ebony Dark'ness Dementia Raven Way approves.
AdorableDragons,ffz2apl,t3_evwnv6,1580361650.0,But which dragon is which?
patientgamers,ffz0jbi,t1_ffywt2p,1580360105.0,"To be honest, I was fatigued by *all* the levels being dark and industrial, and was greatly relieved by the Crew deck (I think, it was the one with the candles) looking nice. I was also extremely put off by the blatant System Shock 2 ripoff vibe (it was intended to be System Shock 3 before being reworked)."
patientgamers,ffyuwad,t1_ffykkpc,1580355747.0,"Dead Space's plot twist was what killed it for me.

""Okay, so that's definitely going to be the twist, right? Right.""

""Oh, the game just showed me something that makes that twist impossible.""

""Huh, it *was* that twist all along. I, uh, have questions."""
worldnews,ffyjmzq,t1_ffwtrww,1580348005.0,">Yes, there are people who might be priced out of the new masks, but even at the regular price there are people who can't afford it, so, unless they are free, some people can't afford it.

Well *that's* a false equivalency. To put this into perspective, we're talking about a store selling masks for ¥850 when the online price is ¥150. If people want to stockpile, they can do that online - the store was taking advantage of their need for masks at short notice, when there is no other choice without waiting and potentially infected in the meantime."
tifu,ffx64cj,t1_ffwcn9l,1580318548.0,A
PracticalGuideToEvil,ffwa4cf,t1_fftzu5p,1580291916.0,"Nah that was a Callowan from the Third Army, on loan to Captain Raphael."
AskScienceFiction,ffw9ixq,t1_ffvzx3s,1580291004.0,...You think Welsh people are from Ireland?
worldnews,ffw8wf4,t1_ffw3c0t,1580290061.0,"Unless you're too poor to afford one. You're assuming that every consumer is equally able to buy masks at the inflated price, which isn't qqtrue at all."
worldnews,ffw6udz,t1_ffvxks9,1580287063.0,"Like the official that was [sentenced to life in prison](https://en.wikipedia.org/wiki/Liu_Zhijun) for cutting corners on China's high speed rail network? Or the two dairy executives that were [executed](http://www.chinadaily.com.cn/china/2009-01/23/content_7422983.htm) for tampering with infant milk formula? I won't pretend China is perfect, but when something big happens, they *really* crack down."
worldnews,ffw6bqz,t1_ffw2hpg,1580286360.0,"You'd might as well say you pity people who can't afford masks without the price freeze. Either way you're pitying someone, it has might as well be for other people's panic rather than greed."
ABoringDystopia,ffvs5sf,t1_ffvkxrl,1580271722.0,"Ever hear of [Posse Comitatus](https://en.wikipedia.org/wiki/Posse_Comitatus_Act)? Essentially, the US armed forces are banned from enforcing the law on American soil - that's the National Guard's job."
bestof,ffvj3zy,t1_ffv1t11,1580265318.0,Slavery is working without being paid. Welfare is payment for those who can't work.
PracticalGuideToEvil,fftccwo,t1_ffsq9tt,1580216257.0,">Also, if I’m not mistaken, Raphael is our first non-binary character! (Cat consistently referred to them as, well, them’)

I took it as Cat just not knowing what sex Raphael was, because their eye-wateringly garish costume distracted from and concealed their body shape."
PracticalGuideToEvil,fftc70i,t1_ffss340,1580216103.0,">that I’d not skinned that so-called heroine alive and made a cloak out of the leather was already showing great restraint, as far as I was concerned

Oh she definitely knows."
rickandmorty,ffsw353,t1_f7buyab,1580194813.0,He destroyed his Project Phoenix after he almist got stuck as Tiny Rick while infiltrating Summer's high school.
AskScienceFiction,ffsshls,t1_ffqzt7h,1580190836.0,"It's still a bit of a stretch that of all the humble labour they could have chosen, all of the Jedi with rare exception (Anakin got away with dark leather somehow) went with moisture farming. I mean you've got janitors, agriculture farming, animal ranching, office workers, well digging, etc, all with clothes that have a million variations across billions of worlds, and they happened to go for that particular one."
tumblr,ffsrys5,t1_ffsaxmz,1580190310.0,"If it won't die until *after* it's done disembowling you, it's effectively bulletproof."
Showerthoughts,ffsok3c,t1_ffrxl9g,1580187173.0,"I wouldn't say high fantasy, that's dragons and elves and wizards living in high towers. Mid fantasy, certainly, with a heaping of Space Western too."
todayilearned,ffslpjq,t3_eumy3k,1580184848.0,">On the day of the ceremony, Ximen Bao arrived at the sacrificial site by the river and met with the shamaness, her disciple, the three elders, the local officials, several village elders, and the maiden; with an estimated over a thousand onlookers also in attendance. 

>Ximen insisted on inspecting the maiden and concluded her beauty would not meet the standard of a God. Declaring that the delivery of an inadequate bride would trigger the wrath of the River God and would result in floods on the region, Ximen demanded the ceremony be postponed until after a more suitable bride is found. He ordered his soldiers to submerge the shamaness into the river to report to Hebo the River God about the postponement and to report back to Ximen on the God's response.

>Sometime after, as the shamaness had obviously not returned from the river, he tasked her disciple with the same mission and to locate the shamaness before submerging her into the river. After neither of them returned, Ximen ordered the three elders to be submerged one by one and tasked each with the same mission. 

>As neither the shamaness, her disciple, nor the elders returned from the river, Ximen ordered the local officials and the village elders to go into the river to fetch them. All of them instead knelt before him in terror. After that day, bridal sacrifice for the River God became a thing of the past in the County of Ye.

Now *that's* a power move."
tumblr,ffskt7c,t1_ffqx7yp,1580184177.0,"Yeah there was an episode like this where they both dashed into a room, yelled excuses at each other, went out and fought, went back in..."
europe,ffpf993,t1_ffm2o6m,1580093586.0,So he froze to death anyway?
tumblr,ffpezl9,t3_euayml,1580093393.0,The bear would also like some salmon.
tumblr,ffpdf7e,t1_ffol723,1580092268.0,"In the film Metropolis, there's a retelling of this story that I think works really well.

Basically, when the architects talked about Babel, they were thinking of this amazing tower celebrating man's achievement and the world he lived in. However, when the hundreds of hired hands talked about Babel, all they thought about was the backbreaking labour, the endless toil in the mud for other people's benefit, the dirt and the sweat and their agonised limbs. 

Both groups spoke the same *language*, but could no longer understand each other because they'd lost perspective. And so the next time an architect came out to give a motivational speech talking about how great Babel is, he got pelted with rocks and the project was left in ruins, as the workers finally and inevitably revolted.

EDIT: Here's a link - https://youtube.com/watch?v=Y3XHMDkxsT8"
ireland,ffne8bo,t1_ffnbobv,1580064795.0,I've an idea for Miggledee's next election campaign.
PracticalGuideToEvil,ffndmyz,t1_ffjxekh,1580064587.0,"Yeah but it wasn't literally feathers. I imagined it as having feather-shaped textures on top of the fabric, so they show up when the light hits them but otherwise blend in. That or it's a Name / Night thing (I forget when the effect showed up)."
todayilearned,ffn4ao3,t1_ffmwm2j,1580061926.0,"Oh is *that* what those are called? I always thought of them as category addresses, like in websites, or hell, actual residential addresses - Where you are specifically, the area around you, the area around that, and so on."
movies,ffhn2ud,t3_etjglq,1579943270.0,"I think it goes too far in places. Like there's one scene where the main character is meeting someone, and:

* They're dead

* No actually they're alive;

* No actually they die two minutes later.

I also think the movie goes too far to make the main character sympathetic, especially at the end, though as a nice side effect it means the murder victim was - well, I'll save that for spoilers."
movies,ffhmvp1,t1_ffhb3nd,1579942961.0,(and threw in the aircraft carrier as a bonus)
tumblr,ffhco7n,t1_ffghx2f,1579930029.0,Reminds me of the time the US gov poisoned industrial alcohol during the Prohibition to stop people drinking it. When does it become right to hurt your citizens for breaking the law with no trial?
SympatheticMonsters,ffhca19,t3_etgvtv,1579929637.0,Mr. Meseeks?
LifeProTips,ffh6pl8,t1_ffgga67,1579924636.0,"Those commercials have had sound editing, so it doesn't sound like a real human voice to an Alexa device."
todayilearned,fffm23q,t1_fffd3t0,1579886881.0,"Tagging /u/Popular-Uprising-, you'll want to see the comment above."
AskReddit,fffi9jv,t1_ffeymcb,1579884546.0,"Serious question. Why do Vikings have myths about venomous snakes? They were based in Sweden, right?"
aww,fffhpmm,t1_fffa5ow,1579884206.0,">like most quadropeds

So every animal bar humans? That doesn't sound right."
movies,ffesxfl,t1_ffe0iwr,1579864011.0,Cpt. Sullenberg was heavily involved in *Sully* and forced the director to change the names of characters that had their personalities changed from RL.
bestoflegaladvice,ffeskih,t1_ffekbxh,1579863505.0,"Except OP had made sure the police know about the situation, and two officers can serve as witnesses that he knew where the dog was and wanted it back very badly."
worldnews,ffdzra0,t1_ffd6w4y,1579833000.0,">EU officials are a group of unelected bureaucrats

The UK government appoints members of the European Council (the PM) and the Council of the EU (his ministers). It has no say in the European Parliament, which is elected directly by citizens of each country. Both the CoE and the EP have to consent to pass laws. Laws are proposed by the European Commission, which is made up of commissioners appointed by each member state.

But please, do continue."
tumblr,ffdy86q,t1_ffdwa8z,1579831894.0,I guess it's appropriate for the number of innocent people he sent there.
tumblr,ffdtim5,t3_eswwds,1579828547.0,"So if Heaven = Himmel, what did Heinrich Himmler's last name translate to? Heavenly?"
tumblr,ffds6ja,t1_ffd810q,1579827597.0,"Well, you've got a couple of options.

* Luke got absorbed into the Force and is no longer corporeal anywhere but the island.

* Luke was gravely injured in his first confrontation with Snoke, and depends on the island keeping him alive.

* (My favourite one) Luke no longer cares. He's seen the whole history of the Republic, rising and falling and rising and falling, and has concluded that no matter what you do, all of your work will be washed away like drawings on sand, so what's the point? Everything is a cycle, everything is balanced and cancels out. Make a thousand generation era of peace and harmony today, lose it to a thousand year era of oppression and torture tomorrow. The first part of the movie is Rey trying to convince him he's wrong, and in doing so acting out the arguments fans have been having for decades about the nature of balance and if the Dark Side can be used responsibly."
tumblr,ffcw7wb,t1_ffcds7n,1579808556.0,"Elijah Wood's cameo in Spy Kids was this.

""I'm The Guy. Follow me.""  
*Is instantly vapourised.*  
""Oops."""
