subreddit,self ID,parent ID,time,text
nfl,ffvt1v8,t1_ffvp6ch,1580272430.0,"I mean, it's only been 29 years."
pics,ffv8ygk,t1_ffuc4o0,1580258508.0,[*Pacific Rims: Beermen Ballin' in Flip-Flops and the Philippines' Unlikely Love Affair with Basketball*](https://www.amazon.com/Pacific-Rims-Flip-Flops-Philippines-Basketball/dp/0451233220) is a great book about just how huge basketball is in the Philippines.
nfl,ffv830r,t1_ffuahz3,1580257922.0,[Don't forget that Dikembe Mutombo sounds like Cookie Monster](https://youtu.be/F_0wjFP3YsQ?t=111)
movies,ffv2598,t1_ffu3yi9,1580253941.0,"Does he share a Corona with the pope in the end credit sequence and says ""family"" as a toast, then they both start to laugh?"
nfl,ffv1n2m,t1_ffv0x7x,1580253615.0,Have fun never seeing the lions win another playoff game within your lifetime!
nfl,ffv0oum,t1_ffv0czl,1580253006.0,"Me too, that's what happens to you guys in the playoffs."
nfl,ffuzuaf,t1_ffuzjbx,1580252524.0,"1957 and 1991 dude, nuff said."
nfl,ffuz8oz,t1_fftyxjz,1580252187.0,"Well,  both Barry Sanders and Megatron cited the toxic team culture for retiring when they were still very capable players, hell Sanders was a shoe in for setting the all time rushing yards record if he'd played a year or two more.

A team can suck but there is always hope of getting better , when one has a shit culture like the Lions, Browns, or Chargers there is always that knowledge that even if the team gets good, it will all go to waste because the front office will piss it all away somehow."
nfl,ffuyt9h,t1_ffu9hxl,1580251944.0,"Well, Patricia can teach you how to dodge a rape charge, that's valuable information in the NFL."
nfl,ffutlfn,t1_ffudw0f,1580249092.0,"He was extremely smart, he made guys lose their cool.   Anyone who's ever played against him has ever denied that he was dirty, but they also universally consider him an extremely tough guy.   He was a banger in the paint and extremely physical.  He was just too smart to get caught in technical, but was excellent at drawing them."
GifRecipes,ffufckq,t1_ffuesg8,1580240776.0,"Nah, my maternal grandpa kept in contact with some of his relatives back in Beirut before the civil war, but lost contact with them after it."
GifRecipes,ffuehkm,t1_ffudgsu,1580240262.0,"Got Lebanese blood on both sides, my maternal great grandpa actually arrived at Ellis Island, then moved to Mexico a few years later and settled in Guerrero.   On my dad's side it was his great grandmother and her family settled in Veracruz, where most of my dad's family is from."
nfl,ffu2fb5,t1_fftn8z9,1580233037.0,"There was some actual tough, intimidating players like Laimbeer or Charles Oakley back in the day.   I don’t remember Oakley getting in a fight, but mostly because everyone would just back away if he squared up to them."
LatinoPeopleTwitter,fftocgl,t1_ffr2uds,1580225546.0,"Then they gets shot, then one of our broke ass justice systems somehow determines it was her fault for getting in front of the bullet and the guy walks free.   If she survives, she will probably take him back because according to her he’s a good man who made a mistake and she only shot her cuz he loves her so much.  I know my people."
GifRecipes,ffspsbr,t1_ffsoapx,1580188258.0,[This recipe sounds pretty accurate](https://www.mexicoinmykitchen.com/tacos-arabes-recipe/)
books,ffsl29o,t3_euostv,1580184361.0,The Godfather?  I guess people really love Puzzo lovingly describing Sonny's penis over multiple pages.
GifRecipes,ffseqfm,t1_ffsba27,1580179917.0,"Actually there are plenty of taquerias that sell Pueblan tacos árabes in Mexico City like Hayito and DonEraki, both have multiple locations.  There's a Hayiro around 3 blocks from my house."
GifRecipes,ffs7tyr,t1_ffs3bh5,1580175275.0,Un abrazo!
GifRecipes,ffroybd,t1_ffqzlq8,1580162600.0,"Tacos árabes are pretty much the same as a shawarma, but the meat used is pork instead of lamb. 

Al pastor incorporated the use of more Mexican ingredients (achiote, pineapple, tortillas instead of pita bread) than tacos árabes. 

Tacos árabes are originally from Puebla, the city between Mexico city and Veracruz (the port where most Lebanese immigrants arrived to in Mexico).   Most settled in Mexico City, but many also stayed in Veracruz and Puebla. 

Source: I'm Mexican, of Lebanese descent, and have lived in both Puebla and Mexico City.

*edit*: Thanks for the gold!"
videos,ffqzd98,t1_ffqi9hh,1580147046.0,"My hometown airport was a major hub for Pan American from the day it was inaugurated by Emilia Earhart and Charles Lindbergh.   Back in the 70’s this little upstart called Southwest tried to get the local government to also let it be their hub in the Rio Grand Valley, but they said no because we had Pan Am, so it would be embarrassing having a budget airline have to share with the world’s most important one. 

Eventually Pan Am went bust, our airport went into disuse, eventually even closing for a while.  We’re still the biggest city in the area, but our airport is the smallest.  The two cities in the valley that did allow Southwest to operate now have far bigger and busier airports, despite the fact that our airport is historical landmark and was basically America’s hub to South America for more than 50 years.  Even today because of this it’s still the main immigration point of entry for private flights coming in from south and Central America.   A friend used to work at coffee shop at that airport and he has a ton of pictures with celebrities who had to wait around the airport while their private flights cleared customs (they usually looked annoyed as fuck having to wait around in a little airport with nothing but a coffee shop for 3 or 4 
hours)

*Edit*: [a little bit of the history of the airport](http://texaslesstraveled.com/valleyaviation.htm)"
videos,ffqqsb4,t1_ffqqh3o,1580141477.0,"*Blow out*, a great, underrated movie."
starterpacks,ffqncq1,t3_eumsj5,1580139132.0,"never understood the love for minecraft.  Sure, good game, but isn't the creator now a huge men's rights supporter, white supremacist, and uber neckbeard?   I mean, reddit is pretty huge on disavowing those kind of people and their work but somehow minecraft gets a pass."
Music,ffqms37,t1_ffqjsjy,1580138730.0,"And the man still catches a whole lot of ""jokes"" about how ugly he is.  It's also a different time, kids are embracing diversity and body shaming is a huge no no.   Back then people still openly made fun of people with disabilities or of different ethnicities and it was seen as normal.  Watch some tv from that era and you realize most of those shows would have been cancelled in a second had they aired nowadays.    The guy just happened to be ugly in the 80's, a decade where narcissism became the law of the land."
videos,ffqgrvw,t1_ffqgq5f,1580134142.0,this too!
videos,ffqfqmq,t1_ffqe468,1580133266.0,"The guy said he's a sound engineer, kind of the perfect witness in an accident that nobody really could see because of the fog, but could be heard. 

Not only with a technical knowledge of how sound travels, but also with a trained ear for it."
Music,ffqf6cl,t1_ffq13v7,1580132779.0,"And most people don't remember him because he's considered one of the first victims of the rise of MTV. 

Wonderful song writer and performer, but the man was pudgy, balding, and not much to look at.  The fact that music industry began shifting toward the use of a visual medium as the main marketing tool didn't bode too well for him. 

You can't even blame it on a change of musical taste by the public, his style of soft rock/easy listening music was still wildly popular throughout the 80's."
Music,ffqeszw,t1_ffpozz4,1580132454.0,"And Christopher Cross is also considered one of the first victims of the rise of MTV.  After music videos became an integral part of music, his career took a serious nose dive. 

A balding, pudgy, ugly guy doesn't translate well to a visual medium."
soccer,ffleqml,t1_ffl3vsd,1580038766.0,"His club just released a statement, according to the team doctors it’s a fractured fibula and dislocated ankle.  He’s getting more tests done and will release more information on Sunday.  

He’s very lucky to be at Pachuca, it’s a top tier club which has invested heavily in the sports medicine department.    The club runs a football focused university and their sports rehabilitation department is supposed to be top tier."
movies,ffickre,t3_etrqvw,1579970650.0,Because Jackie Chan would have 57 Oscars
soccer,ffe64yl,t1_ffdhmzf,1579837715.0,"you are correct, in fact he was an important part of the Leon teams that won back to back Liga MX titles, not an easy feat that hadn't been done in almost a decade, and then being only the second team to do it since the two tournament era began."
soccer,ffdd9xc,t1_ffd97ut,1579818453.0,"Rafa Marquez is probably the worst MLS signing ever.  Huge contract and pull with Mexican fans. 

It became evident from minute one he had no intention of giving any effort and just cashing his huge checks.   He was so bad and toxic they basically paid him the majority of his contract to leave.   What really pissed off the MLS fanboys was how they all swore up and down he was washed up, then proceeded to move to Mexico and the club he started with and played a few more years at an amazing level.  Hell he even managed to get himself called up to the Mexican national team again l, make the world cup squad for Brazil 2014 and score a goal in that world cup."
LatinoPeopleTwitter,ffasduy,t3_es5c1b,1579743383.0,"My mom used to call me saying : *estoy en el mall, quieres Chika Fila?*"
soccer,ff9vdj0,t1_ff9ofis,1579722315.0,that’s the most *I've never touched a girl* quote ever.   Hercule Poirot can probably deduce how many piss filled Mountain Dew bottles the neckbeard that utter it has under their computer desk in their mom’s basement.
mexico,ff9sg7h,t1_ff90k42,1579720235.0,Igual en España.
confessions,ff912ei,t3_es9teg,1579702165.0,"Well, tbh the Megan Rapino type of haircut is pretty popular among older ladies, so mistakes can be made."
todayilearned,ff7izu3,t1_ff739ln,1579650671.0,Their remains technically already went over a waterfall.
mexico,ff6c3n5,t1_ff0v0d2,1579623946.0,Me acuerdo del pésimo nivel de información que la televisión manejaba en los 80's y principios de los 90's.   Un buen de gente fue abandona por su familia por todas las pendejadas de información de programas como este.  Este programa encarna perfecto la ignorancia y pendejeas de la típica señora Mexicana qué obtiene su información de chismes y novelas.
WTF,ff3bmf8,t1_ff38c2i,1579537980.0,"Sadly you are right.   Even with good insurance you can still get fucked.  A few years back my exes mom was diagnosed with breast cancer.   She’s a worrywart with disease, specially since her dad had died young of a brain tumor, so her health package offered an upgrade cancer package.   She asked me to ask my dad if it was a good idea.

My dad is an oncologist and had told her the cancer her father got was rare and related to exposure to certain chemicals because of his line of work, but if she could afford it she should as there was that precedent in her family. It came out to about an extra thousand dollars a years, thankfully the insurance she got at work was very good so it was basically the only upgrade she paid.  

When she was diagnosed and started treatment it really paid off, close to 40 or 50 grand, covering mostly incidentals in treatment.   We were in a small city in Texas and she got her treatment at MD Anderson in Houston.   This basically paid for the weekly six hour trip to Houston, lodging for the 3 to 4 days she stayed there, and other things.  Even with all this, she ended up spending close to 20 grand out of pocket when it was all said and done and she thankfully got a clean bill of health and has been cancer free for close to a decade now.

Again, this is a person with good insurance and who through sheer worry was spending over a grand a year in extra insurance, she still ended up having to spend close to two years to paying off the debt for her treatment.   I can’t imagine what it’s like for someone with very basic insurance living paycheck to paycheck.   Getting sick in the US has become an expressway to poverty."
soccer,ff2zksx,t1_ff2mm2x,1579529610.0,I wonder if there is a Cantona or crazy homeless guy outside 7/11 game?   That one would be quiet challenging too.
mexico,ff0d617,t1_fezv4ew,1579467774.0,"En Estados Unidos los limones verdes son limes, el limón amarillo es lemon."
JusticeServed,ff0a0py,t3_eq2sjn,1579466778.0,"A few years back there was a big case in Mexico city involving prostitutes who used eye drops to drug their clients drinks and robbing them. 

They ended up accidentally killing two wrestlers.  Both were little people (lucha libre has very popular little people wrestlers) who had hired them.  Apparently they didn't know the size difference affected the dosage, so they accidentally poisoned them.

Both of the women ended up getting lengthy prison sentences."
soccer,fezva3e,t1_fezurjn,1579462112.0,"always thought it was a nice city, got a really close friend from there who I should really go see one of these days."
soccer,fezttf1,t1_fezseyp,1579461573.0,"TBH i haven't been to Liverpool in years, didn't know about the Lost Soles tracksuit.  They are surprisingly tasteful as far as tracksuits go."
soccer,fezqjfx,t1_fezl960,1579460386.0,don't you need to steal a car stereo and get a perm in order to be formally enshrined as a scouser?
movies,feyq1qv,t1_feybi3c,1579449109.0,Best marketing strategy for 2049: *See a lot of Ana De Armas!  She's naked too!*
WTF,feyfmmj,t1_fewtwe8,1579444857.0,Nobody ever got the irony of hiring a convicted drug smuggler and snitch to do the voice over for that campaign?
WTF,feyeyw5,t1_fexpe3n,1579444586.0,"Also the home of untreated mental illness due to a piss poor health system.   

So many people like that fall through the cracks because they don't have adequate health insurance that covers the type of mental health treatment they require. 

Public health is shit and over saturated, when she sees a case worker they will usually just have to let them go because since they didn't commit a violent crime they are not deemed enough of a safety risk to spend resources on her."
cringepics,feskd1n,t1_fes5bfb,1579366142.0,"Or people who obviously never had sex, like this person.   This soooooo reeks of desperate virgin trying to sound like they're a stud."
cringepics,fesk4c4,t1_ferwnq5,1579366057.0,Grew up in Texas.  Those God damn mini tubs of Blue Belle homestyle vanilla ice cream are crack like during summer.
soccer,ferqo7j,t1_feo8k2t,1579357235.0,"I'd love it he pulled a Rafa Marquez 2.0, showed up 15 kilos overweight, had a no unnecessary running clause in his contract, did fuck all, and demanded to be paid in a cartoon like money bag with a big dollar sign in front of the ultra section.  

The Galaxy proceeds to buy him out, MLS fanboys say he's terrible and washed out, proceeds to move to another club, regains his form, and has one last great world cup."
soccer,ferpxng,t3_eqbk45,1579357009.0,"Always said, not all goals have to be poems, the ugly ones count as much as the beauties."
soccer,fep3zh0,t1_fen8ak7,1579311615.0,"Your problem is that taking into account the club's bottom line, Man U should be able to easily outspend every club in the Premiership and be right up there with Real Madrid in being able to freely spend and not incurring a FFP violation.  However a *HUGE* chunk of the profits are used to pay off the gigantic debt the club was saddle with when the Glazers used leverage to buy the club."
soccer,fep3mxp,t1_femxhje,1579311396.0,"Well the situation is a bit different.  Jerry Jones is a fucking egomaniac and has killed the Cowboys success through his mistaken belief he knows more about football than his coaches, thus makes terrible decisions on what players he brings into the team. 

Man U is severely crippled by having to pay off a the huge debt incurred by its purchase of the Glazers.   They are way, way more profitable than *EVERY*  Premiership club so they should be able to outspend every other club by a country mile, yet the tend to spend less now a days than other big clubs because a huge chunk of their profits are tied to paying off that huge debt."
soccer,fep1omp,t1_fenpw70,1579310154.0,"It works pretty well in the Liga MX, same protocol:  VAR officials reviews the play, informs ref if he thinks there is an issue, ref proceeds to stop the game and review the play (with replays and angles which the VAR official suggests, but can also ask for specific angles).  Then with this makes a decision.

To be honest, it works in Liga MX because the league has a long history of being the testing ground for new technologies.  This was due to the fact Guillermo Cañedo, who for years to was FIFA'S VP technology and development was also the president of Club America and the VP for sports programming for Televisa, Latin America's biggest TV network.  With this he had huge influence within the Mexican league and complete control of how games were broadcast.  Because of this FIFA would test basically every emerging technology in Mexico before it was implemented around the world.  Things like color broadcasting, instant replay, and live satellite feed of games were tested in the Mexican league before FIFA endorsed their implementation around the world."
soccer,fejxxl2,t1_fejl8ba,1579188377.0,"Lived in Spain for a lot of years.   Celebrity culture there is probably the sickest I've ever seen.  Probably the worst thing about an otherwise wonderful culture and country. 

The amount of shit people pull off to be famous is unbelievable.   Nuria Bermudes, who's now an FIFA agent but used to be basically a d list celebrity basically famous for sleeping around with other minor celebrities and footballers (she's the one who let the world know Claude Makelele was hung like a horse).   

Around the time the David Beckham/Rebecca Loos scandal was happening she decided to make her big move to the C list level of celebrity by announcing she too was sleeping with Becks.  Her proof was pictures of them together.  

Photoshopped of course, and by that I meant my they looked like my 3 year old nephew had done the job.  The light on the images was different, what one was doing was totally unrelated to the other, etc.

Yet they worked.  This knucklehead was on TV every day talking about her ""affair"".  She became more famous and soon was on a bunch of reality shows and magazines covers. 

I was blown away and talking to friends who were journalists or worked in the media they all told me that just how it was.  That it was a huge business with no oversight or much regulations.  Tabloid and gossiping journos could do things that were incredibly illegal in other countries for years, like tap into people's phones, spy on private property, etc.  And had only began to change a bit when Spanish laws were challenged in the European court of appeals because they were now part of the EU. 

On the other hand, Spain is also very, very backwards in laws that govern sex crimes as it has become very evident in recent years.   Violent rapes have an annoying habit of being downgrade to less serious sexual assault charges when both the defenders, prosecutors, and judges give into a boys will be boys mentality and question just how valid the violence that occurs during the assault the victims claim.  

This story doesn't surprise me at all, what surprises me is that she might actually have to face some consequences."
nfl,fegoafj,t1_feffjxh,1579098599.0,and he's the poster boy of just how terrible an injury a concussion can be.  Seeing this young athlete at the top of his physical form sobbing uncontrollably as he is trying to figure out what just happened to him on the field is heart wrenching.
MMA,fegkj1s,t1_fegh39o,1579095571.0,"Yup, it worked wonders for Todd Marinovich (being sarcastic).   Sure it got him to the NFL where it looked for a hot minute he was gonna make it, but it messed him up psychologically and drove him to a very messed up lifestyle that took him years to recover from. 

His dad used him as a calling card for his strength and conditioning business too."
politics,fedet86,t1_febttmr,1579009552.0,"And surprise, surprise Mark Furman is now a contributor on law and police matters for Fox News and other conservative news outlets."
mlb,feckq65,t1_fe8k5rg,1578976298.0,"Yes, it was a ""vintage"" line of clothing and caps from the early 90's.   I remember the jerseys were cotton and the fabric a bit heavier to imitate the old timey wool uniforms."
movies,fe9ejuv,t1_fe9e8oy,1578936895.0,and it's a disservice to how great his performance was otherwise.
movies,fe9edg4,t1_fe9ar4m,1578936830.0,"The thing, it could have been believable because they didn't have to do too much physical acting.   The WWII scene is him mostly standing around.  But the beating the grocer scene was just rough.  He could barely lift his leg and swung it like an old man trying to get in a pool.  

I say if you are gonna use technology go hog wild,  use a younger actor and superimpose his face on a wide shot and use VO.  It's not unheard off and it would have looked way, way better than the actual scene.   Even the shittiest special effects would have looked more belieavle than DeNiro trying to kick."
movies,fe9dh2j,t1_fe9cddk,1578936603.0,And this movie was full of technology to be able to use all these amazing older actors.   They couldn't superimposed DeNiro's face and do VO?  Do a close up of just his face?  It's literally a wide shot of him struggling to lift his leg.  That kills veneer that Sheeran is this juggernaut of a man.
movies,fe8w1iz,t1_fe8kyn2,1578931641.0,"I blame the scene where they make him beat up the grocer.  That was rough to watch.  You literally can tell it's a 70 year old man trying to kick someone and not break his hip.

*edit*: thanks for the silver!"
nfl,fe6d58a,t1_fe6264y,1578887441.0,It's a travesty a moron like Switzer has a super bowl win to his name.   Literally the least qualified head coach to ever win one.  It's the equivalent of giving a chimp a Ferrari and winning a drag race because he managed not to crash the car.
mexico,fe4q12v,t3_enabkk,1578861755.0,Vete a la zona rosa.  Seguro ahí agarras algo.
mexico,fe4nuta,t3_enisei,1578861211.0,"Este es la Parka II, la parka original sigue vivo y lucha como L. A. Park, perdió el nombre en un pedo legal."
SquaredCircle,fe4dilz,t1_fe4bn8h,1578858116.0,"My pleasure, the masked luchador business can be vexing.  Asides from fathers passing the name along to their kids, you also have weird situations like these when signing a shitty contract can end in the loss of your name."
SquaredCircle,fe49qp2,t1_fe3s0be,1578857121.0,"The one alive is the original, this is the guy who got the name after AAA took the name away from the original."
Volkswagen,fe2q198,t1_fe2pm9v,1578841651.0,You mean service records filled in crayon aren't valid?
Volkswagen,fe2phjc,t3_enfr87,1578841479.0,"That is soooooo fake looking, no check engine light?"
movies,fe2oh29,t1_fdydib5,1578841206.0,"Yeah, said months later and with the full backlash of what she said thought out and digested. 

It's really easy to try to amend and say it was a call to alternatives to violence when it was glaringly obvious what she really said was tone deaf and cowardly: *you're white and privileged, it's not your problem, don't get involved in scary stuff!*"
nfl,fe2jid8,t1_fdzp1lg,1578839120.0,The man was a gentleman and a scholar.  When he was on hard knocks his rookie year he paid his lady love the biggest compliment a man can bestow on a lady: *People stop you all the time because they think You’re Britney Spears*
nfl,fe2iv8o,t3_enis69,1578838848.0,"you mean to say a team that got hot at the end of the season and sneaked into the playoffs using a run heavy, time grinding offense and a strong defense that finally gelled are making a deep run and have taken out the glamour teams?  Colored me surprise, I mean I’ve only seen it like 8 or 9 times in my lifetime."
nfl,fe2evez,t1_fdzqdgc,1578837623.0,"Plus his first wife getting cancer and dying really shook him.  He realized those 16 hour days were time he didn’t get to spend with her and their daughters, so his priorities now are totally different."
nfl,fe2eioq,t1_fdzjyl8,1578837492.0,"His first wife getting cancer and dying really changed him.   There was still a chance of him coming back before, but after that his priorities really changed.  All he really is into now is spending time with his daughters, grandkids, and new wife."
nfl,fe2d4lz,t1_fdzqz09,1578837069.0,"Don’t forget about a lover of tacky suits, the man looked like he was going to an inner city prom every time he was on tv."
