subreddit,self ID,parent ID,time,textChoosingBeggars,fdys7o3,t1_fdyq44a,1578783025.0,"[the European Agreement on Au Pair placement](https://www.coe.int/en/web/conventions/full-list/-/conventions/treaty/068) which regulates how Au Pairs operate within the EU.   It basically details the length of time they can work, age range, and that au pairs are *NOT* considered household workers by law. 

This is the model pretty much followed worldwide and has been since 1971.

Also, this doesn't just applies to Eu citizens who want to become au pairs, specially since the schengen agreement came into place and they don't need work permits within the EU, so it covers non European girls who come to Europe to work as au pairs and need a visa to do it. It's popular because it's an easy way to legally live in Europe for women 17 to 30 years old for one to two years.

[The requirements for an Au Pair Visa to the US](https://j1visa.state.gov/programs/au-pair) which limits the age to less than 26 years old"
movies,fdy0bhw,t1_fdxjq5q,1578774691.0,"And why they are bringing these two milquetoast kind of hosts, specially Fey. 

They will make fun of the attendees, but in a more quirky, goofy way. 

Remember, Fey bravely came out and said people should just stop confronting white nationalists and just eat cake after all that happened in Charlottesville."
movies,fdxz434,t1_fdx7ha6,1578774362.0,"No, he doesn't, but he does present every charlatan in his show as experts on whatever bat piss and snake oil pseudo science they are peddling and usually questions established scientific theories with easy arguments like *we still don't understand a lot of it* or *science hasn't completely proven that yet*."
movies,fdwvd8h,t1_fdvptp3,1578762699.0,Don't forget about beastiality... So much beastiality.
HolUp,fdwthbs,t1_fdwtb2g,1578762186.0,"Well, spotted the white nationalist.  That was easy."
HolUp,fdwt86z,t1_fdw847p,1578762105.0,"They live off the tax payers in exchange for duties to the crown eg. Work as representatives of the crown, and thus the government, of England. 

Tons of members of the roya family do this, not all get a salary out of it.  Some like cousins of the queen usually just got to live rent free in Crown owned properties in exchange of these services.  That changed a few years ago when people started complaining they were living off people's taxes.  So now they live in crown owned properties paying ridiculously low rents (remember reading someone was paying 6 pounds a month for a huge apartment) in exchange for being representatives of the crown. 

Harry and Megan were a bit different. They got housing, a very large stipend, and security in exchange of their duties."
HolUp,fdwrjh5,t1_fdvpdy3,1578761656.0,"Shit, with how racist people in England and the media have been she's probably going to be killed in a drive by attributed to a dispute over a 40 that took place outside a check cashing place on MLK Boulevard so The Sun's headline can be ""Told You So!"""
ChoosingBeggars,fdwpn92,t1_fdofxcl,1578761163.0,"well, it's also a different situation.  Au pairs are supposed to be young girls, usually college or gap year age, who go into these programs that place them with a host family in another country.  They provide some child care, usually during the week, in exchange for lodging, food, and a stipend.   They then get weekends off to experience the country.   

It's a very common thing in most of europe.  Again, it's usually not girls looking for a permanent job or a way to emigrate.  They're girls looking to live a year or two abroad."
ChoosingBeggars,fdwontw,t1_fdmf0xe,1578760905.0,"but that's different than an au pair.  You are a professional doing your job,  au pairs are gap year girls, usually from well to do countries, looking for an experience by moving with a family in another country and helping with their kids in exchange of food, lodging, and a small stipend.  In some countries like the US, it also requires a special type of visa.   

Again, not saying that childcare givers should not be paid their just due, but an au pair is not a professional in any way of form.  It's usually a college or gap year girl who takes cares of the kids during the week then fucks off during the weekends to do stuff with her friends.   At least that's what i remember from au pairs i met when i lived in Spain."
movies,fdw0sj4,t1_fdvvc6i,1578753833.0,"Well, it's even a bigger problem whit people with no formal education.

The smartest person I know, my thesis adviser in colleges.  Had a PhD in history, was a fulbright scholar, and fucking walking encyclopedia told me something that's always stuck with me: People with no formal education have a really hard time discerning legitimate sources from false ones.   Even worse, they have a strong bias towards the ones that support something they believe and will ignore ones that contradict them despite having strong evidence of being right. 

The rise of the internet has made this a bigger problem because now you can find a thousand other idiots who believe the same nonsense as you and validate that belief.  

The Joe Rogan Podcast is a perfect example of this.  The man peddles some of the most ignorant bullshit out there and the people who follow him take it as gospel."
todayilearned,fdoq7bd,t1_fdo0d6o,1578610395.0,"Easy, do what 98% of Americans do when they meet actual Irish people.

American:  so you're Irish? I'm 198% irish too!

Irish person: Oh really? Where are your people from?  I'm from Donegal!

American: mostly Boston and Chicago, my name is Dave Chekowski. 

Irish person: That doesn't sound too Irish...

American: my great grandfather once ate a potato during St. Patrick's day so that makes me Irish on all 4 sides.   Besides that Boston is *WAY* more Irish than Ireland, everyone knows that."
todayilearned,fdopdkz,t1_fdnhj0d,1578609893.0,"He was actually really into computers and video games.   A large chunk of his fortune comes from him betting on video games becoming an integral part of the entertainment industry and having his IP made into games by investing in a game studio.  

I just remember the guy was on TV a lot after 9/11 because one of his books ends with a Japanese pilot flying a 747 into the Capitol during the presidential state of the union as revenge for a war between the US and Japan.   He looked really annoyed defending himself as the guy who gave the terrorist the idea."
pics,fdoaq3k,t1_fdo1kox,1578601806.0,"I wouldn’t hold my breath there, first she’s jewish and holds israeli citizenships, and most importantly her father, Robert Maxwell was a very staunch supporter of Israel during his time as a member of parliament and owner of the worlds biggest media empires.  She’s there because she knows she’s safe."
pics,fdo8qbj,t1_fdnpxi2,1578600835.0,"He was also married to a very famous London socialite, so more than likely he was just a party or event and someone took their picture."
pics,fdo8iet,t1_fdnn37a,1578600726.0,"And married to a wealthy London socialite, shocking him being at a swanky party where another wealthy socialite, Maxwell, was too.  

Apparently being at a party and having your picture taken now counts as evidence of being a pedo."
pics,fdo851f,t1_fdnvr1o,1578600547.0,"Khan is a world famous cricketer who used to be married to a wealthy London socialite.  How shocking is a picture of him talking to a another wealthy London socialite at a party in London 30 years ago?  If you were famous in London in the 80’s and 90’s you probably have a picture with Ghislaine Maxwell.  That doesn’t mean she procured underage girls for you.   If you’ve ever gone to those kinds of events with society pages press, the will literally round up people to take pictures together, it doesn’t mean they are best friends or associates."
memes,fdkbotv,t1_fdjps52,1578500481.0,Nooo Clamydia Riley give you Koalas!
todayilearned,fdk61ot,t1_fdjxh0h,1578496888.0,"His kids are just as bad as him.  If they do, nothing about the editorial point of view or how his media empire is run would change much."
politics,fdj91k4,t1_fdinfmg,1578461960.0,"And he literally bankrupted himself.  After his first casino was a success, he opened two other competing casinos and flooded the market and made all three unprofitable.    

It's been proven that if he had taken the money his dad gave him (some 200 million) and invested in the most boring and stable blue chip stocks on the market, he'd be way, way richer than he claims to be (which is nowhere near to what he's actually worth).  

This is a guy who people think is a billionaire tycoon because he and an NBC show convinced every gullible hick in the US he was.

*edit*: [a podcast covering how he bankrupted his casinos](https://theassetpodcast.org/episode/bankrupt/)"
mexico,fdib928,t1_fdhgp8j,1578439090.0,"Hay dos tipos de cuentas digitales.  Una de 17 y otra de como 180 mil.  La diferencia es con que app la abras.  Si es el app de BBVA es la de 17 y lo puedes hacer todo en línea sin comprobante de domicilio 
.  el app de BBVA México te deja abrir la de 180 y solo te pide que des comprobante (algo que requiere la ley por el monto).   El único problema es que solo te dejan abrir este típo de cuenta una sola vez y si abres la de 17 ya te chingaste y no puedes cambiar a la otra de mayor límite.   

Otra opción es abrir una cuenta de nómina que te da los mismos beneficios que la digital.  

El app de BBVA es bastante bueno, si vives en la CDMX puedes pagar cualquier servicio (luz, gas, teléfono, internet) desde este sin pedos y accesos a una tarjeta digital que es súper util al momento de comprar cosas en línea con Amazon, Uber, Rappi, etc.

Source: tuve una digital, abrí la de 17 pensando que podía hacer el upgrade a la de 180 sin pedos pero los del banco me explicaron que no se podía, entonces cambie a una de nómina."
memes,fdfwp6x,t1_fdfka0p,1578372266.0,"Donald Sutherland also has a degree in engineering from the University of Toronto.  Apparently he started out in engineering, but fell in love with acting in college, so he got a double major in acting and engineering."
videos,fdfv6sz,t1_fdftb4b,1578371074.0,"I must be remembering incorrectly, thought she said afterwards that it was because of the general abusive behavior the catholic church had carried out in Ireland, specially of women and children.  

But you weren't the only one.  The week after it aired, Joe Pesci hosted SNL and he addressed what happened in his monologue.   He straight up said if he had been there he would have slapped her in the face and he got a *HUGE* ovation for it.   Times change, attitudes change, with age comes experience and perspective.   If Pesci had said that now a days he'd be the one facing a shit storm about as bad or worse than what O'Connor had to face."
videos,fdfn9x8,t1_fdfhuvn,1578365634.0,"Well, it technically wasn't a protest just about child abuse, it was a protest of all the fucked up shit the catholic church had done in Ireland complicity with the government like how they limited abortion and birth control, abused unwed mothers and stole their babies, and a myriad of other fucked up shit. 

It's almost 30 years and we are now seeing a very severe backlash against the catholic church in Ireland.  The vote to repeal the abortion ban is a good example of it, passing with over 70% of the vote in favor of ending the ban. 

It was fucking hilarious seeing all the idiot American evangelical Christians and conservatives catholics go over to supposedly be part of Ireland reaffirming their tradition of strong, religious people saying no to abortion only to be met by people telling them to fuck off and reporting them for illegal entering the country to try to influence an election.  It was glorious seeing them cry and bitch about how Ireland had lost its way and say incredibly ridiculous shit like how the US was now more ""Irish"" than Ireland."
LatinoPeopleTwitter,fdd0gs8,t1_fdc9hhw,1578289950.0,"everyone is entitled to have an opinion.  This however, does not mean that opinion has to be respected or that you are inmune from any kind  of repercussion due to expressing that opinion.  

A lot of people have a really hard time understanding this simple concept."
