subreddit,self ID,parent ID,time,text
AskReddit,fffk483,t1_ffev0tl,1579885687.0,"likely they have hopes about who, but in a real disaster it is likely the first 15000 in the doors before the guards look at each other and say yep..time to shut the doors"
PublicFreakout,fff5wf2,t3_eta2t9,1579876515.0,the ole shoe attack...dangerous from birth to death
PublicFreakout,fff5pra,t3_et6cu3,1579876378.0,"she might need some help, looks distressed in the eyes"
PublicFreakout,fff5k0m,t3_eszeh7,1579876259.0,lol..he knows what he is
Milton,ffezsyb,t3_esyca7,1579871645.0,"How much money is in a bank? Few thousand cash up front? Seems like a really risky move for no payoff.

Hope they catch and lock some up so milton doesn't seem like a good mark anymore"
Conservative,ffez25i,t3_et4cta,1579870959.0,Ok I'm sure she could find competent women but the non binary people? They will almost all be nutcases
confessions,ffeyzld,t1_ffe35ie,1579870893.0,Omg..lol
funny,ffe44pg,t3_et0f5e,1579836202.0,"i want to buy this and give it out at trade shows as a gift.  
you got this, market it a different way than you think."
videos,ffe3oc7,t3_eswrhy,1579835864.0,"They are locking down anyone that has been in contact or suspected contact. Take that into context. They are actively trying. I spent a lot of time in Wuhan, it is an advanced high tech city, considered tier 2 but still an awesome place.  


They do have a bio lab that opened up a few years ago, which is likely the actual cause. However, hopefully this is contained or burned out in the unfortunate souls that run into it and can't fight it off.  


This doctor does not say anything more than they are busy. This is to be expected when they are locking down anyone that was even in the room with someone infected."
trashy,ffdtxau,t1_ffdjuj4,1579828834.0,He is onto something
PublicFreakout,ffd7hzb,t1_ffd6bfl,1579814921.0,i used french
PublicFreakout,ffd3me9,t3_eswm73,1579812766.0,"She is crazy for sure, but a quick google search shows that the USA does in fact have an official language....no it is not corruption.  Apparently it is English."
trashy,ffd2r3o,t3_ess8ak,1579812269.0,That is a man baby
PublicFreakout,ffbugs3,t3_esmzbo,1579783154.0,I love this video
PublicFreakout,ffbucct,t3_espigl,1579783030.0,Sad.  I really enjoyed my time in wuhan
interestingasfuck,ffb19wp,t3_esjrfc,1579749302.0,so Wayne Gretzky
JusticeServed,ffa9dhi,t1_ff9lfrr,1579730433.0,I have found it is all on how the police see it when they show up. Act cool and nice and have the other people on your side you will be fine
JusticeServed,ffa254h,t1_ff9ujie,1579726368.0,puts it back on all flustered and trying to apologize and seem cool at the same time...failing at all
JusticeServed,ff9udl7,t1_ff9sqbw,1579721551.0,Puts it back on
JusticeServed,ff9fape,t3_esbbm3,1579711780.0,"reminds me of this bozo  
[https://www.youtube.com/watch?v=eE\_vZOaxHoo](https://www.youtube.com/watch?v=eE_vZOaxHoo)"
JusticeServed,ff9erng,t3_esbbm3,1579711449.0,"that was nice to watch..lol  
big dude sauntering down, like jeez looks like ill need to handle this..calm as can be, i am betting buddy got off the train"
PublicFreakout,ff8tu6i,t1_ff8ts7o,1579695858.0,In death we have a name
PublicFreakout,ff8tsi0,t3_esan75,1579695810.0,Meth or just crazy?
PublicFreakout,ff8tmjm,t3_esawu9,1579695636.0,"Pretty sure his name is Doctor Ron Swanson. 
So lucky he was there"
AskReddit,ff5zgrg,t3_ero8mj,1579615137.0,Lazy. Not achieving what is possible...meh gets worse from there
PublicFreakout,ff5ybfv,t3_erq2lx,1579614195.0,The guy with the child and wife...haha suckers
Bad_Cop_No_Donut,ff44xh7,t1_ff3n4q2,1579555624.0,"and it looks bright as day outside, so how is this even a noise complaint"
Bad_Cop_No_Donut,ff44nbr,t3_erdkjv,1579555444.0,i really want a follow up post on this
PublicFreakout,ff3h4uj,t3_ereir2,1579540916.0,could have broken his neck...piece of shit
torontoraptors,ff2z8cg,t1_ff2z70v,1579529319.0,Ah ok thanks. Was about to consider getting the kids out of school to watch
torontoraptors,ff2z0sj,t3_ercqx2,1579529133.0,"is this going to be Carters last game in Toronto? i heard a rumour it was.  
The man needs some honours if so :)"
EntitledBitch,ff1ooq5,t1_ff0mp7t,1579482780.0,"you would likely do better by full out laughing at her as if she is a total crazy person. You would likely find some allies, who also think she has lost a screw. Then you could have a good laugh at how ridiculous she is. She obviously is crazy or on drugs or something."
RoastMe,fey9qpt,t3_eqrvd2,1579442653.0,Does he clean up when your other bf cums over?
politics,fey9lz8,t3_eqpp0t,1579442581.0,He's also on tape literally saying he would withhold aid if an investigation is not dropped about his son.  Nothing burger
sports,fey9gun,t3_eqseo2,1579442506.0,I wonder if they were both hoping for the ref to call it over
golf,fes24v3,t3_eqfi85,1579360631.0,"That is awesome, im trying to make sure i can get me and my 3 boys a membership this summer, some lessons for them. Then try to play as much as possible.   
Price is not unreasonable, but it is still a chunk of money  


Dream to be out as a foursome:)"
todayilearned,ferb5ug,t3_eqb4l7,1579351907.0,Brings tears to my eyes as well good sir
torontoraptors,fepn5xm,t3_eq9kwr,1579324974.0,You could literally see the other team sink lower when he hit it
canada,fepc1yr,t3_eq6cpx,1579316854.0,I used to workout at his gym in Toronto. :( hope Dwayne Johnson is with loved ones right now for support
pics,fepajzd,t1_fep6kh6,1579315842.0,:)
nba,fep98mp,t3_eq9k0w,1579314985.0,"i felt bad for the Wizards, just a bit though"
howtonotgiveafuck,fep7kq4,t3_eq69gt,1579313917.0,Those claws look sharp but my money is on the snake
pics,fep6jpw,t3_eq7ik1,1579313260.0,"oh wow, good job though :)"
gifs,fenvwnp,t3_eq291q,1579291709.0,"i dont know shorts could have been more green, socks pulled up a little more"
PublicFreakout,femp9j4,t3_epn5d3,1579265492.0,Ole mustache can throw serious hands though
PublicFreakout,femos9t,t3_eptxr6,1579265030.0,This is sweet..onions in my eyes
videos,fek6zki,t3_epkczi,1579193914.0,omg this is why we have amber alerts...and i want more video...please
AskReddit,fejtyl0,t3_epduqa,1579185788.0,rubiks cube
canada,feil1v5,t3_ep8x2n,1579141013.0,Cover their what? get a job
RoastMe,fecflm3,t3_eoddbu,1578972742.0,What is your correct pronoun?
PublicFreakout,fdtsrkz,t1_fdtkz49,1578721623.0,Gufawwwww i read this in his accent
PublicFreakout,fdts8p4,t3_en307i,1578721395.0,Lol the dude laughing his ass off is what kills me...lol
worldnews,fdst56h,t1_fds80y3,1578707605.0,Trudeau has already started cutting checks to Iran in an apology
conspiracy,fds7nob,t3_emspuc,1578696206.0,"So she is either deceitful or incompetent, take your pick"
AskReddit,fdp2akf,t3_emhkiu,1578618301.0,Omg the only real answers are labelled controversial
worldnews,fdove6e,t1_fdokp8l,1578613743.0,Kind of like claiming Notre dame was definitely not arson while it was still blazing.
aww,fdmbce4,t3_em1lqk,1578544598.0,Not gonna lie...this is pretty cute:)
torontoraptors,fdm8svu,t3_em3h9w,1578542648.0,lol  what a close game...loved it
seoul,fdm7z33,t3_eltfmb,1578542042.0,Wow they are really fishing hard
politics,fdlg0mw,t3_eltndp,1578523221.0,It is widely believed they just shot down a passenger plane. So i guess they do want to calm things down. Hope we can move forward and stop the war talks
golf,fdlcp0v,t1_fdkxko9,1578521206.0,i got this reference!!
PublicFreakout,fdlcc8v,t3_elvprh,1578520991.0,"iran for 30 years: Death to America....but not Americans?  


I feel for that guy, but he needs to look around. Make changes at home that are more in line with today's societal views. they literally executed 1500 people recently. Get rid of the old shitbags in power. They are stealing from the country and are utterly despicable.  


Trump killed a shitbag terrorist, i don't think it was a great idea, but i am not in the position to know all they know. PErhaps it was the right thing to do.  


we need some damn aliens to show up and be refs cause everyone is getting too worked up and im trying to live in a non nuclear winter thanks very much"
pics,fdgtwk9,t3_el9zl0,1578408217.0,"omg this is sad:(  
those people who started the fires in that area, if there are some need to be charged with murder"
howtonotgiveafuck,fddscxn,t1_fddcg12,1578322731.0,"im waiting for the vids of their faces....i mean i want to see more, there must be some good reaction clips to come still"
RoastMe,fdb1n9h,t3_ekfa0p,1578252680.0,"you could roast anything you want on that forehead  
i cant decide which is bigger the forehead or the chin"
startups,fdailio,t3_ekbhuf,1578246516.0,"Why not partner with a sales type person.  Lots of them are often in need of a good tech/programmer, i hire out of upwork.
Lots of tech/sales partnerships out there"
PublicFreakout,fd93hpj,t3_ejfb5z,1578227784.0,Enriching every place they infest
PublicFreakout,fd92m3x,t3_ejy05u,1578227471.0,Stuck 1000 years in the past
conspiracy,fd6nk7c,t3_ejz6bq,1578193481.0,"I don't see an invasion happening, do you?  
Seems they pulled a button a few pieces of shit. Funny, if you tend not to kill people in massive numbers, you tend not to appear on kill lists of powerful people.  


Don't kill people, and you are highly likely to never encounter a drone with your name on it."
OldSchoolCool,fd6n2e1,t3_ek03o3,1578193306.0,Why is hers orange?
worldnews,fd6m0c2,t1_fd6ad9t,1578192944.0,"please, releasing the nerds over here would fuck all their shit up.  
Things will be locked down quickly as their vulnerabilities are exposed. Not concerned with Irans ""Hacking"" ability"
todayilearned,fd2wph2,t1_fd2kq36,1578152357.0,Same as all movies and tv shows and commercials portraying dads as bumbling fools
dankmemes,fd08svu,t3_ejofnc,1578115339.0,[https://www.youtube.com/watch?v=GGU1P6lBW6Q](https://www.youtube.com/watch?v=GGU1P6lBW6Q)
thalassophobia,fcyj41p,t3_ejjvrz,1578080924.0,Things i never want to experience for $1000 Alec
Conservative,fcye5dv,t1_fcxlm32,1578078741.0,"exactly, cant have this pos in care of anyone"
Ebay,fcxkwr0,t3_ejdncn,1578065425.0,As a seller and someone who has been through it with PayPal. I will never touch them again. Hope they go out of business
todayilearned,fcwht8s,t3_ej4rim,1578025991.0,"yeah was a major pain in the ass to buy, i got it delivered by anyone visiting"
pics,fcwc04a,t1_fcuryxx,1578021896.0,Dune
JusticeServed,fcv62uo,t3_ej0i0e,1577995404.0,"lies about words on a coup...fired/resigns

&#x200B;

literally shoots people in the back...no problem  


Murica"
Unexpected,fcv60lp,t3_eixr95,1577995366.0,anymore stuff on the floor and they wouldnt need carpet
todayilearned,fctg73m,t1_fcte0dk,1577942236.0,"yasssss this is very ENTertaining  
ENT"
iamatotalpieceofshit,fcr1t44,t3_eiinrk,1577895531.0,When will the people just steam roll these pos cops?
PublicFreakout,fco3v8t,t3_ei4jx6,1577823576.0,Seems dangerous
PublicFreakout,fcllvps,t3_eho1g2,1577750838.0,he tried to share some pieces of his religion with other people but he got the pieces himself
iamatotalpieceofshit,fckmgv6,t3_ehm6mu,1577728524.0,This is why i go outside and watch people who just come into the area and park for awhile. Show them I'm watching
torontoraptors,fcj5hbx,t3_eheyky,1577677755.0,lol norm does not look amused
youseeingthisshit,fcgzb01,t1_fcfluxx,1577645597.0,"1..they approached her before the show.  
2..he can get rings off people easily and dropped it somewhere on the stage that was out of light soon after and then it was simply walked over to the gumball machine and placed into it by a helper"
canada,fcac5z0,t3_egtwot,1577566558.0,Who approved this? they need to be taken out of that role immediately
Bad_Cop_No_Donut,fc9h5qz,t3_egqabt,1577552612.0,i hope to see some serious arrests and jail time for these pieces of shit
PublicFreakout,fc95qeq,t3_eg698a,1577547461.0,Do we know what caused this stampede?
PublicFreakout,fc94r75,t3_egd7hp,1577547017.0,I'd only call him sugar gay if i ever met him
PublicFreakout,fc93usx,t3_egq9qu,1577546595.0,She is a racist piece of trash
insanepeoplefacebook,fc6z71j,t3_egfncb,1577493299.0,that lady is crazy..letting politics rule over family..ugh
PublicFreakout,fc5ocke,t3_efzzfs,1577462580.0,Id be in jail for smashing his stupid face off the ground
insanepeoplefacebook,fc4ev8b,t3_efwktq,1577414637.0,omg you found my neighbour
AskReddit,fc4eshk,t3_efz98e,1577414576.0,We have your browser history
PublicFreakout,fc4drqa,t3_eg1ev1,1577413735.0,She is now the regional manager. Burgerking is looking to sponsor her in the upcoming door breaking competitions.
Bad_Cop_No_Donut,fc32avb,t3_efwk7x,1577379812.0,Yet he supports the oppression in China. Lebron should keep his mouth shut and take his millions for playing a sport
videos,fbuulii,t1_fbuno9n,1577120606.0,"i would be cool with it, the dog was attacking a child, at that point it is game over for that dog soon"
