subreddit,self ID,parent ID,time,text
memes,ffha6r3,t1_ffh2pne,1579927637.0,"This man has never, and I mean never, commented anything other than ok. I just checked. Please explain"
flatearth,ffh9xd8,t1_fffbbg9,1579927398.0,I just died reading this comment
StartledCats,ffcjuei,t3_espp24,1579800996.0,Cat has activated: Escape
memes,ffcdj14,t3_esru3h,1579797123.0,Laughs in island
trippinthroughtime,ffcczx1,t3_esfbkp,1579796794.0,r/madlads
memes,ffccumf,t1_ffbg8h3,1579796704.0,r/wHoOoSh
memes,ffccpzg,t3_estaxo,1579796624.0,"It should say, if you are above 13 and don’t play with legos you need help"
flatearth,feyijwo,t3_eqloy1,1579445923.0,"Ya know, occasionally I see a real flat earther and I just think, what the hell went wrong with this"
Rainbow6,femw0r9,t3_eplad6,1579271087.0,Wait... hibana’s blushing...
memes,femvkr6,t3_epztvx,1579270760.0,Goddamnit i laughed fuck off have an orange arrow
memes,femv5uc,t3_epx8ia,1579270451.0,I would be devastated if my owner died
