subreddit,self ID,parent ID,time,text
UCSC,fpj5ybh,t1_fpj4e09,1588657566.0,ACCURATE
UCSC,fp0l0wx,t1_fp0kyvk,1588211399.0,I’m pretty sure you should look into your situation just to make sure
UCSC,fp0kfze,t1_fp04n13,1588211058.0,If you get financial aid it’ll impact it /:
UCSC,fp0kdr8,t3_gaiv2m,1588211022.0,It’s basically telling us we’re not getting our money back and them covering their asses
politics,foz1ryn,t1_foyy2vl,1588183203.0,....coup
worldnews,fonxmm1,t1_fonwlbu,1587928484.0,It’s not your fault. The education system has failed you! You just don’t know the facts. Natives were here before another whole civilization commuted genocide and wiped out their way of life. Calling them animals is perpetuating their dehumanization. I don’t care to argue with white ignorance anymore :/// another word for white ignorance could be settler ignorance if it makes u feel better!!! I hope u have a good day and life :)
worldnews,fon6ixd,t1_fomoluf,1587913313.0,Oh white ignorance stepped up u know it’s bad when U USE HITLER LMAOOO
worldnews,folzirc,t1_folyghc,1587874296.0,"You just sound white in ignorance dude. No hate for white people, just their privilege. If America is so free, why do we have the largest prison population in the world per capita? Big corporations run the country like an oligarchy. Look at the big picture and even though you feel free, not everyone is. The US is built off the backs of black and Native people. Structural inequality is real."
worldnews,folxj4k,t1_folwvve,1587872882.0,Yea ur white it’s ok :)
worldnews,folr898,t1_folqrzh,1587868589.0,Are you white? You sound white.
worldnews,folqc5t,t1_fokk419,1587867992.0,Why’s this getting downvoted? We need someone to liberate us haha fuck America
egodeath,foepsmy,t3_fijj4q,1587710709.0,This same experience happened to my ex gf. Like same exact thing up to the point that I had to look at how long ago you posted it to make sure it wasn’t her experience. This happened more than a year ago. She took a few hits off the pen and had the same experience. Youre not alone and it’s normal! Hope you’re helping better soon xoxo
politics,foeo2ql,t1_fodgfss,1587709175.0,"Hey dood. Politics aside and all reddit aside, your mom is a connection u will probably miss when it’s gone. You should visit her and just talk about other things and love her. YIU only live once"
UCSC,fobxa52,t1_fobvdre,1587664696.0,I can’t speak for the village just dorms and apartments
UCSC,fo9u7q0,t3_g6fi77,1587631336.0,"There’s no check in like other colleges. Not even a desk that you have to sneak by. That being said, I’d suggest u treat ur roommate like the desk. Make sure it’s ok with then first!"
interestingasfuck,fo9t6da,t3_g6apuh,1587630282.0,The golden years my fucking ass
UCSC,fo90u61,t3_g6a7g1,1587608009.0,Funny comments make chats go brrrr
Showerthoughts,fo0ejwo,t1_fnzm8b3,1587411674.0,Can I suggest something? Do that
WatchPeopleDieInside,fo03jr6,t1_fnyujtt,1587405458.0,Sheepie
WatchPeopleDieInside,fo03i0b,t1_fnyv4x7,1587405434.0,"Gender identity is necessary for oppression against women and female identifying people so men, the breadwinners can be the breadwinners and so the household can mirror the hierarchy that allows capitalists to maintain dominance in society - sorry if that wasn’t a good explanation in high af rn lmao"
AskReddit,fnyr2wn,t3_g4mlqr,1587372458.0,Drugs
WatchPeopleDieInside,fnyr1tp,t3_g4lxyx,1587372427.0,The fact that so many of y’all are confined by capitalism’s need to define a two gender system... actually pretty sad. Native American communities had mixed gender people until the patriarchal needs of capitalism shaped the hierarchy of the world. But keep your mind confined to society. Don’t think outside the box EVER
AskReddit,fnuq3io,t3_g3nika,1587268188.0,No. Earth is too beautiful and green. Not going to red ass Mars
interestingasfuck,fnsz9ep,t1_fns1cjq,1587231619.0,What better duo is there?
interestingasfuck,fns02w9,t1_fnrvc2a,1587208156.0,The only circumstance under which I’d be a cop
politics,fnrze6h,t1_fnr4y6m,1587207446.0,THIS KILLED ME HAHAHA
politics,fnpkayy,t3_g33lzd,1587146994.0,Maybe i should join that side after hall hahaha
worldnews,fnglktd,t1_fnektc2,1586936199.0,Fuck I wish
WatchPeopleDieInside,fnaywqx,t1_fnayq9v,1586806263.0,Yea based on how many times I’ve seen this same trick “go wrong” it probably is .... also her scream LMAO
WatchPeopleDieInside,fnahicc,t1_fnac8my,1586797601.0,That nail was going thru her
politics,fn9fll9,t1_fn8z2x9,1586771078.0,We’ll see. Trump’s neoliberalism probably won’t have the same results as it did 40 years ago... or at least it’s not looking like it. The system is being pushed to the brink
AskReddit,fn8dns1,t1_fn78jmc,1586739312.0,So he wouldn’t necessarily be very surprised by his fame at all. Technically.
UCSC,fn8ddqy,t3_g00dzw,1586739145.0,"Yea we’re paying for the degree technically, not the the education. And we’re still getting the degree"
AskReddit,fn5yjfd,t3_fz93hm,1586680511.0,Discrimination
politics,fn5ybon,t1_fn5ek92,1586680281.0,Fuck America- an American
UCSC,fn5xzdc,t3_fzqv4c,1586679925.0,You can but you’ll most likely be put in with other people
worldnews,fn3t58v,t1_fn3axgk,1586627406.0,It’s theorized that HomoSapiens did in fact kill off all other like-species (including Neanderthals and homo erectus)  in a race war-like scenario.
PublicFreakout,fn3sdq3,t3_fz1tra,1586626985.0,This is what happens when you create a hatred for police
PublicFreakout,fn3scck,t1_fn2s4qf,1586626963.0,The cops in that department will all get it too. And then they’ll complain to the government for not helping them too :))))
funny,fn3qg6u,t3_fz3e8v,1586625916.0,"Women be like: shave ur head

*shaves head* 

Women: kills you"
AskReddit,fn3odhh,t3_fyyj8z,1586624747.0,Cars 3. My dad and I snuck into it after another movie and it was so bad we left.
PublicFreakout,fn2p9pl,t3_fyz0r2,1586597775.0,Me @ the American flag
news,fn2m4do,t1_fn2hru2,1586594159.0,Ur mom caused countless deaths hehe
PublicFreakout,fn2lxob,t3_fyvqf6,1586593952.0,The virus came from China. Like stop Cunts. Fuck China
cuntsdownunder,fn2lqp1,t3_fqg3a5,1586593736.0,No definitely do spit on fucking pigs....
movies,fn2l8tj,t3_fytfr2,1586593190.0,Stealing from the rich and giving to the poor? Definitely a message this next generation needs to hear.
news,fn2kmt2,t1_fn0p5h3,1586592520.0,That was exactly my thought. Like not much of a crime stealing from ppl that are already stealing
PublicFreakout,fmz2d2c,t3_fy4loe,1586503767.0,So what cops can’t break the law??? They enforce the law they’re not THE law hahaha
UCSC,fmz28h0,t1_fmyotql,1586503631.0,Feel this. We’re gonna be hella glad to have u back & love & accept you for who u are ❤️💕💘💖
UCSC,fmz25aq,t1_fmyqmtl,1586503540.0,Someone should tell them....
politics,fmwt66w,t3_fxt01l,1586452588.0,I don’t think it’s meant to do that?
PublicFreakout,fmvpsx0,t1_fmvmtoi,1586426197.0,Fuck the establishment of police
PublicFreakout,fmvpr5x,t1_fmvdf20,1586426143.0,That explains it.
PublicFreakout,fmvpq42,t1_fmvjevt,1586426110.0,Right... how many white people does he see “not come to a complete stop”
PublicFreakout,fmvm33s,t1_fmtchcw,1586421988.0,Fuck pigs man you can’t even be black and fall in America without getting fucking attacked. I would’ve kicked that dog in the face and the pigs if I had the chance
PublicFreakout,fmvj7pm,t1_fmuu76o,1586418924.0,BIKES
PublicFreakout,fmnzr83,t1_fmnpf2u,1586240309.0,His stupid ass is gonna get what he deserves in court lmao. Hopefully his ass got sued and fired by her. If it was me I’d have taken a fat bite out of his fat bald head. Pig.
PublicFreakout,fmnyrvj,t3_fw9ujv,1586239388.0,Why the fuck is the 5 year old screaming that’s my car
news,fmmbpkj,t1_fmlte2h,1586202402.0,True thaaat
UCSC,fmmbisd,t1_fmmat2d,1586202308.0,Dope
UCSC,fmmapoz,t3_fw4dnb,1586201894.0,Yooo are you on Spotify?
news,fmm9p7w,t1_fmm5bbl,1586201378.0,Fuck the military
politics,fmlz66h,t3_fvwgnn,1586195840.0,So we’re all just gonna believe North Korea has the most beds... ok
AskReddit,fmlya7x,t3_fvsuu4,1586195401.0,Nice cheekbones
movies,fmjk4jh,t1_fmhixxq,1586131936.0,More like slumass
