subreddit,self ID,parent ID,time,text
todayilearned,fffgxk2,t1_fffgt0t,1579883719.0,Ok dork
todayilearned,fffgdm6,t1_fffgadm,1579883375.0,Cringe bruh
todayilearned,fffg2q7,t1_ffffqtf,1579883189.0,You’re no pilot you weird lying reddit nerd
todayilearned,ffffc22,t1_fffak0y,1579882731.0,"They’re extremely stuck on “no, I could never be wrong”."
todayilearned,ffff1m4,t1_fff5ve1,1579882550.0,“What’s a Pilot without their co-pilot” isn’t a saying either mr self righteous.
ProgrammerHumor,ffe2t2x,t1_ffe0a81,1579835221.0,So fix them?
PoliticalHumor,ffcin4m,t1_ffchnnb,1579800270.0,Exactly what a Russian bot would say
DunderMifflin,ff9wgf3,t1_ff9oc4h,1579723003.0,S04E13
ENLIGHTENEDCENTRISM,ff9mitv,t1_ff9h8et,1579716113.0,"Only single use, bust out that reusable one and suck away."
news,ff9fsus,t1_ff94vok,1579712088.0,Mods of legaladvice are cops so I doubt it’d go anywhere.
ENLIGHTENEDCENTRISM,ff9avk8,t1_ff9aqog,1579708784.0,I believe you can suck my pp
ENLIGHTENEDCENTRISM,ff9a7wf,t1_ff8v5pv,1579708375.0,I see the brain worms have fully taken over
trashy,ff6ofqs,t1_ff6mty4,1579631528.0,"1488 flag in literally the first panel.

The “ideal partner” has a fucking swastika on his shirt.

Talking about getting rid of the Jews and other “low IQ races”

“Secure the existence of our people”

Get the fuck outta here."
COMPLETEANARCHY,feu6vu9,t1_fetna7q,1579383719.0,"The subtitle of the article (or whatever the right word for it is) shows they wanted to have their feet licked and groveled and ego stroked, they don’t give a shit about actually helping."
toptalent,fet8h5k,t1_fesyuun,1579372745.0,"I’d like to see you pull this off

ETA: not to mention [this](https://reddit.com/r/toptalent/comments/eqfirn/juggling_with_a_table/ferskif)."
whitepeoplegifs,fet03av,t1_fesvf5w,1579370568.0,"Seriously! I wanna be comfy at my 8am lecture, idgaf what some chucklefuck thinks of my outfit."
todayilearned,fesvs75,t1_feskad0,1579369526.0,Proof?
GetMotivated,feo9e6a,t1_feo3254,1579296881.0,Because you’re a douche
todayilearned,fembyts,t1_fem6927,1579247861.0,Pretty sure you’re thinking of Shaq in [Kazaam](https://www.imdb.com/title/tt0116756/)
PublicFreakout,fem7lp6,t3_epm9y0,1579242643.0,ACAB
docker,felea47,t1_fel16d8,1579220139.0,that was four years ago though tbf
DataHoarder,feh26c4,t1_feg31nw,1579107584.0,"Gotcha, seems Narwhal (iOS client) doesn’t handle cross posts properly."
DataHoarder,feg1z84,t3_eoulck,1579073444.0,Did you forget to post the link?
