subreddit,self ID,parent ID,time,text
AJelqForYou,ffoxapd,t3_eudf1y,1580082945.0,"Had that happen to me to, when i started using weighted hanger then back to extender, it was like nothing."
tifu,ffnj0rn,t1_ffneq5c,1580066556.0,Cus' Jesus christ is coming to toooooooown
AJelqForYou,ffn5e5w,t1_ffldkx2,1580062194.0,"Also to add to this, using skin prep (can find at walmart) in the medicine bandaid section, along the shaft will assist with slipping, and air leaks as it provides a mild sticky layer and keeps skin oils away. Dont use with the tape on the tip though!"
averagedickproblems,ffmut6m,t1_ffksfm3,1580059187.0,"What would be my reason to make it up? You dont know my life or the people in it, i dont have an exact explanation on why he choose to share it other than me mentioning jelqing and such."
funny,ffkgwkw,t1_ffk41mb,1580022562.0,Ive seen this one
averagedickproblems,ffkf4cp,t1_ffj8uva,1580021733.0,"Concur, a coworker of mine i would say is fit, musclular, has the perfect smile and looks and is 6'6"", and can sing, has all the women pay attention to him... until he sleeps with them. Some quit the job, others were no longer dreamy eyed with him. He confided in me that he was only 4.5in x 4.25in, i informed him about this sub in hopes it would help. He quit soon after.

Edit, sorry i thought this sub was r/ajelqforu and didnt realize it was for such a cesspool of negative nancys, so go fuck yourself.. nevermind your dick isnt big enough to do that"
tifu,ffhijyj,t1_ffh46kx,1579936837.0,"I wanna go out in my sleep like my grandfather, not like the other passengers in the car."
AskReddit,ffh7zr9,t1_ffgpvmj,1579925710.0,Very true
AskReddit,ffh7yln,t1_ffgmv3k,1579925683.0,Michael myers?
tifu,ffh35h1,t1_ffgzlul,1579921839.0,Gallery lock is best
Documentaries,fffzhvn,t1_fffyqsz,1579895192.0,Try the sweetbread
AskReddit,fffyfk1,t1_fffy55k,1579894535.0,"They call it hawaiian, can any one from hawaii confirm this originated from there?"
AskReddit,fffybuo,t1_fff8mez,1579894471.0,The french would have one hell of a time to trying to find the damned lamb sauce
AJelqForYou,fffxvco,t1_fffhfhh,1579894183.0,"Bout the same routing as everyone else, but about 3 or 4 years now. Did do alot from age 14 to age 16 about 20 years ago when jelqing was first coming into light"
conspiracy,fffkuh1,t1_fffjrng,1579886141.0,Thats how the nsa gets your dna
technicallythetruth,fffic9r,t1_fffgluk,1579884592.0,"Earth, fire, wind, water, and heart"
news,ffddpbx,t1_ffd88mi,1579818713.0,"Who do you think has to be the criminal in this department and review these things to make the case.......
Ive said to much"
AJelqForYou,ffddlxw,t1_ffd8zco,1579818656.0,"No thats my goal lol, my current is 7.4 x 5.6"
news,ffd46ql,t1_ffd3j0i,1579813082.0,"Sir, please dispose of your original Blue Lagoon Movie and purchase the new edited copy."
news,ffd2dz3,t1_ffcpera,1579812063.0,FBI: how do you know this term?
WritingPrompts,ffd1zbt,t1_ffcyopo,1579811832.0,"Thank you, have been a lurker for a while on here and really want to get into writing my own material."
WritingPrompts,ffcnww9,t3_estta6,1579803471.0,"

""cubavit lamia oriri, ortus ac dona mihi votum tuum, cubavit lamia oriri, cubavit lamia oriri"", said Karen as she sat in the middle of her perfect circle of vegan blood substitute.

 ""I summon you lilith, my one wish to be granted in exchange for my soul, oh manager of the underworld succubus section!"", Shouted Karen

POOF! A black green smoke arises from the lines of cruelty free vegan blood substitute in the shape of a pentagon.

I rise up and focus my eyes onto this short haired stern looking woman who seems very disappointed in my arrival. She screams, ""And who in the Hell are you?""

""I am here because you called upon me! Lord of the weapons of destruction! Why have you summoned me wench?"", I said, my voice booming loudly for which only she can hear.

""NO NO NO, i asked for lilith, queen of the night, queen mother of the vampires, hidden mistress of adam! I didnt call for yooouuu!"", She said in a snarky voice, ""where is your manager?!""

""The complaint department is underconstruction at this time, would you like to be located to the waiting line?"", I said, ""its at the back end of the river styx, requires two coins, gold prefered but silver is ok, and no damned patchouli or sage allowed!"" 

""Seriously, i have to WAIT?!"" She screamed.

""Sorry miss, but use fresh virgin blood next time, you can do it now if you wish, just slit your....nevermind, im leaving have a nice day!"" I said as i laughed outloud and disappeared into the green mist.




This is my first writing comment, how did i do?

Edit: edited for capitalization, attempted to clarify first and third person views, its POV from the demon with responses from the other character. Hope this helps, thanks for the advice!"
nottheonion,ffch9p6,t1_ffcgw5i,1579799430.0,HAH! They think the fbi uses alexa to listen to them -Homeland security and NSA
AJelqForYou,ffc5r02,t1_ff4g6xp,1579792165.0,"Dont stress, just put in the work and at the 8"" mark work with girth, the girth exercises will assist with the final 0.5"" in length"
AJelqForYou,ffc5cld,t1_ffbvkhz,1579791897.0,[heres a link for info on underwear](https://www-livescience-com.cdn.ampproject.org/v/s/www.livescience.com/amp/63283-men-underwear-sperm-count.html?amp_js_v=a2&amp_gsa=1&usqp=mq331AQCKAE%3D#aoh=15797917697945&referrer=https%3A%2F%2Fwww.google.com&amp_tf=From%20%251%24s&ampshare=https%3A%2F%2Fwww.livescience.com%2F63283-men-underwear-sperm-count.html)
personalfinance,ffbzbjf,t1_ffbrftb,1579787466.0,Ive often considered this vs. FNP
tifu,ffbxban,t3_esmdmr,1579785789.0,This is why i eat super spicy things like this with rubber medical gloves
PublicFreakout,ffbguwe,t1_ffajpm9,1579764707.0,Its called BIRDEMIC: shock and terror
nottheonion,ffau4jw,t1_ff9q76p,1579744538.0,[utah guy died](https://www-insideedition-com.cdn.ampproject.org/v/s/www.insideedition.com/utah-man-dies-rabies-after-handling-bats-he-allowed-his-home-48336?amp_js_v=a2&amp_gsa=1&amp&usqp=mq331AQCKAE%3D#aoh=15797445080389&referrer=https%3A%2F%2Fwww.google.com&amp_tf=From%20%251%24s&ampshare=https%3A%2F%2Fwww.insideedition.com%2Futah-man-dies-rabies-after-handling-bats-he-allowed-his-home-48336)
AdviceAnimals,ffatrkc,t1_ff9w5ba,1579744299.0,The sustenance of life
