subreddit,self ID,parent ID,time,text
BlackPeopleTwitter,ffagcx7,t3_esk1bk,1579735108.0,Maybe don’t give an 8 year old child a smartphone?
toptalent,ff8sgru,t1_ff8s7qa,1579694333.0,And he’s
trashy,ff83ja0,t3_es68m9,1579665030.0,You’d be surprised about that manners bit..  my neighbor literally dumps her cats litter box in the now dead grass directly next to our shared front porch as well as cig butts and her massive dogs shit that she refuses to clean up
tooktoomuch,ff826mp,t1_ff81z63,1579664034.0,Lol we don’t actually care we just want to know like did you see him doing bumps then proceed with the pushups?
tooktoomuch,ff8193y,t3_es5z3l,1579663348.0,What led you to believe this man had done cocaine before a few pushups
RoastMe,ff7mmp2,t1_ff6yvml,1579653180.0,Do not pass the blunt
watchthingsfly,ff7fu6k,t1_ff42doi,1579648578.0,Definitely sweat
trashy,ff6rknv,t3_eryzds,1579633402.0,Happenis
oddlysatisfying,ff6mejz,t1_ff6i6ai,1579630300.0,Knot wood
trashy,ff5ac7o,t3_erq3ui,1579585084.0,This is so old
skateboarding,ff5574e,t3_eroyrt,1579580558.0,Let them know what’s up like the older dudes did when we were groms
oddlysatisfying,ff3a7ff,t3_erey7m,1579537252.0,When you take a piss in the morning and that first bit goes everywhere
oddlysatisfying,ff33joi,t1_ff31aau,1579532768.0,Adderall
television,ff20778,t3_er0byy,1579490325.0,The revolution will not be televised
trashy,ff1qz8r,t3_er5w40,1579484251.0,Free beer
coonhounds,ff0r93j,t1_ff0jzna,1579471551.0,Haha yeah they pick up on stuff really quick. Sometimes too smart for their own good
oddlysatisfying,ff0j8ht,t3_er2gfo,1579469401.0,"If you post something on reddit, it’s probably a repost"
coonhounds,ff0gvqr,t1_ff0gmkm,1579468767.0,Redbone/beagle she’s a bit smaller than most coonhounds but definitely has all of the personality
coonhounds,ff0fte7,t3_er23ij,1579468496.0,"What a sweet puppy, my girl Rose has the same markings. still a handful at about a year old"
oddlysatisfying,fezxrf8,t1_fezvyx4,1579463085.0,Ok
oddlysatisfying,feziwz1,t1_fezh6fh,1579457799.0,Depiller
oddlysatisfying,fezij7a,t1_fezgkjl,1579457714.0,"Everyone google depiller, 4 dollars on amazon"
nextfuckinglevel,feui2jy,t3_eqn7q7,1579386735.0,Wow
trashy,feu45u0,t3_eqmk0s,1579382969.0,Double bag it and get to work
nextfuckinglevel,fet9mfx,t3_eqjnn2,1579373021.0,Oh no that’s terrifying
trashy,fenlfvw,t3_eq4e0p,1579287206.0,"I mean but, look at their super cool Mercedes SUV tho"
interestingasfuck,fenhdsg,t3_epztpz,1579284726.0,Boosters returning the the department of redundancy department
trashy,fengfph,t3_eq3vbd,1579284144.0,Meth
BlackPeopleTwitter,fen2oj5,t3_epro03,1579275633.0,"I never got this.. I am embarrassingly broke and I never clown on people when they get stuff they like. Not hard to just say hey, cool shoes and move on"
trashy,felxhlb,t3_epuozm,1579233416.0,L I T E
BlackPeopleTwitter,fek1i32,t3_epl05w,1579190598.0,What’s not to like? S&G fuck
ween,fehj8xp,t3_ep71q7,1579117664.0,All of them: #1
skateboarding,fehfvjg,t1_fehfd2y,1579115690.0,"Hell yeah man, that park is rad. I’m based in NC, took a trip through there then hit west coast last spring"
skateboarding,fehejpz,t3_ep632n,1579114913.0,Boise park?
oddlysatisfying,feguxgq,t1_fegu5tn,1579103095.0,Sadistic fuck slowly steals gravel driveway
gratefuldead,fegoa5p,t3_eot4h6,1579098594.0,Anything with Brent gets me going
skateboarding,fefqqpc,t3_eovxia,1579062494.0,Donglord
toptalent,fefokah,t1_fef5khi,1579060918.0,Chyes..
toptalent,fef5zt4,t3_eotus0,1579048991.0,That’s a weird looking sink
nextfuckinglevel,fef5es9,t1_fef37hx,1579048591.0,Ray would be proud
trashy,feer5d8,t1_feenfvw,1579039446.0,"I agree with you about certain opinions being validated more than others but, oftentimes seeing a post with trump stickers they’re also accompanied by an ASS EATER 9000 sticker or something similar"
nextfuckinglevel,feeqm8i,t1_feem9cp,1579039134.0,I’ll do my best?
nextfuckinglevel,feelaa1,t1_feegkt0,1579036050.0,Merica
trashy,feejm88,t3_eor8l6,1579035079.0,Let people do their thing in peace
pics,fee0xqj,t1_fed6l0e,1579024095.0,Oof.. my current one
WatchPeopleDieInside,fee0rxv,t1_fedkq3b,1579023994.0,"Bold strategy, seemed to play out well though"
nextfuckinglevel,fedng0l,t3_eolgk2,1579015767.0,Play penny slots until I die
oddlysatisfying,fedmmfh,t1_fedk47x,1579015229.0,"Those pieces are still pretty sharp, better to give a dog large uncooked bones"
ween,feb1fyg,t1_feb17j6,1578954511.0,Good plan
ween,feaz34i,t3_eobb50,1578953740.0,Welcome mang the first ween hole is magic. Check out the live at Stubbs album
toptalent,feavyx9,t1_feapdyb,1578952737.0,"I can see that, very well done"
toptalent,feafe0p,t3_eo8v5q,1578948023.0,Is this not a photograph of Bryan Cranston?
toptalent,feaabjo,t1_fea9hh3,1578946235.0,My shitty wah
nextfuckinglevel,fe9udbv,t1_fe9raiw,1578941521.0,You are now alone
nextfuckinglevel,fe9u7sh,t1_fe9tyq0,1578941468.0,Makes sense
nextfuckinglevel,fe9k2zl,t3_eo7mvd,1578938546.0,Mongolia?
nextfuckinglevel,fe9fmsz,t3_eo6las,1578937133.0,Hold my molly
skateboarding,fe9etkm,t3_eo6uug,1578936987.0,That was slick
skateboarding,fe9e710,t3_eo78ki,1578936763.0,That looks fun as fuck
oddlysatisfying,fe912xl,t3_eo6awx,1578933045.0,That man is talented
skateboarding,fe8v57q,t1_fe7qgic,1578931301.0,"Sick, I’m down in NC hopefully taking a trip up the east coast this spring. I’ll have to stop through there"
skateboarding,fe8bl4s,t1_fe840x5,1578924538.0,Depends on your skating style
BlackPeopleTwitter,fe7zkv8,t3_eo3u1x,1578920871.0,Damn this explains my older brother I guess
BlackPeopleTwitter,fe6jjss,t1_fe6jcap,1578892965.0,Not gay unless the balls touch
mycology,fe6jg8v,t3_enzg0a,1578892870.0,"Probably moisture, could be bacteria of some kind, you have a microscope?"
BlackPeopleTwitter,fe6jcqw,t1_fe6j9ms,1578892774.0,Also hilarious.. and gay.. hilariously gay
skateboarding,fe6hzul,t3_enttkl,1578891499.0,"Where is this park man, it looks like a lot of fun"
trashy,fe5rywc,t3_envv1r,1578873662.0,Alert the police
nextfuckinglevel,fe5ogxe,t3_envhq2,1578872172.0,Neato
skateboarding,fe5nfnf,t1_fe5mk10,1578871770.0,Hell yeah how do they skate? I’m breaking in a pair right now haven’t skated them yet
trashy,fe5kp71,t3_enutf8,1578870669.0,Got some franks red hot
skateboarding,fe5kj52,t3_enttkl,1578870594.0,Those the chima 2’s?
trashy,fe5aunf,t1_fe4o4o4,1578867160.0,Yes
ween,fe2x97s,t1_fe2wzy9,1578843886.0,It’s ok
trashy,fe2w5b4,t1_fe2s761,1578843498.0,A whole lot of them definitely are
trashy,fe2rea9,t1_fe2r204,1578841985.0,Custees this way
trashy,fe2r0xt,t3_enoi3q,1578841932.0,Headyy
shrooms,fe27zgx,t1_fe01jtg,1578835475.0,When the album drop?
pics,fe0ilhi,t1_fe0glh7,1578813969.0,North Carolina
BlackPeopleTwitter,fe0ehs1,t1_fe0e6u8,1578811887.0,Lavondrious? That you?
oddlysatisfying,fe0ak4f,t1_fe08wck,1578807829.0,Hot stuff
festivals,fe08g1n,t3_elbwqo,1578805905.0,Never would have guessed big something would play bonnaroo
trashy,fdzuqli,t3_enhhxw,1578796257.0,I saw something similar dining at a small authentic Mexican spot one time and told them to gtfo and go to an Applebee’s.. my bad
tooktoomuch,fdztp1o,t1_fdzt0ha,1578795554.0,Possibly 4th degree
tooktoomuch,fdznj16,t1_fdzmsec,1578792011.0,Nah she got the gurns
mycology,fdzbw6m,t1_fdzb9cn,1578788574.0,"Should be fine, like the other guy said if there’s no mold or bugs your good"
nextfuckinglevel,fdzb31s,t1_fdz5nj3,1578788398.0,*plants for hire
ween,fdzavnb,t1_fdxzhem,1578788324.0,Sure was
todayilearned,fdyouay,t1_fdyo185,1578782094.0,Seems unnecessary?
todayilearned,fdyn3p3,t1_fdymsw7,1578781565.0,"Tried them, not a fan"
pics,fdyn00l,t1_fdyji5i,1578781527.0,You guys have strange taste in pudding
todayilearned,fdylwhs,t1_fdyjtk6,1578781238.0,Raw papers only
trashy,fdyl9ro,t3_ene8i7,1578781013.0,Trans fights?
nextfuckinglevel,fdyfz0r,t1_fdyftye,1578779403.0,Let’s upvote it
oddlysatisfying,fdy6rbp,t1_fdy6j7i,1578776663.0,You can see the etch marks marking out the inches
oddlysatisfying,fdy5ya5,t3_encxvx,1578776472.0,Get you a leaf blower
oddlysatisfying,fdy5q2l,t3_end0nt,1578776394.0,With a ruler
PublicFreakout,fdxwzfw,t1_fdxfj6v,1578773801.0,Possibly the most profitable racket
skateboarding,fdxkr6f,t1_fdwvg6b,1578769856.0,Hookers and cocaine.. also loudog
skateboarding,fdxkjx2,t3_en8588,1578769775.0,Revert noseblunt was slick
