subreddit,self ID,parent ID,time,text
ptsd,ff8yhi8,t1_ff8tey2,1579700114.0,"Most are. You kind of have to have no empathy for people to be able to kill them. If you see a human being before you then it's going to make it harder. My uncle is like you describe, he was in the army for 40 years. He is the most psychopathic person I know."
ptsd,ff8y8cw,t3_es4tcy,1579699906.0,Dump his misogynistic arse. The boy is no good.
AskReddit,ff8xn2c,t1_ff8w4df,1579699407.0,Remember when they told Jen a black box with a light on it was the Internet. Then she presented it to the board... Oooof hahaha
BlackPeopleTwitter,ff8wuh4,t3_es42d9,1579698705.0,He just tryin to find his tribe... In Alabama
awakened,ff8w97e,t1_ff7p1wa,1579698175.0,">I hate the type of people that think they're better anyone because they're ""more awakened than everyone else"", to me it sounds like your very egotistical and negative. Those type are the ones who make the earth unbalanced to there ego nature thinking they're better.

>That's why us more awakened people are here to help and guide to the right path of positive energy but that's up to their descion. 

You should assess yourself"
AskReddit,ff8vh94,t3_es76uw,1579697471.0,The inbetweeners and the IT crowd
AskReddit,ff8va82,t1_ff88wcx,1579697286.0,I came here to kick ass and drink milk and I've just finished my milk
privacy,ff8uybc,t1_ff7zbxj,1579696967.0,I bet it's as wonky as his eye
privacy,ff8utpo,t1_ff8mbta,1579696843.0,"Yeah, it's instant karma... How does he like it now?

I genuinely want to know the answer to that question"
privacy,ff7o98u,t1_ff7bmqg,1579654317.0,That's by design. (Well as far as I can see anyway). When it benefits the government it's no wonder they are slow to act. Look at quickly they act when anything is against their interests
privacy,ff7o3wr,t1_ff7ie31,1579654211.0,"You're right. However, Project Fear has been so effective on the masses. That method has been used since the inception of religion. What a shame people believe their programming/indoctrination, we are awake while the rest are napping or are just to lazy to care. Their complacency is creating our idea of Hell."
privacy,ff7kx40,t3_erx4pa,1579651994.0,I've been having the same problem shutting down some online shopping accounts as I'm purchasing cash only from now on. Those bastards make you send an email with all your details on before they will close your account. *sigh*
AskReddit,ff7jv0l,t3_erzmpz,1579651260.0,A kidnapping lair
privacy,ff7gstj,t1_ff6e54l,1579649206.0,She was just a social climber like the rest. She just wanted to be top tier because it was better up there. Just like how most people want to be financially secure now. Can't blame a person for wanting better in life.
AskReddit,ff6s2w0,t1_ff639w5,1579633709.0,Tea bagging is a power move
RoastMe,ff6rab5,t3_ersu8c,1579633230.0,"Incy wincy bad bangs

Made all the peni limp

Made a bad career change

And moved in with her gimp

She asked for a roasting 

And they all said the same 

That incy wincy bad bangs

Can make the penis lame"
RoastMe,ff6pjxa,t3_ersu8c,1579632198.0,"Humpty frumpy sat on the loo, 

Humpty frumpy was full of poo, 

All of reddits roasters and comments of spam

Went and put frumpys self-esteem in the can"
facepalm,ff6nyuq,t3_ero3ym,1579631246.0,"This is one of those ""I ain't touching that"" posts"
awakened,ff6fzzv,t3_erq1eu,1579626381.0,Not today NSA
facepalm,ff6ddi8,t3_ersft8,1579624747.0,Them babies are walking out her foof and tantruming about naps and potty training
facepalm,ff6cytz,t1_ff5q1cb,1579624493.0,I have those elephant pregnancy feels
privacy,ff6b8i8,t3_eruyrv,1579623391.0,"The listeners are creepy as fuck ""we did this to ourselves didn't we guys..."""
privacy,ff67kzl,t1_ff61vm1,1579621023.0,Yep. It's fucked. We are fucked. They played us like a fiddle
privacy,ff5zgbe,t1_ff5z64c,1579615127.0,"Who knows how long Facebook has been sharing our information... Those old pictures and old account might already have been shared way before we knew about FB privacy concerns. 
 https://www.cnet.com/news/clearview-app-lets-strangers-find-your-name-info-with-snap-of-a-photo-report-says/"
