subreddit,self ID,parent ID,time,text
privacy,ffcpc4h,t1_ffcniw1,1579804346.0,"Idgaf what people **choose** to wear. That's my point. Just because there are a few bad actors doesn't mean you ban it. It's a bit like privacy, just because a few conspire to murder doesn't mean we should all be spied on. 

How can you be in this sub and have this shitty attitude? My approach would be to pass a law and those that want to use it can. Besides, those that are forced to wear it mostly live under the Taliban. Doubt you have much of that there in the Netherlands..."
NatureIsFuckingLit,ffcljb4,t3_esczdv,1579802020.0,They are brutal. They do remind me of Welsh girls scrapping over the local chav because he's been shagging them both and they're loaded with vodka jellies.
NatureIsFuckingLit,ffcithi,t3_essvg6,1579800378.0,This sub has made my day
exvegans,ffcham0,t3_esu0ts,1579799446.0,"Ummmm I don't see the point in just treating animals kindly, if you want the moral high ground treat people and animals the same."
lostgeneration,ffcgud1,t3_esrnut,1579799168.0,"Wasn't he at Davos yesterday saying ""yeah I love the environment, I'm big on environment stuff..."""
interestingasfuck,ffc8n2r,t1_ffc8evm,1579794051.0,">""should we continue on that path or take stock of what we already have? How far do we take things?"""
privacy,ffc59w6,t1_ffc09ct,1579791847.0,"Please don't use propaganda to oppress people's choices, so long as they are choices who are you to say anything?"
UFOs,ffc538n,t1_ffc50oe,1579791723.0,"Thanks, dad bot."
UFOs,ffc4zit,t1_ffc3rs7,1579791655.0,"Yeah, I have them feels. I sometimes only read a couple of lines and scan to the part where they saw something if I can be bothered. Mostly I give up. Like I'm not emotionally invested in your life I just want to read the actual details of supposed sightings."
conspiracy,ffc4igv,t3_essm14,1579791331.0,Reddit really belting out some disturbing stuff today...
AskReddit,ffc3ynb,t3_ess64d,1579790954.0,"Off you fuck

I'll take it under advisement.

I'll be sure to remember that for next time

Of course, you are right you're always correct

Don't let me keep you

Don't you have to be somewhere? 

Sure, sure, sure, huh hu

Hrrrrrmmmmm ok"
UFOs,ffc3fl4,t3_estiqn,1579790580.0,"Sometimes there are a lot of words to say they saw nothing.

""So like I was living in Arizona and I was having ham and eggs for breakfast like I always do and I was pouring my coffee. I like it black with just 1 sugar because I find it too bitter otherwise. Then my partner sent me a text about how we were going to meet later that day. So as I was replying I couldn't help but notice the neighbour was getting their morning paper and I waved like I always do.... 

20 minutes later

So I looked up and there was this light in the sky and I don't know if it was a reflection from the window or just one of those weird eye flashes but I definitely saw something. So I set my coffee back on the table while I took a closer look and it was still there but as I moved around our gorgeous new kitchen island we had installed last spring I kept my eye on it and you know the damn thing just disappeared. Now I don't know what it was but I think it was UFO"". 

Thank you for reading my diary entry for 2/5/2015 and participating in my diary entry for 20/01/2020"
BlackPeopleTwitter,ffbygse,t1_ffbwalh,1579786771.0,"""Knock one up while I make a super noodle sarnie innit"" if you come from the boarder of England Wales."
NatureIsFuckingLit,ffby93j,t3_esrwvi,1579786590.0,I'm loving the cute baby wars on this sub today. It's cheered me up no end
LateStageCapitalism,ffbximf,t1_ffbx7ip,1579785963.0,We are paying for socialising losses and privatising profits.
interestingasfuck,ffbxdea,t1_ffbwdg8,1579785838.0,"I get your point, I really do and it's hard to argue against such an emotive reason for doing this. However, these things never just stop there and that's where the cost will be. 

Moreover, as a species we have been incredible at creating life through IVF and saving premature infants. We've become so good at it we have saved these infants from death without the means of supporting when they are disabled beyond our capabilities to care for them properly. Sometimes that means a lifetime in intensive care. We create life and our earth cant cope with the population explosion as it is. The hard questions are, ""should we continue on that path or take stock of what we already have? How far do we take things""."
interestingasfuck,ffbw157,t1_ffbvm3f,1579784646.0,"For me this falls under ""just because we can doesn't mean we should"". Looking back at our most recent history we carry mini-computers, cameras and listening devices in our pockets. That's great! However, it's come at the cost of having zero privacy. What's the cost of this going to be?"
conspiracy,ffbuij1,t1_ffbb6f9,1579783202.0,Good. I hope they are released publicly
Glitch_in_the_Matrix,ffbtpy8,t1_ffbp9jd,1579782402.0,Stole a donut but needed to confess crime
interestingasfuck,ffbt64s,t3_esqsa5,1579781829.0,That's enough internet today
conspiracy,ffbsjsk,t1_ffblzt0,1579781133.0,"There is a culture of this now... ""Yes but.... No one is perfect.... Let us forgive them their flaws... They're really good at doing X"" no, he is a fucking paedophile and I don't give a shit if he can solve climate change. Take his knowledge at the same time as ostracising the cunt, then throw him on the bonfire with the rest of them and watch them burn. 

Like forgiveness ever stopped an abuser. It just encourages more of the same. If you want to love and forgive them offer up your own kids to them and see how that works out. (Obviously I don't want any kids offered to paedophiles but if you suggest this to them they get angry, presumably because it's ok they do what they do so long as it's not your own kid)."
privacy,ffbrh8p,t1_ffb1iwv,1579779864.0,I don't think there is such a things as a 'free country ' anymore. Too much propaganda and generally confusing yet a complete overload of information and misinformation. Even on this sub people will berate you because you don't know absolutely everything. We've all been caught up believing something that false. I think that just shows how effective it is and how difficult it is to keep up with the truth.
privacy,ffbr9iw,t1_ffariyh,1579779599.0,"France banned the burka, hijab and niqab. Using Muslim terrorism fear arguments meant that people asked for it to happen. Those that are awake and watching knew that propaganda about Muslims was for a bigger purpose. Only now do they realise what that was. Too late now, we tried to say but no one listened."
interestingasfuck,ffbqga1,t1_ffa3zbb,1579778556.0,Am I the only one thats horrified by this?
AskReddit,ffbq9gc,t3_esjj44,1579778302.0,This thread has taught me that money really does bring peoples true colours out and not in a good way.
AskReddit,ffbm7x0,t1_ffbm4ut,1579772278.0,It probably worked for him one time and so he keeps doing it in case he gets lucky again lol. Poor bloke has a lot to learn!
collapse,ffbll9k,t1_ffbfime,1579771318.0,"I live in Wales on the border to England. Wales have just committed to all new homes having a zero carbon footprint. They have ground sourced heat pumps, wild grass rooftops and super insulation. We also are looking at investing in tidal wave technology for energy. 

We are doing good things, but we only got them done by demanding them."
collapse,ffbljz5,t1_ffb6i66,1579771263.0,"Yeah because you're just virtue signaling now and trying to be superior. It's gross.

Here is some copy pasta

So let me tell you what a mix of political and socially responsible people in my area have achieved. 

We have a local farmer that now has bees on his farm. We are surrounded with farms and 3 more have committed to housing bees also. 

People from different political leanings have put pressure on the council to install ports for electric cars. We have 17 designated points to date. Residents were asked to complete a survey asking if they would change to electric if they were installed 87% said they would. 

We now have reusable recycling bags instead of plastic. We are aiming to be plastic free by the end of this year. 

We have the council now not cutting some grass areas entirely leaving some areas long for wildlife and biodiversity. 

This year the council is changing some grass areas to plant wild flowers. 

Designated areas have been left for hedgehogs to hibernate in, all pressure from the locals. 

The council has completed 90% change over of street lighting to more economical types. They are white instead of the orange ones. They have also been more diligent with switching them on and off appropriately to save money. 

Over the past decade the council have refurbished all housing stock. They all have super insulation and solar panels. One of the farms has created a solar field on one of his most useless plots of land. 

There is a proposal in the works for all business properties in the town to have their own solar panels. The proposal is the excess funds are to be diverted to help bring down business rates. 

So you sit there and say that people are doing nothing. People are and if you got involved with your own you will probably see there is a lot more going on than you think. 

However, the people can only do so much. Industry is where our politicians let us down because there is only so much people can do themselves. My own town has come to a point where there isn't much more that we can do. 

Get involved yourself instead of sitting on Reddit moaning about how people aren't getting involved in climate change because in this town they have been the most influential."
collapse,ffblhvz,t1_ffb5kpv,1579771172.0,">That's telling, the real question is why don't you know that ?

I don't see it as a problem. They aren't eating high grade meat. They are eating what's not fit for human consumption. The animals are alive and here and they need to be fed. Almost everyone I know with a pet are getting them from shelters rather than puppy farms etc. They are rescue animals I see nothing wrong with that rather than euthanasia on healthy animals. 

>If you aren't reducing your emissions by 10%-15% a year down to about 3t per annum then YOU are the problem

You need to get off your high horse and blaming individuals. Industry is the biggest polluters. Cruise ships pump-out the same emissions as the size of London. Start pointing your fingers at those folks."
collapse,ffbl87r,t1_ffb12kb,1579770765.0,Well my own county is looking at investing in electric charging ports for cars. We had a local poll and 87% said they would switch to electric if there were more ports in the county. At the moment they aren't enough and we live in a rural location. So it looks like that won't be an issue in the near future. I know that we (UK) are looking to have a complete switch to electric cars by 2040 (I think). My county has 17 proposed designated car port sites to date so in the next couple of years they will be implemented.
AskReddit,ffbktqy,t1_ffaofsi,1579770145.0,">annoys me because than hé is acting like a jerk to me Just because there is a girl.

He does this to put you down because he thinks it makes him stand out and it's attractive to women. It's not, we see he is just a tw@."
AskReddit,ffanxqg,t3_esedhp,1579740393.0,"Unfortunately, they do, I just don't enjoy other peoples company. I get frustrated that I can't do some shopping without people bothering me. Every fucker and his dog wants to talk to me. I now have to go out at weird times of the day so people are too tired for idle chit chat and going on self service tills. Wtf vibe am I giving off that people think it's ok to spark up a convo? I need some human repellant or a sign that says ""fuck off no chatting today"""
AskReddit,ffanc6p,t3_eskc2n,1579739989.0,Didn't manipulate or expect sex/relationship... because we are not vaginal puppets for the socially awkward.
AskReddit,ffamona,t3_esciik,1579739544.0,"Nuclear Power, nuclear weapons, just nuclear anything because it's fucking cancer."
AskReddit,ffamfsc,t1_ff96rnh,1579739379.0,"Cats with boobs, boob cats"
AskReddit,ffamd3x,t3_esciik,1579739328.0,Porn... Because of erectile dysfunction. More men are becoming impotent
facepalm,ffam5nl,t3_esetsn,1579739190.0,"It's holding his gut in, the strain is easy to see"
conspiracy,ffalvoa,t1_ffa06le,1579739001.0,"I got to agree. I live in the uk and we have your mass shooting reported here. However, after one mass school shooting (I can't recall which one) it was reported that certain guns we're going to stop being produced. It was shown here that people brought more guns... In their droves scared they wouldn't be able to get hold of them anymore. 

Not too long after that another news reported stated that there was an ammunition shortage and they were soon going to run out. People once again went out and stocked up. It was then I realised that a lot of what the Americans are being told are lies. Lies to make them purchase more guns and ammo. 

We have since seen it happen again with semiautomatic weapons. The slightest hint these weapons will be somehow made much more difficult to obtain, makes people actually obtain them!"
conspiracy,ffajrrq,t1_ff9q5yx,1579737472.0,Body language can say more than words. I agree with you assessment. He is making sure things are being signed. Helicopter president style.
collapse,ffag4o4,t1_ffa9yk1,1579734956.0,">Just take ""reduced their flying."" Why are they flying at all?

I know one family that is trying this but here is the deal. He is a professor and he travels all around the world and he is in Tokyo one week and Russia another etc. He has to fly else he wouldn't be able to work as much. Yet his family are exceptionally climate change supporters. Their house has been made as carbon neutral as possible. They are also vegetarians and have a number of rabbits as pets. 

Their last holiday they went by train but it's only because they are rich they could afford to do this and because of the location (south of France). We talk all the time about climate change because although they are rich and I am poor we exchange our views on things. He said he would have saved hundreds if they flew. Is that his fault? No. It's politics. The world is not connectable by land. Cruise ships are horrific, one can pump out as much C02 as London. Why are people still doing that?"
collapse,ffaf4nu,t1_ffa83mo,1579734258.0,"That's just the people I know and I'm talking of about 35 individuals. So let me tell you what a mix of political and socially responsible people in my area have achieved. 

We have a local farmer that now has bees on his farm. We are surrounded with farms and 3 more have committed to housing bees also. 

People from different political leanings have put pressure on the council to install ports for electric cars. We have 17 designated points to date. Residents were asked to complete a survey asking if they would change to electric if they were installed 87% said they would. 

We now have reusable recycling bags instead of plastic. We are aiming to be plastic free by the end of this year. 

We have the council now not cutting some grass areas entirely leaving some areas long for wildlife and biodiversity. 

This year the council is changing some grass areas to plant wild flowers. 

Designated areas have been left for hedgehogs to hibernate in, all pressure from the locals. 

The council has completed 90% change over of street lighting to more economical types. They are white instead of the orange ones. They have also been more diligent with switching them on and off appropriately to save money. 

Over the past decade the council have refurbished all housing stock. They all have super insulation and solar panels. One of the farms has created a solar field on one of his most useless plots of land. 

There is a proposal in the works for all business properties in the town to have their own solar panels. The proposal is the excess funds are to be diverted to help bring down business rates. 

So you sit there and say that people are doing nothing. People are and if you got involved with your own you will probably see there is a lot more going on than you think. 

However, the people can only do so much. Industry is where our politicians let us down because there is only so much people can do themselves. My own town has come to a point where there isn't much more that we can do. 

Get involved yourself instead of sitting on Reddit moaning about how posh people aren't getting involved in climate change because in this town they have been the most influential."
collapse,ffa99jk,t1_ffa82pm,1579730371.0,">The most traditional of Tories become environmental activists when there is a threat of fracking on their doorstep.

This I agree with because they are Tories and that's what they do. They are the most self interested nitwits going. Any other time they just don't give a fuck. 


>The concerned green consumer still drives, still takes holidays, still has pets, still has baths, possibly still eats meat.

I can't agree with this. I live in the countryside and I have a mix of affluent and poor people around me. Across the board people are being much more considerate to the way they live. I've worked in some of these houses and over the years I've seen them evolve. 

The most affluent have changed their cars to hybrids (because they can afford to), reduced their flying, most of them have reduced meat consumption, 1 has gone vegan. 1 of them never even so much as recycled but started 2 years ago. What having pets has to do with things I've no idea. Can you explain why you specifically mentioned this?

Are you basing your information on people you know?"
collapse,ffa7hkc,t1_ffa744l,1579729378.0,I don't agree. In the uk where I live fracking has been immensely unpopular. That means it's been politically and environmentally unsustainable. Green issues here are popular and from the few polls there have been most people would pay a little more for much better solutions.
AskReddit,ffa1v5s,t1_ffa1ma6,1579726206.0,"I have, I love his dead pan wit!  I just love Richard he is a comedy genius (and he actually is as he went to Cambridge University)"
AskReddit,ffa0ktr,t1_ff9xjc6,1579725453.0," 

>I know right? Maybe I should get her a glass case. 

""You think this is funny? You think this is some kind of mother flipping joke?""  Of course get a glass case, save the internet!

I can only marvel at the absurdity of such advanced technological notions!"
privacy,ff9ze8g,t1_ff9vvpc,1579724762.0,I hope the price is psychological with immense paranoia driving them demented.
AskReddit,ff9q6hh,t1_ff9ejtn,1579718508.0,Your girlfriend has the only copy of the Internet. I hope she doesn't break it!
AskReddit,ff9n6mt,t3_esbf2p,1579716506.0,Bobby woods -the moth and the flame
collapse,ff9n1vy,t1_ff9kifp,1579716428.0,Yes sorry I didn't check.
LateStageCapitalism,ff9mtnj,t1_ff9hbwt,1579716292.0,Oh fuck! Ooops sorry and thanks haha
AskReddit,ff9mrjp,t1_ff9gohj,1579716257.0,Ahh well this is aimed at them then. I stand by what I say. I've never found the big bang offensive. I've not seen much of it (probably about 3 series)  but what I have it's been humorous in a banter kind of way.
collapse,ff9mhzw,t1_ff9fmxn,1579716099.0,There are ways of doing things that don't make it that way. It's only that way because the 0.00001% want it to be.
collapse,ff9e5m3,t1_ff9dmr3,1579711060.0,"How do you know this? You seem so sure. 

The only reason people get upset by this issue is that the poor pay the highest price for these things. History has shown this multiple times. However, the poor care about climate change just as much as the next person, they just don't see why they should shoulder the burden more than everyone else in terms of financial penalties."
ptsd,ff9dt6m,t1_ff9dfso,1579710835.0,">mental health issues are still pretty stigmatized in the work sphere.

We still have this problem despite all the services we have access to. Mental health across all of the UK is pretty much looked down upon. However, in jobs like ambulance services, fire, police etc they are a little more on the ball because they see things most of us don't."
privacy,ff9dgi4,t1_ff9bm98,1579710596.0,Yeah same here
ptsd,ff9d077,t1_ff9cp0k,1579710272.0,Errrrrrmmmm I would say that might just be in America. I live in the UK and our police are well looked after and they are mostly respectful to the citizens. We get a rogue few but it's not the norm here. We have the NHS so any mental trauma gets treated either privately through police funds or publicly through available services within the NHS.
LateStageCapitalism,ff9cp20,t3_esbg4h,1579710035.0,"\#AdvertisingShitsInYourHead that's perfect

Edit: \ before # so I don't give everyone a headache!"
zen,ff9cd39,t1_ff9bq1l,1579709779.0,"Yeah I agree. Kind of my 'open to interpretation' quote about how humans create hell on earth, or in other words our pursuit of power and greed is hellish for others."
AskReddit,ff9byqp,t1_ff9bbys,1579709487.0,"As a brit this is all part of our culture. We see the funny side of things. I can say with all honesty I have found at least 1 of the IT crowd stereotypes in a place of work. Normally I can hit at least 3. We see it as banter and being brutalized about these things is a right of passage. 

I have found that America doesn't understand this type of humour. Not only because Americans take offense to it more than any other nation on earth. They are serious people. They take stuff personally like it's an attack on themselves. It's not all about you sometimes it's just taking the piss so we can laugh about the realities of life."
zen,ff9bdrk,t1_ff99zp5,1579709105.0,"
>Ever seen a gazelle being eaten alive by hyenas ?

I have it's brutal. 

When you look at the world with a wide-angled lens it is beautiful, but when you zoom in and look at the real workings of life you see it all. The brutality, dog eat dog, survival of the fittest, the hell humans have created for themselves. 

You can only survive in this world if you turn off your microlenses and forget all the real workings of life. Operate on the wide lens and lie to yourself."
AskReddit,ff987rs,t1_ff8w161,1579707105.0,"The entire show is based on stereotypes. 

Moss: functioning slightly autistic nerd

Roy: drunk Irishman that doesn't give a fuck

Jen: typical woman who works in IT but 'shouldn't be there'

Reynholm: sleazy boss that's stupid but earns billions

Richmond: office emo weirdo who lurks but hardly no one notices"
AskReddit,ff97hdj,t1_ff929m9,1579706633.0,">Moss: ""What is it running on""

>Police: ""Windows Vista""

##Moss: ""we're all going to die!"" (Was the correct line)##"
collapse,ff972zu,t1_ff92ez8,1579706375.0,"I'm 45, I've known about these issues since I was 9. There has been plenty of time to find real solutions. The fact corporations coupled with capitalism is the block to all these problems says everything we need to know. 

Moreover, I became aware in the late 90's just how much of an issue this was when big oil and other relevant companies started to buy up and shelve patents which created free green energy to households, for life. It was safe and emissions-free. Yet big oil and the like wanted continued dependence on fossil fuels."
collapse,ff96dpz,t1_ff8uaml,1579705914.0,"

>What if you just restart as an infant when you die? You're unaware of it, but you'd be forced to live your life identically, again.

That's the most torturous explanation of the afterlife I have ever heard. So those that we're sexually, mentally, emotionally, physically abused as children get to relive it for all eternity? If that's your idea of God and reincarnation then I feel sorry for you. I honestly do."
collapse,ff94x89,t3_es716l,1579704928.0,The greedy thrive on exponential growth. Until there is a cull in that mindset there will only be assured destruction.
collapse,ff94og9,t1_ff8m1np,1579704762.0,If only that we're true
BlackPeopleTwitter,ff94b1x,t3_esb7k7,1579704510.0,What's even sadder is that they did think it through and it's an elaborate mockingtroll
AskReddit,ff940iv,t1_ff93sct,1579704307.0,So many damn good quotes from that series! I'm so sad it's not being made anymore.
collapse,ff93qlh,t3_esbunn,1579704114.0,"Ian Bremmer said something that resonated with me on UK channel 4 news... (I might not have an 100% accurate quote here) 

He was asked ""what can corporations say that will convince us that they are serious about climate change?"" 

His reply ""it's not what they 'say' it's what they 'do' that important... There have been many wonderful words and sayings when it comes to climate change but that must lead to action and action now""

Talk is cheap and people need to start doing..."
zen,ff92p04,t3_esch92,1579703373.0,Life at it's weirdest
collapse,ff929o3,t1_ff91k4i,1579703067.0,"Sure, not like science is ever proven wrong."
privacy,ff90qxe,t1_ff8qxwn,1579701916.0,I'm starting to see a pattern. I'm not 100% sure yet but I think in about 200 years time people might not have any privacy at all. This is a guestimation based on the emerging patterns I see /s
collapse,ff907au,t1_ff8ziq6,1579701487.0,"Yeah yeah yeah

https://www.reuters.com/article/us-usa-water-foreverchemicals/u-s-drinking-water-widely-contaminated-with-forever-chemicals-report-idUSKBN1ZL0F8"
collapse,ff8zxw8,t1_ff8v5jv,1579701278.0,r/exvegans
collapse,ff8zhn6,t1_ff8u056,1579700923.0,Not until she asks... Don't need to pile on before she is ready
collapse,ff8zdzl,t3_esayln,1579700843.0,The kid is right. The water supplies are contaminated with forever chemicals. It's just a matter of time and we don't have much of it.
