subreddit,self ID,parent ID,time,textSelfAwarewolves,fejgel4,t1_fehm1in,1579173005.0,"There are large differences between the term white and the term black, at least in America. White is an in group that is pretty exclusive as it is only for those that don't have any outward appearance or recent family history of breeding outside that in group.

Whereas, black is an umbrella term for announce with even a shed of genetics relating to it, that accepts all and exists as their original cultural heritage was stripped from them. It is used often as a support group for the down trodden.

With this framing it's easier to understand why they are looked at so differently. White fragilities are looking at people who self identify as white being upset about their in group being mentioned. Saying that there are advantages to being white shouldn't cause problem because it's a fact, and if you get upset about it, it is because you are fragile. It's not racist to point out someone like that being fragile as you are pointing out their fragility in terms of their self appointed identity.

I don't consider myself white, because that doesn't mean shit. I'm a Midwestern American from Wisconsin. That has a lot more meaning, and says a lot more about me then the color of my skin. I can find plenty of things that would come long before the color of my skin, so why do so many take that as the first and foremost identifier?"
SelfAwarewolves,fejfwwg,t1_fein9kf,1579172306.0,"You certainly can be discriminated against for being white. The point is, it is less common and damaging. I have been discriminated against for being white, was looked at as not able to become a good chef in a Japanese kitchen because of not being Asian. This really in the grand scheme of things didn't change much in my life, and it's one of few situations where it was a problem, but it does happen, and trying to advocate it doesn't is going to make it hard for many to side with the movement.

White privilege does exist, but that doesn't make white people immune to suffering. Life is pretty rough for most people."
SelfAwarewolves,fejfo40,t1_feias4d,1579171948.0,White privilege is a diminishing thing that does very much still exist in most places.
SelfAwarewolves,fejf1xp,t1_fejew99,1579171026.0,"Funny how people who just said ""Yes really"" are the real racists in this situation."
SelfAwarewolves,fejex9j,t1_feio1il,1579170833.0,"I think he was trying to say that white people don't get judged based on their skin color very often. That's a privilege that is pretty exclusive to white people in many areas, and that's all people are trying to voice. 

Just because you haven't seen many problems that doesn't mean they don't exist, and it's hard to know what problems there are when you were of the color of skin that gets discriminated against least.

Acknowledging white privilege isn't able doing anything, but understanding the plight of those around you. That's why it's kinda crazy when people want to argue it. Because it's very likely not even as big as you think we are saying it is, but the point is just to acknowledge it is a problem for some. This isn't some giant campaign, just a simple idea that everyone should understand.

It's not always the systematic oppression of one specific race like with blacks in America. It can be as simple as having a hard time being recognized as a sushi chef because you're not Asian. Which could be an example of being judge for being white, because it does happen to white people, but it doesn't happen as often as with other colors of skin."
MagicArena,fegvbpe,t3_eon97r,1579103348.0,"They have been getting extremely shitty with their event management. I can't see myself stopping playing the game, as I enjoy standard and draft so much, and it's a free way to do both a lot. However, I would love to get into historic or brawl, but there are literal costs to playing them. 

First I have to play wildcards to build decks, then I have to pay to enter events, and what's my reward for all this commitment, 3k xp, which gets me 3 uncommons, passing 10k gold for 3 random uncommons and ""the pleasure of taking part in a different format"" feels like a fucking slap in the face."
MagicArena,feguz6v,t1_fee7hhh,1579103126.0,"I wouldn't call mtgo perfectly functional. Do you not remember the time where the program wouldn't let one of the two finalists in a online pro tour qualifier connect to the last game and it was won by default? 

All that aside, their customer support is great, and will gladly reimburse you without questioning it because they know how bad the program can be."
FragileWhiteRedditor,fed5yx7,t1_fecvk3z,1579000529.0,Projection is a hell of a drug
FragileWhiteRedditor,fed5x2t,t1_fectlx7,1579000458.0,"True, but does stating that get you anywhere?"
PoliticalHumor,fed0k52,t1_fechese,1578992624.0,"Idk, he could have been killed."
SubredditDrama,fecy137,t1_fecpcox,1578989266.0,T_D is the biggest joke on Reddit.
Libertarian,fecxo0s,t1_febu8re,1578988811.0,"Actually, all they allow on their Reddit is opinions. It's facts that they ban."
TopMindsOfReddit,fecty0u,t1_febcixm,1578984494.0,"People should feel and be shamed for saying racist and hateful things. That's what the ""indoctrination"" you speak of really is. In a largely populated area, if you talk down to other people based on color of their skin, their culture, or their ancestry, you will generally be called out for it. People pick up on this and recognize it's not okay. 

I really don't see how it's a problem that this sort of thing happens. Discrimination isn't okay."
TopMindsOfReddit,fectskn,t1_febvx11,1578984324.0,True fascist mentality.
insanepeoplefacebook,fea79vj,t3_eo3mtp,1578945184.0,"The funniest thing would be if this backfired and all their crazy right wing friends became Bernie supporters because he's ""just like their hero the first"""
TopMindsOfReddit,fea61fg,t1_fe8w5c7,1578944772.0,"Free speech hasn't changed in the slightest. You are still allowed to say anything you want, wherever you want."
AskReddit,fe5y9v3,t1_fe5x94g,1578877627.0,What about if we cut out the low bar? Can an atheist be a better person then a truly devouted and nice religious person?
AskReddit,fe5szqb,t1_fe5sr0l,1578874275.0,"Seems like a bit of a stretch, I think there certainly can be religious people who do good things without fear or worry about their afterlife. Being good for goodness sake is part most peoples life."
facepalm,fe5spsu,t1_fe54e65,1578874108.0,"Why do you need faith? I don't think there is anything wrong with being eternally skeptical. I don't even have faith that god doesn't exist, but that doesn't mean that life is meaningless or that I don't care for those around me. 

I feel I have gotten by just fine accepting that nothing will ever be known for sure. The only thing I have faith in is my friends and family. There is evidence on both sides, but as there isn't enough to prove one way or another, I choose to not make any assumptions as that way I wont be wrong. God could exist or he could not, either way I will live my life as I choose and not let the writings of some long dead men make decisions for me."
HumansBeingBros,fe5rcii,t3_enq7s9,1578873493.0,Just because he can't tie a tie doesn't mean he's mentally disabled.
AskReddit,fe5r4ca,t1_fe5qzov,1578873375.0,"True, anyone can suck, and your beliefs don't exempt you from anything."
trashy,fdw84f8,t1_fdu5oxe,1578756025.0,"To be fair if I were her, I'd be begging them to run me over too and throw a tantrum if they didn't."
WhitePeopleTwitter,fdw7a0p,t1_fdtweph,1578755832.0,"It's a crappy argument. There are plenty of good arguments, but because some guys said so over 200 years ago isn't. That's the point, we can have logical discussions on a subject or we can have screaming matches about what a government decided. 

It would be a fine argument in court however."
Libertarian,fdmx6y6,t1_fdmmide,1578569865.0,"It has the bad word in it. Us libertarians aren't allowed to like anything with the word social in it. /s

Seriously tho, we need to rename socialized healthcare as healthcare as a public good. It makes it sound much better, and is still actuate."
Libertarian,fdmx38c,t1_fdl4j0g,1578569742.0,I disagree. You can be libertarian and support healthcare as a public good.
Libertarian,fdmwzu2,t1_fdlfgvx,1578569627.0,"That probably explains why they don't even consider what they are arguing against. They just hear the word socialist and froth at the mouth. Healthcare as a public good can very easily for within the libertarian agenda, in fact I personally believe it would make sense, otherwise people are literally becoming wage slaves to medical debt, with the only alternative being death to lack of care."
Libertarian,fdmwtdr,t1_fdmke26,1578569408.0,"So should we get rid of police and firemen? I don't get to choose who works for the state, so should we get rid of all government employees?

Socialized healthcare is just the scare term for healthcare as a public good. We already have public goods in our economy, it doesn't mean the commies won. I think there are valid arguments against healthcare as a public good, but it is certainly not un-libertarian or inherently evil."
Libertarian,fdmwkd1,t3_elyaf9,1578569104.0,You can certainly be pro healthcare as a public good and still be libertarian. The anti gun one however...
PoliticalHumor,fdfx6te,t1_fdf9a7z,1578372664.0,"Idk, you seemed quite triggered because someone used the word white."
Brawlstars,fdfx1sz,t1_fdejasy,1578372548.0,"To be fair, if you are straight buying your way up, you will not be to worry about the double cost. You will get enough power points long before you get enough gold."
trashy,fdeglvt,t1_fdeey50,1578338585.0,The point he was making is that even those that align with this crazy still see him as crazy. Basically taking the politics out of the equation
trashy,fdeggzr,t1_fdedjuq,1578338501.0,Yeah basically
trashy,fddth8z,t1_fddtb8p,1578323559.0,"I get it. This is the internet, we don't have all day to write out a page of text to explain our intention and ideas behind everything we day. I just get bored and like talking things out with people. Thanks for coming to my TED talk."
