subreddit,self ID,parent ID,time,text
Libertarian,fgkl5ue,t1_fgkkg7i,1580868115.0,"https://en.m.wikipedia.org/wiki/Left-libertarianism

Since you could really do to read up on the topic. It's painfully obvious you have no idea what you're talking about."
Libertarian,fgkio15,t1_fgkiaaa,1580866451.0,"FYI the original libertarians were left leaning, so they are the true libertarians. Right wing libertarians are just diet conservative."
ENLIGHTENEDCENTRISM,fgk12i4,t1_fgjmixx,1580855316.0,"No it does not. If I said 'the ""good"" guys' it would sound drastically different then ""the good guys"" the point of the quotes is specifically to announce the sarcastic nature as the people we are referring to are not actual centrists."
Libertarian,fgk0wa8,t1_fgjm698,1580855220.0,"It is not the government running healthcare his platform is a government option. 

Do you consider public schools a authoritarian policy?"
Libertarian,fgjl6ds,t1_fgjhtqj,1580846314.0,Offering a public option for healthcare is in no way authoritarian.
Libertarian,fgjexcx,t1_fgj3hoq,1580842608.0,"Banning assault weapons is objectively not libertarian, but the rest can be considered it. Just not under your ideologies. 

Socialist economic policies can certainly fit under libertarian ideologies. Regulations can be looked at as protections. Protecting a citizen from a toxic environment is definitively the government's job. Providing services to people also falls under that umbrella term, and increasing taxes to do so is a given. 

Libertarianism doesn't have to be right wing conservatism lite, it is a far wider range of things.

BTW the student loans one is definitely going to be controversial, and I can understand why that one might not for for most, but no one gets their full desires in a candidate. I personally don't find most other candidates even close to good. I certainly would prefer Andrew yang, but I will happily vote for Bernie if it comes to it."
ENLIGHTENEDCENTRISM,fgjd490,t1_fgjc2qs,1580841536.0,It's easy to win an argument against a strawman. This meme isn't even assuming that a certain quantity of centrists say extremist things. That was your assumption. If you are going to make your arguments based on your assumptions and your crazy image of what is actually happening here then of course it will look crazy.
Libertarian,fgjcvcd,t1_fgildp6,1580841392.0,"What you aren't factoring in the equation of hours per dollar, as if I have to work 1/2 the amount to get the same pay. There is also currently an abundance of employees, so having a tighter market forces employers to pay more to get good employees.

As far as the taxation equals theft thing goes, I know I won't change your mind and you won't change my mind so it's probably best to leave it at that."
AdviceAnimals,fgihojw,t1_fgifw92,1580821947.0,"Trust me it's not people at the ballots that cause the problems. It's always the hidden boxes full of ballots for your competitors, or literal vote tampering within the systems themselves as election digital security is a literal joke. No one is bussing in thousands of people which is painfully obvious when all they have to do is hide a box of ballots or switch a few numbers on a computer. 

You are just passing on shitty right wing fear tactics. Our current voter turnout is abysmally low, so anything that could improve that is probably a good thing for the side with the better ideas. Which is no wonder the right wanted to make it difficult for people to vote."
ENLIGHTENEDCENTRISM,fgih3xp,t1_fghmc1q,1580821448.0,"Politicians have been moving to the right for as long as I've lived, but the people haven't. So it only appears as if things are moving left. The things we are fighting for were even afforded to earlier generations BECAUSE they were more evenly balanced. The right has just gotten better at gaming the system."
ENLIGHTENEDCENTRISM,fgiglje,t1_fggrzg1,1580820996.0,I thought we were talking about centrists?
ENLIGHTENEDCENTRISM,fgigk2k,t1_fggri8i,1580820958.0,Something being to difficult to understand doesn't make IT retarded.
ENLIGHTENEDCENTRISM,fgighb2,t1_fghdbza,1580820886.0,"You are correct, but many people use the centrist label to pander to people and tout their extremist beliefs. This sub is specifically to make fun of those people who are obviously not centrist but pretend to be one."
Libertarian,fgig5gt,t1_fgi8k5s,1580820579.0,"There are consequences to any option, I would agree the incurred risk to small businesses could be dangerous, but. On the other hand, it would give more power to more people as far as job choice goes, and it would empower people to say no to shit jobs. We are already close enough to full employment that losing a few percent couldn't hurt. If an employer can't afford to properly pay people is it a worthwhile establishment? I'd say no, and I think it would take a little getting used to but I also think it's immoral to pay someone less than a living wage.

I would however personally prefer a more elegant solution then a raised minimum wage, as with inflation we will just revert back to where we were, and it doesn't help citizens equally as some areas a living wage could be less then 15$ and other more. Really what we want is to empower the lowest rung in the employment chain to have a voice. Not enough to change the whole system, but enough to keep themselves from being abused. 

As far as taxation being theft, that is a extremist ideology and I don't subscribe to it. There are lots of things I want from the government, and it's illogical to think they can do them without money. I appreciate many of the services they offer. Roads, schools, public services, care for the less fortunate, and plenty of other things. I do about that a good portion of that money is often miss manage, and we could do more to fix that."
Libertarian,fgi4tun,t1_fgi2lm8,1580805581.0,"He aligns very well with left leaning libertarians. I can only assume are right leaning, but for many of us here he is actually a very fitting candidate."
Libertarian,fgi28er,t1_fghxz0n,1580802185.0,You can be a Bernie supporter and a libertarian.
Libertarian,fgi26d5,t1_fghv04o,1580802114.0,"There is nothing socialist about looking at a situation and how it would affect you and those around you. The policies on the other hand are fairly rooted in socialist policy, and I'm all for good policies regardless of what economic structures they fit under."
JordanPeterson,fg9mjdi,t1_fg9jely,1580640681.0,"Yeah, I get that, but they aren't, so it doesn't work well. It just makes you look ignorant for having no idea what fascism is."
JordanPeterson,fg9kzwz,t1_fg9h0ul,1580640190.0,"So who is funding them? Who is there leader? Which dictatorial power are they trying to being into power? 

There is a big difference between thugs acting on their own, and large government funded militias."
JordanPeterson,fg9iubg,t1_fg9gpdu,1580639292.0,"Sure, so basically since they are mean that means eventually they would if let rule the world become fascists. But by that nature my dog is a fascist, because I doubt he would share his toys if he ran the world.

I think there are plenty of great ways to label and describe antifa, but fascist isn't one of them. Authoritarian? Sure. Thugs? Generally, but I wouldn't call them fascist."
JordanPeterson,fg9gtga,t1_fg9ftld,1580638568.0,"What group do you think the antifa groups will become a part of? Do you really think the guys with masks burning flags are part of a party that has any chance of holding power? 

As far as I see it they are just some punks with crazy ideals looking for some attention. They are not some great force that could destabilize our whole way of life."
JordanPeterson,fg9f0yy,t1_fg9eocr,1580637952.0,"That's not what fascism is tho, that's a small part of it. Fascism is largely about dictatorial power, ultra-nationalism, strong regimen of society, and suppression of opponents. So other then the last one, I'd say they have very little to do with it."
JordanPeterson,fg9e622,t1_fg8ze4b,1580637572.0,"Not to make it seem like I'm defending antifa, as the bulk of the people on those groups aren't good, but what way are they fascist?"
facepalm,fg4al6k,t1_fg42gro,1580499672.0,"Exactly. She was screwed from the start, there was a little of playing up the scene for the video, but ultimately it was a learning experience that those gloves were not enough. 

I assumed that she knew way sooner then he made it out to be as even once she knew, it was too late for her."
ProgrammerHumor,fg3v17d,t1_fg3uoxz,1580490270.0,"I mean, if you are trying to count basics you can't forget the snow covered lands."
facepalm,fg3ur2c,t1_fg3uhwd,1580490097.0,"Yeah? I love his health videos, but I've only watched that so far. What is the nuclear throne stuff?"
facepalm,fg3gs22,t1_fg3gq5t,1580481139.0,If you watch the whole thing it makes a lot more sense.
facepalm,fg3gkzc,t1_fg3gixc,1580480994.0,"Honestly I didn't realize that, it had been a while since I watched the video."
facepalm,fg2zmqo,t1_fg2kyi4,1580463272.0,https://youtu.be/NJ7M01jV058
niceguys,fg1bkvo,t3_ew528c,1580424239.0,"Seriously tho, I don't get why he didn't at least try to just make plans a different day. Like ffs why does it specifically have to be the one time you've already been turned down on."
OutOfTheLoop,ffze2dc,t1_ffxq4rp,1580374390.0,This isn't supposed to make him look bad. It's not like him possibly having an STD is even a scandal at this point. It's an attempt at trying to explain why he is so insane and mentally disturbed.
SelfAwarewolves,ffxg2qi,t1_ffxfp6m,1580324431.0,"I was just misunderstanding you. I thought you were saying it's crazy to change parties like that. I really don't have strong party affiliations personally, if someone has good policies I'll vote for them, and probably want to register in their party to primary for them. It's not about changing party, but having that power to influence the earlier stages of election."
SelfAwarewolves,ffxfd57,t1_ffxbzor,1580324018.0,"One thing he didn't mention is when it comes to the actual elections you can vote whatever, but it's about helping influence who gets put on the ballot."
SelfAwarewolves,ffxf94v,t1_ffx11h4,1580323953.0,What kind of hivemind process makes you think Bernie doesn't have solid views that could be appreciated by a libertarian?
SelfAwarewolves,ffwnzwd,t1_ffwi8f9,1580306695.0,There is nothing socialist about having empathy and caring for your neighbors. Besides who cares if something is socialist?
PoliticalHumor,ffw91fo,t1_ffuzt8n,1580290265.0,"True, this really wasn't funny, but then again I guess we could just pretend the joke is the Republican party. 

Seriously though, I am very sick of the trash options where you aren't voting for someone you want just someone who's not as bad as the other side, then when they win you get to flame them for picking some jackass like it was their personal decision to put this idiot on the ballot.

Like seriously, if Trump hadn't won, we would have had Hillary in office. She wouldn't have fucked up as much, but damn, she is not exactly high on my list. I would have picked my grandma, my neighbor, and the guy I met at the bar last week over either of them as well as plenty others."
insanepeoplefacebook,ffw8rig,t1_ffw2j17,1580289859.0,"Because this is an idiotic claim first of all. 80%? Second, liberals weren't pushing to get rid of straws, corporations willingly gave up straws to advertise their ""anti-pollution"" stances instead of doing anything real. Straws are not a big deal. 

https://www.c2es.org/site/assets/uploads/2017/09/cait-global-emissions-sector.png
From: https://www.c2es.org/content/international-emissions/

If you look at the breakdown, you realize very little of what you can change as an individual does much. Climate change needs to start at the top. That would be like Trump saying the start to immigration reform is people to kick their immigrant neighbors out of the neighborhood. It's idiotic to think that we have any control over how the energy companies in our area produce their energy.

Environmentally friendly can take many meanings, but whether it's individual improvement or on a global scale, getting rid of cigarette butt waste would not only be small, but extremely difficult, and there are far better goals to set."
SelfAwarewolves,ffw817o,t1_ffvofr0,1580288777.0,Catholics are often pretentious white heads too.
SelfAwarewolves,ffw7zrq,t1_ffvken4,1580288715.0,"No, and you're also not obligated to avoid calling everyone you meet a fuckwit, yet somehow most of us avoid doing that. In America tipping is more then just common courtesy it is literally how the servers make money."
gatekeeping,ffw7str,t3_ev5fy4,1580288427.0,"Por qué no los dos? I truly believe depression is a state of mind, but that doesn't mean it's something you can just overcome. You can do things to help alleviate the problems, and work towards a better life, but that doesn't mean having a good outlook will fix your problems. It's not cut and dry, it can be improved with attitude, but not fixed. I think that these sorts of things are wrong, but not entirely."
insanepeoplefacebook,ffuxzqz,t1_ffuic9x,1580251491.0,"Idk if I'm even sure it was shit, but sometimes it's fun to play along. If you truly believe most anything on the internet you're probably ignorant or way too optimistic."
AskReddit,ffmmb53,t3_eu6iol,1580056614.0,"Strangely enough, league of legends for a short but there if you didn't have safe search up, would put shopping options on the side. This would lead to a bunch of naked characters on t shirts and shit."
justneckbeardthings,ffg6mac,t1_ffg6jpq,1579899577.0,Probably.
worldpolitics,ffg0olp,t1_fffh28b,1579895922.0,"This is in no way was an attack on Trump or conservativism, but on racism. Which I guess you might be able to put it under the umbrella term of conservatism, but I certainly wasn't trying to."
justneckbeardthings,ffftmxx,t1_fffaqho,1579891539.0,"You are definitely right on when it happened, you can see it on the TV, but it's not like we are doing anything but making fun of him. This is the internet, that's what happens, and it's not even personal. I still think it's completely ridiculous to get that excited that you make a Pepe cake and a wall cake over something like that. It's definitely worth laughing at someone who invests so much of their personality and identity on politics."
justneckbeardthings,ffft8ta,t1_fffepu8,1579891297.0,This is where you guys draw the line on empathy? Rofl
worldpolitics,ffbvvul,t1_ffbb2ff,1579784508.0,"Alex Jones, armored skeptic, and Sargon of akkad are the only decent reputable sources now a days. /s"
tifu,ff5w9e8,t1_ff4pdjk,1579612371.0,You don't think he's a cunninlinguist?
relationship_advice,fexhccz,t3_eqr15p,1579431021.0,"When I was 16 I was getting stoned and playing magic the gathering with adults. Like 30-60, I still meet up and play games with them. There was nothing inappropriate about what you did."
facepalm,fewimuw,t1_feuutqj,1579411300.0,Or just tell him there is plenty of room for him to get in through the passengers side.
BlackPeopleTwitter,fewah8d,t1_few3nck,1579407559.0,"Yeah, she did that decades ago when it was worth more, possibly in another city where your dollar goes further. So your anecdotal evidence doesn't prove shit."
SelfAwarewolves,fenltii,t1_fenipbx,1579287436.0,"I guess I assumed this was about white privilege considering we are on a post about it. I don't know why that's such a far fetched assumption, or why you keep shifting the goalposts so often. 

I already told you plenty is reasons why recognizing privileges is important, but specifically in your scenario it isn't that important because you're not white. You didn't have those privileges so you know better then others what it can be like to be racially profiled. Honestly white privilege isn't as big of a deal and there are plenty of people act like it matters a lot, when really it isn't. It exists, but what does it mean to me?

To me white privilege is just something I recognize was a afforded to me and that I shouldn't take for granted. That's it. I think it's shitty of people to think that they aren't afforded advantages in life. Such as my privilege of financial stability. So yeah it bothers me when people try to act like that doesn't exist, because it feels like you're trying to say that everyone is on equal footing.

Just as bringing up crime statistics (as long as the situation calls for it) isn't racist recognizing privileges isn't racist.

Now back to the initial point of people trying to deny and argue that, complaining it's racist to say such things, are fragile people who can't accept that even if their life isn't good now that they have been afforded some advantages over others. So it is a fragility that specifically relates to their privileges being recognized. So white fragility isn't a great game for it, but it is a form of fragility that relates often to how they identify themselves. I still don't see anything racist about that."
MagicArena,feniyoo,t1_femjbi7,1579285699.0,"This!

MTGa is actually really good, and isn't terrible, but that's just because we're used to our gambling games abusing us.

My largest complaints are always going to be taxing us to play formats we like, terrible events. Currently I just play it for draft and standard. I had been buying the pass every season with last seasons rewards, but this season I likely won't. Not because the small drop in value was huge, but because that drop along side the lack of events makes the grind to get my value out of it not worth it. Since I can almost assume that they won't be doing any worth while events."
MagicArena,fenhx7m,t3_epyh0l,1579285060.0,It's 1k gold and 200 gems and plenty of icrs and a few packs
SelfAwarewolves,fenh3ct,t1_fenf3se,1579284548.0,"Of course Asian privileges are a thing. Privilege just means an advantage afforded specifically to them. Shit there are even black privileges. It's not specifically about white privilegea, you're the one who is so affixed on white privileges.

It's about empathizing with those around you, which seems like something you are actively trying to avoid. 

Everyone has specific privileges and an important step to help better yourself and those around you is to recognize your privileges.

For example one privilege I have had is having a caring family with a strong financial safety net that I could trust was there for me if things went wrong. By recognizing that I can start to understand the stress those around me who worry about money much more then I still are going through. This would be very difficult if I ignored this fact. 

I'll reiterate again that recognizing these privileges is all people are looking for. You don't have to DO anything. I'm not saying it's bad that these have existed, but they DO exist."
SelfAwarewolves,fencjxd,t1_fena87u,1579281779.0,"It's easy to win an argument against a straw man isn't it. I never said white privilege is always happening everywhere. It has always been situational as you said. It is a fact tho, no matter how much you try to deny it. How about we call it in group prejudice privilege? Those who are part of the same group will prejudice towards each other, and then it has nothing to do with race. It does however become about race when the in group decides they want to make it such. 

Basically this means when racists hold power they have control over who else gets it, and historically racists held power and did exactly that. I don't think I even need to quote history to prove that but since you seem to think there isn't any scientific backing to what I'm saying I will.

https://www.npr.org/2017/05/03/526655831/a-forgotten-history-of-how-the-u-s-government-segregated-america

These racist continued to blatantly discriminate against people within the past century. Plenty of people homes and neighborhoods they live in now were decided by racist shit like this.

As far as this privilege goes, here is a great article on the specifics of how it has impacted African American citizens. 

https://www.americanprogress.org/issues/race/reports/2018/02/21/447051/systematic-inequality/

Now, admitting white privilege exists doesn't mean white people have it well off, it just means that statistically they have better chances. Most people are struggling as the economy is shit right now, and just being a little better then your neighbor doesn't make either of your situations good, but if we can't help each other we'll never get out of this situation. It's not so much about trying to put white people down for being better off, but recognizing that those who aren't white are at a disadvantage, honestly there isn't a whole lot of action desired. It's almost exclusively about recognition. I don't think programs things like reparations or affirmative action are good, but I do think that if we act like there isn't an imbalance then we are ignoring those who are hurt by it"
SelfAwarewolves,femsg5v,t1_femnm5j,1579268307.0,"The fragile part is you freaking out over it being said. Bringing up crime statistics is important, as it shows their is a distinct problem with policing and the ability for people to climb out of poverty. However being upset by that is human nature, that is a shitty position for our society to be in. Being upset because someone said you might get preferential treatment occasionally is being fragile.

The fact that you don't see the difference is the racism, as you are valuing your feelings higher then literally the well being of citizens of our country is the racist part."
SelfAwarewolves,femjcrk,t1_femf1fa,1579258546.0,"That is racist. Race is a socio political identifier it has nothing to do with culture, and what it does have to do with genetics is almost exclusively appearance. Politically white people identify as white as it is their benefit to do so. People are more often labeled as black by ass holes like you trying to say they are the root cause of crime.

I was explaining how they are culturally used, and why that is the case. Where as you are using statistics to make things look bad.

If anything that statistic says something about the biased policing of our country. It's kind of crazy the double think it takes to think it's not okay to say the term white without being called a racist, but it's okay to try and act like black people are the main reason we have crime and think that's just a fact."
TopMindsOfReddit,femi3mt,t1_fem4tgj,1579256715.0,"I don't know how you think colleges indoctrinate their students with political beliefs. A good portion of them literally refuse to allow political discussion in class. 

So the only other thing I can think of that's even close to it is the politics of people. Supporting around you makes sense to anyone who is actually around people. It really takes an isolated life to think that healthcare shouldn't be a public good, or that equal rights aren't important.

I guess it would help understand what crazy accusations you are trying to make if you elaborated on what crazy things the spooky left elitist indoctrination experts where trying to push on students."
SelfAwarewolves,felhe6x,t1_felh80o,1579222220.0,"Idk, if someone as dumb as me had the answers things would be easy."
PoliticalHumor,felhaoa,t1_felflw0,1579222153.0,"You're right, it is better then the CPI, and is a good thing, but it's not some amazing thing. It is a small bit of progress in the right direction, and you're acting like the working class is finally saved, and the left is crazy for thinking it's not. Which is a drastic over stating of the situation."
SelfAwarewolves,feleick,t1_felec4r,1579220290.0,"Honestly, I think everything you said is very true."
PoliticalHumor,fele6xe,t1_felcs7u,1579220080.0,So basically inflation is what you're talking about. It's a natural part of the economy it doesn't signal a positive change. Fluctuations are normal.
PoliticalHumor,felc88h,t1_felbvf2,1579218773.0,"You tried to spin that as good, when in fact that means they are getting lower wage increases. If that trend continues and that's a big if, they MAY end up making more faster. Stating out right that it's good is what I was calling disingenuous."
PoliticalHumor,fel8nh3,t1_fel3vaa,1579216451.0,"I hope you understand how percent work. If the bottom 25% are getting a 5% increase on 25k a year and the top 25% are getting a 3% increase on 50k they are still getting higher wage increase. This is deceptive statistics and a bad argument. It is getting better, but not at a good enough rate. The bottom 42.7% of American workers make less than 25k a year, and the amount of people making less then a living wage is absurdly high.

We must refuse to continue to accept breadcrumbs when there are people with millions of times what we have trying to penny pinch a few more dollars out of their ground level employees.

Also it's really fucking disingenuous to blame everything on one side of politics with your painfully blatant strawman. Maybe if you understood what the statistics you are using to push your agenda meant then we wouldn't be here."
SelfAwarewolves,fel52ko,t1_fel4idg,1579214230.0,"Definitely, but not being the biggest one doesn't make it irrelevant. It's also about perception, and I would argue that white privilege is the most blatantly recognizable one. I am not going to know if you have two parents just by looking at you."
SelfAwarewolves,fejw3xp,t1_fejqida,1579187202.0,You just used the term white privilege. So by your standards you are a racist.
