subreddit,self ID,parent ID,time,text
news,ffkhn65,t1_ffk04gf,1580022909.0,"My son had an as of yet diagnosed issue with his spleen 18 years ago. Every Dr. and student came to visit, mostly because he was very thin and his spleen was so enlarged it was actually visible protruding from his rib cage so they were more than able to feel it. He wasn't as happy about it, especially after the bone tap; this is where a very large needle it jammed into your thigh bone to pull out marrow. He screamed when the needle went in, then screeched loud enough for the other 2 floors to hear when the Dr pulled on the syringe to get out the marrow. He had a 2 inch black & blue bump on it. He was 9 at the time."
personalfinance,ffk7jie,t1_ffk45lf,1580018238.0,"Contact your state, they have a department for it, thats where the money ends up."
personalfinance,ffk13si,t1_ffjx76a,1580012594.0,"When you opened the account the other person would have been there, or after you opened it."
personalfinance,ffk0zr0,t1_ffikpzu,1580012496.0,"Your birth certificate will have your parents full name and place of birth. If he's in college now he should have all their info for FAFSA but he would need the yearly tax return to complete it. Unfortunately if you aren't in contact with your parents and under 24, not married or have children, and never declared a ward of the court you won't be able to file a FAFSA. I had a friend who wanted to go to college at 21, she was kicked out of her house at 16 and didn't even know where her parents were. There was nothing that could be done because she was never legally emancipated either."
personalfinance,ffk0k26,t1_ffjb329,1580012121.0,"My son works at a medical facility and I have all of his immunization records, they didnt really care and gave him all new ones."
Futurology,ffjb07x,t1_ffj3lqy,1579994522.0,Yeah but the founding fathers weren't really opposed to that.
worldnews,ffgar0i,t1_fffyup2,1579902128.0,At this point the removal won't be over until after the voters remove him.
Futurology,fffqydf,t1_fffomgf,1579889882.0,"Ever seen the Fox show Sleepy Hollow? Basically its Revolutionary fighter Icabod Crane brought to life today. They buy something and he looks at the receipt and is shocked at the 10% sales tax and says they fought the crown for less than 2%.

Here's the scene https://youtu.be/cD0EHX8Bsr4"
Futurology,fffk1eq,t1_ffez1i9,1579885637.0,"I wouldn't quite say that. Its more likely in the 40-55% range who were ""hippies"" and even more were very socially conscious. If it was a small minority then you wouldn't have seen near the change that happened then. There were a great number of hippies who did become yuppies because with age and experience ideologies can change. Just as many soldiers returned from Vietnam to become jaded hippies."
Futurology,fffek2y,t1_fff6pdc,1579882240.0,Whaa???? I thought she was just a youngwaitress from the Bronx fed up with big government and decided to run for congress with nothing but her moxie and a few bucks from neighbors.
Futurology,fffdp3c,t1_fffbnbt,1579881688.0,DS9 was straight off of NG complete with cross over cast and even a visit from the Enterprise. I believe Voyager branched off of DS9 too.
Futurology,fffa2qa,t1_fff4rr6,1579879393.0,"Technically they would be DS9, and the one after Voyager. It will take a while to get to Picard."
TwoXChromosomes,fff09jc,t1_ffe5c4k,1579872062.0,"I had a coworker who caught her husband molesting her 12 yr old daughter from a previous marriage. While he was in jail she was forced to take their 2 yr old daughter to him twice a month for his court ordered visitation! 

The courts do not dole out justice equally. That woman not only has a blindfold on but also earplugs in."
personalfinance,ffcyyry,t1_ffcw1dk,1579810158.0,"We knew at the time we were doing it to get ahead of bills, which we did. Its a hit financially but we feel much better and are looking forward to not being completely exhausted on fridays. We both have 20-40 mile commutes and the later we work the worse traffic is coming home. We go in at 5 am, so traffic is light but come home 4-5 pm during rush hour is brutal. My 40 minute commute was 2 hours last night because I had to stay until 4."
personalfinance,ffcyoq8,t1_ffcvqvw,1579809999.0,"My last job was 60+ hrs and I was salary. I was pretty much at work all day, if I was out of the office I was either at a meeting on site or dealing with an issue such as having to do the work myself because someone messed up. I would be eating at my desk and it would take an hour to eat a sandwich because I would get interrupted constantly. After 7 months I was done with that nonsense. 

Most of my working career it has been hourly, including my recent stint. Me and my husband are both hourly and we are getting about $5k a month but we are much happier even having to tighten the belt a bit."
nottheonion,ffcmpi6,t1_ffcdiii,1579802728.0,"We deposited a $50k check from my FIL that was part of an inheritance. His account was a Chase account, we put it into a Chase account and they made the funds available immediately. 3 days later our account was negative the $1,200 we had spent. Turns out they never verified the funds were in his account so when the computer went to ""move"" it 3 days later there was nothing there so our account lost the money. 

In the end his dad went into his bank and they found the error: he had put the money in another account before writing the check. They moved it into ours (even without us there) and reversed the overdrafts. 

When we got the check we were with Wells Fargo and was told for that size they would need to hold it for 14 days, but would make $1000 available then, and in a week $2,500. Then they told us we would need to open another savings account to put it into. This was after years of their crap so we simply closed out accounts and went to Chase. Frankly I wouldn't be surprised if this idiot had previously worked at WF."
nottheonion,ffclf3r,t1_ffcfhyg,1579801949.0,"Not even a teller- he was talking to the assistant branch manager! He did the sign in on the sheet and sit and wait for someone to help you, he didn't just go up to some random window."
news,ffciyam,t1_ffc4co8,1579800458.0,Find a job that lets you work from your basement: problem solved!
personalfinance,ffcdu8r,t1_ffcbv9d,1579797321.0,"I had impacted wisdom teeth. They were in there for an extra 10 yrs because I didn't have the money to get them pulled, or didn't have the time off work. I finally got it done after 1 became so infected my entire head was in pain. Since I didn't want to wait for the oral surgeon the dentist pulled them all. One broke into pieces and blood rushed out. I had to rinse my mouth then walk to x-ray so she could make sure it was all out. 

Not that big of a deal. I wasn't even late to class that night or work the next day."
personalfinance,ffcd1ih,t1_ffc6u81,1579796822.0,"Well, no. When you work 60 hrs a week you come home completely exhausted and need at least a day to feel okay. When working 40 hrs you come home and are able to spend time with the family, feel like making small talk, taking the dog for a walk, tinkering with something in the garage. 

I speak from current experience. My husband & I were working 60-70 hrs until a few weeks ago when his job stopped all OT and I had to car pool so I leave early. He now does 40 hrs and I do 40-45. Your life is completely different.

I worked 50-70 hrs when my kids were younger and went to night school; the fluctuation was because during the semester I worked fewer hrs. I rarely saw my children other than the small window in the morning when I got them up and dropped them off at school. During summer they would stay up late so we could spend time together when I got home. Yes we paid for a lot of basic jobs and went on vacations and even camping regularly but you still miss a lot of their lives."
TwoXChromosomes,ff921nv,t1_ff8vvmw,1579702903.0,"I think the big issue is how many DV calls the police go on and the victim won't press charges. Also, DV isn't always a husband hitting a wife, a fight between siblings or parent & child is considered DV. In poor areas where drug & alcohol abuse it rampant (I grew up poor and have lived in many poor areas before moving to middle class neighborhoods) fights are common and often the police are called to step in the middle. Police then show up and are stuck mediating 2 grown children until they calm down."
TwoXChromosomes,ff91bzy,t1_ff8vstq,1579702367.0,"People expect the police to be mommy and stop the fighting, but they don't want them to actually do anything else. Its like when family sues because they called police on a family member and the police take things too far and someone is hurt/ killed. Lesson being if you need a mommy don't call 911."
TwoXChromosomes,ff914ya,t1_ff8voz2,1579702219.0,"There are also issues with house alarms going off and the police having to show up. Some cities in my area where there a lot of new homes with these you are only allowed 3 false alarms a year before they fine you. 

Such laws are also useful in cleaning up neighborhoods because the 1 house with the issues like fighting, loud noises, and yes drugs can be pushed out legally."
TwoXChromosomes,ff8xnuk,t1_ff8wqnj,1579699426.0,"Yes, 911 calls are part of the information used to create crime report data. Its how some areas are listed as more dangerous than others."
tifu,ff6qba5,t1_ff5zdw8,1579632655.0,"Unless your parents are super strict Christian/ Religious folks you should be fine. Most parents did stupid stuff as kids too and know its just part of growing up.

My son was suspended at the end of 8th grade, didn't even get to go to his graduation because he had a video inside a hidden folder on a school computer they traced to him. They told us it was porn. We grounded him for it and for the last 12 yrs or so my husband would brag how his 8th grader got suspended for being such a badass. Last year he finally saw the video in question *Jizz In My Pants* and was disappointed because it wasn't even porn. 

We old people can be pretty chill, but we will tease the hell out of you."
tifu,ff6o2jk,t1_ff6jjes,1579631309.0,"Yeah I wipe everything even if there is nothing in there. I sold an IPad mini which I used to play Pokemon Go, email and facebook but I still wiped it because I didn't want him to go through my emails or access my FB, and I sold it to a friend."
tifu,ff6nv84,t1_ff6mbyv,1579631187.0,"I don't know either, but no way am I about to google it."
worldnews,ff6n1ve,t1_ff6dubt,1579630692.0,"> The U.S. focuses on yellow corn, used primarily for feed and ethanol. Mexico's produces primarily white corn, used for tortillas and other corn-based foods, though it raises a small but growing amount of yellow corn, too.  
>  
>• About 15% of U.S. corn is exported, and U.S. corn accounts for virtually all of Mexico's corn imports. (Mexico gets a little from Brazil, too.) Mexico exports a very small amount of white corn to the United States.

They are importing corn-but to feed their animals not make tortillas. 

Mexicans have been heavyweights for some time given their diet heavy in lard and wheat. Many tortillas, especially in the US are flour; they are made with wheat not corn. Also ""Indian Fry Bread"", well about anything fried is favored among our southern neighbors. Also keep in mind that Mexicans are mostly European descendants who brought their food along with them, the US didn't make them fat."
personalfinance,ff6m0m8,t1_ff6k1d7,1579630064.0,"I sent them info of my Capitol One account, since they asked for proof I was covered at the time of the claim, and was told that was not accurate. They only wanted to give me the 6 mths of free monitoring. 

Here's the actual e-mail they sent me

 [https://imgur.com/gallery/OqEIIlm](https://imgur.com/gallery/OqEIIlm)"
personalfinance,ff6jclx,t1_ff6ejge,1579628439.0,Well she must be miserable since hes always either at work or home with us.
personalfinance,ff6j53s,t1_ff6etvo,1579628313.0,"I tried that and was told I needed to provide proof.

So this was what I got from them, I amended it to add my Capitol One card, since I needed proof I was covered when I made the claim and was told I did not meet the standard. 
https://imgur.com/gallery/OqEIIlm"
worldnews,ff6dcba,t1_ff69hi1,1579624728.0,"Tortillas have been made in the US for decades. They are cheap and easy to make, why would they be imported? Especially before NAFTA. 

Mexico has always grown their own corn so no they don't need ""us carby corn""."
personalfinance,ff6aybe,t1_ff68fma,1579623212.0,Whats crazy is me and both of my adult children were affected but my husband was not.
personalfinance,ff6ardo,t1_ff680i0,1579623091.0,"I submitted, I am also listed as having had my information breached but I was denied because to get the $125 you have to provide proof that you already have credit monitoring you pay for."
TwoXChromosomes,ff53547,t1_ff4vbt1,1579578941.0,This was 26 yrs ago so maybe rules are different now.
tifu,ff530aj,t1_ff4ktvn,1579578837.0,If her eyes are closed its not obvious at all.
TwoXChromosomes,ff4j6ey,t1_ff4f4by,1579564884.0,"When my son was around 6 mths I put him in a daycare that was part of a large chain. My son was put in a crib along with 12 other kids and 1 caregiver, who was a girl around 18-20."
science,ff49b2z,t1_ff4309g,1579558352.0,"As someone who was poor, and has since moved up to middle class, we make twice the average household income, that's just Drs. With medicaid they dont make referrals as often because much of it gets denied, same with Medicare which I know of because I used to manage my grandmother's care. Private insurance they have a better chance of getting paid. I was on Medicaid when I had my children, my sister was on private ins. We not only had them in thre same hospital but had the same Dr. He treated me like scum & her like she was his daughter. Come delivery she actually had less time in the hospital, was not given any lactation or child care tutoring and left with a few free samples. Whereas me, I got help I never asked for and left with bags of free stuff to include clothes and diapers."
news,ff3wtvj,t1_ff3qyiz,1579550581.0,"Yes its under the federal government but that does not give them power to do as they want, especially in a territory with an elected government. Just as the federal government is limited on what they can do in US states. Case in point- a huge earthquake could hit California and destroy half the state but the federal government, nor any of its agencies not directly affected can respond until the governor asks for it. The constitution created a bit of separation between the federal government and the states because they believed states are better suited to address concerns within their states alone and would ask for help when needed. 

If you take a basic US Civics class you can learn all about it."
tifu,ff3w40j,t1_ff3okp2,1579550134.0,Does the wife know the picture exists?
science,ff3qisz,t1_ff3azh0,1579546682.0,Poor people in America actually have a better chance of getting medical care than middle class because of Medicaid
arizona,ff3nl8g,t1_ff3ddpk,1579544890.0,Did they lose it because they went and put the election of judges back into the constitution?
news,ff3mtc3,t1_ff3kzzp,1579544408.0,"That would have to come from Congress/ the Judicial branch though. He can't do a thing. Just like he can't decide to audit a state because he thinks something is fishy, if that were possible you would see Presidents investigating states with opposing governors often."
news,ff3mm1o,t1_ff3kwf9,1579544284.0,"Its more independent than even US states, which also have a level of separation from the federal government."
news,ff3k2ry,t1_ff3i5o5,1579542725.0,"What was he supposed to do, though? PR is still an ~~independent territory.~~

Edit- okay bad choice of words, but it is a territory that is self governed. Its much like states, but with even less federal control over it. The Constitution limits what the federal government can do to states & territories especially when they have their own elected government."
news,ff3jtmx,t1_ff3imik,1579542570.0,"When in Puerto Rico citizens can not vote, but when they live in the states Puerto Ricans are allowed to vote."
news,ff3jbro,t1_ff3hfh4,1579542265.0,"He never said Trump was clean, he only said that Trump was called racist when he refused to send more aide and blamed their own corrupt government for the people not getting it."
news,ff3j3zj,t1_ff3hm6z,1579542135.0,">Trump had nothing to do with this

But if you go back to the months following Maria you will see news stories (and millions of comments online) all blaming Trump for the suffering because he refused to send the aide needed."
MMA,ff3eeq5,t1_ff3cnaz,1579539386.0,Oh FFS stop already I said over and over and over it was directly people I knew who didn't. Have you been hit in the head repeatedly yourself?
tifu,ff3dygg,t1_ff35cda,1579539156.0,"So? Still doesn't mean only boomers hate it.

And Boomers hate it because their parents told them its bad, and their parents hate it because their parents told them and so on and so forth."
tifu,ff3dsf5,t1_ff3daef,1579539070.0,"You are supposed to stay in your seat until the bus stops, I know some drivers don't care but it doesn't take that long to walk off the bus and if anything ever happened then you are eating floor and your parents are suing the school for emotional damages. I have had cars pull out in front of me, kids run out in front me, etc. causing me to hit the brakes hard before a stop."
MMA,ff36weu,t1_ff360wq,1579535121.0,Did I say that? No. I clearly said I know a few who couldn't. Maybe they're just idiots but I do know for those who cant figure it out they did not buy it. We weren't going to buy it because every time we do no one chips in.
tifu,ff368h8,t1_ff2k2qw,1579534667.0,"Growing up the librarian at our elementary school hated shut up. If you said it within earshot of her you got detention. One year the yearbook had a picture of her apparently yelling, tilted over & mouth opened. The yearbook teacher added a talk bubble that said Shut Up! She was mad at him for years!"
tifu,ff35q9s,t1_ff2fs16,1579534313.0,I went with Ned Flanders because it was over 20 yrs ago.
tifu,ff34zt3,t1_ff2odoh,1579533812.0,Growing up we had a dog named DeeDee. I only learned when I was a teenager he was so called that because when they first got him (he was a stray they found) he would get into stuff and my uncle was always yelling Dammit Dog at him but they didn't want us kids to hear it so it was shortened.
tifu,ff34l15,t1_ff2k6vz,1579533524.0,"> around the boomers

My boss in a Gen Xer and hates it. He complains how his wife swears too. Its not really an age thing, some people just don't like it. Also religious people of all ages don't like it."
tifu,ff34gpi,t1_ff2m306,1579533437.0,"I swore around mine when they were small, my oldest never repeated them but my second son did. I knew I had to stop when we were in a store waiting in a long line and he yelled ""this is a bunch of bullshit!"" Even at 4 yrs old it wasn't that cute. 

After that I stopped swearing around them and made sure the rest of my family did too. They are now in their mid-20s, my oldest still doesn't really swear while my other does occasionally. He once did it in front of me but I didn't say anything and he quickly caught himself and tried to mask it."
tifu,ff33uhq,t1_ff2v30v,1579532991.0,"I was a school bus driver, after 15 yrs in the construction field, so I had to really sensor my language. Needless to say once in a while it would slip. In one case it was when someone was making a high pitched screech, I narrowed it down to 1 of 3 sisters, mainly because I know it a female and after their stop/ before it I never had an issue. 

Well, one trip she started the screech and I had to hear it for about 3 minutes until I got to the next stop. Once stopped I stood up and said ""Enough of that damn screeching!"" The same sister group went home and told their mom that I was yelling and cursing at them saying fuck and shit. My boss questioned me so I told her, then she pulled the video from my bus and commended me on only saying damn. 

Another trip I was coming to a stop when these girls decided to run down the aisle instead of waiting until I was stopped so I braked a little hard and they fell. One said ""What the hell? That was really rude!"" I told them to stay in their damn seats and she said ""oh no I'm telling my mom you swore at us!"" I replied, ""Go ahead and I will be sure to share the words you use. Believe me I hear them all."" I never heard a thing."
MMA,ff1x8jq,t1_fez67b4,1579488254.0,IDK I just know a few people who could not and 1 who called Amazon because they have a Firestick and were told it could not be cast but they could watch it on their phone.
MMA,fez1806,t1_feyz7ju,1579452963.0,"I had some friends who couldn't get it and were told specifically it couldn't be. I know NFL games can't, so I wasn't surprised. If you have a direct cable you can do it."
MMA,feyykls,t1_feyxjnh,1579452050.0,"The buzz was there, but the way to buy it was not. It had to be bought through the ESPN app and couldn't be mirror cast to TV. Lots of friends who would have bought it, and us, didn't because of this."
nottheonion,fewla9q,t1_few2366,1579413424.0,"Im in Az, charter buses are slowest during the summer. I also know of no school district that annualized drivers because they are 9 month positions, not 12."
nottheonion,fevxpi7,t1_fev7gee,1579402833.0,"Yeah, but all of the time off doesn't help. Its nice having a week in the fall & spring, 3 weeks at Christmas and all those holidays but not getting a paycheck isn't so nice. Having to find a job every summer just to make ends meet is why its so hard to get decent drivers."
nottheonion,fevwr58,t1_feu2cwq,1579402426.0,The funny thing there is the admin seem to have all been teachers before moving up to the big office.
nottheonion,fevwkz9,t1_feubjrg,1579402355.0,"At my son's HS graduation the Assistant Superintendent gave the main speech. She was so drunk she was slurring her words, giggling, babbling about nonsense, going on tangents, etc. It was clear to everyone and watching the admin staff sit uncomfortably trying to ignore it only solidified my lack of trust in schools. 

My husband a fleet supervisor in a large school district. Recently they hired a consultant who helped turn things around... then decided to fire about everyone to include the director. He was made acting director, drawing a decent salary to go on top of the 6 figures paid to him for his consulting services. He has convinced them to purchase new software that his company shares the profits of, and recently got them to hire a new director who happens to be a friend of his."
news,fevrudu,t1_fev9moz,1579400775.0,"I had to tell my son's teacher that the other kids saying he stinks and making fun of his running nose; because he's not allowed to get up and cross the room to get a kleenex during class, was forms of bullying. She told me it was happening and suggested I have him shower and put on clean clothes every morning, which he did, and buy a box of kleenex just for him. She did not realize it was bullying because she said no one actually touched him."
news,fevqq0b,t1_fev4vjm,1579400371.0,Uhhh no. By federal law you need a Class B CDL with P and S endorsements. You also have to get a certification for each state in which you want to drive in.
news,fevqklw,t1_fevl2ta,1579400314.0,You also have to have 20 hrs practice by a CDL instructor and a vehicle in which to do the road test.
news,fevq4yy,t1_fevchuu,1579400138.0,"When I drove bus I got in trouble for ""slamming on the brakes making a 1st grader fall to the ground""... in reality I was slowing down at a red light, said kid was jumping from 1 seat to the other and that's why he flew forward."
TwoXChromosomes,feu4w8p,t1_feteqk7,1579383120.0,Thus the reason using a backup method is highly recommended.
PartyOfFive2020,fep6r7j,t1_fep3o4e,1579313394.0,Oh apparently that just passed. With all the Trump stuff I have been tuned out of the news. I think this script was written a while back so before it passed.
PartyOfFive2020,fep2r2z,t1_fdpupms,1579310831.0,DACA is the same as Dreamer.
television,fep08lb,t1_fdlin98,1579309237.0,But one of those is a toddler. Why not at least take your toddler with you?
worldnews,feof7d0,t1_feo3vjc,1579299310.0,"Farmers in their 90s now had the benefit of equipment for decades, along with laborers. They would have started farming 70 years ago- in the 1950s. You should ask a few how many years they farmed and if they had tractors and such. My grandparents lived & worked on a cotton farm around 1930 until the farm was sold to developers and even though they only worked it for about a decade in their 70s they still had back and hand problems from being bent over picking cotton."
personalfinance,fenvoy2,t1_femzj6j,1579291634.0,"I used to use H&R Block when I only made $30k & was single w/ 2 kids. It would cost about $400 to them, but I got my $3k+ refund within a week when I only paid about $400 in taxes so its not like it was money out of my pocket. That's what most people who use them are doing, anyway. Its not hard to do it yourself but some people don't want to wait."
worldnews,fenv3ki,t1_fenkggu,1579291298.0,"What did he do in the army and the mine, though? Just being in a field doesn't mean you did loads of manual labor."
