subreddit,self ID,parent ID,time,textworldnews,fenv0vu,t1_fenhtvv,1579291254.0,"Today I could see that with farmers, much of the work they do is by machine. 

There are a lot of trades that are far more physically intense than just a builder. If you spend decades bending & lifting heavy things; or at a job that highly stressful it seems you just don't live very long. How many people do you know in their 90s who spend 30+ years doing physical labor 40 hrs a week?"
personalfinance,fentbkh,t1_fen92fh,1579290503.0,"Thanks, it is. She finds any deduction possible and will call me if there's ever a question."
worldnews,fen4bx3,t1_fen352t,1579276676.0,"I pointed this out to my husband before, people who did manual labor for 30+ yrs of their working career don't live to the ripe old age of 80, much less 100. At least from the hundreds of people I know/ have known. Anyone who makes it past 80 spent most of their youth either not working or having a job with limited manual labor or stress."
personalfinance,fen3uss,t1_fen198m,1579276378.0,"I was going to say that. I don't think people realize this, and if you can't pay in April you still file and after its accepted file for an extension on payment."
personalfinance,fen3ovq,t1_fen2ewc,1579276274.0,You should call the IRS directly. I have had to do that and they are actually very friendly and knowledgeable!
personalfinance,fen3kr7,t1_fen1mok,1579276203.0,"Our personal tax return is $100 through our CPA. We know its right and we don't have to waste our own time doing it ourselves. I drop off papers then when its done go back in to review it, sign and pay. She even E-Files it."
personalfinance,fen3cku,t1_femzlef,1579276057.0,"I personally would say use a CPA, and not the random booth at the mall. Self Employment is very tricky and a little mistake can be bad. I have always done my own taxes but first time doing it for my 1099 I worked it out 3 times and got 3 completely different numbers. It was also a really hard learning curve because when I started I didn't know what to keep and what not to. It cost me a bit because she had to unravel my mess, but after I was able to give her detailed records so the cost went way down.

It is $100 for me & my husband's personal income return and $150 for self employment through my CPA. Its well worth not worrying I missed something, plus all I do is drop it all off then come back a few weeks later."
todayilearned,fen2kde,t1_fen1gvl,1579275558.0,"I once saw pics from a homeless camp deep in the Arizona woods, around the tent were a few hundred white plastic grocery bags. Apparently the guy would crap in the bag, tie it up, and throw it in a pile. It seems some people don't understand how to dig a hole like our ancestors did."
todayilearned,fen1tvt,t1_fen0i9t,1579275085.0,"But he was a true eco-terrorist, fighting the industrial complex!"
todayilearned,fen18bv,t1_femxh0j,1579274698.0,"What if you print it, then go to a Kinkos and do a low grade B&W copy?"
todayilearned,fen15ep,t1_femxd33,1579274647.0,">keep it offline

Dude was living in a cabin in the woods shitting in a bucket."
todayilearned,fen10u9,t1_femubif,1579274564.0,Cops went from solving crimes by accidentally stumbling on a traffic violation to accidentally stumbling on old data files?
todayilearned,fen0r9n,t1_femuhlg,1579274392.0,"Well, his wife kind of browbeat him into narcing him out."
todayilearned,fen0nru,t1_femyosa,1579274327.0,"I, too followed it in real time and Netflix did fairly exaggerate. It seemed during the 'manhunt' the FBI had no idea what was going on. I remember after every bomb there was a whole new profile. It seemed they would never catch him, and if not for his brother they wouldn't have. Even after the capture FBI officials admitted as much. 

I use manhunt loosely, because there was not actual hunting, they simply waited for another bombing to go and get evidence."
todayilearned,fen09ok,t1_femyo9r,1579274068.0,"I lived it, and followed the story as it happened including after the arrest. The docu was still good because it goes very in depth into each incident and how it affected everyone."
gifs,femtsro,t1_femg494,1579269391.0,"Difference is black bears aren't known to be aggressive whereas moose are. My husband was looking for jobs a while back & Coleville, Wa was on the list. I googled it and saw a picture of a moose, I told him its going to be hard making long distance work but we can try!"
todayilearned,felscad,t1_felqgj4,1579229727.0,"6 ft tall- thre fence posts were 4"" diameter logs."
todayilearned,felketv,t1_fel6pp3,1579224297.0,"I DIY'd a fence. Did 150 lin. ft 6ft tall for about $2k using 4"" log poles, stringers, & aluminum panels."
Futurology,felftb2,t1_felck73,1579221163.0,"I tried to stay up, but after a hard day of working it just wasn't easy!"
personalfinance,fekr73i,t1_fekic3s,1579205922.0,"Oh they know. Its how they get the school money. This is their business and the more money they can get for their company the better employee they are. This is an easy one, too ""just try it for a few weeks you don't have to pay""... ""oh you do? Oh I'm soooo sorry, my mistake! Oh well, maybe when you return next semester you will find a class you do like and we can get the whole tuition from you instead of just part of it."""
personalfinance,feklhu8,t1_fekkeji,1579202530.0,"Funny thing, it wasn't company policy. Corporate was not watching my emails its just the new superintendent throwing his weight around. I talk to corporate often, I don't think he realizes this."
tifu,fekjqit,t1_fejxugx,1579201489.0,"I'm sorry. And here I thought a story about SOs kinky porn might have a happy ending, unlike mine did. My ex seemed more into it than me. Once I walked in on him watching lesbians (he was always trying to get me to do a 3-some) and I walked up behind him, leaned over and said ""you should try to pick up some pointers looks like she knows what she's doing"". 

Also didn't help when I found out his Vegas trip ""with the guys"" was actually a meet up with a woman he met online."
Futurology,fekia4o,t1_fekakfj,1579200613.0,"Here's the commercial, so it would have been 2009 when I started using it. I worked & went to class so I watched TV online/ recorded with the DVR in my computer. When I saw this I went and checked it out, loved that I could watch regular TV again! 

 [https://www.youtube.com/watch?v=bbLtLUwMTxg](https://www.youtube.com/watch?v=bbLtLUwMTxg)"
tifu,fekhl0s,t1_fek8sjk,1579200199.0,"No one puts sex toys in the will.
And all the friend has to say is she loaned them to her & gave her an extra key."
