subreddit,self ID,parent ID,time,text
news,ffnr3is,t3_eubjfc,1580069625.0,Absolute madness.
nba,ffnqiff,t1_ffnoao7,1580069393.0,"If I get in a crash I could break any number of bones, hell even be paralyzed from the waist down seems better off to me than knowing that plummeting from the sky isn't gonna leave me with a busted femur."
nba,ffnq9ax,t1_ffnkypj,1580069292.0,If this weren't real then someone close to him would have debunked this right?
TIHI,ffmjs1o,t3_eu5xb6,1580055653.0,This sub seems lame.
interestingasfuck,ffkp6q5,t3_eu0f3r,1580026480.0,I would come out of that slide covered in my own puke.
starterpacks,ffjxws1,t3_etwun5,1580009987.0,Tonight is my last night of isolation
TheNWA,ffju8l9,t3_etul98,1580007088.0,Give her a new belt
reddeadredemption,ffjtoa2,t1_ffjks7m,1580006649.0,Woosh there it is
politics,ffjjgz1,t1_ffj2hlp,1579999614.0,The porn parody of National Treasure?
WWEGames,ffivw3w,t3_etmzwm,1579983966.0,Fuck yeah
WWEGames,ffivl65,t3_etroye,1579983764.0,They look like a Smash Mouth cover band
rareinsults,ffin9d2,t3_ets5ys,1579977949.0,He looks like the CAW you find on the community creations for WWE 2k19
DisneyPlus,ffihpzy,t3_etqevi,1579974143.0,"Hell no it teaches them French for God's sake.

But really I have no idea. My 4 year old loves it and it's always just played from the ""previously viewed"" section."
pagan,ffifiyy,t1_ffhg2kz,1579972649.0,Sure but Glenn Milstead was always Divine.
pagan,ffifg0t,t1_ffhfh78,1579972592.0,I'm surprised ancestor worship or veneration isn't more widespread in modern pagan movements. Aside from heathenism at least.
TheNWA,ffif9yc,t3_etscvl,1579972477.0,No that's Ivar's gimmick
gifsthatkeepongiving,ffhmi1t,t1_ffhkaji,1579942389.0,"Necessary? Is it *necessary* for me to drink my own urine? No, but it's sterile and I like the taste."
StardewValley,ffhehvk,t3_estcjk,1579931937.0,I'm on PS4. How do you get overviews of your land like this?
notliketheothergirls,ffh7wvc,t1_ffh63d7,1579925643.0,Exactly
notliketheothergirls,ffgyz3q,t1_ffg5ydx,1579918684.0,/r/whiskey
saltierthancrait,ffgd5q4,t3_etbvna,1579903603.0,Because #metoo.
StardewValley,fffyb8r,t1_fffp4kd,1579894460.0,Thank you!
television,fffp6vb,t1_ffeyf9c,1579888788.0,My nephew Michael *loved* Rugrats. Remembering how Angelica was and how my sister was to my nephew it makes me wonder if he grew up thinking Angelica was a way to be.
WTF,fffmgzi,t1_ffevld2,1579887132.0,This joke is A+
news,ffdw5iv,t1_ffdaq3e,1579830415.0,Hey do you folks like coffee?
WTF,ffdtvdz,t1_ffdr61e,1579828797.0,[Confirmed?](https://i.imgur.com/1lg5hbD.gifv)
WTF,ffdqyca,t1_ffdqnul,1579826791.0,You mean like Budweiser and Seagrams?
badwomensanatomy,ffdqomx,t3_esutny,1579826622.0,He heard a pussy called a clam once and took it literally.
WTF,ffdnze0,t1_ffdlhmo,1579824933.0,Coronavirus? I had the Michelob Flu once and Acute Crown Royal Syndrome.
insanepeoplefacebook,ffauwbo,t1_ffaoj22,1579745050.0,Is this a cat in a hat?
Baking,ffa6whe,t1_ff9oi7g,1579729051.0,But you have to specifiy it's the tea not the actual Earl and that it's hot not cold.
MakeMeSuffer,ffa1s65,t1_ff8yy9l,1579726159.0,Cooking like a bitch
vaxxhappened,ffa0x4k,t1_ff8sey2,1579725655.0,What a time to be FABULOUS
LPOTL,ff9xgpi,t3_es0avi,1579723622.0,Makes me wanna be a teenager again
AskReddit,ff9vft9,t3_esc8vq,1579722358.0,Sit down and cry
assassinscreed,ff9q1e9,t3_eqwck4,1579718412.0,After seeing these I'm most intrigued by a Byzantine AC.
Unexpected,ff9hz8a,t3_esau3w,1579713420.0,"Hey, uh. Fuck you."
oddlysatisfying,ff9hdsf,t1_ff9eoky,1579713055.0,Buffalo soldiaaaaa
WWEGames,ff9fhmr,t3_es2avc,1579711898.0,Team him with Breezango and call them the Fashion Show
Scotch,ff9drwg,t3_esdv3q,1579710811.0,*starter* Scotch? This is a *finisher* Scotch!
saltierthancrait,ff9cue3,t1_ff8tg95,1579710147.0,"""I see him turning his lightsaber to strike down his true enemy!""

*The Force holds up a spork*"
DidntKnowIWantedThat,ff8hses,t1_ff7k3v1,1579679090.0,My precious ice cream bar... I've had it since I was a *child*...
Wicca,ff7rcp2,t1_ff7k22d,1579656491.0,Your fucking username
shadowofmordor,ff789wr,t1_ff70osu,1579643075.0,Nice! I'll have to work on that
NoMansSkyTheGame,ff6ja9d,t3_ertlyk,1579628400.0,How do you set up a mine?
saltierthancrait,ff6efe9,t3_ervude,1579625403.0,Goddamn I really hate Star Wars now. They're retconning shit to fit what TROS fucked up. Fuck this. I'm turning in my fanclub card.
oddlysatisfying,ff5kjlo,t1_ff5htzs,1579597299.0,"Hahaha trapped like rats inside the dead crusty bodies of their own kind, a sort of yeasty exoskeleton, only to be smeared with cream cheese and devoured later on.

The fools have no idea what horrors await them inside of Einstein Bros. Bagels!"
assassinscreed,ff5d1do,t1_ff5b9hr,1579587835.0,Oh I am!
assassinscreed,ff5b8gl,t3_erewla,1579585955.0,Hey I'm playing Unity for the first time right now
Wicca,ff5aun2,t1_ff5653x,1579585577.0,Sso you're saying that Eclectic Wicca isn't actually Wicca but is only borrowing from Wicca enough to give that appearance?
gifs,ff5a8jd,t1_ff56xky,1579584987.0,FOR ME TO POOP ON
fakehistoryporn,ff58gtv,t1_ff589fi,1579583345.0,"*the joke*

*my head*"
fakehistoryporn,ff57bek,t1_ff54wm8,1579582322.0,But those are small...
Wicca,ff5346p,t1_ff52td3,1579578922.0,Wow that's a lot!
Wicca,ff52pv9,t1_ff52o4v,1579578613.0,"Ah, see I don't use Instagram but maybe I will look into it."
TopMindsOfReddit,ff4pq04,t1_ff45kh0,1579569467.0,"But it is what Russia wants. Am I calling Donald Trump and his MAGAts anti-American Russian operatives?

Before we begin speculating as to their motives let me make myself clear when I say yes."
WTF,ff4o906,t3_erhb38,1579568437.0,Questions about what? Icy roads?
wholesomememes,ff4m6ke,t1_ff4i2jj,1579566978.0,"Let Hitler be a true example of a great leader in history. Let him be remembered as such a great leader that his followers and all neo-Nazis and sympathisers forever continue to follow his wonderful standard.

By blowing their fucking brains out."
wholesomememes,ff4h6n4,t1_ff451fu,1579563516.0,Not every baby lives up to the standard you've set.
wholesomememes,ff4h36b,t3_erigyr,1579563451.0,I have a 4 year old daughter and I have never stopped the happy dad tears. I am an emotional wreck of a man.
assassinscreed,ff4gvja,t1_ff4egns,1579563306.0,I think I am going to go for Ezio and 3 so I have a healthy backlog.
ABoringDystopia,ff4au8y,t1_ff44ye2,1579559316.0,You say there's panic on the streets of London?
MovieDetails,ff49d3f,t1_ff48j0s,1579558387.0,Maybe I can use my coke nail to do some bumps.
MovieDetails,ff46cds,t1_ff451qg,1579556510.0,"Maybe it is I who is weak, O strong man"
StrangerThings,ff45x0n,t1_ff3v17u,1579556246.0,And money and success and drive and motivation.
shittymoviedetails,ff44i9p,t1_ff33ngs,1579555357.0,Killing Boke
specializedtools,ff448ro,t1_ff3mxme,1579555190.0,"""Who does Number Two work for?!""

""Yeah buddy you show that turd who's boss!"""
MovieDetails,ff43eix,t1_ff4202d,1579554675.0,Prying things open with your pinky nail? Doesn't seem strong enough.
WWEGames,ff41cxl,t3_erg4ss,1579553410.0,I love the work you do for the NWA loyalists lol
LPOTL,ff40u4m,t3_eril3d,1579553086.0,I'm sorry were you saying something recycled? It sounded like you said something...recycled.
occult,ff3xxyu,t1_ff2fa9e,1579551279.0,No shit?! Thanks!
MakeMeSuffer,ff3i3yg,t1_ff3eovk,1579541518.0,"*""Street rat!*""

-Guy chasing Aladdin"
HydroHomies,ff2mdnd,t1_ff1yscg,1579513125.0,Kinda like his belief that kids should be given hormone replacements and be transgender if they want.
SquaredCircle,ff20tgu,t1_ff14ww5,1579490775.0,Straight to bootleg ~~dvd~~ VHS
SquaredCircle,ff1zziu,t3_eqx69z,1579490172.0,You can jist see Stephanie's nipple.
WWEGames,ff1z57s,t1_fewsk3e,1579489561.0,I dig it
Whiskyporn,ff1wwsa,t1_ff1wi5o,1579488045.0,Lol ok man
Whiskyporn,ff1w05y,t1_ff1t7rp,1579487437.0,"5 lifetimes? Really?

And why are they ignorant and self entitled?

Because they spent their money on a drink they enjoy?"
whiskey,ff1vjpk,t1_fex3n7t,1579487134.0,"It's decent when mixed with Pepsi.

^^^^^^^^^^^/s"
LPOTL,ff1v2xw,t1_ff12e2a,1579486836.0,"""Would you like to see how many pairs of New Balance I own? They're past the binders of Polaroids from graveyards around the world and next to the locks of hair I bought from ebay claiming to be from Jon Benet Ramsey."""
gonewild,ff1prme,t3_er0hi0,1579483463.0,[X] Doubt
food,ff1p5ec,t1_ff0tx8u,1579483066.0,"My coworker is Ethiopian and she made the bread and that dish with the egg in it.

I have never shit such a shit in my life."
todayilearned,ff1n8x6,t1_ff1lb7n,1579481997.0,Oh sweet I'm gonna die broke *and* broken.
FREE,ff1mxaz,t3_er31c0,1579481833.0,I hope I win Assassin's Creed: Odyssey but good luck to all!
assassinscreed,ff1i27w,t1_ff1ax83,1579479556.0,I think I will grab that one! I should have taken advantage of the recent PS sale because digital it's $40 but Amazon has it for almost half that!
assassinscreed,ff1d76q,t1_ff0udao,1579477677.0,The... Assassins were a Shia Muslim order so...?
assassinscreed,ff1cwhq,t3_eqwck4,1579477559.0,Holy shit a British Raj or Mughal Empire Assassin's Creed would be great. It would give an historical reason for the Assassin's to be in India.
assassinscreed,ff1aslc,t3_eqyqlj,1579476888.0,"From what I understand both Origins and Odyssey have very heavy mythological elements.

I would like to see more of a historical lean and a story set in the Middle East would be great."
Unexpected,ff15exv,t1_ff15bjc,1579475408.0,Instagram
Unexpected,ff153jw,t1_ff13zlu,1579475293.0,Keep your freaky deaky shit to yourself.
Unexpected,ff13n79,t1_ff120l9,1579474864.0,This is why I only date whoors
Wicca,ff0zzfp,t1_ff0vlej,1579473913.0,Oh oh oh
saltierthancrait,ff0zuko,t1_fevztge,1579473869.0,At the 6:09 mark.
saltierthancrait,ff0xeam,t1_fez3fnq,1579473236.0,"""The Dead Speak!"""
saltierthancrait,ff0vwuy,t3_eqw0t2,1579472787.0,"ST:TFA and SW:TLJ are both ????

While TROS is BeginningMiddleandEnd all in one.

Fucking terrible mismanagement."
saltierthancrait,ff0vaxa,t1_fezlqjv,1579472634.0,"White people looking for validation as being ""on the side of"" non-white people."
Wicca,ff0qczp,t1_ff0na0i,1579471336.0,?
Wicca,ff062sd,t3_eqz35z,1579465603.0,Where you get that athame?
WTF,ff05l1f,t1_fezlkf4,1579465417.0,So it's the blind leading the blind?
MadeMeSmile,ff01tch,t3_eqwnux,1579464299.0,This is juat an ad for Natty Light
