subreddit,self ID,parent ID,time,text
aww,ff1r7px,t1_ff122n8,1579484401.0,A good home for the beautiful Jubilee
aww,fecr0by,t1_fecnb6u,1578981389.0,It reminds me of Jack and Rose in the movie Titanic
gaming,feca309,t1_febyeuf,1578969367.0,"""fast and furious"" child version"
rarepuppers,fe7iwd7,t1_fe6me83,1578915163.0,The ears are always at full capacity
aww,fe7if58,t1_fe6wbw1,1578914949.0,"Thank you for the video. It reminds me of my childhood. I was very short and often could not reach the bowls on my cupboard and every time my brother would show up and take them for me. Now that I'm with him in two different cities, I always want to go back to my childhood with him."
aww,fdjlxri,t1_fdj3n2g,1578477226.0,This is a good way to help him exercise
aww,fbzo7wj,t1_fbzj98s,1577253688.0,The happiness family
