subreddit,self ID,parent ID,time,text
Whatcouldgowrong,ffhjxl2,t1_ffggb5r,1579938685.0,Lol Jesus fucking Christ. Human monsters? Take a step back for a minute dude. It's some highschool kids doing some stupid shit and that's all it is.
Whatcouldgowrong,ffhjt1f,t1_ffh25xe,1579938508.0,Seriously Reddit is so predictably stupid when it comes to this type of stuff. It's just some highschool kids doing some stupid shit. There are so many comments acting like these guys narrowly escaped dying.
mildlyinfuriating,ffhh9oi,t1_ffhc8ow,1579935173.0,Makes sense on a business level until people inevitably realize what happened and call out AP for their racist bullshit. I can believe that this wasn't done for racist reasons but think that cropping out the black girl would do anything other than backfire is nothing but corporate arrogance.
sports,ffhfwzd,t1_ffh3fji,1579933549.0,Yeah I almost never watch the pro bowl but I'd definitely watch this. They could do some American Ultimate Warrior obstacle course's or something too.
ExpectationVsReality,ffglhu5,t1_ffg589x,1579908997.0,They'd have to evacuate the theater that shit would smell so bad.
worldnews,ffg7mjg,t1_ffg19et,1579900201.0,"Reading the whole story it seems plausible honestly. Seems like the tracked their credit card information as they traveled to New York and they were staying there until they maxed out their credit card. I don't think it rules foul play out but I think it does support the idea that the ran away. 



Also I never saw anything about them being bound at their feet like the previous commenter said. Seems like they were bound loosely around the waist and not in a restrictive way. 



I'm not defending Saudi Arabia or anything and I fully believe they would do this but I'm not sure I agree with the people acting like it's obvious that they were killed and the cops are shamelessly covering it up."
worldnews,fffx0jd,t1_fffkb7e,1579893654.0,"> Suicide remains “a leading theory,” a law enforcement official told NBC News.


I didn't see this in either of those articles?"
UNBGBBIIVCHIDCTIICBG,fffndjq,t1_fff737p,1579887685.0,Yeah but not using real words.
UNBGBBIIVCHIDCTIICBG,fffn8yq,t1_fffdsef,1579887608.0,"Guinness sold it. It's currently owned by the Jim Patterson group, the parent company of Ripley's Believe it or Not and a fuckload of other things."
theydidthemath,ffff4n1,t1_fffc7lm,1579882603.0,"Or -4,821,818,182 Big Macs stacked on top on each other."
todayilearned,ffe6hgg,t1_ffceamp,1579837985.0,"For a lot of this I think it's important to remember that the wealthy patricians, the people writing everything we know about Nero, would have had very different opinions about him than the average roman citizen. The hyper conservative Roman senate hated him for his acting and love of performance and certainly other reasons. The plebs may have shared similar views about acting but they definitely wouldn't have felt as strongly about it as the traditionalists in the Senate. 


The lavish spending on public works and games is exactly the kind of thing that tended to keep emperor's in the good graces of the peasants. His prosecution of the Christians wouldn't have meant much to them either. They were a strange and foreign cult at this time which tend to make pretty good scapegoats. His active prosecution of Christians very well could have helped his popularity with the plebs."
todayilearned,ffe5qv8,t1_ffcumli,1579837416.0,Especially for the Romans. They're pretty much all either the perfect Roman woman or an evil monster.
science,ffdn1kf,t1_ffdh4f9,1579824365.0,First of all you can only own decommissioned tanks with the guns and firing systems disabled. That's not what I was talking about. Do you think people should be able to buy active tanks with working guns? If you're going to deflect again by saying it doesn't matter what you think then this is pointless. It matters because I'm trying to understand what you believe.
science,ffdgpsd,t1_ffdf3z9,1579820502.0,"Do you think the public should be able to buy working tanks and other military equipment? What about large bombs and missles? Your logic would apply to all of that stuff as well. If you want to kill someone you can do it without a tank so we might as well let people have tanks right? Ofcourse not. 



Yes you can kill with just about anything but some objects are much more deadly than others. The only question is where do you draw the line, not whether it should exist at all. It has to exist or we'll be living in mad Max anarchy."
unpopularopinion,ffd8lnr,t1_ffch97g,1579815545.0,"I think a lot of it is planning ahead. I feel like most people agree that 25, give or take a year or two, is pretty much the prime soldier age. If the military is drafting people 24-25 year old by the time they're trained and put in action they're only going to be in their primes for a short amount of time. They would rather train 18-19 year olds so they can already have some experience by the time they enter their primes and so the military can use them for the entirety of their prime."
todayilearned,ffcwhec,t1_ffcpsr7,1579808716.0,"My favorite tidbit is that not only did the think the surrender information was propaganda, he believed that the stories about post war Japan actually proved that Japan couldn't have surrendered. He was taught that every man woman and child would die defending Japan and he believed it. The fact that Japan still existed was proof to him that Japan was still fighting. 


That's some next level dedication or fanaticism or whatever else you want to call it."
todayilearned,ffcvvcd,t1_ffcmsm8,1579808345.0,"It's fascinating, in a horrifying kind of way, to imagine what would have happened if the emperor never surrendered or even actively encouraged people to keep fighting. Like I wonder what percentage of the population would have been willing to die defending Japan? A much higher percentage than most countries for sure. It would have been absolutely devastating to everyone involved."
todayilearned,ffcv7zo,t1_ffci3tq,1579807950.0,Japanese dedication in WWII was intense as fuck. There was a Japanese guy on an island who didn't surrender until the 70s or something. In an effort to get him to surrender they dropped newspapers describing modern day Japan. He claimed that those newspapers only proved that Japan had not surrendered because so long as a single Japanese was left alive then it wouldn't surrender. He was taught that every man woman and child would die before Japan surrendered and he seemed to believe it. He does not seem to be alone in that belief.
therewasanattempt,ffcpu71,t1_ffcoz36,1579804678.0,"Well yeah that's exactly what he's saying. Just because the movement began in the 50s it doesn't mean that's when actress stopped being the colloquially used word. 


It'd be correct to say that it stopped being the colloquial word (or much less so at least) when the movement got legs. Much later than the 50s."
BlackPeopleTwitter,ffchqan,t1_ffc70xa,1579799713.0,"It's painfully ironic how similar politics on Reddit are to Fox News. Obviously it's a very different type of media medium but the misinformation, anger and blaming everything on the side are all the same.


I actually agree with the political leanings on Reddit but that doesn't mean it's not an awful place to get political information or opinions though. It doesn't really represent or even understand the more centrist or disinterested Americans, which make up a massive part of the country."
TIHI,ffcb209,t1_ffcab6f,1579795579.0,America has a population of 327 million people. Tens of thousands is like 0.01% of the population and would absolutely qualify as niche.
justneckbeardthings,ffc8xdo,t1_ffc5xc2,1579794237.0,Fine. What are we talking here like once or twice a month?
comedyhomicide,ffaksna,t1_ffafo7v,1579738231.0,If you hate dogs that doesn't surprise me I guess. It's ironic that people on that sub think that obsessing over dogs is unhealthy and a sign of shamelessly seeking affirmation but that's literally exactly what they're doing. If hanging out in a sub dedicated to hating dogs isn't a sign of being obsessed with dogs I don't know what is. Also posting there so that other people who hate dogs can congratulate you on how enlightened you are is very obviously seeking affirmation.
facepalm,ffafqgu,t1_ff9wqza,1579734689.0,"Well since this happened in America and it's about national holidays it's not really relevant that other countries have different holidays. 

A huge amount of people in America live in rural areas they aren't really specific to any small area."
comedyhomicide,ffa5yop,t1_ff9jj6f,1579728537.0,"r/childfree is just toxic people hating on children and anyone who they think is stupid enough to have kids. I didn't downvote you but I'm guessing the people who did assumed r/dogfree was similar except towards dogs (I'm not familiar with it so I have no idea if it's true or not). 


I do feel like these subs that are set up exclusively in opposition to something are almost bound to turn toxic eventually unless the mods are extremely active.


Edit: Took a look and yeah it's pretty much what I figured. Just a bunch of toxic people who hate dogs so much that they post stories about how much dogs suck so that they be congratulated by other people who hate dogs.

Edit 2: https://www.reddit.com/r/Dogfree/comments/esahd4/dog_obsession_is_a_harbinger_of_decaying 


I mean what the fuck is this? This is incel level delusional."
sadcringe,ffa3a7s,t1_ff9xfn6,1579727024.0,"> It's not just like this guy happened to see her and immediately fell in love


You have no idea. Seems more likely to me that a college freshman has a crush and is calling it love."
sadcringe,ffa2y8k,t1_ff9tpxs,1579726833.0,"Sounds more like a crush and IMO it's pretty cringey to throw things around like ""the girl I love"" if you've never even been in a relationship with her. It's hard to tell the exact situation though."
lotrmemes,ff9t7hv,t1_ff9mz0d,1579720737.0,"For the record I've never read the books either, just have been told things and read the wikis. 


He was 33 when he first got the ring which would make him about 50 when he started the journey. I think hobbits age a little slower than humans and the ring probably slowed his aging like it did with Bilbo."
lotrmemes,ff9msuk,t1_ff9lp4a,1579716278.0,True but in the books Frodo has the ring for 17 years before starting the journey to Mordor. Still much shorter than Bilbo's 60 years but a lot longer than the movies make it seem like.
ScottishPeopleTwitter,ff9b5d4,t1_ff98faq,1579708957.0,I just thought of this but my bet might be some NFL offensive linemen. Those boys can eat and it's ridiculous how many calories they have to eat to weigh 300+ pounds while still being an incredibly active athlete. Most of them drop down to a more manageable and healthy weight after they retire but it's not like they're switching switching to nothing but salad.
NintendoSwitch,ff8cm7f,t1_ff7w9tp,1579673022.0,"I'm not against it but I don't really care or see it as a big deal either. I'm going to look for reviews of a game before buying it anyways. 



Also I love Nintendo for what it is but they make all kinds of weird ass decisions and based on their history it seems pretty useless to attempt to force them to change. They're going to do what they want with some of their awful decisions and for me it's not worth getting upset over them anymore."
videos,ff8atru,t1_ff71f7x,1579671229.0,"Thank God this is a highly rated comment this time! This shit has been all over the front page for weeks. Her entire fucking business is generating outrage! Stop falling for it hook line and sinker with the ""look how shitty Wendy Williams is threads."" Yes she's a piece of shit but allowing yourself to get so worked up over her shitty comments to the point that you actively spread them is doing exactly what she wants you to do.



Go watch some puppy videos or learn to play an instrument or do literally anything other than allowing yourself to be riled up by someone who's trying to rile you up."
todayilearned,ff881gp,t1_ff8744j,1579668672.0,"I'd say what determines caught red handed? It'd depend on the specific situation but you could always come up with some bizare explanation with a 0.0000001% chance of being true but that 0.0000001% chance is all it takes for something to no longer be infallible. 


In any case the ""nothing is truly infallible"" argument is more of a philosophical argument than anything else, if we're taking infallible to quite literally mean perfect with a 0% chance of being incorrect. I have no problem saying that some things can be proven to be so close to infallible that it makes no difference for real world applications though."
todayilearned,ff85luo,t1_ff4qzj4,1579666631.0,I feel like it's easy to forget that they were every bit as intelligent and creative as modern humans. Sure they didn't have anywhere close to the amount of collective knowledge we have today but from a evolutionary view point 4000 years is basically nothing. You could send a baby born yesterday back in time to be raised by ancient humans and he'd fit in just fine.
todayilearned,ff851kk,t1_ff6cn34,1579666186.0,It was basically like a military draft. They were paid and had some freedom but working on the pyramids wasn't optional. Not quite like independent contractors signing up for a job but definitely not what we generally think when we here the word slave.
trashy,ff82uwv,t1_ff7246d,1579664528.0,"Honestly this is one that I really struggle with. In general I do think that an employer should be able to fire someone for whatever reason they like so long as it's not discriminatory. I'm sure part of that is growing up in an American culture that prioritizes freedom to such a degree that it's often harmful. I like the way Europe does a whole lot of things but I can't shake all of the American freedom programing I've received. 



I definitely understand all the logical arguments against right to work and I can see how implementing stricter laws about firing people would have a lot of benefits, I just have mixed feelings about it."
DidntKnowIWantedThat,ff81axp,t1_ff7rbva,1579663385.0,My guess is that it's more of a gag gift type of thing and it actually smells pretty strongly of smoke and whiskey.
todayilearned,ff7vodb,t1_ff7tp6b,1579659458.0,"The problem is that by the time you've gone through the exhaustive process of appeals that it takes to prove that the evidence is essentially infallible it ends up being more costly to sentence someone to death than it is to keep them in prison for the rest of their life. 


I think you could also argue that no evidence is truly infallible. Is it really worth spending much more money and risking killing innocent people just so we can kill some criminals instead of letting them rot in prison for the rest of their lives? 


There's really no argument for the death penalty any way you look at it."
ScottishPeopleTwitter,ff7n1m3,t1_ff6t266,1579653463.0,"Now I'm curious if they're a slow and steady approach. Like if some eats a ton of chips but not quite enough to make them morbidly obese. Could someone like that eat more chips over the course of their life than someone who ate them at a faster rate but was morbidly obese and died much younger?


My money would probably still be on the morbidly obese dude shoveling chips down his throat but I'm too lazy right now to crunch a few numbers to see if it's even remotely possible. Maybe I'll come back in a bit."
television,ff78db8,t1_ff6tdri,1579643131.0,That's definitely true but I do feel like it's a little different since there was some separation between the personality and the goals of the two versions of Kovacs. It allowed them to do their own thing to a certain degree but still feel like the same person. Adding someone new to the mix who should be essentially the same as Joel Kinnaman's Kovacs seems much harder to pull off. And that's without getting into the emotional attachment to the Joel version. Even if you have no problem in principle to having a new actor as Kovacs it's still reasonable to be a little upset to not have the guy from S1.
nextfuckinglevel,ff6p3fe,t1_ff6l600,1579631926.0,"It's also wort pointing out that he was actively firing at the police and many of the buildings he attacked had people in them but were evacuated before he could destroy them. He may not have been trying to kill anyone but he clearly had no regard for the safety of any innocent bystanders in the path of his rampage. The fact that no one died had nothing to do with him, it was just lucky."
nextfuckinglevel,ff6nvmx,t1_ff665mz,1579631193.0,"Also he wasn't even slighted by the government. Dude was just a jackass who was mad that he had to follow the rules. The ""story"" that keeps getting circulated is extremely misleading in parts and objectively wrong in other parts."
WhitePeopleTwitter,ff6ha3y,t1_ff60u0e,1579627175.0,"The 1st can doesn't count and then you get to the 2nd and 3rd. The 4th and 5th I think I burned with a blowtorch, and then I just kept eating."
WhitePeopleTwitter,ff6dttw,t1_ff69l7k,1579625030.0,I didn't realize you weren't the same guy but someone else said that it'd be impossible to live stream video on the dark web. So it exists but not on the dark web?
WhitePeopleTwitter,ff68c8u,t1_ff67tg9,1579621523.0,But you said it can't actually exist? So is it like an urban legend kind of thing?
mildlyinteresting,ff667d2,t1_ff65gr7,1579620100.0,I mean if we allow people to use a sensible and versatile material all those jazz playing negros might get all uppity. Is it really worth it?
Showerthoughts,ff50c4q,t1_ff4srh9,1579576830.0,"The problem with arguing this with logic is that magic is inherently set up to not be contained by logic. There's only a handful of things established that magic and spells can't do and from there it's pretty much a free for all. 



If there was a full out war between muggles and wizards they could potentially invent spells that would protect them from firearms or invents spells that would instant melt all the muggles guns or something.


I do think the wizards ass backwards devotion to tradition has put them at a severe disadvantage to muggles in a lot of ways but it's more complicated than ""guns shoot faster than spells"". I think muggles could probably beat wizards in an all out war mostly due to outnumbering them so much but technology would definitely play a role."
instant_regret,feysh6g,t1_fewjajh,1579450059.0,I feel like a lot of these people don't watch sports. Something shitty happening in the game would be more than enough to explain all these instant changes in expression that most people seem to think can't be explained.
2meirl4meirl,feylfye,t1_fexvtna,1579447169.0,"I thought it was a skull sort of coming out of the ""void"". Like a portal situation."
nfl,fevu1d0,t1_feulcau,1579401498.0,It's Tom Brady though. You're absolutely right that it'd be a dumb move but all it takes is one desperate team. I'd be surprised but I wouldn't rule it out either.
MurderedByWords,fevkaid,t1_feuppi9,1579398386.0,I couldn't help but look. Lol there's literally people there mad about school lunches being healthier. Obviously there's all the boiler plate racism stuff too but man it's bizarre what these bottom feeders will argue against just because a black democrat supports it.
HumansAreMetal,feungs2,t3_eqj5xn,1579388241.0,"[Link to a FAQ about another guy's solo ocean row if anyone is interested.](https://www.google.com/url?sa=t&source=web&rct=j&url=http://rowforhope.com/html/images/file/Rowforhope_FAQ.pdf&ved=2ahUKEwj1wM3VnY7nAhUNbKwKHRKNC1YQFjAAegQIAxAB&usg=AOvVaw1ef79BeGTkx13PdkvDQm9c)



I'd imagine a lot of it is relevant. Answers to some of by biggest questions are they shit in buckets and chuck it overboard and it seems like they just drift around while they sleep at night and then in the morning they figure out where they are with GPS and recalibrate their course.


[Also some stuff about the boats in general](https://newoceanwave.com/great-pacific-race/boats/)


Seems like that thing with the hatch behind them is the cabin that they sleep in. It doesn't look like it's big enough for someone to lie down in but maybe it extends under the part where they sit when they're rowing? I also wonder if they all sleep at the same time or if they take shifts or something."
todayilearned,feq1h3o,t1_fepg67q,1579336085.0,"By all means if you're such a disciple of his tell me what him ""going to great lengths"" has achieved? Has his ""radical disruption"" changed the course of humanity? It hasn't done jack shit. 


His only contribution to humanity was being a terrorist and a killer. He wasn't some visionary, he was a crazy person with delusions of grandeur. You've literally positioned yourself on the side of and murderer. 


> You simply saying ‘he’s wrong’ is just some bullshit emotional response. You have provided no retort to any of his arguments. 


I don't have to refute his arguments. Plenty of his arguments could be valid but that doesn't make him any less of an psychopathic murderer. If you want to argue that it was necessary for him to kill I'd happily refute that however."
nba,fepfyut,t1_fep0kit,1579319529.0,"Before watching I was thinking ""for fucks sake are we going to start saying yeet instead of shoot now"" but yeet was definitely the right word here."
todayilearned,fepfaja,t1_fepdipz,1579319058.0,"He's wrong. Technological progress is inevitable. Only a fucking insane egomaniacal psychopath would think murdering people with bombs could change that.


I'm sick of the fucking hero worship this dude is getting in this thread. Yes it's entirely possible that the negatives of societal progress end up outweighing the positives but it's not anywhere close to a forgone conclusion and blowing people up isn't the right way to combat that. His ""message"" is not particularly deep or unique in any way. He was a murderer who needed therapy and that's all he was."
todayilearned,fep67h4,t3_eq9k4g,1579313036.0,"I'm pretty sure most of the yellow for NC is prohibiting the sale of alcohol before noon on Sunday or some variation of that. Tried to buy beer at 11:49 before the football games and got hit with that bullshit. Store person said that there wasn't anything they could do because their system literally wouldn't ring it up until 12:00. 



It's one or those things that's annoying but not a big enough deal for anyone to bother changing. I'm wouldn't doubt that some jackass Republican would be able to drum up a little outrage about ""Godless heathens"" and get a couple extra votes if anyone cared enough to try to change it though."
todayilearned,feopxjl,t1_feo855n,1579303751.0,"Sounds more like r/im14andthisisdeep to me. It's really not comparable at all. For one thing politicians didn't chose to introduce automobiles. They were invented and then spread because of how useful they are. 40,000 people dying a year in accidents due to a technological improvement is not the same as actively choosing to kill 40,000 people."
todayilearned,fenqipf,t1_fenh7nx,1579289312.0,"I feel like Long probably never caught on in the way that Yeti or Sasquatch did because not only because it's already a word in English (or closely resembles one) but it's a pretty generic adjective at that which would just be confusing. 


Somewhat ironically what the Greeks and Latins called dragons seem to resemble Eastern Dragons more closely than they do Western ones. Seems like modern Western dragons evolved from that in the Middle ages. The Wikipedia has lots of good information including pictures from the middle ages of dragons that have most of the features of modern Western dragons but still look much more snake like."
movies,fenj2oj,t1_fenfuad,1579285767.0,"Honestly if the entire trilogy was just about Luke being a demi-god level force user I would have been happy no matter how bad they were. 


I don't even hate the sequel trilogy in general but dragging Luke through the mud is by far the worst part about them for me and completely unforgivable."
movies,fenil1r,t1_fengqhb,1579285468.0,"I feel like following ep 8 had a lot to do with it also. If it followed ep 7 I bet it would have been different. 

Ep 7 wasn't a universal hit but the overall attitude of fans towards the trilogy was positive and hopeful. After ep 8 people were pissed and lost a lot of faith in Disney Star Wars."
movies,fengtun,t1_fenesdy,1579284384.0,I also think it's more about future success rather than being upset that the current trilogy could have been more successful. They can coast on the Star Wars name for a while and make plenty of money but if they continue putting out shit like the sequel trilogy that wont go on forever.
movies,fengge5,t1_fencm1h,1579284155.0,I'm sure they aren't exactly upset but it would have been impossible for them not to make money off of this trilogy. They're surely aware (some of them at least) that the was a lot of negative buzz surrounding the entire trilogy and they won't be able to continue to milk the Star Wars name if they keep making the same mistakes.
todayilearned,fen5jnm,t1_femhu0w,1579277446.0,"Why would the Chinese use an English word to describe something they already have a name for? That has nothing to do with how similar the animals are. 


There are a lot of differences but ultimately it's a large, powerful, mythological reptilian animal that can fly. It makes sense to call them dragons and it's not hard to see why they did. What else would they call them? Magic snakes?


In any case the root of the word dragon is Greek and original applied to any large mythological snake like creature I believe."
