subreddit,self ID,parent ID,time,texttodayilearned,fen50pn,t1_fem0b9x,1579277109.0,"Seriously. It's weird how many people are complaining about Eastern dragons being called dragon. Yes there are a lot of differences but ultimately it's a large, powerful, mythological reptilian animal that can fly. Even if you ignore the root of the word dragon it still makes sense to call them dragons."
todayilearned,fen15io,t1_femub9b,1579274649.0,It means the same thing both ways.
todayilearned,fen0eqe,t1_femuhbp,1579274160.0,"You aren't a nutjob terrorist with an obsession about ""correct"" phrases and spellings though. It was his manifesto. I doubt he could have brought himself to write it ""incorrectly"" and it probably never occurred to him that it could lead to him."
todayilearned,femz0f9,t1_femw3k5,1579273212.0,"Didn't he ask the cops if they'd be able to track him if he sent in a floppy disk or something like that and they were like ""No ofcourse not bro just send it in."""
TooAfraidToAsk,feluc1c,t1_felec3x,1579231135.0,"It could be somewhere in between. I'm inclined to believe that it's probably all real except for the parts about people being in the bunker and shooting at him. 


I'm guessing the house stuff and him exploring and finding the bunker is all legit just when he found the bunker he decided to make it more interesting by turning it into some murder cave instead of just an old bunker. It wouldn't have to have been elaborately planned if thats how it happened. That's just my guess though."
gaming,fekzmes,t1_fekxl0x,1579210913.0,For me it's not really about wanting them to look like MCU characters. It's more that they were obviously trying to make them look like the MCU characters but then changed them enough to get around licensing issue. The end result is that they look like Walmart brand Avengers instead a new take on the characters.
sadcringe,fekgjg3,t1_fek0nid,1579199580.0,"The worst part is there's always a bunch of replies like ""You dodged a bullet anways OP she has no sense of humor.""


As if any women who doesn't drop her panties after being bombarded with shitty pick up lines and obscure memes must be a stuck up bitch."
interestingasfuck,fek2b4h,t1_fejo0r0,1579191098.0,You can get DUIs on them but you also don't need a license to drive/ride them.
interestingasfuck,fek26nl,t1_fejlf6d,1579191021.0,The P45 is brilliant AHHHH in every way.
nfl,feiyl19,t1_fegz4p1,1579150854.0,"What a lot of people don't understand about Ivy league is they don't care about how smart you are, they care about how successful you're going to be. That's the only metric that matters. Obviously a lot of people get in because they're smart and smart people are likely to be successful but a lot of people also get in because they're well connected and well connected people are also likely to be successful."
WatchPeopleDieInside,fehm9ev,t1_fegw8np,1579119411.0,How does that work exactly? Is there a producer or someone who manually unlocks the buzzers when Alex stops reading or is it automated somehow?
nfl,fefhmw0,t1_fefe0vf,1579056510.0,"NBA has a soft cap instead of a hard cap. Teams can spend more than the cap they just have to pay a ""luxury tax"" at a high rate for every dollar they go over the salary cap. Warriors had no problem spending a lot of money going well over the salary cap because it allowed them to have dream team which dominated and brought in tons of cash."
nfl,fefevmn,t1_fefbicv,1579054848.0,Damn a year ago I would have been certain that if Luke shifted to coaching it'd be with the Panthers but Ron might be able to pull him away.
politics,fef3f81,t1_fee909m,1579047256.0,The problem with having a guy like Trump is it doesn't have to be overt at all. Anyone who spent any amount of time with him leading up to him calling for the strike probably could have told you he was pissed and going to escalate things with Iran. It's absurdly easy to take advantage of him and the situations he causes.
MurderedByWords,feep4na,t1_feemhy1,1579038278.0,Lol Jesus only about 50 inhabitants and they're mostly the descendents of mutineers who arrived there like 200 years ago? Welcome to incest island.
KidsAreFuckingStupid,fedsv5a,t1_fedq0zb,1579019169.0,Most people here don't care if their house is going to last centuries.
AmItheAsshole,feckav2,t1_feck1bg,1578975990.0,"Lol it literally is but okay I guess this isn't going anywhere at this point. There's no universal definition of what ""cheating"" is. Everyone is going to have their own view on what constitutes cheating and there are gray areas that are important to discuss. Good luck with your future relationships if you don't feel that way though."
AmItheAsshole,fecjufa,t1_fecjrix,1578975665.0,Cheating is whatever people in the relationship decide.
AmItheAsshole,fecjly6,t1_fecj1se,1578975502.0,"That's not how relationships work. Bodily autonomy is not a blank check to do whatever you want free from consequences. My girlfriend is certainly allowed to exercise her bodily autonomy to post videos of herself masturbating. Same way she has the bodily autonomy to masturbate with someone in Skype chat or have sex with whoever she wants. 



I'm also allowed to consider those things cheating and break up with someone for doing them."
AmItheAsshole,fecipli,t1_fecbb78,1578974883.0,I'm not possessive at all but if I found out my girlfriend was posting videos of herself masturbating I'd probably break up with her because that would be cheating in my mind. This is absolutely the type of grey area stuff that should be discussed ahead of time. It's ridiculous to just assume your partner is going to be okay with something like that.
AmItheAsshole,feciiln,t3_eoe91c,1578974745.0,"NTA this is absolutely the kind of thing that needs to be discussed beforehand. If the genders were reversed there would be no where near this many people defending a girl posting videos of herself masturbating without telling her bf. 



This would essentially be cheating in my mind and it's common sense that you'd need to discuss if your partner is okay with that kind of stuff."
CFB,fecg4j3,t3_eofc21,1578973095.0,Fuckin hell I was just dicking around on Reddit and forgot what I was even watching. It's been like a half hour since they stopped playing.
CFB,fecfqj5,t1_fecflw2,1578972833.0,First half took a while but halftime has been going on for like 25 minutes at this point. Mostly just damn commercials too.
CFB,fecfkra,t3_eofc21,1578972726.0,Christ this is a long halftime.
therewasanattempt,febtic1,t1_febks6w,1578962539.0,"Water would just be the standard but they'd be welcome to have a glass of anything else I happen to have at the time. There's no real cultural importance placed on the actual drink offered though, it's more just a polite thing to do in case they're thirsty."
therewasanattempt,febhsfm,t1_febbvfp,1578958924.0,I think so. It doesn't mean that wattage isn't a factor but it probably does indicate that's it's more about Americans just not drinking tea. I don't think stovetop kettles are particularly common here either.
therewasanattempt,feb1p3q,t1_feb00hq,1578954593.0,I was just curious and was very clear it was just about what I personally do. I use a coffee maker for coffee and don't drink tea so that's those. Since you have to boil it all in a pot anyways for pasta and rice (also don't make rice) it still doesn't seem worth having an entire appliance dedicated to getting my pot of pasta to boiling temperature a little bit faster.
therewasanattempt,featujd,t1_feamegp,1578952165.0,I disagree but that's just based on my experience. I tried to find a poll or something about how common they are but couldn't so who knows.
therewasanattempt,feat6g7,t1_fe9ng75,1578951991.0,"Yeah I mean I wouldn't be surprised if the percentage able to correctly point to Iran is in the right ballpark but this is obviously a terrible ""poll"" or a whatever it is."
therewasanattempt,feaflag,t1_feacrqt,1578948121.0,For what? I'm curious. I can't think of anything I do where it'd be particularly helpful to have an appliance dedicated to boiling water.
therewasanattempt,feaepza,t1_fead7hj,1578947799.0,I can't find any figures but there are tons of articles talking about how American's don't have electric kettles and trying to explain why. Saying they aren't a thing is obviously exaggerating but everything I can find indicates they're extremely rare. It's probably far less than homes with an Xbox and that's only a specific brand of game console.
therewasanattempt,feablb4,t1_fea74p0,1578946676.0,You can get them in stores but most people don't have one in their home.
therewasanattempt,feaalwu,t1_fe9wtgt,1578946329.0,Electric kettles are rare in the US. I've heard it's because our standard outlets are a lower voltage so they don't boil as fast but even ignoring that issue we also just don't drink that much tea. A lot of people don't have stove top kettles either.
coolguides,fdyui76,t1_fdyn38p,1578783706.0,"It's got one of those recliner things and says ""perfect for movie night"" so I guess they're marketing it more like a couch or something. Doesn't make Family Bed sound any less weird though."
pics,fdy3xj1,t1_fdx3ar6,1578775839.0,"True but I don't think it's a myth so much as people just using the word sterile incorrectly. Sterile is what medical equipment needs to be. I feel like most people understand that if you dipped a scalpel in piss before surgery it's probably not going to go well. When people say piss is ""sterile"" I feel like they usually just mean that it's relatively safe to drink, which is true."
RocketLeague,fdwyf5b,t3_en5u9a,1578763516.0,Missing an open net goal isn't too bad. Whiffing an easy save is a nightmare though.
gaming,fdskptj,t1_fdqxyf1,1578704415.0,I wonder if they'll ever make a new one. That'd be awesome.
