subreddit,self ID,parent ID,time,text
AskMen,ffpcmg2,t1_ffp50c4,1580091700.0,Don't have kids.
mildlyinteresting,ffn4ptk,t3_eu7mfk,1580062063.0,You just defeated the purpose of all of his hard work by exposing his neat trick. Lol
meme,ffmdtx4,t3_eu5z8h,1580053119.0,I see what you did here.
natureismetal,ffl1m89,t3_etyfjj,1580033112.0,When your mom isn't seeing you eating food.
Wellthatsucks,ffi49up,t3_etnscn,1579964655.0,When final destination becomes too assertive.
RoastMe,ffhn9tm,t3_etkpz5,1579943562.0,That smile when you finally signs a $1000 deal for banging 5 guys at a time.
aww,fffsb6t,t3_et8toe,1579890717.0,Just like an elder sibling who just want to piss you off while disguising it as affection.
LifeProTips,ffeyyvt,t1_ffdwtpv,1579870874.0,are you dead now?
technicallythetruth,ffdxwau,t3_esvn9l,1579831658.0,Then the jaguar squishes you.
AskReddit,ffcfsgu,t1_ffc0ei1,1579798521.0,I just don't want to see this :(
india,ffcejeu,t1_ffbzdfk,1579797755.0,*The enemy of my enemy is my friend*  I think it's simple as that and to save your country you can go to any extent possible and that was a wartime for fuck's sake.
Showerthoughts,ffccuwv,t1_ffc3ued,1579796709.0,I'm living up to my name.
Showerthoughts,ffc20gn,t1_ffbx9qt,1579789541.0,that makes them faceist.
Jokes,ffc1xgm,t1_ffbwa0r,1579789477.0,*Unzips package*
Showerthoughts,ffbu8at,t3_esp5a3,1579782916.0,Does grabbing a piece of your mama counts? Actually it's a big piece of universe. Lol
AskMen,ff8mktx,t1_ff87zj3,1579686013.0,I just wanted to write a long paragraph but my working hours don't permit :(
starterpacks,ff641js,t3_erq5we,1579618596.0,am I going to hell for upvoting this?
ExtremeCarCrashes,ff4vecz,t1_ff3zfw5,1579573361.0,He was just preparing himself as a stunt driver.
holdmyfeedingtube,ff2xnzc,t1_ff2xa0j,1579527911.0,I wasn't saying about this one.
holdmyfeedingtube,ff2wwbo,t1_ff2kh8v,1579527177.0,I thought it was only in my country. anyway I think the people specifically with Toyota fortuner are always high.
DarkJokeCentral,ff2q28q,t3_eraxon,1579518774.0,that's makes them the best volunteer.
rareinsults,ff21f3f,t3_er2khv,1579491212.0,is that how you put an end to feet fetish?
Jokes,ff211zi,t1_ff1ivdw,1579490946.0,"""Hey Gil, now it's my turn to t-bag your wife."""
meme,fez66hg,t3_equ01o,1579454187.0,I did that. Lol
RoastMe,fexdl2d,t3_eqrvd2,1579429219.0,I'm sorry. Which one is the boyfriend?
memes,feppf39,t3_eqb4lx,1579326924.0,"""Laura"" do not have a good meaning in hindi."
Showerthoughts,fepicp5,t3_eq59s6,1579321253.0,Saw this showerthought few months ago.
AskReddit,fenpxe5,t3_eq1wzh,1579289173.0,Someone who will love me for what I am and for whom I can do anything to keep her with me for the rest of my ife.
2meirl4meirl,fenjgyb,t1_fenf8ge,1579286009.0,Starting fights with your loved ones is a bonus too so that no one will be there for you when you're in a mess.
gaming,femqewm,t3_epyi2o,1579266561.0,You've to be considerate while watching porn on cassette. the RF antenna of the neighbours usually picked the broadcast on Channel 3.
Whatcouldgowrong,felyntn,t3_eposh8,1579234320.0,Also the centripetal force that wanna throw you off from a radial motion.
DecreasinglyVerbose,fekdhr9,t3_epii4l,1579197761.0,Sadn't: ended. Be Happy :happened.
Wellthatsucks,fejgki3,t3_epd72r,1579173236.0,Cursed eyesight.
cursedcomments,fejgixu,t1_fej5yot,1579173175.0,Glasses are like an obstruction to the cooling fan of the cpu. throw them off and see a boost in your intelligence.
DarkJokeCentral,fejgd4k,t3_epfk0j,1579172948.0,They both know how to roast the subject perfectly.
Jokes,fej8dwv,t1_fej1mvm,1579161302.0,You're such a burnout.
RoastMe,feifncf,t3_ep93yn,1579137413.0,You have an awesome face with those Walter white wrinkles.
SweatyPalms,feieou6,t3_ep18jb,1579136766.0,Maybe that was a dare by his marriage prospect.
AskReddit,feid1fl,t3_ep7tm4,1579135656.0,It's been a while-Staind.
AskReddit,feh5uyc,t3_eoyn3a,1579109776.0,"Experiencing a full blown snowfall for the first time. I couldn't absorb all of the feelings when I saw it for the first time and felt like laughing, crying and everything else that human can feel at the same time."
DarkJokeCentral,feh4qr2,t3_ep1caj,1579109113.0,Now I know where to aim ma gun.
ExtremeCarCrashes,fefgerd,t1_fef4ogt,1579055777.0,"If you want to be a racer, never look back in your rearview mirrors."
TooAfraidToAsk,fee4elz,t3_eold5r,1579026165.0,Your plane is converted into mass coffin.
Chodi,fe6u866,t3_enzdyg,1578905253.0,I came to reddit just because I hated political chaos of our country but I guess you can't run off from the mess our country have created.
Wellthatsucks,fe6rve3,t1_fe6kla6,1578902458.0,Evidently you're one of those shitty parents.
RoastMe,fe666dy,t3_eno3py,1578882675.0,Thank you. After looking at your post now I can really make my students understand that humans evolved from monkeys.
KidsAreFuckingStupid,fe3rwrd,t3_enn4jj,1578852265.0,that's why pedophiles are attracted to kids.
memes,fduvgnn,t3_en45uy,1578739487.0,It'd be really amazing if we could've witnessed it with our own eyes.
memes,fdsqcpz,t3_emxawj,1578706578.0,Nice job in cropping.
IncreasinglyVerbose,fdspbox,t3_emmx1l,1578706202.0,/r/shittylifeprotips
cursedcomments,fdmvoqy,t3_em5nwo,1578567991.0,/r/technicallythetruth
gonewild,fdkqhxm,t3_eluvsd,1578509040.0,If the goddess had a body.
TooAfraidToAsk,fdkodex,t3_els3mv,1578507773.0,My ex used to climax very early that  sometimes I had to finish myself after it. I once joked that you're a man from inside.
AskReddit,fdkn51b,t1_fdjxmpm,1578507027.0,Well I recently watched a behind the scenes video of Mt. Everest and a woman had commented that she cried a lot due to the scenes in the movie and watching them do it in a green studio made her feel stupid.
AskReddit,fdkmykc,t3_elssvy,1578506916.0,"I used to believe that there's a world inside the TV and people comes and go at their will, and for a long time I really wanted to enter it while some certain scenes were showing but obviously couldn't find the way in."
nextfuckinglevel,fdjnw2n,t3_ellzdd,1578480058.0,the carmaker must be sweating after seeing this video.
AskMen,fdjndx6,t3_ellzke,1578479336.0,Not dick but balls got swollen and hurted for a week after I worked out too much on my first day and it felt like my left testicle went numb. I was 16 and was scared to tell anyone and didn't went to the doctor. I used to feel like maybe I have turned sterile. then years after it I went to the doctor and  got the ultrasound scan and my balls were in great shape. that moment lifted a big weight off my chest.
DecreasinglyVerbose,fdisj9w,t1_fdhb028,1578450075.0,Wank
DecreasinglyVerbose,fdisi20,t3_eld473,1578450054.0,Me N wife divorcing. Help.
Whatcouldgowrong,fdidiaz,t1_fdh6wya,1578440438.0,because they're heavy and expensive.
AskReddit,fdhgf4k,t1_fdh2agh,1578422098.0,Yikes. I thought only I listened those lines.
AskReddit,fdhg4f9,t1_fdgplv2,1578421919.0,My ex used those lines and then broke up with me after a week. I can never believe these lines.
memes,fdh5ytp,t3_elbd67,1578416098.0,"There was a thread where a girl answered that instead of saying that ""thanks for coming"" or ""thanks for letting me serve you"", she said, cthanks for letting me come""."
nextfuckinglevel,fdh597y,t1_fdgp4la,1578415666.0,Well if the road is single lane then it's kept 3.75 metres and for the double lane it's 7.0 metres as far as I remember from my transportation engineering books.
PublicFreakout,fdguzqe,t1_fdgo0ks,1578408995.0,*A man is dead*
nextfuckinglevel,fdgo715,t3_el9dzk,1578403771.0,You can pay a couple of grands for the speed but you're still nothing in front of me.
nextfuckinglevel,fdgo06f,t1_fdgjdak,1578403612.0,As far as I know a 2 lane road should be at least 7 metres wide.
holdmyfeedingtube,fdgmgpw,t3_el32rb,1578402246.0,This hurted to watch.
Whatcouldgowrong,fdgipim,t3_el6aq1,1578398445.0,the cub was running for his life.
AskReddit,fdgc91y,t3_el2az5,1578389724.0,Yennifer.
Wellthatsucks,fdf960r,t1_fdevsv5,1578356220.0,I also thought of the same thing and it actually works.
clevercomebacks,fdef4tf,t3_ekqbvo,1578337667.0,Even the comments are same as the last repost.
Indiangirlsontinder,fdedhtl,t1_fdear1z,1578336643.0,"Bus kar pagle, rulayega kya."
RoastMe,fdditz7,t3_ekq29d,1578314016.0,and you put your dad's pic here instead just for the sake of pure revenge. Well played.
Indiangirlsontinder,fddi7mk,t3_ekqm9z,1578313327.0,"Agnostics can fuck off, Im half atheist from now on."
AskReddit,fdclbwo,t3_eke3wm,1578277750.0,"""I also choose this guy's dead wife."" have only seen the screenshot of Q&A."
FreeKarma4U,fdcl2pl,t1_fdapnxi,1578277570.0,You.
memes,fdc09p0,t3_ekgfz0,1578264629.0,quite accurate for me being 28.
meme,fdbyclo,t3_ekempl,1578263786.0,For a moment I wondered which site is dark alley. Lol
CrazyIdeas,fdbx19c,t1_fd74kwy,1578263236.0,I was searching for this comment. Lol
AskMen,fdagl91,t3_ek9ajq,1578245854.0,"I dunno, I just wonder whatll happen when both guy and girl have the same name because some stupid names are unisex."
FreeKarma4U,fdadwra,t3_ekad6y,1578244998.0,Muff is close to 1k.
gifs,fd9rady,t3_ek9otz,1578237038.0,Lol. The caption made me laugh.
memes,fd92utp,t3_ek9zva,1578227610.0,/r/humansaremetal
aww,fd92ox6,t1_fd91oj7,1578227515.0,Kill them with cuteness.
aww,fd92jzb,t3_ekaod3,1578227442.0,the face of both says it all.
Indiangirlsontinder,fd926hb,t3_eka46p,1578227214.0,TIL Angry: Happy.
Showerthoughts,fd3da4i,t3_ejwrr3,1578157152.0,"There was a scene in ""We're the Millers"" where the Jason and Jennifer Aniston have to lie about how they met and the made up story was very seamless because of their acting skills. if you ask a normal person to tell a made up story in sync, it will never turn out coherent."
Indiangirlsontinder,fd39ozc,t1_fd29rex,1578156086.0,Bhai bndi ki dp fake h to OP is free to do anything at his disposal.
Indiangirlsontinder,fd27saj,t3_ejumt1,1578143031.0,Please don't talk non veg to vaishnav-i.
cursedcomments,fd1la5l,t3_ejpu4m,1578132837.0,Next time I have to design the nuke warhead with wiggle function just as it sees the ass.
RoastMe,fd1gdj9,t3_ejnmok,1578131027.0,is there a competition for which one is more ugly?
Indiangirlsontinder,fd1ev3a,t1_fd12jwr,1578130591.0,Maybe she had a bad experience with gutka khau people.
Indiangirlsontinder,fd19vms,t3_ejtom0,1578128945.0,Didi apni tummy biceps se cover kar rahi h.
AskReddit,fd0scun,t3_ejr5rg,1578123098.0,"The girl I was talking to started to not reply my messages, later that night my brother called and told me that my father is not well and is currently in hospital. then I called my friend who rejected my call and out of pure anger I decided to not go to his wedding next week. I bought my first suit for his wedding."
Indiangirlsontinder,fczq0nv,t3_ejj9s7,1578106584.0,"are bc, 6 packs aur 6"" ka wonderful combination chahiye didi ko."
RoastMe,fcxwfk8,t3_ejh1t7,1578071418.0,Get a hooker man or try working as a pimp.
unpopularopinion,fcxey6m,t3_ejcenk,1578061154.0,and body positive regime for fat people leaves only the ugly people by face on the spectrum.
quityourbullshit,fcx2uuy,t3_eja9jb,1578048786.0,is there a benefit of karma whoring? I have a lot of karma without any use.
DecreasinglyVerbose,fcuybny,t3_eiy7e1,1577990959.0,Ball hurt bad.
