subreddit,self ID,parent ID,time,textpolitics,fezr58k,t1_fezf0hb,1579460603.0,"Oh boy... What hippie communist commune do you live in in Connecticut where you don't see these things?  The Molon Abe thing, the ""Don't tread on me"" stickers, the ""III"" stickers, the Punisher stickers are all must haves for any right-wing white conservative driving a pickup truck in South Carolina.  I'm surprised they even sell pickups without those things.


(Also I learned that Connecticut is spelled ""Connect-icut"", and not Connetti-cut or whatever bastardization the spellchecker was screeching about)"
politics,fezqjt6,t1_fezkx3c,1579460390.0,"Wow.  More telling is that there are people writing things like ""Is this edited, if not..."" in the sense that the judgement of him having a neurological condition is correct assuming the video is truthful."
politics,fezpmkp,t1_fezccze,1579460079.0,Sudafed is an upper?
todayilearned,fezpc7q,t1_fezmhq2,1579459976.0,"But did HR send the correct forms or kick off the correct process to start the decommissioning process?  I've been at plenty of companies where they term someone, but IT doesn't find out about it till weeks later."
politics,fezp125,t1_fezmfo0,1579459868.0,">...The people of the US don’t want war with Iran. 

The fact that we elect Republicans and kill Iranian generals show otherwise."
politics,fezouw8,t1_fey6ryv,1579459806.0,"Syria was also a country that had a nuclear program that was stifled by the West, only to be later attacked by the West.  Meanwhile, Pakistan is running an Osama Bin Laden Bed-and-Breakfast with few repercussions.  What the US and the West is teaching the world is that sovereignty and security can't be brought about through treaties and bullshit, but only by becoming a nuclear state."
worldnews,feyq7bt,t1_feyhy6a,1579449203.0,"Yeah, I didn't see the usual narrative direction when it's an enemy or victim of the West that is harmed.  My suspicions were confirmed further down the page."
politics,fev3wj2,t3_eqot90,1579392836.0,I’m glad someone noticed the Orwellian themes by having a country’s National Archives blur stuff.  Amazing how all you have to do is say “we wanted to avoid controversy “.
AskReddit,feo86h1,t1_fen188m,1579296384.0,"Military strictness is legendary, we all know the guy that was ""oh yeah, john, his dad is an ex-Marine, doesn't allow him outside of the house after 4PM unless he can bounce a quarter off of his bed""."
politics,fenooon,t1_fenjrwf,1579288682.0,"But I'm not wrong, you have done nothing to counter my position that Kanye has lost face in the eyes of black America.  All you've said is ""but sales!"". And your points don't follow into one another as we dominate the production of hip-hop ,we don't dominate the purchases of hip-hop."
politics,fenismw,t1_fenhzwo,1579285597.0,"The dominant choice for a group doesn't mean that any given artist fanbase is composed of that group.  You are really running into the weeds and getting snakebitten in your ""datasets"".  It's kind of strange that you pick a battle about Kanye not having lost face in the eyes of the black community as your hill to die on."
