subreddit,self ID,parent ID,time,textBoxing,feztts3,t1_fexvm87,1579461577.0,"Maybe he does that in MMA, but in this specific clip at 0:20 that was a retreating jab, not a range-masking jab. His left foot is moving backward at the time his right jab is out. This presents a jab range that's ahead of his center of balance that's moving backward. 

A range-masking jab would be the opposite, throwing a jab from behind your center of balance to give the illusion you're farther away than you are, so that you can quickly snap forward to your center of balance that's closer to your opponent, allowing you to surprise them with a straight."
DaystromInstitute,fezrn3l,t3_eqxsz7,1579460769.0,"My headcanon is that there are many time branches...but they are in a state of constant flux and splintering. 

However, some of these branches manage to develop their own version of time police and achieve stable equilibrium. These self-stabilizing branches form the basis of the Prime timeline and the Kelvin timeline. These time police exist to ensure their own timeline stays stable. They're not concerned with policing all timelines or other stable branches."
GifRecipes,fezqn6k,t1_fezltgk,1579460423.0,Thanks! I will have to give roasting a try!
GifRecipes,fez8bi5,t1_feyfxnj,1579454746.0,"Newbie here: The idea behind slowcooking pork is to melt down fat and connective tissue at like 200ish degrees, and the low temp helps prevent toughening the meat during such a long cook. Here with a roast approach it seems it would certainly reach the same target internal temperature, but spend less time at that target. Something like 5 hours roasted vs the 8-10 of a slow cook approach.

Is there a noticeable difference in practice? I don't have experience in either so I can't make a comparison yet. (Also, how does roast and slowcooking compare to pressure cooked results?)"
politics,fez676i,t1_fez086p,1579454195.0,"It is set up for younger generations to pay the older generations because it's funding has been robbed over the years to cover the US govt deficit. Each person's contributions aren't paying for their retirement, but instead relying on a future generation to do it for them. It is behind on saving to pay people out and should instead be ahead on saving to pay people out so that the accumulated capital can itself compound and use that growth to offset the additional contribution needs from the public.

Insurance funds are set up to cover emergencies too. They are not set up to only be able to pay for current claims based on future receipts. They plan ahead and grow the dollars taken in to be able to cover those future outlays and risk pooling diversifies the acute risk to individuals."
videos,fez2oum,t1_feyzf8w,1579453303.0,"That's the point, in breaking away from the US they'd issue their own local currency to replace it, and the value of that currency would not be pegged to the  very strong US dollar, but instead to very weak local economy, making it cheap to invest in that economy."
videos,feyy7nz,t1_feyrxdv,1579451919.0,"I can guess one hypothesis is that by decoupling from the US, they can allow their local currency to fluctuate. 

The value of the US dollar is the most stable in the world for reasons we don't need to get into. However this means buying things from Puerto Rico stays fixed at the value of the US dollar. If you're a poor country you want the value of your currency to drop, so that buying from you becomes relatively cheaper for the rest of the world, so they'll buy from you and boost your economic output and increase jobs locally.

This is part of why people are pissed at China for artificially keeping their currency cheap. It makes their prices lower vs the dollar causing trade imbalance that favors China. This is part of why people were wary of joining Euro because it stops poorer countries from allowing their currency to devalue.

Linking currencies works well when the economy of the constituents are roughly equal. It allows for business exchange without threat of currency volatility. It does not work as well when there is a large disparity in economic health between members, where some members do need that currency volatility to get them out of a hole."
politics,feysvrz,t1_feyl7vv,1579450205.0,"It is very much a democratic ideal. Democrats aren't pushing for inefficiency, which is what we're talking about. This is Obama's essay on the role of Capitalism in the Economist
 https://abcnews.go.com/Business/obama-defends-capitalism-international-free-trade-economist-essay/story?id=42614080

To sum up, it is a tool for efficient allocation that requires regulation to aim it's efforts at desirable outcomes rather than an uncontrolled spiral into undesirable outcomes. This is absolutely a Democratic view and is one shared by every candidate, including Sanders and Warren, neither of whom have proposed that we get rid of capitalism. There is a huge gulf between the idea of free market capitalism and centrally planned economies.

The OP suggesting SS to be reformed to gain a better return is simply that. Aiming to achieve a public retirement program that achieves the same or better returns on retirement savings. Practically speaking, who is privately saving for retirement the same way that SS saves for retirement, with an aim of near-zero returns on decades of investment? Nobody does that because it's ridiculously inefficient.

What people normally do is invest in growth while young and shift mix to low risk investments as they age, so by the time they might need to retire, they are in low risk positions while having gained a ton of compound growth over their working growth. SS does not do this. There are ways to reform it to allow it to reap compound growth gains while also insulating against risk to retirees. Right now it is simply badly designed, and nobody is defending it's current design."
Games,feyj6uc,t3_eqw3j5,1579446173.0,"Life is Strange is a good one. Good luck even trying to realize where the good or evil choices are! 

I took the evil choice, 100%, felt terrible. I'd do it again."
interestingasfuck,ferru1g,t1_ferkhaf,1579357630.0,"The reason why is discussed in the video. Climbers have less muscle mass, but build tendon strength instead. Tendons grow very slowly compared to muscle and accumulating that strength takes time.

https://www.thebioneer.com/tendon-training-for-injury-prevention-and-explosive-power/"
Android,fdz0pr2,t1_fdsypr8,1578785479.0,"Verizon plans to do both. The slower broad coverage approach, plus the high speed targeted coverage. This far only the high speed targeted coverage has been turned on, but Verizon is activating Dynamic Spectrum Sharing to activate 5G broadly in 2020. Verizon already has as much or more low-mid band spectrum as TMO in addition to the mmwave they've been rolling out."
explainlikeimfive,fdx711p,t1_fdwg2hf,1578765955.0,"Holy shit, this is not copypasta. This actually happened."
DnDGreentext,fdtvhxq,t1_fdtp0m3,1578722872.0,"The former, judicious use of treason is central to the game as everything is treasonous. But personally, I would never commit treason against Friend Computer."
dataisbeautiful,fdimwyg,t1_fdi0gy3,1578446479.0,"It's not really gross, it is a little sad perhaps that he can't find long-term companionship, but at least it doesn't seem like he's cheating and having messy divorces and upsetting kids.

Or maybe he knows himself and the challenges of having relationships as a celebrity, and decided this route is the easiest way to avoid the worst minefield of celebrity dating."
absolutelynotme_irl,fd2v8l2,t1_fd11qcg,1578151933.0,"When I was young I had tried to join up with some of my friends, talk went on for awhile and ended up getting rejected because I had just gotten diagnosed with athsma. They were still really choosy at that point shortly after 9/11. Heard later on they relaxed standards a lot to get warm bodies after the never-ending war kept dragging on and it was harder to get people to sign up. Maybe they would have taken me if I'd waited a few months."
