subreddit,self ID,parent ID,time,text
AskReddit,fgn0c9b,t1_fgmynmn,1580935287.0,"Automatically scheduled contributions into S&P 500 indexed mutual funds or similarly hands-off no-brainer investments. 

Look at VFINX. This is what Warren Buffet recommends for beginner investors because it is set-it-and-forget it, dead easy investing. Definitely ways to optimize, especially based on your age, but for the vast majority, this is almost all you'll need to do."
AskReddit,fgmzrwn,t3_ezfbgo,1580935009.0,"A few little tips:
1) Chunk big tasks into little ones


2) Accept that hard things are hard and you'll go ahead and do it without concern for the outcome because starting is better than nothing.


3) Judge yourself from the future-tense. I don't want to work on this report...but future me is going to be really pissed at me for putting it off. Do it for future you. When have I ever slacked off, looked back, and be really glad I chose to slack off? I always regret it. So just take a moment to recognize the choice you are really making."
AskReddit,fgmw7w9,t3_ezauxv,1580933210.0,Don't fight on concrete. Even winning the fight over concrete could be the worst mistake of your life.
amateur_boxing,fgj2r57,t3_eyrn80,1580835877.0,"I forget what it's called, but I like the weighted ball throw up at a wall, kinda like shotputting. Gives some resistance, but in a way that kinda lines up with how you generate power off the ground and up through your hands. The power curve of overcoming inertia makes a bit more sense than punching with machine or elastic cables which are continuous resistance all the way through, when in reality you should be accelerating."
anime_irl,fgis740,t1_fghcx51,1580829735.0,"It's because anime is often discovered as a sub-culture that is broadly accepting. For those who have difficulty socializing and fitting in, this sub-culture gives them an opportunity to feel normal given the wide span of what constitutes normalcy within it's fandom. Due to relative isolation, of course they'd want to latch on tightly. This subculture quickly becomes a part of how they self-identity, and their personality becomes defined by this passive entertainment and that is what this meme is about.

It's not all that different than say, weed subculture, where some people form an identity based on a thing they consume. It's totally ok to like the things you like. It's just inadvisable to *define yourself* through these things, only because doing so slows you from learning who you really are through action. Say, don't just be ""fan of shounen anime"". Maybe fitness-enthusiast inspired by shounen anime heroes, always reaching for new heights of personal achievement, just like the characters he/she watches when they go home."
NetflixBestOf,fgiqzx8,t1_fgiofa5,1580828950.0,David is adorable
vegangifrecipes,fght69o,t3_ey68cq,1580793141.0,"This looks amazing, I’ve gotta try this."
GifRecipes,fggz3q3,t1_fggtn3r,1580772836.0,"Ooo, those sound promising, thanks! I'll give those a try!"
GifRecipes,fggslgw,t3_ey8ac4,1580768631.0,"Anybody know of a non-dairy means of making a soup feel creamy?

Daughter's got dairy and nut allergies which is severely limiting in the kinds of foods I can cook for the family. Can usually substitute in soymilk or margarine for baking needs, but I don't know what non-dairy ways I can get things to be creamy."
DaystromInstitute,fgg6tuw,t1_ffd9gm5,1580755503.0,"I think the key take away of the Star Trek franchise's vision of the future evolving over time is not that Utopia is impossible, but more that the Utopian ideal will take hard work. The implication there being is still that it is indeed *possible*, which is very much an optimistic one and arguably a more useful form of optimism than assuming it will be achieved and staying blissfully ignorant of all the present day challenges that make the goal seem so far away."
Boxing,fgfx1yv,t3_exyt3k,1580749477.0,"He's not really a great fit at Welterweight, but I really like Mikey Garcia's style. Almost pure textbook, and a great demonstration of how very simple boxing principles, when practiced and applied, can be taken all the way up to an elite level. Boxing is less about special tricks and secret knowledge and more about an ocean of hardwork poured into relatively few moves."
Boxing,fgfwfhv,t1_fgfqyfi,1580749092.0,"Culture. 

Of course there are Mexican boxers with glass chins. But how do you think they fare when training in a Mexican boxing gym where they prize grit and toughness in their stable? The chins get exposed in hard spars, they get discouraged by shame, get less support from trainers and fellow boxers, and are less likely to turn pro and even if they do, they will have a tougher time gaining a following.

On the other hand, the ones with a chin get valued higher in a culture that values chin, and get lots of support to rise to the top."
Boxing,fgfvxzk,t1_fgfex6s,1580748790.0,"All except the 4th one seems cultural. For Nigerians, I'd say, ""why are Nigerians so good at getting Master's degrees"" and the answer seems to again to be cultural.

And with all cultural roots there's socioeconomic drivers mixed in too."
GifRecipes,fgeefoq,t3_exrjl1,1580697663.0,How long would I boil the beef?
Boxing,fgedjkx,t1_fgdrbcu,1580697085.0,"I don't think this is a reaction speed drill, this is form and distance management. He is attempting to move his head exactly 1 head length away from it's previous position. Anything less and he gets grazed/clipped. Anything more, and he reduces the time it takes to return to center to respond to the opening or the next punch. The thing to note is how close his nose is to the bag. Efficient AF. 

The bag is swinging predictably, it's not a matter of reaction, but of timing."
AbruptChaos,fgdb6rk,t1_fgcrcbk,1580680614.0,"Everytime I see rollerblading, I think of the Aziz Ansari skit."
science,fgd9tkn,t1_fgavh2a,1580680245.0,"I think it depends most on whether or not your audiobook is engaging you.

If you're focused on what you're listening to, your mind is taken off the exertion and you unconsciously relax and your body looks for the energy minimizing approach to supporting your intended action. If you aren't focused on the audio book then you stay hyoeraware of what you're doing, and that is good for drilling specific form, improving mind-muscle connection, but is also a little more mentally taxing and your heart rate can go up as a result.

I often run with a chest strap heart rate monitor while playing videogames, and on a fixed pace on the treadmill I can see my heart rate go up when I'm bored, and go down when I'm entertained. In a fire-fight? 150bpm. Hit a loading screen? 160bpm. The connection is pretty noticable. That being said, maybe if the game goes beyond engaging to actually exciting I imagine my heart rate could go up rather than down, but I'm usually not playing anything that intense."
Boxing,fgcglzt,t3_exm1qc,1580672517.0,"Nah, I found this hard to enjoy. There's no entertainment if they aren't actually boxing. The kid got rocked too hard in the first. His gloves barely rose above shoulder level for half the round. He's punching back, so it's hard for ref to justify stopping the fight on that basis, but the kid's corner, his FAMILY should have thrown the towel. 

They were too compromised to recognize the kid had stopped defending himself and was just taking way too much damage taking bombs with his hands down and no head movement."
IAmA,fgbp2x8,t1_fg9wzvo,1580664609.0,">Asian women say don't date Asian men because remind of my family member like brother. I can show you a video about this.

Are you suggesting that white women prefer to date black men as a result of having white brothers? Or that black women are ok with dating black men because black women tend to have non-black brothers? 

Both of these are kinda nonsensical right? That's how insane the logic of the original statement is, because women of all colors tend to have brothers of the same, or similar color, as their brother, as a result of sharing between 50-100% of the same racial origin."
IAmA,fgbnyaf,t1_fg8pu7x,1580664212.0,"This a scientifically unsupported position. All research points to significant and obvious racial preferences. Playing field is not level (when is it ever?), Everyone has to deal with it by either giving up, denying it, or doing something about it."
PublicFreakout,fgawlss,t1_fg8ja2l,1580656200.0,What did Sway say to him?
worldnews,fg80ivu,t1_fg7q8jo,1580606273.0,"This guy understands. The Democrat strategy here was never to rely upon ""the GOP doing the the right thing when it matters most"". That would be an insane foundation for a strategy.

The practical reality is that positive change must necessarily be forced through the ballot, and the impeachment is just a part of the journey to victory in November.

Plenty of criticism came from the left for Nancy Pelosi stalling on impeachment. In truth, she had always intended to impeach, but with awareness that timing matters, the timing of impeachment actually mattering more than the result (which is already known beforehand)."
worldnews,fg6r74n,t1_fg6f6fi,1580575008.0,"Form the article it seems the trend of high education among Nigerians is beyond anecdotal. I'd wondered about that too, because obviously the ability to successfully immigrate to the USA is definitely a filtering factor, from my own anecdotal experience I don't think I've ever even met a Nigerian without a graduate degree education. We just seem to be getting their best and brightest..."
Showerthoughts,fg6h2rn,t1_fg6d8or,1580567777.0,"Fully agree that fat won't stop blades and piercing blows.

However ""fat"" for these guys is probably more on the line of NFL linebacker. The diets probably aren't nearly as rich, and with almost everybody walking everywhere they go, most of them were probably pretty lean. Adding on top needing to do lots of daily training to ensure they don't die, I wonder if the ""fat"" gladiator is probably more around the 15-18% BF range, where the six-pack isn't visible anymore, but the added calories facilitate more frequent, higher intensity training. Kinda like boxers leaving cruiserweight to go into the unlimited heavyweight class will keep a bit more fat instead of staying super lean to carry more strength into the ring, since they're no longer having to balance fat against muscle under a weight limit. Or, like what some weightlifters call ""bear mode"" bulking, where they allow more calories and a fatter physique to add muscle and raw power at the expense of aesthetics."
fightporn,fg5gif3,t1_fg5g701,1580526846.0,It's also probable that the experienced guy is giving the newbie a firsthand look at what higher level skill looks like. It's hugely beneficial and motivating to witness that next level from your gym's best guys.
Boxing,fg5f3m4,t3_ewv6ra,1580525774.0,"Tendon strength is something often overlooked. If I push you with a steel rod, you're going to take all of the force and stumble back. If I push you with the same amount of steel, but in the form of a chain, you won't stumble back. So much force is lost in each hinge that the chain probably won't even reach you.

Thick strong tendons aren't that easy to notice, taking fingers for example, even decades of training only make about a 50% difference in thickness, but holy fuck, a professional climber has grip strength that can embarass power lifters hundreds of pounds bigger than they are.

To the point, perhaps tendon strength is part of that ""born with it"" mythos around punching power, because it's a factor that isn't as noticeable as the clearly visible factors of speed, technique, timing, or muscle size.

Old school training does account to this to some degree via wrist curls to strengthen forearms. Often done as a protective measure to prevent injury from glancing hooks, but that added rigidity to the kinetic chain may be key to increasing transferred kinetic energy at the point of impact."
fightporn,fg2q94w,t3_ewgw8y,1580451666.0,"The guy is very well practiced, but it definitely looks a lot better than it actually is, it’s much easier to look good defensively in this kind of scenario.

They’re doing defensive drilling/light sparring with a training focus. The goal here is to give the guy in black opportunity to practice, not to get in his way."
educationalgifs,ffyhwhj,t1_ffygltc,1580346819.0,"Thanks! Yes, I do have a rubber inner tip in mine, I'll give that a shot! 

....*Ba-dmp-tsh*"
BlackPeopleTwitter,ffygeok,t1_ffyfhy6,1580345801.0,"Sure, here's the first race. There's a race or training sequence in pretty much every episode.

https://youtu.be/X7FTORAvtW0

Gets you freaking pumped to sprint with them. Pretty solid sports anime, pretty funny at times, no ecchi to worry about."
anime_irl,ffyf0fa,t1_ffxij23,1580344849.0,"Science says:

Treadmill results in higher reported exhaustion when pace matched against running. It also results in slightly fewer calories burned. So it is both less effective for calorie burn, and more uncomfortable to boot.

That being said, charting the calorie expenditure against each other, you just need to add a 0.5degree incline to your treadmill running to match the calorie burn of running outside."
educationalgifs,ffya9e3,t1_ffy4sj1,1580341656.0,"Thanks! Delonghi ECP3420. Very cheap, and yes it uses a ""panarello"" as you guessed (had to Google what it was). It sounds like maybe this cheap panarello may make it difficult to get the silky kind of foam I'd like to get to. Taking it off leaves only a very small stub which I won't be able to use to reach the milk :("
internetparents,ffy1bqg,t3_evpbfl,1580336601.0,"It's not weird. I did it when I was your age, and my teachers were overjoyed to reconnect. I encourage you to do it and show them your gratitude, and in return being a gracious person generally improves your overall satisfaction with life."
educationalgifs,ffy0lbg,t1_ffxuwa7,1580336160.0,"How does one make the microfoam? Is my expresso machine's cheap steam wand a limiting factor? It foams fine, but I don't know how to get the bubbles small enough."
BlackPeopleTwitter,ffxzm7h,t1_ffxn3cv,1580335578.0,"Uma Musume: Pretty Derby is a pretty good one to watch on the treadmill. When the races start, sync your speed to the race pace. Main challenge is that anime stretches the hype moments so their final leg sprints are looooooong, but  when they celebrate victory, you celebrate right along with'em.

I've transitioned to video games though, using a wireless controller and just avoiding competitive multiplayer there's a ton of games you can play while running."
amateur_boxing,ffxpq5a,t3_evmxzz,1580329982.0,"Lifting for performance? Plenty do that. Lift for hypertrophy? Not really, you're working within a weight limit, so a lot of your improvement margin won't come from growing additional muscle, but improving your skill and efficiency in applying existing muscle in specific ways. Lifting is a helpful tool in working towards that goal, but can't be a focus."
UpliftingNews,ffv8kzv,t1_ffv2hi7,1580258256.0,"I don't recommend Orville as a space comedy.

I recommend it because it's good sci fi. The comedy is gradually dialed back as the show finds it's ground and it's really a Star Trek TNG spiritual successor."
dataisbeautiful,fftngab,t1_fftl8cl,1580224960.0,"The virus is on a different playing field now.

You might be an elite player out of all the highschool basketball teams. Then you get recruited to the NBA. 

Since you were an elite player in all your previous basketball games, should you assume your future performance in the NBA will also be amongst the elite players? No, because the conditions have changed to such a degree that you should limit or completely discard non-comparable data history."
technology,ffsdl8l,t1_ffsagm2,1580179148.0,"5G isn't just mmwave. Bad analogy, it's kind of like a compression technique, like getting a .wav of a song vs. an .mp3 of the same song.

Midband spectrum currently used for 4G  LTE has medium coverage and medium bandwidth. Mmwave spectrum currently offered in select areas has super short range coverage and ultrahigh bandwidth.

HOWEVER, the 5G standard can be used on BOTH the midband and mmwave spectrums. Right now TMobile is only doing the midband, while Verizon is only doing the mmwave. Eventually, both companies will be offering 5G on both spectrums. 

What does this mean? Modest speed gains in places you normally get LTE signal, due to DSS (Dynamic spectrum sharing) where both 4G and 5G signals will come out of the same cell tower, speed on 5G will be marginally better due to the improvement in spectral efficiency, and go up over time as they shift the ratio of spectrum, Potentially up to 1gigabit speed. A few people in Urban areas may get pockets of ultrafast 5g...like 30 gigabit speeds. No real benefit there most of the time, the real practical value of mmwave is in fixed home wireless, where they replace your cable or fiber to the home connection with mmwave antennae through your window. Basically making it easier for them to sell home internet in places they couldn't afford to compete in.

Over time, LTE service goes away as 5G chipsets become the norm, and only 5G service will be coming out of those towers. It will take a long time, perhaps a decade. 3G service is only just now retiring in the next 2 years."
trashy,ffs31ey,t1_ffrif86,1580171901.0,Jeff Nippard is a good one too.
MadeMeSmile,ffnh0ya,t1_ffkx9hp,1580065860.0,"Yeah, Jeff Cavaliere recommends fixing diet with ""Quality, then Quantity, then consistency"".

Fix the kinds of foods you're eating and adjusting quantity becomes easier, and getting the first 2 right helps enable the consistency that leads to body transformation."
GifRecipes,ffiddmy,t1_ffia547,1579971197.0,">There is a misconception about what constitutes a safe cooking temperature for meat.

**The upshot is: Food safety is a function of both temperature and time.**

Chart/graph of kill time vs. Temp in the source link:

https://www.seriouseats.com/2015/07/the-food-lab-complete-guide-to-sous-vide-chicken-breast.html

>As you can see, at 165°F, you achieve pasteurization nearly instantly. It's the bacterial equivalent of shoving a stick of dynamite into an anthill.
At 136°F (58°C), on the other hand, it takes a little over an hour for the bacteria to slowly wither to death in the heat. In fact, you can even pasteurize chicken as low as just above 130°F (54°C), but I don't recommend it. Partly because there's a risk that your sous vide device is mis-calibrated by a degree or two, but, more importantly, because chicken cooked to 130°F has a very soft, almost raw texture that is simply not appealing."
GifRecipes,ffhdzw4,t3_ethdmu,1579931401.0,"Chicken breasts gotta come out at around 140F, max maybe 145F because the temp keeps rising a bit after. therwise they become tough and mealy, the marinade helps, but not over cooking is better. Foil-wrapping them at that target temp helps ensure it stays there long enough to kill bacteria.

Chicken breasts have a bad rep from being so commonly overcooked. They’re just as tender as chicken thighs as long as they never cross past 150F."
amateur_boxing,ffgnqwj,t1_ffglhnf,1579910533.0,"Yeah highly recommend against using willpower. It's cool if you've got it, but everybody has their weak moments, and it's just fucking exhausting to rely on it. Habit and routine though? Takes no effort to sustain because it's just the norm.

Snacking for me is more effective when I make myself eat even if I'm not hungry. Not allowing myself to become hungry means I don't get tempted to eat things I'm not supposed to. I prep tomorrow's snacks the might before and eat it as scheduled rather than when I'm hungry.

Another good one is baking chicken breast to 140F and then taking it out and wrapping in foil. Not cooking above that temp keeps it juicy, tender, and delicious instead of that mealy bullshit that earned chicken breast such a bad reputation (i.e when cooked past 150F). You slice it up after it rests, throw it in the fridge and you can snack on it whenever because it's lean clean protein with relatively low calories and is super filling."
amateur_boxing,ffgdatl,t3_et1bmt,1579903691.0,"I want my snacks to STOP the hunger rather than eating with no benefit. So that usually ends up being apples, bananas, or protein, because I need the fiber and protein, and these are high satiety foods. If you can sit down for a sec, instant oatmeal is satisfying too."
amateur_boxing,ffffu15,t3_et67bo,1579883039.0,"Genetics are a cap, but training gets you there.

You train the mind to predict, recognize, and react. You train the body to move in concert and do it subconsciously. You don't expect to pick up a guitar for the first time and ad lib a guitar solo, why should you expect to slip and counter punches without lots of practice? Guitar soloists aren't thinking about putting their ring finger on the 5th fret on the 4th string next...they are just riffing and their fingers are trained to translate intent into specific action. It looks like they're thinking at superspeed with those crazyfast guitar licks, but really they are just vibing with the music and their body does what it already knows.

Train until your body does the boxing for you, freeing your mind to focus on higher level things, and even thinking ahead. That is what gives the appearance of faster reflexes."
inthesoulstone,ffdh66z,t1_ffd178t,1579820773.0,"They should put Jon Favreau in the tights. ""Don't worry Peter, we'll fix it in post""."
amateur_boxing,ff8wci8,t3_es41u3,1579698260.0,"Hold on. You know it's per lb of LEAN bodyweight right? You have to back out your fat from your weight.

Also, 1g per 1lb is too high. It's 0.5g-0.8g per 1lb of lean body mass. It's really not that hard to reach this level.

https://mennohenselmans.com/the-myth-of-1glb-optimal-protein-intake-for-bodybuilders/"
nottheonion,ff30vyr,t1_ff2wec7,1579530697.0,"Maybe you've already tried, but make sure you've sexified your resume as much as possible. For whatever reason, I find a lot of people fail to maximize their resume appeal. 

If you do get interviews, at that point your credentials have already been deemed competitive so it's mostly about interview skill and affability rather than actual professional skill. If this is where you're getting stuck that's great, because unlike experience which you can't acquire much faster, your interview skills are definitely something that can improve quickly with practice. Most people don't practice and it's crazy that they don't. 

Most people spend 8h a day going to do their regular work duties for no real increase in pay...for years. In comparison spending an hour practicing each day for like 2-4 weeks can snag yourself a 20% bump in total pay...training interview skills has a HUGE return on investment compared to a lot of other ways you can spend your time. One way to practice is to just apply for a wider range of jobs, including jobs you don't want, or jobs you don't think you could get. This means more interviews to practice towards, and more actual interviews to sit in and get used to the stress. It's better to fail in unimportant interviews and learn how to relax, so that when you do get interviews that are important to you, you're already well-practiced and relaxed, and have a good interview ""routine"" in place."
Fitness,ff0r9xg,t3_eqpf53,1579471559.0,"Diet soda is definitely better than regular soda. However studies showed that people switching from regular to diet don't really end up losing much weight. The specific reason isn't nailed down and there are tons of possible explanations (like people compensating with more food, or diet sodas still resulting in appetite change resulting in that extra compensatory eating).

Bottom line is, it's better, but seltzer or water is best.

Seriously give seltzer a try, it tastes pretty good. All the fizz and none of the guilt."
Fitness,ff0axln,t1_fex0cvd,1579467008.0,"One way to improve thinking on this is to stop thinking of work as ""Cardio"" because it's a blanket term for 3(4) different energy generation systems. Exercise at different intensity will prioritize different energy systems, but in ANY exercise, all 3 systems are in use to some degree. Point being, since exercise will eventually hit a point of diminishing returns you want to make sure you're hitting all 3 systems so you're reaping all the low-hanging fruit, while also prioritizing the system that will be used the most in your sport of choice.

In real terms. You need energy for short bursts of 10 second max efforts, and up to a minute or so. You need anaerobic energy from sugars for moderate duration high intensity. You need aerobic energy from fats for long duration efforts and to keep you going overall for base energy reqs. 

There's a ton of different ways to use a heavy bag, but people tend to use heavy bags in multiple rounds, rarely for max effort sprints and rarely for long duration hour-at-a-time-nonstop stretches. So boxers should be sprinting and doing HIIT training, and also be doing long LISS runs. You do it all, and you reap all the low-hanging fruit."
