worldnews,fnvcmnt,t3_g3w5rd,1587288250.0,This could have easily been the USS Teddy.
facepalm,fnvblsv,t1_fnuwpd4,1587287164.0,"But if they're educated who would elect Republicans?

Yes, that's a serious talking point for the GOP."
britishproblems,fnvb0sr,t1_fnv97w3,1587286551.0,Haha cuz it's actually to make them feel better.
britishproblems,fnvaz08,t1_fnv67h4,1587286499.0,"Yes, what better way to show appreciation than mobbing a hospital parking lot to simultaneously honk at all the workers while they're trying to help sick & dying people inside."
Wellthatsucks,fnv6ccn,t3_g3pdn5,1587281765.0,This can be steam cleaned out right?
politics,fnv69z0,t1_fnthn3p,1587281700.0,Reminds me of Puerto Rico.
