punk,fr2bjl8,t1_fr0v836,1589834460.0,"I was just thinking that, I will never be as punk as this cat"
FindLingerie,fqrlbiw,t3_gkfwuu,1589586669.0,Doesn't wicked weasel have stuff like this? Try there
streetmoe,fqrkbcc,t3_gkbkrj,1589586081.0,This is so sick.
punk,fqqquy9,t1_fqpo8qd,1589570318.0,"I read that Les got tied of hearing people yell Primus sucks. But I still yell it every time they come through, it's tradition! You can't mess with tradition Les."
LeviCult,fqi3qvf,t3_giyeai,1589389507.0,"""Obey my order,"" or ""follow my command,"" doesn't sound off to me. We all know the context, he's a captain in the military and she's a subordinate, they do actually talk like that lol. Not sure why they needed to tweak it to trust."
AnimalCrossing,fqhd369,t1_fqh3os4,1589374362.0,I've tried this with Diana. I gave her the moldy dress and I complained about her clothes to Isabelle but she still wears it sometimes.
AnimalCrossing,fqbhrkd,t1_fqaixkz,1589237219.0,I know! I'll try to snap cute pics but it seems like they know when I open the camera app and they're all camera shy.
boyslove,fqbc567,t3_ghu45a,1589234289.0,"I finished it a few days ago and after watching some videos on it I think I'm in the minority of feelings towards the characters. The whole time I wanted Bum to get out. I never once felt like they could work things out or Sangwoo could change. I saw a lot of people hoping that Sangwoo would have a change of heart or something and stop being a killer and live happily with Bum but that is honestly never in the fucking cards lmao. I guess it just hit a little too close to home with me because I've been in abusive relationships (not nearly as seriously abusive as Sangwoo) and they don't change. Abusers rarely ever change especially in a relationship that they've been in for some time. It's kinda like training a pet, if you let them get away with the abuse there really isn't any reason for them to stop.

I do have sympathy for Sangwoo because he did grow up in an abusive family but so did Bum and he's not a serial killer. It's an interesting look at how people develop when they come from abusive upbringings, how polar opposite they can be. They both need therapy and psychiatric care. But I was 100% rooting for Bum to run and be happy with someone who doesn't abuse him because he deserves that so much.

I want to add too that I'm very disappointed in the way Sungbae handled Bum. It's like he's never heard of Stockholm syndrome. And it also seemed like it never occurred to him that the abuser would force the hostage to commit crimes so as to keep them quiet to police. That's pretty standard abuser tactics and this experienced detective from the big city didn't think about that?"
houseplants,fqb3nkg,t3_ghlufy,1589230015.0,"I've wanted one of these for so long. One day, I am promising myself."
BokuNoMetaAcademia,fq60zqb,t1_fq5xkg1,1589122201.0,Oh shit I used to do that when I was younger with my legs. Didn't know it had a name.
schizoaffective,fq5zeas,t3_ggwyi4,1589121203.0,Used to smoke cigarettes but I vape now. I definitely increases my nicotine intake when I switched to vaping because now I don't have to leave the room.
AnimalsBeingJerks,fq3xpha,t1_fq136wr,1589071487.0,One of our kitties became immune to the spray bottle so we use compressed air instead.
BlackPeopleTwitter,fq1jqk4,t1_fq0q0wk,1589046270.0,"Dunno if I can comment on this because country club. But a few years ago I posted some stuff online about police brutality and how police are targeting people of color. A woman of color commented on it telling me ""we don't need you, wonder bread bitch."" 😂 I just thought it was funny. Solidarity is always a good thing in my opinion but there will always be name calling for speaking up for a group you don't belong to. See: simp, white knight, sjw 🙄"
memes,fpxakws,t1_fpwwbc4,1588978878.0,I had pretty good insurance when I got into a car accident right outside the hospital. Witnesses called an ambulance for me and it couldn't have been more than 2 miles. Still cost $475 just for the call I guess. I paid it first then the other driver's insurance cut me a check.
schizophrenia,fpwr9zj,t1_fpvmdwe,1588968522.0,"Sometimes I feel abusers are drawn to people like us. Easy targets, I dunno. I've ran off good people because they couldn't or didn't want to deal with it which is understandable I can't fault anybody for putting themselves first. What hurts the most is that sometimes I feel like I made abusers out of people. They didn't want to be like that but being with me just made it happen."
schizophrenia,fpwqqly,t1_fpwoh9v,1588968238.0,"My fucking cats do this for hallucinations. If I ask my boyfriend he's too oblivious and doesn't ever notice anything. But my cats tho, they got my back."
AnimalCrossing,fpvqhvb,t1_fpvfx6l,1588949956.0,"Yup lol, my hair is big, long, and curly and I gotta either choose the straight hair with the little wave at the ends or the short hair with the waves. Curly hair is always difficult in video games though."
boyslove,fpvq0gb,t1_fpuw281,1588949695.0,I'm curious if the creator classifies it as bl. 🤔
ac_newhorizons,fpt9gkr,t3_gfcb3l,1588887204.0,"Yes! I have an ""enchanted forest"" area and I have bamboo speakers hidden all around. I forget which trees they're behind though so sometimes I get stuck lmao"
schizophrenia,fpt8s5z,t3_gfcmja,1588886862.0,I was sleepy for the first few weeks on it but after that my sleeping was pretty regular.
bigboobproblems,fpt4rdy,t3_gf7b4b,1588884844.0,Following for sure. I love kawaii lingerie and I don't even really need it to fit like a glove cuz I'm not leaving the house in it. The closest thing I've found is Etsy sellers. Sometimes they'll work with you on custom orders so you can get your true size. Pricey though.
BokuNoShipAcademia,fpt2k38,t3_gez83y,1588883754.0,I want that hat so bad
schizophrenia,fpt23ae,t3_gf4n27,1588883523.0,Weed is weird huh? I used to enjoy it so much and then like a switch all it ever did for me was cause me pain.
boyslove,fpsbmgg,t1_fps6hqn,1588870734.0,"Exactly. BL meaning boys love makes it pretty obvious, there's no love in this story. ""Love"" out of fear is not love no matter how you slice it. There's nothing romantic about abuse, though I do understand that whether it's homosexual or heterosexual abusive relationships people will fetishize it much like the 50 shades hype. And I have read a couple comics where there is emotional abuse present and it's considered romance. I get that it's fiction but yeah this title in particular is psychological horror through and through."
schizophrenia,fpp5kmz,t3_geo4gz,1588796352.0,"Yunno, the more I think about it the more I realize that bad lsd trips ar drug induced psychosis and we're dangerously similar to wooks. 😭"
SkincareAddiction,fpoylzo,t1_fpmjjqm,1588792899.0,Is this job only available to nurses or can anybody apply? I (much like many others) am short on cash and I'd like to do something that helps.
AnimalCrossing,fpoxso3,t1_fpofccl,1588792499.0,Don't feel stupid! It's kind of hard to find cuz it's all the way at the end and I believe it's also a different color than the other categories.
AnimalCrossing,fpoa31e,t1_fpms1nh,1588780983.0,When you go into a room press down on the d pad to bring up the furniture placing tool and all the way to the right you'll see a cat icon. You'll be able to place your villagers like you would place furniture. And you'll be able to change their clothes and expressions.
BokuNoMetaAcademia,fpo6ryr,t1_fpmzn09,1588779362.0,I think that logic is from having a quirk in general? I haven't read the manga but I heard people talking about la brava and how it was her quirk that made her latch onto people and become dependent on them to the point of stalking. Maybe that's the case with him too.
ACQR,fpo6dvo,t1_fpo08wb,1588779169.0,Pissed Jeans are fuckin choice 👌 you should join the punk subreddit if you haven't already. People post new music and there's always discussion happening. It's a very active community. Also the punk memes sub too because funny
NoFeeAC,fpmfwji,t3_gdvvjw,1588732200.0,Yes! I gave Diana the mouldy dress because I thought it would be funny seeing this posh deer walk around in it but now I hate because it's ugly and she won't stop wearing it.
BokuNoMetaAcademia,fplls1x,t1_fpll2jc,1588715016.0,He's been handsome he just needs some chapstick and to stop scratching his neck like a methhead
NoFeeAC,fpkqd5i,t1_fpiw9wu,1588699206.0,"Very same lol, even if it's just a simple trade of low value items and it's quick in and out I'm always just like ""thanks for trading with me!"" Lots of buttheads in the AC community right now so I'm trying to make up for it lol"
ACQR,fpkcs2f,t3_gdsazx,1588692317.0,Love it! I really hope they add a wisteria pergola. That would make my life complete.
BuddyCrossing,fpiapt6,t1_fpi9lf6,1588637056.0,Thank you for responding! Give me a bit to get the others in and I'll send you the code in a pm
BuddyCrossing,fpiao7a,t1_fpi9h3x,1588637030.0,Perfect! Give me a moment to get the others in and I'll send you the code in a pm
BokuNoShipAcademia,fphtyfk,t3_gdi1fa,1588627756.0,"Love edgeshot so much, need to see more of him"
AC_trading,fphqvng,t3_gdhuu4,1588626144.0,Saw this on facebook. What a low life
ac_newhorizons,fpfcrhw,t1_fpf8z2u,1588567504.0,"It wasn't on mother's day for me I think I got it on the first of may but yeah it is a little depressing. My mom loved animal crossing and she played our old copy of city folk when she was sick. Wish that she got to play this one she would have had the most stylish town. At the same time, even though it can be a bit sad when I receive letters from mom in the game I do feel a little connected to her just by simply playing because we all loved animal crossing when I was younger."
ac_newhorizons,fpf36s4,t3_gcnc88,1588560705.0,I would adopt her! I'm trying to have a little lover's island goin on cuz all my faves deserve love and I had the chance to take Julian from a mystery island but I felt like he'd be so lonely.
ac_newhorizons,fpf2ij4,t1_fpdjjac,1588560271.0,"The last one is the mug, I just got that one beginning of May

Oh wait no I think the mug is actually for Mother's Day so scrap that lol"
schizophrenia,fpf0rsh,t1_fpezi0f,1588559136.0,"I've done yoga some years ago and it did make me feel like I was doing something good for my body, but like I said in another comment it didn't stop my symptoms and I would really like it for people to stop pretending like it does. For example, my bf had a friend come to him saying he thought he was experiencing depression. He said he works out all the time and is still feeling like he's depressed. He had this idea that the magic cure all was exercise and was so against going on medication or even going to therapy because he thought exercise was gonna be the thing that did it for him. And it didn't. There's this attitude of ""you don't need *therapy,* you don't need *medication.* All you need is to go take a walk, or meditate, or do yoga, have you tried mindfulness?"" I'm sick of it. Because it turns people away from getting professional help that they need. 

And about making my own posts, I definitely do that. I make posts mostly on tumblr and here on reddit, I'm never on instagram, I was looking at the hashtags on a website that tracks the most popular tags. Also to add, I think this post complaining about it would also serve the same purpose. If someone comes to this sub confused about what they're experiencing they may see this post essentially telling them ""yoga is not a cure all, get help"" and they may heed the advice. I don't think I have to make a super serious psa post to get that point across and making jokes about it is more fun."
schizophrenia,fpezdor,t1_fpeybwy,1588558253.0,I'm convinced that the only thing yoga does is make you an insufferable person to talk about issues with. It's like the crossfit bros lol. I used to do yoga and it was fun and made me feel good and feel like I was doing something good for my body. But it didn't stop my symptoms and that's all there is to it.
AnimalCrossing,fpeyuau,t1_fpee76i,1588557911.0,"Agreed, Olaf is my Bill Wibbly. I never hit him or caged him in or anything I just didn't shed any tears when he moved away lmao."
acturnips,fpe1nno,t1_fpc7bwq,1588538577.0,"Be alert right now but I also want to encourage you that I don't think it will always be like this in the community. In my experience all the other titles had a nice community around them and I never heard about stuff like this. Not to say it never happened, just that I think with the virus keeping everyone inside and animal crossing kind of became a meme where almost everyone even celebrities are playing. When it's everyone playing and interacting there's bound to be asswipes and I think those asswipes are gonna get bored and ditch the game when life goes back to normal."
ACTrade,fpdnclp,t1_fpdmsq4,1588530400.0,okay I'll pm you with the code!
ACTrade,fpdmbjd,t1_fpdgzp6,1588529813.0,"Okey doke, all the normal wood I have is 3 stacks of 30 and a stack of 5"
ACTrade,fpdhtyc,t1_fpdgzp6,1588527273.0,"Okay, it'll take me a min, I got a lotta trees!"
ACTrade,fpdhooi,t1_fpdhgsh,1588527190.0,"Oh you meant stacks. lmao nope I can't do that sorry, don't have enough"
ACTrade,fpdhdia,t1_fpdfnje,1588527018.0,Gold I can do easy! Okay I'll pm you :)
ACTrade,fpdgxd5,t1_fpdfscj,1588526769.0,Let me chop some trees and I'll see how much I can get. Prob won't be 12 stacks though
ACTrade,fpdgj5t,t1_fpdg36i,1588526550.0,I have an already made lucky cat that I got from a balloon but no DIYs for those items.
ACTrade,fpdg2ge,t1_fpdfl7i,1588526291.0,Sure thing! I'll pm you
ACTrade,fpdfpk9,t1_fpdfip1,1588526092.0,I only have the rocket lamp in blue :( sorry about that
ACTrade,fpdfiv7,t1_fpdetjr,1588525988.0,What's in the set?
ACTrade,fpdfhjr,t1_fpdf3sk,1588525967.0,"Yes, how much clay would you like?"
ACNHRecipeTrade,fpbp1td,t1_fpbl3cr,1588475182.0,"I don't have it anymore, sorry bout that"
BuddyCrossing,fpa7qbg,t1_fpa7lai,1588442511.0,"Aw okay, thank you!"
BuddyCrossing,fpa2o94,t3_gc03sa,1588439584.0,I think it is possible to talk to the admins of TagBackTVs discord server and tell them this guy is scamming people. I haven't used their server to trade anything but I feel like it's in their best interest to purge scammers from their server.
ACNHRecipeTrade,fp9vwrn,t1_fp8pnv5,1588435663.0,Okay I'll pm you.
ACNHRecipeTrade,fp8ounr,t1_fp8lbpi,1588398285.0,Sure! Which recipes are you wanting?
yaoimemes,fp7rt3n,t3_gbpclh,1588376470.0,Source please
AnimalCrossing,fp7riwf,t1_fp6zfpf,1588376302.0,Lmao! My brother was SO mad at Hopper he wanted him gone so badly. I love that one person's Bill Wibbly is another's dreamy.
ACNHRecipeTrade,fp7423c,t1_fp73tts,1588363666.0,Perfect I'll pm you the dodo code!
ACNHRecipeTrade,fp72z7n,t1_fp72nox,1588363098.0,"Lol yes yes, I commented on your post too! So I already traded the bamboo stool recipe but I have the other two! Would you trade them for the ironwood low table and the plain wooden shop sign?"
ACNHRecipeTrade,fp72jiz,t3_gbp0wx,1588362874.0,Hi! I can trade the ironwood table for the ironwood low table!
ACNHRecipeTrade,fp71gjx,t1_fp71c99,1588362319.0,yeah! I'll send you the dodo code in pm
ACNHRecipeTrade,fp719s7,t1_fp70ymb,1588362223.0,I have those diys but I'll trade you the bamboo stool and basket if you come water my flowers lol
boyslove,fp4bsc2,t1_fp1dfxu,1588295714.0,It's from 19 Days manhua. I really like it! It's still ongoing
AC_trading,fp4bdms,t3_gaxa5l,1588295477.0,Love the cyber samurai getup
AnimalCrossing,fp48hd3,t3_gb07kx,1588293802.0,"He rebranded as Jolly Redd now, somehow that's even more sinister lol"
punk,fp41fug,t1_fp3za2g,1588289809.0,"Eh, I assume it means living vicariously through the upper classes? I see what you're saying, it could use some more lab time. It seems to have multiple messages just in this one verse when I think it could benefit from a little more focus. Like ""slaving under artificial scarcity"" and ""lavish abundance and starving hungry"" have some relation but it needs a little more ties to relate it to the rest.

I'm not a poet, I have no idea what I'm talking about and I have no idea how to make it better. But I believe in you OP! Keep writing."
punk,fp3y6se,t1_fp3wqw6,1588288020.0,"I *kind of* agree but I think all it needs is a couple tweaks. And honestly really hamfisted lyrics can be great if the performer sells it. It's okay to not have hidden meanings in lyrics and have the message be loud, clear, and in your face but I think it works better with a certain type of delivery."
ac_newhorizons,fp3uvgc,t3_gaya17,1588286243.0,"Okay so I messed around with it and unfortunately I have been unable to stunt growth of trees once they've reached stage 2 (stage right after sapling). I'm out of ideas on it too but I'll share what I tried.

* I tried planting a sapling in sand, it grew to it's full size. Funny though, you can't transplant a tree that has grown past stage 1 into sand *on the beach* but you can transplant it into sand paths.
* placing stone/brick paths in all 8 blocks around the tree does not stunt it's growth
* placing fencing around it doesn't work
* placing furniture in all 8 blocks around it doesn't work
* planting another sapling next to it only stunts the growth of the sapling but the other tree will continue to grow through the stages
* planting 8 saplings around it only stunts the growth of the saplings
* you cannot transplant a stage 2 or higher tree next to other trees, stumps, rivers, cliffs, buildings, rocks
* you cannot transplant fully grown trees next to trees stage 2 or higher

I only used saplings in this experiment and not planted fruits so maybe that's something else to mess around with but honestly I'm not that hopeful for it. I'll test it out with what others are saying about having too many trees in that acre."
ac_newhorizons,fp33d1d,t3_gaya17,1588272386.0,"Does the pathing have something to do with it maybe? I've only ever tried growing tiny trees/bamboo to chop em down and get tiny stumps, I haven't tried keeping them as baby trees. I'll play around with it and report back!"
AnimalCrossing,fp2r7df,t1_fp2nqv1,1588266534.0,"Using Google lens for it though at least you get to play spot the difference. Guides tell you exactly what is different about it, you don't even have to look at the real painting, you just look for the feature specified in the guide."
ACQR,fp2qxkj,t1_fp2kwmk,1588266401.0,Thank you very much!
AnimalCrossing,fp2kunq,t1_fp2frlv,1588263489.0,"Genius idea, I'll give this a try. Following guides just takes the challenge out of it."
AnimalCrossing,fp2klh6,t1_fp2f7ye,1588263364.0,"Happy they changed it for NH, woulda been a big let down if they only added some new art but kept the same fakes for the old ones."
ac_newhorizons,fp0u41z,t1_fozj0kf,1588216955.0,I love it! I have a jungley area too and it'd be dope to put some critters around. Nintendo expanded the amount of custom designs we could have but it still isn't enough lol!
ACQR,fp0l17q,t3_fsubd2,1588211404.0,"AC:NH

Requesting: transparent seaweed patterns to decorate rocks on the beach

I attempted to make some seaweed patterns to decorate the rocks but I guess I should just stick to designing clothing lol. Anyway, I've seen someone have a cute seaweed pattern on their rocks but I couldn't find any creator IDs or anything on them. I'll also take cute little sea critters too! I just need somethin to spruce up these rocks!"
schizophrenia,fowqrlf,t3_g9yn4b,1588125170.0,I always hear stuff outside my window and it's difficult to tell what is real and what is not.
ac_newhorizons,fovk23c,t3_g9n19i,1588102641.0,Adorable idea. I'm excited to see your other personality neighborhoods
BuddyCrossing,forkokv,t1_forjtqr,1588013845.0,I think tagbacktv on YouTube has a video about it. And also there are infographics floating around the other subs I think
BuddyCrossing,forj4tg,t3_g95ctf,1588013107.0,"1) no, you can water your flowers first and then have others come in and water them too and it will give you the bonus.

2) I don't know

3) no benefit to watering flowers that can't have offspring unless you plan to breed them later, I believe there is a luck system involved but I'm not sure how much later you would have to breed them in order to still get the luck bonus"
schizoaffective,for5xww,t3_g8wqa9,1588006729.0,"Definitely get a lawyer! Maybe you could ask your pdoc for a recommendation if they have one, or ask your therapist. It's worth a shot, it would be beneficial to get a lawyer that understands mental illness and knows that it does not make you violent but any lawyer will do.

The police are licking their fucking chops trying to pin the death of someone on a mentally ill person. Lawyer lawyer lawyer. Don't talk to police at all, let the lawyer do all of the talking."
AnimalCrossing,fopnk8m,t1_foon7ey,1587966392.0,I mailed them recipes thinking they would mail me ones back and I was very disappointed.
democrats,fol47xw,t1_foki6h7,1587854563.0,"To be honest the people I personally know that continue to support him all believe that he's lying in their own best interest. They truly believe the ""5D chess"" bullshit and think that he's some sort of Messiah who is going to save the nation from unseen enemies in unseen ways. It's truly ridiculous and no, you can't use reason because they've all abandoned reason a long time ago. It's faith."
AnimalCrossing,fokhoos,t1_foj2nb8,1587842259.0,Ugh same. I wanted to do this nice floral arrangement around my fountain but with my shops and museum so close by I'm struggling to find what looks good and still keeps some form of function.
shoujo,foimksi,t3_g7l0f0,1587790553.0,I moved over to MangaGo for ones that aren't officially released in English.
ACNHvillagertrade,fog0l1b,t1_fofxaec,1587746057.0,Okay cool!
ACNHvillagertrade,foerxle,t3_g72dek,1587712696.0,I had the same idea because I have a lot of amiibo too but I was waiting for the glitches to get fixed. Is there any word on glitched plots and amiibo glitches?
acnhdesigns,fodrdhz,t3_g6qwwy,1587688691.0,Love the pocket idea!
schizophrenia,fodqsh9,t3_g6i02a,1587688368.0,"Yes! This happens to me too lol. I also take psychedelics from time to time and I can promise everyone here that is questioning it, it does not have to be drug related for it to happen. Brain chemicals do weird things whether it's from a substance or from mental illness."
AnimalCrossing,fodphwl,t1_foctvqr,1587687660.0,"Yeah it'd be cool to see them expand the personalities beyond gender. They wouldn't even have to make new characters they could just change personalities of villagers around, they've done that with a few villagers in the past."
schizoaffective,fodovem,t3_g6vqn8,1587687350.0,"Used to be very sensitive to it while I was on ziprasidone, at least I think it was that one. One cup of coffee would put me into psychotic thinking and it was really annoying because I use coffee to wake up and be productive. Everybody was always looking at me and their faces were always weird and morphed and just generally fucked up but in these subtle ways where it's like am I just an asshole thinking all these people look weird? Gave me a lot of anxiety and I didn't want to leave my house because everyone was so fuckin freaky lookin. But now I can drink coffee with no problems."
muacjdiscussion,fodkrgr,t1_fodc15i,1587685908.0,This one actually hurts. For all the times I've seen people say that they wear makeup because they like it and it's a creative outlet I didn't think people would still be judging those who don't wear makeup on the regular. Shouldn't really surprise me I guess because I've been told at multiple work places makeup is mandatory.
muacjdiscussion,fodjy0t,t1_fodayci,1587685625.0,"Damn fooled me, I did not know that brand was marketed toward an older audience. The only people I know that follow along with the Kardashians are very young teenagers so I figured that'd be who they would market to."
schizophrenia,fodd220,t1_fo7f5lq,1587683160.0,"I'm a huge medication advocate on this sub because I was able to relatively go back to ""normal"" after I found the right medication. It took me close to two years to find the one though. I know I can't apply my experiences to everyone but I want to offer words of encouragement to keep going and searching for the right one, search for a good therapist, search for things that work because they are out there."
AnimalCrossingTours,fod0rwp,t3_g6osps,1587678422.0,Fellow funky towner! lol I like the paths I think they're really cute with the edges
