tumblr,fqyt7p6,t1_fqvre21,1589754158.0,might wanna get ur friends tested
tumblr,fqyt61u,t3_gl7jf3,1589754136.0,"marriage, money, and ass.... am I going to marry rich"
gfur,fqwt15a,t3_gla7m8,1589716658.0,should've kept him there longer owo
gfur,fqwjbrp,t3_gl5ctn,1589706535.0,and what if I say no :3c
femyiff,fqrxywa,t3_gkiux1,1589594284.0,dun TAK me... im angy
ghost_hands,fqq16a9,t3_gjz4vl,1589557625.0,all according to keikakku
gfur,fqpnqwo,t3_gjz95h,1589550516.0,I hope that's a promise
ghost_hands,fqpiqi4,t3_gjwnyg,1589547381.0,I am filled with so much desire to be him OwO
ForTheKing,fqh6yn5,t3_gix3ay,1589369740.0,I heard the Divinity games are similar! Could also use Roll20 for more creative stuff.
tumblr,fq6e47j,t1_fq6aope,1589129755.0,omggg
rule34gay,fq63y1v,t3_ggz40z,1589123995.0,lucky uwu
tumblr,fq61gem,t1_fq61e8u,1589122487.0,and found love omg so wholesome
tumblr,fq60qgv,t3_gh0nko,1589122044.0,It's weird seeing this after finishing the good place omg
webcomics,fq5sueo,t3_ggxoo9,1589116523.0,wholesome goals
shrooms,fq5i3ay,t1_fq23si0,1589106261.0,soooo what *is* the tolerance deal haha
tumblr,fq3bwre,t3_ggpevg,1589064918.0,a whole ass salamence... my condolences for your wife jeez
ForTheKing,fq0tboc,t3_gfypyh,1589037367.0,rng or do you have a strat haha
tumblr,fpzrgap,t1_fpz2uvf,1589022397.0,"stole the words right outta my mouth, now give them back or I'll call the police"
rule34gay,fpuxlbw,t3_gfjv1s,1588927295.0,damn did he get a new miraculous
tumblr,fpoh44y,t1_fpnyh2j,1588784396.0,well you have been replaced
darknet,fplbhk4,t3_ge1gr7,1588709744.0,what'a pgp
MenWithToys,fpl6wkm,t3_gdw4jf,1588707437.0,like forreal tho goals
MicroPorn,fpkpgvf,t1_fpkh9kb,1588698769.0,"Well if not visible, who knows!"
gfur,fpjdgve,t3_gdjmfs,1588664535.0,that bowl of cereal better have milk in it
gfur,fpjan4m,t3_gdjpl3,1588661779.0,*nom*
tumblr,fpgzm46,t1_fpdsjqc,1588612348.0,sort of what happened in seven deadly sins haha
furry_irl,fpghiae,t3_gdahme,1588602810.0,One of my recent dreams was going through a life focused on the romance aspect with what resembles a merman.
gfur,fpga0pn,t3_gd3v31,1588598187.0,can't be leaving them dirty now can we owo
Fureeuse,fpfyyv5,t3_gcsh5s,1588588751.0,don't worry guys he has a get out of jail card it's just an intense game of monopoly
gfur,fpdulir,t3_gcmjs1,1588534548.0,damn what in that bolgy wolgy uwu
ghost_hands,fpdlpa8,t3_gcligd,1588529459.0,what will it take to take his place owo
shittyfoodporn,fpct8eb,t3_gccsd3,1588512047.0,I meed therapy now
IDontWorkHereLady,fpcrhp1,t3_e7sn99,1588510632.0,"Just caught up to the story after many months, gosh hope he's recovering well!"
tumblr,fpc1jrp,t1_fpc1hlv,1588484681.0,huh didn't think that was the reason why she used spray tan ngl
tumblr,fpc0ll8,t3_gcdcx0,1588483872.0,the scairest thing here is discord light mode
tumblr,fpc0dsg,t1_fpbjccb,1588483687.0,is she cancelled lol what happened
NatureIsFuckingLit,fpbuyyv,t3_gcgl02,1588479404.0,innocent
cumflation,fp8mdv4,t3_gbs0gv,1588396222.0,"wait a second, this isn't a sauna... this is anal sex!"
gfur,fp8kp7p,t3_gbxxb8,1588394870.0,juicy thiccness
HorsecocksMasterRace,fp8k3kk,t3_gbk8hc,1588394401.0,but r u horny tho
tumblr,fp8ii1q,t1_fp8iemw,1588393178.0,Just gotta follow the instructions: step 1 arrow
rule34gay,fp8ht34,t3_gbxemq,1588392660.0,love the fairy wings 😍
tumblr,fp6il07,t1_fp6ig32,1588352959.0,Shakespearean beauty
AnimalCrossing,fp6ifws,t1_fp6i6e4,1588352890.0,"I so thought something along FNAF too omg. Both gamea out there with their creepy, nondescriptive stick figures."
tumblr,fp6i9m0,t1_fp6hlar,1588352804.0,"Till sweat drop down my balls!

^my ^balls!"
tumblr,fp6fy8m,t1_fp6fo6r,1588351673.0,they just exude a certain Very Tired energy that I think everyone can relate to lol
tumblr,fp6fvhx,t1_fp6fqnw,1588351635.0,Nooooo worries! (people just hate wet socks sorry you were on the end of my previous joke :p)
tumblr,fp6fkct,t1_fp6fbgh,1588351483.0,"Wet socks, wet clothes, in general are a form of torture used in hell basically, and we don't want to take away the demon's jobs, so we avoid wetting our socks as much as possible."
tumblr,fp6cmw7,t1_fp6cbvu,1588350043.0,Rookie mistake! It's actually a threatening gaze to whoever wet the floors.
tumblr,fp6chwq,t1_fp6caaj,1588349976.0,Just imagining those type of specific scenarios are funny. I don't think they're funny bc of how real they are tbh idk about others tho
tumblr,fp6c8xn,t1_fp6c62w,1588349851.0,w-what does this imply? I'm shook
furry_irl,fp6bmaq,t1_fp6b9on,1588349542.0,ty uwu :3 Hope you found/find someone befitting your kindness.
furry_irl,fp6asg2,t1_fp6al28,1588349130.0,Something I'll probably have to reluctantly agree to. Right now just feels wrong to think that I could be with anyone else if not an exact replica haha
tumblr,fp6acfc,t1_fp6a1zt,1588348904.0,It's a gif of the guy punching the ground. Didn't know how to capture gifs haha but don't worry it's like 3 frames only
furry_irl,fp6a7e3,t1_fp68sos,1588348834.0,"Like I wonder if my feelings will change if I get rejected. If they don't, then what do I do? I'd feel guilty for loving someone who doesn't love me I think. Then again, hopefully all these thoughts are just me overthinking haha"
furry_irl,fp630ul,t3_gbg7ey,1588345114.0,"hmmm but why? not complaining, in fact I adore this, but what came across the creator's mind?"
notinteresting,fp60h4v,t3_gb7hyi,1588343715.0,was it good tho
furry_irl,fp60fal,t3_gbegh4,1588343687.0,I think I know what love feels like. Will it still be love once it's not reciprocated?
Oxygennotincluded,fp5s9ne,t1_fp5rvtf,1588338726.0,I love that omg
Oxygennotincluded,fp5o7qd,t3_gbeuzd,1588335784.0,heh heh pee water
tumblr,fp5h2f2,t3_gbdori,1588329125.0,i cannot believe america is fighting for independence again
wholesomememes,fp55qel,t3_gazgep,1588317204.0,does this actually happen?
Fureeuse,fp4t8mw,t1_fp4t4gx,1588306796.0,I'm telling on youuuuuuuu... MOMMMMMMMMM
nsfwmonster,fp4t5xy,t3_gazoyt,1588306742.0,Wish i could get bred by him owo
Fureeuse,fp4syt5,t1_fp3dctd,1588306599.0,mom says it's my turn under the penis table D:<
wholesomememes,fp2ns9f,t3_gavuev,1588264904.0,omg is this the dream world site or something like that
interestingasfuck,fp2hez4,t3_gas6w2,1588261803.0,i can smell it ugh
tumblr,fp2cnjq,t1_fp2civc,1588259429.0,hhhh perfect
tumblr,fp21wf6,t3_gaum3c,1588253407.0,au contraire I must know what the surprises are
AnimalCrossing,fp1877v,t3_gafu9p,1588227202.0,Is this a reference to something? I don't get it haha
MenWithToys,fp183s8,t3_gamtlq,1588227120.0,goooooals
interestingasfuck,fp16iqh,t3_gagwi1,1588225790.0,”while exploring an abandoned house...” hmmmm u tryna get cursed? tryna get deceased? tryna commit fiddle on the diddle? tryn
Furry_Backsack,fp14t2q,t3_gacy0i,1588224421.0,p h a t
gfur,fp0zjri,t3_gakda8,1588220555.0,owo size difference
MurderedByWords,fp0yw67,t1_fp0j6tm,1588220104.0,honestly u rite that's basically what he said xD
no_mans_sky,fp0wlhh,t3_gaexw8,1588218563.0,Huh my Traveller text is translated
furry_irl,fp0w2ye,t3_gaigqj,1588218234.0,WHAT
Yiffbondage,foyl76h,t3_ga07zm,1588174510.0,I'd like to make a donation toward a new installation :3c
gay_irl,foyhv5d,t3_g9y8bv,1588172804.0,I'm a sub bc anytime someone is remotely dominant to me I feel horny in ny soul lmao rip me
AskReddit,foyhmfs,t3_ga4gjx,1588172679.0,"I keep encountering events that happen in my dreams. Sadly I never really remember them until right before the moment, but my sister could predict stuff better."
BadDragon,foucxax,t3_g9jtzp,1588081616.0,omg goalssss
gfur,fouax3z,t3_g9jbyi,1588080397.0,size difference OwO
Pregfur,fouam2p,t3_g9l6ah,1588080204.0,i love dirty talk to much owo
Animemes,fou2asu,t3_g99bb9,1588074146.0,I'm so confused
2meirl4meirl,fou0auc,t1_fou07q9,1588072361.0,wow that totally went over my head thx for the catch haha
animegifs,fotxuxo,t3_g9godd,1588069996.0,god reminds me when I was younger I had such a strong middle school syndrome lol
HypnoFur,fotx8ly,t1_fotx2sw,1588069379.0,"I'm so not good with words sorry haha. Basically it's one of those kinks that like invoke a strong desire within me, something along that line. Like it strikes my core and soul in a way."
HypnoFur,fotwxw9,t3_g9j7rv,1588069079.0,"hypnosis and stuff that slowly corrupts the mind is such a turn on, but like on a deep level I swear."
2meirl4meirl,fotw6o4,t3_g9iruv,1588068302.0,Isn't that discord and twitter tho xD
femyiff,fotum59,t3_g99r4h,1588066692.0,"gasp......,,,,,.,.., breaking the rules? unprecedented"
Gfurcomics,fottpre,t3_g9gceo,1588065783.0,the humour's so great
gayfurryporn,fotgl21,t1_forbgxf,1588053315.0,what a mood
gfur,fotf15s,t3_g990vh,1588052039.0,how do I get this job owo
rule34gay,fot1s08,t3_g9bc2h,1588042734.0,how do I make a contract owo
gfur,fosz7as,t1_fosws6e,1588041153.0,huh why do people hate unpaid internships that much then
gfur,fosvxnu,t3_g92mpy,1588039161.0,where can I apply for that position OwO
gfur,for6cs3,t3_g8znfg,1588006930.0,so jealous uvu
NoMansSkyTheGame,foqgorc,t3_g8ydmr,1587993142.0,how does your ship have a Nada bobblehead?
furry,foqb72k,t3_g8un5q,1587989032.0,arguably my fav food
tumblr,foq6kim,t3_g8xfqr,1587984818.0,"gotta praise him tho, he decided to eat something that would put him through so much pain just for a date"
