dragonage,fr54t4f,t1_fr54are,1589902510.0,"In fact... I would argue... they heavily imply they are *not* dead.

From the first time you play Hawke - ""Don't be afraid to leap"" ... now she may have meant just leap into the abyss, or in general take risks in DA2... but since she has the kind of psychic manipulation she does - I think she meant, don't be afraid to leap at the nightmare. I think it is a directional story they intended with Hawke, even though they gave you a choice.  [Tinfoil, I know]"
loseit,fq9x4uh,t1_fq9wljh,1589208766.0,"Water, salt, bloat.

In one day, it is unlikely to be fat.

You had a higher volume/mass of food that your body hasn't fully processed out of your system.

More carbs, more salt - higher water retention. (Especially if you tend to do low carb and had more carbs, even healthy ones.)

Look at trends, not details. See how much your average weight-loss happens over time. See how your measurements change with time.

(Anecdotal example: I can lose 10 lbs in one good workout. This is easily put back on with rehydration, and can mean zilch for how much real weight I lose. Same thing goes for the other direction.)"
loseit,fq9t9gh,t1_fq9pr0k,1589206586.0,"When you start off this is not unusual. It means you are pushing yourself beyond normal, and that is the point.

(1) Go easier on yourself. I can run, but I can only run for a very short period before getting wiped out. If I do a fast walk I can go many times longer and get more benefits in the end. If I do it on a bit of an incline I can keep it at a cardio level pretty easily. 

(2) Give yourself some time to adjust. Even easy workouts can kick your butt when you aren't used to them. - keep doing them and they won't . 

(3) Eat enough. Feed the machine. Chances are if you are here you are on a calorie deficit, but if you are trying to run 6 miles while eating 1,000 calories, your body will fight you. Find the deficit that works for you."
3d6,fpbjdot,t3_gcfls3,1588471369.0,"I am having a similar debate with a character of mine, although in a different setup. 

For you directly...

He is willing to look for unusual allies - so it is not unreasonable he would take a risk in you. As for what you owe him... 
[From wiki] ""Suitable gifts had to be brought before him, including vast amounts of wealth, valuable secrets about his rivals, a mass of insignificant individual souls or a soul of singular importance, and rarely were one of those considered enough. ""
... even bringing some valuable secrets about his enemy would be something he would be interested in. He uses information very well. Souls may push your characters goodness... but some secrets you uncover about his (evil) enemy... well....

For me (personally- in case this sparks ideas) I tried looking at his most admirable traits to embody....

She is good, but her connection to Levistus had left me a bit stumped.  Most evil gods have some redeeming traits and it is also true with Levistus. (1) he is fair,  if he challenges you to a duel, it will be a fair fight and he will honor the outcome (he is also very, very good - so he expects to win - but he is also honorable to a fault.). (2) He has more souls than anyone. Why? Because he sought those that were forgotten.  He has the least organized followers, but everyone else dismissed them. (3) he has few underworld allies - he would likely join right in a rebellion against most of the evil powers. (4) not really a ""good"" but not evil either. He is supposed to be charming AF. 

So, my character is charming, looks out for the little guys, and honorable.  (Didn't do anything directly with #3, but mentioned it in case it becomes relevant.)

I don't know how much these help or if they spark any ideas.  Also, as you said - he is very powerful (knowable, slippery, manipulative) and the ends can justify the means right?"
TooAfraidToAsk,fm5hajn,t3_ft57pb,1585772941.0,"I think some social behaviors is actually the place they just expected me to learn but osmosis.  My mom is still frustrated my sister and I don't do our makeup every day, as we are adults (I am turning 30 here in less than a week)  ... she did her makeup every day, but she didn't teach either of us how to do hair or makeup (I learned from the internet, my sister just doesn't) but we never were ""taught"" the importance of it.  School for them was more for socializing than anything, and they expected we would come out properly socialized for going through it. (We did mostly, so it isnt untrue)

Academically .... It was less because they ""assumed the school district would teach"" as they weren't super experienced themselves... but the arts & sports. I did lots of fine art and music- and my parents offered opportunities there but not direct teaching.  They did sign me up for music lessons and some early sports teams though, so even then...  For classic academics, my parents were very involved. MY mom more or less taught me to read and write, my dad was always doing history and science.  ..."
LifeProTips,fm0rops,t3_fs9iox,1585664823.0,"LPT: most phone let you schedule a message for later.

Sort of expect them to forget? Send the text for about the time you expect they might free up and be able to deal with it."
dataisbeautiful,flud3t3,t1_fltce3i,1585500213.0,"You know what, I definitely see that now. I failed to read thank you."
Career,flt8o4n,t1_flt7wm8,1585462961.0,"I would throw that out the window, personally. 

Many, many jobs just want to see a degree. It doesn't matter if it is ""in"" the industry for many. 

If you specifically really want to work for the subject you studied- then you can fight for it. The stereotypes are from so many people who expect to be handed it, or that the degree will result in a job in that industry, and that isnt accurate. Some degrees don't get your foot in the door even if it gets you the education. If you want one of those, go for very specific jobs like pharmacy. Liberal arts degrees can be applied... liberally. My example for this is my husband. Got his masters in Anthropology. Loves it. He has used that degree very directly (digs in romania) and for things that are a stretch (teaching high school chemistry).  The ones he has to fight for to get the most are the most directly his degree. He uses connections he has built, skills he has learned, experiences he's had... the easy ones are usually the ones that don't seem to relate. (Like teaching high school)... but you will never see him say the fighting isn't worth the fight.... and no matter what he does, he breathes Anthropology. Even in part time just-money jobs he has taken like working for a moving company ... he used his skills to bridge communication gaps, find excitement in his day, or teach someone something new. He cannot put it down because he is passionate.  He has had many colleges who ""dropped out"" of the Anthropology scene because they liked learning, but they didn't want to fight. Most are happy in totally tangential positions, that loosely use their education. ... also... he didnt have that passion going into school, he learned it through studying... and many of his classmates didn't.  That was okay too."
dataisbeautiful,flt826m,t3_fqps12,1585462348.0,"I am curious... you seem to have a very tall sample.your shortest female is about the average height of a female, maybe a couple cm above average depending on which statistics you use. (The one I saw said 161.5 cm) Same with guys. (175.5 cm)  Where did you get your sample? It looks like you asked a good handful of people, but it seems skewed tall."
LifeProTips,flt75ip,t3_fqvgk7,1585461456.0,"Agree and disagree? Involving yourself with other's lives is very important, especially for those closest to you.

I built a relationship with my husband by joining in with several interests th as t weren't my thing. Now that we both know eachother better,  I know which things he really wants me to be involved in (where it emotionally matters) and where I can say ""nope, not my thing."" Without hurting him. Full on ignoring or even trying may hurt him, but not liking it doesn't. 

... I have one friend who is very invested in you joining her on her obsessions, she loves it. But she also have 2 or 3 new obsessions every month. And if you don't like it, she gets hurt. Sometimes it is better to pick and choose,  and not hurt her for not loving it, because you didn't try. 

And then my sister. She is so good at recommending things for me, I pretty much know if she says I will like it, I will - but she also couldn't care less if I actually take her up on it.  She has a strong ""your loss"" response to people who don't agree with her. 

Then I have a friend who loves to share, has great taste, but it is like a whirlwind. She shares in the moment and forgets a moment later. She barely remembers that SHE liked it a few days later. Out of sight out of mind. 

My dad? He almost bonds more over a refusal to engage with his interests. At least for fun things like movies, sports, etc. Creates an opportunity to tease or banter with you.

... so, real investment is knowing your friends and family and knowing what is important to them.  And not everyone is skilled at that, so don't be hurt if someone else uses another ""love language "" to show they cafe."
Career,flt6dn4,t3_fr0jf6,1585460713.0,"Yes and no...

... for money? No, you are likely to lose more wasting time. If you do, go community college. But you might be better off delaying a year or two to work and explore.

... for the value of learning and social integration and learning. Yes, definitely.   You learn a lot in college that has nothing to do with the classes. (Or the parties, which I have zero experience in even having gone to a ""party"" college.)  The social system of college will be repeated in jobs, the connections you make often come back, etc. Etc. Etc.  I find my college education to be worth it in almost every way except finacial."
dragonage,flt5xi7,t1_flsomom,1585460295.0,"Thank you, I figured it was pretty much ""go away"" but knowing It was decipherable drove me crazy."
CustomerService,flrxem8,t1_flrxbqb,1585429889.0,"I actually find that a lot with people who dont like fast food. They are too patient sometimes :P patience doesnt mix well with ""now"""
dragonage,flrxbrw,t3_fqslbs,1585429841.0,"It appears to just be written in an upside down font. I am 90% sure on the first part... ""A short word or two..."" but I am struggling on the rest. My letters don't make sense. Maybe if there was some elven in here it would? I am not familiar enough with elven to make out the rest. Orange lettering are some reaches, blue is ones I am pretty sure on. Didn't write anything I couldn't get a full word.


Still working on it.... I am pretty sure that middle word is mystical so that goes (to my best guessing including bad lettering)

My Darling,
A short word
Or two of I Noekphe
Rablf mystical for
Elon charact sae
Here"
CustomerService,flrozox,t1_flrd6wm,1585424782.0,Because patience is not the ONLY thing required for working at Tim's and being impatient is the ONLY reason someone would leave.
CustomerService,flrosku,t3_fqnn7a,1585424660.0,"Both...

... when customers are disorganized it is actually super annoying. Especially if I have a line and people behind them are huffing. Mostly I say that because (1) it is my job, and helping you is part of that. If I act like a child and say the truth I am not helping ANYONE.  And (2) anxious people do not get organized. If I can calm you down you get organized faster.

But if you allow me to multi task and not throw a fit over it or get mad at me because you aren't organized (like yelling at me for the stupid app) ... or worse, complain about others being disprganized/slow and then you aren't ready... then I am likely to forget it seconds later. So it isn't just me being polite. It is a minuscule part of the annoyances of the day."
CustomerService,flpa8ne,t1_flpa4t8,1585354891.0,"Wow... that is a ""great"" argument.  Clearly that is the only place to get coffee."
CustomerService,flp8wmh,t3_fq55s0,1585354084.0,"Curious, what is their loophole? I get some businesses... but this sounds like Gamestop."
nutrition,flmk6d4,t3_fpi7rc,1585286093.0,"Just to add to the noise... I have tried many supplements,  and Vitamin D is the only one I ever FELT a difference from taking.

... then again, it was the only one I ever took because I tested low."
AskReddit,flke84o,t1_fljgkm0,1585239270.0,Laziness is the mother of all invention.
Vent,flccmoo,t1_flcam24,1585026207.0,"I cannot confirm New Zealand, but it seems to be common amongst many countries. I imagine they are having similar issues? US is definitely sucking worse than most on that."
Vent,fla7ub9,t3_fnimqd,1584978475.0,"I think tests should be handed out like candy right now, because many people are asymptomatic,  and many of the symptoms are like a normal flu/cough.

That said...

They literally do not have enough tests. They are limiting those tests to people where it could impact the way they handle treatment. That means that yes, usually if a 19 year old gets it, the best answer is self-quarantine and assume you have it because chances are you won't need hospitalization (there are exceptions to this,  but the hospital is playing a number game and hoping you fit the typical.) Self-quarantine,  minimize spread (good idea if this is Covid 19 or a ""viral lung infection"" because if you get both infections, or someone else gets both, it will be way worse.) Hold off on going in unless you need hospitalization. Almost every health recommendation I have seen says to avoid going physically into the doctor if you just ""suspect"" you might have it, because it aids in transmitting to the most vulnerable. Go in if you need their help. If they have drive-through testing,  you can try that, but most places out here are turning away people because there just aren't enough tests. Hopefully this changes soon."
TooAfraidToAsk,fl8qnmr,t3_fn5c8c,1584929927.0,"I can only speak to those I have talked to.

... the older people ho are still out have an attitude of ""I have survived a thousand flus, and if this kills me, it kills me. We have never gone this extreme before, and I dont get why this is something we are doing now.""

... many of the younger people I hear are saying ""I am not worried about me, I am worried if my mom/grandpa/neighbor gets it, and I learn I am responsible. I hope these new tactics change something and we have a better than worst case senario.""

I think a big part is the ""I am already old, and I am going to die someday."" Vs the optimistic ""let's try something new"" mentality. As far as the pressure, I think a big part of that is how much younger people can have no symptoms and still transmit it, perpetrating the pandemic while being seemingly ""healthy""... wheras the older people are more likely to succumb to the illness and show those signs making self-quarantine more of an obvious action."
BeAmazed,fl6xd7m,t1_fl6j7sv,1584886681.0,Good question! Clearly the higher one.
BeAmazed,fl60xlk,t1_fl60sg4,1584851046.0,"Done! I apologize though, only image I had of myself on my phone was the one where I was wearing my invisibility cloak, so I am not sure if it was helpful."
BeAmazed,fl60m53,t1_fl5zxu2,1584850785.0,"I am sightly taller than the cane... but the can looks like it is just over 5', so a slightly short females would be pretty close to that.  Definitely human height cane."
BeAmazed,fl60ffm,t1_fl5zbms,1584850635.0,"Sure, but the Master stole the key to my Tardis, so it might be a quick minute."
selfimprovement,fl5yb36,t3_fmgi6x,1584848945.0,"From my own experience?

My husband has seen me at my best, and my almost-worst (to be fair my worst out of control depression was at about 10-13, hence almost-worst)

He has seen me cycle into a refusal to do anything but lay in bed. He has seen me push through and work 60 he weeks for months on end.

When we started dating when the really got to know me, I was in one of my max-social times, we bonded while hiking and over academics. Since then I dropped out of school, I never go hiking, and I have virtually no friends. He admits he misses hiking. There was one point when I had a panic attack early in dating that he had to decide if my moments were something he was willing to burden. ... and he loves me for me. At my worst.

Now I still am always improving, and I would argue my best has been since being married... but I have changed, some things got better, some things got worse. His affection towards me never stopped. 

But it depends on who you get in a relationship and what it matters to them. If I started being super controlling I would drive him away, but I am not a super controlling person. If this was something I had ""improved"" and I regressed,  I would definitely think it would make an impact on his ability to be partners with me."
BeAmazed,fl5wmxy,t1_fl5sl9p,1584847643.0,"I am a slightly tall female, slight short if I was male - very average human....  I would come up approximately to his elbow, maybe slightly shorter. She would come up slightly above my knee.  .... not a photo, but maybe some visual for you."
nutrition,fl26q86,t1_fl1gboq,1584744172.0,"This ^^^ beans and rice go a long way for subsistence,  and frozen veggies will help you get some more vitamins. Overall pretty inexpensive."
therapy,fkxq1ys,t3_fl4le2,1584633205.0,"I think it is healthy... specially if you keep the self-relationship healthy.

You will hear therapists talk about self-talk and say ""would you say that to a child? Your best friend?"" I usually switch that to ""someone you manage"" if I need some tough love, but the point remains the same. We all have an inner voice. I find, for myself, if I dont separate I just tell myself the ""truth"" and I'm not going to sugar coat it like I would a kid.  ... so I do find it helpful to separate more. Picture someone else having this conversation, have them be gentle and disconnected and less emotionally involved, and what would they say.

Also, you know that it isnt real, you dont feel like it is real... that isnt some multiple personality or schizophrenia type thing."
HaircareScience,fkwfswn,t3_fl2eq5,1584591272.0,"I am 29... no sign.

My mom is 50 ... I think.she finds one occassionally, no one would call her graying.

My dad has about 50% gray, but it really just makes it look lighter blonde because it is fine and it blends well.

My grandma has never grayed so much as her hair got duller."
Advice,fktw9lr,t3_fkmqek,1584536395.0,"A balance I think.

Maybe send out a newsletter emphasizing: We live in a more enclosed area, and this can be transmitted before anyone shows symptoms. We encourage everyone to practice social distancing.

I think naming names, regardless, is a bad idea.

Saying ""someone"" could create paranoia/panic or legal issues and in general potentially unhelpful conflict.

Maybe say what you at the office are doing: cleaning, limiting hours, emphasizing space, etc.

Neither of those statements/suggestions are outside what my apartment, job, and community are saying already - but emphasizing may save lives."
selfimprovement,fkt839a,t3_fk5crq,1584509205.0,"People have said similar... but I wanted to give my own story.

TLDR: you dont see the whole picture, you are way more talented than you give yourself credit for - and they have advantages you are not aware of.

When I was in 6th grade I started playing the cello. I was horrible, of course I was. I had just started playing and I was a kid. The person who I shared a music stand with would memorize the music. Make a point of stating as such if I put music up there. I ended up trying to pretend that I had also memorized it, resulting in me just pretending to play half the time. He was clearly the best cellist - and he had started playing at the same time as me. I didn't give myself a chance to do well because I was trying too hard.

Hindsight: (1) memorizing is my weakness. Getting after myself for one of the things I am weakest out without recognizing my strengths was really ridiculous. (2) it was not his first instrument. He had been doing music for years. If I went back to that music I would have it memorized after a play or two also. He was only learning the cello. I was learning how to read music, how to hear the notes... all of it. He got to put that energy into being ""better"" and have a head start. It wasnt him being naturally better or me.being inferior.  The fact that I kept up with him as well as I did was actually evidence of my skill.

Then, when I got older I continued to play, and I never got first chair. Always second. There was one girl who always beat me.  It really demoralized me, because I wanted to do well. I ended up.being sure I had no ear, no talent, and eventually dropped out of orchestra (amongst other things like developing stage fright.)

Hindsight: (1) she was a year older than me. She started cello very young. She played multiple instruments. We weren't comparing two people at the same education level. That was, again, like comparing a high school essay to a college level essay and discouraging the high schooler because they weren't there yet. (2) her mom was literally my cello tutor. She grew up hearing cello, watching cello. In my family, I was the odd artist. My parents didn't do music or art or any of it. My talent actually was the ""naturally inclined"" - but again,  I stunted my confidence by comparing it to people who just had more experience.

... I occassionally play still, and by most people's standards I am very good. To me, it will never be enough.  It is because ai have always compared myself to someone else. I won't be ""good"" until yo-yo-ma himself says he admires me. There was a time I could have considered majoring in music, but I wasn't already a professional,  so I couldn't pursue it as a career. I still have low confidence about it, even when I can step back logically. 

I know this mindset has held me back so many times.

You don't know their whole story, and if you did - chances are you would feel much better about where you are.  And if they had a harder struggle, let it feed an inspiration to work harder. They had to struggle to get there.

You are amazing, in your own way. No matter who it is, there is something that you have better. Maybe you are an average at skill X, and they are a master. But you also know G, and I, and K... and are pretty good at all of them.  To be a master they gave up the time they could have used to learn those other skills. Maybe they are superior in all those skills... and you spent that time building relationships and networking. It's all worth it."
AskReddit,fknmmqc,t3_fjenok,1584369333.0,"Yes, but within reason. Giving too blanket of a yes would give people room to abuse it. I think I will be fine, but I am hoping my complex will give liency to some of my neighbors who I know will be hit hard by this. Extended deadlines at the very least."
CustomerService,fknme4i,t3_fjd9ez,1584369190.0,"It could also be autp-response. 
I am speaking from my own foibles.  I have my habits at work and I tend to default to them when engaging with people outside of work... sometimes ai slip up and say things that make zero sense as a customer, just because I say them 1,000x per day at my job.  ... if I was him, that would be exactly why I would say that. And then I would shut up and hope you didnt notice."
memes,fkmkbtl,t3_fizqnh,1584331217.0,Dude... you guys are all still babies. You probably cannot even.... *counts on fingers*  .... What do you mean you can legally buy beer next year?! How old am I? *cries*
CustomerService,fkmj488,t3_fjdb44,1584330321.0,"Or when they get really mad at you for not immediately helping them.  Sorry, if you are not at the counter and you are on your phone - I am going to give you as much privacy as I can.

 ... I had one customer accuse my coworker of blatantly ignoring and avoiding her because she was leaned against a wall chatting on her phone and my coworker went to someone who actively was seeking help even though that customer had been there (presumably) first. Yes, she walked past this customer who has having an in depth conversation and not making eye contact with anyone or standing in any sort of que.... Lady, we have 3+ lines (or no lines)  we juggle through with one or two on staff. We try to tack who came in first and triage appropriately,  but when three people come in at once, we may sequence incorrectly. Yes, you may have been there first, but your disregard for our time and lack of communication to us (even non verbally) that you wanted us to come over was the reason someone was helped first, not intentional offense to your personhood."
AskReddit,fkk1k1s,t3_fiueho,1584269616.0,"The garage was filled with scantily clad women. I heard the previous residents pretty much died of old age, and uh... there were a lot of very, very young girls lining those walls. I think the oldest was one of Madonna... from 40 years ago. But there were ones that had to have been put up within what was 2 or 3 years before we moved in.

In general that house was very much a ""Just do what we need to sell it"". Many personal items were never removed, and there were a lot of ""quick fixes"" like wallpaper over wood paneling or cheap carpet put over ugly laminate flooring.

This house was one I moved into as a kid, and there was a lot of my parents moving in on top of it. Many of those posters are still in the in garage , excluding where shelving was changed up. (Of note, the Madonna poster is still there. I suspect that one is less incidental than others.)"
