Career,fh6ve65,t3_f1ehic,1581307072.0,"It sounds to me like you really have the experience and resume to get yourself somewhere pretty decent with the right representation. 

I know at a lot of colleges there are programs to help with setting up a resume and interviewing. I think there is also often stuff through government services. Having someone trained at that to go through your history and help you clean that up could be the difference between an entry level job and a career you really like. So I would take the time to go look through that. 

If that doesn't  help, maybe look into some more minor managing jobs to get back into the industry and then move on from there? But ai think that is selling yourself short."
dragonage,fh4zk0h,t3_f1cjt0,1581283595.0,"The inquisitor as the protagonist.  I dont think they will, but so many people hope for it. I am not one of them.

*note: I love my inquisitor... I just like a new protagonist to explore"
skin,fh1x10j,t3_f148o9,1581226846.0,"I highly recommend a dermatologist on this one. Guessing can make stuff like this worse (or be totally ineffective)...

... but it strikes me as a fungal infection or something along those lines as opposed to standard acne. Especially since you said it came up overnight. If this was typical I'd maybe say Eczema?"
pcmasterrace,fh0do7e,t3_f0s71d,1581202791.0,"Screw the river table... I want this one.

*pictures playing DnD on this one*"
longhair,fh0cn1r,t1_fgxrkd2,1581202445.0,I noticed your rosewood is sold out... any feedback on how long that waitlist is?
longhair,fh0c5ux,t1_fgxqqnl,1581202286.0,"I said that for years. I have super fine, oily slick hair. Everything falls out of it. .... you have to twist your hair a bit tighter or more than girls with more texture -  but I bet you can put your hair up with this. Check out some youtube tutorials and try with a normal pen/pencil for testing. 


... although I didnt really ""get"" it until I had a coworker show me, but it is very, very doable even with fine hair."
Career,fgymepe,t3_f0qhc3,1581184801.0,"I just wanted to give one anecdotal scenario that could be helpful.

At my work we had some trouble hiring someone based on things that were outside of the control of anyone who the person would work with.

It was initially delayed because the district manager was on vacation and couldn't approve the position. Then, as he approved it the HR person quit so the paperwork couldn't be triggered at our level. This was after the three week long interview process the person went through. We lost them due to time - and I do not blame them. But they also couldn't see how much everyone at the level he would be at was scrambling to do what they could to find who could give the release and get the paperwork through. When the district manager shows up once every 2 months and I have never even met our HR person. The people holding it up weren't the people who they would be working with."
skin,fgy2k6r,t1_fgy1m25,1581178880.0,This is exactly the one I used. I hope it helps!
skin,fgxo36n,t3_f0qod5,1581174865.0,I have similar stuff on my arm. Based on what I read on this reddit I tried Cereve lotion (has salicylic acid in it) and it has made a noticable difference. Yours looks pretty mild so I bet if you find something that works for you it will clear up pretty quick.
dragonage,fgxmri8,t3_f0r6x0,1581174435.0,"... the golden nug is the part that kills me. 

I did this run once for ""fun"" and it was tough, but the golden nug made it possible. I am. Not sure how well I would have done without it.... but I have thought about trying it for a let's play type thing..."
