IWantToLearn,fkk1712,t3_fiti48,1584269151.0,"Hang out with people who use the words.

Honestly, if you aren't using it, it won't stick. Just like learning a foreign language.  

[Long explanation that says the same as the above with more words]

I am regularly criticized for speaking above people's head, and I just don't catch it. I grew up in a family that spoke like this, it's almost like an accent. I had a social event where I invited a friend to a game night [D&D, so not language based like others I will mention.] with my cousins, and he stopped me in the middle asking me if we just had dictionaries we were pulling these words out of. I don't mean that to sound pretentious, because it has followed me with labels of ""stuck up"" and other assumptions simply due to my natural word choice.  (And heck,  I am too lazy to proofread this, so there is a 100%* chance you will find sloppy grammar or autocorrect errors throught this post) ... but my point is, if you put yourself around people that naturally speak that way, you will pick it up far more naturally than if you try to memorize the dictionary. ... my friend had no chance. One cousin is currently pursuing a PHD in technical writing. My husband has a master's in biological anthropology,  and the rest of the group was exactly the type of people you would expect to hang out with those two. [Except me, the college dropout, but they have to invite me as I am married to one and blood related to half of the group]

If you do want to do the ""memorize the dictionary"" method. Here are some tricks: listen as much as you read. Listen to college lectures or debates amongst scientists on podcasts. Often you will read a word, understand a word, but not pronounce it right - and that does not help you.  Also, games are more fun. I recomend Balderdash, although most of the words are not commonly used - a surprising volume tends to just be more niche words. (My family did New York Times crosswords, scrabble, Balderdash, and Gin rummy during family get togethers. Kids were as involved as the adults, with the exception of those gold colored drinks they had when Rummy was played. Eventually games like Taboo were also introduced,  which doesn't directly use big vocabulary words, but having a large vocabulary helps you cheat the system.) Also look at things for like SAT or GRE prep for vocabulary.  Those will focus in on less frequently used words that are very relevant. 

I also encourage practicing blending in definitions with your language for two reasons (1) training your understanding of the word. And (2) bridging the gap when you do end up having a larger vocabulary. It doesn't have to come off condescending or academic, and can be as simple as throwing in a synonym.  For example, if I said ""I feel like such a plebeian."" Many people are unfamiliar with the plebeians/bourgeois terms, and will not nessisarily understand the meaning. I could be super condescending and assume that the person on the other side does not know and say ""I feel like such a plebeian- that is, a person of lower economic and social status who suffers under the weight of the upper class.""  ... and I am likely to get a giant eye roll. I could also say (and I am sure there are people who can say this better than me, if you haven't noticed I tend to talk too much) ""Ugh, I have been spoiled by having fast internet. This dial up is making me feel like such a plebeian! First world problems I guess."" So there are context clues for people to follow, even if they don't have the vocabulary range. In relation to that, watch for eyes glazing over. If you are being stared at like the professor of calculus, it may be time to chill out, and let someone else talk for awhile.  ... chances are if you are looking to expand your vocabulary,  you are the type of person who already has an above average one and just want to push it further, so learning to relate while utilizing that skill is important.  (Of course, it also requires you realizing when you are using obscure words... which is not a skill I always have. Longanimity [Balderdash-style definition: Patiently suffering while plotting revenge.] was a word I was using in elementary - how difficult can that be? Oh, autocorrect doesnt know it, probably obsucre.)

*edited percentage after noticing an error."
Advice,fkjz5uk,t3_fit446,1584266469.0,"What is anti-femenism - saying you should be the one to stay home because you are female. Where sex is the deciding factor.

What is not anti-femeneism - making a choice between two partners for something that makes sense to them that was brought to that conclusion (at least seemingly based on your post) without regard to sex. 

...

A lot of people seem to go with feminism means that women can be ""the man"" and the goal is to erradicate the female gender roles. Often it looses view of the value of the ""female role"". The ideal feminism isnt just about women. It's about men too, and people who dont align with traditional gender roles. The ideal world - men don't get ridiculed when the best answer is them to stay home with the kids. It is a valued role, that is needed whether mom does it, the dad does it, Grandma does it, uncle Joe does it, or you pay a nanny/daycare/babysitter.  Same with going out and ""bringing home the bacon"". Different setup work better for different individuals and limiting it on sex alone is not helpful. ... but devaluing the ""traditional female role"" is just as dangerous as saying that all women ""should"" be in those roles.  
 
... just because your choices seem to currently align with historical roles doesn't mean you are betraying anything. Your attitude, your words, your view, and the way you live your life will have a far greater impact on that.

[Anecdotal insert: in reverse, going the opposite direction isn't nessisarily feminism.  My mom has a well paying career, that my dad couldn't match her part time income even working 60 hrs a week. The result was he worked around her schedule,  and was a lot more involved in child rearing than his dad was. He came from a household where his mom also had a full time job. My mom came from a household where her mom was the most consistent income.  You would think all 3 would show great feminism?  Yes and no. The most traditional marriage I have ever seen was my dad's parents, inspite of my Grandmother's career. My dad constantly grades himself as a ""lesser"" man because he wasnt the breadwinner. My mother's parents have so many of those classic ""locked into marriage"" type stories, you know they were ruled by the social structures around men and women. Each generation it gets a bit better. My little sister's husband is a stay at home dad, and she defends his choices regularly  (against many, but one of note is my more traditional parents- who think the roles should be reversed or they at least both should be working). I am in a relationship that is extraordinarily free/open on those kind of roles, and we talk about them. Yet in both, we still have our own playing to it. My husband occassionally has felt guilty for not making more money, even though he recently has been making more than me, and we are very comfortable. My sister often will play a more submissive role to her husband than I ever expected of her, mostly when protecting his ego and letting him ""be the man"".  ... even if you insisted on working, we all have this culture ingrained that we would be working around. Learn, grow, and do what is right for you.]"
mildlyinfuriating,fkjjhp9,t1_fkif9s7,1584247845.0,"I dont know about you... but we only keep about 2 weeks worth of TP. The chances of us running out is, well, kinda high."
TooAfraidToAsk,fkil6to,t3_fijez1,1584222621.0,"Yes. I am pretty Liberal/left... and I definitely get the ""circle jerk"" effect if I spend too much time on Reddit. Because clearly everyone agrees with me, and it is the obvious stance. Then I realize 50% of the country think I am the crazy one... so there are probably several points that I have not full considered. (I try to keep a balanced perspective, even when my conclusion leans heavily to one side.)"
AskReddit,fkikvl9,t1_fkhknz6,1584222407.0,"I appreciate this. I seriously had to restrain myself from a ""well actually"" rant in response, and only knowing that you probably have recited that yourself allowed me to silence my keyboard."
AskReddit,fkiklaq,t3_fikjbd,1584222215.0,"All narcotics. I shouldn't say I said ""nope never again"" after once... but I repeatedly was prescribed different ones in different situations. And I get exactly the same response.  Zero pain relief and my body is covered in hive-like itchiness. The itchiness might be tolerable if it gave any pain relief,  but it is useless with no redeaming features.


Also, Xanex. Except as a sleep aid. I was prescribed it for panic attacks, and literally just fell asleep. I am super sensitive to it, and even a quarter pill of the lowest dose just puts me out. Doctor discouraged using it a sleep aid though."
AskReddit,fkhjwxn,t1_fkh39p8,1584200475.0,Oh do not tell my husband this... he would abuse such power.
Career,fkhjid3,t3_fihgih,1584200249.0,"My degree is electrical engineering.
I work in management. 
It is different, but I find it more rewarding (emotionally) ... but I have also spent many years with on-the-job training for it."
IsItBullshit,fkey7r9,t3_fhq0wd,1584123175.0,"The best arguments I have seen have been 100% this. They aren't terrified of x volume of people getting sick. They are terrified that x volume of people get sick at once.

Even at my work... we have a staff of 6. One person calls in, it sucks but we handle. Two people call in, we are dying, but we can push it through with delays. 3 people call in....... and we are all working with close interaction, if one gets sick, we all are at risk. In fact, by the time one person gets sick, it is probably too late for the rest of us. Especially since knowing the above, we have to be pretty sick before we admit it."
Career,fkbcftr,t3_fhf0ye,1584030405.0,"Other issues...

... people need people, we suffer from being disconnected already, a more isolated world is not good for our health. Even on the basis of illness, too much protection from infection results in a weaker immune system. Especially amongst those developing one. (Yes, let's minimize the worst of outbreaks - no, let's not live in a world of bear perfect sanitization.) But more so, social health, you need actual contact. Digital contact is better than none, but you need more than that. For me, I get depressed when I work from home. I work where I work, at least partially, because it has a high level of team engagement.  

... sort of what you said, but on a societal level - stratification of economics. If everything moves more online, then those who were privileged to grow up with computers or live in cities where internet is more accessible/faster have an advantage,  and those already at a disadvantage fall further behind. This is one of the issues my husband critiques at the school he teaches at. They are talking about going online for a few weeks, but he mentions 30% of his students dont have internet at home (maybe cellular internet but not full workstation computers). He is frustrated,  because those 30%, on average, are also the ones who struggle the most, and they will be the most hurt by that decision.

... that said ... I am a big believer in finding new solutions like this. It would be great if I could find a way to do my job from home so when I am in that state where I have no problem working, but I am definitely infectious,  that I could stay home and protect others. Instead, I know I cannot take 2 weeks off work, so I will call in one to three days, as needed, but then I come in, and everyone gets sick. It isn't a good method. But my current job isnt really one I can do from home either... and the jobs I have done from home weren't good for my health. It would be nice to have the choice."
dragonage,fkbaz8d,t3_fh9xy8,1584029602.0,I definitely am planning another full playthrough......
AskReddit,fk6ltrx,t3_fgi5bd,1583906345.0,"I love how some people are like ""it is a short series so you would definitely finish it."" 

Let me go the opposite. Critical Role. Not tv, but full of fantasy action and drama... unlike wussy TV shows like Star Tek that only have 400 something hours - you have that much time in just the first season. Season 2 almost doubles that, plus there are specials for an additional 130 hrs.  Totalling almost 1,000 hrs. If you watched day and night 24/7 you would have over 40 days of entertainment.  ... so ... if that quarantine turns into a Zombie Apocalypse,  you will be able to keep the entertainment rolling. Oh, and it is still airing, so you would probably get almost another full day worth of watching before you caught up...

... you know, I have pretty much watch 98% of this show. I must have no life. It is great, I highly recommend it."
AskReddit,fk6jskh,t3_fgjgv1,1583904319.0,.... looking through this I realize my name is probably Pandora... because I would literally open ALL of these boxes.
AskReddit,fk6gr7e,t3_fgg2gx,1583901719.0,"Ummm...

Do I need to catch it? Because TBH, I cannot name a whole lot of animals I would be able to catch. And do I need to hold on to them in order to kill them? Because most animals will probably succeed at escaping before I work up the courage to do harm. Also, Is harm required to kill something? Because I dont want to hurt anything soft and fuzzy... or cool and scaly... or fun and feathery... or well... this is the wrong question for me to answer hu?"
adderall,fk6g4i7,t3_fgftd6,1583901209.0,"My doctor told me day 1, she would not give more for any reason... she flat out told me that a big priority when she prescribes it is thar I take responsibility for it. I 100% would not even broach her with it, even with a police report- but I know her. She has strict guidelines and it is one of the reasons I like her. I am not about to ask her to bend.

.... however, I sometimes miss a day here or there. Over time it has added up. I have a few weeks buffer before I run out. ... so if I lost half a bottle I would just have less buffer.

Trick: I dont carry the whole bottle. I have people in my life that I fear would sneak some if they had a bad enough day, and I don't want to be their source. If someone stole my pill container they would get about a weekend's worth at max."
konmari,fk6d51t,t3_fgkaod,1583899009.0,"There is a cost of owning things.

Some are obvious - a car needs to be licensed, insured, gas, repairs... these costs can mean buying a new (er) car saves you money, and letting go of an old frustrating one a budget-friendly choice.

But even smaller things have that....

When you move, it costs money to move everything. Even one across down where you throw things in garbage bags and drive it over yourself.  More trips, more gas. More trips, more time. Time is money. Is the $1 tape worth moving?

Storage costs money, this is obvious if you need a storage unit, or a bigger home... but even without that. Too much food in the fridge makes it harder to keep food from perishing.  Too much in a junk drawer makes it more likely that you go out and buy a second of what you ""need"" because you cannot find it. Things cost money to repair. Difficulty accessing things increases the likelyhood of them getting grimy, and maybe unusable.

My example on this is extreme. My dad is a hoarder. He loves to buy clearance items, pick up things on the side of the road, auctions, etc. He gets many incredible deals for pennies on the dollar. Yet he often spends more at the end of the day at his DIY budget solution than I did when I just called a professional, and had it done at a fair price. He hoards because he ""might need it"" for his next project. 

Some things I keep because I know I will need them. But if I haven't used it in years... If it requires work and money to make it useful again... often it is better to let it go even from a budget POV.

Bringing you joy and also mean the joy of not suffering the pain of not having it."
femalefashionadvice,fk6bnqh,t1_fk6av5w,1583898000.0,"I am  larger girl... so many of my favorites have been from Torrid (plus size store) 

I find that if I buy early to mid summer, those are the most comfy. Early spring goes very cute, but a bit too... perky .... to be comfortable.  Late summer starts getting into sweater dresses and fall stuff that I have a harder time wearing. The best is not ""spring fever"" time, but the ""people are actually going to the pool/beach"" time. 

Sometimes they look stiffer on the rack than they are once you have it on (or one or two washes) Maxi dresses can be amazing. I think one of my biggest surprise dresses was one from Old Navy. I think one of my dresses was from Maurices. They usually arent popular so they arent on the mannequin or front and center... almost every good dress was in the back corner and minimally displayed. Many were on clearance racks.  ... people think dresses are ""fancy"" and the comfy ones aren't people's first choice for weddings or that little black dress... but they are a step up from sweats in style, but (imo) way more comfortable. I almost never find good ones and high-end stores, more likely to find it at Walmart (which I usually avoid shopping at, but I have had historically a couple good dresses.) Not to say they can't,  but they have a higher focus on highly structured dresses, which is not the comfort factor.

I cannot give a store, however, that I would guarantee had some."
SkipBeat,fk3ps1x,t1_fk38fs7,1583842857.0,"I like a lot of these... and a lot of your ideas are exactly why it cannot be an easy resolution right here. There has to be some of these types of moments.

She has to have a scandal, because too much has been said about it being ruinous to actresses. I think things with Sho have to progress more before she can relax with Ren. And Vie Ghoul is not done, he was put in there for a reason - and I dont think his reason has been completed yet. Plus, Moko has been a major but somewhat confusing character recently,  and it is setting something up."
SkipBeat,fk3pfe2,t3_fg7xy8,1583842555.0,"She sometimes has really calm reactions that really suck. Sometimes they are wise, sometimes they are just stupid, but I am not expecting her to run.

I am expecting a calm ""I am sorry Ren, I swore I wouldn't go there until I made it."" Not really confirming or denying her affections. Maybe a ""I am going to America"" breaking of news. ... or maybe she has a burst of honesty. ""Ren, I like you, but I cannot go there. I cannot be that person."". I dont expect a full confession,  but she isnt a liar, she is honest to a fault. I dont think she will tell him she doesn't like him. I am secretly hoping she says enough to (instead of breaking his heart) put him into ""let's charm her"" mode. ... to be fair Ren knows her, and he should know better than to trap her like this (and I think his flash backs are going to make him realize this too.)

... other thoughts ...

Paparazzi catching them as the door opens. Second scandal for Ren, potentially ruining for Kyoko, they are forced apart without her saying much and have to wait until it dies down. She commits full on to America to prove the scandal wrong. The news causes Sho to freak out. Lots of internal processing for kyoko and a role that let's her act out her feelings... Drama drama drama...

... and if she does run, she is going to feel guilty and need to find a way to correct things. It is one of the reasons I lean against running, I think it would actually resolve things faster, because she would have to face things head on to fix the situation. 

... I am really, really, really hoping against the arc of sulking ren because he got rejected and hurt and believing she doesnt like him at all... and kyoko going full denial mode. It is cliche in other things and almost too ""predictable"" for them. They have both grown, and I often find this manga doesn't go exactly where I think it will... and since that is what I think is the most ""likely"" I actually am thinking it is rather unlikely (I hope).

What I want to happen: him not waiting for a response (too much tension and he breaks) and kissing her. For real, from him. She melts just enough for him to realize she is melting... then the inevitable drama to start. I think there is 0.01% chance of that."
femalefashionadvice,fk3o3vk,t3_fg6nkq,1583841325.0,"Dresses!

So many people associate them with being constrained or uncomfortable formal situations... but I cannot tell you how often people have commented one being so dressed up (say for an early AM meeting) and my honest response (which I will say depending on the situation) ""Thanks! It was as close to wearing my pajamas as I could get""

... a cotton dress, some soft cute flats or sandals - pair with a sweater, and you can feel like you are in your pajamas with your comfort blanket and look like you really wanted to make an impression. 

Now I still wear a bra, and I am likely to put on heels. Instead of a sweater I will usually do a blazer or otherwise more structured jacket (but my most coY option is a shawl)... but if you have the build to get away with it, a sweater could conceal a ... lack of support ... and some flats are almost slippers but can still look professional/dressy.

Tips: leg shaving is annoying, but less annoying than tights. Having some structure in the dress does make it look more professional,  but in our culture wearing a dress at all tends to be ""dreased up"" so you can get away with a bit more unconstructed. If it is looking too casual, bump up the jacket (some blazers are really soft) and throw on some accessories (long necklaces can instantly take a shift dress from pajamas to dressy). Having good undergarments make everything better. I would rather have a $85 bra that fits, supports well, and makes everything look better with a $5 shirt. It honestly looks better than the reverse when I spend $20 on a bra (that sucks and I feel uncomfortable in) then $70 on a ""nice shirt"" but I look frumpy because things aren't supported right. Same with underwear,  I look nicer and feel more comfortable in very ""supportive"" $30 underwear and $25 jeans than I did in my  $2 underwear and my $53 jeans. You said you wouldn't wear a bra, so I am assuming you have the figure to get away with it, but you may find an under tank (the stretchy kind that has a bit of ""make sure everything stays where it is supposed to"" type structure) to make a difference in the final look without feeling horrible, but also getting a bra that is well fitted is a million times more comfortable and most women don't wear the right size.. finally, the one I hate ... hair and makeup.  It is impossible to look put together with bed head and tired eyes even in the best attire- but a sleek finish can make ""street fashion"" (which honestly is often horrible clothing) look put together."
