Career,fk3mtu3,t3_fg01rz,1583840076.0,"You are not alone.

MOST people figure it out by making mistake and ending up somewhere they didnt really plan. (Example: my computer engineering degree ended up with me pursing management. Never what I expected of myself even a few years ago, and I never expected me to say ... I really enjoy it.)  My advice: worry less about getting it perfect, and just go with what is working. Maybe teaching is a bad move, or maybe being inexperienced is painful and you just need practice to love it. (Teaching is @&$(king scary) if you love working with kids - early education may not be a bad degree, but maybe it turns into something else down the line. Maybe you end up working for different emphasis that results in less traditional teaching? 

I know I HATE being incompetent or put on the spot. But some of the best rewards have been when I pushed through until they weren't bad anymore. ... and often it got way worse before it got better. I started out with zero stage fright. I could perform in front of anyone. Then I had a small talent show go slightly wrong. Then a solo (cello) judging go slightly wrong. I had an audition fail, but without bravado. Then a solo judging going moderately wrong. Then in a third attempt it went horrendously wrong. Each time it got worse, eventually I got sick and couldn't get on stage at all. I swore off performing. A decade later I am slowly stepping back into spotlight situations (like teaching) and it is starting to get better. The anxiety is lessening. The weight of the past mistakes don't feel as heavy. I actually recorded myself playing the cello, and played in front of my husband without shaking or feeling nauseous. I needed a break from the spotlight to do it again - but it didnt mean I couldn't do it.

... what I don't recomend- allowing yourself to change majors every 2 years. Sometimes it is better to push through and have something to show for your work and come back later if needed. So many jobs now will take a ""good argument for why your degree qualifies."" My biggest regret in education is how many times I switched, time and money wasted. (There ARE benefits, but it came are a big cost.) If I could do it again, I would have picked a major that I enjoyed learning and just do the 4 years, worry about ""the job"" later.

For example... my husband has used his anthropology degree to teach (currently is the chemistry teach in a highscool), work at museums,  and do forensics. He has also considered using it to work at a mortuary- and of course, traditional Anthropology.  [He is a prime example of a liberal arts degree getting put to use... but he also fights for it every job - proving his experience,  proving his value. He took extra opportunities too that he can really talk to, like doing an internship in Romania. It isn't easy for him to put it to use, but he does, and it has worked well for him.]

Since leaving school I have used my degree more for getting into jobs that want tech-competency more than any of the skills I learned in school. The biggest value from my college education was the ""college education"" (meaning enculturing into the corporate world and how ""the system"" works.) And there is real value there. My dad used his degree in accounting as a hobby and pursued jobs in manufacturing. My list of people who used their degree for what the intended is very, very short. (And most are highly specialized and mostly medical. Like my mother who is a pharmacist. )

Don't worry about getting it perfect now. You will get it. It sometimes just takes experience and putting yourself out there. If you like learning education it sounds like you are well into your degree. Something is right - push forward!"
Career,fk0fpcq,t3_ffspep,1583755467.0,"It could be, but it also could not be.

Any job isnt just looking for a qualified candidate, but also one that will mesh well with the team (a huge part of hidden discriminations, but that is another topic.) Also depending on what you are looking at doing, expressing enthusiasm can make a huge difference in your actual execution. This is where that ""could it be an excuse"" comes in. It may be read as a ""We doubt your ability to mesh with the team"" - but that is one scenario. 

My job is in customer service. Not everyone hired is a bubbly big personality love-people kind of person... but we have a higher percentage of them.than the average population for sure. There is actual job-skill related.  Who is going to hop in front of the counter and help the customers first - we want them. Who is going to look for solutions when a customer is being a Karen and turn their attitude around - we want them. Who is going to be able to be on their feet for 8+ hrs and still smiling and laughing - we want them. Someone who comes into the interview and has some technical skill and experience might not be selected if they seem too withdrawn or low energy. It takes 3 months before you even start being useful, and ingesting in someone who doesn't click is a risky move. Someone who seems like they need a job, is willing to work, but doesn't want to fight for a career - they often quit before those 3 months are over. (My job looks entry level, but the people who stay are people who want to move up into management or make a career out of it - people looking for a ""job"" can find an easier one for the same pay and usually do.)  

I almost didn't get my job when I first started for that reason. My efforts to be professional came across as withdrawn. My awkwardness at the interview made them doubt my longevity, and to be fair - I didn't know what I was applying for, so bad on me.  But my technical skills caused the assistant manager to push for me against the other candidates and they gave me a chance. I learned a lot and now come across with much more passion - but even then, my lack of ""hunger"" holds me back a lot. Do I want a promotion? ""Well yes, but I am not 100% so I'm not fighting for it."" - Means I don't get it. The moment I am ready to fight for it, I will get it, and I know it. The fight is exactly the skill they are waiting for me to develop.

Tip: Practice arrogance. Most of us are awkward with self-promotion.  It feels yucky, and we know our weaknesses too well. If you go in with ""integrity"" (translation: being honest about your flaws and providing them without prompting) you will often come across as not really wanting the job, and convincing them they don't want you. If you go in with ""modesty"" (translation: not bragging up little things) then you will come across as lacking enthusiasm. Pretend you are in 3rd grade and you get an award for everything. Brag about every ""award"". Play up team efforts as something you had a big part in. They are bigger than you think, what is easy for you and ""not a big deal"" are often the things that make you good at your job. If it seems silly to brag about them, brag anyway. (Note: professional bragging of course.)"
dragonage,fjsk8a0,t1_fjsjttx,1583597939.0,"It is rather disappointing. They seem very pragmatic,  and blood magic is definitely useful."
CustomerService,fjsk3jg,t3_fejt4l,1583597893.0,"*shakes head*

I never have met as many ""how do you survive the world"" people as I do in the print industry. 

Although I kind of want to pester him with questions now. Where did he want color? Why dose he want color? *sigh*"
dragonage,fjsj2rs,t1_fjqphkz,1583597509.0,"As a blood mage, ai highly encourage you to pick Tevinter.  The Qunari are kind of terrified of you."
Showerthoughts,fjq1fby,t1_fjplhwu,1583565357.0,This type of stuff always make me think of https://youtu.be/8ainB6qnWBI ... which I think is a very creepy song.
NoStupidQuestions,fjo8btp,t3_fecooo,1583522594.0,"Be honest in private. Hinting may not make it through,  and they likely have no idea. Be direct."
CasualConversation,fjln6n5,t3_fdz3v2,1583450027.0,"I sort of do this. But I actually transfer them to real people, so I am an jerk.

I work at a large organization, but am a very small part of it. We have a customer service line, which is where we are told to direct any media, any larger-organization complaints, donation requests, etc.  So... I also transfer ""offers"" to that number. I am pretty sure they have a number that person then gets redirected to and so on. Eventually you should get to the tight department, but ...

There is a almost no chance if you are calling my number to sell me toner, that we will but from you. The organization is big enough that they need big suppliers. Big suppliers need sales people who know how to reach out more directly to organizations like mine. If they are calling my number chances are you cannot supply the volume we need to make a regular contract with you, and everything we order is from our warehouse."
teenagers,fj7gxt2,t1_fj6l5kg,1583091499.0,"Obvious hints are not obvious. Evidence: now husband.

January: He is completelt friendzoned but suddenly I realize I like him. Start flirting, being totally transparent. He is literally hand feeding me at times and I am sure I drove my friends crazy.

May: He is completely infatuated with me (and he admits I had to have been right about this) - but he has no idea. Drives up an hour to visit me every weekend for the whole summer when he wouldn't drive 20 minutes to visit his best friend because ""gas was too expensive"". I cook for him and then we take long hikes in the mountains chatting about everything.

August: He gets a great idea. How about he take me on a date to ""practice"" so he can ask out the girl he actually likes. I turn him down. 7 months of hints and practically ""dating"" and I spell it out for him.

October: He asks me out properly. (3 months of confirming from mutual friends that I meant it)"
longhair,fiy6991,t3_fagc3n,1582833343.0,"Two thoughts... 

(1) In my hair, I found layers did make it look thinner, inspite of what many professionals said. Now it could make it look more full if I did heavy heat styling, but normal brush- product-braid styling looked thinner. I think that makes a difference. 

(2) it looks like your hair has some ""natural"" layering anyway. A stylist who cleans them.up would definitely look good."
coolguides,fixjckd,t1_fix4rcj,1582821412.0,"Even with the best managers... I feel like there is great skill in ""managing up""

I know my (former) boss sucks at scheduling and is likely to forget key shift coverage. So I would read over the schedule and I didnt do it for him, but I would check critical points and email him which ones I noticed. Then, when the shit hit the fan, at least he had the opportunity to fix it.

I know my district manager has X,Y,Z goals and the implementation isnt working the way he hoped. I am a better follower by helping try different methods to motivate or change the outcomes.

I know my (new) boss has a tendency to overwork. She is salaried so she skips lunches, doesn't take breaks and works 7 - 12 hr shifts a week. I sometimes can be a bit insubordinate encouraging her. I pester her to get off earlier, take lunches, delegate weekends. Even bosses sometimes need to know it is safe for them not to carry all the load. She wants set a good example and take care of her employees - and I try to communicate the only way to do that is by taking care of herself too. 

Technically my position is a ""supervisor"" - so I have some level of management expectation, but I am only one level up from the ""bottom"" so it is a careful line between overstepping and being helpful. I am working on better techniques for dealing with both directions. I don't think my boss's job is to be perfect. I think their job is to have a bigger picture view than those on the floor,  and to guide accordingly. Even the best managers will fit a bit into these categories. Steve Jobs was both known for turning around the companies he managed... and being a micromanager. Elon Musk has done some incredible things, but is a rumored scatterbrain.  ... some people's reputation is quieter, but I picture many famous managers and leaders with that ""assistant"" that goes around behind their back fixing up the things they suck at. Being high up and in charge of a lot of things can exacerbate many flaws."
CasualConversation,fixgu79,t3_faclik,1582820155.0,"<3

My first pet after moving out was a German Shepherd. She and I immediately bonded (she is also pretty attached to my now husband). Her favorite place to be is laying on top of my feet. 

Later we got a cat. I have always bonded quickly to cats, so imagine my surprise when this cat bonded to our dog and was quite okay to forgo human attention. We have had him for 4 years now, and inch by inch he is deciding the humans are okay. Last night he didn't run away when I picked him up before bed and set him next to me. Some mornings I wake up with a dog on my feet and a kitty cuddled into my side.

Animal cuddles are my favorite. (Don't tell my husband)"
CustomerService,fisatvm,t1_firozfe,1582681294.0,I regularly get people mad because I cannot help them get through the security on their email. *sigh*
skin,fiqhxcp,t3_f9ae42,1582644687.0,"It might be very similar to what I used to get as a kid all the time but have gotten a few of recently.

Almost like little dry patches, but lotion doesn't touch them...

I am not sure what they were or how to fix them 98% sure they are harmless and it will go away on it's own (if it like what I have)."
therapy,fipkt38,t3_f922o5,1582610092.0,"Depending on HOW you have that thought, it may be normal.

Fantasizing obsessively,  definitely should seek help.

A passing ""dark side of the brain"" thought - normal, inspite of what the above people said. https://www.headspace.com/blog/2015/07/17/should-i-fear-the-dark-side-of-the-mind/

We all have dark thoughts, but judging how real we actually engage with them is another matter. For myself?  I have thought about it. Something about the ""perfect crime"" serial killer thing can be strangely fascinating.  Look how many TV shows we have on that. But if it came down to it, I couldn't pick someone to do it to. The reality lurches my emotions. I am one of the least violent people I know (never owned a gun, am not prone to physical responses - a sarcastic jab is my most likely weapon) 

Please, if you are seriously engaging with these thoughts,  get help. For your sake and others."
TooAfraidToAsk,fin3097,t1_fim5pec,1582554518.0,"That could easily happen at my job, which is a very large company. We have one of the better insurances, and part timers get it too. The lower paid people I have seen recently are around $15/hr. So at 20 hrs a week that is roughly $1,300/month. Make a few dollars less, work a few hrs less, and you are definitely able to have good insurance and make that much. (Note: I live in an area with a higher cost of living. I am willing to bet many areas pay rate is much less also.)"
TooAfraidToAsk,fin2knb,t3_f8ibt1,1582554205.0,".... sort-of ...

I have insurance that pays for some mental health.

I can do an online therapist 100% covered through one program. But it has to be online.

I can get 6 visits a year within a narrow network (not many will take my insurance) that brings it down to about $25 a visit. Most therapists want to see you more often than once every 2 months though. I think my insurance will cover a percentage of ones after that, but it is something like 20%

... so with insurance I could, but I have to fight through the bureaucracy,  and it took me 30+ phone calls to confirm a doctor (mostly a cycle of calling my insurance, getting a list of doctors, calling the doctors, each saying they won't take my insurance, then calling back my insurance. Rinse and repeat.) I could go to. Is can only imagine a therapist would be harder. I know a coworker who struggled through it, and it was a giant mess."
changemyview,fii65ll,t3_f7ys1j,1582417869.0,"One exception to me:

Men dont have to physically recover from the pregnancy,  which is a big deal. 

Other than that... 100% agree. They can help the mother recover too, which is helpful."
AskReddit,fib4mqu,t3_f7aipy,1582314520.0,"Dragon age ... story, characters, lore... love it."
femalefashionadvice,fi933b2,t3_f6ytul,1582254411.0,"To a point...

I definitely find heels that retail at $100-$200 (but go on sale for more like $50...) to be infinitely more comfortable than the $10-$50 heels. After that point.... no.  I have never seen truly high end shoes that seemed worth it.

Real leather makes a difference.
Well design for comfort makes a difference. 

Cheap plastic heels will only cause you pain."
Foodforthought,fi7jzf6,t1_fi7d5sa,1582222825.0,"This is very true, and I have to admit I have been at that advantage from my own family. ... my family isnt ""rich"" as in long international vacations and beach homes and sports cars. But my parents saved lots, invested a little, and made good enough income to not have to worry about paying rent.

When I got to college, my parents were able to hand me a saving fund that lasted me 4 years ... I worked during that time and had scholarships,  but that money was a huge deal.

When I got into a financial struggle in my mid 20s, my parents dropped $2,000 so I could pay my bills, buy food, and have a bit of a buffer to catch up.

When my sister got married and had a kid, but lives dramatically under the poverty  line... her baby still has a safe carseat, medical bills are paid, food is managed. They don't have enough to pull her out of poverty,  but they have enough to shield their granddaughter from some of the impacts.

In the case of genes, my sister has Asperger's- her life will always be a little harder because she struggles to play social games. My family was able to get her early treatment, and most people see her as quirky/odd and she can hold down a job. It is rare to see her get so overwhelmed that she reverts into the rocking or self-injury to soothe, because she has had the opportunity to have support from early on. In another family she may have never got the support she needed to be able to do what she has done. 

I always get to have that security blanket. ""Yes I am going to work hard. Yes I will do this myself and be independent. ... but ... if it all falls apart ... things will be okay."" It has allowed me to take risks I wouldn't have otherwise been able to take. It has reduced stress when crisis hit.

I compare this to my husband. He grew up very poor, and fought his way out. He doesn't trust when money is low - he stops eating which puts his health at risks and lowers his ability to manage it. He isn't willing to take risks. I am struggling with encouraging him to do house shopping with me - it is timez we are settled in one place, a mortgage would be cheaper than rent, and we can afford a good down payment. ... but he is terrified of getting a loan and having the worst hit. He lost his house as a kid.

We had very parallel lives in many ways. (We grew up in the same area, had the same education - many of the same teachers, were viewed by our peers similarly,  our parents were from similar education levels)... I had a financially stable home, he had a financially hectic home. They way it sets us up to make money as adults is astounding. By all accounts he should make more money than me. He works harder, has a master's, provides a critical skill,  and is a white male. I am female,  have an associate's,  work a retail job. All statistics say I should make less... but I have always made significantly more than him. I play the money game better, it is less scary. I see investment where he sees risks. ... and a lot of that is the glass floor. If I am wrong, we wont starve, we won't die we wont be homeless. He sees homelessness as a real fear, those risks aren't worth that."
Advice,fi69orz,t3_f6nv4o,1582184429.0,"Adding to the ""me too"" s.... seemed harmless bug. Wouldn't worry right now."
diet,fi2g514,t1_fi28u9o,1582078984.0,"Maybe unhelpful
...

What our nutritional labels call a calorie is a kilocalorie. We just lost the ""kilo"" over time.  So dont stress, it is a bad naming convention. In diet no one really deals with with a true calorie. (Too small to be relevant to anyone on daily eating.)"
AskReddit,fhrmr3c,t3_f4gsxv,1581830820.0,"I frequently injure myself stupidly,  but usually do not end up in the hospital i can black it out from shame. So narrowing it down to the times when I ended up in the hospital....

I was about 7 (so forgivable for some stupidity) and my parents were gone on the first no-kid trip since my little sister was born. (... you know already I still hear about this every Christmas...)

I was told: no playing in the truck.

The babysitter was told: no playing in the truck.

So I was playing in the truck.

I was inside the bed, and I decided to open the back side to get out easier instead of climbing over the side. 

Flipping over the back as it opened, headfirst into the pavement was definitely faster. Success!

... waking up in the ER with my very weary parents standing over my bed... less successful."
DMAcademy,fhpds8g,t3_f40udv,1581787302.0,"It really depends on the DM. It sounds like you handle it well, but it is all how you olay them.

If they are getting killing blows or major damage on enemies... you might be overdoing it.

If they are saving your player's characters on a regular basis you may need to tone down the monsters. The DMPC shouldn't be the fail safe (often... I am not opposed to the rare saving).

If they are trying to be center of attention in everything, it will be hard for.other players to shine. You already play all the monsters and regular NPCs... having a DMPC can turn into ""DM universe""

The DMPC is a bad way to railroad/direct players, if you need to do it try other methods. Players will look to the DMPC for that, so making them extra clueless or worthless at metagaming might be important.

.... but I have seen it turn out super well too. Someone who adds a bit of lore, or would make sense to come along. 

One example of DMPC in the dungeon crawl is my DM is doing Dungeon of the Mad Mage, which is a heavy dungeon crawl (even with interesting lore) he is implementing Halaster at higher levels to torture us, mess with us, play with us ... ""help"" us. I am 98% sure he is much heavier handed on Halaster than the module suggests (I have not read it to be sure, for obvious reasons). He isnt there 100% of the time, popping in and out, but he is using it to break up the drudgery and add extra RP - and we have been having a ton of fun with it. Halaster is our favorite. Right until he kills us probably."
adderall,fhhfp8h,t1_fhgq5eq,1581603087.0,"Definitely!  I had a bit of an adjustment period, but that was mostly the Adderall.  I have been on Adderall about a year and a half, and the combo for a  year. It works great for ME."
adderall,fhgfs20,t3_f32824,1581565991.0,"This is my combo.

20mg xR, and (I think) 300 Welbutrin

There  is some potential interaction if it gets too high, but when I brought it up to my doctor and pharmacist they waved it off as a CYA warning label for most people. It does carry some valid risks though."
TooAfraidToAsk,fh9t9mq,t3_f1pkzp,1581389086.0,"Perspective? I see extroverts getting dirty looks from their SO saying ""please shut up now"" ... or from other extroverts saying ""whisper"" all the time.  ... I think they get shamed too."
LifeProTips,fh81ccq,t3_f1mnsf,1581349819.0,"This helps me a lot.

Doesn't kill my procrastination, but it does help me manage it. 

At work I also have this rule ""I will make sure to get done anything that I would be angry my next shift if it isnt done."" Leaving projects in hope that another coworker will do it (or even delegating and hoping they stick to it but not verifying) is doomed to disappointment.  Obviously to prevent never leaving there are exceptions, but usually I only leave the if I am clear (1) it has to get done, no exceptions and (2) the people left are proven capable of that task.  ... same idea, but involving more people. Sometimes you need to protect future you."
ENFP,fh80a2z,t3_f1rhsk,1581349124.0,This is not limited to INTJs... I get anxious when someone says someyhing positive and it stops regardless. Or if they never say something positive. Or if they say too much positivity
DMAcademy,fh6ylsx,t1_fh5xvnk,1581309478.0,"I think you need to talk to your players independently to answer this...

....

""I want to make sure I honor your best experience in this game. There are some unintended conflicts between some of the character designs and I want to make sure no one is shorted. Please tell me more about what is important to you about your character. ""


This phrase gives no direct hint about what the conflict is. Based on how they answer you can have relevant follow up questions...

""What if the resolution to your identity ended up being more comical rather than dramatic, would that hurt your experience?""

""How important is originality vs exploring the idea of having to hide your race?""

... then mix in some things that are relevant to the characters but maybe not relevant to this conflict for some misdirection (but also great as a DM to help build character backstory)

""So what part of this sentimental memory is important? Is it the loss or how the character grew?"" 

.... .... ....

Not only does this help characters develop, it also helps you decide what works best for the players.


If you do make them switch it up - I would reject both and tell them exactly why.  ""Two players came up with the same idea and to honor your own experiences I want you to create something new so that they dont complete."""
