schizophrenia,fqoox7d,t3_g36kqu,1589520656.0,"I love your art so much! It really resonates with me.

(Sorry this is such a late comment I'm not on here often.)"
mbti,fqk4nk5,t3_gg3jgh,1589420102.0,As an INFP I am very happy. :)
AskReddit,fqbnzz8,t3_ghu612,1589240593.0,"The protagonist(s) loses a loved one and sheds like one tear before completely moving on. By the end of the movie they're just celebrating with everyone else and have no signs of grief or PTSD at all. In real life, losing a close family member or friend is incredibly scarring and would be extremely difficult to compartmentalize even in a crisis."
pokemongoyellow,fqb9ej1,t3_ghtwtn,1589232886.0,"WOW. That's awesome, congrats!"
mbti,fpu6wly,t3_gev2hz,1588905981.0,Can you do more?? I NEED.
COVID19_support,folnf51,t3_g7m028,1587866068.0,I'm so so sorry. I'll pray for you and your dad.
niceguys,folmnnt,t3_g7r2k7,1587865577.0,"Good

Good

Good

Y I K E S"
u__-x_-Y--_,fnlalcj,t1_fnhwo67,1587050121.0,"It's okay, don't be sorry. Just glad to hear from you."
u__-x_-Y--_,fnhupx2,t1_fndxd3y,1586969168.0,"I understand that feeling, but what if the new existence is worse? I'm just glad to hear from you again."
ParanormalReddit,fmswg2o,t3_fx671x,1586363066.0,Looks like n art project in the same vein as the channel Meatsleep... or could be a legit killer's video like (possibly) the channel Deeper.
elderscrollsonline,fmctul6,t3_fuee4s,1585952732.0,I like how the first three are basically the same cake with more layers and the most recent ones are *drastically* different. Makes me feel better about only having the last two!
Christian,fmbpium,t1_fm8iafq,1585930849.0,"Well, we found out he does not have Covid, just a virus. However, he does have type 2 diabetes, which we found out through the blood work. So, at least we know what is going on so we can treat that!"
Christian,fm16j0j,t1_fm164tp,1585672900.0,Thank you so much.
elderscrollsonline,flpeh7s,t1_floy2ni,1585357591.0,Same!
elderscrollsonline,floxw2k,t1_flold1o,1585347715.0,"Okay, thank you! That helps a lot. Now I'll have to work towards that achievement."
elderscrollsonline,flol148,t1_floeej5,1585340352.0,"I did, it comes out hot pink. :(

Thank you, though!"
stevenuniverse,flbmwfw,t3_fnuoby,1585007998.0,"I was a bit disappointed, tbh, but I still love Spinel. Like, she was clearly trying to help him but I don't think she realized how bad off he was. I think that's one of the major themes in ""Future"", though-- no one really realizes what Steven's going through and try to make it better with shallow advice. 

The main CG's are totally lost when it comes to handling his issues, Greg is oblivious, Jasper's advice only made Steven worse, and the diamonds are as bad as Greg at figuring out something's wrong until too late. The only ones who really know the seriousness of Steven's problems and recognize his trauma are Connie and her mom, and Steven pushed them away too.

So, yeah, Spinel was annoying, but she was no less helpful to Steven than anyone else in ""Future"" has been. Honestly, even though I understand it's a plot device I'm kind of annoyed at all of them right now."
Coronavirus,fkxvzte,t1_fkxvhfr,1584636498.0,"Yeah but more than half are just ""Oh I sneezed a couple times this week so I had Covid19"". That's why I'm specifically asking for people who have been diagnosed. Thanks for the link, though."
Coronavirus,fkxum4n,t3_flad2s,1584635744.0,"People who have been diagnosed with Coronavirus, what is it actually like to experience?"
weddingshaming,fkxrwdb,t1_fkvb841,1584634236.0,"That's what makes me so angry. People who don't care going out and then getting sick. Then when/if hospitals get overcrowded the poor immunocompromised and elderly people will be put aside to treat the younger/healthier jerks because ""they have longer potential lifespans"". 

I wish care could be denied to people who went out and socialized recklessly. Like, ""Oh I see you went out partying in a crowded bar during the social-distancing effort? Sorry, you're on your own."""
Christian,fkxkhd0,t1_fkwznfr,1584630040.0,Thank you!
Coronavirus,fknjhai,t3_fjfth9,1584367262.0,As a Christian this makes me absolutely livid. He's putting his entire church at risk because of his selfish false doctrine.
infp,fkmekat,t3_fj6kwz,1584327110.0,"I understand if you're being forced to work. The people I get mad at are the people who keep whining on FB and other outlets about how it's all ""blown out of proportion"" and that they're going to do what they want because screw everyone else. They don't want their social lives to stop on the off-chance that someone could... you know... die."
COVID19_support,fkez1a5,t3_fhu9ws,1584123665.0,"Yup, same. My husband has a compromised immune system and I'm just treading water, trying to keep my head above the anxiety."
mbti,fkeru1i,t3_fi1j3u,1584119362.0,INFP = yellow (though I also really love pink and brown)
AskReddit,fkenn6n,t1_fkea76c,1584116915.0,"Well, in lore, ""ghosts"" are human spirits while ""demons"" are fallen angels. So, yeah, pretty significant difference I'd say. At least in my religion.

But hey, thanks for the sarcasm stranger!"
AskReddit,fkeko2j,t1_fi610cr,1584115154.0,Gotta kill fast!
AskReddit,fkctnrs,t3_fhnmo9,1584060894.0,"Reusing my story from another thread because I didn't want to re-write the whole thing:

The apartment building where I grew up definitely had something wrong with it. It had been built in the early 1950's by my great-great uncle, and I lived there from the time I was 7 until I was 25. Over the years I had several major experiences and many minor ones, and there was a general consensus among the long-term residents that bad things were afoot.

My first personal encounter with the entity (because I don't believe in ""ghosts"", but I do believe in demons) was when I was seven. I was sitting on the kitchen floor playing with my Barbies. I just happened to look up and there, on our indoor porch, stood the lower half of a man. I can still remember exactly what ""he"" looked like: lean, with tan pants, shiny brown leather shoes, a tan blazer, and white cuffs with gold buttons and fair-skinned hands. He seemed like he would be tall, but again, no upper half to be sure. He stood as if he were regarding me silently. Then he opened a see-through copy of my front door and walked out, closing it behind him.

The last time I saw him was about 3 months later. I was outside with my mom and grandmother and, again, just happened to look over and see him standing at the corner of the building. His hands were clasped behind his back, and even though he still had no upper half, it looked like he was checking out the area of rot at our foundation. When I told my grandmother about him, she believed it was the ghost of my great-great uncle.

After that, I went years without seeing or hearing anything. Then, in my teens, things got bad. My mom and I would both feel a cat jump onto our beds-- pressure, footsteps, everything-- but my cat wouldn't be there. We'd go out and find him fast asleep on the couch. Then the footsteps began. Heavy, pounding footsteps in the unfinished area of attic over my room. For context, no one could have been walking there. My mom accidentally stepped on that area and put her foot through the ceiling. There was only insulation and ceiling tiles, no floorboards. Anyway, every night for roughly two weeks, this thing would stomp above me for at least an hour. I would get up to make sure the attic was shut, that our neighbors were asleep, that I was not being pranked. As I lay there in bed afterward, I would listen to the steps go in ways that it would take two people to successfully emulate-- from one wall to the opposite wall without crossing over. Starting in one corner and then stopping for a second only to pick up in a completely different corner without any way to have gotten there. As soon as I would wake mom up it would stop, only to resume after she went back to sleep. Finally, one night, I convinced her to come into my room with me. It started up again and I woke her. I could tell she was scared, but she said, ""Maybe it's squirrels?""

As if angered, the entity reacted. My bed shared a wall with our living room, which was decidedly unoccupied. It was as if a huge man had balled his hand into a fist and slammed it as hard as he could against our wall without breaking it three times. My mirror rattled and we felt the shudder of the blows. Mom was up for the rest of the night with the lights on, and it didn't happen again.

The other most overt incident happened around that same time. I had a thick (old style) tv in my bedroom with a little Spongebob plushie sitting on top. I was watching something as I was trying to ignore the footsteps and fall asleep. All of a sudden, I saw with horror that my toy was moving closer to me-- off the edge of the tv set. It fell to the floor and I sprang out of bed. Thinking maybe I'd just put it too close to the edge after all, I turned on my light to check.

Nope. There was a thick trail in the dust where this thing had been slid from the center of the tv top to the front. There was even a perfect roll of dust on the floor next to it. Shaking, I stuffed the plush into a box and went back to bed... but not to sleep.

There were more things. One incredibly scary thing that I don't want to post because it involves someone I know and they might not like that I posted it. However, I think this gives you a general idea of how creepy this place was."
AskReddit,fkct0yq,t3_fhnzqi,1584060483.0,"The Queen = Very sad

Kim Jong-un = Dance party

Trump = Mass hysteria in the USA as one side parties in joy and the other riots in grief. Other countries look on with objective satisfaction."
AskReddit,fkbmfor,t3_fb2bve,1584035711.0,"Had a brief crush on a guy in high school who seemed to have everything going for him: handsome, from an upper middle-class family, straight-A student, track star. Found out later that about a year after he graduated he murdered a guy over drugs.

You think you know someone."
AskReddit,fkbls3x,t3_fdc5jh,1584035359.0,"My father and his friend worked cleaning a hospital morgue for a while. Two of the notable stories I was told were these:

1. Dad's friend had his first night shift down in the morgue, which already creeped the poor guy out. He began mopping blood off the floor only to hear a soft moan behind him. He turned around just as a heavy old man's corpse sat up and groaned. The guy didn't even remember leaving the morgue. He ran so fast that one second he was looking at the dead man, the next he was at the top of the stairs. Never did night shift after that.
2. Different co-worker was supposed to transport an amputated limb from the morgue to the furnace out back, which was at the top of a steep hill that had been covered with snow and a thick layer of ice from freezing rain and sleet the day before. Dad was at the bottom of the hill and, thinking it would be funny, the dude waved the amputated leg at my dad. Then he dropped it, watching in horror as it skidded all the way down the icy hill into a small crowd of visitors-- which included some of the hospital's investors-- who screamed bloody murder and took off in random directions. He was fired, but later considered the story in itself to be worth losing his job."
AskReddit,fkbkp2o,t3_fcuc9g,1584034777.0,"Someone has probably already said this but ""Pumped Up Kicks""."
AskReddit,fkbeskk,t1_fjiv4l4,1584031688.0,"For some reason this story bothers me more than any other on this thread. 

*Corpse juice...*"
Ghoststories,fk76rsk,t3_fgui8j,1583929307.0,"Simple: he was a killer who also dabbled in necrophilia. He may have been thinking about abducting her too and then changed his mind. He apparently had the fungus from making out (or more) with the corpses in his room. He was probably using the ID of a previous victim or, like you said, a fake one."
AmItheAsshole,fk3pfp7,t3_fg84io,1583842563.0,"YTA

So, my husband's best friend is a woman and if we had had a traditional wedding she definitely would have been his ""best woman"". She's engaged and he's already agreed to be her best man at her wedding. And you know what? I'm fine with that. They love each other like siblings and I 100% trust them. You're being super insecure and entitled. Him having a ""best woman"" doesn't mean she's more important to him than you, it just means she's important to him-- and that's FINE.

Little advice tip from someone who's been married a while: Having a jealous, possessive attitude like yours is ultimately going to drive your husband away. You need to trust him and not assume that every woman in his life is going to steal him away from you, or that the fact that he cares about another woman as a friend is somehow siphoning his love away from you. Be graceful and accepting and allow him to have his best friend be his best whatever, regardless of what's between their legs."
infp,fk144mf,t3_ffq2xo,1583772013.0,"It's true. I've been called ""cold"" before for not crying at movies, when it's just that I don't really get sucked into things that aren't real. I'm also super awkward at comforting people and don't generally like it when others cry in front of me. I'm an INFP to the core, but I'm not overly emotional."
mbti,fjsvn33,t3_fem76j,1583600873.0,"INFP: Leadership means 0% to me. The only time I actively ""want"" a leadership role is when I know everyone else on the team is incompetent or lazy and nothing is going to get done unless someone steps up-- and, even then, I only take on the role if team failure affects me personally. Otherwise I just sit back and watch the chaos, enjoying the fact that I don't have to try to control it."
mbti,fjkolp8,t3_fd0b0j,1583430840.0,"INFP

1. Story ideas/daydreaming about stories
2. Obsessively worrying over deep existential fears (""Will my loved ones die before me? How will they die? Will I be able to go on without them?"" etc.)

And sometimes I get distracted by the present moment but that doesn't usually last very long."
infp,fjacblz,t3_fbknco,1583170588.0,Mistyped as an ISFP but lacked their intense competitive streak and overall daring-do. Took multiple MBTI tests and was diagnosed INFP. It made total sense and felt completely right.
interestingasfuck,fja9spb,t3_fc155e,1583169288.0,I need one.
elderscrollsonline,fj6ohg2,t1_fj4m3p2,1583076726.0,That's what my main is and I love playing her. She's a straight DPS with a smidge of healing in case we get in over our heads in a dungeon. I run her with Valkyn Skoria and Phoenix gear from Imperial City and she's a beast now.
elderscrollsonline,fj5b1yf,t3_fbc8rp,1583028460.0,This is so sweet!! I'm going to have to do this with my main! :\`)
elderscrollsonline,fj5apyl,t3_fbc5bi,1583028242.0,Yup! That's why my main has all ten of her outfit slots unlocked.
elderscrollsonline,fj589l6,t1_fj3obat,1583026567.0,The thiccest :)
elderscrollsonline,fj3rbkt,t1_fj3pzgu,1582991362.0,Here's the info on it: The Heroic Personality is the DLC loyalty reward for the Shadows of the Hist DLC. Entering either the Cradle of Shadows or the Ruins of Mazzatun dungeons for the first time will reward you with the personality.
elderscrollsonline,fj3m194,t1_fj36u9b,1582987545.0,"Hahaha, it's still nice to go to the Crown Store and be like, ""Now I could if I wanted to..."""
elderscrollsonline,fj3lxsy,t1_fj3k0hf,1582987470.0,"Lol with, I don't mess around in Cyrodiil. Outside of Cyrodiil I kind of half & halfed it. I liked using the clues and I'm decent at it."
elderscrollsonline,fj3iok0,t1_fj391oy,1582984811.0,Go on smaller campaigns during mid-day (I get on right after work around 4-ish) and generally AD will have the map. It helped that I was home sick yesterday lol. I had the whole day to kill.
elderscrollsonline,fj3ikjm,t1_fj38381,1582984715.0,"Daggerfall area number 8: ""Search near the cliffs...cliffs...cliffs""."
elderscrollsonline,fj3ii75,t1_fj3ew2b,1582984659.0,"Yup, that's the best way. AD had most of the map yesterday so it was relatively easy to get the last ones I needed."
elderscrollsonline,fj3igfy,t1_fj3anxz,1582984617.0,Now I'm never not going to call them that lol
elderscrollsonline,fj3hqzf,t1_fj37usr,1582983992.0,Lol SUPER distracted
elderscrollsonline,fj3hpu9,t1_fj3eryl,1582983963.0,Heroic personality
AskReddit,fj2rex7,t3_fb084s,1582951558.0,"For me? Spicy salmon maki roll, without a doubt."
schizophrenia,fiuf8bh,t3_f9ft7r,1582740265.0,"Reddit is not an entity. It's not trying to communicate with you. It's a website where a bunch of people who don't know each other write and read random crap all day because we're bored. 

So, yeah, don't worry. You're not missing anything."
schizophrenia,fiuevfb,t3_f9l7pv,1582740069.0,"I'm going to be blunt for your own good, even if you probably won't believe me: it's a delusion. You're just rationalizing a psychotic episode/hallucination. My mom has schizophrenia and does stuff like this all the time. She thought someone was poisoning her and all of a sudden had a bunch of physical ""symptoms"" that matched being poisoned. Except, no, she wasn't being poisoned.

The fact that you a a firm believer in aliens is why you think you were abducted. You're hallucinations matched up with something you believe in strongly, just like my mom's do.

So don't worry, you weren't abducted. Just go to the doctor and get checked out. It sounds more like you have some kind of gastric infection or something."
Ghoststories,fitwa1i,t3_f8n1i0,1582730748.0,"It's funny, I had a very similar experience growing up, except that my mom and I stayed at a residential nursing home (even slept there) during the week and went home on weekends. Nothing spooky ever happened, but it gave me a huge respect and appreciation for older people."
Ghoststories,fitu642,t3_f9bhsv,1582729482.0,The photo makes me feel uneasy too. I think it's the woman in the middle. She just... looks off for some reason. Plus she's looking directly at the camera while the other two kind of tilted their heads.
AskReddit,finn0pc,t3_f8pr0l,1582566301.0,"It was me, alone, in my college building one night. Class had let out about half an hour earlier and I was still waiting for my ride. We had a crazy janitor at the time who was known for being ... well, crazy. He'd recently been reported for harassing female students and, since I was one of his favorite students to harass, he thought I had reported him (I hadn't, yet).

So I was looking out the two full-length windows for the car when I see in the reflection behind me the janitor slowly coming down the stairs. He was staring at me and clearly furious, and the fact that he was being so quiet alerted me to the fact that he was probably trying to take me by surprise. We were alone in the building, or at least too far away from anyone for me to get help.

So I whirled around and cheerfully began to make small-talk with him as though I'd been expecting him to arrive, all the while edging towards the door and praying my ride would hurry up.

The whole time I talked, he just stared at me with wide, unnerving eyes, clenching and un-clenching his fists. He brought up the report of harassment threateningly and I kept redirecting. He also kept looking around, as if to make sure we were alone, and when my ride finally came he backed off. Still, he continued to stare at me as they pulled away.

I'm still not sure what he would have done to me if he'd thought I was driving myself home that night. He later got fired for threatening another student and I was asked to give testimony to a lawyer, so that was interesting. 0/10 would do again."
AmItheAsshole,fgmjau9,t3_ezb2co,1580925714.0,"NTA

Stand your ground and stay home. Amy is being absolutely awful and, frankly, isn't worth the trouble.

Also, your hair is gorgeous."
weddingshaming,fggnj85,t1_fgghcky,1580765555.0,"Again, with more emphasis, YIKES."
weddingshaming,fggfklg,t1_fggek8h,1580760826.0,Yikes.
AskReddit,fggc2h1,t1_fgg54uk,1580758702.0,"Thank you for sharing this with me. My mom has been diagnosed with schizoaffective disorder and suffers from hallucinations when she's off her medications, so I am trying to understand what she goes through.

I'm sorry you go through this."
AskReddit,fgfr6ta,t3_exvrzj,1580745763.0,"Completely covered my co-worker's Harley motorcycle, which was his father's... who had died 4 months previous... and which had been at the front of his funeral procession... in vaseline and baby powder. It cost him almost $200 to have it professionally cleaned.

We are still friends."
AskReddit,fgfqlzf,t3_ey5tm0,1580745389.0,"Maine. We have a huge tourist industry and that's fine, but now uber-wealthy people have moved in and blocked off large parts of our state so they can have their ""little slices"" of Heaven. 

We hate those people."
AskReddit,fgfotlq,t3_ey2of6,1580744223.0,"Well, based on who I love: Axe deodorant, gasoline, and spicy food cooking.

Based on me (so, what they smell): Coffee, lilacs, old books."
nosleep,fgfohx2,t1_fgfkchv,1580744007.0,"Yeah, it's that and genetic. My mother wasn't the most sane person herself."
ESOVogue,ffzqru6,t3_evv3qp,1580390156.0,Amazing.
ParanormalReddit,ffqpgqt,t3_et1ud0,1580140586.0,"Try moving your bed away from that wall, if you can. I don't know how your room is laid out, but I've heard of this sort of thing before-- one spot in a room affecting people's dreams."
nosleep,ffqp7pn,t3_euox36,1580140413.0,I'm hooked.
oddlyterrifying,ffgxlq2,t3_etgcky,1579917664.0,Hahahahahahaha**NO.**
AmItheAsshole,ffcyhmj,t3_essrci,1579809887.0,"YTA

Look at it from her perspective: she's been growing out her naturally red hair for years now and doesn't want to ruin it for a ONE DAY AFFAIR. I've grown my hair out for years and never dyed it, never will. If someone asked me to over their wedding photos I'd back out because A) my body, my choice and B) a color scheme should never involve a person's natural physical appearance. That's basically the same as saying, ""Do you think you could bleach your skin for my wedding? The color scheme is cream and peach and your dark skin would really clash in the photos. You won't bleach your skin? How about painting it instead? No?? Why are you being so unreasonable?!"""
elderscrollsonline,ff5zqyh,t1_ff5ys76,1579615368.0,Thank you!
TheArcana,feuyn5o,t3_eqj99y,1579391237.0,I've been wanting a route for this guy from the beginning. XD
niceguys,fetp0c7,t1_fetoo14,1579377831.0,"Me too. The internet's a scary place, especially for kids."
niceguys,fetop9o,t1_feto3jj,1579377710.0,"I apologize too. I'm sorry you've gone through all that, and I wish you the best."
niceguys,fetne8o,t1_fetmica,1579377179.0,"Well, now that I have context, I get it. You could have just replied with this instead of everything else that you did. 

For your information, I'm a school teacher and have worked with kids for 10+ years. I saw that you were a man making a lot of comments to a young girl and, having no trust for anyone on the internet, decided to intervene based on what I knew to potentially protect her from a creepy white knight who might have not been what he seemed.

Sorry that I offended you. I really didn't mean to. I'm glad you had good intentions. Not everybody does."
niceguys,fetll4b,t1_fetkks8,1579376633.0,"I am failing to see your logic here. Me calling YOU out makes ME a predator??

Look, I honestly never expected it to go this far but holy crap, it has. You sound like a miserable, rage-filled human being."
niceguys,fetk1uy,t1_fethl8j,1579376206.0,"LOL I'm not the white knight here.

And I wasn't calling you a pedo, just saying you came off as creepy. YOU chose to take it to extremes, insult me, and just generally make an ass of yourself. I'm not ""playing a nice guy"" either-- I'm a WOMAN. Who is creeped out by you, A MAN.

And now, y'know, just put off by you as a person."
niceguys,fethg9v,t1_fetfpak,1579375517.0,"WOW. 

The ""victim"" card? And calling me a dumbfuck? You're a grade-A jerk. I wasn't trying to upset you, but now I honestly don't care."
niceguys,fetfdsk,t1_fetcxa0,1579374897.0,"Um, no. I'm not saying her choices are right. I think she could get herself into danger too. I'm saying that the level of research you've done into her background to prove your point borders on creepy in itself. If I was a man trying to warn a 13 year old girl, I wouldn't do so by revealing MORE information about her to the internet because, by doing so, I would think it would make me look like a potential stalker. 

I'm not calling you a stalker, just saying that I'm put off by the level of interest you're showing in this young girl. If I was her, it would make me more determined to ignore you on the basis that you would strike me as being just as dangerous as the guys you're telling me to avoid."
niceguys,fetcpz0,t1_fet0cc7,1579373994.0,"Like I said, not trying to upset you."
niceguys,fesxc7k,t1_fessf9l,1579369883.0,"I feel like these NiceGuys want to live in a world where women have to be branded like cattle as somebody else's property so they don't waste their ""precious"" time on us. 

Because basically we are cattle to them."
elderscrollsonline,fdn2rq4,t3_ely4i9,1578575564.0,"I was in a group where the tank did this once. I mean, they were an amazing tank and they were pretty much solo-ing the dungeon-- so why didn't they just solo it? There were two newbies in the group and I basically had to be the tank AND dps to get them through because the true tank was trying to be speedrun it. I was also doing the quest, so it was fun. :)"
niceguys,fdmzfio,t3_em5ml0,1578572383.0,"I don't think your grandma would approve of your language or your tone, young man."
niceguys,fdkwv49,t3_eld75x,1578512815.0,"Severus Snape, is that you?"
niceguys,fdkl24i,t3_elqqlr,1578505769.0,Uuuuuuuuuuuuugh
