niceguys,fdkisxw,t3_eluk77,1578504653.0,"Huh, I'll have to go apologize to my husband for all the men I've had a conversation with since we started dating because apparently I've been a huge whore."
menwritingwomen,fdk6gc3,t3_eicszj,1578497156.0,"The only description I actually like is ""taxi yellow dress"". 

That's it."
menwritingwomen,fdjw8tp,t3_elh8cz,1578489533.0,"""She was twelve""

""She was tWeLVe""

""She was TWELVE""

Do you even see what a fricking pedo that description makes you??"
mentalhealth,fdjs6na,t3_eld9uc,1578485551.0,"I still love sleep, but when I was 24 I was so depressed that I used to try to sleep all day (if I had no work that day) and all night. It got so bad that I would take antihistamines and sleep aids because I'd have slept enough to have too much energy to fall asleep again on my own. I love my dreams-- often they are like dark fantasy novels. Back then they were so much better than my waking life of being emotionally and verbally abused that I couldn't stand to be out of them for long."
AskReddit,fdgwvw8,t1_fdg3p42,1578410321.0,"I was homeschooled because I was bullied in school and suffered from extreme anxiety, so homeschooling worked for me. As an adult, I've worked in the school system for 10+ years! Just got hired as a full-time teacher this year. 

Homeschooling works when the parent(s) are doing it for the right reasons and are properly equipped to handle the challenges of keeping up with the public education system so their children don't miss out on anything."
niceguys,fdgj4hf,t3_ej6j3u,1578398913.0,Holy crap.
niceguys,fdej3ya,t3_ejjmra,1578340113.0,Women complain because they have to deal with incels like you.
niceguys,fdeiz0c,t3_ejkfa0,1578340030.0,"I hope this guy gets reported to the cops before he, y'know, becomes the crazed murderer he's gearing up to be."
niceguys,fdeg4as,t3_ejfdmk,1578338281.0,"I stare at girls on the street. Just stare and stare but they never stare back. They only look away with uncomfortable expressions on their beautiful faces that I stare at. Why do they not stare back at me? Why am I told that I am a creep? Why do they call the cops? Why do I have all these restraining orders?

I do not know, but I will not give up."
niceguys,fdedgjj,t1_fd5lidv,1578336621.0,Hahaha wooooooooowwwww
niceguys,fdeb3qd,t1_fd4ozup,1578335148.0,"You're called whatever name makes the guy feel vindicated about himself in that moment. He likes to imagine that the only possible reason you could *not* be interested in a gem like him is that you're just a massive b\*tch who thinks you're better than everyone else or a whore who isn't worth his precious time. Either way, you only like a hot Chad who abuses you because you're too stupid to choose a ""nice guy""."
niceguys,fde9ced,t1_fd51srb,1578334035.0,If I had the coins I'd give you a platinum for that.
niceguys,fde75pr,t1_fdcdg7d,1578332660.0,"I feel for you, man, but you're blending in HARD with the r/niceguys right now."
