NonBinaryTalk,evt2fzq,t1_evsyei5,1564761394.0,"The struggle is real! Lol
I talk too much, so TL;DR is at the bottom lol. 

My back's and arms' measurements certainly have gone up almost an inch! Not my waist or hips, though, but I'm not focused on the latter two. I don't know if I'm just seeing what I wanna see, but my back is a little broader than I remember :3 But my shoulders look more narrow, now? I've always had a naturally drastic V-taper until two years ago, it seems. 

Last school year, my weight steadily went from 122 to 132, but went down with every vacation. Now that it's summer break, it wont go lower than 125-127. Then again, that's still within my usual range, so I'm not sure if I ""actually"" gained three pounds. Besides. 

That kind of weight gain is normal with age, right? Because your metabolism slows. I'm just now turning 18, but ""freshman 15"" is real. I don't know if what I gained is muscle or fat. But the muscles in my arms *definitely* got bigger; their size when I flex increased a very good amount. Still got stubborn tricep flab, so don't know about them, but my biceps have blown up. Is that gain or ? I dunno. Because at rest, my arms look muscly with squishy triceps, like they always have. 

My mom sometimes asks if I got my hands on hormones as a half-joke, though, lol. She says I'm looking more muscular than she remembers. More lean than curvy. 

TL;DR- All *I* know is that I have been working on my body every other day for almost 12 months, and my measurements and weight definitely have gone up. I *want* it to be muscle, but it very well may be fat. Should have taken progression pictures. Lol."
legaladvice,evs215q,t1_evs1vz8,1564726570.0,"Thank you for the source, this helped! I will most definitely look into this. Need to sit down and calm down, and think. I guess I'm panicking or angry and am just forgetting all my options. Thank you so much."
legaladvice,evrzkvj,t1_evrz55y,1564723834.0,"She isn't going to prostitute herself. That wasn't one of our options to begin with. I've kicked him out of my house once and made him cry twice, now, and certainly will do it again.

We'll find a way to make it work. I'm on the fence about student loans, but we said we'd try other options first. She's almost 60 years old and is still paying off her student loans, and doesn't want that for me. I don't want her to deal with this for four years. 

So we're both probably gonna work two jobs, and she was already planning to forclose. Ugh. Please wish us luck. 

I reposted this to r/legaladvice to see what we can do about my father. I'm just itchy and nauseous digesting all of this. I can't imagine how my mom dealt with this bullshit for over 18 years. I just want to get him away from her for once and for all. Because everything she tried failed-- since I'm his child. God, she's sacrificed so much. 

But. This helped! Thanks for reminding me of another-other option. I guess we can call it that? I kinda never counted how many ""other's"" are on the table, hehe."
legaladvice,evryxc5,t1_evryuoy,1564723152.0,"No. He'll call her pet names, or forward her links to romantic songs and music videos and then lies and says it was a typo or an accident."
Advice,evry7tm,t1_evry5di,1564722414.0,"Helped. Thank you! I've been looking for the right subreddit for this post, and I think this is it."
traaaaaaannnnnnnnnns,evrxh1h,t1_evrxdbw,1564721669.0,I would recommend (even though you already have it lol) ^_^ It's one of those games that feels better when you take your time playing it
traaaaaaannnnnnnnnns,evrtg75,t3_cktuup,1564717982.0,Read Only Memories is $5.99 and worth it!
Androgynoushotties,evrhrns,t1_eswael7,1564708711.0,Amen
relationships,evrdt61,t1_evrde9m,1564706225.0,"Okay, I'm starting to get a better visualization of what I need to do. Thank you so much for your help."
NonBinaryTalk,evq7otq,t1_evnsl86,1564688052.0,"I hope the same for you, too. All of us, really. I'm happy groups like this exist on the internet, because it really goes a long way. 

I think I have a better ""plan"" of how I'm going to go about things with my psyche, next session. 

I want you to know that you are and will always be yourself. There's no way that you're being ingenuine, even when your life is in a transitional stage. You can't ever not be yourself. I'm sorry and understand that internal conflict can make that statement seem false. But if you need to talk to anyone, my DM is always open, as well. The internet is such a good communicative tool!

And I'm so glad you found your happy medium-- that's wonderful! And even better that you can dress as you please, safely! I'm happy for you, friend. 

Thank you for your kind words and support. Best wishes to you and yours!"
unpopularopinion,evpncwg,t3_cif7v6,1564676827.0,"I'm an atheist as well, but I don't agree with calling belief stupid. It's a belief for a reason. You ""believe"" it. It isn't necessarily true, it's just true to *you.* 

I've been called stupid for being an atheist enough to have picked a fight. 

Polarizing statements and actions aren't the answer to human grievance; collaboration is. The Golden Rule all day long, baby."
unpopularopinion,evpmzz7,t3_ckautx,1564676636.0,"I agree. Healthcare should be a right, but it's capitalized, and sometimes kept from people based on social biases. And that's just the USA. In other parts of the world, people don't even have the resources to stay healthy at all. Which is what makes it a privilege."
unpopularopinion,evpm54q,t3_ciu7m7,1564676175.0,"I disagree. 

As a female who grew up as a child of a single mother, whose father did not pay child support, *and* an sexual assault victim, statements like this make me feel nauseous. Not gonna lie. 

It doesn't make a difference. I wasn't aborted, but I wasn't planned for, either. My father did not pay child support. My mother has been harassed by him in and out a courtroom, for over 18 years. He earns six figures as a successful judge and *still* refuses to give me a dime. Unless that dime was for ice cream during visitation. I'm lucky he agreed to that. But my mom had to beg a judge for visitation, too. That man didn't want a kid-- that mad didn't want to *see* me until I turned 18. But I'm lucky he ended up liking me, because some dads run away, and then never even try to come back. That isn't any mom's fault. 

That being said. I agree about not having to pay child support if a child doesn't exist. That's dumb sh*t. Who even made that a thing? Like ?? What sense does it make? Like if someone can explain the purpose to me, I'd feel better about my opinion. But I never did research on it, so excuse me if I'm missing any details. 

I also agree that if the father is in the picture, that it should be worked out between the two. I don't agree with gatekeeping abortions, but ""to abort or not to abort"" is a conversation the parents *should* have. 

However. 

If my assualter got me pregnant, should I have to live with a child who bares his face? Should I not cut him off for 18+ years? Should he tell me what to do?

What if a doctor warned me that if I were to have a baby, I would die? If I would bleed out, if my immune system were to weak-- if I had any rare but possible condition, that made childbirth deadly for me personally. Let's assume the father is in the picture, and the baby was conceived on purpose, and parenthood was mutually planned for. I doubt the daddy is any less torn than I am. But I shouldn't be able to say no to childbirth, still? 

I had a pregnancy scare last year with my boyfriend. We've been dating for two years, now, and we have high regards for one another. I was hiding my late period from him. But I stressed out, and he knows me well, so he knew what was going on. I implied ""other options,"" and he said ""fuck other options. I'm gonna make this work."" (And I knew he was a keeper :3) I wasn't ready for a child, but I didn't want to abort, either. But then he said ""Unless you choose to. That sort of thing is your choice."" And I was so surprised! 

I asked him what he meant and he explained that *I'm* the one who has to walk around my school with a baby belly, whose body will change forever before I turned 20, who will graduate high school with a baby belly. I have to figure out how to buy myself maternity clothes. Id have to change my lifestyle for almost a year as a high school senior. I have to deal with being looked down upon. Who has to come up with a diet plan that nourishes a fetus. Who has to deal with being cooed at. With being shamed and humiliated by strangers and family members. 

At my high school, teenage mothers would be harassed constantly. Kids would joke about punching them in their stomachs. It's high school and terrifying. 

He said it isn't an expectation for me to be okay with dealing with all of that, especially not when we don't even know if we'd be financially ready for a kid in 9 months. It'd be his child, but these things build up bitterness, and tear the happiest of couples apart. So he said it was my ultimate choice. I just have to communicate my thoughts. And promise to never try to hide something like this from him again. He was hurt that I did. (God, I love him so much!! Getchu a mans like him!!) 

And then I got my period two weeks later, and he roasted the shit out of me lol. 

But yeah. We had safe sex and got plan B and everything. We didn't do anything wrong or too late. I wish the stigma around teenage pregnancies would disappear, but that's too much to ask. 

Bottom line. My mans explained ""my body, my choice"" perfectly. It doesn't mean that there's no communication whatsoever. It just means that you're gonna be sick and fat for 9 months straight, ma, can you physically and emotionally handle it? Because mothers kill their babies for all sorts of mental issues, that start with watching their baby belly grow overtime. You have to be in a good place, mentally, too. Not just financially. If you're not ready, you're not ready. 

I'd rather abort than develop post-partum mental illnesses due to the stressors of physically carrying a child; or miscarry because I can't take maturnity leave from school; or be negligent because I can't work and care for a baby and finish my education, all at the same time. I'm not the only person who's like this. 

The mother has to be both physically and mentally ready for the baby. Not just financially. If they aren't, and they can't or aren't willing to make some changes for whatever reason, then the fetus' wellbeing could be in danger. Which is why the option to abort is on the table. That's it, that's all."
unpopularopinion,evpi2b7,t3_ck6q5i,1564673938.0,"A lot of recent episodes are quite critical; I watched so many new episodes yesterday and the series has been making a lot of political statements. I haven't watched many cartoons lately, but it's made that if you want it to be mindless, it's mindless. If you want it to be a political cartoon (or you simply are thinking about what's happening,) then it's a political cartoon. Many cartoons are made like this for several reasons, I believe. So for that reason, (call me biased,) I just agree to disagree."
u_commoditylad,evp0wam,t1_evoe8si,1564663430.0,I totally forgot to join a bullet journalling community on Reddit lol. Will do!
u_commoditylad,evp0upf,t1_evoejmp,1564663398.0,I'm glad I could help you out! : )
BipolarReddit,evnr01r,t1_evgzv6g,1564630345.0,Yes! I shall DM thee promptly!
NonBinaryTalk,evnqx0p,t1_evnldte,1564630295.0,"I'm so happy that it worked out for you, that's so great! 

I will definitely bring up clothes shopping again, this next session. I just gotta stop pussyfooting every three seconds. Maybe I just need to be comfortable with being open?

Thank you so much for your suggestions and support. Honestly, I consider myself lucky. Or fast thinking? I got kicked out at first. But I did what I had to do to not let that be permanent, which at the time, was to just do whatever I was ""supposed"" to. So I lived with my grandma for three days before I came home. Nothing bad happened, just lots of crying and yelling. Which sucked. Like I looked in the mirror and threw up, since I had to change a lot about my appearance for months, for anyone to buy the ""act.""

Which is probably part of why I pussyfoot so much about how I see myself today. I know my own truth, but I'm deathly afraid to come out to literally anyone. Even allies, even LGBT folk. Like my heart and stomach drops, I get sweaty and dizzy, the whole nine yards. But general anxiety about coming out isn't at all uncommon, I don't think.

I think that whole experience itself was more buried than addressed, so I should talk about that if nothing else regardless. It's all connected, so either way works ^_^ the experience socially *jacked* up my freshman year, but made me a lot stronger as a person. It helped me become who I am today, I wasn't physically harmed, and I love myself. So I think it's got a silver lining. 

Thank you for talking to me, and thank for your suggestions and help again! I don't think I would've seen my freshman year as a stepping stone to my transition if we didn't have this little chat of ours : )

(Egads, I type/talk so much, and am sorry you were bombarded with so much, in such little time. Thank you for your respect, time, and patience, my friend!)"
relationships,evhdvp8,t3_cjsil0,1564524832.0,"No it is not normal. 

It's kind of crazy (in a good way) to see how perspective changes your opinion. God, I know what this is like. I always doubt myself when my mother upsetedly blows up my phone or makes meaningful threats, because I forgot or missed a call or text. What she says makes my points seem childish, and what her points seem correct. I feel guilty and overwhelmed and do everything to pacify. It's hard to admit but that's gaslighting. 

Seeing myself in the situation, I sweep it under the rug to deal with it another day. But seeing somebody else-- somebody older than I am, coming close to move out-- I can't stress how important it is for you to stop being afraid. Easier said than done, but you're already a responsible young adult, moving out of the house. 

Let her know (not aggressively, but not passively) that taking control of your life is a part of it. And if she justifies her actions with ""You *do* have control, I'm just worried for your safety"" talk, calmly tell her how you feel. Write and proofread a letter if you have to avoid even slightly raising your voice. I know it might be a passionate subject. But no matter what, no matter how peaceful and nice things are between you two at the time, *do not let anyone tell you how you're supposed to feel.*

I am in the exact same situation as you, and I want you to know that being gaslighted with every slip up is not fair. Do what's right by yourself; if you don't want something, you don't want it. And if you do, you do. The only thing that can make you cruel, ungrateful, or inconsiderate, is the deliberate action of being cruel, ungrateful or inconsiderate. Not the boundaries you want for yourself. So set them. And don't let anything convince you that it is anything but absolutely healthy to do so. 

Good luck and Godspeed to you and yours."
BipolarReddit,evh40jt,t1_evfmjv3,1564520308.0,"Amen to alla that, pal. Keep up the self care!"
BipolarReddit,evfl43j,t1_evf901b,1564497365.0,"That's so great! I'm happy you found something that is helpful and works for you, and I wish you well!"
NonBinaryTalk,ev2mzgi,t3_bw12jo,1564180003.0,"1. I choose they/them pronouns because he/him and she/her both make me feel extremely dysphoric. Like. With this kind of dysphoria, it's the same kind of cringe you get from a nickname you outgrew. But amplified, and it feels undeniably false. 

2. Personally, I'm in a place where I'm both confident and closeted. So I question my identity and presentation rarely these days. I do whatever the f*ck I want and don't have to justify it for any reason, so long nobody is effected. If someone asks about my experience then I'll answer; I've realized I was non binary for five years and my ""gender thoughts"" have been consistent throughout my life. Learning that being non binary is thing and is okay to be just helped me accept my dysphoria. 

3. If I like someone, then I like them. I'll do what I can as their significan other to make them happy. Not responsible for their happiness, but I want to help push them to be their best possible self, and vice versa. Same as the almost anyone else. 

4. As a fellow artist, and as a Black non binary person, I. CANT. FIND. ANY. STORY. TROPES. Because non binary folk and culture are so appropriated and misrepresented, and *not enough people takes us seriously because of it,* I hate it when a character (or YouTuber *COUGH COUGH*) turns their struggles as a non binary person into their personality. I am not my dysphoria. Or my skin color. I have hobbies and goals outside of transitioning, and I have a life. Yes, my struggles are real and exist and hijack my life at times, it is not the only f*cking thing I do with my time. 

So all in all just don't forget we're people, too. Have the character aspire to be something like a teacher or a doctor or a dancer. Anything that suits them. I didn't have someone like that to look up to growing up, because all NB YouTubers at the time talked about was trans problems and binders. Not that that's bad, but that's literally all there was. Not enough representation is my one frustration, which is where misrepresentation comes from. Because all you see on media is someone frothing at the mouth about how their cashier called them a ma'am when they dressed entirely feminine that day. Not that it isn't okay to feel dysphoric about it, but, like ??? It's kind of expected?? No offence but nobody can read minds. So people see these sorts of things go viral, and then they don't take *me* seriously and it is so unfair. 

So that's the thing I don't like seeing. 

Good luck!"
NonBinaryTalk,ev2kezr,t3_c0a4x7,1564178604.0,"I wouldn't worry so much about labels, as I would about doing exactly what feels comfortable and natural, instead of what's uncomfortable and unnatural. Just be your genuine self and all will fall into place."
BipolarReddit,eu7fall,t1_eu60d15,1563529406.0,Many thanks. To you the same.
BipolarReddit,eu5r4xo,t3_ccxgew,1563483501.0,"I sure did let little triggering things entirely hijack my mood, but sure did *not* let my mood hijack my behavior, thus hijack my visit with my lovely dingus boyfriend/his wonderful family. It's going great!

I've been making myself walk away instead of feed into the triggers by blowing up or self harming. At most, I've been snarky in response to unusual comments, instead of explosive. And honestly, what an improvement."
witchcraft,etuqbn0,t3_cdlfi6,1563217832.0,"I was in a similar situation when I was first began practicing witch craft. How I didn't let it stop me was a combination of two things:

1) just ignore it. Don't address the psychology behind it, just keep swimming. 

2) logic my way out of it. The only way to stop being so afraid of the unknown, is learning about it. Things become less unfamiliar and mysterious the more you understand it."
