tylerthecreator,f2phtfx,t3_btd5pj,1570343596.0,"I think “gun” is emphasized (like in the track) because Tyler is alluding to hate crime and police brutality. A lot of the lyrics of “A Boy is a Gun*” do, but I doubt anyone who’s never had the “police can and will kill you at any second because of you skin color” conversation growing up, with an adult in their life. In other words, if you’re white and haven’t been exposed to other cultures and financial situations, you prolly don’t see that connection. If you’re Black it might hit home for you.

I am Black, grew up in a violent, Chicagoan neighborhood and spent high school in a nice ass suburb. What I’m saying is I’ve seen both sides of the fence so don’t come at me with some “uwu you dont know wut ur talking about tee hee hee.” And don’t come at me with reverse racism bullshit because I’m making you uncomfortable with my opinion and experiences. 

Racism is Social Darwinism; it’s believing in the concept of ‘race,’ a correlation between genetics, intelligence and behavior. Therefore, there are superior and inferior races. Saying what is *deadass* your reality isn’t racist. So don’t be that dude who says that it is.

We just use ‘race’ interchangeably with ‘ethnicity’ so we don’t look use ‘race’ with a superior-and-inferior sort of way, we just use it.

Anyway. To me:

- “you so motherfuckin’ dangerous” alludes to wrongful convict and racial profiling. Bc Black men are especially ‘dangerous’ to the majority of the US’s population (AKA white people). That’s why the 13.something% of us is more likely to die, more likely to get the death sentence, more likely to be sent to jail even if we’re innocent. And that’s just Black people. This type of discrimination applies to other minority groups as well.
- “all these other n***** lame as fuck we show em no resepct” implies that those who lack material possession (AKA the poor AKA LOTS of minorities) aren’t done justice. Nuff said.
- “take your hoodie off” is a part M A N Y “the police can and will kill you at any time” conversations, I promise you.
- “diabetes to the first degree” is ‘murder to the first degree’ because diabetes can be deadly and ‘first degree’ is part of a sentence
- “No, don’t shoot me down” reminds me of ‘Don’t shoot. I want to grow up,’ which was a writing program in 2012. Chicagoan teens affected by gun violence wrote their stories of trauma and paranoia and stitched them together to share with our governor. I don’t know much more about it, other than there were billboards of it all over my neighborhood. The violent one, I mean. It didn’t slow down police brutality and gang violence, because it’s such an unsung thing. Which is why it’s important for songs like this to exist, and for interpretations like mine to be shared. This perspective doesn’t get the attention it needs, except for in echo chambers of conversations, which makes it even harder to solve problems like these.
- “I want you by my side/keep me safe” conceal and carry.
“You could be dangerous to me or to anyone else” might be referring to conceal and carry, gun death by suicide, and racial profiling.
- And when I say “gun” is emphasized, not only does Tyler describe “you” as a gun without calling him a gun, but “a boy is a gun*” gets extra bass. Not to mention, the vocals build a major 7-flat-5 chord, instead of a major 7, like the sample. Let’s not ignore that deep, heavy bass that lets you know that something dark lies beneath the surface. Plus, that flat 5th is anxiety inducing. And if you aren’t into music theory, you can Google it. 

And of course this all has to do with romantic heartbreak, as well, like all of the above has said, it’s Tyler, the Creator. Everything is a double entendre, you just have to catch it. 

I’m tired but really want to put my interpretation of this song out there. I haven’t found one like it and think that representation is important, so I’m commenting on here. I’m in the process of writing a full analysis (for an English class) so I’ll explain in depth-in depth there. It’ll be on my profile when I’m done and SUPER super long, because I’m passionate about social justice *and* music. : )

Peace."
BratLife,f2drfja,t3_cn4bd7,1570162329.0,"Act like I'm too overstimulated to follow directions, so that he ends up overstimulating me even more as 'punishment' >:3

Nothing is more delightful than getting *yanked* into doggy by the hair, bc my arms ""gave out,"" and I simply can't hold myself up anymore. Hehehehe."
BipolarReddit,f22lipl,t3_dbbyb7,1569891520.0,"""but let's not talk about that"" whenever I bring up sexual trauma"
SubredditSimulator,f1xg1pp,t3_dausem,1569797845.0,"WHAT IS THIS SUBREDDIT. MY BOYFRIEND RECOMMENDED ME TO FOLLOW IT, SO I DID. IT'S BEEN MONTHS, NOW, AND I STILL DON'T EVER KNOW WTF IS HAPPENING HERE"
ftm,f1vfoa4,t1_f1py8bj,1569770313.0,"You sure will, ya twink"
ftm,f1oczsk,t1_f1obj0y,1569641270.0,"I know exactly what you mean, ya twink"
ftm,f1ocyne,t1_f1oajnb,1569641240.0,LOL that's so cute!! Omg that's so wonderful to hear
ftm,f1ocx7j,t1_f1o4fh9,1569641204.0,"That's so cute!! 
And yesssss oh my gosh it's great!!"
ftm,f1ocr8v,t1_f1o439m,1569641056.0,Aayyy
ftm,f1o3rjp,t1_f1nzakj,1569633861.0,"Exactly! Like. Oh my gosh! Haha I can totally relate to that! 

Like. I'm still a guy regardless of how feminine I am. Instead of one of Da Bois categorizing me as a woman, they categorize me as effeminite, like wbansnajaisjnana!!! It just makes me (a twink) super duper happy and even less apologetic about being myself lol"
ftm,f1ny0bk,t1_f1nv96y,1569629422.0,"I'm so happy to have him in my life. Will do.

And thank you!! : )"
ftm,f1nxwhp,t1_f1nvz50,1569629338.0,"I know, right!!"
NonBinaryTalk,f192etg,t1_f189ac1,1569266928.0,"Thank you very much; I had no idea about spareroom.com.

I just talked with my aunt and she's ok with me paying a little rent for her basement until I can move out-out, if my mom does end up kicking me out. I'm just scared. And hope she doesn't give away my dog. Hahaha. (You can laugh with me. I'm just nervous laughing through a screen because I'm terrified ahahahaha!)

But I'm going to be alright. Thank you so much for your support. Thank you so, so, so much."
BipolarReddit,exro8kg,t3_cu4kt9,1566519943.0,What helps me is watching animations of what happens to the on a cellular level. Grossing myself out by watching all the germs and functions that dance all over us at all times.
BipolarReddit,ex2uija,t1_ex1fqaw,1565975518.0,What an excellent idea! I never thought of it that way! Thank you!
menstrualcups,ewz8jqo,t3_cq61xb,1565892570.0,"I have the same experience since using the Diva Cup!

I Googled it a while back and this isn't uncommon. I *believe* I read that majority of menstrual cups create a light suction, and so do others. 

I think some article a gyne wrote said that it isn't impossible for the period to quite literally be sucked out of you, thus shortening your bleeding time. Period symptom(s) intensity and duration depend on the person; some people feel better, some feel worse, some feel no different."
BipolarReddit,ewtygc8,t3_cpym65,1565757654.0,"I've only smoked or eaten an edible during either during my hypomanic or stable times. Never while I was depressed, or even generally discontent. Not on purpose. I just don't smoke much. 

While hypomanic, I just think I'm God. I can do anything. 

An example was my first edible, Junior year. Taffy. Split it with a pal. 

I wrote a 6-paged researcg paper for an AP class that explained why over population doesn't actually exist (and that relocation would be an easy fix if it weren't for financial and social hurdles). In forty five minutes. I scored a 100%. 

Got a perfect score on a test I knew nothing about, the same day. I made my BS make genuine sense for the first time in months. It was just chicken scratch-y. 

Friends told me I got on a table and rapped about immigration rights non stop during a history presentation. I believed I was an all powerful taco. (Yes, a taco.) That everything I saw that happened, happened because I *let* it happen. That I, the meat, was surrounded by the world, my shell. And everyone around me will be ground corn, soon. Metaphorically. 

I felt like I controlled everything. So I did whatever came to mind, the second it came to mind. Drew a lot. Ran into a wall. Drummed on lockers. My powers justified why I could do whatever I wanted. Why I was so powerful and merciful to not kill everyone around me with a snap of my finger. Which I remember to be the reason behind my giggles. Grandiosity. 

This was all one day.

My then-friend who was my height, my weight, and an athlete, are the other half of the same edible. He didn't do none of this shit lol. He laughed at everything and ate a lot. Felt good and relaxed. 

When my overall mood is stable, I pretty much act drunk, I think? After typing it out, I think it resembles drunkedness.

While stable, my senses are just heightened and I'm less alert. In a moving car, I feel like a vessel full of water. Everything tastes and feels HD all of a sudden. My limbs feel weighted. I can't comprehend speech or movement until the effects begin to wear off. I get super mellow and super horny. Restless. And nobody could ever know any of that unless I said. Being high becomes a secret I can't hide for the life of me, which is what I find so funny, then. 

I was high with my boyfriend and two of his friends. I wouldn't stop talking or laughing, when his friend's dad called. I laughed harder when my boyfriend gently shushed me, so he pressed two fingers to my lips and then to his own, smiling. God, I love him. For whatever reason, I thought ""what if I sucked on his fingers?"" and then immediately sucked on his fingers. He shivered, looked at me, and then just held my hand. He kissed my cheek, said to wait until the friend got off the phone before I finish my story, and I was quiet and even happier and smiling. I don't know if everyone experiences weed-impulses like this but yeah. Out of body-ish. 

This all sounds funny and stupid as hell but yeah, man. I personally love weed. Calms me down overall. Makes me let go. But I can let go *too* much, rather quickly. I'm afraid of thinking something dangerous, and then immediately doing that dangerous thing. So I try to put myself around someone I care for, who cares for me. 

I know I *already* think in a nutso-boing-boing kind of way. Gettjng high blurs the lines between my beliefs and my intrusive thoughts, which turns my every thought into an impulse. That is *not* good for *many* reasons. 

So I do my best to indulge in modesty, and exclusively in safe spaces."
college,ewtv3z7,t3_cpypc3,1565754658.0,"Many call me cute, then assume I'm a stoner because of my outfit. Some mistake me for an eccentric Spanish teacher. My boyfriend says I dress like an anime character 24/7. 

Nonetheless, I dress. And I look and feel good to myself, which is the only thing that matters to me personally.

Don't nobody give a shit lmao"
detrans,ewc39dq,t1_ew9mq78,1565277132.0,"I'm so glad this could help you, and I'm glad it was a good read for you!

But when did I talk about girls putting makeup in middleschool? The pink fingernail polish thing was how we paid homage to Leelah Alcorn. I don't know if that was worldwide, but it was certainly citywide for my town, it seemed. I didn't mention putting on makeup at all, I don't think."
detrans,ew6f9m0,t1_ew6ezv4,1565166563.0,Alright. I agree. Thank you so much for the advice!
detrans,ew6f6oc,t1_ew6dk5s,1565166447.0,"Thank you for your input. That's a thought I've been chewing on for a while. 

Gender expectations never *actually* effected my way of living. Aside from the uniform thing, I mean, but not because ""only girls wear skirts."" Skirts are cute. I just can't stand how they bring out my leg's curves and make my shoulders look narrower. Once I gain enough muscle to be mentally comfortable with wearing them, I'll wear 'em more. 

But yeah. Unless I had to, if I didn't/don't want to do something, I wouldn't/won't do it. If I do/did, then I will/would. Unless I legit can't. 

I expected I'd end up having an Adam's Apple, deep voice, and an angular structure ""at the end"" of puberty, as I thought existed. But it doesn't work that way so no change happened. 

Gender roles didn't make me feel uncomfortable, because I was always comfortable with my interests and personalities as a girl. I didn't feel distraught or conflicted, personally. I didn't even think about what it's like to be a woman vs. what it's like as a man then, and still don't. Both have pros and cons, in my experience. I can relate to all kinds of things-- we're all just people-- but still don't see myself as either. 

And I was sexually abused for months, while living as a trans man. I likely would have been raped on my high school campus, then, if timing was slightly different. I learned that people are just assholes with no specific target, sometimes. But I'm 18 and don't know everything; haven't seen everything. That was just one bad experience.

I experience dysphoria and resonate with ""non binary"" more than I do ""woman"" or ""man,"" God knows why. It feels like I'm being honest with myself and others for once, instead of like I'm hiding. Which is what living as a woman, or as a trans man, both felt like to me.  

I'm going to continue to rule out any other unaddressed issues or possibilities with my therapist. I appreciate your honesty. Thank you for reading all of what you read, by the way, that's extremely selfless of you. 

(God I talk to much!! lol so) Thank you for your time and patience. I'm sorry if this was a selfish post and/or comment. But I digress. I honestly believe we need to have more of these kinds of discussions."
traaaaaaannnnnnnnnns,ew3l6td,t3_cmm4dd,1565084571.0,BRO I LITERALLY WAS *JUST* LOOKING FOR BOTW LINK-INSPIRED WORKOUTS LMFAO
Androgynoushotties,ew3kzm4,t1_ew3imwu,1565084277.0,he asks how you're doing
ask_transgender,ew34bgj,t3_ckwc2i,1565063767.0,Soren?
unpopularopinion,ew2e7oa,t3_b6otj1,1565044511.0,"As a non binary person (I'm being serious) I partially agree. I have a 2-part TLDR at the end bc I talk too much, and I have a lot to say about this topic. Lmao. 

This is such an appropriated identity; too many tomboys confuse clothing preferences for identity, and then try to get attention for it. It's unfair for *us* as trans people, because so many people don't take us seriously. Again. After decades and decades of fighting for positive representation and inclusion. For our rights. And now a bunch of people go and mess it all up. Not because they're young and cringey, but because too many people turn being trans into a bandwagon. *God,* I can't stand it, either.

Don't get me wrong. Doing stuff to discover yourself, and doing stuff for attention, are two different things. Both happens in many aspects of identity. Gender identity is just a popular subject these days, which is why so many kids and people are making it bandwagon to hop on. Or, ""transtrending."" It's upsetting and toxic for multiple communities.

Trans people experience gender dysphoria with their secondary sex characteristics, and how they're perceived. It is distressful, uncomfortable-- I could talk all day about mine. You look in the mirror and can't recognize yourself; it's not about being fat or skinny. Your body was just structured entirely differently than you imagine, and you constantly have to deal with it. Hence the need to transition. The need to change your biology, pronouns and adjectives. 

Because clothing isn't definitive. Cis and trans men wear feminine things and are still men. Cis and trans women can wear masculine things and still be women. And there's always androgynous apparel. Everyone is still themselves regardless of their clothes (and hobbies.)

Clothing and societal roles are social constructs. Sex is biological. Gender identity combines biology with socialization. 

(Which is why all these little kids need to stop claiming to be transgender *solely* because they like androgynous shit. It gives us a bad reputation and embarrasses them in the long run. Even worse, if they *do* medically transition and don't need to, they're stuck with dysphoria for the rest of their lives.)

Non binary people (speaking from my experience) experience dysphoria from both directions. It makes you feel dysphoric to be perceived as a man, and dysphoric to be perceived as a man. A wardrobe change isn't enough; because there's still the social and biological dysphoria that clothing can't change. Hence the preference for androgynous pronouns and adjectives. Clothing, again, is not definitive. So clothing preferences varies from person to person.

Imagine feeling like a freak your whole life. Because you've dealt with dysphoria for years before you even knew what ""dysphoria"" means. But you don't identify with your sex-assigned gender, but you don't identify with the opposite gender, either. Until you finally find a word that doesn't make you have to pick either one of the two. Doesn't make your skin crawl. ""Non binary."" ""Neither identifying as a man nor a woman."" They/them. It doesn't make you cringe, it doesn't make you feel like you're lying, and it's possible. 

Now this part is even more personal. Aside from wanting a penis, my dysphoria is the exact same as majority of trans man's. And even there, not all trans men want penises. But all trans men see themselves as men, are comfortable with being refered to with he/him pronouns, and with being called burly things. Me? That makes my skin crawl just as much being called she/her or a woman does. And having the word ""non-binary"" to define myself is what makes me feel empowered about that discomfort, instead of like an awkward subcategory of ""I'm not cis? But I'm not trans? But that's ridiculous because I can't just be neither?"" Like. I feel at peace with myself, now. I don't feel like I ""have"" to be a man or a woman if I genuinely am uncomfortable with calling myself either.

I do doubt myself. Maybe I'm a trans man, but am simply not used to being called a man. I don't know. It's a process so I'm not too worried about doing anything, but figuring out how to alleviate my dysphoria at the moment. (And the rest of my life. And how to transition from college to real-adulthood once I cross that bridge. Lol)

I've lived as both a girl/young lady, *and* a transman for years. Why I identify as non binary is because it simply suits me better than the former two, and doesn't make me feel dysphoric. Just feels right. And I don't go abd turn it into my personality (like many ""transtrenders"" seem to) because I don't want attention for it. It and my transition are quite personal. I'll share my experiences in discussions like these, but not out of hypocrisy. The only thing I tell people is what my pronouns are; because I was diagnosed with a mood disorder, and don't want to have a bad day and then mentally break down over a stupid easy fix like pronouns. That, and people just can't read minds. 

However, I have trouble telling people my pronouns because I've had several bad experiences with doing so. People laugh in my face, people abandon me, waited outside my stall in a public restroom-- I was kicked out of my house at 14. And then I had to go through behavioral therapy ""to get fixed,"" which obviously didn't work. There are people who don't belief I actually exist, and then force that belief on me. So I'm constantly afraid. ""Transtrenders"" are not helping. 

TLDR part 1. 
• I'm transgender because of my dysphoria, and my need to socially and medically transition. Because if I don't, I'll continue to be increasingly miserable. Positivity doesn't help. Believe me. I've tried for twelve years straight. It sucks. 
• My dysphoria is dysphoria because it is biological, constant, is diagnosed, it effects my mood, I feel it all over my body, and clothing alone can't alleviate it. So yeah. As soon as I rule out all other possible causes with my therapist, I'm transitioning. The fact that tansitoning is a permanent thing I take seriously, is the only thing stopping me from buying androgel off Amazon to slather it all over myself. 
• I am not a tomboy, I don't simply prefer to appear androgynous, I don't have ""Tumblr softboi UwU"" aesthetic. At all. I'm not doing this to be cute. I have severe dysphoria, and simply do not identify as a man or woman. 
• I'm terrified of how people will treat me because 1, I'm trans *and Black*, and trans *and* Black people get hate crimed/I constantly get the ""Black people don't do that, you just want attention"" speech from family and peers. And 2, non-binary people are highly appropriated so people don't take us seriously. So!

TLDR part 2. To shorten my point further; I *do* in fact exist, and I just wanna live my life, man."
Androgynoushotties,ew14krk,t1_evxqy34,1565014997.0,<3
Androgynoushotties,ew02bnk,t1_evzy65s,1564973741.0,Hiya!
unpopularopinion,evy44r3,t3_clp3h7,1564921708.0,"I agree and vibe with this so much. Not a parent, and it's a beautiful thing to want to do nice things for your kids. I'm not judging. But here's my experience with toddlers at an aquarium. Aquariums aren't historical, but they're just as ""look don't touch, walk don't run.""

I used to work at an aquarium. A crying father came up to me to tell me that he cant find his two sons. So I tell security and panic and briskly walk around with the dad, looking for them. 

They were right behind us the entire time. Following us. Sniggering. They thought we were playing a hiding game of some kind. They were 3 and didn't know any better. Bless their hearts. But poor Dad.

It makes a good story but goddamn we thought those kids got snatched. Museums and museum-type settings kinda suck for toddlers and their parents; little kids wanna play and be kids, when they're just not supposed to do that at a museum. It's stressful for them and for whoever is looking out for them. That, and the world is full of shameless wackos. So just be aware and be physically and mentally ready for that."
DiWHY,evy35lw,t3_clser3,1564920608.0,Where the dimples tho
imsorryjon,evxnbcm,t3_clqaew,1564898851.0,"I've watched one of these toads (starts with an S) give birth and I felt nauseous for the rest of the day. The image takes me back. My skin is crawling and I want to cry. Excellent, beautiful work. It's stunning. (Not bc I *really* don't like this kind of amphibious creature. I thought I'd never see it again. ;-;) (No kidding but still lol)

The answer is no. No Jon can't kill them fast enough. He will barf or cry or run away before he sees even three lil babies pop out of their holes. (UGH I FEEL LIKE IM GONNA BARF AND IDK WHY LOL.)  I promise you he will."
Androgynoushotties,evw4wpz,t1_evvikm8,1564855207.0,"No, he's mine, I stole him back"
DiWHY,evudnv9,t3_ckdqu6,1564792341.0,I saw this on a Snapchat story at like 2AM the other day. Thought it was just a memory of a weird dream until just now. But nope. Welp!
DiWHY,evudenr,t3_ckxfmp,1564792138.0,Actually I kinda fucks with it
Androgynoushotties,evtyhcn,t1_evtpkrv,1564781316.0,Thank you!
BlackPeopleTwitter,evtju3q,t3_cl3vyi,1564771941.0,Fuck pharmaceutical science. Nigganometry is my new major.
NonBinaryTalk,evti1yy,t1_evt7ei1,1564770849.0,"Oh my gosh, I think that hit the nail on the head! Thank you so much! 

I've been trying to eat better, but honestly, mostly carbs and fiber take up my diet, which isn't bad for my lifestyle, because I move a lot. Meat makes me feel sluggish. But not a lot of meat isn't good for muscle growth, because, as you said, the body needs *protein.* Duh! It entirely slips my mind when I shop and cook for the week! I don't know *how!* Lol

I'm not a vegetarian or anything, I just never realized that I am *not* much of a meat/egg eater, now that I take a step back. So thank you for guiding me to take a step back!

I read your reply and mixed protein powder with juice this morning. It's good! I'm not gonna drink it with juice every other day because it's a treat for me, but I know why I've hated protein shakes this whole time, now. Cuz I've only had it with water; when I simply don't like it with plain water! Little things! Lol. I'll be sure to add it to something every other day. 

TLDR THANK YOU SO MUCH! I think you're right about needing to add protein to my diet (I totally overlook adding enough protein when I meal prep, somehow, lmao). So I'll do exactly that! Thank you!!"
