PiercingAdvice,fokjxsc,t1_fokeldo,1587843458.0,Okay. Thank you!
PiercingAdvice,fok5auy,t1_fkz1heo,1587835671.0,"I'm sorry I didn't reply any sooner, but your advise was the same as my new piercer gave me! (At least before quarantine fully hit the USA) Thank you!"
PiercingAdvice,fojdrh8,t1_fojcy5h,1587817894.0,okidoki- thank you!
PiercingAdvice,fohn508,t1_foh9xp7,1587768785.0,That's so smart! I'll do some research before I try to convince my sister to do it for me lol. Thank you!
PiercingAdvice,fkynnlw,t1_fkykymj,1584652368.0,Ok cool I'm glad that's an option lol. These are my first piercings so I had no clue what to think of this. Thanks you!
tattoo,fj28e49,t3_ej7f9o,1582937131.0,"Is it realistic to balance being a full-time student (non-artistic major) and an apprentice at the same time? I get that it depends on the flexibility of your mentor, but I also understand that there's the ""if you want to be a tattoo artist so much, you wouldn't need to go to college"" argument. Because tattooing is a lifestyle and trade you've got to put your all into. I absolutely do respect it as such and believe that it's safe to say that I take it dead seriously. But I just so happen to be earning my bachelor's, too, for a few reasons beyond my own control.

(And, yes, I could just wait till graduation to apprentice, if I really must, sure. But do I *want* to wait any longer? It's like an itch I can't scratch. I just want to do it.)

So I guess that my question is actually whether or not I actually need to justify myself to my future-mentor, even if my portfolio and productivity are straight. 

Like... is being both a college student and requesting an apprenticeship just setting myself up to be brushed off? I know that one day I'm going to have to pick one hat to wear at a time, but this is where my passion lies. *I do not want to pass up the opportunity to earn this hat.* And there's no telling what the future will hold, how unhappy and too-busy-to-apprentice I'll be post-graduation, so I don't see why now would be a bad time.

For me, it feels like school is the side-gig (that I take somewhat seriously) and tattooing is the big, main thing I'm chasing. The bachelor's is a 'backup plan' that appeases my parents, I'll say for a lack of better words. Is that a 'bad' way to 'justify' doing both? *Do I even need to feel insecure about this at all?*

I ask because I've been asking my tattoo artist about his apprenticeship, and he seems to believe that artists can only have one main craft. Because I introduced myself as a musician, he refers to music as my craft, and doesn't really seem to think I feel as passionate about visual art as I actually do. I get 'musician-ed' a lot when I try to talk to him about visual art, hehe.

Others opinions don't matter, I know my own truth, et cetera, but I'm so afraid. I hate that I have, like, fifty hobbies and am 18 and in the process of figuring myself out (which is all fine), but is there ever a time to stop persisting? I don't want to give up on this, but I don't want to be out of line, arrogant, or disrespectful to a tattoo master. That is, disrespectful by waltzing in with a clean portfolio, a polished CV, a nice business card, *and* a pre-existing long-term commitment.

So; other than having all my sh*t together, being punctual, and honest with myself and my future-mentor. Is there a way that I can prove to that I want this and take it seriously? Is already being a full-time student (or full-time anything) a common make-or-break for tattoo artists, when weeding out apprentices? Or am I just overthinking this all."
BipolarReddit,faavau9,t3_e8alvl,1575914018.0,"Got into BDSM, called an abusive relationship healthy, blamed myself for my assault and rape, and now I haven't once gone back to who I was before it all began. And my current therapist doesn't believe in talking about the past so I'm kinda screwed until I find a new one lol. 

Similar to what someone already posted

By the way, if anyone needs to talk, my DMs are open"
transpassing,f6xbk0w,t3_dt73cd,1573246291.0,"Thank you all so so much for your feedback, comments and advice! You're helping me so much. Honestly.

Ok so hi all! (I'm the OP) Thank you so much for your comments and feedback so much!!!!!!

I'm transmasculine and I'm 18 heheh. 17 days on T! I was really happy and excited about all of your feedback, and all I could say is ""thank you so much!"" to literally all of them. So I decided to make a big comment for that before I individually thank you all. So THANK YOU!"
insaneparents,f5sou2t,t3_dp5oa3,1572438972.0,HOW DID YOU ACCOMPLISH THIS YOU WIZARD (does it solely have to do with him cheating?)
Advice,f5ns6oc,t3_do4gbg,1572303538.0,"My Heart Will Go On (the bad recorder song).
You have my condolences."
ftm,f4jafmz,t3_cy3por,1571615884.0,"Broooo saaame. I do a couple things to cope... If you want to call it ""coping?"" (I call it 'coping' for a lack of better words lol)

Rings for hands! And cute bracelets! Lots of them! Any kind of metal band or beaded bracelet is rather masculinizing imo. Makes me feel burlier. And tbh, wearing multiple bands at once is more of a guy thing from what I've seen. Plus, all those rings really accent your hand's definition. And HD hands are associated with men, more often than not. 

Plus, jewelry just looks sophisticated. Not babyish at all. It's meant to enhance what is already there. 

So play around with what you do and don't like.

Socks for feet; the cute ones from the men's section. And cute shoes. Cute ankle macrame jewelry when your ankles are out.  I like simple strips of faux leather; they're sophisticated and fashionable.

As feminine as this all sounds; to me, nothing makes me feel burlier than knowing that I look good enough to eat. So that's my advice.

Flattering accessories provide a sense of control, and have the potential to provide a sense of comfort toward what we dislike. You gotta feel around. Like how I didn't like my hair until I found a haircut and style I actually like. Or I didn't like clothes or fashion until I found the men's section (lol). 

I hated my baby hands and feet until I figured out how to make them not look... babyish? I still experience hand and foot size dysphoria (badly) but I know rings and cute socks takes my attention away from it, because I look more adultish I guess? I don't know if this is healthy but my psychiatrist says that it's a great way to cope with something as slippery as dysphoria.

Like. Y'know what I mean? I'm not saying impulse shopping and wearing 50 rings at the same time is the solution. I'm just saying that maybe this could be another aspect of your personal aesthetic to discover? 

Plus: maybe this is just my personal sense of style; it's just a thought. Do what you need for yourself. 

I know exactly what you're feeling. Best of wishes, man."
BipolarReddit,f3isoat,t1_f3ihpsh,1570941683.0,"Thank you so much for taking time to share you advice. 

I do have a therapist. We talked about how to communicate my disatisfaction today (I've tried and failed to word it plenty of times in the past); lo and behold, my boyfriend beat me to it and we 'broke up.' This week's homework was to find a way to word how I feel without beating around the bush. Guess it's still homework. Haha.

My therapist kind of. Redirects the conversation? Finds no purpose in talking about past traumas, since they've been resolved (can't hurt me anymore, and my flashbacks have decreased in frequency) it's just dwelling to him. I don't know how I feel about this, but I find that telling my family members about the trauma has helped me. Except for my best friend, I didn't tell anyone for eight months: the second person I told was my (ex) bf. And after two years, I finally told other people close to me. 

Ex-boyfriend said that he's willing to talk things through and I'm so grateful. I hope this time around goes differently, and that we can both leave the past in the past this time. 

I'll be sure to make an extra effort to not use sex and drugs to cope with all my problems, this time, too. Lucky for me, this time, I don't have many unusual problems to cope with. The urge isn't as strong. I can't tell if this is the ordinary college student promiscuity or if it's my pre-manic promiscuity. Either way, I'm going to be safe about it.  If I even act on it at all. You're right about the importance of awareness; it kind of gives us control over our impulses.  

Thank you again for your advice, honesty and patience. I hope things are well in your corner of the world and that you have a good night/day/afternoon."
satanism,f3fy2c6,t3_dgtq05,1570904562.0,Aayy
transpassing,f3cn3yr,t3_df5rxf,1570825943.0,"Girl, go off
you are beautiful"
asktransgender,f37l066,t3_dfxpyj,1570727174.0,"God no. Well. I wish I was ""normal"" and I wish I didn't have to spend thousands of dollars and totally change the lives of my family, my s/o, and his family upon coming out and transitioning. And I wish I didn't have to risk so much. 

But I'm choosing to transition, because if money, careers and relationships were no object, I would transition without second thought. If I could transition and none of the above were at risk, I'd have *been* on T. It's being disowned and attacked for ""selfish"" reasons that scares me the most. That, and liver complications. But not so much the latter. Hehe. 

And I've tried and tried and tried to tried to deny that I'm trans for years, dress overly girly, ""ignore"" my dysphoria, but that obviously failed. I went back to desperately trying to pass as a dude, every single time. For the sake of my mental health. I just can't fucking *lie to myself* like that, man.

Like even if my personality was the exact same, I still wouldn't want to be cis, because I just can't *imagine* myself being cis. I would most likely look and act the exact same, just call myself a girl. Which feels like a lie to me in this lifetime. I came out because I'm tired of lying. It hurts me. Like I have five million hobbies for a reason lol.

And I can't imagine looking and acting the same without trying to pass. So it's just really hard to imagine myself living as a woman without being dissatisfied with literally everything, because I'm ignoring a piece of myself that I can't ignore. 

But if I *could* happily live cis, it'd literally be me, but from a genderbent!AU fanfiction lmao
Cool to see it, wouldn't wanna be it. Ya dig? 

It's one of those What If relaities that I want no part of, because now, I'm *actually* at peace with myself. All because of self acceptance. And I can't imagine being genuinely happy as anything but myself at this point."
BipolarReddit,f35l628,t3_dfr2fz,1570681002.0,"Y E S.

Dude I thought that was a thing that everyone does until my psyche said my symptoms may contribute. 

Like my symptoms contribute to everything, man, can I get a clear list of what symptoms I have and *how* they effect literally every aspect my life
I'm so tired of constantly feeling overwhelmed, even during the times I have full control."
unpopularopinion,f2ts2az,t1_f2th9ef,1570399592.0,"I never said that it wasn't. But police brutality effecting literally everyone doesn't stop racial profiling from existing, hun. 

Plus there's literally more White people than Black people (77% compared to 13% of USA's population) so those numbers makes sense. 

That and poverty is a cycle. The higher the poverty in an area, the higher the crime rate is likely to be. And socioeconomic status is what segregates. You're right about Black on Black crime but like. Bro.

People of color are more likely to be discriminated against by authorities; be that through violence, or judgement, which are broad terms. 

Pointing out systemic racism doesn't deny that class-- and sometimes luck-- doesn't factor into how authorities treat someone. You can't use 'it isn't just POC who face these problems in the US' to belittle systemic racism. 

Because systemic racism doesn't stop biases from crossing social intersections, from being just as awful. Nor is it pissing and moaning. So stop belittling what is literally there. You aren't being threatened or accused of anything, here. I made this post to unite two worlds. Not to make a contest of 'what ethnicity has it worse in USA?' because oppression shouldn't ever be a contest. Gross. 

However, all that ""racism is overblown/not only _____ has it hard out here/you're overreacting to a coincidence"" talk implies that oppession is a contest. It's erasure, because it belittles someone's experience. 

I hate to make assumptions but I could guess that you don't live in Chicago. Lol. Things are *tense* here (as it can be, literally everywhere else), and this shit is real. No less real than not-racially-charged injustice. If you've never experienced discrimination because of your skin, religion, or identity, just believe whoever has. 

America isn't perfect for anyone. Just accept that this country was literally built upon racism and genocide, for centuries, before it was steered toward equality. *Which is why we're not all treated as equally as we should be, yet.*"
unpopularopinion,f2pozig,t3_ddxz3i,1570347865.0,"No. It isn't overblown, people just focus on the wrong things imho. I feel like that's what you mean. But ""racism exists but way overblown"" hurts my heart, because I see that it isn't what you meant, so you worded it the way you did. That's alright, you probably aren't looking at racism at a bigger scale.

Hehe this is long asl, man. Apologize but I'm passionate about these things. TLDR starts at the fifth-to-last chunk/paragraph.

The government and Justice system sets us up to fail, but people are choosing to pay more attention to microaggressions, than to police brutality, hate crime, and wrongful convictions. 

I say ""us"" because I'm Black.

I'm assuming you're aren't a POC and probably see people who are POC talk about racism, but this goes over your head because you haven't been harassed by a cop. 

Or accused of stealing when, you didn't steal, you're literally *just* black in a store with someone racist nearby. So you have to empty your pockets and be sure not to get emotional or act too paranoid, because you don't know if security is going to be reasonable or if security will try to taze you or something.

I'm Black and live in a suburb. I used to live in a dangerous neighborhood in Chicago, a heavily segregated city. 

The government put heroin in *our* neigborhoods and killed and incarcerated us for having it. For using it. But *now,* decades later, it's finally considered an epidemic, because majority of opioid abuse is done by Caucasians. And it *is* an opioid crisis. It never wasn't. 

Don't tell me racism isn't overblown. Don't fucking tell anyone that bullshit. Don't teach it to your kids, it just makes racism even worse.

Unless you believe I don't have a right to be upset about children being shot by police, because they have dark skin and are holding a phone? 

That happened. A little boy was holding a cellphone, a cop saw him hold it up and shot him. He thought a child was holding a gun. Not because a rectangle looks like a gun, but because the child was Black, therefore dangerous, so the cop is on edge about what he should do about a 'suspicious young adult'. Look up how often it happens. 

Look up how often our kids go missing and we only hear about it once. But little AJ whose parents killed him? We heard about him for weeks. As we *should* hear about police looking for missing children. But not little black and brown babies, unless they're studying abroad. 

Do you have any idea what's going on at the border between Mexico and USA? 

Don't tell me ""it's an immigration ban"" its a Muslim ban. If it were an immigration ban, we'd be doing the same thing at Canada's border. To all immigrants from overseas. We aren't completely respected by the government and you *can't fucking tell me that I'm not.* I'm not citing anything because these are current (or historical) events and if you have access to Reddit, you can look it all up. I encourage you to. I shouldn't have to prove to you the heartbreak I experience. 

I *could* find you articles about the opioid scenario in the later 1900s and about AJ and about that ""immigration ban"" but if you don't believe me you're free to do as you wish. 

And if you find *one* fact that says something like ""opioids were used by muhmuhmuh it was a choice"" dude they wouldn't have BEEN there in the first place if authorities didn't put em there. And have you ever tried drugs? Its a form of escapism. Poverty is associated with crime. If I had weed growing up, I'd have gotten high everyday just to calm my nerves about the gunshots outside, and about the other facts of life. People make mistakes. 

*But that entire opioid thing is just one example of underprivileged communities being set up to fail.* 

It's literally the same as the tobacco industry profitting off nicotine addiction. But you aren't saying that nicotine addicts are overblowing targeted advertisment, right? Bc that'd be messed up, right?

The poor are segregated from the rich; that's just how income relates to housing. And because poverty is a cycle, lots of families have been poor for generations and generations until to day. Dating, all the way back to sharecropping and debt, which dates all the way back to slavery. Which, in this country, majority of Black people were slaves, not even two hundred years ago. 

So you stay in the same place, with the same financial situation, for years, unless you just don't. But not everyone poor, regardless of ethnicity, in the world manages to lift their families from poverty. That's just how it is.

As for job opportunities. Two hundred years ago, employers were white men (because literally everyone else was either oppressed until a certain point). If they were racist, they didn't hire black people. Sexist? No women. Because they're not competent because if their inferior genes. 

It slowly got better and better and better, and *now* we can do something about discrimination in the work place. And now people are accepting. People have been becoming more accepting for decades, but I'm not trying to act like I was alive in the 80's.

That doesn't stop poverty from being a cycle. If you poor you're likely uneducated. And if you're uneducated you might not make a lot of money. Which means you probably live in an underfunded neighborhood. Which means you probably live where there aren't a lot of resources (but that's slowly improving, too!), might even live in a food desert. 

TLDR: If you don't know what a food desert is then you have a lot of research to do and should *not ever say anything about any minority group overblowing their oppression. You're in no place to say so because you aren't experiencing it so who the hell are you to say.* And I promise I'm not trying to be mean, and I'm not angry with anyone on this post, I'm just saying. It's unfair, it hurts my heart, and is further proof as to why the phrase ""racism is overblown"" simply has room for revision. 

I'm not sorry if you feel like I'm shitting on your feelings, because if you never ever thought about any of these things (AKA you're either White or EXTREMELY fortunate), then your feelings are valid but irrelevant. You aren't on the receiving end of the racism-stick. 

Cops are killing *our* children and men, attacking *our* women, teachers are failing *our* kids because they blame the child for their failure. *We* are ten times more likely to be discriminated against by a judge. To be killed and brought no justice. To be incarcerated. To fail standardized tests, because the questions on them are created by people who rep well funded schools. Not underfunded. And majority of students in underfunded schools, are of color. Look it up and prove me wrong if you don't believe me.

Don't call me racist for using and emphasizing ""our."" Not using it would take away from the fact that all that bullshit goes on because of subconscious and conscious racism. 

If you aren't white then look at the numbers, honey. We came a long way but have a long way to go. Btw I'm Black and live in a suburb and have nothing against anyone here. There's no need to get defensive, I'm not calling anyone racist. Just saying that you probably mean to word the phrase differently."
DissectPod,f2pj35f,t3_bpnk8f,1570344308.0,"I think “gun” is emphasized with the asterisk in the title (like in the track) because Tyler is alluding to hate crime and police brutality. A lot of the lyrics of “A Boy is a Gun*” do, but I doubt anyone who’s never had the “police can and will kill you at any second because of you skin color” conversation growing up, with an adult in their life. In other words, if you’re white and haven’t been exposed to other cultures and financial situations, you prolly don’t see that connection. If you’re Black it might hit home for you.

I am Black, grew up in a violent, Chicagoan neighborhood and spent high school in a nice ass suburb. What I’m saying is I’ve seen both sides of the fence so don’t come at me with some “uwu you dont know wut ur talking about tee hee hee.” And don’t come at me with reverse racism bullshit because I’m making you uncomfortable with my opinion and experiences. 

Racism is Social Darwinism; it’s believing in the concept of ‘race,’ a correlation between genetics, intelligence and behavior. Therefore, there are superior and inferior races. Saying what is *deadass* your reality isn’t racist. So don’t be that dude who says that it is.

We just use ‘race’ interchangeably with ‘ethnicity’ so we don’t look use ‘race’ with a superior-and-inferior sort of way, we just use it.

Anyway. To me:

- “you so motherfuckin’ dangerous” alludes to wrongful convict and racial profiling. Bc Black men are especially ‘dangerous’ to the majority of the US’s population (AKA white people). That’s why the 13.something% of us is more likely to die, more likely to get the death sentence, more likely to be sent to jail even if we’re innocent. And that’s just Black people. This type of discrimination applies to other minority groups as well.
- “all these other n***** lame as fuck we show em no resepct” implies that those who lack material possession (AKA the poor AKA LOTS of minorities) aren’t done justice. Nuff said.
- “take your hoodie off” is a part M A N Y “the police can and will kill you at any time” conversations, I promise you.
- “diabetes to the first degree” is ‘murder to the first degree’ because diabetes can be deadly and ‘first degree’ is part of a sentence
- “No, don’t shoot me down” reminds me of ‘Don’t shoot. I want to grow up,’ which was a writing program in 2012. Chicagoan teens affected by gun violence wrote their stories of trauma and paranoia and stitched them together to share with our governor. I don’t know much more about it, other than there were billboards of it all over my neighborhood. The violent one, I mean. It didn’t slow down police brutality and gang violence, because it’s such an unsung thing. Which is why it’s important for songs like this to exist, and for interpretations like mine to be shared. This perspective doesn’t get the attention it needs, except for in echo chambers of conversations, which makes it even harder to solve problems like these.
- “I want you by my side/keep me safe” conceal and carry.
“You could be dangerous to me or to anyone else” might be referring to conceal and carry, gun death by suicide, and racial profiling.
- And when I say “gun” is emphasized, not only does Tyler describe “you” as a gun without calling him a gun, but “a boy is a gun*” gets extra bass. Not to mention, the vocals build a major 7-flat-5 chord, instead of a major 7, like the sample. Let’s not ignore that deep, heavy bass that lets you know that something dark lies beneath the surface. Plus, that flat 5th is anxiety inducing. And if you aren’t into music theory, you can Google it. 

And of course this all has to do with romantic heartbreak, as well, like all of the above has said, it’s Tyler, the Creator. Everything is a double entendre, you just have to catch it. 

I’m tired but really want to put my interpretation of this song out there. I haven’t found one like it and think that representation is important, so I’m commenting on here. I’m in the process of writing a full analysis (for an English class) so I’ll explain in depth-in depth there. It’ll be on my profile when I’m done and SUPER super long, because I’m passionate about social justice *and* music. : )

Peace."
