sydney,fqw91cj,t3_gl35cv,1589696386.0,love this!
brockhampton,fqhjl6r,t1_fqhifbf,1589378291.0,bitch how
AskReddit,fp0zuax,t3_gaarw1,1588220754.0,The Poltergeist !!
unsw,fkn4q6k,t3_fjh03q,1584353383.0,"man, i am so sorry to hear that. Wishing you a very speedy recovery, take it easy ❤️"
unsw,fkn426m,t3_fjc21b,1584352519.0,"Yep, all law classes are to be online after Wednesday, not sure about other faculties"
unsw,fhkf3xb,t3_f39i1u,1581681184.0,"don't stress! you've only done one year - it's only up from here. and I assure you, most people in your degree are feeling the same."
beauty,fgv91du,t3_f0lkqs,1581140923.0,Too Faced Born This Way foundation!! amazing.
BPD,fdt1yhe,t3_emyry4,1578710869.0,"Even though I don't know you, I love you."
