Cringetopia,fq64dyh,t3_ggk0ds,1589124257.0,Isn’t that what the downvote button is for?
lightingdesign,fm5yaqy,t3_ft9txj,1585782437.0,Woah
joker,flnkiq7,t1_flmp7g0,1585320512.0,No blue eye paint? Stitched on face? Seems more like New 52 than Phoenix joker.
Allergies,fl8loxi,t1_fl7owfs,1584926590.0,That’s exactly how I would describe the fatigue I get from my allergies.
DarkSoulsHelp,fl7qmzv,t3_fn28u8,1584907304.0,"2 is good. Make sure to level ADP, the game plays like it’s broken otherwise. Also be prepared for slightly more linear level design than DS1. But DS3’s whole layout is basically linear."
BlackPeopleTwitter,fj5e2ku,t1_fj45p4c,1583030457.0,Corona is made by Modelo lol
PrequelMemes,fj5de02,t1_fj3yhir,1583030003.0,Callbacks are an essential part of Star Wars
bipolar,fj4z5ao,t1_fj2o97x,1583020384.0,Or draw the reddit alien in this style!!
PrequelMemes,fihysr6,t1_figkefe,1582415549.0,they were originally supposed to have “the most intricate lightsaber duel in Star Wars” but it got cut due to budgetary and time restrictions. ewan even learned all the choreography before it got cut
mildlypenis,fic7vxc,t3_f7f5ox,1582339805.0,Nothing mild here
organ,f91iudw,t3_e37fnk,1574991335.0,Usually they’re just screwed in. I just sawed the pedals off mine
TheeOhSees,f8a4wug,t3_dztljb,1574387823.0,Instantly got me
CrazyIdeas,f56qwng,t3_dmwbl4,1572026608.0,"[https://www.youtube.com/watch?v=sy1dYFGkPUE](https://www.youtube.com/watch?v=sy1dYFGkPUE)

Justice did it  first ;)"
flocked,es84ez1,t3_c6723r,1561687610.0,very nice
