goodmythicalmorning,fqzt0fj,t3_glngl1,1589774681.0,this picture of link is always just too much lol
bonnaroo,fqx5ai5,t3_glalws,1589726123.0,I love this pic and all of your smiling faces! I miss it 💗
trippy,fo1z22p,t1_fo1x6l0,1587445030.0,happy rooooo🤟🏼
KidsAreFuckingStupid,fmyrhq3,t3_fy5c8k,1586493606.0,I also ate shit in my bike and have a picture looking just like this! My family just took it to make fun of me forever lol
Anxiety,fmjmeax,t3_fvcocr,1586133248.0,i love you too :)
AskReddit,fmakh9t,t3_ftxgo4,1585897261.0,Blowing on your ear
ElectricForest,fl1kwz5,t1_fl1kejr,1584731032.0,"they aren’t specifically used for molly, they’re usually used for dust. People use them when on molly to hid their molly jaw. Which could be clenching or slacked. Sometimes you can look pretty wild when you’re rolling so it’s just hiding that"
AskWomen,fkdkwb3,t3_fhqc8s,1584082864.0,Be with someone I love. I wasn’t used to that kind of lovin lol
bonnaroo,fhhwies,t3_f3bmdp,1581613137.0,jennazickgraf
BassnectarMarketplace,fd6q9m9,t3_ek4i5s,1578194409.0,Thanks for posting this! I need that bodysuit!!
BassnectarMarketplace,fd6q6gr,t1_fd5ub4q,1578194377.0,she tweeted that she’s in vacation mode so she’ll probably message you back when she’s back to work! :)
somethingimade,fcjjm5p,t3_ehezc4,1577690190.0,omg sell them
bakedart,fccqj1h,t3_egwpvm,1577601452.0,"I’m sad christmas just passed and am just now seeing your work! I want to get one for my boyfriend but it’s not in the funds anymore, saving you for another gift that’s for sure"
Unexpected,fccprn5,t1_fccecli,1577601199.0,He commented on another post Fraktality. com
trippy,fcb86p2,t1_fcai804,1577583623.0,Are the ones on your website shiny and reflective like this?? or just flat color? Thanks!! Awesome work
Raves,faf4p0j,t1_faf40fq,1576014471.0,Ask not much going on in dayton but Therapy Cafe has silent discos kind of often if you get on their facebook page you can see when they are :)
Raves,faf4g0k,t1_faf40fq,1576014323.0,No problem! Weird I’ve never been on this sub and the first post I see is someone from dayton! Happy to help! Have fun :)
Raves,faf3s52,t1_fae3f5y,1576013921.0,"I live in dayton and go to shows all the time! Usually once or twice a week. Cinci has a lot of small venue options actually! Also columbus if you wanna make the drive. Mad frog, thompson house, topcats, bogarts are all in cinci that have shows often and are usually pretty cheap. In columbus you’ve got Skullys, dahlia, bluestone, and otherworld that all put on shows. (There’s even more options for both cities I just can’t think of them off the top of my head) If you download the app Edmtrain you can put in cinci and it’ll give you all the upcoming shows in the area. I usually spend 15-40 bucks per show which I know is a big range but don’t be afraid to go to the cheaper shows of people you’ve never heard of because they are still fun! Half the shows I go to I don’t know the djs that are playing. Sorry I know that’s long but I hope that helps. This coming Thursday Riot Ten has a show at Thompson house!"
AskWomen,f9f9sme,t3_e4r1kc,1575263692.0,"Big Wilds ‘Superdream’ album, and anything by Clairo"
TrollYDating,f8zdp2g,t1_f8yabq7,1574959876.0,"I approached my boyfriend, women approach men all the time"
AskWomen,f8u1mav,t3_e21gm6,1574816806.0,"Grin and bear it honestly, aim shy and also don’t like being mean or confrontation so I just do my best to deal with it."
rhettandlink,f8ai1fk,t1_f8afh5s,1574397906.0,which more is it?
Columbus,f7p4n4m,t1_f7p4dw6,1573942032.0,thanks
Anxiety,f6hdzlg,t3_dr4l5s,1572844527.0,I’m proud of you!!! I’ve been trying to work up the courage for a year. One day :) I hope it helps your find your way :)
somethingimade,f5vdqwe,t3_dpafgt,1572487359.0,Love them! LOVE the post of the necklace too!! Can I get the link to your shop??
bonnaroo,f2pd1ku,t3_ddqlmn,1570341118.0,I need him too. We all need him <3
bonnaroo,f290s2c,t3_dckvjc,1570076417.0,happy roo! how was the show? I’m seeing him next week in Cinci
tattoos,f1gs8g3,t3_d9by7j,1569475647.0,I love her so much
Hair,ezvip2d,t3_d2gfpq,1568179765.0,"V2, no beard but with mustache, Not very many people can do mustache only but you could for sure"
AskReddit,eywr6ol,t3_cz2apy,1567536018.0,"I was messing around on a treadmill and slipped and got my foot stuck under the belt, couldn’t reach the bar to turn it off so i had to scream for someone to help me"
intermittentfasting,ey9d8nz,t3_cw9qoo,1566940672.0,What do you eat in your window?
goodmythicalmorning,exs6ce7,t1_exs56bz,1566533703.0,"same, gonna binge either way"
mileycyrus,ex16n5h,t1_ewmqmyl,1565932567.0,How dare she grow up to look like her mother lol
Botchedsurgeries,ewx51hd,t3_cq7fkg,1565844611.0,His teeth look like Ross’ when he whitened them for a date
bonnaroo,eweofpt,t3_cnx4r6,1565331043.0,I can’t believe you got this with a disposable!!! It’s awesome. I tried to take a picture of my favorite tree with my disposable and it didn’t even turn out lol
PEN15,eu3ninn,t3_cemkoh,1563419576.0,"Then take it up with facebook or something, people are on this subreddit because they like the show."
cosmoandwanda,etp75s6,t3_ccqdsu,1563047555.0,This is so perfect!! I love it
bonnaroo,esglaul,t3_c7jhum,1561956579.0,I love this picture :( but also :)
movies,es86lcs,t3_c67aoe,1561689096.0,Well guess the new ghostbusters is a hit... dammit paul
australia,es7u29s,t1_es7tnpn,1561679839.0,good to know thank you lol
bonnaroo,es5hmqx,t1_es5eog2,1561612281.0,Church boners get in here and tell us who these people are!
bonnaroo,es5drqj,t1_es5dg1h,1561608563.0,Haha Find them!!!
bonnaroo,es56gh7,t1_es4zj2n,1561602828.0,"I took a disposable too, we took little to no pictures on our phone so it was really fun to get the pictures back :)"
bonnaroo,es49t3o,t1_es49cy7,1561580152.0,thank you!! I had a disposable camera too so it made it easy to get them developed at the same time! Some of the pics show an australian flag though so that might make things a bit harder
bonnaroo,es47jk7,t3_c5utgi,1561578765.0,[More pics](https://imgur.com/gallery/3ncB6lB)
bonnaroo,erhrzgs,t1_ergua0q,1560881613.0,The walk to centeroo wasn’t as bad as i anticipated but the no ice sucked real bad
bonnaroo,erhrr2z,t1_erhbvki,1560881469.0,"I’m a big fan and was pretty disappointed, his hype man talked for like 5-10 min before dicky even came out, he talked a lot, his sound wasn’t great. I’ve seen him twice before and they were both great, I’m sad he didn’t bring his best to the farm"
bonnaroo,erhr9d5,t1_erhoct8,1560881161.0,"Tiny spoons are usually used for doing bumps of coke (at least in my experience), and the girl asking for tweezers could have been wanting to hold the last bit of a blunt with. Hope that helps, I could be wrong"
bonnaroo,erg4500,t1_erg3xr0,1560825881.0,"Literally same, this just made me so happy"
bonnaroo,epos487,t1_epojdta,1559351837.0,serious question what if you’re just depressed and not on antidepressants
dayton,ep0s9zn,t3_btnoko,1558979660.0,that baby is so cute!!! I hope he gets home
AskWomen,eojl9fv,t1_eoiase2,1558639409.0,I had cute collarbones until I gained weight.... I miss them so much
