pitbulls,fr10dqn,t3_gm02hq,1589810756.0,So cute. I love her ears!
CountingOn,fqt9yhw,t1_fhnpwy5,1589634229.0,Josie bates.
namenerds,fqpii5p,t3_fob66z,1589547225.0,"Sparrow, raven, sterling"
namenerds,fq4xdo4,t1_fq1u3xm,1589086527.0,I think people do this because they don't want others opinions to sway them from the name they want. People are prob less likely to say they dislike the name once the child is already named. (I'm just assuming).
namenerds,fq0s6ye,t3_ggda57,1589036927.0,"Hazel is a nice name for a girl, but its too common now imo."
ExPentecostal,fq0dar0,t3_gg8g6u,1589030300.0,"I always wondered what makes people join. I was raised in the apostolic church , and was counting the days till I was 18 and free.  I would imagine  seeing someone jumping around speaking in tongues the first time was scary.  Most apostolic pentecostals are judgmental as hell, I wouldn’t want to socialize with any of them lol."
pitbulls,fq0ak2l,t3_gg717w,1589029437.0,Those people are ignorant . I don’t even go on cause I will get mad. Their loss.
namenerds,fpvojcr,t3_gfriip,1588948879.0,"1. Destiny - lab mix
2. Kylan- yorkie  jack russell mix -(she came with the name , but we thought it was cute and kept it.
3. Valor- pit bull ( his name was rain for about 12 hours when we first got him, but valor fit him better)."
namenerds,fpvhore,t1_fpvfp2v,1588944997.0,Me too.
namenerds,fpvfeh5,t1_fpu82ot,1588943554.0,You and i have similar name taste. 19 of your names are on my list lol
namenerds,fpvf5wx,t1_fpuxqk0,1588943399.0,Temperance is on my name list for future daughter . I heard it on bones and loved it ever since.
pitbulls,fp9g23p,t3_gc0az0,1588425215.0,Enjoy the puppy stage now. They get big too fast. Such a cutie ❤️
CPTSD,foylnli,t3_ga6uiu,1588174738.0,"Same. I hate when I run into people I know while doing errands. I suck at small talk. I usually hide or act like I don’t see them, unless we make direct eye contact and I’m forced to say hi."
TLCsisterwives,foqlnc5,t1_foqkpfx,1587996251.0,That is true.
TLCsisterwives,foqereb,t3_g8za3a,1587991812.0,It could be too overstimulating for Dayton.
SisterWivesFans,fopqsr7,t1_fopmypy,1587969162.0,this season was disappointing
TLCsisterwives,fojo5r3,t1_fohwr8z,1587825736.0,I literally laughed out loud lol
confessions,foip940,t3_g7exk3,1587792731.0,"I feel like what you are feeling is normal. I'm sure your childhood was very difficult, and your feelings were often overlooked. Now that you are an adult please consider speaking to a professional."
paganism,focks1d,t3_g6tdpo,1587672498.0,Etsy has some really great stuff. They have a whole spirituality and religion section. They also have nice raw crystal necklaces with essential oil diffusers.
pitbulls,fo72n0i,t3_g5xvkt,1587571160.0,"So happy to see pits as service dogs. Unfortunately ,they have bad reputations. They are great dogs.

Sorry about the loss of your Mama ❤️"
childfree,fo1cu9r,t3_g4xla2,1587430521.0,"I had a betta fish. Originally i thought i would put him in a vase and he would look pretty( i falsely thought it was fine) . Then once I got him I did some research and someone was saying they need more space because ‘surviving is not thriving’ . I dont know why it didnt dawn on me before. A vase tank is like being stuck in a car your whole life. I ended up getting him a 5 gallon tank. He was a happy boy swimming all over his tank. They are really cute fish, he used to be so happy when I spoke to him. Rip reiki ❤️."
oneanddone,fnz4ok2,t3_g4l2ol,1587385973.0,"Im not a Mom yet(waiting another year or so to start trying). But my husband and I know we only want one. Both sides of the family keep saying our kid will be lonely, and that they pray we have  twins . Im like please don’t lol... Im  sure I can mentally only handle one, and I want to be super close with my kid cause I wasn’t with my Mom.  Also I want to be able to help my child with college and I know I would not be able to do that with two."
childfree,fny912f,t3_g4e8na,1587356432.0,"I'm american and i hate baby-showers too. I personally think it is tacky to ask people to buy you stuff. If they want to give you a gift they will. I will go to one if its someone that I am close to, but i never stay for the whole thing.I hate having to watch people open gifts."
introvert,fnvlepb,t1_fnvl6xx,1587297543.0,Thats a good idea. They may even initiate the conversation 🤞🏼
introvert,fnvky5w,t3_g42c0w,1587297092.0,She may be more extroverted than you and could possibly be offended that you stay to yourself. Some people take everything personally. Maybe you can start to come out of your room and spend more time in the common areas. Sometimes just being out and in the presence of others makes it easier to start a natural conversation.
CPTSD,fnve5ba,t3_g3rmwi,1587289895.0,"I always feel like I'm being watched and that others can read my mind. I was raised in a super religious home, so I dont know if that has anything to do with it. Its so bad that i cannot even open the blinds/ windows in my home because i feel like I am on display."
energy_work,fns90qq,t3_g3m1s6,1587216102.0,I can relate to feeling of unworthiness and having an unbalanced root chakra. Something that works for me is positive affirmations.
CleaningTips,fns0z58,t3_g3gyuh,1587209065.0,"I would wipe it out with vinegar and water , and then run a hot cycle with bleach. Congrats on your new apartment. I know your happy you don't have to go to the laundromat."
Psychic,fnrzal1,t3_g3l4mc,1587207340.0,Awesome pic. Where was that taken?
namenerds,fnku9h9,t3_g24uq7,1587040098.0,"Celeste, Elise, Ari/Aeri, Jane, Penelope"
CleaningTips,fn6naos,t3_fzun2m,1586703351.0,"I would spray a mix of dawn dish-soap, vinegar, and water. I would then get a heavy duty sponge and add baking soda or ajax/comet, and scrub. Then rinse with water(hopefully you have a detachable shower head)  , then spray vinegar and water and wipe with microfiber cloth. It will look much better. I don’t think just the spray without the abrasive baking soda or ajax works as well."
DebateReligion,fn6ipsp,t1_fn3ch5r,1586700324.0,Can you please explain what you mean by rite?
namenerds,fn4k7v4,t3_fz7jk5,1586643070.0,"I like Marietta. I know some people are saying its the name of a city, but so is Savannah  and its on the top 100 name list."
exmormon,fn3b3wi,t3_fyqgti,1586617009.0,"Lol i read the meme before reading your description, and was like wth how will that help ? lol."
namenerds,fn3awo3,t3_fyw274,1586616882.0,Hana
pitbulls,fn36kt0,t1_fn32zqf,1586614101.0,This is an awesome story. Im so happy you found each other. And I hope you have a long life of happiness.
DebateReligion,fn363a3,t3_fyzpns,1586613765.0,"    I was raised oneness pentecostal. The church I grew up in looked at communion as symbolic. I had a friend who was raised catholic that explained  transubstantiation to me . At first I thought she was lying/kidding with me . I had to go home and research it. 
    I also just recently (since the coronavirus) found out that catholics all drink from the same cup."
exmormon,fmytng3,t3_fy5gam,1586495416.0,I love your hair color.
namenerds,fmypkxo,t3_fy54yh,1586492092.0,Carly is a cute nickname for Caroline.
exmormon,fmxzkkl,t3_fxyeis,1586475012.0,You were adorable before... but you are a beautiful woman.
Wicca,fmw30es,t3_fxqn3y,1586438350.0,I’m so sorry for your loss. Your memorial/altar is beautiful. May your friend rest in peace ❤️
Frugal,fmw2rr6,t1_fmw1k0u,1586438184.0,Awww....Curly hair problems lol
Frugal,fmvubel,t1_fmuqbzl,1586431165.0,"This is good advice. Im biracial and my mother is white, she used to just rip through my hair with a comb . It was torture"
nutrition,fmhqkm4,t1_fmh2qdd,1586090478.0,If I let myself... I could eat ice cream 7-8x a day. Im not joking .
ExPentecostal,fmg04dv,t1_fmfd5at,1586038487.0,"I agree with you that both of those scriptures are used in the apostolic church to support oneness doctrine. (When I was saying  apostolic earlier, I meant oneness pentecostal)."
ExPentecostal,fmelzch,t3_futf0c,1586007944.0,Apostolic- Pentecostals only ready acts and revelations lol. There is no way apostolics read 1 Corinthians .
ExPentecostal,fm63kd0,t1_fm60110,1585785540.0,Good luck with your healing ❤️
ExPentecostal,fm5tien,t3_ft7w8n,1585779647.0,"Your mother is indoctrinated so she  thinks she is saving you. I was raised to always be ready because Jesus is coming back in the blink of an eye. A few weeks ago I caught myself slipping back into my programmed thinking, and for a second ,thought the rapture could happen and I was going to hell. But, I just reminded myself that was indoctrination speaking. Please read Leaving the Fold by Marlene Winell. This book changed my life. As far as your mother is concerned she thinks she is saving you. Please take what she says with a grain of salt."
exjw,fm46qh9,t1_fm44jma,1585747835.0,We all have. Its so scary.
exjw,fm3rvt3,t3_fsqhb9,1585734657.0,My mind was blown when I found out that yhwh was a caanite war god. And that he was related to Baal. People also did child sacrifices to yhwh way back. I fee like everything I learned growing up was a huge lie.
namenerds,flx9ukz,t3_fri29s,1585578530.0,"I like them both, but I like the Ian a little bit more."
introvert,flx29vl,t3_frm28g,1585573187.0,I hate FaceTime too. I legit don’t answer . It gives me too much anxiety.
namenerds,flts6fw,t3_fqvsq0,1585485477.0,Juliana
Psychic,flqud6e,t3_fqg2ql,1585406409.0,Sorry for your loss. He was handsome ❤️
conspiracy,flqcj66,t3_fqf9qt,1585388840.0,All of those children look uncomfortable .  The little girl in her dads arms is trying to pull away from him.
pitbulls,flq75g7,t3_fq3i10,1585381928.0,sorry for your loss
religiousfruitcake,fldc2nj,t1_fld4ixa,1585061405.0,Came to say the same thing. I grew up in an ultra conservative house and was out 5 days before my 18 th bday. I couldn’t even wait another week lol
Advice,flcbtw0,t3_fnix70,1585025496.0,My mother left for 2.5 years (cheated on my father/ drugs) when I was 6 and my brother was 4. My Aunt and Father told my brother and I that she was sick. They never really said much more. But I knew the truth. It always hurt me because I knew she had left to be with another man. I remember my parents fighting about it. I would highly recommend seeking professional support for your child. Remind them that it is not their fault. I remember always feeling less than when kids in class had a Mom and I didn’t.  I still carry that feeling of inferiority with me. I wish you all healing. And I’m sorry for what had happened to your family.
Frugal,fl0bi89,t3_floxg0,1584700121.0,Frittata
nutrition,fkwidpn,t3_fkti60,1584593403.0,"Already chopped lettuce, cheese, olives, chick peas, croutons, jalapeños from the jar, and dressing,"
Christianity,fkuu2je,t3_fkj9er,1584556145.0,"Sounds like a cult to me. Here is the bite model:

http://old.freedomofmind.com/Info/BITE/bitemodel.php"
exmormon,fkurlwx,t3_fkopnc,1584554845.0,Do Mormons knock on random doors like jw? Or do they knock on doors of the people who request the free bibles? Just asking because I never had a Mormon come to my door.
yoga,fku2gbn,t3_fknc33,1584540765.0,Yoga with kassandra is great.
namenerds,fkp3y7w,t1_fkp0b2q,1584401246.0,I can hear Erics voice so clearly now lol
namenerds,fkk8xwh,t3_fitud1,1584277515.0,Aurielle moon
namenerds,fkk8sdd,t1_fkjqk44,1584277377.0,George Zimmerman is who came to mind right away when I heard the name.
exjw,fkh896y,t3_fif5jf,1584191881.0,"Don’t underestimate  the power of planting a seed. I did not grow up jw, but was raised in another cult. My husband planted seeds for 9 years before I finally woke up. Just keep planting little seeds here and there. I actually started studying the history of christianity, and the bible so I could prove it to him. During my research was when my eyes were opened fully."
occult,fk8wn7n,t3_fh3wco,1583964278.0,Beautiful  kitty ❤️
LetsNotMeet,fjxoxrx,t3_ff66le,1583679804.0,Do you think they could be ghosts? Thats creepy as hell.
namenerds,fjrvqij,t3_fevki3,1583590675.0,"I never heard that name before. I really like it. Its different, but not too weird."
CPTSD,fjrpyth,t1_fjo54de,1583588717.0,NOTHING that you did deserved abuse. It has nothing to do with you. You are not at fault for your mothers actions. Please remember to remind yourself that she had issues that she  failed to deal with. Not everyone should be parents.
namenerds,fjmtkbk,t3_fce50p,1583483358.0,Crowley is a cool name imo.
exchristian,fjkth79,t1_fjkrlq7,1583433576.0,Lol. I did not see that exact one. They have ones similar.
pitbulls,fjkm64f,t3_fdslvo,1583429499.0,That is so freakin adorable ❤️
exchristian,fjilh3q,t3_fdjods,1583370251.0,"No soliciting signs wont work, because they aren’t selling you anything, so they don’t think it applies to them. I actually got a sign from etsy saying please don’t knock, please call or text instead. So far it has worked ."
ExPentecostal,fj9xzos,t3_fc7svh,1583162222.0,Have you tried another denomination? There are churches that would accept you.
horror,fiyk2hp,t3_fae6yw,1582840925.0,Im so excited. Candyman still scares the shit out of me. And I love Jordan Peele. So excited to see this movie .
SisterWivesFans,fiu7jb1,t3_f9pugk,1582736475.0,This season is making me not want to watch anymore. Its the same thing every episode.
mentalhealth,firsib0,t3_f9e4qz,1582670446.0,Have you tried positive affirmations? The anxiety guy on youtube has some great ones for self esteem.
TLCsisterwives,fidh7wd,t3_f7qb9m,1582367003.0,lol i'm bored too. I'm still watching old seasons on [tlc.com](https://tlc.com).
FriendshipAdvice,fi9gkxz,t3_f761c4,1582265146.0,"It sounds to me like she is jealous of you, or threatened by you. Either way, it may be best to speak with her directly about it. When you are alone with her(make sure you are alone, people act different with an audience) , let her know how you feel when she says negative things about you. Use an “I statement”. For example “ It really hurts my feelings when you call me a fake bitch, or say that I am ugly. I would like for you to stop doing that.” If she says she is joking. Say you find it disrespectful and want it to stop. 

I know you may be nervous to call her out on it. But you will feel proud of yourself afterwards. Every time I have ever confronted someone and was assertive, they apologized and stopped the behavior, and Im not naturally an assertive person. 

Please stand up for yourself. And if she doesn’t respect  your boundaries she doesn’t deserve to be your friend."
Christianity,fi34xx9,t3_f5tue0,1582101142.0,"

Sometimes medications can make symptoms worse. I went on Zoloft because I was anxious and it made me feel  suicidal. I kept communicating with my doctor and I was eventually prescribed Trintellix, it worked wonders. Please continue to let your doctor know how the medications are working for you.  If you do not advocate for yourself, there is no way for them to help you. 

If you have a plan for suicide please contact 911 immediately. The hospital is often helpful because you feel safe, and kinda hidden away from the world. They can also monitor any med changes, and you get the chance to participate in group therapy. 

I know you said that therapy did not help you, but please consider group therapy. Sometimes it is nice to know that you are not alone in what you are experiencing. I am sorry for the way your father treats you . Please know that it has nothing to do with your worth as a person. He has obviously his own issues that need to be addressed. 

I hope you do not hurt yourself, and I hope you can get the help you need. Please know that you are worthy of happiness. And remember that life goes through cycles. It will turn around eventually. I am sending good vibes your way❤️"
TLCsisterwives,fi29q4m,t1_fi2062n,1582074744.0,Thanks for explaining.
TLCsisterwives,fi1ywfw,t1_fi1xuxy,1582067700.0,What do you mean by virtue signaling ?
mentalillness,fi1xmde,t3_f5xiu5,1582066896.0,"I know some people love it. Im glad it works for you.

For anyone who tried it and it didn’t work, do not give up. Communicate with your prescriber. My Mother was on Zoloft for years and loved it. I tried it for about 6 months and went from feeling anxious to suicidal. I kept communicating with my prescriber and he put me on Trintellix. I have been on it for about 3 years and it works great for me.

Everyone is different. I am happy you found something that works for you."
mentalhealth,fi1w8ia,t3_f5xphn,1582066063.0,Sorry for your loss ❤️
confessions,fhpd987,t3_f4468i,1581786986.0,"Just so you know, dollar tree sells hallmark cards for $1."
ExPentecostal,fhpbrhz,t3_f4acqk,1581785984.0,Same. I remember telling my mother that I was depressed when I was around 15. She told me I was not praying hard enough. I hope you were able to get help.
childfree,fhm06r2,t3_f3qkzw,1581706889.0,"I think that parents just tune it out. I was always raised with “keep crying , and I”ll give you something to cry about”. We were never allowed to make a scene in a public place. In fact my niece got escorted to the bathroom and spanked in Disney world by my sister because she was acting bratty. I know not everyone believes in spanking, but damn take your kid to the car. No one wants to hear that."
SisterWivesFans,fhj5le8,t1_fhiz2mq,1581638542.0,She has. At one point she was my least favorite. Then a few seasons ago it switched.
SisterWivesFans,fhixk0m,t3_f3h01z,1581633848.0,I go back and forth between her and Christine. I like them all though.
ExPentecostal,fhi5siq,t1_fhi2408,1581618291.0,"I never spoke in tongues so I was never considered saved, but I know the feeling of inadequacy well. When I did leave the apostolic church, i started going to a non denominational church , but I always felt like a ‘fake’ christian. Like they were all real and sincere and I was a phony. I was unable to open up to anyone even  though I was there for three years. The people in that church were so nice and non judgmental. But I was so used to Apostolic’s judging everyone that I was never able to open up."
ExPentecostal,fhi50wn,t3_f37zha,1581617885.0,They don’t want you to trust yourself. They want you to do whatever they say. If you trusted yourself you would realize how abusive it all is and leave.
confessions,fhbjta6,t1_fhbfe7s,1581443730.0,"What op did was wrong. They were a child and a victim too. They were obviously acting out of trauma. Im not condoning what op did , but  they feel guilty and are struggling with regret. Telling someone to kill themselves is not helpful in this situation, and its actually quite mean. I realize you are probably a victim of sexual abuse too, and maybe thats why you are so angry. I hope you find your healing."
religion,fh7fp70,t3_f1hx80,1581329464.0,Try reading Christianity for dummies. It’s a great book and broke down all the denominations for me.
TLCsisterwives,fh7c3g6,t1_fh79676,1581324100.0,"Same. I think she isn’t happy , but this is her religion. It is sad. I do hope she find happiness."
exjw,fh2o08g,t1_fh2lib2,1581258586.0,"Yes. And no make up ,and you cant paint your nails or wear jewelry except wedding ring. And females have to cover their head in church."
exjw,fh2nprq,t1_fh2ma5z,1581258462.0,This is excellent advice. Thank you .
conspiracy,fh2kpso,t1_fh1wcsf,1581256280.0,Thanks for asking . I tried to google  and nothing came up.
exjw,fh2j949,t1_fh2hmo6,1581254808.0,Thank u . Me too.
