ShitAmericansSay,fr3fi5r,t1_fqxy716,1589856298.0,he’s a pompous asshole who looks like a Cheeto
MakeMeSuffer,fr3di2e,t1_fr3dfs7,1589855068.0,Thank you
MakeMeSuffer,fr3de90,t1_fr3dccy,1589855004.0,It got posted on a Facebook group and I took screenshot and edited it on Snapchat
AmItheAsshole,fr1a58l,t3_glwjub,1589816101.0,NTA it really isn’t snitching because she is essentially bullying you and doing something actually harmful. Also she’s freaking 18? I would Behavior like this from a 13-15 maybe 16 year old but from a legal adult? No. I did stupid shit on the internet from age 12-18 but I NEVER bullied people.
AmItheAsshole,fr19yd5,t1_fr0nc5n,1589816002.0,"Or better yet use reddit where you can be Anonymous. That’s why I have reddit so I can post stuff “anonymously” because there is no way for anyone to know who I am on here unless I tell them. My name, location, and face aren’t listed on here. Only the fact that I am female, am a college student and my age."
AmItheAsshole,fr19pmj,t1_fr07m5y,1589815878.0,From the post I would have thought you were the older sibling and she was like 13-15 Jesus she needs to grow up. secrets accounts also known as finsta’s are all about throwing shade. I technically have one but I only posted a couple pictures of memes and some gossip about something happening with my school building. otherwise thought the whole concept was stupid so I just use my real Instagram
insaneparents,fqzf8ma,t3_gljprr,1589766123.0,So confused as to what is happening here
DuggarsSnark,fqyoe5u,t3_gklx4x,1589751886.0,I’m sure another scandal of some kind will come along and shut this show down like it did with 19kids
DuggarsSnark,fqyo3ds,t3_glihcs,1589751742.0,What the fuck is the child bride wearing? The bottom looks like my grandmothers tablecloth
MakeMeSuffer,fqvkesa,t3_gl4bcu,1589679168.0,I don’t even understand what I just watched
MakeMeSuffer,fqvjywe,t3_gl5gwe,1589678897.0,Desperate times calls for desperate measures
MakeMeSuffer,fqvjxkm,t3_gl5ici,1589678875.0,What the fuck?
DuggarsSnark,fquj3aw,t3_gky8f9,1589659758.0,Are they doing a freaking Beatles tribute??? Don’t they know John Lennon was one of the most anti-Christian people in existence?
relationship_advice,fqtwofi,t1_fqsq6fm,1589647561.0,That’s what I’m saying. If she is so “godly” why did she open her legs for someone other than her husband and conceive a child out of wedlock.
relationship_advice,fqtwjjp,t3_gkndk8,1589647486.0,Social work major here! He doesn’t sound like a psychopath. He sounds like a bully he’s being enabled by his mother. she’s a real hypocrite for all the hateful things she said to you being that she laid with a man outside of marriage and was an unwed teenage mother. Next time she says anything about god punishing you make mention to the fact that she was fornicated and had a child out of wedlock which is a huge no no in the religious community. I would also talk to your mom and tell her your concerns. Sit down with her and ask her to give your brother an ultimatum.
aww,fqs1v5k,t3_gkk4sg,1589596666.0,What a good boy! What kind of dog is he?
AmItheAsshole,fqrlhfl,t3_gkfn66,1589586765.0,NTA. If they want sex so badly they should get a hotel room or they could always get busy in the shower
insaneparents,fqogytb,t1_fqogx3i,1589515013.0,Ah okay
insaneparents,fqogmm9,t1_fqnz2q3,1589514798.0,Wait is it not normal to see your parents naked? I’ve seen my mom naked almost everyday for my entire life. Doesn’t bother me in the slightest. We are both females after all
DuggarsSnark,fqogi8m,t3_gjyg9q,1589514719.0,Both
JUSTNOMIL,fqo1bxr,t1_fqnxzvy,1589505554.0,Also denial
AmItheAsshole,fqjnw1l,t3_gj3kau,1589412636.0,NTA. Thats nasty. don’t know if you should have called her dirty but I understand why you did
AmItheAsshole,fqjm4yu,t1_fqikm8s,1589411914.0,"Exactly! While I wasn’t exactly a tomboy as a kid I was happy to do both girl and guy things. Sure I liked dress up, barbies, poly pockets and all that jazz but I also really liked toy cars, dinosaurs, and getting dirty (loved mud as a kid. Hate it now)"
JUSTNOMIL,fqhp832,t1_fqhnl6q,1589381620.0,Ohhhh okay
JUSTNOMIL,fqhnn7c,t3_gis9q0,1589380686.0,emotional manipulation at its finest
JUSTNOMIL,fqhnejp,t1_fqhfd96,1589380543.0,I didn’t get the chickenpox shot until I was around 3 or 4 so I could go into school
AskReddit,fqfyczy,t3_gigdoi,1589334153.0,Peter Griffin....uh oh
AskReddit,fqc1vlz,t1_fqazsfp,1589248407.0,That’s because they almost always hired people in their 20s
DuggarsSnark,fqahf6j,t1_fqach3v,1589219120.0,I think Lauren definitely abuses josiah emotionally
DuggarsSnark,fqaayza,t1_fq8mafp,1589215950.0,She probably wants to wait and see what Josie bates posts so she can copy it and do it better
DuggarsSnark,fqaaslp,t1_fq8ipd4,1589215859.0,I think Jeremy is more than likely emotionally abusing her. Don’t think there’s any physical abuse but he gives off the warning bells of someone who is emotionally abusive.
DuggarsSnark,fqa9mav,t1_fq9mmzt,1589215264.0,Out of all of the daughters/daughter in loves Anna is by far the stupidest
DuggarsSnark,fqa915s,t1_fqa793f,1589214967.0,Trying to conceive
EntitledPeople,fq67qxp,t1_fq67p0j,1589126196.0,At least for a business to ask.
DuggarsSnark,fq671j8,t3_ggw2g5,1589125797.0,So glad I wasn’t blanket trained. as a kid if I acted up my mom would make me stand in the corner with the nose to the wall until the timer was up. hated it so much I wouldn’t act up anymore afterwards. Probably use that for my kids as well
EntitledPeople,fq35xc0,t1_fq35e8t,1589063315.0,"that’s what service dogs are? are you thinking of support dogs? Those are not protected by law. Only service dogs are. Service dogs are the official name for guide dogs, medical alert dogs etc. Support dogs are for mental health issues and that’s how people abuse the system mostly."
EntitledPeople,fq33dd1,t1_fq334de,1589062623.0,If you really wanted to abuse the system
EntitledPeople,fq30sne,t1_fq30ljl,1589061956.0,In order to be a certified service dog the dog must go through rigorous training. You get the dog registered but there is no paperwork
EntitledPeople,fq2tonl,t1_fq1495d,1589059565.0,By law all establishments in the United States has to allowed service dogs or they could face a huge lawsuit. it’s service do discrimination. I worked in a restaurant and we were not allowed to turn customers with service dogs away.
EntitledPeople,fq2tbm7,t1_fq2bexx,1589059449.0,"I feel like people don’t realize that you aren’t even legally suppose to ask that kind of stuff. I worked in a restaurant and only ever dealt with a service dog once. We were only allowed to ask 2 questions 
“Is that a service dog?”
“What service does the dog provide?” Meaning is it a seeing eye dog or medical alert dog we are NOT asking for your disability."
EntitledPeople,fq2sxvd,t1_fq2199h,1589059339.0,"In the U.S. there are strict regulations for service dogs 
Legally an establishment can not deny a service dog entry nor can they ask for “proof” 
Only questions that can be asked are 
“Is that a service dog?” 
“What service does it provide?” 
that’s it"
EntitledPeople,fq2s98p,t1_fq1pzak,1589059137.0,"Legally you aren’t suppose to ask that. It’s against the law. if a person wants to tell you that’s fine. The only legal question you are allowed to ask is 
“Is that a service dog?” 
“What service does it provide?” 
anything else is off the table and can get you sued."
EntitledPeople,fq2ru6a,t1_fq06gls,1589059019.0,Service dogs and emotional support animals are 2 completely different things. legally the venue has to let the dog in
EntitledPeople,fq2r4qq,t1_fpzvzbz,1589058832.0,That’s technically an illegal question
insaneparents,fq2q2kr,t3_ggh1wa,1589058531.0,How old are you?
entitledparents,fq1eb32,t1_fq1dxd3,1589044875.0,America really isn’t nudity friendly.
AskReddit,fq15osj,t1_fpydwz7,1589042094.0,Make sure you’re buried an umbrella
AskReddit,fq15mwo,t3_gg9hn2,1589042072.0,Levels by Nick Jonas. Don’t know if that’s good or bad lol
entitledparents,fq0yhpg,t1_fpz17rf,1589039208.0,That must be a European thing because if you did that here in the U.S. you’d probably get in trouble
MakeMeSuffer,fpx6qln,t3_gg00fe,1588976728.0,Kevin and Molly Brown gonna have some fun
DuggarsSnark,fpx5xwx,t1_fpvmcv0,1588976288.0,Or choking on it
offmychest,fpunpgb,t3_gfit3g,1588917930.0,Congratulations! I’m sure you’ll be a wonderful father. Your little girl is lucky to have you
DuggarsSnark,fpun72h,t3_gf9jpr,1588917503.0,Who tf are these people?
DuggarsSnark,fpun5r1,t3_gfdzqh,1588917473.0,I actually really like that saying
DuggarsSnark,fpumslw,t3_gfl1p7,1588917168.0,Jim boob and Meech honestly should have been sent to jail for covering something like this up. they covered up molestation
AskDocs,fppvxia,t1_fpp7m5r,1588810198.0,No live virus in HPV shot. I got warts from sharing a shower with my step sister who had warts. You can get it from basically anywhere
DuggarsSnark,fpo83eu,t1_fpnlpg9,1588780008.0,Probably because she waited a few months so she could breastfeed and then weaned baby and passed it off to the sister moms
DuggarsSnark,fpklpxk,t1_fpkf0fx,1588696917.0,That’s what cults do. They break and brainwash women into thinking this is their sole purpose in life
DuggarsSnark,fpkertx,t1_fpkb3fk,1588693362.0,She was raised in a cult and became a mom at like 19. She didn’t have the knowledge or maturity enough to raise a child properly
cursedcomments,fpi9g5i,t3_gdjejb,1588636325.0,Shit I don’t remember the last time I slept 10 hours. I’m a stressed out college student. I’m 21 btw
WatchPeopleDieInside,fpfl7kx,t3_gbmx3v,1588574710.0,Please don’t release balloons In general. They are bad for the environment and can kill animals
BitLifeApp,fpfl1r5,t3_gd4r5u,1588574558.0,Why
BitLifeApp,fpfkx8n,t3_gd5rpy,1588574443.0,I have
BitLifeApp,fpfkvy9,t3_gd69dh,1588574411.0,*insert Indiana Jones music
AmItheAsshole,fpdj30m,t3_gcoc8s,1588527979.0,"YTA for saying what you did and for excluding her but I don’t think you’re the TA for how you’re feeling. look op I’m an only child as well. I get it. My moms boyfriend has 2 girls and while it was an adjustment I would NEVER make them feel like they were unwelcome in our home. Would I be pissed of my mom told me she was pregnant or adopting a child? Probably because I’ve been an only child for 21 years but what you did was completely unacceptable. at 15 years old you should know better than to treat anyone like that. I get that you are having a hard time adjusting I totally understand that so I’m trying to be as nice as possible about this since insulting you isn’t going to do any good. It blows my mind why your parents would not even mention that you were getting a sibling so you could have time to adjust but you are they child and they don’t need to ask you permission for anything. You need to accept the fact that you now have a younger sister. I do have empathy for you because being 15 is hard enough but I’m not at all going to side with you on this. What you said was awful and honestly you should be ashamed. If she was adopted at 14 she most likely went through foster homes and if you know anything about the American foster system (if you’re American that is) it’s complete garbage and you have no idea what this poor girl went through. maybe sit down and have a calm talk with your parents and tell them how you’ve been feeling but other than that you need to apologize to your sister. Have you tried to get to know her? Maybe you two have common interests and can find something you enjoy that you can both do together. if you’d like to talk I’m open to a pm. For those wondering why I’m trying to be gentle about this it’s because I’m studying to become a social worker and we are taught to address difficult situations like this in a calm and empathic tone. 
TLDR
I think she is TA for what she said and for the exclusion and the attitude but I don’t think she is TA for how she feels only because I can understand why she feels the way she does but that doesn’t excuse her actions"
DuggarsSnark,fpa2789,t1_fpa08kh,1588439312.0,what’s the weirdest craving you’ve had since you’ve been pregnant?
DuggarsSnark,fp8n60g,t3_gbxsaf,1588396870.0,Shit I wanna do this now. Think I know what I’ll be doing with my time lol
DuggarsSnark,fp8n1o0,t3_gc0hp4,1588396770.0,eat any tator tot Casseroles?
DuggarsSnark,fp8mxk8,t3_gby2z8,1588396677.0,This is a masterpiece that belongs in a museum
DuggarsSnark,fp8munt,t3_gby2z8,1588396610.0,I can’t believe how hard I laughed at this
AmItheAsshole,fp6z9my,t3_gbgytz,1588361206.0,NTA. You seem like an awesome step mom to your step son and sounds like you 2 had a blast. You reach out to Julie more than once and it’s her fault she didn’t get back to you
DuggarsSnark,fp6yykq,t1_fp6t6tx,1588361051.0,Holy shit
insaneparents,fp6pxkf,t3_gbhtso,1588356559.0,What an absolutely horrible excuse for a mother.
DuggarsSnark,fp68i2v,t1_fp5otx2,1588347979.0,he looks dead inside. I personally don’t think he hates her but he definitely is not in love with her. She loves him but he doesn’t return those feelings. I think he cares about her because she’s the mother of his child but that’s about it.
DuggarsSnark,fp67wqs,t3_gbbja2,1588347678.0,Did he ever actually go and sleep with any of the women he met on there?
cats,fp3ui9z,t3_gb1dtx,1588286047.0,She has accepted you as her human. Congrats
DuggarsSnark,fp2cry5,t3_gad2no,1588259494.0,I seriously cannot imagine being married so quickly to someone let alone the first person I ever dated. (first guy I dated wasn’t awful and while he’s kinda a cocky ass today Im still friendly with him)
DuggarsSnark,foz0sqa,t3_gad2no,1588182712.0,She also looks very pregnant here
AskReddit,fox3yt8,t1_fovzsln,1588133508.0,My mom and I went to punta Cana back in 2015. She told me to wait to post vacation picture until we got home. Which I did
DuggarsSnark,fovo58w,t3_g9rtcl,1588104623.0,He doesn’t look like he’s looking at her. Looks like he’s interested in something to the left of her
AskReddit,fovleoh,t3_g9ml8q,1588103296.0,My uncles WiFi used to be named YOUREWAKINGTHENEIGHBORS
AskReddit,fotqi0h,t1_fortfoc,1588062521.0,Yeeeeeeah
AskReddit,fotq4np,t1_foteh80,1588062147.0,Burt macklin FBI open up
AskReddit,fotpwzi,t3_g9gsuo,1588061930.0,Wanna cross streams?
DuggarsSnark,fotpeqb,t1_fotmf67,1588061428.0,what about Jill and Derek? Or joe and Kendra
DuggarsSnark,fotozp1,t3_g884zj,1588061007.0,I hate Lauren’s dress so much. It’s plain and boring. Also really hate sleeves like that
DuggarsSnark,fotovox,t3_g8nim5,1588060895.0,19 kids and close your legs
DuggarsSnark,fotoc6k,t1_fotgz9x,1588060369.0,Possibly pregnancy addiction
DuggarsSnark,forutr7,t1_foru4av,1588018898.0,😂😂
DuggarsSnark,forkt95,t1_foqs9io,1588013909.0,When I first read this I thought it said shit Catholics and I was so confused lol
unpopularopinion,fomdsag,t3_g83b2y,1587886407.0,i can normally just copy and paste the questions on google and have a quizlet pop up with answers.
AskReddit,fom3bzv,t1_fokqiua,1587877166.0,Good answer
DuggarsSnark,follgpu,t3_g77n8i,1587864806.0,Is there evidence that he actually went and had sex with the women he talked to on his profiles?
DuggarsSnark,folimz7,t1_folil2v,1587863036.0,Ohhhh okay. I was thinking it was “the torture house” or something
DuggarsSnark,foligpn,t3_g7eos8,1587862930.0,A lot of kids hair starts off lighter and gets darker with age
DuggarsSnark,folidpi,t1_foiniyk,1587862878.0,Okay what does TTH stand for I keep seeing it
cats,foj3dnw,t3_g7jcbs,1587806763.0,Blep
ChoosingBeggars,foj2e65,t1_foin39h,1587805644.0,"I live in Pennsylvania and in my town we have 3 different elementary schools. All 3 were overflowing so they built an extra school and call it the “intermediate school” so our schools go like this. K-3 is elementary. 4-6 is intermediate. 7-8 is middle school. 9-12 is high school. So I got a 6,8,and 12th grade graduation"
aww,foj25sy,t3_g7lx08,1587805381.0,He chose you guys
AmItheAsshole,fogt7fd,t1_fogpvqk,1587756702.0,Baby number 1 will be 2 on May 4th. he wakes up at 5am every morning like clockwork and screams to be let out of his crib. I’m 21 and love him dearly but he is great birth control
