todayilearned,fr64nxt,t1_fr6031v,1589919856.0,"Also fun fact its located in pakistan

Also kya hal hai ?"
selfharm,fr3o5le,t1_fosa9iq,1589861856.0,Legit haveing the same thing now
shittyfoodporn,fqqf3qf,t1_fqqdakj,1589564428.0,Yeah ik it's a shame
shittyfoodporn,fqqcve3,t1_fqqc3xx,1589563332.0,"Just imagine an extra heart attack american dinner 
Scratch that indian/Pakistani food is drenched in grease"
shittyfoodporn,fqq9qnb,t1_fqq050f,1589561801.0,Ahhh yes gulag jamun love then but they are just deep fried heart attack on diabetes
exmuslim,fqog0cq,t3_gjyi9m,1589514398.0,Eating with bare hands is more of a cultural thing let's not be eurocentric here
selfharm,fqnweih,t3_gjq2s8,1589502731.0,Thighs and shins
selfharm,fqnw8b2,t3_gjx3pl,1589502635.0,My mom found my bloodied tissues in the washroom I passed it off as I nicked myself while shaving
selfharm,fqio0j9,t3_gizure,1589398555.0,For me since I live in a Muslim household as a women I cant show my legs or my ankles ever so like no one sees them ever. My friends might have idk I hope not
selfharm,fqinkmi,t3_giwsm2,1589398386.0,Started at 18 still 18
selfharm,fqin6qp,t3_gj0g3g,1589398237.0,Live with a Muslim household as a female so I cant show my legs or my ankles
exmuslim,fqii4on,t1_fqhdzc5,1589396303.0,"https://discord.gg/WCuBMG

Here ya go"
Miniworlds,fpv23rh,t3_gfnbca,1588932105.0,"I hate my mind

I see a glowing vagina"
insaneparents,fputc05,t3_gdinfq,1588923006.0,Lol my mom everday
exmuslim,fpg0v0l,t3_gd9b67,1588590668.0,Lol same but I'm slowly working to get over it hanging with male friends and talking to them helped alot
exmuslim,fpg0p1p,t3_gcuee0,1588590505.0,I didn't even know it was a sin before I got more religious
godtiersuperpowers,fpfybdu,t3_gd4zxo,1588588078.0,Wouldn't you did from dehydration or just piss/shit yourself
selfharm,fo65zko,t3_g5or2h,1587547787.0,Me literally me . I wass gonna go cut instead cut my hair
exmuslim,fo0k1bj,t1_fo0j9r5,1587414532.0,Some are the NSFW channel is raunchy
exmuslim,fo0j7ql,t3_g3me32,1587414109.0,"Yo there's an entire discord for ex muslims come joins us there 

https://discord.gg/DEu4sb"
justneckbeardthings,fnphcem,t1_fnojbem,1587145517.0,Oof are you my mother??
blunderyears,fnk9gon,t1_fnk9732,1587019116.0,Lmao that comment was a long time ago lol
MakeNewFriendsHere,fni75d8,t3_g1uoz9,1586975118.0,"Made a couple nice friends on this discord server we play minecraft and talk together feel free to hop on. Lmaorcen made a pen pal too

https://discord.gg/4237Dn"
GrandePrairie,fnd6wc5,t3_g10uq7,1586861084.0,Idk if they are but alive at healing hands is really nice and does a good job
exmuslim,fnbaxrl,t3_fy7vns,1586812312.0,I'm lucky to have found one irl
exmuslim,fnbabv6,t3_fyjg3s,1586811999.0,My eyes
exmuslim,fnb9flw,t3_fzel3l,1586811539.0,The server is so meh
exmuslim,fnb7wl8,t1_fn9l3a1,1586810772.0,Same just water fast for 18 hrs lovely
exmuslim,fnb2gac,t3_g0o4te,1586808042.0,Holy fuck same dude I'm stuck till corona is over let's hope we can go back
justneckbeardthings,fn4243y,t3_fzayws,1586632505.0,Lmao it's from the show peaky blinders
blunderyears,fn3wro5,t3_fyxy8r,1586629439.0,Your short grandma looks like my 6th grade teacher and it's making me trip.
BlackPeopleTwitter,fmxopcq,t1_fmwf7ed,1586468949.0,Me at my mom telling me to wear longer shirts and not wearing shorts at home.
amiugly,fmu21lr,t1_fmt8fic,1586383109.0,Exactly
InsanePeopleQuora,fmn7uak,t1_fmmsctp,1586220046.0,Felt that
InsanePeopleQuora,fmms0bp,t1_fmmq5kv,1586210959.0,Could be but mom was never the flamboyant fashionable type though
insaneparents,fmmlsp7,t3_fw4vic,1586207623.0,"My mom except 
 To me

Yall need allah"
insaneparents,fmmlikk,t3_fw0zzo,1586207473.0,Same I used to be kinda open and they saw my face and I tell them I'm sad. And they sas stop being lazy/ungrateful and move . Idk I think I might be bipolar lmao with mom who says that's caused by my lack of belief ha
InsanePeopleQuora,fmmkvm3,t3_fw1mzf,1586207130.0,"From my mom

""If you dont dress up/pretty enough your husband will leave you for another woman"""
exmuslim,fmj5fu3,t3_fuxsje,1586123406.0,Maple syrup land
exmuslim,fmisyay,t1_fmia8op,1586116278.0,Ayy net the dude
teenagers,fmfw555,t1_fmf2xtd,1586036092.0,Yay another human whose scared of intimacy even if they want it oof
bisexual,fmfuubg,t1_fmftfuc,1586035315.0,I had a weird religious phase and tend to suppress any crush I get trying to get over that lol
bisexual,fmft2t4,t1_fmft027,1586034266.0,Yassss . It's funny cuz when it first happened i was so embarrased and ashamed I suppressed it lmao
bisexual,fmfsoew,t3_futfhg,1586034026.0,My first gay crush aahhhhhh
2meirl42meirl4meirl,fmc3lxl,t1_fmc3j5z,1585938269.0,Feels bad man rip
exmuslim,fmbzb15,t3_fu6yk0,1585935979.0,My agnostic ass*
curlyhair,fmbz8co,t3_fu9q99,1585935939.0,My only sex appeal is my hair cuz it distracts from the face
2meirl42meirl4meirl,fmbyx9h,t3_fu6ari,1585935776.0,Ha told my therapist I'm fine and dont need it but like I do I cant trust people like that
funny,fm9arir,t3_ftmrlu,1585864978.0,r/VredditDownloader
2meirl4meirl,fm8f6ox,t3_ftjwln,1585848311.0,If yall want you can come hang out with me and my friends in discord we're chill . Always nice to meet new people
exmuslim,fm1rn5w,t3_fs36r2,1585683774.0,"18 Canada, family wont ever but my distant/online friends do"
exmuslim,fm1rcvh,t3_fruqh1,1585683627.0,Lmao big fucking relate
exmuslim,fm1r4un,t3_frrxzh,1585683509.0,Some.mosques smell so bad and dank its nasty
exmuslim,fm1qyob,t3_fs3zpd,1585683421.0,I'd be down though I prefer over vc o n like discord
exmuslim,fm1qats,t3_fs6nlw,1585683081.0,I contemplated suicide cuz religion and eternal punishment back then . Now it's just other mental things I need to deal with religion gave me false hope though
AskReddit,flyb4gl,t1_flxfqqf,1585598858.0,Same
exmuslim,flwkabp,t3_fp2mms,1585553837.0,Idk but I really dont want shit and piss residue fermenting down there
exmuslim,flvk8ns,t3_fqqxtk,1585525643.0,It would be so easy if I were more attracted to girls I swear being in a lesbian relationship would be easier
exmuslim,fluwhq5,t3_fra9ae,1585511493.0,Me
exmuslim,fluqsxl,t1_fluqqdy,1585508095.0,Oh yeah just noticed . Lol this guy all high and mighty and now being hypocritical lmao
exmuslim,fluqalv,t3_fr7fgb,1585507795.0,Its punjabi lol
AskMen,flum9dm,t3_fqudf0,1585505453.0,As a female I do too  sometimes
menwritingwomen,flucw9j,t1_fltxzg0,1585500092.0,Yikes the plath coping method
PourPainting,flt5slv,t1_flspxqf,1585460169.0,My first thought too
TikTokCringe,flrow0j,t3_fqc74n,1585424719.0,r/VredditDownloader
ATAAE,flrlfng,t3_fqllhc,1585422631.0,"This is getting pretty close to beastiality × child porn 

FBI help"
bisexual,flri2zp,t1_flrd7ms,1585420651.0,Ha me.....
bisexual,flrhz9b,t1_flqvn3q,1585420589.0,Ha same
bisexual,flrhw70,t3_fqjfvt,1585420539.0,I'd be fuckibg gay for roza Diaz
Instagramreality,flonak3,t3_fp7b5q,1585341618.0,I think it's just a trend there one of my Japanese acquaintances most of the time posts really creepy looking fractured images
exmuslim,flldcah,t3_foxyhb,1585258175.0,I really tried to be religious and hit as many prayers. Also stayed up for extra prayer in the morning I used to cry in my prayers. I used to pray god would kill me as a believer before I become a non believer. I used to watch scholars in my free time and avoided music and making friends with the opposite gender even if it was platonic
RoleReversal,flkwhi4,t3_fpcy8c,1585248983.0,Man I want that buff body
curlyhair,flhpe7z,t1_flhp42u,1585166999.0,Big f maybe we could put it up somehow and fo a satin wrap idk
curlyhair,flhoke1,t1_flh9tsi,1585166554.0,My hairs to short to pineapple lol
steam_giveaway,flhjly5,t3_fosenx,1585163902.0,789
Botchedsurgeries,flfw4xa,t1_fkwvhf0,1585120132.0,Some of us are broke my friend oof
insanepeoplefacebook,flfvfqh,t1_flcrt37,1585119326.0,Oof sounds like me accept I had a hard time making friendships or even being close with a guy . Mom made it seem like men were horny rape monsters and dmstill restricts me from what I can or cant wear . Shes become uber religious lately and goes off on me wearing leggings or ankles showing. No wonder I'm still socially underdeveloped
exmuslim,flehd24,t3_fmy4x6,1585084415.0,I kinda do understand there perspective buts it's also a pandemic
exmuslim,flefxga,t3_fo43kt,1585083633.0,Mom is apparently paranoid about me getting raped so like she doesnt let me go some places and wearing fitted clothes will make my dad do the no no to me . Wtf is this bs
2meirl4meirl,fldy5wb,t1_fldwstv,1585074005.0,"Well then ik what ik doing when I'm 25 yeet 



I'm joking or am I lol"
2meirl4meirl,fldwmq1,t1_fldwdu8,1585073155.0,Where the hell does on get argon
2meirl4meirl,fldsezq,t1_fl9vdik,1585070794.0,Ha same moving back home dosent help eithet
2meirl4meirl,flds96k,t3_fnxnh0,1585070706.0,That's why I plan to use carbon monoxide poisoning
2meirl4meirl,fldrpjl,t3_fo3p27,1585070403.0,Me on reddit yikes
exmuslim,flbxwn1,t1_flbx624,1585015174.0,Yeah and now people are losing their jobs cuz corona bruhhhhhhh
exmuslim,flbujk1,t3_fnvwd8,1585012926.0,"Charity/ helping others out

But that's just human nature"
exmuslim,flbu8u0,t3_fnlm8g,1585012732.0,Yeah had return home because of corona my mental health is gonna tank yeet
exmuslim,flbu40e,t3_fnu8fr,1585012643.0,My parents spent around 20k bro..... they could've used it for so much better things. And now mom became hella religious
selfharm,flattmn,t3_fnpi4p,1584990991.0,Idk i use a razor cuz part of me is afraid how deep I'll go in a frenzy plus with a razor you cant hurt your self as much
selfharm,flat9o9,t3_fnebof,1584990675.0,18 and the first time I cut was a month ago after resisting for about a year
selfharm,flat0zf,t3_fnp9xg,1584990539.0,"Same :/ I had to return home because of Corona and now I keep remembering all the panic attacks I had in my room and kinda panic or wake up feeling shitty well imma fail school . Anyways I guess if you wanna talk to people this discord helps I made a friend there idk

https://discord.gg/cvRVBG"
exmuslim,fl99bn8,t3_fnbkp5,1584945719.0,18f bi curious still figuring it out
exmuslim,fl8mgpk,t3_fn8q7q,1584927103.0,I didn't wont cant. It will break my family though I did have freedom in dorms for 3 months before Corona hit . That was a nice time was gonna get alcohol but like age was 19 in that province
SelfHarmScars,fkwyar5,t3_fkz3u6,1584611253.0,Trust me when I say its addicting stopping it early wood be good. Anyway when I started I had this huge henna  tattoo I did on my thigh and it stopped me when going around that area. So maybe doodling something you like might help . Stay strong ik it can be hard but proud if you for wanting to stop
DebateReligion,fkuvwkk,t1_fkuvqey,1584557125.0,Right not bengali but like mom git really religious and started preaching the end times
feemagers,fkutoa3,t1_fku3ca3,1584555936.0,Never my insecurities reeeee
teenagers,fkt9tb7,t1_fksxu6m,1584510936.0,I mean I made a couple good friends on there if you want the link to it
henna,fkrh1ps,t1_fkrgzpf,1584468720.0,Still  pretty good keep up the good work
henna,fkrgnqb,t1_fkrgin6,1584468500.0,"Aww thank you. Lmao when you cant go steady you go sketchy 

Well we all have our strength you with really good hand control"
henna,fkrgcsw,t1_fkrg6o1,1584468329.0,"Not sure but I have a sketchy loopy retailed styled . I did a snake I was inspired from here 

Usually for me drawing it out and doing it works idk"
