BPDlovedones,fr0gohy,t3_gkfr4a,1589795003.0,"I'm having this issue with my gf. I've noticed just about every time we make plans ahead of time to hang out, even if it's just getting some snacky food and watching movies, she'll either blow it off or find a way to sabotage it by starting an argument over something completely inconsequential.

Tonight it was over cheese dip. We'd planned to get some frozen pizzas, chips, and dip and spend some time watching a show tonight. I get back from the store after finding the last bag of the kind of chips we wanted and the last queso dip with jalapenos. I'm all excited and happy to tell her I got the right stuff, and this is how the conversation went:

""Why'd you get jalapeno dip?""

""?? We've gotten spicy queso before...""

""I've never gotten queso with jalapeno dip!""

It then spirals into a circular argument of her FOR SOME REASON trying to tell me that other spicy dips with various peppers in them don't count, that if she'd found the dip herself it would have been a ""special moment"" for her because she likes it, the whole time I'm just trying to tell her this doesn't need to be an argument and if she wants me to go get something different I will, then she says that's not what she's saying, throws it back on me and accuses me of yelling at her even though I'm not, I'm exasperated at that point, and it ends with her declaring ""We're done"" and asking me to get away from her bedroom door before she shuts it on me. 

This is not even close to the first time she's sabotaged what should have been nice plans. But if we decide to do something spontaneously, it's usually fine. I just...why?"
BPDlovedones,fr0fhoo,t1_fqr2aot,1589793762.0,"Had a former friend/roommate do that to me. Me and my ex moved in with her and her bf/later husband after falling on hard times. She'd admitted in high school that she had a crush on me but I had made it clear I didn't feel the same. Things started off great. We worked well together, the four of us would clean house together at least once a week, we all had plans to get jobs and save to move out of state, ect. Things started getting weird after a few months but I was already in such a fragile state mentally my mind couldn't handle or recognize what was going on.

* She'd do things like flash her chest and claim it was because she'd gotten too high on weed.
* She'd get overly affectionate with me, then get upset that her husband was at work (she eventually started ignoring/devaluing husband).
* Would refer to me as her ""pet lesbian""
* Would do things to intentionally stress the hell out of my ex if they were home alone behind my back (I still kick myself for not catching on to that).
* Sabotaged her jobs every time we'd get to a point where we could save money.
* Became verbally and emotionally abusive toward her husband.
* Cheated on her husband and vehemently denied it even though she wasn't making any real effort to hide it.
* Started stealing mine and my current gf's portion of the wifi money, then would blame my gf for the internet getting throttled because she works online.

I had told her a few months prior to my move out date that I was planning to move the same month they were going to have a major apartment inspection. I wasn't on the lease and didn't want to risk them getting kicked out from me being there. After piecing together her manipulative, sabotaging ways, I decided it would be safer if I didn't tell her exactly when I'd found a place. I knew she would find a way to fuck it up. So me, my gf, and my best friend moved all my shit out in one night while she sent her husband out in the living room to angrily monitor us while she hid in her bedroom and wouldn't come out. Found out a couple months later from a former mutual friend that she started a smear campaign against me claiming I just up and moved with no warning, when I'd moved during the month I said I was going to.

I figure she didn't take it seriously because she knew she'd be able to keep me there if she had enough prep time and got mad when I didn't give her the opportunity. She popped back up in my dead tumblr inbox last month insulting my physical appearance and trying to shame me for ""losing so many friends"" because I didn't understand that ""all (gf) wants is to abuse you"" (gf is most likely BPD too but that's another can of worms). These ""friends"" she's referring to are our diagnosed BPD neighbor that kept me around in between her dysfunctional relationships because she knew I was crushing on her and smeared me as soon as I got a gf, and roommate's emotionally and mentally fried husband that she treated like absolute shit. So basically she's shaming me for ditching a group of abusers and enablers."
Actuallylesbian,fr08irj,t3_glotpp,1589787053.0,"Best date: Went to see Cats live for the first time.

Worst date: Went to a hookah lounge with very unstable ex, her friend, and some people we'd met throughout the week. Turns out ex was WAY more controlling than I realized. Girl that was hanging with us wanted to go to a bar. Ex didn't and was becoming increasingly manic. Girl ended up being an alcoholic and a recovering heroine addict, so she was somehow trashed by the time we walked from the hookah lounge to the bar to find her and meet up with the other friend that followed her. Ex gets upset and goes running down the street. We end up at drunk girl's apartment where she spills everything that had happened over the past few months, including her gf dying of an overdose. I'd like to point out here that this is literally the most we've interacted with this girl since we met her. A bunch of random people show up with at least one kid and we eventually leave. It's been seven years and I still don't know wtf to make of that night."
TooAfraidToAsk,fr07prt,t1_fqwbp3h,1589786312.0,"I'm glad you realized and have decided to do something about it as opposed to bury it. It took me 27 years to realize why my immediate family's little bubble is so isolated from the rest of these distant relatives I've heard so much about but have either never met or only met once. They all bury the toxicity and pretend it's not there. Anyone who threatens that bubble is ""subtly"" pushed out."
conceptart,fqu85a1,t1_fqu7wvp,1589653879.0,Haha thanks. Have an upvote. :)
conceptart,fqtc14u,t3_gkpsiu,1589635731.0,"Wow, there was clearly a lot of thought Putin to this."
TooAfraidToAsk,fqtaooh,t1_fqqsbz2,1589634775.0,My dad was consumed by bitterness which is what contributed heavily to his abusive behavior growing up. That's a huge motivator for me to not go down that road.
Cyberpunk,fqpgoow,t3_gk5i51,1589545940.0,This is that real shit I've been waiting for. People need to realize the leverage they can have and why the internet needs to stay free. It's a balancer.
AskReddit,fqpg2ey,t3_gk1ixa,1589545477.0,"I had a guy try to argue with me on here once about a lesbian gif not being ""real enough"". The two women were very clearly into it, but they weren't screaming dramatically and making goofy, exaggerated faces.

The guy said I didn't know what ""real women"" were and told me to go find one.

I'm a lesbian."
TooAfraidToAsk,fqp3j6s,t3_gk1zkq,1589533741.0,"Oh, yeah. Not as often anymore because I'm actively working on letting go of the bitterness before it consumes me, but I have fantasized often about telling the entirety of my living family off and shoving my entire unacceptable self in their faces. They love their idea of me more than me so I'm not wanted around."
BPD,fqp2zyl,t3_gjlupt,1589533186.0,"You're on your way. :) This internet rando is proud of you. If you find psychology interesting at all, I suggest researching neuroplasticity. You might find some useful info to help you along."
Androgynoushotties,fqp2ooa,t3_gjqudm,1589532871.0,"Make it a double, please."
BPD,fqp20qs,t3_gjwy7t,1589532197.0,"""It is said that one day the Buddha was walking through a village. A very angry and rude young man came up and began insulting him, saying all kind of rude words.

The Buddha was not upset by these insults. Instead he asked the young man, “Tell me, if you buy a gift for someone, and that person does not take it, to whom does the gift belong?”

The young man was surprised to be asked such a strange question and answered, “It would belong to me, because I bought the gift.”

The Buddha smiled and said, “That is correct. And it is exactly the same with your anger. If you become angry with me and I do not get insulted, then the anger falls back on you. You are then the only one who becomes unhappy, not me. All you have done is hurt yourself.”"
AskReddit,fqcxceg,t3_ghkw99,1589272170.0,"My Month of 420 plans that involved my gf, best friend, several joints, a few bowls, and an Asian buffet. >.>"
AskReddit,fqcx8vv,t3_ghtwbr,1589272070.0,Get some friends together and go to a hookah lounge. Might bring a Switch and have a Street Fighter competition.
AskReddit,fqcx4v8,t3_gi01uq,1589271958.0,"Several reasons. My parents were shit growing up and I know I've learned/inherited their impatience for children. The last thing I ever want to do is put an innocent child through anything even remotely similar to what I went through. The thought of pregnancy mortally terrifies me due to me knowing I wouldn't be a fit mom, and not currently having the financial stability to care for one.

I'm perfectly happy living for myself, the grown people in my life, my cats, and eventually my bees."
AskReddit,fqcwya0,t3_gi245o,1589271775.0,Dizzy Grizzlies. There is part of me that will always be salty that they were replaced with bland teddy grahams. Those cookies were goddamn delicious.
AskReddit,fqcwvxo,t3_ghxqgj,1589271708.0,"A shellfish platter.

I'm allergic to shellfish."
AstralProjection,fqcvsgo,t3_gi14tv,1589270624.0,"As someone who used to frequent the old otherkin and therian communities, we had a name for these people. He's a fluff."
BPD,fqcvbyu,t1_fqcnewc,1589270173.0,"We had a conversation the morning after the fight and went over some dealbreakers and things we can try to focus on in a few areas. I don't feel it went as in depth into her issues specifically, but it's something. If she gets violent with me again, that's it."
AskReddit,fqcea5x,t3_gi3j40,1589256096.0,"Former friend/roommate stole a wolf mask my gf got me for Christmas, along with stealing the wi-fi bill money I gave her. Pretty sure her husband had been stealing my weed. Never could figure out why she stole the mask, but she was stealing the wi-fi money because she was jealous of my gf and was hoping she could fuck with her online income enough that she'd leave. She would blame my gf for ""using a lot of data"" when it would get throttled less than a week after she supposedly paid it. I moved as soon as I could and don't speak to her anymore."
StonerPhilosophy,fqccecy,t3_ghwlnd,1589254842.0,"I remember being young and ""picking up"" on how characters in anime acted. I was a young teen at the time so I was able to recognize it and not act weird around people, but I definitely noticed the change in my thought patterns."
BPD,fq9xmw7,t1_fq9jk49,1589209041.0,"When her symptoms aren't controlling her, she is one of the most intelligent, logical, compassionate, beautiful souls I've ever met. She's become a completely different person over time, and I believe it's because we've been triggering each other without meaning to.

If there is any hope of restoring the trust we had for each other and re-regulating ourselves, I want to take it."
BPD,fq9xcoj,t1_fq9khoy,1589208885.0,"She has openly told me she has trouble putting herself in other peoples' shoes. I know she can do it, but she has to be really focused and I understand that's impossible to do in a highly stressed state. 

As for her being suicidal..she isn't actively. She's one of the most resilient people I've ever met, but she does self-harm and her taking her life somewhere in the distant future does worry me. Back when we were teenagers, she told me she knew she would die before she turned 30 because she was afraid of aging. Now she looks forward to aging and giving no fucks, and has accepted the changes her body will go through. Now she tells me if she feels like she'll never find the peaceful home life she desires, she will end her life. I know I'm not her last attempt, so if we don't work out, she will move on to the next thing. I want to believe she has enough of a drive and will to live that she wouldn't go through with it if enough time passes, but I can't be for sure."
CongratsLikeImFive,foizcwm,t3_g7d9na,1587802337.0,Definitely look up the 2020 complete JavaScript course on udemy. I believe it's still highly discounted and it's been my favorite course so far. :)
u_PM_ME_UR_PULP,flzt2j1,t3_fru4qa,1585632706.0,"Oh my my, it's been a while since I've gotten that turned on that quickly..I need to give and receive some attention like that..😍💙"
rant,flstpra,t1_flqye0b,1585450554.0,"I've struggled with my feminity since I was young, but now that I'm adult I've matured a lot and have a more solid view of myself. For me personally, it was a sort of defense mechanism. I'd suffered some deep trauma at the hands of a man during my childhood and I was desperate to be taken seriously and not brushed off. ""Can I get some strong men to help me lift this?"" ""When are you gonna get a boyfriend and get married?"" ""No let me do that for you because you're a feeble woman."" That's what I felt like I was constantly fighting against. It still happens to this day, but it doesn't get to me as bad because I'm more confident in myself. I don't feel like I have something to prove."
NatureIsFuckingLit,flp392z,t3_fq0wfp,1585350772.0,Send nudis.
cats,flp34dc,t3_fpwoe3,1585350697.0,Someone needs to draw that side-eye side-smile he's got. <3 <3
Internet,flowur2,t1_fli7zmo,1585347120.0,"As someone who has spent the past two years cleaning the garbage off my vibe, I couldn't agree more. I was in a very bad place mentally, and surrounded by people who were even worse off than me in that regard, for quite a while. When you're in it for that long, it's a truly identity-shattering process to get out of it. Some people aren't ready, aren't strong enough, or don't have the right support system to break out of it."
rant,flez3km,t3_fo0gmt,1585094478.0,"Agreed and I'm seeing just as many boomers brushing it off and refusing to stay the fuck inside or take precautionary measures because ""I ain't scurred!"" 

I had to explain to one of my older coworkers the other day that it isn't a flu just because it has a couple of similar symptoms. -_-"
cats,flc3rt7,t1_flc3p4b,1585019157.0,It's been about a decade since I studied French so I only remember bits and pieces.
cats,flc3hu9,t1_flc3bwv,1585018958.0,Mèrci! ^-^
LesbianActually,flc2znk,t3_fnn9z2,1585018602.0,Brb learning Spanish. 😍
cats,flc2fnn,t3_fnu18f,1585018224.0,"Hong Hong Hong je tre beau chat petite baguette~
(I think I destroyed the grammar in that sentence..)"
Internet,flc1n0x,t1_fla2roi,1585017686.0,"Agreed, and I believe the internet is the best possible way to do it. Instead of focusing purely on positivity, we need to cultivate compassion and understanding. We need to learn how to navigate our darknesses without trying to force them away or ignore them. 
The human race needs to focus on shadow work right now to get to the roots of our wounds, figure out how those wounds have manifested in the external world, and work to heal them."
Internet,fl90z5g,t1_fl8z1oz,1584937630.0,"The only way I can answer that is use what I've been doing lately as a small example. I disconnected from social media for a few months to break my addiction. When I came back, I redid my social media profiles so I no longer see any self-deprecating content (depression memes and such), and I'm working on being more selective about the things I share to leave a positive message or impact in same way. I'm also being more selective about the sources of knowledge I share to avoid potential misinformation, fear mongering, or pseudo-science and spirituality."
casualiama,fl8wtx3,t3_fmzwxs,1584934349.0,"You're socializing right now. You just need to transfer the confidence you have on the internet to real life, at least to some degree. Do you care what some troll online says to you to make you feel bad? Apply that to real life. :)

I've struggled with that exact thing for most of my life and I finally have it under control. There are a few YouTube channels that helped me get there if you're interested. Therapy in a Nutshell, Einzelganger, and Academy of Ideas. 

You seem like a really down to earth, self-aware person that's down on your luck and yourself. You'll get out of this. :)"
ImaginaryBehemoths,fl8wgzc,t1_fl88r22,1584934079.0,You have to have a dry sense of humor for Coronavirus puns. The people who get them are often left breathless.
AstralProjection,fl8u8ax,t3_fn51wj,1584932433.0,"My experience is purely anecdotal so take it with a grain of salt. I practiced remote viewing a lot in my younger years and was very good at it. Most of my friends were online so I was able to experiment with it often, and as long as I had a strong emotional connection with the individual and they weren't shielding, I could get a good bit of detail in my mind's eye on what they were doing and where they were, and confirmed it with them in ways that wouldn't have sparked power of suggestion. It is possible, but there are a lot of variables in your situation that I can't account for..

I'm so sorry for what you're going through. I wish you the best in finding her no matter which way you do it."
badcode,fknssp2,t3_fj6jco,1584373169.0,I have just barely dipped my toes into coding and the thought of hardcoding a specific username and password made said toes curl.
Androgynoushotties,fknrz19,t3_fjbh6r,1584372677.0,"Those *eyes!* Oh, the things they've seen. I know that look well."
AskReddit,fk3bxds,t3_ffy47s,1583826028.0,"Laws and product labels that tell people not to do obviously dangerous things, or to keep certain things away from children. You know someone has done it at some point and attempted to sue the company over it."
coolguides,fjq2wnu,t3_feps2v,1583566306.0,"Paper wasps have always been bros with me. My grandad's barn was full of them throughout my childhood but they never bothered anybody. They'd fly up and stare at me for a second, or even land on me, but never stung.

As soon as I have the space and money, I'm getting my own honeybee hives."
selfimprovement,fjpf0vs,t3_felb5n,1583549094.0,"Ask yourself why you are feeling this way. Write it down if you have to, and go from there. There is a therapist on YouTube I found recently that has already helped me start to turn my mental health around so much. I know YouTube doesn't have the best rep, but it may help. No harm in looking. The channel is Therapy In A Nutshell."
nosurf,fjny6w6,t3_fec57l,1583516704.0,"I don't know about where you're from, but my home town was socially hostile and judgemental as shit to anyone who wasn't hardcore Christian and conservative. Where I currently live, people are generally only randomly social when they're on something or mentally disturbed. Plus I don't like my space being bothered by someone I don't know without invitation. Puts me in an awkward position because if I decline the conversation, I'm seen as the rude one as opposed to the person who decided to invade my space without asking."
AskReddit,fjmw5ws,t3_fe9a9b,1583486980.0,"Lived with a fairly close high school friend for a few years in my early to mid 20s. Ended up moving out suddenly without telling her. My girlfriend helped me uncover the wool I'd been keeping over my eyes because I'd been in survival mode for most of my life up to that point and was too mentally broken to deal with reality. 

""Friend"" had been sabotaging me and her bf/husband financially the entire time I lived there. We'd talked about pooling our money together and moving out of state, but every time we'd start to get a handle on things and save money, she'd quit her job or find some way to lose it. Or she'd convince her husband to quit his citing his multitude of health issues related to a bad accident he had a few years prior. Since I wasn't on the lease, I couldn't even save up enough to get my own place since I'd have to pay extra to keep a roof over everybody's head. I was the only one with an income for about a month and a half, and neither of them seriously started looking for work until I had a full breakdown. Literally all they did was sit around watching shows and playing video games. Their house was constantly filthy.

When my girlfriend moved in, they started stealing from us. Ex-friend stopped paying the WiFi bill even though we paid more than half of it, but would lie and say they did, then blame my girlfriend when the internet would get throttled (gf works online so friend was trying to mess with her income). Husband stole girlfriend's juul and ended up putting it back in a place we never would have put it. Weed would go missing even though we'd give husband some any time he asked and would leave some in his piece if we used it. Friend stole a mask girlfriend got me for Christmas and it never turned back up. 

They also neglected the fuck out of their animals. They had two dogs and two rats. The dogs weren't given enough food so they were food aggressive and the bigger one was an uncontrollable food thief. The carpet in their bedroom had to be ripped up and deep cleaned because of the animal piss and shit since they rarely, if ever, let them outside. The rats were even worse. She eventually got bored of them, and didn't want to put in the effort to socialize the feeder rat she'd stupidly bought, so she eventually stopped feeding them. When I left, they were confined to an empty cage 24/7 and were lucky if they got watered or fed at all. They fought constantly and were stressed and miserable.

I moved without telling her because we'd told them three months earlier that we were planning to move by a specific month, and we knew she would sabotage us if she found out we'd found a place. Found out a few months later they got busted by the IRS for lying about their income in a government assisted apartment and got kicked out. Good riddance."
AskReddit,fjmvbgk,t3_fe9li4,1583485776.0,Had a sociopath bitch of a roommate several years ago that didn't like me or my girlfriend at the time. She had a friend over one night and was drinking and spun out on vyvance. She turned the heat up on the dryer in an attempt to destroy my clothes. Luckily nothing caught fire and the worst damage she did was fade a pair of pajama pants.
AskReddit,fjmuyng,t3_feascn,1583485268.0,"""No no, wait wait. Aah~ ah~ ah~....AAAAAAAAAAAHHHHHHHHHHH!!!!"""
AskReddit,fjmusrw,t3_fe6dto,1583485040.0,If I was thinking of my favorite quotes from that segment of my own space at all of them is the best cuddles tonight.
AskReddit,fjmu8yu,t3_fbg8e9,1583484284.0,"I have a small crush on one of my co-workers and have since the first time I saw her. We talk, hang out outside work sometimes, and we get along. I think she has a crush on me too from the way she opens up around me, and I've picked up on her subtly flirting with me on multiple occasions.

The problem? She has a fiance and is in a monogamous relationship (my girlfriend and I are very open). I fucking hate her fiance and so do our other two guy friends. He's the type of person that you just have to take one look at and you instantly get a really nasty vibe from him. I kept checking myself because I knew my perspective would be biased. ""Maybe I'm just being jealous. Maybe I'm looking for reasons to dislike him. Maybe I'm exaggerating his flaws."" No. His behavior backs up the vibe. He's extremely inconsiderate of her boundaries. I've noticed him sneakily trying to be inappropriate with her at work and then denying it when she gets angry at him. The way he talks to her when he thinks no one is listening is fucking gross. He puts her down constantly, but does so in a playful enough way that most people wouldn't catch it unless you know what to look for. He comes across as very insecure and possessive. She'd worked there about two years prior to me, and they've known each other since high school. It took her a while to come out of her shell and start talking to people. I thought it was because she was really introverted and shy, but now I know where it comes from. Shortly after she started opening up and socializing more at work, he got a job there and transferred to her department as soon as he had the chance. He popped the question to her shortly after that. The timing seems really red-flaggy. 

I'm worried about her, but I don't think her and I are at the level that a conversation like that would be appropriate. I'm also afraid he'll ramp up his isolation  tactics if he thinks she's even considering leaving him."
AskReddit,fjmtgiv,t3_fcbntx,1583483220.0,"I lost my pencil one day while taking notes for a programming course. Decided to use a pen and found it more useful than a pencil, since I had to write out why I'd written something wrong rather than erasing it."
AskReddit,fjmt40f,t3_fe8pdn,1583482766.0,"- Put heart and creativity back into video games instead of making them glorified slot-machines or subscription services.

- Put an end to the rampant abuse of employees.

- Tell major publishers encouraging this behavior to go fuck themselves."
AskReddit,fjmsuf9,t3_fe3o4v,1583482428.0,Had a coworker try to convince me I should want kids because it's what god wants and singing 'happy birthday' is fun.
