AskReddit,ff5jwut,t3_err239,1579596389.0,"The year of the migraines. I reached a point of chronic stress that was triggering chronic headaches. Migraines were triggering at least twice a week or more. They got so bad that no OTC medication would touch them, I was throwing up, my motor functions were frighteningly impaired, I couldn't see straight, ect. I was in the ER multiple times for steroid shots due to not having health insurance at the time.

Imagine feeling like your entire brain up through your skull is splitting from the inside out. Thinking hurts. The entire time it's getting worse and seeping down into your neck and shoulders. It's horrific."
AskReddit,ff5jm57,t3_erqyyz,1579595963.0,"The weirdest shit tended to happen in the ridiculously rich areas just outside of town. 

\- Found a woman waiting for me in her garage so sloshed she could barely make it to the door. Brought her food inside for her, got lunged at suddenly by a dog I wasn't prepared for, and some greasy looking equally as drunk man was sitting at the counter. I'm a woman, so looking back on it kinda creeps me out in hindsight.

\- Had a typical rich brat teenager and his buddy come to the door shirtless on a school day and ""subtly"" flex their abs at me. I hope they heard me laughing as I left.

\- Someone's goat kept putting her hooves up on my car to look in my window. She didn't want to let me leave."
AskReddit,ff5j0zl,t3_erpwfx,1579595137.0,"Smoke weed before going. Smoke a joint or pipe in the car on the way there. Bring a vape pen and go out to the car in between plates to keep the munchies going.

I spent last 4/20 at Golden Corral with my best friend and girlfriend. It was fucking glorious."
AskReddit,ff5iphd,t3_ero8mj,1579594698.0,"An uneasy split of relief and discouragement, immediately followed by the angst-fueled motivational fire I had back then."
AskReddit,fexzbjl,t3_eqqbz1,1579438698.0,"I was with my childhood cat for her final moments. She was 19 years old and I'd had her since I was 2 (I was 21 when she passed). She had been showing signs of declining health for a while. One day my mom called me and said she'd been hiding under the bed, wouldn't eat, and wasn't breathing normally. I immediately started crying, told my second job I wouldn't be coming in, and went to my parents' house to get her. When I went to pull her out from under the bed as gently as possible, she meowed in pain. As soon as she realized who I was, she relaxed into my arms and it seemed like we both knew what was about to happen.

She rode in my lap wrapped in a towel the entire 40 minutes to the vet while my now ex-girlfriend drove. Brought her into the vet in tears and told them what was going on. They took her to the back to put her on oxygen and stabilize her, and all I kept saying was I needed to be near her because I didn't want her to be scared. They brought her into the room I was in and gave everyone a few minutes to say goodbye. The vet was already choking back tears when she came in. She asked me how long I'd had her, and she broke down when I told her. 

My cat wasn't afraid at all. She was calm and kept raising her head to lick my face and comfort me. It sounded like she was trying to purr despite not being able to breathe. She was a wise cat and was letting me know she would be okay. I kept my forehead against hers until I felt her leave, then I couldn't stand anymore and dropped to my knees sobbing. She lived a full, happy life, but it was still one of the hardest experiences to help her pass on."
AskReddit,fexxr1o,t3_eqr19p,1579438048.0,"I learned the hard way that most foods that claim they contain real crab are actually fake. I had a tiny bite of sushi containing real crab at a sushi restaurant. I'm **extremely** allergic to shellfish.

Thankfully my former rooommates and I were almost home, so it was the side of the road in the middle of the night. No witnesses other than them. which was embarrassing enough."
AskReddit,fexvp1m,t3_eqlblo,1579437216.0,Satoru Iwata.
AskReddit,fexuv63,t3_eqohhz,1579436826.0,Put me in one of those full-body pods or urns you can plant a tree on. Traditional funerals are so wasteful. We could reforest the entire planet and then some if we started giving our bodies back to the Earth when we're done with them.
iamverysmart,fecsi9f,t3_eo2dzw,1578982929.0,"That's called anxiety, buddy. Just because you have a racing mind doesn't mean you're intelligent."
AskReddit,fecryoc,t3_eodtd1,1578982346.0,"My last roommates actively prevented improving their situation for at least five or more years.

I moved in with them in 2016. The woman was an old high school friend, the guy is her high school sweetheart and they married while I lived there. I had found myself in a bad spot and they offered the spare room in their apartment. My ex and I only planned to stay for a few months while we got back on our feet. 

Turns out I had dramatically underestimated my now former friend's mental issues. She's most likely BPD, is fully aware, and has absolutely no desire to address it. She spent the entire time I lived there lying, manipulating, sabotaging us and herself (she quit multiple jobs because she 'couldn't handle' them, but she always did it as soon as one or more of us had started being able to save money), you couldn't talk to her about any of it without her having a complete mental breakdown, she's emotionally abusive toward her husband which lead to her cheating on him and barely trying to hide it, ect. The final straw was when my current girlfriend and I caught them stealing from us. My girlfriend's income is online, so the woman roommate started using our wifi money for other things, and then lying to us and claiming it had been paid. We found proof three months in a row but had to play it safe because we knew she would ramp up her shit to make sure only my girlfriend would leave and I'd be stuck. 

Wrapping things up here before this gets too long. A couple of months after we moved out, I found out they were busted by the IRS for lying about their income in a government-funded apartment and got kicked out. I'm not sure where they ended up, but I know they most likely had to give up the two dogs and two rats they had been neglecting horribly, and they would have either had to move into the guy's parents' house (woman's personal hell) or move into a much more expensive complex. They got karma-nuked."
cannabis,fdut6hs,t1_fduow81,1578738427.0,"Me: So I could go to a psychiatrist and be prescribed anti-depressants that I'll be expected to take every day?

DEA: Yeah, of course.

Me: I could go to the dentist and be prescribed painkillers after surgery?

DEA: Don't see why not.

Me: So why can't I use this medical cannabis that treats both of those things without near as many side-effe-

DEA: **STOP RIGHT THERE, CRIMINAL SCUM!**"
AskReddit,fduozux,t3_eab6tf,1578736559.0,Character actress Margo Martindale caused a cargo ship to capsize and dump spaghetti into the ocean.
AskReddit,fduobse,t3_ef0f59,1578736211.0,"""Homosexuality is unnatural."""
AskReddit,fdunm0e,t3_ebzush,1578735864.0,"My coworker and I were taking turns playing music over a speaker our manager found. He was playing modern day Soundcloud rap while I was playing Poets of the Fall, Dua Lipa, In This Moment, ect. He finally complained that he couldn't get into any of it because the songs had ""too many lyrics""."
AskReddit,fdumpms,t3_eauhhu,1578735409.0,"I'm three years away from being 30 and I'm only just now in a safe enough environment to begin to dig deep into the multiple layers of mental issues I've picked up over the years. I feel like I should be so much farther along in myself than I am.

My family will never admit to anything, or take responsibility for the fucked up shit they believe and do to each other. My parents married because my mom got pregnant with me, and my dad's family is Catholic, so it was mostly an obligation. He resented the absolute fuck out of me and made it clear. I remember being confused a lot as a little child. He'd go from playing with me and being friendly, to suddenly getting irrationally angry for a small thing I'd done wrong, or for reasons I never understood because they were never explained. My mom wasn't as violent, but there was never any doubt in my mind who had priority in her life; my dad. She was at his beck and call constantly. Granted, he was an abusive piece of shit to her too, but when a child/later children are involved and you choose to not even try to get out of that environment, you've already fucked up in my book. 

Sperm donor was mentally, emotionally, physically, and sexually abusive. I could write a book on all the crazy shit he did while I was growing up. I left home at 19 at the first chance I got and ended up living with a covert narcissist, which effectively shattered my naive ideas of having freedom and happiness after getting out of my parents' house. During that time, me and the narc ended up living with a slew of absolutely horrible roommates (another manipulative narcissist that abused vyvance and her dog, a girl that was in cahoots with the 'subletter' that scammed us, a dysfunctional couple that consisted of an individual who was addicted to speed-based diet pills and a woman with severe mental health problems exacerbated by her non-existent med schedule, and the ex of the narc who is a psychopathic disgraced college professor with a criminal record that includes but is not limited to multiple shoplifting charges, stalking, and at least one sexual harassment charge from one of his students).

I ended up homeless for about a week, moved in with my aunt for about six months, and had to move back home for a while. My dad almost immediately started threatening me with rent, even though I had a solid full-time job within two months of living there and was saving up money to get a car with no help from the family, despite the fact that my grandad had helped my brother get his first car. My brother still lives under their roof, with his (I assume) now ex-girlfriend that recently cheated on him. He doesn't pay rent, has never been threatened with rent, and neither does the girl. I recently began putting the pieces together with the help of the woman living with me now that my entire family knew about the abuse to some degree. They either chose not to believe me, chose to protect him regardless, or chose to not do anything. As of Christmas of 2018, I finally had enough when my grandmother had the spine to openly direct their bigotry in my direction. Before that, they'd been icing me out of the family for several years.

Long story short (haven't even gotten into the last roommates I had, which consisted of a close friend from high school and her now husband that I discovered had been lying, stealing, and sabotaging me so I couldn't leave), my life up to this point has been gaslighting, manipulating, abuse, apathy, fake friendships, ect. It's shattered me as a person. I used to be so open and empathetic to people. I never wanted anyone to feel the pain I did, so I made myself far too open to the wrong kinds of people. Now I don't trust my own thoughts. I don't trust my judge of character. I'm constantly trying to figure out what people are wanting to use me for. I keep everyone at a distance. I'm terrified of intimacy when I used to crave it. I see aspects of both my parents in me and it makes me sick on every level.

I fight every day to rebuild and redevelop myself into someone I can be proud of. Me. Nobody else. Breaking the codependency has been one of the hardest parts, along with working to change my perspective of people and the world in general to something more productive. It's like taking everything you are, setting it on fire, and waking up in a pile of your own ashes over and over again..but at least now I'm the one setting the fire."
AskReddit,fcqh918,t3_ehop56,1577885955.0,"Me and a woman I dated years ago asked a woman we knew from a local store to hang out with us one night. It was supposed to be me, my gf at the time, the woman, and three other friends/acquaintances at a hookah lounge. Well, we started out at the lounge, but retail chick was insistent on drinking. Half of them decide to walk down the street to one of the bars. I was underage and didn't go in, but from what I was told by the two guys that we're with us, she got shitfaced faster than I've ever witnessed and was dancing on tables in the bar. She came out barely able to walk.
We go back to her place to finish out the night in a safer environment. She ends up having an emotional breakdown and telling us she's being treated for a heroin addiction and had recently lost her girlfriend due to an overdose. Neither myself nor my girlfriend were in any position to help her, and we'd already been burned multiple times, so we left her alone after that night. 
I haven't heard from her since but I hope she turned out okay."
AskReddit,fc2uh6c,t1_fc0s88j,1577374380.0,"All the pieces are based on a poetry book, so that's where some of the appeal comes from to me. It's a celebration of life for the sake of life rather than a solid story, and the story they did put in was touching in multiple ways. The play pulls that off beautifully. I recently learned the choreography was designed by watching how real cats move. It's popular due to the effort and passion that was put into it and is refreshed every time they do a live tour."
AskReddit,fbzxxyg,t3_efackr,1577267735.0,Rinse my mouth with hydrogen peroxide. It hasn't failed me yet and has prevented a few infections from setting in.
AskReddit,fbzxv7n,t3_ef8q0t,1577267608.0,I was sitting on the folded up bleachers one day back in high school and forgot the wall protruded out right above where I was sitting. I stood straight up and immediately felt like an accordion.
AskReddit,fbzxsam,t3_ef69kv,1577267473.0,It's perfectly legal to order and grow magic mushrooms. You just can't consume or sell them.
AskReddit,fbzxnhw,t3_efdcit,1577267260.0,"Been a fan of the play since I was a little kid. The movie completely bastardized the entire thing, and I don't just mean the aesthetics. The play didn't involve a ""singing competition"". There was no competition. It was literally a celebration of all their lives, and the one cat who NEEDED the second chance the most is who got it. The movie turned it into some America's Got Talent bullshit and switched the lead to the character they thought had the most sex appeal. 

They did Grizabella dirty.."
AskReddit,fbzxgi4,t3_ef7yxn,1577266942.0,"My two most annoying coworkers. One is a neurotic woman in her 60s that I partially feel sorry for, but it's hard for me to have sympathy for her when she's a perpetual shit-stirrer and an incompetent control freak.

The other guy is one of the laziest people in my department. He gets mad at the people bringing him work when he gets backed up, even though it's his own fault for fucking around. He's also gotten way too pushy with the religious shit. He tried to justify not doing his job to a female coworker by citing some bible reference. She cut him off. He's also been giving me creepy ""conversion eyes"" any time he sees me reading a bible-sized book or anything to do with Christianity."
AskReddit,fbzx9yt,t3_ef1c5q,1577266646.0,"Drowned multiple times.

Hanged.

Fell to my death.

Burned.

Crushed.

Stabbed.

Shot.

Buried alive.

Some sort of severe sickness, possibly black plague or something similar."
AskReddit,fbzx3fv,t3_ef0f59,1577266355.0,"That increasing the minimum wage to keep up with production and inflation will somehow cause more inflation. First of all, the only reason inflation tends to follow a minimum wage increase is because there is nothing stopping major companies from jacking up their prices to keep the same short-term profit margin, thereby perpetuating the problem. If they would pay people more without increasing their prices to cancel out the raise, they would see bigger profits in the long run since people would be able to afford to buy things. The busiest times of the year at my work have been slower than I ever thought possible, and I have to wonder if a major factor is people's steadily decreasing spending power.

Second, and this one drives me up the wall even worse, is the belief that the minimum wage is only meant for teenagers looking for spending money. It's not. It's a well documented fact that the minimum wage was insistuted as the minimum amount someone would need to earn to afford basic living expenses. Housing, food, transportation, utilities, childcare, basically anything that has become an absolute necessity in order to function at the bare minimum level in society. Without it, companies would pay their employees as little as they could get away with."
Androgynoushotties,f5yn863,t3_dpmwwu,1572558796.0,Sweepin' the clouds away
rant,f5ven04,t1_f5utxhu,1572487802.0,"Oh shit you're right. I forgot you can pay your bills with experience alone. Also if you think a ""transition specialist"" is standard practice in high schools, you're already way too out of touch to understand why this is a problem."
rant,f5urn2e,t1_f5u7qb0,1572478168.0,How are you supposed to get experience in the field when every job requires you to have experience in the field? Really think about that.
casualiama,f5ur19a,t1_f5ui69i,1572477895.0,"Damn I did. That's what I get for responding to comments right after waking up. But I digress.

Say what again! Say what again! I dare you, I double dare you motherfucker!"
Actuallylesbian,f5uiin3,t3_dpcr99,1572473989.0,Somewhere between True and Chaotic Neutral.
casualiama,f5uhclc,t1_f5txsq8,1572473243.0,Watch the movie. It's a scene.
casualiama,f5rrv6h,t1_f5re19d,1572401463.0,Does he look like a *bitch*?!
gaming,f5rb78i,t1_f5r57dj,1572391353.0,Dragons getting drunk and flying face first into the ground.
casualiama,f5r8mr3,t3_doxuyv,1572390046.0,What does Marcellus Wallace look like?!
AskReddit,f5p4soz,t3_doog6a,1572348636.0,"Chhchchhkckjhghck

pap

Ch-chk

...........................................KCHNK!

Tink

Sckschkschkschk

crrrnch munch munch munch"
rant,f5p47m0,t1_f5p3t41,1572347951.0,"Lol sweetheart I'm a 27 year old woman who has met people outside the internet and whatever little box you've found yourself in. What you just said is something genuinely shit men tell themselves so they don't have to face the fact that they can't get a girlfriend because they have a manipulative, horrible personality and use that to self-sabotage so they can perpetuate their misery. Women are guilty of the same thing. I lived with a married couple for three years that were the poster children for how to actively perpetuate their own misery and they made sure to spread it to everyone around them. I got dragged down with them for a long time before someone very dear to me smacked me with reality and woke me up. By then I'd let myself spiral into such a dark, toxic, debilitating mindset that it took almost a full year before I got back to a functional point and wasn't miserable constantly. 

Don't believe everything people say. Pain can change the way your mind processes reality. It can make you paranoid and give you extremely narrow-minded views of the world. Blame everything and everyone else so you don't have to look at yourself in the mirror and realize you're the one with issues you need to work on. You could have so many experiences that will help you grow and develop as a person, but you're already self-sabotaging and making sure that won't happen by listening to self-loathing grown ass sadboys on the internet. 

Trust me, there are many, many reasons these guys can't get laid and it has very little to do with their looks. You'd be surprised at what people are actually attracted to outside of what the mainstream media and 'societal beauty standards' try to shove down everyone's throat. You can resist that by not turning into a shitlord."
AskReddit,f5p3naz,t3_do7hln,1572347275.0,He wasn't The People's President.
rant,f5p3j5d,t1_f5p35pk,1572347132.0,"Like I said, you haven't had the life experience to know that's full of shit. Everyone has things they're attracted to and things they aren't and it's an extremely mixed bag. Just because some women aren't attracted to short men or are shallow doesn't mean *an entire gender* falls under that same umbrella. I'm sure you don't appreciate seeing people make sweeping general assumptions about men. Don't be a hypocrite. Get out of this ignorant shit and go live your life.

I've read your comments in the incel subs and even they are telling you it's a bad idea and you need to pull your head out of your ass before it gets stuck there."
rant,f5p35ip,t1_f5ov0pj,1572346651.0,"https://www.google.com/amp/s/www.vox.com/platform/amp/the-goods/2019/5/29/18644354/chick-fil-a-anti-gay-donations-homophobia-dan-cathy

""In 2011, the same year a Pennsylvania Chick-fil-A franchise donated food to a local anti-gay organization, the LGBTQ advocacy group Equality Matters obtained tax records which revealed that the Cathy family had donated more than $1.9 million to anti-gay groups in 2010 through the WinShape Foundation, the Cathy family’s charitable giving organization founded by Truett Cathy in 1984. Those donations included a $1.1 million gift to the Marriage & Family Foundation, a group that promoted so-called traditional marriage and opposed both gay marriage and divorce; $480,000 to the Fellowship of Christian Athletes, an athletic organization that requires applicants to agree to a “sexual purity statement” that condemns LGBTQ people for living “impure lifestyle[s]”; and $1,000 to Exodus International, a group that promotes anti-gay conversion therapy."""
rant,f5ov9xa,t3_do7u0c,1572334196.0,"You don't realize it now because you're young, but this really isn't the best group of people to be hanging out with. I'm not saying that to put you down for your age either. I'm saying it because I remember what it was like at your age and I ended up stunting myself pretty bad due to a combination of shitty parents and hanging around toxic as fuck people for years. You don't want to get stuck in that stagnating mindset. You don't have enough life experience to know that what these guys are feeding you is total lies based around their own self-loathing which fundamentally warps their perception of reality.

Please get out of that. You're 13. It's not even close to over for you because you've barely had time to develop. Don't throw these years away like that. You'll end up regretting it."
rant,f5oux87,t1_f5nro5u,1572333620.0,Some of the groups they donate to are conversion therapy groups which are literal torture camps. Parents can go as far as having their children kidnapped out of their bedroom and sent to these places where they're subjected to the kinds of abuse that got old sanitariums shut down.
AskReddit,f5os9kh,t3_dolq2r,1572329520.0,The CIA has declassified documents studying telepathy and other related mental phenomena in humans.
AskReddit,f5os3tt,t1_f5orp89,1572329286.0,"Adding to this, dolphins use puffer fish venom to get high and will pass it around in a circle."
Psychic,f5ors7n,t1_f5mqfvo,1572328830.0,I'm a Scorpio Moon as well. Been internally buzzing for days and this is the first year in a long time I've been able to direct this energy in a positive way.
Psychic,f5orpve,t1_f5mnzjs,1572328737.0,"Confirming what the comment above said. Some of the most rewarding, life-changing events I've experienced have immediately followed a huge 'burning' period."
rant,f5odiyd,t3_do8rih,1572315459.0,"People like her give polyamory/ethical non-monogamy a bad name. If you aren't clear with boundaries or intentionally go beyond boundaries, that's still cheating."
AskReddit,f5k451h,t1_f5k40ev,1572254327.0,"I can tell ya for a fact that you don't have to kill yourself. This is a temporary mental state. Difficult, yes, but there is another side that's worth getting to in this life. Plus I assume you're pretty young and as cliche as it sounds, life gets a lot better when you're older and have more control over your circumstances."
