funny,ff9rq5n,t1_evh8avk,1579719696.0,Wow.
HumansBeingBros,ff9pnk8,t1_ff9o0zp,1579718144.0,"Boy, i wonder."
interestingasfuck,ff90bmv,t1_ff8y7ml,1579701580.0,He means with no utensils.
MakeMeSuffer,ff5b2xx,t3_ejde08,1579585805.0,Not bad kid.
ntbdbiwdfta,ff4qzcp,t1_ff4iq60,1579570336.0,No reason to not have f***ing balls.
ntbdbiwdfta,ff4ifru,t3_ergdy4,1579564379.0,Where are his ballsâ€½
Jokes,fezsu1o,t1_fezskoy,1579461207.0,too much.
AskReddit,fezo3zc,t1_fey5sqj,1579459552.0,"You just kill the baby whenever she gives birth, that's some food and if the  mother is getting a little close to too old, you kill her keep a daughter and get rid of the bull before any genetic disturbances happen. Buy a new bull with the money you get from selling the meat from the old bull.

Of course, you would likely be unable to do this during an actual apocalypse."
schizophrenia,few73qy,t1_feq8kq5,1579406261.0,"Yeah, a lot of those will probably help a lot of people. [Including sacrificing firstborns ;)]"
schizophrenia,fev1ne4,t1_feq0cw1,1579392129.0,"Wow, that's great."
Art,fet9rlt,t1_fes3n9i,1579373075.0,"It's just a variation of wow, i can't do this. The ""copy"" part is the accuser comparing themself to you, 'there's no way i can do this, therefore if you did this, you must have cheated somehow'. 

Art is creativity, good-looking art is effort, when someone doesn't understand that, they can only see a picture. That's why they don't understand how insulting it can be to make a false claim like that.


^^^^Of ^^^^course, ^^^^sometimes, ^^^^some ^^^^people ^^^^are ^^^^so ^^^^intertwined ^^^^into ^^^^art ^^^^that ^^^^all ^^^^their ^^^^good ^^^^looking ^^^^art ^^^^is ^^^^just ^^^^their ^^^^creativity."
Art,fet80lm,t3_eln7n7,1579372595.0,"Wow, how long did it take to make this?"
schizophrenia,fepaj2u,t3_eqaacx,1579315826.0,Are you all better now that you've vented?
Art,fep4lcq,t1_feounqn,1579312004.0,None so far.
AskOuija,fep1q96,t1_felq068,1579310182.0,S
AskOuija,fep1p1j,t1_fekr6kx,1579310161.0,G
AskReddit,fep08pg,t1_feoufs6,1579309239.0,Yeah.
AskReddit,feo55u4,t1_feo3pvj,1579295271.0,"Now or when they were younger, you might not even recognize them if you see them fricking when they were going to have you. Now, they look gross and the imagery is disturbing, but the genetics that keep you from finding your day kinda hot doesn't go much further than skin deep."
AskReddit,feo416e,t1_feo2f8c,1579294837.0,"What if you can't change back when you turn into an inanimate object, you still keep your soul, conscience and memories, but now you're stuck forever. With no eyes, ears, skin, etc, you would forever be stuck in limbo world until you eventually stop thinking. Breaking you into pieces just multiplies the number of inanimate objects with souls.

And the switch that you use to shapeshift can sometimes be accessed via dream, so let's say you're dreaming of being a table, RIP.

What if you shapeshift into an animal, and you're too dumb to remember or process how or why to change back. I bet your genetics would be hella weird."
AskReddit,feo32z1,t1_feo2vbb,1579294499.0,Like what?
AskReddit,fenr36l,t1_fenqk1x,1579289620.0,"Ah, thanks."
schizophrenia,fenqzyt,t1_fenpndl,1579289587.0,Sure.
schizophrenia,fenpnt3,t1_fenle0f,1579289031.0,"I don't get what's so funny about it, but for someone of your pedigree, i'm assuming you know what you're talking about and i'm just not knowledgeable enough to understand."
schizophrenia,fenpj5f,t1_fenm8fo,1579288953.0,"I figured you're an expert in the field, so you likely know what you're talking about better than me. It's mean that you'd call me dumb for how i feel comfortable using the toilet."
schizophrenia,fenkw3w,t1_fenbxn5,1579286870.0,"> Never said they were interchangeable

Yeah, you're right, i misread that. Dang."
schizophrenia,fenkoow,t1_fencanp,1579286745.0,Sure.
schizophrenia,fenknef,t1_fenchje,1579286723.0,"Whoa, you're right. Dang, i was soo wrong."
AskReddit,fenbyam,t1_fen5e4t,1579281409.0,"That doesn't answer the question. Not to hurt your feelings or anything, but you might have gotten distracted."
schizophrenia,fenaxzi,t1_femj9db,1579280787.0,"No, that's just your consciousness getting bored. I don't know where you're getting your information from, but the subconscious and consciousness are not interchangeably, your subconscious might hold ""memories"" of things that bore you, but it doesn't actively process it, that's the job of your ""brain""."
schizophrenia,femibkk,t1_femeuk1,1579257043.0,How could you be subconsciously bored of something? i'm certain that would be just conscious.
schizophrenia,femi068,t1_femc6jn,1579256573.0,"That's right, it does happen in life."
AskReddit,femcyw8,t1_fem2hgn,1579249184.0,Sometimes they're also just cowards.
schizophrenia,fembjt5,t1_fem8vsr,1579247329.0,You're answering the question with a question.
schizophrenia,fembgou,t3_epwi8x,1579247220.0,"It's possible that this is just a delusion. But if not, it's also possible that the drugs unplugged some portion of your schizophrenia in order to plug in an eventual symptom. Maybe this was going to be how your brain would become in a couple years.

Perhaps your ""delusions, episodes, disorganized thoughts, grandiose thoughts"" stemmed from your emotions. And now that you're not feeling so emotional, for example, you're not rushing the neurons that create your thought processes, keeping you from having disorganized thoughts."
schizophrenia,fejlsks,t3_ephilm,1579179217.0,Yes.
schizophrenia,fejlpqt,t1_fej8owr,1579179142.0,"Meaning.

For example, the title ""I'm not a schizophrenic, I just wanted to tell all of you that we hear you and support you"" is not reasonable. Op wanted to tell me(apparently) that everyone hears and supports me. 1, that is not true, everyone doesn't hear and support me, with that first statement it had already started to sound like mushy words meant to make me feel hope and OP look like a support group(which they probably aren't). 2, ""we"" statements don't often mean anything, because one person often doesn't actually speak for the group. 

Another example, ""just"". ""Just wanted to say"" statements sound humble and nice, which is why so many people hoping to gain emotional leverage/wanting to virtue signal, use it. Because of that those kind of statements don't sound so humble or nice any more. Companies use them all the time, ""we just wanted to say, we care"". Who's we?

 Some people only care about niceties, so the logic part doesn't matter to them, some people(fewer in this thread) like me care a little more about logic in these allegedly humble statements. You just wanted to say it? then why didn't you just say it? Who hears and supports me? How? Why are you saying people you have no control over [or knowledge of] are doing something i would like? What does support mean in this context? Hear me, why does that matter? 

It probably doesn't sound as nice, but if the post only said sorry, more people might have ignored it, but it would have had the same meaning or maybe even more when you realize OP doesn't say sorry anywhere in their text. Not that it matters, sorry doesn't do much unless you really want to hear it. After reading the title, i got a bit suspicious and read the body message as carefully as i could.

You don't understand what my schizophrenia is like, we need more awareness. Why, i'm not saying awareness is bad, but why, what reason are you giving for this statement? It sounds like pandering, by this time in internet land, we should have all heard ""need more awareness"" panders by now, and by that i literally mean everyone should have heard it. Emotions don't repeat themselves like that, there are many other ways to express sorrow than buzzwords. 

This sub has opened my eyes in a way i didn't thought it could, other than the grammatical error, this was the most honest(according to me) phrase in this message. I've seen many people say it before, but it could be completely honest, and the possibility is not something to take lightly. 

""I send everyone a big internet hug"". Well, i wasn't sure what this statement meant or why it mattered, i've seen this many times as well, but i'm still not sure if it actually has any meaning. 

""I'm so sorry, this sub has opened my eyes in a way i didn't think it could."" There are no logical errors or meaningless statements in this one, so i don't feel quite the pinch of disgust(me personally). Most online praise is virtue signalling, i usually judge the context of the text by the reasoning behind it. Or if there's any reasoning to begin with."
DMT,fehpxk7,t1_feh7ftp,1579121528.0,That's all i needed to hear.
Art,feh2vus,t1_feh2r50,1579108012.0,SHAME!!
AskReddit,feh2kub,t1_fefyek8,1579107825.0,Also you don't know the answer to the question.
Art,feh0oet,t3_ep3afo,1579106683.0,Did you eat it afterwards?
Art,fegpm16,t3_eoyvjz,1579099537.0,"~~this isn't paint.~~

I was wrong."
DMT,fegpjo2,t3_eoyw5t,1579099490.0,"~~I'm just going to assume you didn't paint this since you aren't answering anyone's questions.~~

I was wrong."
Molested,fefrogm,t1_f8f6nab,1579063214.0,"I agree, this is exactly as i felt."
Molested,fefreob,t1_f6r224w,1579063006.0,"The ""milking his member"" part makes it seem like erotica."
BabeMemes,fefo1mj,t3_emtam8,1579060563.0,"Ooohh, 

nothing."
BabeMemes,fefn3md,t3_eoqe76,1579059921.0,"Wow if you're the only one keeping this sub alive, you're awesome."
schizophrenia,fed86ms,t3_eofzqh,1579003286.0,"Wow, that's awesome."
schizophrenia,fecm7jo,t1_feciobh,1578977373.0,"You're great, i hope you find satisfaction."
schizophrenia,fecdvtt,t3_eocnw0,1578971587.0,I believe in you too.
schizophrenia,fec5ofz,t1_feaidrb,1578967038.0,Sorry.
Art,feage0o,t1_fe9w20c,1578948414.0,Do you mean like this? https://www.reddit.com/r/Art/comments/ef1qkp/freed_me_pixel_art_2019/
schizophrenia,feaehxb,t1_feaba49,1578947691.0,"Wow, it's both. Sorry."
Jokesuncensored,fe9lnal,t1_f7qaexk,1578939191.0,Best punchline ever.
schizophrenia,fe9ldqa,t1_fe8cnx3,1578939065.0,You've done great.
schizophrenia,fe9l9oz,t1_fe8ly6h,1578939008.0,"People with power over your lives are different. That's just them creating drama to satisfy some disturbing urges. 

With the delusions, anyone and everyone can seem to be what they're not."
UpliftingNews,fe87csx,t1_fe86uz9,1578923400.0,"u/shamelesslyplugged said
>They probably tied him to a paddleboard under controlled circumstances. Like the picture in this: https://www.goraise.co.uk/surfability-uk-cic"
schizophrenia,fe855sr,t3_eo2prf,1578922700.0,"This thread didn't give you a friend, you found one by yourself."
UpliftingNews,fe84n8a,t1_fe81utu,1578922511.0,"You can't, it doesn't matter and the same argument applies to both. Like /u/Charoncaori said,
>Reporting like that in the OP is extremely hurtful because sometimes people allow babies with only brain stems to be born because they think their child might recover.

This kid is learning how to work at 6. I'm not saying kill him or anything, but brainless or not, it's a serious impairment that shouldn't be glossed over with hopeful eyes. This kind of child [with use of harsh impartial language] grows up to become a burden, we might make scientific discoveries to trump this in the future, but it is not something that you just eventually grow out of."
UpliftingNews,fe83t31,t1_fe7qwow,1578922200.0,Yup.
schizophrenia,fe7pjbx,t1_fe7pehr,1578917747.0,Alright.
schizophrenia,fe7p276,t1_fe7ouqx,1578917564.0,Ok.
schizophrenia,fe7o50l,t1_fe7nqqw,1578917325.0,"I think you mean confident [not confidant]. That's part of why i thought you were trolling, i thought you were trying to give the impression of someone so weak that they mispronounced words when challenged."
schizophrenia,fe7mzj0,t1_fe7mlyr,1578916750.0,"Uh, ok.

I think you're trolling because i can't relate to your reasoning, but if you're not, sorry your feelings are so hurt. It's unfortunate that you deleted your post, i was looking forward to seeing how many schizophrenics would actually respond to it. Somewhat of a missed opportunity it is."
Antfuckerclub,fe7mlcc,t1_fdyurx8,1578916549.0,Baby.
schizophrenia,fe7lpuc,t1_fe7kxk7,1578916245.0,"Nothing is bad about it, my tone was neutral, i just said i found it strange. I would like to know what set of words i said that made you feel i was asking u/jackanour not to request people's photos. 

I was not saying that."
schizophrenia,fe7kb17,t1_fe7inbc,1578915783.0," Paranoid schizophrenics are often not very trusting people to say the least, it's just very strange to imagine anyone with schizophrenia posting identifying photos."
AskReddit,fe7k4r2,t1_fe7jb4a,1578915704.0,"The first line sounds like something sokka would say while waving his head around before panning to the camera and blinking both eyes twice. 

From avatar, of course."
schizophrenia,fe7js0l,t1_fe774nq,1578915559.0,"It's a delusion thing when your mind invents the intentions of other people. It happens every now and then if you're off meds, it's not really noticeable since i can reason my way out of it, but neutrality could really sound negative if your delusions want a villian."
schizophrenia,fe7jqm8,t1_fe6r1ab,1578915541.0,"It's a delusion thing when your mind invents the intentions of other people. It happens every now and then if you're off meds, it's not really noticeable since i can reason my way out of it, but neutrality could really sound negative if your delusions want a villian."
AskReddit,fe7iynz,t1_fe7iqu7,1578915189.0,"I'm not trying to antagonize you, but that means you were being sarcastic."
schizophrenia,fe7ig0b,t1_fe7hfnv,1578914961.0,"~~You would make a better point if you posted your photo instead.~~

I don't know what kind of antagonist you think i am, but i'm not telling anyone what to do with their photos. 

Paranoid schizophrenics are often not very trusting people to say the least, it's just very strange to imagine anyone with schizophrenia posting identifying photos."
schizophrenia,fe7hre5,t1_fe7fnqm,1578914658.0,"I'm not telling you to do anything. I don't know what words make you think you've upset me, but my tone was neutral throughout the whole text."
AskReddit,fe7gaio,t1_fe7ds9m,1578914274.0,"That's not possible, it's more likely that he just sold to more people/had better initial advertising.

You might be being sarcastic, but i'm not just going to assume you agree with me from the start. So you might also not be being sarcastic."
schizophrenia,fe7ffeb,t3_eo1xs2,1578913895.0,"I find it strange that you think a paranoid schizophrenic would simply release their photo online without proper prompting. 

Example, how old are you?

I know it would be nice if we all just trusted eachother and were nice to eachother, but that's not a reasonable expectation."
UpliftingNews,fe74swo,t1_fe6wsp7,1578910015.0,"No, it wasn't clear, that's how you make clickbait titles."
schizophrenia,fe74pto,t1_fe749og,1578909973.0,A lot of people that don't relate would have found it funny.
UpliftingNews,fe6vq2a,t1_fe6ucgk,1578906239.0,"The article title says ""baby born 'without brain' defies odds to live."""
UpliftingNews,fe6rix1,t1_fe6hqy9,1578901991.0," The article says his brain was just squashed into a small space, and ""that after he had a shunt fitted, it grew back to where it should have been"". The title of both this article and subreddit title is misleading."
UpliftingNews,fe6rfxs,t3_enx6zs,1578901879.0,"The article says his brain was just squashed into a small space, and ""that after he had a shunt fitted, it grew back to where it should have been"". The title of both this article and subreddit title is misleading."
Art,fe6ljt3,t3_enoqr0,1578894958.0,Beautiful. Splendid
Art,fe6knuq,t1_fe6b1ew,1578894057.0,Is that from a movie?
drawing,fe6kguz,t3_enyozd,1578893862.0,"Haha. Very funny, thank you."
Art,fe6jydo,t3_enxcce,1578893356.0,Yes.
schizophrenia,fe6ig7y,t3_enwhth,1578891916.0,"No. It might be the meds, but i don't think schizophrenia affects your cognitive ability until it has really settled in for a while."
Jokes,fe6b8so,t1_fe5pkrn,1578886021.0,I'd swerrit.
schizophrenia,fe6b48t,t3_enp4lc,1578885928.0,"It was annoying that the ""joker"" might have dreamt up the whole thing though. That's a massive F-U from the producers, i really hated the scene where the lady wasn't really his girlfriend. It made everything else seem like a massive schizotic episode."
AskReddit,fe620a3,t3_eni3n7,1578880000.0,"Suicide via trampolining through a missing step on a wooden bridge and landing on a diagonal spear, impaling me through my crotch."
AskReddit,fe61p4h,t1_fe61fts,1578879804.0,"Wow, ðŸ‘."
AskReddit,fe618co,t1_fe5x4ld,1578879514.0,"No, it makes sense if he's talking about economics."
Art,fe613wf,t1_fe4wabf,1578879433.0,"Clearly sarcasm, but what do you mean by ""generic render of some quirky bullshit happening in a physics engine""?

Is that a new genre in art?"
Art,fe604kz,t1_fe5wvdd,1578878806.0,"Why do that when you can draw..

#>!HOT WOMENâ€½!<"
Art,fe5w4lk,t3_enqu1j,1578876272.0,The human part kind of looks like post haunting surgery look michael jackson.
schizophrenia,fe5vjkp,t1_fe5nsq9,1578875896.0,"Do heavy emotions trigger your episodes or is it just random, not the hallucinations, the delusions+hallucinations."
schizophrenia,fe5j02k,t1_fe3pbh0,1578870096.0,How long has it been since you've been off?
schizophrenia,fe3nc8f,t1_fe2jwe1,1578850931.0,"Technically they do serve their purpose, for as little time as they do. The side effects are just proof that no one really wants us to get better, they just want our weirdness to end. Yay, now we're just stupid, works out for everyone."
AskReddit,fdy9w5s,t1_fdy1wbg,1578777581.0,"Yeah, that's fucking annoying."
AskReddit,fdxyzv8,t1_fds681c,1578774319.0,Yup.
AskReddit,fdxx394,t1_fdxmkxe,1578773840.0,"Oh sorry, i didn't understand. From your comment it sounded like you were saying OP had an agenda which is what really mattered.  But now i see that you were saying OP got my point."
AskReddit,fdxmliz,t1_fdvo9kv,1578770608.0,*century
AskReddit,fdxlyzi,t1_fdudd0i,1578770430.0,So what's the point of the tourist there?
