AlAnon,fqvpskz,t3_gl6ror,1589682457.0,"Not at all. He is a grown man. You aren't being cruel, you are taking care of you."
AlAnon,fqvpi1a,t3_gl6rip,1589682274.0,Hugs. I'm very sad to see this but glad you aren't carrying guilt.
bipolar,fqujfxh,t3_gkz72k,1589659912.0,Not a lot of serotonin here either
raisedbynarcissists,fqu6uxd,t3_gkn4bn,1589653166.0,Wow this is so inspiring! I can't imagine how difficult it must be to be pelted like that and live your life in peace.
adhdwomen,fqrnlpg,t3_gkh4wn,1589588012.0,Me today.... drove home from work and crumbled in overwhelm.
AskAstrologers,foyo6o6,t3_g9xlvu,1588176070.0,"As a Scorpio I connect well with cancer men, but usually as a platonic or professional encounter while I'm in a relationship. I can feel the warmth and sparks fly if professional (eek) lol"
raisedbynarcissists,fnsotd8,t3_g3fcvb,1587225928.0,"Its understandable to feel the confusion etc for what's going on. Are you feeling guilty for not being sad? Understandable, but just know that you really seem to have an upper hand on the self love stuff. I'm 34 and often wonder what happened between 16 and now.... you will heal and be okay, and likely live a fulfilling happy life."
adhdwomen,fnn1ayp,t1_fnmyt4a,1587082304.0,Thanks! Adderall wasn't a good long term solution for me and I'm trying Vyvanse next. I felt discouraged when Adderall didn't work but know that there are other solutions out there too!
AskAstrologers,fnli8kp,t1_fnlh5xz,1587054001.0,"Thank you, depression is a struggle that comes and goes. I was a massage therapist by trade, had some skeletal muscular issues with nerve compression etc that took a toll. I've had a really rough go as an adult in a lot of ways and not having vitality really hit me hard! I hope you were able to find another outlet after BJJ."
AskAstrologers,fnlgkx5,t1_fnlfq31,1587053182.0,"I used to do Krav Maga and love to be doing lots of things! I hate sitting still and have struggled emotionally, mentally and physically due to work, direction,  stability and physical injury troubles to work through. 

My partner is an Aries sun sag moon libra rising. He has venus and Mars in pisces and merc Taurus. I feel like I am too much for him most of the time, but he is slowly coming out of his shell into his own power."
AskAstrologers,fnlen38,t1_fnleetr,1587052213.0,"I get a surprised expression from others when I tell them my big 3, they say WOW that's a lot! How do you think they tie together?"
AskAstrologers,fnldoon,t1_fnlda4l,1587051728.0,"Interesting I always thought sun sign early Leos did that, but not necessarily in a bad way. I do have a commanding presence and strong personality, but I'm actually only fun when I'm totally comfortable."
adhdwomen,fnitqvb,t1_fngxw8o,1586986208.0,"I am in the same boat, in my 30s and have pursued treatment recently. I fell through the cracks as a kid, too. It written off as unmotivated and laid back."
adhdwomen,fngfuw7,t3_g0s9bt,1586930931.0,"I empathize with all of this.. I am 34 and undergoing treatment with a new psych, my second one. Adderall helped me GREATLY for a time, but also built up restlessness and anxiety. I just scored 90 out of 120 on Brown ADD scale, and have a follow up tomorrow. Let us know how it goes!!"
astrologyreadings,fngfplt,t3_g1ciuk,1586930802.0,I just came by to thank you for saying would've instead of 'would of' 🤣 I'm sorry I don't have anything else but I hope it made you smile 😊
adhdwomen,fngfdrv,t3_g06bmc,1586930518.0,"Yes. I got this from my partner's father, and subsequently his sister because 'Dad' didn't like it. Dad was controlling language said around their mother who is cognitively ill. I laughed and said ""I'm sorry *partners name* but no, I will not mince myself to please your father"". In time I found that his dad swears often, but ""he controls when""; I also found that he was relaxing and cursing more often. 

I still, at 34, feel uncomfortable around his family like I can't be myself. I hate it. But I am proud of myself for saying ""no I will not conform to that"""
adhdwomen,fngf0oz,t1_fnfetrx,1586930208.0,"""Find your why"" is something that has always felt so elusive to me.. I've come to resent the phrase. How did you find yours?"
raisedbynarcissists,fnbjmhb,t3_g0oo5q,1586816701.0,"My father is very dramatic about his manual labor. Granted he's in his early 70s now, but it progressively became more dramatic in the last 15yrs. He always loves making a show about what he's doing and loves the attention. It is generally harmless but does get annoying."
AskAstrologers,fmxw83f,t1_fmxv6tk,1586473101.0,"Thank you for the tips! I forgot I have Astrology for Dummies as well, with a helpful section."
raisedbynarcissists,fmxbusl,t3_fxvevp,1586462124.0,The real world has more helpful people in it than them when I've been in a tough position.
AskAstrologers,fmwzr1s,t1_fmwvciq,1586455904.0,"You're welcome! I am not versed on aspects but with lots in sag in your first house and Scorpio sun in your 12th, it seems that could be easy to do. Try guided meditating and remember to connect with your intuition!"
AskAstrologers,fmwu02f,t3_fxwbck,1586453009.0,Well my ex was a Virgo sun Pisces moon and cap rising - so there you have it. Complete with a gaping mother wound for Pisces moon to fester an infection.
AskAstrologers,fmwtf96,t3_fxuwmm,1586452717.0,"Have you considered something self creative for your work? Your communication is in sag in the 12th house, enthusiastic optimism but perhaps crossed with the darker shadow side of the 12th house or subconscious. 

Perhaps you're just looking in the wrong places."
astrologymemes,fmt5h1u,t3_fwzbrw,1586367173.0,Pretty sure it's all scorp moons haha. My best friend is a Virgo sun scorp moon and yeowza!
AskAstrologers,fm1wox4,t1_fm1pftj,1585686367.0,"Yeehaw, you are def an intense individual but I feel also like you have your head on straight with those 1st house placements."
depression_help,fk0vuj0,t1_fk0rfn3,1583767285.0,"On that note, I recommend checking out the Root Cause Protocol. It recommends consulting with your GP with blood tests during. Mineral deficiency can be linked to depression and anxiety. A vit D suggestion may not be wrong, but it depends on the person so yes saying THIS vitamin cures it all, is wrong."
raisedbynarcissists,fi42164,t3_f6bajk,1582132380.0,"Something I've had to learn for myself, and I say this from experience, with tough love..... 

Its not your fault she acts this way, but it IS 100% your responsibility to love yourself enough to draw boundaries and heal from it. It is 100% up to you how to react to her. Nmoms create victim mentalities, I am working my out of a victim mentality myself. 

She is not making you do anything, you are allowed to do your own research, you have 100% control over your body and choices. If you keep allowing the abuse, and playing victim, that's where you will stay."
raisedbynarcissists,fhwbk4r,t1_fhszi9o,1581911368.0,"My parents made my sister have 2 jaw surgeries and tons of ortho work done, turns out her teeth are still just not very strong. It was traumatizing for her to have those jaw surgeries. 

My other sister and I had braces. My parents insisted. 

They refused to help pay for college or help is as adults if we got into a tight spot.... but bought a 100k RV and a 75K pickup truck. And ya know buy dinner. 

I didnt know orthodontic work was an obsession for nparents..? Interesting. I'd say it was probably my mom over my dad, and she just told him what to do."
raisedbynarcissists,fhe8o31,t3_f2nz32,1581516697.0,Sounds like my future FIL 🙄😒 He really likes to berate about what I'm doing.
REDDITORSINRECOVERY,fgq1mhi,t3_ez470f,1581016158.0,"Thank you all to who suggested Al Anon, I went to a meeting last night and I'm glad I did."
REDDITORSINRECOVERY,fgnz5qa,t1_fgndato,1580956120.0,"I went it was very nice. I'm in a great location for multiple meetings too. Thanks so much for the suggestion, it was a good choice."
REDDITORSINRECOVERY,fgn5fqd,t1_fgn35dm,1580938055.0,"Thank you, there is a meeting near me tonight."
REDDITORSINRECOVERY,fgm58jl,t1_fglzi1g,1580918218.0,"You picked up on an important piece, his distance. There is a loaded story behind that, I believe stemming from his authoritarian upbringing, very judgmental/stuck up hometown. Not everyone in your circle wants to see you succeed kind of thing, ya know? Before we lived here, we had a lot of fun. He was very kind and accepting. The moment we came here he closed in, but it was all he knew. He is realizing that his ""home"" isnt anymore."
REDDITORSINRECOVERY,fglszje,t1_fgl9hs4,1580910198.0,"I love those rideshare conversations, I've done it a bit too. Its been pretty gross messy and hurtful living here near his old life, coupled with it being a tough city."
REDDITORSINRECOVERY,fglr3mk,t1_fglq61w,1580908715.0,Thank you. That's where I am coming from as well and am having trouble seeing where the line is. Have you experienced this yourself?
REDDITORSINRECOVERY,fglhyul,t1_fglgkch,1580898711.0,"I often beat myself up for not having the energy to keep our home clean. I get where you're coming from on the misogyny aspect, but I was thinking something along the same line. In therapy I recently discovered that being with an addict has caused some of this struggle.

In my previous relationships, I did find pride and solace in cooking, nesting etc.. in this I am so exhausted, that I gave up too. During our relationship i got so tired of asking for things and driving myself crazy that I just stopped. He likes to cook and that seems to be his outlet. 

I see what you mean about starved relationships. I discovered (at the risk of sounding like a red flag) that his family and friends are not healthy and dont support his growth, they ALL believe/believed the problem is me being too outside the lines and trashy. Last year was tough for him to realize his life is what HE wants, not others making decisions for him. So much happened with them that destroyed our trust, he nearly abandoned me and us. He often still says and does things that push directly against me for no reason at all other than to disagree. Is that common?"
REDDITORSINRECOVERY,fglhdmr,t1_fgldvf7,1580897832.0,Thanks. He is not 12 step but I have considered al Anon.
raisedbynarcissists,fglhayt,t3_ez420m,1580897726.0,"I could have written this. In 2nd grade, I came home from school with mud on my pants. My mom demanded I wear my snowpants outside during recess. Around that time it had been a little warmer and muddy. Too warm for snowpants plus I was having so much fun. 

I screamed at, slapped, and thrown across the kitchen floor. My body ran into the dining room chair. How dare I ruin my clothes."
lonely,fgl4j26,t1_fgl4e3d,1580881776.0,His parents probably taught him that unfortunately.at that age people dont understand how to be kind or accepting. You can blaze the trail though.
REDDITORSINRECOVERY,fgl4g4n,t1_fgl40hj,1580881702.0,"This is a great response and yes it IS a resounding yes. Even if we dont stay together I still want him to be the best him he can be.

 I have dealt with codependency before and have come a very long way. I slipped up a bit early on in our relationship because I didnt understand his choices. I am also in therapy and coping with the instability. I will def look into AlAnon, thank you so much for your response."
REDDITORSINRECOVERY,fgl3ysh,t1_fgl3x70,1580881263.0,Thank you so much for this. I will sleep a lot better with this in mind. I feel a bit on eggshells and dont want to move right now.
lonely,fgl3w4i,t1_fgl35st,1580881197.0,"I figured that out pretty early at 16, but if you can figure it out even earlier, that would be stellar. Who can use your demons against you if you announce them? Who can embarrass you if you look them in the eye and say yeah I am gay, so what, what else you got on me that I dont know? Dont let them use who you are as material to bully! They dont get to if you announce it, because that's boring and takes away their power. 

Do you feel it is unacceptable to be openly gay at school? I am from a small town and when I was in high school in the early 2000s, we had a few people who came out. I'm sure some snickered behind their backs but for the most part they were well liked and popular. 

You only get to be you, friend."
lonely,fgl2yru,t3_ez0rsh,1580880384.0,"How old are you? If school aged, understandable to feel that way. But if you tell him guess what you get to keep if you lose him/her? 

YOU GET TO KEEP YOUR MOTHERFUCKIN AUTHENTICITY. Do you realize how much more valuable that is than someone who is incapable of accepting a human being for who they are? 

When you are authentically you, the wrong ones fall away and the right ones come to you in spades. Love yourself!"
REDDITORSINRECOVERY,fgl2mjb,t1_fgl2jd0,1580880089.0,"Thank you 😍 that's exactly what I was wanting to hear - what did YOU need then? 

We have a couples counselor, it's been tough to get in with her, but we are working on it, have an appt in a couple weeks.

The sweet spot between space and support. I dont know where I stand."
REDDITORSINRECOVERY,fgl2gdi,t3_ez470f,1580879944.0,"I'm feeling very on edge with my own trauma, instability and lack of support which we've been cleaning up the mess from. I had no idea what the depth of addiction actually was."
REDDITORSINRECOVERY,fgl27mv,t1_fgl1yyl,1580879734.0,"Thank you for that, that helps a bit. I suppose with my generalized anxiety disorder, it shoots me back to last summer when he denied his addiction was the issue. We didnt sleep in the same bed for 3 mos."
bipolar,fgl217d,t1_fgl1t6y,1580879580.0,"Also, I was on wellbutrin and adderall by my PCP before seeing a psych. She evaluated me on 300mg wellbutrin and 30mg of adderall, which I had been on for almost a year with AWFUL irritable anxiety. Perhaps if she had evaluated me without any meds at a baseline she probably wouldnt have come up with BP2."
bipolar,fgl1t6y,t1_fgl0sqd,1580879387.0,"In my case, based on the symptoms my clinician feels my mood swings are due to huge life transitions I've went thru in the last couple of years, and that it triggers trauma of past interpersonal situations. She said that in her years of practice, when she refers to psychiatry they typically come up with the same or very similar diagnosis. In my case, they are quite different. 

I dont trust the psych. She is inexperienced. Perhaps if it were a more experienced psych, I would reconsider. 

Also, lamictal isnt working for my anxiety at all. It keeps me kind of above water on depression, but once I have an anxiety trigger, I'm gone."
bipolar,fgkyuah,t3_eyx0aq,1580876997.0,"Wow, the dark bold tones mixed with the soft peach is gorgeous and so indicative of the several ups and downs."
raisedbynarcissists,fgkoqhz,t1_fgk9rx1,1580870307.0,"I can relate. My mother used to hit me a lot, when I was 15 or so, she was trying so hard to get a rise out of me during one of her tantrums. I stayed calm walking out the front door. She shoved me nearly pushing me down the porch steps. I shot back in the house, slammed her up against the wall and said 'do not EVER FUCKING TOUCH ME AGAIN."" Walked out, stayed at my friend's house for 3 days. She never hit me again, and only yelled at me once a couple years after it happened. 

My parents had us and CPS convinced that 'some people discipline their children differently'. Dad did a good enough job of convincing them. My poor eldest sister got the worst of it. She is a miserable narcissist herself now, and still needs validation from them. I am done, recently cut them off right before xmas."
raisedbynarcissists,fgbr8qz,t1_fg4zvyu,1580665318.0,"Completely understandable, my mistake. I edited to remove any names of figures."
raisedbynarcissists,fg47jgg,t1_fg3v8rh,1580497802.0,"Thanks! My parents are self absorbed and idk who is what, seems they interchange. Often dad is edad."
raisedbynarcissists,fg47141,t1_fg46uyo,1580497489.0,"That's annoying. Mine dont do that, they just act aloof which frees them from feeling like they should pull weight in visiting.they do when its convenient for them in their RV while they are doing what they want. I'm the one taking unpaid time off and plane tickets to go visit and its NOT cheap, small airport."
raisedbynarcissists,fg3zy7d,t1_fg3zqzn,1580493253.0,"I spent thousands over the last 13yrs going to visit them, while I was trying to build my own life. It was stupid. They even spelled it out for me that they didnt really care if I visited. If I couldn't afford it, that's fine. They meant it too. My mom started to miss me though and make mention of me visiting after a couple of years. 

Same here. Feel free to check out my long list of examples under my profile, you can find my comment on this thread there."
raisedbynarcissists,fg3zjfn,t3_ewnod1,1580493005.0,"100%. I dont have children yet but I dont believe I'd ever say I was glad to get out of their 7th birthday party with a bunch of little kids (Dad) or why MY anxious emotions would be their problem (mom). I promise to never guilt them or talk about how they'd feel if I DIED (Mom to all us kids). I wouldnt chase them around the dining room table and beat them because they firmly refused to do the dishes, esp with good reason fo picking up all the household slack (my dad to my oldest sister) I wouldnt chase my kid out the front door pushing them down the porch stairs for not wanting to engage in rage (my mom to me). I wont force my older child to be the caretaker of the younger child (my oldest sister to me) 

I wont refuse to help them financially when they are doing the best they can, I won't watch them go back to an abusive relationship. I will do my best to make sure they are validated, guided, disciplined and know their value so that they dont have to fill that hole with empty love."
raisedbynarcissists,fg3v8rh,t1_fg3k1d5,1580490403.0,Edad??
raisedbynarcissists,fg3v5kp,t1_fg3i3k1,1580490346.0,"My mother was the exact same way. As an adult she bragged to me that she turned 1900 into 19,000 by investing. Like I wouldnt remember that she insisted we never had any money. She watched me sign student loan paperwork with crazy interest rates... and always acted like their income was precious private info."
raisedbynarcissists,fg3urnr,t1_fg33wmq,1580490108.0,We got decent material items but it was often when they wanted to do it. They were always super defensive about their finances like it was SO private.
raisedbynarcissists,fg3r7g0,t1_fg3p5st,1580487918.0,"I saw a few things on here about braces. Oddly my parents bought us all braces. My sister had to have 2 jaw surgeries, and had a lot of ortho issues that traumatized her, leaving my parents mad at her for 'not complying' she was never even guaranteed to keep her teeth. 

My other sister and I had them. I believe it was more for them to brag about their kids, than actually for us. Maybe a bit since ortho work helps one stay healthy."
raisedbynarcissists,fg3qyn7,t1_fg3bd3w,1580487766.0,"My parents paid for braces but I still believe to this day it was for them, not us."
raisedbynarcissists,fg3qw99,t1_fg3mhdr,1580487725.0,"My mother's mother had her at 41 as well, gmom was born in 1918. My gmom was incredibly quiet, cold, prudish and I dont think she knew how to be a mom."
raisedbynarcissists,fg3qj65,t1_fg359be,1580487504.0,Wow. WOW. Jesus.
