CanadaPolitics,fmj1dra,t1_fmfu73q,1586121080.0,Well I didn't hear about it but I have a similar message but different then for France. But France isn't our neighbours or our one of our top trade partners. The USA is. It's a different relstionship
worldnews,fmfnirc,t3_fut5zj,1586030981.0,"All my emotions can be summed up to Fuck the USA, all of it."
CanadaPolitics,fmfml88,t3_fupwvc,1586030416.0,I say this whole heartedly. The USA can go fuck themselves. This is NOT the time to be playing me first. Take your selfish attitudes and drown in it.
onguardforthee,fmc4yx2,t3_fu9iir,1585939000.0,God damn it motherfu- shit I swear to god someone please slap the ever living fuck out of this man. I don't think it will help I just really reeeeally want someone too.
CoronavirusCanada,fmc457k,t3_fu9hyi,1585938556.0,God damn it motherfu- shit I swear to god someone please slap the ever living fuck out of this man. I don't think it will help I just really reeeeally want someone too.
aww,fm6foys,t3_ft47uu,1585793028.0,"My cat would trip over the first one, scare itself and proceed to scramble through the rest in complete chaos"
trashy,fm43kcv,t1_fm3827l,1585745608.0,"A story with a happy ending, quite the rarity on right now."
memes,fm1yoze,t3_fseipm,1585687419.0,"I mean that's what happens when you marry an immortal. They share there infinite age with you, unfortunately the human body still ages for we mortals such as Philip. He may live infitinly now. but his human body will wither"
Winnipeg,fm0qyrl,t3_fs4pgi,1585664406.0,"Horribly to be honest. I was already struggling with chronic depression, ptsd, and generalized anxiety disorder. I was on edge due being on a waitlist for therapy still after several months. But this isolation has completely pushed me past my holding point. Honestly I should be in the hospital but I don't want to be alone there and they don't allow visitors or guests atm due to the virus, which in terrified of getting to the point of suicidal thoughts. Yes I realize the irony. No one said depression made sense lol"
Coronavirus,flvalb2,t3_frcoak,1585519811.0,"That's nice. Unsaractistically, that's nice."
Aquariums,flk7gjl,t1_fljw5dt,1585235477.0,Thanks for the information. I had read people recommended RO water but didn't know if it was a requirement. In which case I might look into a different species such as cherries or bottom feeder all together that might be a tad less sensitive. I will look into getting the gh and kh kit though.
Aquariums,flk753k,t1_fljkx6e,1585235295.0,"I understand the science of it. I'm just returning to the fish part after a 3 year break. Admittedly it's also my first time doing planted. All I know is the breeders I spoke with kept warning me to bring it down but wouldn't reccomend anything I hadn't done already, so I figured I'd ask reddit for opinions."
Aquariums,flk6sdy,t1_fljgw13,1585235090.0,"I havent tested gH/kH. I wasn't sure how and couldn't really find a kit for it locally.

I've only tested cold water but do use a combo of hot and cold so I'll put some out for 24hrs and try that. I was going to eventually add Indian almond leaves as I was thinking of adding a betta once the shrimp start breeding"
CoronavirusCanada,fljdq2c,t1_flj34cw,1585208189.0,"Although I agree tax revenue plays a role, mail order is wayyyyyyyy more expensive. I'm saying this all from experience. For CBD related products your already paying 50 to 90 through mail order sites, then shipping can boost it anywhere up to 75 or 100+. This compared to local shops where shipping isnt a cost. Speaking on a limited income, the cost of shipping DOES make or break a bank account."
CanadaPolitics,fljdhwt,t1_flixyee,1585207922.0,"Not everyone can get subsidized housing. It's a long waitlist and not everywhere offers it. At least where I am it is. I applied and was told it'd be about a year. That or I could move to the ghetto part of town and get stabbed, but hey the rents cheap, fair trade. For reference I'm in winnipeg. It doesn't matter if your homeless. You don't move to gang areas, period, you WILL be robbed."
CanadaPolitics,flix3p9,t3_foss8h,1585192877.0,"I know it's not the time or place but... shout out to those on EIA or Disability living on 1k a month.


Sorry just a tad jealous. I'm sure it sucks being laid off. Like I get it, what I wouldn't give to work too, but damn yall are so lucky to get finacial help like this."
CoronavirusCanada,fliwkz7,t1_fliuiqq,1585192509.0,"Not everyone can afford grocery stores. For some Dollar stores are the only place they can afford basic living supplies such as hygiene products, groceries, cleaning supplies, household supplies, etc.

As for growing weed it doesn't exactly grow to a useable state over night nor is it easy to grow without room or equipment. So yes, people who medically require it would go without if the closed.

And last for factory and mines. Most mines and factories have willingly laid off half there work force by this point. You'd be surprised how many basic essential things rely on these mines and factories so simply closing them isn't so simple and will have major repercussions on not just the economy (which as a reminder also determines how much everything costs for us) but in those who work there too. It's not a job that can be done from home and most who work in that field will likely need EI which again puts more strain on the limited budget.

Point here being if you dont know much about the industry or concept, learn more about it before telling someone there making the wrong decision. I'm not for or against either side, just that your points aren't very good..."
CoronavirusCanada,flivpcs,t3_fp2ezr,1585191871.0,"Cannabis is essential tho...  specifically for those who use it medically, upon which many who use medically get supplies and quantity from regular cannabis stores. That's like saying your on the fence about if a pharmacy that only sold medical equipment and medicines for diabetes was labeled essential. It's like well yah no shit cause it is. People medically rely on it. Don't get me wrong I understand your point. You just used a really bad example. Like liquor I dont get being essential, but cannabis i 100% understand"
Winnipeg,fl4k8a9,t1_fl48u2z,1584815321.0,"I think the fact that this was common knowledge when this happened is the damning factor. Everyone and there cousins friend know to avoid large gatherings and travel, and that if you do need to go, you need to self isolate. This isn't on the staff, this is on the owner for either A, not looking into travel and group gathering protocols during this pandemic or B, knowingly ignoring them. Explanation and excuse aren't equal. Everything tells me that the owner isn't paying attention to what's going on, which is dangerous for everyone and definitely a reason to warn people about the location. I'm sorry to the staff, but actions have consequences and it shouldn't cost peoples lives to face that. If the business takes a hit from this, that's a consequence of being careless, whether knowingly or otherwise. Ideally  next time the owner might look more into ongoing health emergencies and react accordingly given the consequences of not doing it the first time."
CoronavirusCanada,fl4isk0,t3_fmexne,1584814435.0,"Good. That level of selfish murdering action should be treated with arrest. She is knowingly going out infecting people. You might as well say attempt at murder. If someone dies who she knowingly infected that's willingly on her. That person died because of her intentionally leaving quarantine knowing the result. 

Its like keeping speed to hit a pedestrian crossing at a crosswalk. You could stop, definitely have the time and distance to safely stop so you should, and are supposed too, but you keep driving despite knowing your going to 100% hit that person and possibly kill them."
PublicFreakout,fkt4nb7,t3_fkh217,1584506144.0,Bought a bidet attachment for $50. Done with this nonsense
Winnipeg,fkfbmfh,t3_fi0h6s,1584130912.0,Thank god. I get wanting toilet paper but some people are buying it like the world has ended
CoronavirusCanada,fke4n5j,t3_fhsnv7,1584105062.0,"I understand, but don't agree. People still have lives, work, school, things to do. Yes it ""may"" reduce the spread of the virus, but I think we should be very clear here. Unless you have chosen to isolate yourself as of now, your likley going to get the virus. Statistics say that in a year nearly 75% of the population around the world will have had the virus at one point should we not find a vaccine or treatment cure. That's not to say we should prevent the spread as much as possible, but people lives don't stop. Specifically the uninfected. I think that when a city goes into qurenteen then yes, close mass transit. But until then there's not enough risk or cases to remove such a valuable resource right now. ESPECIALLY  given the weather. If it was warmer maybe you could close them sooner. But many folks can't walk far in this cold. Lastly those who ride the bus do so knowingly. No one forces you to take the bus, you make that decision knowing the risk involved. This would technically be like closing all grocery stores because it's a place of mass groups. It's just not a possible option because it's a necessary resource and thos who go out shopping do so knowing the risk."
Winnipeg,fke3kkz,t1_fkb2oyx,1584104248.0,It's not a common one as covid is more like a respiratory infection but WHO does report some people get mild symptoms of diarrhea as quoted below the math section
Winnipeg,fka9ckf,t1_fk8e3rc,1583997648.0,It's actually the reason I had these numbers oddly enough. I had considered getting one but wanted to know how long till it paid itself off. I then took those numbers and boosted them a bit for this.
Winnipeg,fk7k7o0,t1_fk7e4r9,1583938158.0,"Who wipes more then 4 times? Wtf

4 times is actually a high amount for those with a good diet with fiber. But since it's based on a case of diarrhea I increased it. Based on the 27 people I asked (yes its low what you expect, i ain't no scientist) average ranged from 2 to 3, so I picked the higher one, then boosted it by 1."
Winnipeg,fk7jot0,t1_fk76owh,1583937850.0,"There's actually medical definitions to diarrhea severity as mention in the resources. It's based on how many watery bowel movements the person has per day. I also explain that at 4 people and past I added an additional 3 rolls per person due to the fact that with more people sick in one home the virus is likely to stay longer. I also did mention these are over estimates. Since there's no ""average amount"" of bowel movements I based it on the most extreme case of a person who has normally 3 bowel movements per day and with diarrhea has 4. I also took into account that although it's designed for 1 month some people have had the virus longer, taking some up to 6 weeks to recover. This is why I said ""leaving room for adjustment"" I over estimated so that in the case of prolonged recovery there would still be some available."
Winnipeg,fk6m0w9,t3_fgs1k8,1583906547.0,"For clarification since I didn't state, this is roughly the same amount you'd buy normally. Basically I'm saying go about your monthly shopping as normal."
Winnipeg,fk66crj,t3_fgfjo7,1583894630.0,Im actually pissed at all this stockpiling. I have maybe 2 rolls at home left? Just happened to run out around this time and now I'm gonna be stuck using plastic bags or something.
Winnipeg,fk65zc1,t3_fgfjo7,1583894406.0,"When I saw this I thought we just had a case here or something. A part of me gets it. We have a lot of people and each person probably wants atleast 1 pack around. With everyone shopping at once it makes sense... that said, I know 100% this is cause people are stock piling 100 years worth of supplies like the dead just woke up. So to the one who was hollering a dozen things of tp, dishsoap, hand soap, and hand sanitizer from walmart. Fuk yo ass dude chill. It's a virus not the apocalypse."
Aquariums,fjxpqvh,t1_fjxj77u,1583680390.0,Pretty sure there both snails
shrimptank,fjoxvnz,t1_fjoxjpk,1583537169.0,"Honestly I don't know. It was fine at 7.2 a couple days ago, but I don't check often. The shrimp don't seem to be acting crazy different though some appear to be a bit more sluggish. If anything my plants are taking the most beating visually. It's why I tested it to begin with as many are wilting"
CanadaPolitics,fjoxiko,t3_febxjl,1583536935.0,"I'd say we had this coming for dragging the system so thin to begin with but ""we"" as in the majority of canadians didn't want it to be thinned out to begin with. Politicians did and it's just that some of us are stupid enough to believe it when they say they won't make cuts."
aww,fjnei27,t3_feae1s,1583505545.0,"Congrats, you've now been adopted by 3 cats!"
Winnipeg,fjne9ae,t3_fecvxf,1583505378.0,"I was never able to get breakfast before school. My mom started work at 6am, worked 40 minutes away, and we were out of school bus range. For both elementary and middle school my mom would drive us to school at 5am, my siblings and I still half asleep. We relied on those programs for breakfast because otherwise we didn't eat. There just wasn't time unless we planned on getting up at 4am and believe me we tried that. Without these programs I would have been sick all day. I get severe migraines from not eating. Numerous days my dumb kid self didn't like the food so I didn't eat and with 3 hours I was needing to go home. I can't urge enough that case like mine are not unique by any means. Yes there will be parents who will abuse the system to not have to deal with feeding there kids breakfast, but like the income assistance or disability programs the people its helping far outweigh the people abusing it."
CanadaPolitics,fjlt1uk,t3_fe2bl5,1583453796.0,"About time. So I've been with bell for a few years and watching the prices unjustifiably rise has been nothing short of a nightmare. I can't even change my plan because despite getting the higheat plan for a 2 year contract in 2018, it's now the cheaper then anything else they have, so even if I switched to there cheapest plan, it would be more expensive. When I asked what it offers, there was no difference then my current plan. I've gone through a few companies and all with the same thing calling it ""market price""."
CoronavirusCanada,fjgd7dg,t3_fcyb02,1583322698.0,"This strain of it no, not at the moment. But there actually is specific strains of coronavirus for cats and dogs. These are known as FCoV and CCoV. Both are non transferable to humans. Both arnt lifethreathening if treated but can take years to fully remove the virus and are most commonly seen in stray or outdoor animals as the virus is transmitted via feces. So if a pet smells or comes in contact with an infected animals poop they can catch it. Like most strains or coronavirus it's highly contagious but not as much as this current one. The largest risk it poses is dehydration amd malnutrition due to the side effects diarrhea and an inflamed gut. That said the feline version (not sure on the canine one) has a 5%-12% chance of turning into a uncurable 100% fatality rate virus called FIP. Both FCoV and CCoV are not common in house cats but do show up very commonly in outdoor and feral colonies. This is why its important to wash your hands after touching a stray animal. (Source: my cat has FCoV.)

Treatment isn't too bad but is time taking. Mostly some probiotics and vet food for gastrointestinal response. Retest every 6 months. Special litter to trap the virus, removing all fabric cat things and cleaning all cat items once a week. It is pricey though so I highly reccomend anyone with a pet get insurance. If your looking for the cheapest reputable brand there's peppermint. There's owned by the same people as petline but have cheaper plans with the lowest feline one being $10 and lowest canine being $11. If you want most coverage, customization and direct pay Truepanion is best but it comes at a price."
CanadaPolitics,fizv9js,t1_fiqqg4v,1582876170.0,"Not denying that, just that the nature of these protests are making these people feel validated in those remarks. Enough so to make them publically"
CanadaPolitics,fiumnmh,t1_fiqq1dl,1582744308.0,"While your wrong, Martin Luther King Jr held massively planned protests. Protests that already had large attendance. The protests we see right now aren't really that planned. They contain maybe 5 to 50 people at times, happen sporadically and without much warning. I don't know much about MLK Jr but I assume people knew his protests were happening and when. That's why they worked. They were planned and put together in a way to gather as much support into one area as possible to show case how many people were unhappy and suffering. These haven't been that. It's like the pride parades. At the beginning before it was a fun annual event they were protests for equal rights. They were planned and thrown together in the most effective location. They collaborated with others, notified people, and most importantly, made sure the city was aware that this was happening. In our country we have the right to protest. If you want to block off downtown for your cause you can, but the fact that the city has no warning on it is why there so destructive. No one has any time to prepare alternative routes or prepare for delays in the system. It causes panic and costs people thousands or even jobs. I don't know if I'm for or against the goal of the protests because all anyone focuses on is how destructive they've been. The protests have done absolutely nothing. Because people arnt taking about what it's for, there taking about what it's done. They've completely missed the goal."
CanadaPolitics,fiul4b3,t1_fiqoouj,1582743463.0,"The remarks I was referring to are in person sadly. Granted I have a rather conservative family which means people I hear and see are usually in the more unaware closeted racist area. That said I hear it on the bus, and stores too. Just passing remarks, glances at others or disgusted sounds whenever someone who indigenous in appearance comes by or I see the opposite just as much of someone who I presume is indigenous talking about ""disgusting fucking whites"". The city has always been divided. With such a large metis population protesting for fair chances and treatment, were bound to run into issues in the sense that protest of less then 10 people blocking off entire roads are common, but it's bad right now."
CanadaPolitics,fiqlryr,t3_f9a7ia,1582647030.0,"I don't know... maybe I just don't get it, I'm fully aware I'm very uninformed on the technicalities of these issues, but the protests just don't seem like the most effective way to spark change. Protests to me are a way to gain support and voice your problems, but if everyone is pissed off at you it seems like you'll achieve neither. All I hear from people now is how pissed they are at them and the people behind. I've heard more racist remarks in the last week then I have in years, and I live in winnipeg, that's unfortunately our thing. I just feel that surely there must be more efficient ways to protest that don't involve turning entire cities and systems into a chaotic mess."
Cringetopia,finwk2y,t3_f8oynt,1582571618.0,"The concern isn't the incest, but the getting caught part."
Winnipeg,finwbo2,t3_f8sivn,1582571481.0,"I'm so so sorry such a hard time was made into such a mess. Seriously. Based on your experience I definitely won't ever be using them. I can't imagine the amount of extra pain this caused. Unfortunately I'll be likely planning funeral in the next year or two myself, so to say I'll looking elsewhere is an understatement. Like I get things happen, wrong orders, or late arrivals can happen but all at once with no way to cancel and no refund, that's insane..."
EarthEnthusiasts,fin0bvh,t3_f8mx5r,1582552497.0,I actually fucking love this lmao that's amazing an awesome ad ngl
dashcamgifs,fin03v2,t3_f8ez83,1582552322.0,That just seems like a crappy designed turning lane. Like who the hell puts a turning land that far to the other side of oncoming traffic without some sort of medium.
Minecraft,fimhuap,t3_f8js38,1582530944.0,Thank you! I love mods for the game but it always kinda bugs me the way certain things clearly stand out as not apart of minecraft. Its not the biggest deal but when I just want a small pack to add variety it just feels off
CanadaPolitics,fimhpu1,t1_filw96q,1582530793.0,"I mean I never said all the parties, just 3 or 4. That being CPC, Lib, and NDP. Though some provinces also have another that goes well. Green won't ever get full in but they do claim a few seats usually in some places. That said I do understand voting strategically. I mentioned it in another reply but I never said the system was good, but until it changes theres not much aside from working within the system to get the best results for you. And while that normally means only 1 or 2 options for people depending on left or right views. I particularly wanted to point out that parties do change where they lean on the scale, or atleast how far on it they do and I think it's good for people to regularly keep track of that across the board, even if you wouldnt normally even consider them. That way if you do need to vote strategically you can do so with the most confidence in the result. For instance I like NDP, but I voted liberal this year because where I recently moved is normally CP, which I don't agree with, that said I still follow the CP through social media. I guess the point I was originally getting at was just that if so many people dislike CP currently but whine at the thought of Lib, consider another party. Which I realise as a supporter of one of those ""other parties"" this cones off as bias, but I say from the standpoint of knowing way to many people who won't even look at the others because X amount of years ago they were bad. And to me that just doesn't make sense"
CanadaPolitics,fimgzab,t1_fikxh81,1582529914.0,"I meant generally on the grander scale of things. Even if your specific district/ neighborhood is unwavering, city, provincial and federal fluctuate back and forth over a decade between 3 or 4 main parties. Mostly 3 but some specific provinces have additional parties that stand a chance.

I get it, I do. I voted strategically 2019, but I also didn't hate the option I choose either. It wasn't my top choice but not last either. If i truly hated the party i wouldn't have voted for them, even if it meant voting for a losing party. I'm not saying it's a perfect or even good system, just that it's what we have and you can either work with it to change it, or work against it and gain nothing."
CanadaPolitics,fikeozu,t3_f8apzc,1582478944.0,"I see so many complaing about a ""liberal government again"" for next election... you know there's other parties... right? There's minimum 3 parties that stand a chance depending on where you live, for some its 4. If CPC isn't reflecting the decisions you want and neither is Liberal, look at the other 2. Also bear in to regularly relook at each parties leaders, actions, and goals. They change all the time so a party you might have hated 10 years ago or even 5 years ago, may be completely different now. I know its semi unrelated but I think it's important people try not to pick parties the way we pick brands of clothes. You should look at who reflects your goals those given years, not who you've always picked in the past and be stuck feeling you had to settle for less. The leader reflects the party. If you don't like the leader, you don't like the party. It's ok to change that not just every election, but everyday based on your needs and goals."
PewdiepieSubmissions,fik3cwf,t3_f8753z,1582471775.0,I really want this to be ironically as cringey as it is...
space,fifhw7s,t3_f7qwtu,1582389877.0,"That's actually fucking amazing. I'm only 21 so for me going to the moon is obviously incredible feat, but due to time alone, never had that same aw inspiring take away that my parents or grandparents had for it. I actually really want my grandma to see it with other family. She's told me about when she was young listening about it through her radio. She lived in Scotland at the time and was just a teen. I think it'd be cool to take her to see what was one of, if not thee, biggest scientific feat of her youth. To see on the level of detail as if being there."
CanadaPolitics,fifewrq,t3_f7tau2,1582389131.0,"As someone who's been on multipul legal antipsychotics and antidepressants for years, I for one would really love to at least see something done to have it just considered here. I struggle with PTSD, Generalized Anxiety Disorder, Chronic Depression, and likely Borderline Personality Disorder. I have to say, after 8 years of on and off probably 10 or so medications, 3 doctors on a regular basis, trying 4 forms of therapy, 2 regular therapists, and living on disability since 19 because I just can't function long enough to work, it'd be nice to see more potential drugs or treatments put of the table that could bring some normality to my life, and others like me."
PewdiepieSubmissions,ficvdtz,t3_f7me6y,1582357592.0,We have taken the powerrrrrrrr!!!! MWHAHAHAH
Cringetopia,fi9k5m5,t3_f6zac4,1582268957.0,"I wouldn't say this is cringe, more then likely it's out of context bullying. Im sure my brother would have looked ""cringy"" too when he was in our high school halls screaming murder at the kids who bullied his friend into suicide the previous week and proceeded to tell him they didnt care or he wouldn't be missed.

Context with cringe is important too.

(Obviously I won't use names but I did ask my brother before sharing this bit)"
