Whatisthis,fr2jtw4,t3_gm403l,1589838549.0,Parasite or lice. I've seen them attach to crustaceans but don't know the name
Winnipeg,fqcpzq6,t3_ghvm0b,1589265198.0,"So I genuinely want someone to try change my mind. Why do we glorify riel so much. Personally I think he's a murderous nut, traitor is a bit of a stretch, but by no means do I believe him to be justified, let a lone a hero. I find his actions were unnecessary and extremist behavior. I've heard the history and know the stories. I know he was fighting against some horrific racism and bad things but idk, I just can't support fighting murder with more murder... I just feel like your not accomplishing anything with that aside from proving your equally an asshole. I believe in what they were fighting for, but not the means by which they did so. So in short. Hes not a traitor nor hero. He made a stand and took things too far in how he did that."
wholesomememes,fqco69f,t1_fqckzun,1589263623.0,"So yes pressing for things is worse but that's IF they just don't want to talk about yet with you NOT if there hiding it to protect you. All too often those struggling with depression or stress or whatever don't want to tell anybody not because they're not ready, but because they're afraid of hurting others. There afraid of sharing how bad they really feel. At least from my experience and my friends, we stayed quite because we couldn't bare putting others through what we were dealing with. And honestly those fears did happen. By guardian cried so hard when I told some of my feelings, but it got easier after that because once others know, they can better interact with you and your emotions."
wholesomememes,fqcnnkb,t3_ghszss,1589263183.0,"My persistent fox is my bf, love him to bits and so thankful for him <3 I know I'm not always the most helpful or kind to myself but it's your persistence to see me happy and to push while respecting what I'm comfortable with that allows me to open up. You might see this or you might not, but you've saved me more then just physically from hurting myself but mentally too. When I'm my own worst enemy, your my persistent fox staying by to help. I appreciate that, you, so much. Slowly I'm learning that it feels better to want to tell you how I feel even if I'm scared it'll make you sad and worried for me, because it's easier together... instead of trying by myself to carry it all and that your ok with sharing my burdens. I'll still take time but, thank you <3"
Cringetopia,fq91nqi,t3_ghffdx,1589182422.0,"It hurts more remembering I dated a guy like this... the most edgy wannabe incel fedora wearing fuck you'd ever know, and yes, they are so much worse in person."
PublicFreakout,fpm761z,t3_ge3tua,1588726943.0,"Have they.... never heard of star wars? Who the fuck hasn't heard of star wars?! 1: thise suits are not designed for movement, so those screams were genuine pain. 2: the store owner clarified it was a fake gun 3: who the fuck doesn't know what a stormtrooper is?! The shitty gun is part of the gig. Wtf"
Winnipeg,fpl9xd7,t3_ge0wib,1588708949.0,"I see a lot of people commenting about how it doesn't seem fair that seniors get this or don't have to go through that, but I'd also like to remind you that they haven't gotten anything in this time actually. All of the money that the government said was going to be given to seniors to help them in this time was given to charities that not everyone is a part, so unless you sign up directly for these charities which many people don't support them since they're a bunch of money grabs, most seniors haven't gotten anything in terms of help in this pandemic. The people that need to be able to afford grocery deliveries and buying bulk of items and masks are some of the ones that can't afford it at all because they've been given no help. The most vulnerable have been left out in the dust. I stand in a weird middle line where I'm a disabled student in University but I've lived with my 70 year old grandmother for years. So I'm going to learn a lot about  the true differences between age groups  and the fact that there really isn't many. Her and I both are in groups that have been completely skipped over until recently. People tend to forget and Target seniors due to the fact that they're the boomer generation and a lot of the political leaders are of their age group, but I'd like to remind people that seniors of the middle and lower income brackets get screwed over just as much as anyone else. It's only the wealthy people regardless of what generation that actually have it easy. It doesn't matter what age group your in your pretty much financially fucked.

I also just want to point out as well that I'm not defending everyone else getting nothing I'm just saying it's not fair to go down the ""if I can't have it nobody can route"" and rather I'd like to see people arguing for everyone getting something along those lines rather than the ""me not them"" mentality"
PewdiepieSubmissions,fpd2rps,t1_fpcw2w5,1588518613.0,"No that's not what he said. That's you INTERRUPTING what he said as that. What he's actually said is ""FREE AMERICA NOW"" then later after endless rambling said ""Yes, reopen with care & appropriate protection, but don’t put everyone under de facto house arrest"" however he only said this in response to another comment NOT of his own desire. Additionally America had this. At the beginning you were allowed to go out however it was recommended you take precautions, however Americans showed that they're incapable of making those decisions as people continued to go out without taking precautions and ignoring safety. As a result people started dying fast so they had to enforce a lockdown. This was a decision that American citizens made, actions have consequences and America right now is facing what happens when you don't care about those consequences. Had people listened to warnings this wouldn't have been a problem. You're going to be pissed off that people let it get to the point of full shutdown not that the government had to shut it down because people weren't listening. He's also been rambling off extremist rhetoric and his tweets over the last number of days have been so random and inconsistent that investors have basically dropped off a cliff. People are pissed off at him for a reason. You cannot interpret what people say as something better you have to look at what they said and what he said was a chat being used by extremist groups in protest who think that the coronavirus is a lie and that the government is a hoax. That's what he was supporting whether intentional or not. Help now he's encouraging people to design a way to play Minecraft while driving a Tesla. That's not safe. Yes Tesla's are extremely safe vehicles and dry themselves with minimal human interaction however it is still law that you still must pay attention and have a hand on the wheel. He is openly encouraging people not to pay attention when driving which is directly against the law. To say that his priorities are skewed is an understatement. He very clearly doesn't care about people's lives and only cares about prophet. Do you want to know the real reason he's so upset? Because he didn't get his big bonus. An article was released discussing about how because Tesla had been doing so good over the last year it was looking like Elon was going to get a massive bonus check however do to walk down they've been making zero profit and as a result you're likely not going to get that massive bonus check anymore. This information was released shortly after he went on his tangent. He doesn't care about safety he cares about his profit and I recommend the next time you want to defend somebody you do a bit more research on them."
OneSecondBeforeDisast,fpd13em,t3_gcmxj0,1588517556.0,Why did no one do anything for so long though?
onguardforthee,fpd0nsq,t3_gck6gl,1588517280.0,"In the most Canadian way possible,

We don give a flying honk wht they think."
PewdiepieSubmissions,fp7krlo,t1_fp6ugzh,1588372482.0,"Soooo close to the point. It hurts. Sigh YOU may not be but by continuing these jokes you are encouraging OTHERS too. Idk maybe your too young to understand... think of it as a chain reaction of sorts. With each reaction trying to top the previous one. You make a joke, someone makes art and a joke, the next person makes physical art and 2 jokes in one, the next person and so on. All for attention.additionally felix has yet to openly acknowledge the fans joking about it yet. You might notice it's almost always edited out of the video for likely good reason. When he jokes about it, it's in a semi cringy manner or done as a reflection on past experience. All we do know is that he asked us to drop it, so I don't get why all you kids find that so hard. If you don't respect him or his wishes then why watch him, just leave and come back when you've smartened up a bit."
PewdiepieSubmissions,fp6kjtt,t1_fp64b1d,1588353923.0,Honestly I hope this doesn't become a thing because it really got out of hand last time and hit pewds pretty hard as a consequence to our dumb actions. It was funny at first but with 100m of us it's going to get out of hand again. I wish fans could just enjoy his content and leave it be
PewdiepieSubmissions,fp6k9xr,t1_fp5qij2,1588353788.0,"Considering the last one got so out of hand that it became a white supremacist movement, how about no and we do what felix asked and just leave it be? Just a thought"
PewdiepieSubmissions,fp6k1ls,t1_fp6cp00,1588353672.0,"What part of drop the t-series vs pewds thing do you kids not get. Felix has asked us to stop, so stop. End of story. No jokes, no ironic comments. Just drop it"
PewdiepieSubmissions,fp6jt6p,t3_gbh14r,1588353557.0,"Guys please don't do this again. It got sooooo out of hand last time. Just don't. To whatever actual 9 year olds following him that think its funny, please just don't. Your too young to understand but just dont. Whenever we get out if hand, Felix faces the consequences. So can we just enjoy his content and leave it be? Who cares if channels pass him, that's not why were watching."
Winnipeg,fp2wb31,t3_gazcer,1588268962.0,"They just past moray on Portage. Was wondering what it was for, couldn't see from my window but glad to know it was something positive"
Cringetopia,fowdb8k,t1_fow8ssa,1588117569.0,By enough female parts I was referring to a reproductive system. How about ya learn to just read in general. Also get outta here with your emoji nonsense
Cringetopia,fow2us0,t3_g9mfy2,1588111989.0,"Not actually that impossible or weird. If someone born female transitioned to male but didn't surgically change anything down there then they can still have children and breastfeed. Or in some cases men can be born with enough female parts to support a child. Neither scenario makes them any less male but does make ""male pregnancy"" possible with or without modification to the human body. Its uncommon but can happen naturally."
Aquascape,fonibaj,t3_g8fnh4,1587920039.0,As someone new to aquascaping this actually was quite educational
Aquariums,foe222j,t1_fodz0o8,1587694499.0,"The aquarium currently only has a few shrimp. Do I need to treat the tank? I can easily relocate the shrimp if so. I've also noticed a few ""planaria looking"" flatworms around the glass, though there too small to confirm."
AquaSwap,fo9atvx,t1_fo90g9l,1587614632.0,Interested. Will pm
Bad_Cop_No_Donut,fo4xw4i,t3_g5jqy3,1587513379.0,Cops are shitty no matter where you live.
ActualPublicFreakouts,fo4wr84,t3_g5gd6h,1587512735.0,"As someone who's tried to grow multiple gardens, that shit ain't easy so to have these guys just drive over it. I'd be pissed too not enough to threaten someone, but if have a few choices words."
interestingasfuck,fo3fqss,t3_g5eo8v,1587486141.0,I thought you just found a picture of a dude that looked like him until I read the title...
fundraiser,fo0v470,t3_g52dr4,1587420330.0, https://www.gofundme.com/f/3tvasq-please-help-me-save-my-cat?utm\_source=customer&utm\_medium=copy\_link-tip&utm\_campaign=p\_cp+share-sheet
MiniLadd,fnvgumi,t3_g4229l,1587292811.0,Cute but kinda not sure how mini is feeling still about the dogs. Obviously he clarified he agreed with who got them but I imagine he's still sad and missed them...
Cringetopia,fntwbr8,t3_g3oya4,1587249835.0,Humanity was a mistake.
Cringetopia,fntw6oe,t1_fnto284,1587249757.0,Humanity was a mistake
MadeMeSmile,fntc2fj,t3_g3oi04,1587238668.0,"These kind of moments are why more people should donate hair


(being cautious of where its donated of course)"
Coronavirus,fnr0jz4,t3_g38hnw,1587176398.0,Phil wtf
Whatisthis,fnr0c3g,t3_g328ey,1587176248.0,"Ohhh that ones biiig, kill it. Kill the damned tick. It deserves no mercy"
apple,fnjyphu,t3_g1tlgv,1587010201.0,Oh this is perfect timing. My grandma is looking for a new phone. She likes iPhones cause of there easy interface but hates the new big and expensive models. This would be perfect for her! What a steal.
Cringetopia,fnjv54c,t1_fnihp4d,1587007724.0,"The n-word is unfortunately thrown around in a lot of video games. I'm not saying it's good but rather that spend enough time around it and your bound to slip up. He definitely shouldn't be forgiven instantly but he's also outspokenly on several occasions apologized and hasn't done it since. What more could someone really do? They've apologized profusely and changed as a result of the consequences.


As for his political opinions? He doesn't really share many aside from subtitle hinting he thinks trump's an idiot and that he finds politicians are stupid most of the time. Additionally just like any other person in the world he has the right to share his political views even if you don't agree with them. Having a different political Spectrum doesn't inherently make you racist unless you outwardly support a racist politician upon which I can't think of a single situation where he's knowingly supported a blatantly racist politician. His channel tends to get a lot of political problems simply because of the size of it.

Hes made so many videos explaining things that at this point it's an ongoing joke in the fandom whenever he has to do it again simply because people just don't listen. he's explained numerous times that he doesn't support any of the racist actions people have done claiming to be in his name, and has on numerous occasions displayed genuine sympathy for victims and depression over the fact that people associate him with such a negative and horrific thing. He has on numerous occasions released videos discussing about that he doesn't support any of these kinds of beliefs or actions. I think at this point whether he is racist or not, it wouldnt matter. People will always find some evidence from 6 or so years ago to try and prove otherwise.


My opinion on the  matter is I don't think he's racist I just think he's not trained in picking up on the potential effects or his actions. Believe it or not not everyone is super socially adaptable or has the best oversight. I don't think he's racist I just think he's probably very irresponsible but that doesn't make him a horrible human being. Should he do more research into people and things he supports? yes, due to his public and social appearance he should definitely be super cautious. Is he? Well not always. That's definitely a flaw on his part but doesn't inherently make him a horrible person. Should he be more cautious of exactly everything he does and every word he says? Unfortunately yes but again he's only human and again being irresponsible doesn't make you a shity person or some closeted racist, it just makes you irresponsible.


There's also the fact that YouTubers, unlike many celebrities don't usually have managers in charge of monitoring all their actions. Do you have any idea how many pop stars or famous celebrities would likely end up being seen as racist assholes if they didn't have people constantly monitoring everything they say or do. In fact it happens a lot. Constantly they will tweet or send out things that are been taken horribly wrong by the public and later they have to release an apology explaining what they really meant. Most YouTubers on a larger scale have a manager but nowhere near to the same extent as celebrities do. So it only makes logical sense that things are going to slip up every couple of months. Combine that with doing a career over several years and of course people are going to be able to find evidence to take out of context.


Honestly I don't know why I'm continuing this conversation simply because I am one of many people who have had to explain this over and over and over again. Do I think he's some closeted racist? No, and I only think idiots would believe such an accusation. Do I think he's a responsible person however? No, I think he should probably do a better job of monitoring his actions given the potential effects they could have, but that doesn't make me hate him as a person, it just make me more wary of the things he supports.



I also think that the things he support have nothing to do with his content. He could be an absolute a******* I still think he's funny and enjoy his videos. Do you have any idea how many actresses and actors are actual complete assholes in real life. Way too many, and yet don't tell me for a second you still don't watch their films. Why? Well the most common argument is because the film isn't about that one actor, your more interested in the content being presented, the story, the film. The same applies to YouTube, it's not just about the content creator it's about the content itself. If you find it enjoyable you're going to stay and watch it even if you know the person is a horrible human being. There's obviously certain lines people draw but that's different to each person's moral compass. Personally I can stand the idea of supporting an irresponsible person, that doesn't bother me. Some people however may not be okay with that, but I definitely don't think it deserves the amount of flak that he gets.

End point:
Irresponsibly does not equal closeted racist."
Cringetopia,fni5a1v,t3_g1oor8,1586974215.0,"So is there a reason so many people shit on felix aside for just his numbers. His fanbase is about 60% kids. Of course its cringey. There literal children. It's a pretty one sided battle don't you think? I'll guarantee it was either created by a: a kid with no idea what they were actually implicating, b: a racist troll using the fandom for attention, or c: a fan who is a genuine racist but doesn't reflect the channel because there everywhere and in every fandom, it's just more prominent with felix because the more people in one area, statistically the more shit asses.

Obviously yes I'm a fan, I don't normally step into this kind of dumb shit because it happens all the time and you'll never win, but every once in a while you get annoyed with it."
Cringetopia,fni3shi,t1_fnhar5n,1586973487.0,"Idk the artwork is pretty dope. I mean yah there's a lot of karmawhores but isn't that kinda the point of fan subreddits? His isn't exactly unique in that trait. Most fan subs are filled with cringey fan memes, fan art, a couple racist twats because ""attention"", and just a lot of god like praise because of course there is. It's an entire subreddit dedicated to said person, what did you expect?"
CoronavirusCanada,fni1mjh,t3_g1tal1,1586972449.0,So I realise I might just be dumb but what exactly is the downside to research being publically available?
Anxietyhelp,fn4q42t,t3_fz6a8p,1586646557.0,"You do exactly what your doing, go to the hospital. Not because there's something wrong with you or that your not good enough but because your family loves you and needs you as much as your going to need them right now. A hospital is a place that will help you find the next steps you need in life to start loving yourself and to see yourself the way I'm sure everyone sees you, a wonderful and good person. I don't know you or your family but I do know anxiety and depression. I know that it prays on little thoughts and grows on them like a parasite. That it takes months to grow and once you notice it, it can seem indestructible. An infinite hole inside you that's been slowly swallowing you up. This darkest of dark, a medical condition that seems so terrifying. You have to remind yourself of that one part tho. It's not ""in your head"" like a song, it's a condition, a medical, diagnosable, and importantly treatable condition. How you feel now may feel like forever but it can be treated with time and will pass. But that's why its important to go to help now, when you feel at your worst, because they know how to help you, how to teach you, and how to teach your family to help you too."
Winnipeg,fn4o5b3,t3_fzcxxf,1586645387.0,"So based on this graph, if we continue our current practices, things might turn out ok? Not great obviously since people  will still die but not nearly as bad as it could be. Like this is a good partern right?"
PewdiepieSubmissions,fn3hcgs,t1_fn3fryp,1586620754.0,"I don't really know the video your talking about but the anesthetic thing is enforced but not as monitored as one would hope. (Based on experience from a friend who worked in a now closed restuarant who served it). As for the animal dying in less the a minute, then half the dog festival would be fine to you. A lot of them die to stress and blood loss in a minute or two. I'm not saying I support either side of the road I'm just saying you need to pick a lane. That both lanes have their pros and cons. You can't criticize another culture without acknowledging the fact that were pretty shit at animal rights too. I mean look at any fish and how there farmed, or chickens, or pigs. Many are left to be crushed to death, thrown around like a carcass despite being still alive. And if there has been any regulation since I was last in a pig farm or toured a fish farm, then their sure as hell not enforcing it very well. (For reference I was last in a pig farm 7 years ago and toured a fish farm 2 years ago, so they may be enforcing more but based on all the documentaries that still come out, I'm guessing not.)"
PewdiepieSubmissions,fn3fdvs,t1_fn3cpsf,1586619611.0,"We do the same to a lot of animals just saying... some of the most intelligent animals on the planet are eaten as a delicacy being chopped up alive and we encourage it. Others are dragged, beaten, smashed, or just left to bleed out. Western culture is by no means any better, were just better at hiding it. I'm not vegan but I do choose where I buy meat very consciously, it's a tad more expensive, but local is always best. I hate seeing the dog festival crap too but I'd feel hypocritical to criticize it knowing were no better."
SelfAwarewolves,fn1o54e,t1_fn1jpns,1586566242.0,"I didn't say pick a racist. I said pick someone who represents what you want not talks about supporting people who represent it. Bernie is a very unique example being outside that box, Biden however is such a clear example of people saying they support one thing but voting another. Additionally your Jewish remark depends. Your either jewish race wise or religion wise. They used to be the same thing in the sense that as an ethnic group it didnt exist, but after WWII that kinda changed. So if referring to being jewish as an ethnicity, then as a jew descendant myself, were not really a minority because the rules of being a minority are 1: out of date, and 2: don't really apply because theres no targeted features. But if referring to being jewish as a religious group then yes they are targeted in the same way those who practice many middle eastern religions are. given context however you weren't referring to it as a religious group but as an ethnic group right? In which case being descendant of Jews often doesn't result in racism unless you appear ""stereotypically"" jewish or come from a very strong jewish community. However this is instantly over ridden if you meet other criteria such as being wealthy and white because racism is almost always based on visual representation. Racism is truly only skin deep. If you look a certain way you are targeted, which is where being decendent of Jews becomes unique in that there is no particular traits associated with it unless you specifically follow it as a religion.

To sum it up being descendant of jewish family doesnt give you a minority card unless you actively participate in many of it religious traits. This is an odd quality unique to the jewish community as a result of WWII."
SelfAwarewolves,fn00lbz,t3_fy6urh,1586533232.0,"No he unfortunately has a point.

I've always been one to say you should pick a person for there qualities, not race, gender, age, or religion, but... for a group that so openly claims to support diversity, the final candidates were awfully un-diverse. I'm not American but I am so disappointed. I mean my country (canada) ended up with a straight white male as leader again too but at least he's a bit younger and our more left parties had diverse leaders. (For context our system has multiple parties that can technically become our PM, not 2, however it is usually between two, our conservative and our liberal parties. That said our democratic party does normally still take a good number of votes.) Biden, Bernie, and Trump are old enough to tell stories of when dinosaurs roamed the earth. Hell all the last candidates were over 70. You talk about wanting new generations in office, but still vote up the older ones or don't vote at all. At least Bernie had a history of supporting diversity, but still... why support some who supports diversity when you can directly support a diverse leader. At least that's my logic on it but I'm not american so maybe there's something I'm not getting."
wow,fmljaad,t3_fvlbcs,1586187524.0,That's about the reason I don't tank. Or choose anything new for that matter. People got no patience for new
