onguardforthee,fi9jj0y,t3_f6wncu,1582268251.0,"I mean to be completely honest, this one isn't thaaaaat much better. It's a bit, but I still easily see some questionable things make it as top posts. A lot of time in the fourms of back handed ""progressive"" remarks. Things like ""we should help X people... because they can't do it themselves"" or ""screw X people because they're historically evil"". Good attempts, and I get what they meant, but executed in a way that completely misses the point."
unpopularopinion,fi4yy7c,t3_f6b156,1582151302.0,"So to summarize my counter, should kids under 13 be going through medical transitions, not in my opinion, however if at 14 they still want to do it then that choice is between them and their parents to make, not random strangers on the internet who have nothing to do with their situation or know them on a personal level. Transitions are in their very nature a person-to-person sting and each case should be discussed as it. This is not like drinking, or getting a license, because those have stricter rules that affect everyone regardless of their personal situation come up with transitioning is in its entirety about how the person feels, and feelings cannot be cut down to basic shapes and rules. If a child has expressed since an early age the desire to be a different gender and by 14 wishes to go through with that transition, then I believe that to be ample enough evidence that they understand what there doing.


Long version:
I mean depends on age and level of transition. You obviously mentioned that yah, if at a young age they vocalize wanting to be a different gender then support them. Allow then to make external changes such as clothes or activities, not that those are gender specific anyway, but still. However I will say that at 16 or so there are specific changes that are significantly easier to began doing, then to wait, some are even impossible. With hormonal medications, while going through puberty, someone transitioning can obtain permanent changes that would otherwise take lifelong medications, or be not possible at all. Additionally if your child has expressed for the last 5 years a desire to transition, then surely by that point there pretty confident in there decision.

This isn't the same as choices with dangerous consequences. This is about feeling physically out of place in your own skin. ""Kids"" arnt as stupid as you seem to believe. They know when something doesn't feel right like anyone else. To compare this to the consequences of drinking is to say that there can only be negative outcomes and that someone under 18 is unable to expect or predict them, which when discussing transitioning is completely wrong. Were not talking about consequences that last one or two days, were talking about life long changes that these kids have likely already considered. Yes obviously at the age of 10 or 12 those aren't things that can really grasp, but by 14 to 16 years old you have a pretty good understanding that if you wanted to transition to a completely different gender that's a large change that will affect you for your life. I think that if it's a spur-of-the-moment decision you should definitely give it time and if your child has only recently opened up to you about it, then again, doing medical changes should definitely be given some time, but ultimately the age specifically they do it is really dependant on them. 


By the time you're in your teen years you have a general understanding of your body and how it works, that's the point of puberty, it's a learning curve for just that. If puberty hits and you still find that you don't feel comfortable with your gender then I feel it's perfectly valid for parents to support their kids going through transitions on a medical level. That said I do think you should wait for puberty to start for those kind of changes. I don't think that a 12 year old should be taking hormonal pills, but I do think that at 14 or 16 years old you have enough of an understanding about yourself to make that decision. 

Additionally I support that opinion because the fact of the matter is another two years of life experience likely isn't going to change there opinion and the second they turn 18 there going to do it anyway. Better to have the support of family while you're going through this kind of medical change then to have them outright deny you because they don't feel you're responsible enough and cause a rift in your relationship where they feel you weren't accepting of who they are. What many parents seem to often forget is that trust is a two-way path. If you display to your kid that you don't trust their decision-making skills, they will hold that against you and they will not trust you back. So if you would deny your kid the ability to change into a gender that they feel is more, well them, for the reasoning being that you don't believe they're responsible enough, they will take that personally and hold it against you. It is in my opinion that the very definition of bad parenting is a lack of trust. If your kid doesn't trust you, you've done something wrong. You have done something to prove that they shouldn't trust you and the minute that happens you run a very dangerous path not just in terms of your relationship with them but in terms of their life choices because from that point on they won't believe anything you say, even if it's for their own safety.

I've seen it happen all too often where parents let that trust between a child and a parental figure slip away without a care in the world, only to end up seeing the kid go down some really horrible paths because from that point on they felt that they couldn't trust the only people in the world who they should be able to trust the most."
Winnipeg,fi4r8qr,t3_f6f64o,1582146854.0,"Again another, if it happens I see no downside, but it's always a BIIIIG if with these kinds of things."
