PeopleFuckingDying,fqwx0e0,t3_gl95uo,1589720146.0,what did he expected to happend? xD
blender,fqtgghq,t1_fqtagp1,1589638511.0,[https://twitter.com/0by0ne/status/1151346825556893697?s=19](https://twitter.com/0by0ne/status/1151346825556893697?s=19)
MarkMyWords,fqt691v,t1_fqsksgg,1589631259.0,my mail man has a sister who knows someone from church who knows someone from italy who works at a backery who knows someone from the school where the teachers husband works at rockstar
FragReddit,fqr2yc2,t1_fqr2pe7,1589576607.0,Dann freut mich das für dich (:
FragReddit,fqr0xjl,t3_gk9q9q,1589575548.0,[Suchst du das hier?](http://puu.sh/FKTkp/9848858de7.jpg)
Kopiernudeln,fqqu6b6,t3_gkferc,1589572020.0,Dachte kurz das wäre /r/einfach_posten und war kurz verstört.
Kopiernudeln,fqmjbf2,t3_gjlxmx,1589478382.0,Am Titel hatte ich das Video vor den Augen xD Gute Arbeit
einfach_posten,fql8ztt,t1_fql23x6,1589450488.0,Deswegen das mit dem Desinfektionsmittel Ding.. Ich komme Trump schon noch auf die Spur..
ReadyOrNotGame,fqkn5c0,t1_fqk5x4i,1589431096.0, Remember when they said they were releasing the ron trailer in 2018.. keep your feet on the ground
SaintMotel,fqkll6o,t1_fqkebei,1589430043.0,Well.. The do everything now Video never really got published.. But a million views song? Wierd
SaintMotel,fqkbkzc,t3_gj7vpd,1589423937.0,Guess I'm donating some blood soon lol
SaintMotel,fqkbiqo,t3_gahyj9,1589423903.0,Why is a million views song Unlisted?
SaintMotel,fqkbenp,t3_gagvwy,1589423839.0,You do it well <3
just_post,fqi6d8z,t1_fqi2q9s,1589391102.0,:) thank you
just_post,fqhsv9c,t1_fqhp42n,1589383880.0,"This is going public probably next days
https://youtu.be/ourqEkUOTX0"
1917,fqhcglq,t3_gixq6w,1589373944.0," 

u/weareallpatriots"
cringe,fqdx0rd,t1_fqdkmir,1589298066.0,free health care works in the EU why the fuck does she have to bring Venezuela into this.
einfach_posten,fq8w7oq,t3_gh9cv8,1589177337.0,"Protipp: Licht in deinem Zimmer ausschalten. Licht im Flur einschalten. Fliege will zur Lichtquelle im Flur und fliegt raus.

Profit."
ReadyOrNotGame,fq1i67d,t3_ggjkul,1589045871.0,And so it begun.. Gameplay posts everywhere soon. May all the memes rest in piece.
ReadyOrNotGame,fq1hnsn,t3_ggifhc,1589045741.0,"I can finally share unlimited waiting in the ""Finding Match"" queue."
blender,fq009ze,t3_gg8hvb,1589026220.0,Whats the Music? :)
einfach_posten,fpvy0lq,t3_gfvp0j,1588953859.0,Shit happens. Wieder was gelernt. Sei froh das niemandem was passiert ist und du und deine Freundin heile seit.
ich_iel,fpuyzys,t3_gfni4s,1588928799.0,Falls das mal wirklich Wahrheit werden soll.. [Dann hier](https://www.change.org/p/spiegel-tv-redaktion-fortsetzung-der-penny-markt-auf-der-reeperbahn-dokumentation-von-spiegel-tv)
InternetIsBeautiful,fpuytn7,t1_fpunt2u,1588928606.0,Glad I could show you this page! :)
HowItWasFilmed,fpsvxci,t3_gfdi7x,1588880522.0,That's a cool rig! :D
ich_iel,fprhajk,t3_gf2omf,1588854115.0," Mmmoin🙋‍♂ ️ Leute😜 heute geht's ums SAUFEN🍻😅 aber nicht saufen🍺 wie ihr das kennt, sondern Beweisführung🔎 mittels Induktion😨 öhm, okay, der kam flach😂😂🔫 schreibt jetzt #SAUFZUG🍺🍺🍺 in die Kommentare, wenn ihr tägliche Suizidgedanken habt😌😅 

[...](https://www.reddit.com/r/Kopiernudeln/comments/bz3t42/ein_typisches_the_simple_club_video/)"
AskReddit,fpre1d5,t3_gf4wi2,1588851526.0,Math
PhotoshopRequest,fpr4sod,t1_fpr0xb3,1588842388.0,need your finished meme :)
budgies,fpr4qxl,t1_fppcomj,1588842336.0,How did you do it the first time then? Doesn't it hurt if it sits very tight?
einfach_posten,fpr4891,t1_fpr46fo,1588841797.0,Danke :)
instantkarma,fpr3xvx,t1_fpqzzjl,1588841503.0,"Actually I think they shout ""Let him go"" but at the end it sounds very ""Nazis out"" like.

Lasst ihn gehen

Nazis raus"
ofcoursethatsathing,fpr2ujh,t1_fpqdr32,1588840406.0,I remember a charity event where they played this game haha [https://youtu.be/5jed\_crs0Kk?t=16261](https://youtu.be/5jed_crs0Kk?t=16261)
einfach_posten,fpr1jx5,t3_gf1pj5,1588839122.0,"Habe gestern auch 6 Bewerbungen verschickt.. Bin auch sehr aufgeregt :D

Viel Glück in deiner Zukunft."
just_post,fpk7wgy,t3_gdpc6b,1588689702.0,[hope you like video edits aswell :)](https://www.youtube.com/watch?v=1xKArza892g)
ReadyOrNotGame,fpjg4c2,t3_gdttxg,1588667222.0,"[https://web.archive.org/web/20200503184053/https://twitter.com/_eezstreet_/status/1254056839702028295](https://web.archive.org/web/20200503184053/https://twitter.com/_eezstreet_/status/1254056839702028295)

2 days ago you could see his official Bio say ""Programmer@VOID INTERACTIVE on their newest FPS, Ready Or Not""


Eezstreet wrote a nice statement why he left the company. [Please check it out. ](https://twitter.com/_eezstreet_/status/1257794606680473600?s=19)

Wish you all the best /u/Eezstreet !"
1917,fpd6myx,t3_gcsfv3,1588520926.0,"Watched it the first time in Cinema (glad i did)

watched it probably 10 times at home haha"
FragReddit,fpc7dn7,t1_fpc1mso,1588490108.0,Dein Highlight ist niedlich :>
FragReddit,fp9mnm1,t3_gc58dg,1588429947.0,"Ein guter Freund hatte mal Herrn Steinmeier auf dem Klo getroffen xD
Wusste überhaupt nicht wie er reagieren sollte und wir witzelten darüber ob er ihm die Hand hätte geben sollen haha"
FragReddit,fp613ra,t1_fp60vaf,1588344067.0,Mein Beileid.
FragReddit,fp5vlq9,t1_fp5uwzb,1588340879.0,Wooow wie hat sich das angefühlt? Was hast du Gedacht?
FragReddit,fp5udbq,t1_fp5izdd,1588340111.0,Bestimmt ordentlich windig da oben :)
FragReddit,fp5ua48,t1_fp5lq56,1588340054.0,Gönnung
FragReddit,fp5u9w9,t1_fp5la8z,1588340050.0,Naaw :>
FragReddit,fp5u8o4,t1_fp5lk5l,1588340028.0,Wow! Wie lange hast du dafür trainiert?
FragReddit,fp5u49l,t1_fp5ofqn,1588339949.0,Oh wow! Lass mehr hören! :D
1917,fp1nsc9,t3_gadlr4,1588241952.0,I would like to know what other thoughts your grandfather has about the movie!
loadingicon,foyggrt,t1_foxvcto,1588172084.0,Thank You!
einfach_posten,foxsf9f,t3_ga64yw,1588154664.0,"Ich war überrascht was Liebe auslöst.

Was du für Menschen tust die du vor Wochen mit anderen Augen gesehen hast. 

Was auch immer Sie gerade macht, ich hoffe Sie ist Glücklich dabei."
loadingicon,foxoeno,t3_g9yna3,1588150609.0,Whats the second font?
FragReddit,foxn2xu,t3_ga3np3,1588149303.0,Ich habe eine aber habe mich nie so stark dafür interessiert.. Wenn du eine günstiger haben möchtest schick mir gerne eine PM.
instantkarma,foxmja6,t1_fowvjay,1588148778.0,Enjoy  /u/Cr0talus-atr0x  [https://gfycat.com/slushyfittinganole](https://gfycat.com/slushyfittinganole)
youtubehaiku,fov98x0,t3_g9ngdz,1588097477.0,"Wenn Kaddi auf English produzieren würde, wäre der Weltfrieden gesichert."
howtokeepanidiotbusy,fov4fwb,t1_foufef6,1588095217.0,Here you go satan [https://gfycat.com/scornfultiredballoonfish](https://gfycat.com/scornfultiredballoonfish)
MadeMeSmile,fov35e1,t1_fov2qgb,1588094618.0,You maybe should have posted him in r/aww with his backstory.
fuckepic,fov31zz,t1_foucz7w,1588094575.0,Bielefeld
MadeMeSmile,fov1qv6,t3_g9r3r9,1588093974.0,He is awesome!
AskReddit,fotrqw7,t1_fotrpzn,1588063778.0,And I wish you all the best.
AskReddit,fotph52,t1_fotijws,1588061495.0,"OwO

Wawuigi is a man onwy seen in miwwow images; wost in the haww of miwwows he is a wefwection of a wefwection. You stawt with mawio -- the whowesome aww itawian pwumbing supewman, you wefwect him to cweate luigi -- the same thing but swightwy wess. You invewt mawio to cweate wawio -- mawio tuwned septic and wibewtawian. Then you wefwect the invewsion in the wefwection: you cweated a being who can onwy exist in wefewence to othews. Wawuigi is the twue nowhewe man, without the othew chawactews he wefwects, invewts and pawodies he has no weason to exist. Wawuigi's identity onwy comes fwom what and who he isn't -- without a widew fwame of wefewence he is nothing. He is not his own man. In a wowwd whewe ouw identities awe shaped by ouw wawped wewationships to bwands, cewebwities and commewce we awe aww wawuigi."
madlads,fotpb4v,t1_fototwn,1588061326.0,Yes you can give me gold.
de,foto691,t1_fotn3c8,1588060210.0,Ich konnte mich Glücklich schätzen und vor 2\~ Jahren einen Skin verkaufen und damit einen großen Teil meines Führerschein bezahlen können.
de,fotmopj,t1_fotjpb2,1588058782.0,"Crazy das Valve im Endeffekt die Skins auch ""drucken"" könnte."
madlads,fotktyk,t1_fotiuau,1588057057.0,Wait can I do that?
einfach_posten,foqbmir,t3_g8zhri,1587989388.0,"Eltern haften für ihre Kinder? Haftpflichtversicherung Let's go? Geld wieder zurück?

Alles Gute und viel Glück morgen bei deiner Präsentation! (:"
FragReddit,foq40y8,t3_g8xvts,1587982202.0,Ignorieren wir den Fact das Vancouver Media Production mit Haus des Geldes nur noch Geld produziert fand ich die Staffel 4 echt sehr angenehm.. Bin interessiert wie so etwas und wann zu einem Ende kommt. Also falls noch nicht gesehen.. [Haus des Geldes](https://www.netflix.com/watch/80192098).
ich_iel,fopydjs,t1_fopy68w,1587976342.0,hab mich ein wenig erschrocken als ich meine nachrichten kiste geöffnet habe und eine wand aus E\`s gesehen habe. wnl (werde nicht lügen)
ich_iel,fopy2tn,t1_fops1au,1587976045.0, GIBBEEEEEEEEEEEEEEEEEEEEEE
PraiseTheCameraMan,fopxjab,t1_foomazc,1587975505.0,First time seeing my own sub in another comment <3
Showerthoughts,foo9uj9,t3_g8mgzc,1587935253.0,well.. the building you die?
TikTokCringe,fol327a,t3_g80n5b,1587853910.0,"Record everything

sad music

profit????"
einfach_posten,foj70s2,t1_foif6zs,1587810906.0,F5
1917,foio8e1,t3_g7nsmy,1587791874.0,The first time watching it in cinema >!and the girls shows him her baby.. I instantly remembered his milk..!< SUUCH A GOOD IDEA.. CANT GET OVER THIS AMAZING MOVIE
einfach_posten,fof9ul7,t3_g756k7,1587730647.0,"Mir gehts eigentlich nur darum.. Das mich das Wort anfängt zu triggern/nervt. Deshalb sage ich ""derzeitige Situation"" Angst machen tut mir das Wort eher weniger."
OkBrudiMongo,fof7ujb,t1_fof6m3u,1587728943.0,Ich wünsche dir auch alles Gute für die Zukunft. LG Rudolf
OkBrudiMongo,foevf9l,t3_g6y6lx,1587716129.0,/r/ichbin40undlustig
OkBrudiMongo,foevf0s,t1_foetown,1587716121.0,[Ist sie 40+ ?](https://www.reddit.com/r/ichbin40undlustig/)
einfach_posten,fnzmavj,t1_fnzlo0y,1587396773.0,Was für wenn.. Das ist professionell umgesetzt?!
einfach_posten,fnxojxw,t3_g4itf5,1587343011.0,Das hört sich toll an! Ich freue mich für dich! Beat Saber klingt nach Spaß!
1917,fnujbwl,t3_g3zqd2,1587263464.0,Yep.. Such a beautiful detail.. Can't stop thinking about this masterpiece.
SaintMotel,fnsoze5,t3_g3p4le,1587226022.0,"Wow this is really cool... I have soo many old vinyl but no player for them..

If I ever get my hands on a player I really want to get a Saint Motel Vinyl too"
de,fnrf7rs,t1_fnrer9a,1587187152.0,"Lel die Engländer  machen direkt eine Meisterschaft daraus. 


https://youtu.be/2ytN8vsT_TE"
einfach_posten,fnrf1tm,t3_g3dvog,1587187013.0,Daym.. Habe deinen Text vor 4 Stunden nicht gesehen.. Bin fast immer die halbe Nacht wach.. Schreib mir gerne mal auf Discord Sgitch#3218
PhotoshopRequest,fnr1qrn,t3_g3fr09,1587177212.0,"[Hope you Enjoy!](https://drive.google.com/open?id=1QkhXI46CD0ZTvQoeGRnXxBZlF-Q9UFdL)

&#x200B;

[^(tipjar)](http://tipjar.sgitch.de)"
blender,fnqwlts,t3_g33pqb,1587173820.0,Can you provide a screenshot in blender? that looks awesome dude!
blender,fnqwj25,t1_fnqrf23,1587173771.0,german do ßßßßßßßßßßßßßßßßß
CasualConversation,fnqvjgy,t3_g3bp0k,1587173161.0,"That was nice and relaxing! Thank you, [here is my entry](https://imgur.com/a/BaVkKWR)

Stay save everyone!"
photoshop,fnn22z9,t3_g2r0qp,1587082765.0,if you want to learn go to /r/photoshoprequest
einfach_posten,fnjzotx,t3_g26dkb,1587010913.0,Ich habe das Problem täglich pünktlich um 5 aufzuwachen um mich über Sodbrennen zu beschweren.. Ich bin froh meinen schlimmen Schlafrhythmus reparieren zu können. Sonst bin ich immer um 11 Uhr ins Bett und um 21 Uhr wieder aufgewacht.. Da konnte ich wenigstens durchschlafen.. Aber damn diese Sodbrennen nerven dann doch schon. Wünsche dir später wenn du einschlafen konntest einen ruhigen Durchschlaf :)
IndianJoker,fnh3xka,t1_fnf2j1n,1586954205.0,damn! i did the same yesterday!! such a good song hahaha
FragReddit,fnh34ht,t1_fnh07ew,1586953579.0,Na dann freie Fahrt
ich_iel,fngy8n9,t3_g1miap,1586949306.0,Wir haben Donald Becker das kann sowieso keiner toppen.
de,fngbarb,t1_fnga792,1586927128.0,[Auch wenn Knossi Türkisch singt?](https://youtu.be/74iWLrCyeCM?t=20)
de,fng8w63,t3_g1kwtq,1586925260.0,Schnell! Zur Abgewöhnung einfach 3 Stunden Streams Von Knossi schauen! Das wird wieder!
de,fned2fc,t3_g1a5x1,1586887193.0,"Vielleicht können dir ein paar Lehrkräfte was dazu sagen, /r/Lehrerzimmer"
Laesterschwestern,fndczmv,t3_g130ey,1586866818.0,Würde gerne mal ganz ohne Gründe Coldmirror im Podcast hören (:
de,fndcrkg,t1_fnd4ttl,1586866639.0,Ich bin froh solche seltsamen Menschen nicht zu kennen.. Halt mich mal auf dem Laufenden xD Bin gespannt ob du tatsächlich solche Menschen triffst.
einfach_posten,fncr4w5,t1_fncr0zi,1586844513.0,:D
de,fnco8w5,t3_g0zlds,1586842029.0,Mein Bruder war die letzte Woche in Freiburg und ist heute morgen auch wieder gekommen und hatte keine Probleme. (Wohnen auch in NRW)
gaming,fncmrnt,t3_g0zbwd,1586840825.0,Red Dead Redemption isn't available for PC sadly. Sorry can't help you.. I only have Red Dead Redemption 2 Keys.
de,fnclta1,t1_fnbagff,1586840074.0,Verständnisfrage: Durchziehen in Form von sich **nicht** von Covid impfen zulassen?
einfach_posten,fnbjqwt,t1_fnbip5s,1586816763.0,[Relevant](https://youtu.be/vVrjh-1CTtQ?t=2)
