Dogfree,fn5r19k,t1_fn1zg07,1586672981.0,Oh okay! Sorry was just a bit concerned
Dogfree,fn1yz83,t1_fn1c12u,1586573560.0,"I mean if they are just pulling apart your lips and just looking(no licking your teeth or putting their paws in your mouth), then I have no idea why you have downvotes and I am fine with that. But if they licking your teeth... well that's different."
cats,fmh8lvu,t1_fmgjl1w,1586070431.0,Was thinking the same thing
cats,fm8vk7f,t3_ftqy80,1585856830.0,I just verbally squealed at the sight of that blep because it was sooo cute!! She looks like an amazing cat
Dogfree,fm8uogb,t1_fm8umrw,1585856358.0,# WOW that was long #
Dogfree,fm8umrw,t1_fm8s1x6,1585856334.0,"And whenever we have a party most kids and adults **try** (our cats arn't *very social*, like most cats) stop and pet pur cat if there is one around at the start. Some of them either ignore the cat (and we are not offended) or just don't try because they know the cat probably won't allow them to. No, they don't bite or scratch so that they won't be petted, they just curve their spine down to the ground so that the hand just misses their fur and they are not petted this way. Our cats are also pretty chill around small children so if a baby like pets them the wrong way or grabs their fur their ears just turn backwards and the just lay/sit there until it's over. Usually the parent takes their child away by that time. But they never bit or scratched the baby, probably because they understood that *it's a baby* and the baby is not as experienced in petting cats or they just are chill with it."
Dogfree,fm8s1x6,t1_fm7n16z,1585854956.0,"We have 2 cats, and we never had a problem with people being alergic or disliking them. Plus whenever we have people over our cats just disappear while the guest are here. Sometimes they hang out at the start but still eventually go outside(they are both outdoor and inside cats) and do whatever they do outside. And why we never had a problem with people disliking them or not wanting them there: all of my mom or dad's friends either like cats or are neutral with them, and none of them have dogs. And most of the close friends(ones that often come over to our house and we go to theirs) have a babies and they know dogs are a bad idea if you have a child (ex. What if they have an allergy(the baby) or what if the dog bites?) so none of the have dogs. Other friends that don't have children don't have dogs either. Some of them considered getting a dog, but never did. And one of them, has both children and cats, so they are probably never getting a dog(too much work and also dog is dangerous). So that's a relief. 
Oh, and no, the ones with cats DO NOT bring their cat over to our house because they are polite (unlike some dog owners). I feel sorry for you that you and your husband had/have to go through this. The stupidity and nerve of your MIL."
Dogfree,fm8mjg1,t3_ft9ep2,1585852084.0,"I mean as a sadist and masochist I like to see humans in pain, but I just like my own *species* to be in pain (except some of them). But don't get me wrong, I am not a dog nutter, and I don't think that violence against animals not human is worse than violence against humans. Violence is violence. It's all the same. 
But when we think in reality, reality is that we are animals too, so It's just violence and none is worse than the other."
Dogfree,fly7d5m,t3_frt5xg,1585596895.0,"I agree!! And I saw a meme about how ""Oh ma gosh puppy breath smells *so* good I mean like **nothing** better than *puppy breath* like **puppy breath** is **AMAZING** like it's ***PUPPY BREATH!!!***"" Disgusting. I can't imagine how people like the smell of the breath of a smelly creature. Just
 *ugh*"
Rabbits,flwgd27,t3_frawxm,1585549705.0,"No one:
This rabbit: ***I am SPEED***"
cats,flt4dbw,t1_flt4cp0,1585458880.0,Also happy cake day
cats,flt4cp0,t1_flt2c9n,1585458865.0,Exactly like a tenager in cat form!
cats,flt1krm,t3_fqrk40,1585456544.0,"She looks like she's saying ""Hell yeah I turned one today bitch!!"""
aww,flrygf4,t3_fqmyor,1585430523.0,TBH I'm terrified whenever my cat goes under my blanket to snuggle with me. I'm scared that if I fall asleep for too long he will suffocate and die. 😅
aww,flrxrcj,t3_fqmp93,1585430103.0,God can't imagine how many flea bites she must've had after that... *shivers*
FiftyFifty,flhesmm,t3_fotn4z,1585161302.0,I clicked this because I wanted to see the buffalo wings. Looked at the picture and began saying 'YEEEESS-' and then I realized it's the man. 😂
aww,flfqbwh,t3_fogxvv,1585114045.0,I'm sorry that it didn't make me smile.
aww,fldo3le,t3_fo3uof,1585068389.0,Goddammit answer me!!! WHO SENT YOU!?!
Showerthoughts,fldm6ov,t1_fldm6as,1585067317.0,Nice
Showerthoughts,fldm6as,t1_fldm5xz,1585067310.0,Nice
Showerthoughts,fldm5xz,t1_flbzsss,1585067304.0,Nice
Showerthoughts,flbzsss,t1_flboib9,1585016456.0,Nice
Showerthoughts,flbnnl7,t3_fnrcuy,1585008479.0,"As a masochist, and just realizing this, I believe I now have a reason for why I treat people so badly."
Showerthoughts,flbn5m4,t3_fns9u0,1585008159.0,Read it as 'jizz'
Showerthoughts,flbm8r3,t3_fnlzpi,1585007589.0,Slanted gray
aww,flbesqv,t1_flaleg3,1585003154.0,"Yes, we don't, *we deserve an animal that's better than a dog*"
teenagers,fl54cvy,t3_fmh0g3,1584828207.0,"I agree on the rape part, despite being a girl myself, I think that it isn't fair or okay that boys that get raped by older woman isn't payed attention to or treated to as much as girls getting raped. Something needs to be done and this sexism just can't continue"
aww,fl262p9,t1_fl0pg8e,1584743756.0,Yeah me too especially since the dogs ass was so close to her...
aww,fl25n3u,t1_fl0vugg,1584743480.0,That's why I don't have a dog. I really ***really*** need personal space sometimes.
aww,fl25h2m,t1_fl0j2qg,1584743373.0,You're right *we deserve better*
aww,fl257wv,t1_fl0v99h,1584743210.0,What the fuck?! Why does this have so many downvotes? It's just a normal question!
aww,fl23s8c,t3_flx4w2,1584742290.0,Flexible cat
aww,fl23kb1,t3_flznbk,1584742146.0,I am fast. I am very fast
Dogfree,fkwphjw,t1_fkwiwc8,1584600406.0,"GET OUT. Let us live our lives. They actually SKIN chickens, and the chickens don't get the shit into their blood. That's why we still eat them. Yes we heard of service dogs. And service dogs are the only dogs that are *remotely* only *half* accepted here. Because they too, are still dogs. And there is also people who fake having service dogs just so that they can bring their stupid mutt into the store"
Dogfree,fkl3lwi,t1_fkjy8y3,1584297750.0,Huh. Interesting
Dogfree,fkjpvqq,t1_fkjogov,1584254446.0,Eww It must be horrible to have to see that everytime you see a dog. I feel bad for you. But the colors/shapes are kind of what I expected
cats,fkjnrmu,t1_fkjf3ms,1584252082.0,"The fuck why does this have downvotes? 1, this is a cat sub, 2, it is very true. Do people just deny the truth about dogs nowadays because ""dogs are angels sent from heaven""? Or are they afraid of the truth?"
Dogfree,fki0exj,t1_fki08yr,1584209393.0,Wait is that the right thing I'm talking about? Or do you have something different?
Dogfree,fki08yr,t1_fkhzz36,1584209301.0,"Or if you don't have that type of Synesthesia, what is the taste of animal smell? Feeling....?"
Dogfree,fkhzz36,t1_fkgv8hf,1584209156.0,(I'm sorry if this would offend you in any way but here is the question) What is the color of the smell of certain animal smells? Just curious.
aww,fkhy35t,t3_figxwx,1584208138.0,Ew
NoahGetTheBoat,fkgajsc,t1_fkg2b3d,1584154196.0,Username checks out?
NoahGetTheBoat,fk9y11j,t1_fk9k6xe,1583986459.0,"My sanity got worse because of this. You realize there are people who do NOT like dogs? Or is like this for you, ""Wait, some people don't like dogs?!? How?! They are such *perfect* creatures tho!!"""
Dogfree,fk9oo0k,t1_fk9nlxg,1583980225.0,"I would of loved to see that. Must of been hilarious, especially the part where the cat was more upset because he had to touch a dog."
Dogfree,fk9mrl6,t1_fk8d1ql,1583979119.0,Lol that made me laugh so hard!! 😂😂😂 Funny how dogs attack so many living things yet are utter cowards on the inside
Dogfree,fk9mddm,t1_fk7tnxb,1583978893.0,Or both biased and uneducated
NoahGetTheBoat,fk37bgl,t3_ffpw0r,1583820372.0,You don't need the boat.. he already flew away.  But TBH this is pretty funny
aww,fjzbtz3,t3_ffdz46,1583716056.0,"I love how when the driver is taking a picture the cheetah just looks at the camera and is like, ""Cool! I like selfies!"""
aww,fjzbius,t3_ffbua6,1583715849.0,"This actually pretty dangerous! If that woman was lifting weights and the dogs was circling around her, if she lost her balance and dropped the weights she could hurt herself, or even kill herself. She might even kill/hurt the dog l, but it would be the dogs fault so he kind of deserves it. 😞"
entitledparents,fjz8zu5,t3_fff44a,1583714145.0,*'Dead people getting beaten up by violent plants'* I died
rarepuppers,fjm9sbs,t3_fe1pd2,1583464968.0,That's a health hazard right there
cats,fjm9q86,t3_fe6f6x,1583464927.0,AWWWW!!
cats,fj5zugv,t3_fb9jy5,1583049905.0,*visible confucion*
cats,fj5zqgy,t3_fboibo,1583049758.0,"This is a CAT SUB! I understand that there  is a cat in the picture but stil, escpecialy since dogs are a cats second worst ememy, that dog does not belong here. Get it out"
aww,fj5z23v,t3_fbjwoj,1583048894.0,Comfirms my opinion that dogs are cowards. They're just staires over water with some holes in them. Get over it
Dogfree,fhu3y9v,t1_fhu2nih,1581881639.0,Amen!
aww,fhu3q9g,t1_fhseuoc,1581881516.0,Cat
aww,fhu3ne9,t3_f4ialz,1581881472.0,He vibin!
Dogfree,fhu1ggx,t3_f4tddy,1581880705.0,"Lets hope for the best. And if the best doesn't rurn out, lets just pray that some of us will still be left."
Dogfree,fho4dc1,t1_fhnchcf,1581741067.0,"The thing is, cats CAN tell when you want to be left alone or when you need some company. Like sometimes, I need to snuggle with someone, and I'm upset, my cat notices and comes up and rubs against me in a gentle manner. Or if I want to be left alone, my cat senses it(like how you would sense if your mom/dad/sister/brother/anyone was mad and you would leave them alone), and then goes off and leaves me by myself. I think dogs just don't have this feature. And this is the sole reason why cats are better. Cats are just more human-like and gentle."
aww,fho3a5u,t3_f3yfci,1581740059.0,No
ihatedogs,fgv5mlf,t3_f0m7gl,1581137835.0,"Please get out. Go away. This is the wrong sub. We hate you guys and your dogs. You have a sub reddit for you and others like yoy, so please go to it"
aww,fgm4kzd,t1_fgm403v,1580917879.0,r/usernanechecksout
cats,fgivlg8,t3_eyp6du,1580831863.0,That looks like it hurts... but then my cat bites me the same so I know it doesn't hurt that much
Eyebleach,fgior2x,t1_fghxde5,1580827426.0,Oh yeah. Then neigh-bor mind. (Atempted pun)
Eyebleach,fghuzjp,t3_eykklp,1580794655.0,Must be hell for the neighborhood
Eyebleach,fghu7im,t3_eyet1u,1580793999.0,That's.... not very wholesome.... that's creepy... and wrong
Eyebleach,fghu03l,t1_ffu8a00,1580793826.0,r/usernamechecksout
Dogfree,fghn0kh,t1_fghbbl0,1580788577.0,"Yes. He scissors are childsafe, yes? Then it's dog safe"
aww,fgevq2x,t3_ey0hkz,1580711832.0,"Wait, but did your wife like the pet?"
tippytaps,fgbv566,t3_ewehsr,1580666418.0,My heart just melted
tippytaps,fgbv2cq,t1_fg2l7u3,1580666391.0,I would too
NoahGetTheBoat,fgbs4wj,t1_fg8qw78,1580665651.0,Yeeaaeeeaaaahhh!!
NoahGetTheBoat,fg8ohk8,t1_fg8m29u,1580626620.0,Thankfully I am. The water's actaully quite nice. Wanna join me?
NoahGetTheBoat,fg8l8qu,t3_ex4tva,1580623098.0, ***tell me agian about the wiping***
NoahGetTheBoat,fg8kqep,t3_exi8gy,1580622607.0,For some reason I actaully like this. Help. Does this mean I downvote.....?
NoahGetTheBoat,ffhm9cu,t3_etn7fa,1579942029.0,Kinda cute tbh....
UsernameChecksOut,ffhl8o2,t3_etmfw5,1579940541.0,"Finally, random facts that I remembered come to use"
GetFreeKarmaAnyTime,ffffe7r,t1_ffffduz,1579882768.0,And this
GetFreeKarmaAnyTime,ffffduz,t1_ffe5al7,1579882762.0,Here you can upvote this
GetFreeKarmaAnyTime,ffe4ln4,t3_esp3px,1579836553.0,Make a bunch of comments on this post and then I will upvote then all
Zoomies,ffe3gbi,t3_et0rzw,1579835699.0,How does your house not get ruined after that
NoahGetTheBoat,ffbeh12,t3_esn7ev,1579761813.0,The question is... how did he/she get them out?
NoahGetTheBoat,ffbdjrp,t3_esmobl,1579760772.0,Username also checks our in original post
NoahGetTheBoat,ffaf2vb,t1_ff8a30i,1579734221.0,It's okay! I'm so sorry for your loss.
NoahGetTheBoat,ff88beu,t3_es6f2n,1579668913.0,"I have been suffering. My cat just came back hone after being gone the half the day, the other half he was barfing, and he isn't eating. I'm worried. And scared. I hope to god he isn't infected with something lethal"
Dogfree,ff809e5,t1_ff6sv40,1579662636.0,"""I was going to get a dog, **but I'd rather have a life.**"" This! It made me laugh so hard! By far the best of them"
Dogfree,ff7zweh,t3_ery2vf,1579662372.0,That is so mean and unfair! This also belongs on r/insaneparents
SuicideWatch,ff2ivqd,t3_eqw4e5,1579508117.0,"So that we wouldn't offend the person or other people around us. More if the people around us though. The person who they ""care"" about doesn't give a shot if they say they care. It's just some words. But if the people around them heard, people would get angry, and sad, and ashamed.. I have a friend who has deppression and wants to die.. we both know that we just say that we ""care"" so that it wouldn't get awkward. In reality, we both have bigger problems of our own that we need to solve.
(This is from my view of it, don't hate me)"
SuicideWatch,ff2ilu8,t3_er9x90,1579507756.0,"Bye... if you were able to read this
Please let us know if you survived....
Even if you didn't want to"
SuicideWatch,ff29v2c,t1_fefy4ae,1579498116.0,"Oh I'm so sorry for you! And I thought I was ""too young"". Wow... can't even imangine attempting suicide at 8.. I'm glad a have people who get it. 
Even if I don't know them"
SuicideWatch,feftquo,t3_eokkma,1579064931.0,**gives virtual hug** I hope it helps!
SuicideWatch,fefs8jw,t3_en3mit,1579063655.0,"Here is a virtual hug. It isn't much but I hope it helps. I also need hugs from time to time, and if you want some suggestions I would suggest stuffed animals. It is childish, but it help me. Just hugging them relieved stress. The bigger they are, the more you can hug, so I recomend the bigger plushes if affordable."
SuicideWatch,fefryn0,t3_egyeqz,1579063441.0,Yeah...yeah that does sounf fucking amazing only right now I should be lifting you up when I can't even lift myself. But I wish you luck. Hope you get better. And I mean it. A lot
Dogfree,fectgjz,t1_fecmzsn,1578983953.0,So people know that both tigers and dogs do this but they still think it is sensible to keep a dog as a pet? What is happening to our world. Glad their is this sub and still people who are sane enough to know that dogs are dangerous
GetFreeKarmaAnyTime,fdfvj8k,t3_el2t9p,1578371341.0,Here you go! ⬆
AnimalsBeingJerks,fdfrkcd,t1_fcyqhgv,1578368473.0,"""That's kinda wrong now I'm scared..."""
AskOuija,fcypa2o,t3_ejkslz,1578084330.0,M
AskOuija,fcyp6yu,t1_fcyo3sg,1578084282.0,S
AskOuija,fcyp5sh,t1_fcymw4f,1578084263.0,Goodbye
