subreddit,self ID,parent ID,time,text
freemasonry,fddu83f,t1_fddm6jg,1578324099.0,You think the only place for criticism of masons is r/conspiracy? Your lodge must be swell. To the couple of people who say this is the place. I'd like to direct you to this ostrich and the other commenter as well who both said we shouldn't criticize the brotherhood
freemasonry,fdd7b3g,t1_fdcymio,1578298003.0,"You are yet again conflating disagreement with downvotes. 

&#x200B;

Im fine with disagreement, go to some more debate/critique-friendly subs, they dont lack disagreement and they dont downvote just because they do disagree, thats not what its for and using it that way stiffles conversation, its even in the reddit rules that it isn't meant to be used to signal disagreement. It's because this way, ideas that aren't popular with the demographic they are presented to get sent away and shunned from and shunned from traffic by being downvoted as well as it makes unpopular comments among the demographic hard to even see as they lose priority and eventually get hidden. The rules around the use of the upvote/downvote buttons are meant to curtail the ""echo-chamber"" experience. They're especially relevant when you want to question majority (or even large minority) held beliefs to the demographic that holds them. 

&#x200B;

If i want to feel free to question the organization i'm a part of to try and make it better, other members of the organization shouldn't be weighing the attention brought to the topic based on whether or not they agree... 

&#x200B;

If someone wants to ignore this issue i can again point to events on the sub as well as the fact that this very post was reflexively plunged into the negative as soon as it was made for being criticism in and of itself until another brother and i pointed it out in another comment and reverse-psychology took effect and it flew back up again. 

&#x200B;

And for those saying people don't just reflexively downvote There's even another commenter (who's clearly one of these ""reflexive downvoters"") that has just commented as to why he thinks that needs to be practiced (pretty much because he thinks we should keep our dirty laundry out of the public domain just so we don't dissuade applicants -don't even get me started there).  

&#x200B;

Even if you go to the trash heap which is r/askreddit you'll find people using the site mechanics properly as they enforce this rule, same with other experience/debate friendly subs, as Masons we should surely hold ourselves to a higher degree than that. Im studying now and like i said this isn't the environment to discuss my qualms as its not receptive to productive conversation so i'm unlikely to respond to anything else in this thread unless its someone providing me another sub as per the request made with my post, i just had to respond to this as i find your argument is systematic of the problem.  

&#x200B;

Cheer's Brothers, Back to my studying now."
memorialuniversity,fdd66n4,t1_fdd1fvs,1578296537.0,Will it tell us for the afternoon then as well. as these exams are at 4:30 and 7 pm?
freemasonry,fdcs42i,t1_fdcrjf7,1578282722.0,Yes please. Im honestly too jaded to make a post here about anything too controversial. I think their insistance was misplaced or at least being made by a different populace to those shooting the convos in the foot. This sub more than most seems fickle and as if it misunderstands that the downvote button isn't for marking that you just disagree with a statement. I'll even help moderate if you want.
freemasonry,fdcq5h8,t1_fdcolrs,1578281253.0,See what im talking about. We need a sub orientated specifically for masonic debate to avoid the knee jerk reaction downvoting. Id have no problem debating with a female/clandestine mason to try and build gaps because were meant to be good people striving for truth.
freemasonry,fdcn8m6,t1_fdcn2lv,1578279115.0,ha
freemasonry,fdcn75k,t1_fdcn1ot,1578279087.0,"I don't personally. The problem is that it affects the conversation/traffic and creates negative echo-chambers, (thats just a problem with reddit mechanics)."
freemasonry,fdcmxbn,t1_fdcmaki,1578278891.0,"While i appreciate that and understand there are many here open to dialogue as we should be there are far too many who are not. The knee-jerk reflex to downvote anything critical of the brotherhood is very real. Simply look at the people who have resigned or criticized us for our stances on our membership rules, nepotism amongst lodges, or decrying brothers for spreading hate or politically divisive material on social media, they've all been downvoted to the point that no productive conversation ensues and the OP's are usually linched for thinking this was the place to ""preach"" on the brotherhood or for treating the subreddit like a lodge/masonic court."
videos,fdckzmr,t1_fdcfibc,1578277509.0,because i had to see it so you guys do too
iranian,fdbr9nu,t1_fdb9mgu,1578260712.0,"Why Macron? Will France be taking the lead with this army? If so, why? (genuinely curious here, im not used to having someone to talk to this stuff about). As for the Americans and NATO they also have an upcoming election where they are likely to flip blue again and begin some reparations and ensure some more securities, while it wont undo the damage i still think that needs to be taken into account. If it stays red however i agree NATO will lose all structure/power and slowly dissolve if not implode. Though those troops (that id also agree) would show up to try and keep the US in line, they would be forced to do it under the pretence of still being somewhat allied with the US and the US will almost definitely use this to try and instigate them also getting dragged into any conflict as America likes to implicate people when they get mud on their hands. Im just some geopolitik Nerd behind a keyboard in Canada though so im not going off anything more than the rest of ya."
iranian,fdb62pd,t1_fdb3so5,1578254219.0,"""allow"" them to stay. The thing im trying to imply is that America doesnt give a fuck and wont leave just because they've been asked. They'll stay and occupy the area through force if necessary, they don't give AF about war in the middle east. What they do care about is  being seen following orders of a foreign power that they've positioned themselves against (even if they're within their sovereign territory and jurisdiction). Dealing with the US like that is like trying to wash off tar."
videos,fdb1xty,t3_ekhrg9,1578252794.0,enjoy.
worldnews,fdau6nc,t1_fdat572,1578250214.0,"Psssst, theres lots of banks around the world who don't care and would love 80 million in short term capital. (iran even has their own banks). if you want to try and structure a couple dozen grand in money you want to withdraw in you're local western bank branch sure, but these rules hardly apply to that level of wealth."
iranian,fdai9km,t3_ekdzsm,1578246420.0,How does one expel American troops who do'nt want to leave?
todayilearned,fcyrmdj,t1_fcyfsml,1578085615.0,I see you've met my father
