subreddit,self ID,parent ID,time,text
gaming,ffbpzbl,t1_ffb9wki,1579777909.0,Hahahaha no. We're still in state of emergency. It's 1000$ fin if you're caught out and about. There's a 25 foot tall snowbank in my front yard. My cars roof was under a 6 foot snowdrift. We got a total of like 120cm in 2 days. 76 of that in one night. I also only have a shovel. My Uni Prof was also struck and killed as a pedestrian during it all. This has been a crazy couple weeks
worldnews,ffb1ncg,t1_ffb19gv,1579749551.0,"Well most places dont even pay for donations, you know, since they're ""donations"" from volunteers. It's not a buyback scheme. Not to mention the ethics of paying ""donors"" resulting in poor people siphoning themselves dry."
gaming,ffb0xz7,t1_ffax33s,1579749077.0, [https://montreal.ctvnews.ca/quebec-health-officials-monitoring-5-people-for-possible-cases-of-coronavirus-1.4779111](https://montreal.ctvnews.ca/quebec-health-officials-monitoring-5-people-for-possible-cases-of-coronavirus-1.4779111)
gaming,ffb0rfl,t1_ffar8x2,1579748953.0,As a Newfoundlander id like dibs on this honor
worldnews,ffb0g5z,t1_ffayfpx,1579748741.0,Can i get some sources so i can bring this info to someone?
pics,ffaztto,t1_ffazbsp,1579748322.0,"Its was a reference to how there's a pretty big problem in the country of people criticizing ""immigrants""... but not white ones for some reason."
pics,ffayeqa,t3_esgft7,1579747373.0,I bet for some unknowable reason you wont be criticized for being an immigrant.
StJohnsNL,ffakh5q,t3_esh481,1579737985.0,"Sheigh heights, Drew you a Piste map

 [https://imgur.com/gallery/ayoIajp](https://imgur.com/gallery/ayoIajp)"
Iamactuallyverybadass,ff9v21k,t1_fcoxih8,1579722089.0,"Even if the sentiment was nice. If hes making untrue statements and passing them off as fact under the guise of his ""nice sentiment"" they still should be addressed so you aren't spreading misinformation.

The guy equates the objective and evidence based pursuit of science with a belief in god. Though one can believe both are true only one is verifiable hence why religion takes ""a leap of faith"" which science does not.

He also falsely states that ""Meanwhile half of science, you’re just told not to question why it is"" which is massively false and intentionally misleading.

He also makes baseless claims such as "" Any loophole you find in religion, there’s double in science"".

The commenter is then being passive aggressive and dishonest by saying stuff like ""And that’s what you think. I don’t mind you thinking that, even though you’re wrong""... if you want to frame this as an issue of opinion the correct and non-demeaning wording would be; ""And that’s what you think. I don’t mind you thinking that, even though  I THINK you’re wrong.""

Also the person you are responding to was incited by the guy tacking on ''Prayers work, even if you think they don’t"" to the end of his ""nice sentiment"" which is a statement that's just blasting a personal opinion/belief as a fact again.

Regardless of what evidence you follow or what you have faith in, one needs to accept fallibility when commenting on subjective matters of opinion. Also to make badly informed and inaccurate statements and then to say them as if they were infallible is going to draw criticism, as it should.

I would however adjust the atheists response to be less insulting at times. To call god ""imaginary"" is unnecessary and usually done as a slight. be it Krishna, Thoth, Zoroaster or Yaweh, any god that someone believes in, only requires faith (without any need objective\* evidence). So its a given that its a leap of faith, so to then go through the extra step label it as imaginary is a bit pompous and redundant as well as meant to insult and incite in itself.

I'm a philosophical Buddhist/agnostic so i don't really have a horse in this race but the atheist is 99% right here and just calling out misinformation and preaching where it lies under the disguise of a ""nice sentiment"" ,even if he doesn't have a perfect approach.  One can believe prayers work, but there's no OBJECTIVE evidence of such so to state it as infallible is inciting and ignorant to those of other beliefs as well as to tack it on to a ""nice sentiment"" and say it's beyond reproach because of that is subversive.

u/OblongJohnSilver you're only catching hate because people aren't realizing this. You're right though and even though i don't think the guy was trying to be subversive, he was, and you are right to call it out as well as to call out the following misinformation. People who don't understand the need to address that clearly don't see the damage that misinformation, ignorance and subversion causes in our society.

u/Jhon615, genuinely thanks for all but the ending of your sentiment as that part was nice. If you believe in prayer great but dont push that on other people or you'll catch hate for preaching, even if it was unintentional.

It's like if i told people to do good even when no one is watching because Karma is real even if you dont believe in it.  Yeah its a nice statement, and one i believe in, and people should do good, even when no one is watching. but it lacks objectivity and evidence to attribute anything to ""Karma"", hence it conflates belief with objective fact so someone would still be right to call that out.

Sorry if this comes of as a lecture/ too much mediating, i'm a dad."
geology,ff94n45,t3_escepo,1579704737.0,I've also considered doing this to force myself to commit
videos,ff5tric,t3_erqxyn,1579609934.0,RIP guys
science,ff5sd7m,t3_ersrou,1579608414.0,At what point does a virus like this reach a runaway tipping point in a country as densely populated as china?
gifs,ff5rl0w,t3_ermpv6,1579607501.0,Lets put this skin on the boston dynamics robots know that they can move like proper people.
science,ff5r085,t1_ff5m45b,1579606793.0,A.K.A. Natural Selection
Adelaide,ff4vpka,t3_er5k1l,1579573578.0,Where they trying to get him out? Cant emus fuck a person up? Does he live on the grounds? Is this common?
todayilearned,ff2ygcw,t1_ff1yc19,1579528626.0,Me too. These things have unexpectedly fucked me up so many times.
MadeMeSmile,ff2yckh,t1_ff1nzbh,1579528533.0,My girlfriend had a language with her twin that they both used until junior high and she doesnt remember any of it. I would have loved to see/analyze some twinspeak
NatureIsFuckingLit,ff1q7ip,t1_fezkl0z,1579483750.0,Yeah. One of them became president.
coolguides,ff1o8l3,t1_fezs6eh,1579482504.0,No. They can not.
newfoundland,fez13rh,t3_eqwuwj,1579452926.0,"That lit up that hole fucking bay, holy shit. How many lumens would that take?"
pics,fez00m6,t1_feyznp3,1579452583.0,Did not say you did. Just defended the repost. Especially since 95% of those have like 3 upvotes.
pics,feyztqt,t1_feut2dv,1579452516.0,Have you been on one of the NL facebook groups hahaha
pics,feyzfpr,t1_fexpjc0,1579452390.0,"Didnt see any of them and I scrolled through pics before posting. If you do t like reposts you're on the wrong site. This is in my city of 300,000ish plenty of people have this photo, I just hadn't seen it on reddit yet."
worldnews,fev17d8,t1_fesfogs,1579391960.0,"Yes. Though technically it's a ""socialist republic *led* by the communist party"""
worldnews,fes6pkg,t1_fes53nk,1579361981.0,"But it failed its goal haha. The goal was to prevent north Vietnam from taking over south Vietnam and becoming communist. That's what happened and America left. They lost. I can almost guarantee you're American as well. Ever notice how you'll never find a non-American arguing it was a tie or anything other than the US got its ass kicked. Read some history that isnt from your government funded high school.

Edit:I saw ""wouldnt"" when he actually said would. My bad. Downvote away."
newfoundland,ferwzbn,t1_fervji9,1579359194.0,"Lol I have anxiety. It's not something someone needs to control you over. It's not like down syndrome,mild-sever autism or schizophrenia which are really the only mental disorders that requires anything akin to guardianship. People with anxiety are 100% capable of their own decision making. Even when coming off of SSRI's."
newfoundland,feprpl7,t3_eq8hbw,1579329010.0,I can get behind this Danny Stormborn prophecy
Emuwarflashbacks,fen8g5r,t3_eppav6,1579279253.0,That's an ostrich
BestBritanniaMemes,fegx5yk,t3_ep41ey,1579104520.0,"Although that's a ratio of about \~1:26. 

I think 26 people with spears and skin shields approaching from a ridge when you have fucking guns kind of evens the playing field. If i had a gun I'd honestly rather face the 26 spear throwers than another enemy who also had a gun."
EpsteinAndFriends,fe5wcnv,t1_fe37e27,1578876413.0,Your mother.
NoStupidQuestions,fe1lagw,t3_enlll5,1578827978.0,Sidefact: the reason pink was considered manly was because most military uniforms would be red but the old bad ass veterans would have faded pink from time showing their battle hardiness.
space,fe0hwme,t1_fe0h644,1578813694.0,If you do do not confirm so
Showerthoughts,fe0em5y,t1_fe0bs93,1578811980.0,So are you saying cheaters make better vs worse scientists?
nottheonion,fe0bjix,t1_fdyob1g,1578808774.0,Honestly if she had said the president sent her directly they probably would have thought it was at least believable enough not to challenge her.
Damnthatsinteresting,fe0bfmf,t1_fe0abox,1578808666.0,Gotta keep your princess somewhere!
nosurf,fe0b4d8,t3_enirch,1578808364.0,Comparing your own behind the scenes to other peoples highlight reels?
Showerthoughts,fe0ayvl,t1_fdzdmbv,1578808215.0,Hi I'm not very smart. Could you simply explain that first bit to me and how its related to the rest?
television,fe0ahe1,t1_fe09q8q,1578807756.0,"You need evidence to go the authorities, you dont to make a public joke that shines a light on the situation and raises awareness."
newfoundland,fe0ad2c,t1_fe08wel,1578807647.0,Thanks I'll check it out
worldnews,fe0abm1,t1_fe06myl,1578807609.0,Wouldn't they know the government is behind that though? What else do the populace think killed those friends/family members?
Damnthatsinteresting,fe07zd7,t3_engij7,1578805508.0,They're plastic guys
Damnthatsinteresting,fe07wbi,t3_enciec,1578805437.0,How is this image seen or is it artificial?
worldnews,fe06jax,t1_fe021km,1578804325.0,What killed 1500 people 2 months ago?
newfoundland,fe05uy3,t3_eniymj,1578803809.0,Fuck. ?*
iranian,fe04gxv,t1_fdny9a5,1578802840.0,u/zeronx25.  How you feeling now bro?
worldnews,fe040jj,t3_enbr7g,1578802526.0,"If these comments accurately reflect the social reaction, this will largely discourage shitty companies from bothering to ""do good""."
todayilearned,fe039u2,t1_fdx1kz4,1578801984.0,"1,875,000*

The Germans alone lost ~4.5 million men."
worldnews,fe026ge,t1_fdxl12c,1578801211.0,What's the difference?
worldnews,fdzxvk7,t1_fdvm2l8,1578798472.0,"You're gonna need a timer for that ""/s"""
television,fdzxcvp,t1_f7q9svp,1578798096.0,"Maybe when the show ends, the British fans will get impatient and kickstart the second season themselves."
television,fdzwx0f,t1_f7xw7gk,1578797777.0,You're literally responding to a video of him calling him out publicly
HistoryMemes,fdzwe8r,t3_enbi6w,1578797409.0,Someone want to dissect this frog for me
EpsteinAndFriends,fdztpzp,t3_enf00z,1578795571.0,"Theres 36 people tightly tacked into this photo and the two subjects aren't even the closest or even interacting. I think some of these posts are stretching it. Also Ghislaine and Epstein I'm pretty sure were just doing everything from photo-bombing to honeypotting celebs to force their implications as a future insurance plan. Some celebs that interacted with them are clearly more guilty then others. (E.g. bill Clinton, prince Andrew and trump all seem tooo involved). Theres even a book that's come out that was written by a member of the mossad who claims he was their handler at times as they were doing this for Israel or some shit. Now I dont think they needed to be Israeli spies to need to do this, I think it's just obvious if you're playing really dirty games in very powerful circles, itd make sense to implicate as many people as possible, regardless of actual association, in this manner.  I think we should think critically about these photos and only post photos of people they repeatedly interacted with. The Celerbrity world is very very small.

Disclaimer: yes I know this is just what a celebrity child fucker would want you to think, I still think its reasonable"
Birbs,fdzpu81,t1_fdy0chh,1578793059.0,Fuck that. Make us a feature length documentary including interview/backstory.
Whatcouldgowrong,fdzeg0j,t1_fdybtlw,1578789427.0,"No, no one listen to this idiot...This only works until you meet a guy with the same philosophy and one or both of you ends up dead or disabled despite neither actually wanting that escalation. This works with your average college student but just go to the hood if you want to see how that mindset works out when its common. Go try ""being scarier"" in an altercation there and see what happens. It's an especially prevalent way to think there but people who match this mindset really are everywhere. And trust me, you'd don't want PTSD either even if you ""win"". I cant hold my kid or partner anymore sometimes because of the tension that gets trapped in my body while thinking about past violence, you wont feel tough then. If someone is robbing you, shut up and let them have it so they fuck off. You might relish the oppurtunity to live out an action fantasy, but hes more desperate than you are, i dont care if you're built like a fridge, weapons make that shit irrelevant. Also this happened in Canada, If he fucked that guy up with the bong hed be liable despite ""defending the store"". Also addicts and criminals often have trauma and are just as liable to black out and fuck you up if they feel they are in a corner.

If i see an aggressive little raccoon in the wild, i know i can 100% kick it's ass and kill it due to it's size, I'm even pretty sure i could make it run away by just challenging/charging it if its being aggressive, due to my own size. But if it comes at me in a park im just gonna run away like a little girl because fighting the little shit is a zero sum game. When i was younger i would have just seen it as something to deal with and likely tried to subdue/kill it and though it might work, i then got to deal with that exertion as well as risk getting scratched, biten and infected with disease when the little shit turns out to have rabies and is being more brave/aggresive than it should be, why would i do that when i can just run/walk away (or give up in the case of a robbery)? 

Next time someone you think you can take gets aggressive with you, picture a rabid raccoon and ask yourself if you still want to throw down just so you can talk about that one time you beat up a raccoon (crack-head)."
HongKong,fdz6xa7,t1_fduvt3k,1578787254.0,All im getting is an info page and a phone number. Is their an email or are we meant to call the numbers - A very stoned British expat
EpsteinAndFriends,fdysx9q,t3_ena60f,1578783271.0,"""What do you mean you only have little *girls?""*"
EpsteinAndFriends,fdyssl4,t1_fdxqn1d,1578783225.0,"yeah i dont think it is.

Edit: I'm wrong,  downvote this"
freemasonry,fdthfj0,t1_fdt9t9s,1578716807.0,Do they have a subreddit?
freemasonry,fdthdvc,t1_fdsexxu,1578716788.0,Do they have a sub where I can ask them? lol
nottheonion,fdsb2fe,t1_fdqrfgj,1578698505.0,"Do you think the doctor has sex with the patient? That's not how ifv works Haha, trust me it's not appealing or pleasuring for either party and it's very clinical."
nottheonion,fdqqks3,t1_fdqohr1,1578672754.0,"if your a urologist or gyno that fucks up a procedure, Its not sexual just because it involves genitals, It would be malpractice as it's clinical. The only thing that would make it sexual was if the action was of sexual motivation which is near impossible to prove unless someone finds ""impregnation porn"" or something on his computer. I don't think there's a need for sexual motivation either, its about padding success rates and increasing reputation for effectiveness due to sperm storage issues. Super fucked up,still criminal and unethical but any decent lawyer would get them off any charges of a specifically sexual nature."
nottheonion,fdqmps4,t1_fdqkoif,1578670321.0,"mal practice for sure but i don think its sexual assault as there was no sexual act. ivf isnt sexual, it's clinical unfortunately.  If the woman wasnt aware of the swap then there needs to be further charges but i think that'd be a new crime wed have to (and should) outline and enforce, in the meantime they should just max out the charges on aggravated assault resulting in grave bodily harm (unconsented pregnancy)."
StJohnsNL,fdqjeg8,t3_emq9k5,1578668123.0,"This is looks like another ad for your crafts. Your last post was removed for being spam advertising, this isnt facebook (which you already stated you were blocked out of -presumably for also spamming groups with your crafts). Do you even realize how many people in NL knit? It's hardly in demand. Do you see other people advertising their crafts? No. Because this isn't the place for it. Read rule #4 and stop filling my feed with garbage that's irrelevant to the sub."
StonerThoughts,fdpgxwo,t3_eml4k2,1578628341.0,Because you're trying to be quiet and the weed got you paranoid?
StonerThoughts,fdpe3jo,t3_emkco5,1578626285.0,"Bullshit, im Buddhist. Ill be back to pick it up."
legaladvicecanada,fdpdx03,t1_fdouyes,1578626156.0,"Yeah i know he COULD sue without winning but thats still frivalous and a pain in the ass. My sister seems to think i should have called the cops after to report him for threatening to send his son/grandson after us and pushing into the vehicle but i didn't want to have to make a statement because im in the middle of writing a couple differed exams, now im kind of regretting that, Im stuck seeing the guy every day so i guess ill just see how tensions go... I really dont want to be friendly though as the guy seems like a legitimate hazard, im getting a fake camera to deter him. Is there anything i should do just in case he does come at me down the road? Also how do i see the self defense laws in my province? I feel like this is good to know for future reference. Or does that only apply to criminal law?"
legaladvicecanada,fdpd12m,t1_fdoree2,1578625539.0,"How the hell does my story indicate that? The guy threatened us and lashed out and without any consent or warning lunged into the passenger side of the vehicle that my girlfriend was literally using to stay away from him because she was afraid. I didnt know what he was doing and slammed the door shut to the vehicle that he was entering without consent. I  didnt even contact him, i closed the door. I get that hit him but thats tough titties, it was the force required to remove the threat. If you have to quickly enter property that isnt his, towards someone who is afraid, right after uttering threats and aggresing them, yeah, im confident from the criminal perspective that im in the clear. Also its not the same test because people often cant get charges pressed due to circumstances but can sue civilly under the same circumstances (break-ins come to mind)."
AskReddit,fdpbki9,t1_fdp4r69,1578624536.0,"You didnt provide any evidence and youre the ones making the claims and as the adage goes, ""claims made without evidence can be dismissed without evidence"". I cant point to two of your points though. 

As for taxes, he lowered them for the rich. 

And as for the wall haha, what wall? He renovated a prexisting stretch that the previous administration implemented (that's really small) and he made a  few prototype designs in the form of like three 15 foot wide panels (which can all be climbed or sawed through easily with reciprocating saws, this has been documented)."
news,fdpafqr,t1_fdo6pcj,1578623767.0,">Worked at a PetSmart,

>​

>They take the grooming department very seriously, 


https://www.ajc.com/news/national/dogs-died-after-petsmart-grooming-investigation-says/akBUXHwjdjB3E4OSoS8myM/

It's literally a joke amongst groomers how bad petsmart is... you've got to be kidding?"
news,fdp9jgb,t1_fdott5u,1578623167.0,"Wait, so what happened? They brushed her to death?
Sorry for your loss btw"
worldnews,fdotc9x,t1_fdo3gkc,1578612417.0,That list of canadians got deleted.
StJohnsNL,fdos9k6,t3_emhsbw,1578611743.0,This ain't facebook. Nice hats but it comes off as an add for your crafts.
newfoundland,fdofd43,t3_emcdki,1578604041.0,"""A man is no one"""
news,fdo9io9,t1_fdo0b8q,1578601222.0,"I initially upvoted you but this was too late for an abortion, fetucide is a crime still."
videos,fdo5n00,t1_fdm40df,1578599319.0,Why would you care about getting caught after the prank? How did you plan to know then?
iranian,fdny9a5,t1_fdl8ojv,1578595288.0,"Well he was 100% correct so you should pull your head out of your own ass and stop being such a dickhead. 

 [https://www.reddit.com/r/worldnews/comments/embvsd/pentagon\_officials\_and\_iraqi\_intelligence\_confirm/](https://www.reddit.com/r/worldnews/comments/embvsd/pentagon_officials_and_iraqi_intelligence_confirm/) 

Also, Iran is run horrendously and and is a terror sponsoring state... buuuuuut so is America, Just swap out womens rights issues, gay rights issues and slaughtering protesters for race issues, inequality and the for-profit mass incarceration. 

Both your countries are a threat to world peace. At least most American citizens ive met are very aware of how fucked their country is. Also how are you factoring his preferred sport into your critique of his opinion. The man isn't allowed to like football? Seriously?

You just started being insulting and patronizing to the guy for no reason after rifling through his profile like a creep. What a gem you must be.

Don't go on an open platform if you don't want an open conversation."
canada,fdnvv3d,t1_fdcbsz7,1578593894.0,If he was the owner he could sell them videoclips/story/photos
HistoryMemes,fdi6hto,t3_elj1n7,1578436594.0,"Plz modz, i worked on this for way too long. Emu war is history."
NoStupidQuestions,fdftgrl,t1_fdeqtth,1578369782.0,I have 5 sisters and was raised by a single mom. I never realized anyone actually lifts that seat ever. Step your aim up.
freemasonry,fddzn5a,t1_fddp8f1,1578327824.0,"I dont take them personally. Multiple people have implied this and it simply isnt true and I've said as much already. The problem is the way those mechanics measurably affect the amount and type of traffic a post will then receive. That's why theres subs dedicated to debate and people looking to seriously have those convos dint just post their qualms in any message board as picking an environment is also important for conducive conversation as well as polite conversation. I havent even stated my grievances in this thread and I've already been personally criticized and insulted many times in comments that gain more traction among my ""brothers"" then my own that are simply stating my position and reasoning for my approach once questioned. Sure I can try and shout into a storm but I'd rather an open area where conducive conversation and proper use of the reddit mechanics are better enforced."
freemasonry,fddz1zg,t1_fddwmus,1578327430.0,That's cool. You were the one who engaged in the first place (even though your input was just projecting ignorance and failing to grasp the original post). If you cant finish what you start it doesnt surprise me. Don't forget the earplugs on your way out or you'll get sand in your ears.
freemasonry,fddyis2,t1_fddwjba,1578327069.0,"Yeah sure. I can help take that on. It should be a place to talk about the merits of masonry and masons as a whole, good as well as bad with the main rules being those limiting personal attacks and enforcing that the upvote/downvote buttons are only used to signal relevance of the comment to the discussion as a whole and not ones personal level of agreement (as they're intended for site wide).

To start building traffic I'd start posting that sub link in relevant posts/comment chains."
freemasonry,fddwgks,t1_fdduhkz,1578325660.0,"You dont get to characterize criticism as ""crying"" and then complain because you were just called an ostrich for the implied willful ignorance. Also I literally havent stated my criticisms of masonry here, I asked for somewhere to do so and stated why didn't want to do it here in this subreddit specifically  but I did not state my criticisms of the fraternity (and your comments have exemplified why, thanks). Also if you want to say i dont have any balls go ahead (that reflects on you not me)  but I dont have the issues I see in masonry as a whole at my lodge specifically (mainly because we dont hide from criticism, were embracing light as we should) but I do see it when I travel and speak to other Masons and I do speak up when appropriate. You're mischaracterization is only eclipsed by your clear misunderstanding here of what exactly I'm trying to do as you seem to think my criticism of our masonic body is about upvote mechanics on reddit. I dont have time or interest to argue with every one of you who disagree with my mere seeking of a space to try and promote productive criticism and since you shy away from more descriptive language while using it yourselves I have no interest in dealing with that hypocrisy either. If you really dont understand my desire here then read one of the other comments where another brother shares it."
freemasonry,fddupc9,t1_fddopsw,1578324436.0,"""None of us are perfect"" + a big rip of weed."
