subreddit,self ID,parent ID,time,text
news,ffdvd0w,t1_ffdv6yh,1579829857.0,"China already does this. They partner with Western companies until they can completely replicate the industry, then bar it. It needs to be done. Economic trade should cease just because China doesn't play by the rules in that regard."
news,ffdv5jt,t1_ffdatt2,1579829711.0,Reddit got rid of their Canary warning a few years ago but that seemed to mostly apply to US government agencies asking them to comply with investigations on dangerous people.
news,ffduynv,t1_ffdug2s,1579829573.0,"I don't think the person is implying that we should not let Chinese people out, but more that their government and economy should be essentially cut off."
cars,ffb962p,t1_ff96t9m,1579755754.0,"Seriously, that back-end looks very soccer-mom cross-over. The front end isn't much better.

I fell in love with the Mk5 GTI, the Mk6 looked great, and the Mk7 improved upon the Mk6. This just looks like a step backwards. The GTI was already a very under-stated hot-hatch having a very mature design with subtle hints that it was a fun car. This Mk8 design just makes it blend in with the boring econo-cars.

This is not the GTI design I fell in love with... At least the TCR looks kinda interesting although the Lambo-style front does not fit too well in my opinion. We had better get the TCR in the US..."
pcgaming,ffakvkq,t1_ff9vf0p,1579738292.0,"No, I'm fairly sure the person claiming optimization has no bearing on performance is the person who has no clue what they are talking about.

ARMA is terribly optimized and yet I can still play ARMA 3 easily on my PC. What does that tell you about the new call of duty?  The new call of duty is far beyond unoptimized. It's literally a dumpster fire in that regard. There's no fancy physics or simulation being done. The bullets aren't doing any crazy calculations. There's no AI. You can turn off all the CPU heavy graphical settings making it look like Modern Warfare 3. And it still chews through a 4Ghz quad core like nothing. 

It's widely regarded that it's poorly optimized. It ran fine during the beta and early release, then they put in a patch and everyone reported how badly it started performing on PC. I'm not sure why you would even challenge that notion. 

Also, for the second half of your comment, you literally seem to be agreeing with me. Not sure if that's like a language gap or something but you're definitely using the wrong words if you're trying to argue against my point. But regardless, Overwatch has more going on at any given point than Call of Duty in regards to CPU oriented tasks."
memes,ff9rvcq,t1_ff9o74s,1579719809.0,"The thing with emojis is often times they are used in an /r/comedyhomicide manner where they add absolutely nothing to the post and end up just being annoying. ðŸ˜‚ðŸ˜‚ðŸ˜‚ðŸ˜‚ Is just annoying.

Other than that when they are used in arguments like the awful ðŸ‘emoji. They really just come off as either naiive or obnoxious.

And finally, they are like swear words. You can use them to enhance a sentiment, but using them often just makes it seem like you're using them as a crutch instead of actually having something decent to say."
memes,ff9rc3c,t1_ff9hesr,1579719394.0,And intelligence is negatively correlated with frequency of sex. So?
pcgaming,ff9mxqg,t1_ff95w3l,1579716360.0,"Hyperthreading is fine because it tricks the software into thinking it has more cores available. The problem isn't the core availability, it's how they allocate the resources. An i7-4770k is more powerful than the current gen PS4/XBox One CPUs."
pcgaming,ff9mt4u,t1_ff98uql,1579716283.0,"There's no problems with 4-cores, it's all how they optimize the game. 4 cores at 4GHz each has more processing power than 6-cores at 1.7Ghz each (which is what the consoles are clocked at). The problem is that the 4-cores aren't being utilized properly. Game makers are optimizing heavily to utilize the poor single-core performance of the new consoles but they aren't putting that same level of rigor in changing that mentality for the most common Gaming PC CPUs."
pcgaming,ff9ml6o,t1_ff9dbg0,1579716153.0,"It has everything to do with optimization. I'm not sure how you can even make that claim when there are games with far more physics from 10 years ago that run fine on even a 2-core processor. Optimization means everything. 

Look at ARMA 3 for example. The amount of physics calculations in that game makes Battlefield 5 look like a joke. Every single bullet fired does trajectory shaping, impact analysis, ricochet calculations, penetration calculations (every caliber of bullet has different penetration levels into different materials), wind calculations, and constant force calculation updates. And that's just the bullets! ARMA 3 released almost a decade ago and runs fine on an i5.

Overwatch actually has a ton of physics calculations going on all the time. Every single soft-body is actually undergoing constant physics calculations. If you shoot a flag, watch as it interacts with your shot. You get knocked around, watch as parts of your model interact with the force being exerted. A lot of the newer games downplay these small interactions in favor of more obvious physics calculations. 

Overwatch has far more going on with physics than the new Call of Duty, not to mention all of the other interactions involved with various different projectiles and abilities.. You honestly have no clue what you're talking about."
pcgaming,ff9ljf4,t1_ff9e4di,1579715533.0,"You don't understand what simple graphics are. Overwatch has a cartoony art style, but from a graphical rigor point of view, it's far above anything in the new Call of Duty. If you look closely at models, physics, interactions, etc, Overwatch is actually very complex. Blizzard is King at optimization and they always have been. Diablo 3 still holds up to this day and runs very smoothly even while you kill hundreds of enemies in a second with every single body on screen calculating physics."
pcgaming,ff99nbl,t1_ff94q9m,1579708018.0,It's terrible optimization. I can run games with far better graphics and many more complex processing interactions when they are optimized properly. For example  overwatch at 2k/144hz.
pcgaming,ff999n6,t1_ff94c39,1579707781.0,"It's not outdated though. I can play numerous games with far more intense physics and graphics that are optimized properly without ever hitting over 70% CPU usage.Certain console developers just don't even put an effort into their PC ports.

A 3 year old, top of the line i5 is not outdated."
pcgaming,ff94aqa,t1_ff92uj3,1579704504.0,Might be a post Spectre patch i5 thing. Mine was before Spectre.
pcgaming,ff91usq,t1_ff90ltd,1579702760.0,"I had to drop the FPS to 60 just to get Modern Warfare to run on my 6600k, a fairly recent and good i5. It's still sitting around 90% CPU usage with everything on lowest. I need that extra 10% of the CPU just as a buffer so I can talk with my friends on voice chat. My GPU sits at like 40 usage...

It sucks because my PC still performs great in every other situation but now I may need to build a brand new one with a Ryzen 3700 just because console developers don't give a shit about their PC ports."
pcgaming,ff8zmlo,t1_ff8seak,1579701032.0,I'm terrified. Console developers have already optimized games for the 8 core low GHz spectrum. You can't even play the new call of duty on an i5 anymore because of how badly it's optimized for single core performance. I don't want them to have a better cpu to ruin PC optimization even further.
news,ff647pp,t1_ff63aer,1579618715.0,Gun buybacks are pointless anyways. The kind of people willing to sell guns are either going to be people getting rid of their crappy ones or the people you wouldn't mind having a gun.
headphones,ff58jfo,t1_ff3l75l,1579583413.0,"I have an HD6XX, a Fostex TH-X00, and the DT1990s. I hear the treble but honestly it makes it a very enjoyable listening experience for me. Music was literally getting boring for me with my HD6XX. The DT1990 allowed me to fall in love with it again."
pathofexile,ff577gn,t1_ff44d7z,1579582225.0,"Dear lord yes. That's been my major gripe with the game for so many leagues. I want to play an awesome spell-caster build and instead my choices are essentially Ice Nova for the 10th time, Totems/Traps, or things like Necromancer/Zombies.

I miss things like Rolling Flames Fireball, Crit Ignite Flameblast, Storm Call, Ice Spear Chain, and especially Self-Cast Burning Discharge (even more awesome when Juggernaut got that full-endurance ascendancy combined with Realm-Ender). Heck I definitely miss the CoC Discharge Fake-ner builds too!"
OutOfTheLoop,ff4sv9u,t1_ff44kgt,1579571637.0,"Well the idea is not to take over the world. It's to control social media and utilize it to control what people see. You'd be surprised just how much of your opinions are formed by what you see on the front page of Reddit for example, which is typically controlled by a few people with an agenda to push.

 There have been numerous power mod scandals over the years but not much is done about it. Gallowboob for example has blatantly admitted to censoring content he disagrees with while allowing posts he agrees with to stay up even while breaking rules. One guy is directly affecting the kind of opinions you see on a daily basis. And yet you probably were never aware that it was a problem!

Now imagine if the entirety of Reddit was controlled by one guy with the same agenda? That's the problem"
technology,ff351es,t1_ff32ag7,1579533844.0,Oh it's definitely stereotyping. It's just a stereotype that has some basis in reason rather than just random prejudice.
technology,ff31n0c,t1_ff31eo6,1579531299.0,It is a common trait in old people particularly because not everyone keeps up with the times. When you are younger you don't have to keep in touch with the times because you are already in them. You have to work to keep in touch the older you get.
news,ff2yvpt,t1_ff2aom1,1579529010.0,"Got it, so when you make irrational claims, it's fine, but if anyone else uses your same logic against you, they're illogical and wrong.

You also assume I'm a conservative, which I'm not. I'm solidly liberal, but I'm also not going to defend bad logic. For me, that's the biggest issue in the US. People defending shitty mentalities and behaviors because of their political tribalism. The only thing it results in is a country divided and no progress made because everyone is trying to poke each other's eyes out.

So please, just think before you make such ridiculous comments."
news,ff2028i,t1_ff1zw7z,1579490227.0,So you agree that your comment is equally absurd.
news,ff1zoy1,t1_ff1zm4k,1579489959.0,"Okay, then explain why you aren't on the side of the federal government in this case since you're a statist?

The problem with using shitty logic is that you invite people to use your own fallacious logic against you."
news,ff1zdzn,t1_ff1p66l,1579489738.0,"It's almost like you can support the ability of a state to enforce their own laws but also think a state should follow a federal law because you agree with the federal law. Interesting how that works right?

What you said would also be able to be flipped on a different end. ""The irony that this is a federal law vs state law issue and the Democrats are on the side of the state law is not lost upon this American.""

If people weren't always trying to play this ""gotcha"" political bullshit game, imagine the actual discussion that could be had."
JusticeServed,ff1yhr5,t1_ff1oile,1579489101.0,No one wants to do that either. The person who did is a troll and spams all kinds of shit to get people pissed off.
todayilearned,ff1nsu1,t1_ff1jiki,1579482262.0,But then why wouldn't you just use the new domain @outlook.com which will inevitably have more names available and won't send people into an early 2000s shock ;)
todayilearned,ff1bbde,t1_fezmsw1,1579477094.0,"To this day I'm still extremely confused when I see anyone under the age of 30 with a Yahoo/AOL/Hotmail email. Like, how much of your email is just spam at this point?"
WhitePeopleTwitter,ff1aa83,t1_ff147re,1579476807.0,"Got it, so the act of being a shitty person magically deters psychopaths. Is that the point you're trying to make?"
cars,ff169d6,t1_ff0astu,1579475600.0,"Because Porsche is a legend and the GT3 RS is probably the best driver oriented sports car that isn't over a million dollars. They raced them on a track where the Mustang's ridiculous power would have an edge with a lot of straight-ways and a lot of people here are acting like the it's just flat out ""same performance for half the price."" It's not, and driving them both would make that easily apparent, if not just because the GT3 RS is 1200 lbs less."
WhitePeopleTwitter,fezx6zn,t1_fezc5bp,1579462845.0,"It's just socializing. It happens a lot at things like Cafes. It's part of the reason people go to them. If it's not your thing, tell the person, don't attack a person for doing nothing wrong. 

Heck, some of the best conversations I've ever had were when I was in college chatting it up with friends about politics or a news story in a public, and having random people join in."
WhitePeopleTwitter,feyn31h,t1_fey36ie,1579447808.0,"Or how about people act like decent human beings and politely tell the person, ""no thanks""? They even went a step further and exposed their racist/sexist/agist views...

When did it become acceptable to act like a total shit-stain at some random person asking to join in on your conversation."
summonerswar,fes012o,t1_fer1zde,1579360083.0,It's the same in the base arena. Challenger is way above what it was obviously intended to be. The jump from F3 to C1 is like a year or more worth of runes and monsters.
interestingasfuck,fersh4c,t1_feprm5w,1579357860.0,"Get the cheapest ones because you'll be upset when it breaks in two years, but less upset if you didn't spend $500"
interestingasfuck,fers3vp,t1_fepv3ay,1579357737.0,"I wouldn't recommend them. Their customer service is terrible and they have a pretty high chance of breaking within the first year of use. When you spend $300+ on one of these, that's an important factor."
interestingasfuck,ferqor9,t1_fere3g7,1579357241.0,"I've replaced the brushes and filters at the suggested intervals and even had to replace the battery at the 1.5 year mark. Didn't seem to matter. 

The problem I had was the robot would start, then two seconds later, stop. It would repeat this two times, then tell me to reboot it. Which did nothing. Neato CS talked me through a bunch of resets and troubleshooting, which also did nothing. I then sent it in three times for that issue (they kept returning it without fixing the problem) and eventually it was fixed. After a year, it had the same problem again and now out of warranty. 

Something I did see recently is a poll on Reddit found that ~40% of Neato owners have their robot fail within 1 year. So I guess it all comes down to chance. Except most people are likely able to get their robot properly repaired. I spent more time dealing with mine than the time it would have taken me to just vacuum my floors myself.

So now I own a Roomba 960 and paid $60 for a 5 year warranty on it where the store will replace the robot instead of sending it out for repair."
interestingasfuck,fepo7g7,t1_fepb8cd,1579325859.0,"How long have you had them vs. how many problems have you had with them?

I bought a D5 2 years back. It's broken 3 times and was only used maybe once every 2 weeks. A very simple and small house too with 80% hard floors. Words can not describe the spite I hold for Neato. Especially because I sent it back for the same problem 3 times before it got fixed, and then it recently had the exact same fucking problem."
interestingasfuck,fepo1ed,t1_fep2fpu,1579325711.0,Neatos also have the nice feature of breaking every 3-6 months... Still extremely angry at my $400 paper-weight.
cars,fen4ni9,t1_feltygw,1579276878.0,But that just confirms what I've said. Pound-for-pound the Porsche has a lower HP/Weight ratio and still wins on the track.
cars,felrt66,t1_felmwfw,1579229361.0,The Mustang has about 230 more horsepower behind it. It's a muscle car that still handles well. The Porsche is a lightweight sports car that handles incredibly. The Mustang is definitely impressive but I think this actually speaks volumes about how well designed the 911 GT3 RS is.
WhitePeopleTwitter,felf3nl,t1_feko9s2,1579220685.0,"First off, you've only decided on minimum wage as your target. The original post is referencing much more than a small and gradual cost of living adjustment to the minimum wage which is what the economists you point at are in support of. It's talking about raising the minimum wage beyond the intent of it, being the ability to support a single person. 

The original post also mentioned things like universal healthcare without addressing the cost of care problem in the US as well as ""free college.""

You haven't backed your statement with facts you have moved the goal posts. We were addressing the whole package in this tweet and instead you point at be a handful of economists who are in support of a gradual adjustment of the minimum wage over 5+ years in regards to the changes in cost of living. You're failing to address everything else in the package.

Also, pointing ""experts"" opinion without arguing a point is known as an appeal to authority fallacy.


-----------

Second, small apartments in most of Seattle showcase incredible rent costs. Yes I am referring to roommates here. The difference in Seattle is that even the relatively wealthy need to have roommates to afford to live there and good luck ever affording a house. Last time I was up there it was over $2 million dollars for a house smaller than the one I'm currently living in which I bought for less than $200k.

The changes in Seattle are in response to the insane levels of the cost of living. And yes, you are correct, you see the same thing in SanFran and NYC.

Even if you ""have friends who live in rural towns"" (and geez, doesn't that sound like a hilarious statement) you obviously underestimate how much a cost of living difference there is. For most places, they would need to make double to triple what they do currently in order to have an equivalent life in Seattle. That is a huge factor when discussing economic policy and the effects of it on people. That's why you're ignorant of anywhere outside Seattle. You see stuff like that as trivial.

-----

And I'm a computer scientist with a minor in economics and a minor in philosophy. So what?

Also, you can call bullshit all day. But yet again, you have made a critical logical error. I've not argued against any of these points. I've mearly offered a point that these policies do in fact come with downsides for many people (especially the middle class), something that should never be ignored. I'm personally I'm favor of universal healthcare and a minimum wage hike. 

But I'm also a realist. I understand that if we were to implement things like a universal healthcare plan that we'd need to address the extraordinary cost of care in the US, otherwise we're still going to have a terrible system. I also understand that making too large and sudden of a change to the minimum wage has adverse effects on people who have worked hard to obtain a skilled labor position. I'm not saying we shouldn't increase the minimum wage, but that there should also be a plan in place for how to ensure that people who invested in themselves do not lose that investment.

My concern is people rallying behind these causes without concern for the problems. Also people who lie about that issues promising ""free everything."" Everything has a cost and it's up to us to determine if it's worth it. Spreading misinformation is not doing anyone favors."
WhitePeopleTwitter,fekiusw,t1_fekdhsu,1579200960.0,"Yet again, like everyone, you misrepresent this post. This person is discussing much more than the minimum wage increase and yet that's the only part you talk about.

You keep changing the rules and moving the goal posts. Figure out what your argument is before you present it.

Also, living anywhere near Seattle requires a large amount of money. People are already having to bunk with several others to just afford an apartment. What I'm referring to already happened in Seattle before the minimum wage hike. And the minimum wage hike there is in response to the issue. But you like many other people from that area fail to grasp how much different life is outside a major expensive costal City.

PS, I have a minor in economics and am leftist in practically everything economic related, support minimum wage hike and universal healthcare. You have no clue what you're talking about. I just like to present people with realistic downsides rather than lie to their face"
WhitePeopleTwitter,fekikwz,t1_fekb8hn,1579200794.0,The problem is you're confusing one issue with the whole package. Healthcare is one small part of what the post was referencing.
WhitePeopleTwitter,fejovkq,t1_fej3ukz,1579181977.0,"Aiming for something like that just means the people who have the money already it's leave. The problem with our economy currently is there is a class of people with ridiculous amounts of wealth who for some reason are still obsessed with making more as fast as they can at the cost of the well being of others. They make a lot of money by investing in companies and the champion measures to increase their investment which usually means employees take the hit so that the company stock can give these people a return on their investment.

If both lower and middle class were able to see a jump, then we'd be great. But even then, we have the problem of companies just adjusting prices to the new levels. But there always has to be an incentive for people to gun for better jobs. 

The problem is that people with vast wealth are capable of going anywhere they please. So any system that drastically harms them will just make them leave with all their resources."
WhitePeopleTwitter,fejn8d4,t1_fej2ui8,1579180551.0,"That's an amazing argument! You're wrong because I say you're wrong and then s spontaneous claim without evidence. Some economists disagree, some agree with what I'm saying. The problem is taking one economist at face value and ignoring others. But I can tell you that everything in my comment is based on principles of economics.

Yes, the minimum wage needs to be raised, but that isn't the only thing being brought up here. And just because the minimum wage needs to be raised doesn't mean it won't hurt people already making a little more than the proposed new minimum wage."
WhitePeopleTwitter,fejn3pr,t1_feizov8,1579180435.0,"Like small countries with populations less than a single US City with easily managed and efficient governments who also have wealth accumulated either from oil or investment into industries that are booming right now?

To say that something works in another country therefore it will work here is dangerous because it ignores pretty much all of the variables and foregoes research in place of a generalization."
WhitePeopleTwitter,fejmxpr,t1_fej4crx,1579180284.0,"First off, there are definitely people who think it's free and who perpetuate that idea, you see it all the time on Reddit.

 Second, just because you don't pay the hospital doesn't make it free. If you pay your insurance company enough money to not have a deductible, you don't have free healthcare either.

Using ""free healthcare"" is an attempt to mislead people and it's wrong."
WhitePeopleTwitter,fejms40,t1_fej6ykb,1579180141.0,The people hurt the most aren't the rich.
WhitePeopleTwitter,feizoiq,t1_feitisc,1579151815.0,"This has been my pet peeve with government sponsored healthcare, college, etc. Everyone keeps crying ""free"" like some sort of cheap used-car salesmen trying to convince a customer to buy a car that has been in 3 major accidents.

Is it possible that government sponsored things can be a better system? Absolutely! Are they free? Fuck no. If you are unable to honestly explain the cost-vs-benefit of a system, then why should I believe anything you say. Claiming it's free just tells me that you have not actually researched the system you're trying to push."
WhitePeopleTwitter,feiz8ou,t1_feio3ka,1579151427.0,">These policies are actually good for all of us. Raising everyone's standard of living means a more educated society with more money to spend. We all benefit from this.

Raising the floor just means you have a new floor, and the economy adjusts based on what people are willing to pay, which is now more than before. Either that, or the people who worked to get better paying positions now see their efforts diminished as they will likely not receive a similar bump in pay, which actually decreases their purchasing power because of the ""new floor"" (aka inflation), not to mention they also see their taxes increase to pay for all of it. A society with an influx of skilled labor also makes skilled labor worthless.

I'm sorry to say that actually, the policies aren't great for everyone."
worldnews,fei9o7u,t1_fehsz8z,1579133404.0,People called me crazy when I said my 2.0A power adapter wouldn't charge my switch... It sat plugged in for 2 hours and wouldn't wake from a cold boot. It took me forever to find info on why that was the case to prove my sanity.
