subreddit,self ID,parent ID,time,text
news,fefe7n2,t1_fef6y1j,1579054429.0,"Sorta, but that's just going to be human nature. We value safety above all things. Turns out, need for military superiority is a great motivator. It's hard to spontaneously create inventions to solve problems that you aren't aware of. Military necessity gives us problems to solve and these problems are tackled by a group with the resources to make even the most ridiculous idea possible.

I mean, yet again, think about our solution to GPS. Launch tons of satellites into the air, all of them broadcasting to everyone who can pick them up. Then using the relative information of those satellites to triangulate your position automatically, and using that to guide you to your destination. That idea is ridiculous, it wouldn't even really cross the minds of people because of how much manpower is needed just to accomplish it. And if we had a huge government scientific advancement agency, it's unlikely they would ever see this problem as worthy of solving because it didn't seem that bad back to just use a map!"
news,fef5xsd,t1_fef1t8i,1579048953.0,It is going into other things. These kinds of inventions eventually cause improvements in civilian technology. Think about just how incredible GPS technology is and how it has effected our world. An entirely military technology that eventually revolutionized the world.
battlestations,fedjnxr,t1_fedi0jp,1579013214.0,"All white industrial styled room with bright lights shining in a cold color scheme. It gives off an eerie feel. Colors and light scheme have a significant effect on mood. 

It looks great though!"
AskReddit,fecp4wi,t1_feb3go9,1578979678.0,"We were heavily forced to shave in high school. Like we'd have the VP walk around and inspecting people's face/necks. Ever since I've graduated, I've had a beard. Honestly, I look much more professional and clean with one."
battlestations,fecnujz,t3_eoboxk,1578978623.0,It looks nice but I can't help but feel that it would be offputting to spend so much time in the room.
pcmasterrace,fe81329,t1_fe6bqlz,1578921194.0,"I was just talking about this the other day. Bitcoin mining raised prices, people still bought the gpus. Now nVidia knows people will pay those prices. The X70 series used to be ~$300!"
pcmasterrace,fe80sfq,t1_fe6970h,1578921084.0,Same thing with phones. People kept paying the price and now we're over $1000 for flagships ...
pcgaming,fe6j3hd,t1_fe4yve7,1578892525.0,"I have Gigabit for $100. Many people have Gigabit for $60. This is more common in bigger cities. It's just not typically a thing in more rural/small-town areas.

But totally agree, most of our ISPs are garbage."
dataisbeautiful,fe6ig83,t1_fe5yok6,1578891916.0,"I loved to see the jump from ""very good"" to ""awesome."" And it's true. When something is very good, you say ""that is very good."" But ""awesome""? You exclaim ""awesome"", you speak ""very good."""
dataisbeautiful,fe6i938,t1_fe5w9a1,1578891734.0,"""Absolutely perfect."" Really does sound like Amazon/Google reviews though, ""Product was perfect"" 4/5.

Although to be fair. It's acceptable to say ""perfect"" when something is exactly what you wanted it to be. But you can say something like ""excellent"" when it exceeds what you expected. It's really just the context."
news,fe6hzoc,t1_fe4z0pu,1578891495.0,"Reddit loves to echo chamber. The same sentiment will be repeated in every post that hits the front page, giving you the illusion that everything is generalizable. ""Obviously this is the case everywhere, I see it on the front page 5+ times per day!"" Reddit has been both the most amazing thing for information (tons of varying opinions of actual people and information you can get outside of an official news source), and the worst things to happen for information (blatantly biased agenda pushing and censorship through the use of downvotes)"
interestingasfuck,fe6gcio,t1_fe6folf,1578890058.0,"You're right, the 80% is for ""pitbull-like breeds"" pitbulls themselves are at ~65.6% per dogsbite"
todayilearned,fe6f5y3,t1_fe66rmd,1578889066.0,"I think this kind of mentality is changing. A lot of Gen Xers and above seem to understand that mental health is actually a serious thing and that things like depression aren't just cured by ""being happier."" Or even that things like depression aren't really even that apparent or obvious, even for the person experiencing it."
interestingasfuck,fe6e7ut,t1_fe6blt9,1578888295.0,"I agree really. Pitbulls are completely capable of being fine, loving dogs. It's just the breed in general requires much more responsibility and care than what most people are willing/able to give.

They are extremely common in animal shelters, and a lot of people just adopt or buy them without any research on their needs and the concerns about raising them. They are high energy, they need to be entertained, and like most terriers, they have a strong prey drive. Couple this with the fact that they were literally bred to be fighting dogs and you have a breed that can definitely be a bit dangerous.

This does not mean all pitbulls are dangerous, but just that people should definitely exercise caution around an unknown pitbull. It's not irrational for people to be wary around them. And you probably shouldn't leave them alone with babies, although you really shouldn't do that for any large dog. They are animals and sometimes things happen."
WhitePeopleTwitter,fe6cie3,t1_fe6a13t,1578886959.0,"That's an often repeated mentality that is fairly aggravating to see. First off, how many police officers work alone? In my state, it's unusual for there to be more than one officer per car. How often are bad police officers showcasing bad behavior in front of other officers. How many times is the displayed behavior actually something that an officer should go and follow up on? (I.e. is the officer swearing at someone or are they actually being abusive?) How many officers actually are reported for their behavior by another officer. 

Where are all these statistics? It's hard to find them because it's not actually accounted for. That statement is using an argument backed by little to no data to prop up a claim that can't really be argued against because yet again there is little to no data.

I'm sorry, but I often see that mentality not as an honest critique of officers, but moreso a justification as for why someone *wants* to hate all police officers.

Either way, people randomly harassing police officers and lying about misconduct to abuse the recent societal issues is a terrible mentality to have and it does nothing but destroy credibility and cause further problems. In general, if you make being a police officer an unfavorable profession full of hatred and harassment, you're not going to get better police officers, you're going to get people who don't care what anyone thinks about them, or worse, people who enjoy the spite."
interestingasfuck,fe66qfn,t1_fe60azs,1578883033.0,"Statistics really don't lie. Pitbulls are responsible for 80% of fatal dog attacks on humans and depending on study, typically over 70% of dog bites requiring medical care. They are also typically seen as the cause of over 95% of fatal dog attacks on other animals.

There are other big dogs with irresponsible owners such as Rottweilers, Dobermans, German Shepherds, etc, but they don't have anywhere near the prevalence in the data. 

Anecdotal evidence doesn't save you from the data.

I myself have one of the mildest terrier breeds out there and I still paid extra attention to ensure no aggressive behavior to smaller dogs/animals. People who live in denial of the responsibility they incur by choosing these kinds of dogs are a major problem. Pits are terriers bred for aggression and fighting, do not take them lightly."
interestingasfuck,fe66904,t1_fe5zi5m,1578882721.0,"Pitbulls are responsible for something like 80% of fatal attacks on humans and the vast majority of dog attacks on humans despite not being nearly the majority of dogs...

Pitbulls are a bit different from other dogs in that you need to be even more responsible to ensure they behave. A lot of people aren't up for that task and don't know it.

Even then, there are many stories out there of Pitbulls being loving and sweet for many years and then suddenly they attack a small child or other dog.

They are just a more dangerous breed than others and honestly, we should be attempting to either stop breeding them, or attempt to change their characteristics."
WhitePeopleTwitter,fe626vl,t1_fe5s73e,1578880116.0,"It's usually not bad, but I have family members who are police officers and they haven't got a pay raise in 10 years. And from what they've said, being a police officer these days is worse than it's ever been because of the shithead evil cops out there. They love all the recording technology they use now because they get so many accusations that they can just pull up a video and audio to disprove."
changemyview,fe5r53g,t3_entcmn,1578873388.0,"I agree with your overall assessment, but disagree with the assertion that successful parents make successful kids.

While it may play a factor, I think it's much more important for the parents to instill concepts such as discipline, good work ethic, and caring for other people.

I personally went to a private high school and noticed that much of the students there were as bad if not worse than public schools. A lot of them (not essentially the majority but a significant chunk) had been given everything they've ever wanted and had no respect for other people. They never seemed to believe that they had to work for things in life. They harassed the teachers and other students all the time, and treated everything like one big joke.

When we actually graduated, about 70% went to college. Within 1 year mostly everyone had dropped out with about 20% remaining. High school, you could skate by with minimal effort and still get Bs. College slams you hard if you don't actually study and try."
dataisbeautiful,fe4kozp,t1_fe2f7iy,1578860333.0,So it's just Merge sort but with an optimization due to proven benefits of Insertion Sort on small lists.
cars,fe2ewl6,t1_fe1smf3,1578837635.0,"I feel like part of the problem is not many people see a three-prong and would actually care to look at a sign about what kind of power it is. Also, a lot of people probably don't even know what 12VDC means."
WhitePeopleTwitter,fe2ao1j,t1_fe03py8,1578836353.0,"Both are pretty bad. The coffee at Dunkin is less consistent and on average worse. Starbucks always has a burnt taste to it but it's very consistent. Dunkin makes me sad with their donuts after having grown up right next to a local donut shop.

Although in my experience, very few people go to Starbucks or Dunkin for actual Coffee. The people there always seem bewildered when I ask for a plain hot latte. Probably because the three people in front of me order an iced double chocolate caramel fudge brownie mocca supreme at 6:30 AM which is more akin to an ice cream sundae than it is coffee."
WhitePeopleTwitter,fe29wa2,t1_fe0cnpy,1578836043.0,"Knowing several people from Ohio, from what they tell me, it's definitely a commentary on Ohio."
programming,fe28t8i,t1_fe02eyc,1578835718.0,This. Anyone can write code that does something. The difference is how it's accomplished.
programming,fe28iw7,t3_eng355,1578835597.0,"Abstraction usually makes maintainability much better though. If done properly, adding additional features and changing behavior is much more safe, allowing sectioned off parts of the code to be changed rather than mess with a huge file and hope it didn't break something. Abstraction is a design trait to make your code more modular"
memes,fe08shd,t3_enfqey,1578806216.0,"Fun fact. If you're using Reddit Enhancement Suite (RES) and you type in this code, bacon flies across your screen."
pcmasterrace,fdtkhmf,t1_fdtgf55,1578718066.0,"You keep mentioning FPS as the game genre you're referring to for the ""competitiveness"" and then insinuate that you use 20+ buttons in an FPS all the time. Even Overwatch, which added abilities for the characters is not nearing 20 buttons.

Also, it's extraordinarily easy to ""remain competitive"" while using a PTT when using a standard 5 or 7 button FPS mouse.

>Do people play with their mics sitting right against the keyboard and have no ability to mute it?

Any decent mic will pick up keyboard presses, chair creeks, and much more. It's hard to filter out mechanical keyboard keypresses because their immediate volume is actually higher than a spoken word."
pcmasterrace,fdt6zyc,t1_fdt2xma,1578712744.0,"Playing games causes sounds that are annoying to people. All the times I get to hear someone, clacking away, playing games, coughing, sniffing, etc, because they don't want to use a proper PTT is why I have such a disdain for it. Also... if you can't hit a button without hitting several others you are not playing at any level of competitiveness that would impede you in using a PTT.

*I'm the kind of guy who gets pissed off at people who have no common courtesy for others."
pcmasterrace,fdsp4nz,t1_fdsonm3,1578706129.0,"Controller based games are the only time I view it as acceptable. But this is a PC gaming based subreddit and 99% of PC games are built for M+K.

You are still a dick if you don't try to adjust the threshold properly. In my discord we have special voice channels for no-PTT"
pcmasterrace,fdsoh4e,t1_fdsmpjl,1578705896.0,"You do have time. Unless you're literally the kind of person heading into a televised report tournament, and even then, those people have time.

What you lack is muscle training. I've been using a M4 PTT for many years and it's second nature at this point."
pcmasterrace,fdso1u9,t1_fdrv2xh,1578705733.0,Mouse button bound to Num5 is the best. Doesn't impede performance and Num5 is the only key on the keyboard that doesn't have a primary function (at least when num lock is off)
pcmasterrace,fdsndqv,t1_fdscyps,1578705477.0,"Exactly I'll mute you and not unmute you.

You have like 20 keys within reach. You can easily use PTT and remain competitive."
pcmasterrace,fdsmk91,t1_fdrxerv,1578705166.0,Get a typical 5 button and you can do the same
pcmasterrace,fdsmhff,t1_fdrc3aj,1578705133.0,"Exactly. Started off with a PTT vent. Moved to a PTT mumble. Now on a PTT discord. Whenever I enter a group chat without it, I immediately want to stab someone.

Dogs, creaky chairs, coughing, sneezing, people arguing, televisions, and plenty more. All resolved by just binding a PTT to your mouse..."
pcmasterrace,fdsm1n5,t1_fdrru30,1578704952.0,It doesn't work the best because you're still broadcasting your surroundings most of the time.
pcmasterrace,fdslr3h,t1_fdrkzee,1578704835.0,We'll still inevitably be annoyed by things that happen in your background.
pcmasterrace,fdslje0,t1_fdrrbe7,1578704747.0,Why the fuck do people not use push-to-talk
memes,fdsc1on,t1_fdrlaw7,1578699161.0,You are what ruins it for the rest of us
worldnews,fdqfi65,t1_fdqegll,1578665349.0,"Haha isn't that the truth. ""This would be so much easier if I made a program to do it!"" One day later, ""aha it works for my one specific use case, now to get it to do the rest!"" Then it never gets worked on or used again."
worldnews,fdqfa19,t1_fdqed0d,1578665176.0,"I guess I am only speaking of testimonies I've read  from some of the software development groups. I guess it definitely does not apply everywhere.

I had researched the work environment there prior to interviewing. And when I interviewed there, they had probably the most extreme interview process of any company I've ever seen. 3+ remote interviews with coding challenges observed by phone. Then after that they fly you out and you basically have an entire day of interviews and white board code challenges."
worldnews,fdqe7k8,t1_fdqdiw8,1578664348.0,"SanFran Bay area is a much different beast than the UK. The entire culture of silicon valley is like what I mentioned. People trying to rapidly grow a career in tech to make their fortune.

It is a great place to work though, but it requires a ridiculous level of shunning your outside work life. There is no room there for people who are not highly passionate about their work.

And yes, there are definitely plenty of companies that ask the same level of devotion without the benefits. Thats part of the reason why Google still attracts so many people. You might work like a madman, but you're rewarded for it. It's definitely not unheard of for people to be making 300-400k/yr after only 4 years."
worldnews,fdqcx1l,t1_fdqbkn4,1578663304.0,"The problem with places like Google is that they basically expect you to work 60+ hours every week and then devote your off time to thinking about work. All of their amenities are geared at keeping employees at the site longer. It's a very stressful work environment from what I gather, and there are millions lining up to take your spot so it's competitive. Average turnover there is like 2-3 years but a lot of their work opportunities are contracts. So I'm not sure they do a good job retaining people for a long time. Most people go there, get the experience and the pay, then leave for somewhere else."
news,fdow6eb,t1_fdop9nh,1578614259.0,"Uh, that would probably not go over well. Especially if their attempt to provoke a response is attacking non-Americans. The US has already shown they are willing, other countries aren't so sure yet, and it wouldn't be a good idea to help them decide in that way"
headphones,fdok1iv,t1_fdnxc35,1578606713.0,I think the best place I have near me would be like a Guitar Center...
summonerswar,fdo86na,t1_fdnzd1h,1578600569.0,"First, mobile games aren't inherently MMO games. It's not good to compare an MMO to a once-and-done game I'll give you that. But most major PC games are MMO nowadays too. Even then, the big single-player ones like GTAV have cost over a billion dollars to develop. That's much more than has been spent on Summoners War.

Second, The initial development of the server architecture is included in the initial development cost of the game. Further upgrades to the development of the architecture is handled on an as-needed basis and funded through the players causing the problem.

Third, Even then, server resources actually aren't too bad for Com2Us.

Com2Us syncs at the start of a dungeon run and at the end of a dungeon run. You don't need anything between then. You can actually disconnect in between dungeon runs to prove this.

Other than that, you need client requests for rune and monster information, but even then, much of that is likely cached locally and only verified on actions (such as upgrading/changing a rune). Overall, you're limited to about 750 monsters and a few thousand runes in total. Maybe a couple of megabytes of storage per heavy user.

And actually, the concurrent players for Summoners War actually isn't that much. There are millions of accounts sure, but concurrently playing is likely in the upper tens of thousands judging by various statistics and community event progress. 

Compare this to games like Hearthstone, or World of Warcraft, or Path of Exile, or Overwatch, or etc. In these games, every single action is verified by the server. Majority of positional changes, actions committed, all of this at a much higher pace than Summoners War. Your average FPS is calculating trajectories, positions, and events for many tens of thousands of players at 30 to 60 updates per second. (30 and 60 tick servers)

If you want to see some crazy server architecture, look at how Path of Exile does it. They often times have 100,000 concurrent players, killing tens of mobs per second per person (keeping in mind all damage calculations, model positioning, etc), dropping thousands of pieces of loot, making trades, putting stuff in banks, and much more. All of that is verified by the server. Path of Exile is a F2P game without any Pay-to-Win purchases."
summonerswar,fdnqrwc,t1_fdmrbja,1578591039.0,"Far less.

* Graphics are pitiful compared to something like Witcher 3 there's no dynamic calculations, everything is hard-coded from lighting to particle effects. 
* There's no need for an advanced game engine. This is largely home-grown.
* Physics calculations are replaced with hard-coded animations. 
* Limited actual in game content. You basically have 2 zones in the game, the island view, and the dungeon, and they just replace models to make it seem like you're doing different things.
* Simplistic combat system, it's just a turn-based dice-roll like the old JRPGs which only used that methodology because it was easy to develop. It's extraordinarily easy to expand this methodology to new content as well.

The development costs on this game are miniscule compared to something like Witcher 3 or Destiny. You can bet the big-time developers are drooling over the profit margin here.

Even Hearthstone likely has a higher development cost. Having actual dynamic graphics, physics engines, and more complicated event based systems. Not to mention far more cards to balance around. Com2Us releases ""5 monsters"" but they really just release 1, and then re-color it 5 times. They usually make only 1 different skill per element, and the other ones are just grab-bags of the existing skillset."
summonerswar,fdnpq8m,t1_fdklpmj,1578590546.0,"There are numerous ways for a game to remain F2P. P2W aspects are a sleezy one. The way Com2US explicitly builds their game around exploiting gambling addictions is the sleeziest of the sleeze. It isn't just P2W at this point, it's pay to spin a roulette wheel with a 99.9% chance of garbage and a 0.1% chance of something. If you're F2P, you can only spin the roulette wheel a small amount of times. P2P gets to spin it as much as they want provided they keep spending."
summonerswar,fdnpnbp,t1_fdkt92g,1578590507.0,"Yep, but they also put out a patch every 3 months that is bigger than the entirety of the last 5 years of patches from Com2US. My finger gets tired reading through GGG's patch notes."
