subreddit,self ID,parent ID,time,text
depression,fezxqin,t1_fezx5rz,1579463073.0,Ihope all is well with you
depression,fezlz09,t1_fezadip,1579458828.0,I am okay friend:)
PewdiepieSubmissions,fcibg6f,t3_ehcx3p,1577660110.0,He has legs??! Must be fake
depression,fc146hf,t3_effx75,1577307758.0,"I understand. Its really hard beimg around my family while thinking of my ""plan"" with a forced smile. I understand how hard this time of year can be."
depression,fbxlm6k,t1_fbxlied,1577192980.0,Thank you. I wish the best for you. Ill try my best to make them realize that i didnt get q choice in being alive and if i dont like being alive its my choice to stop.
